Remparts des Augustins, dix-huit mille trois cents Sancerre
Rue Jacques Bourlier, dix-huit, zéro zéro zéro Bourges
Allée du Souvenir, Santranges
Rue du Champ de la Plante à Soulangis
un rue Henri Beauchet
Cours Froment au numéro vingt-quatre
mille cent cinquante-sept rue du Chantre, dix-huit mille trois cents Sancerre
dix rue des Caillettes, dix-huit, cent trente, Dun-sur-Auron
six rue du Docteur Gressin, dix-huit, sept cents à Aubigny-sur-Nère
Rue des Néchassins, dix-huit mille deux cents Meillant
Chemin de la Vallée aux Geais, dix-huit, deux cent cinquante Neuilly-en-Sancerre
Rue Jacques Rimbault, Bourges
Rue de la Petite Noue à Vierzon
onze le Clos des Chaumes
Route de Brouillamnon au numéro dix-neuf
deux impasse du Petit Creusot, dix-huit mille six cents Sancoins
six cent vingt-trois route du Tertre, dix-huit, cent, Méry-sur-Cher
cinq allée de la Fontaine de Cierge, dix-huit, cent dix à Vasselay
Rue Jules Sandeau, dix-huit mille Bourges
Chemin du Passoir, dix-huit, deux cent vingt Parassy
Rue du Moulin des Forges, Saint-Amand-Montrond
Allée du Sabotier à Sury-ès-Bois
huit rue des Attelières
Route de la Bottanderie au numéro trois
vingt-quatre chemin des Champs Forts, dix-huit mille Bourges
cinquante cour du Petit Chailloux, dix-huit, zéro zéro zéro, Bourges
onze A route de Saint-Lazare, dix-huit, cent à Vierzon
Cour des Iris, dix-huit mille huit cents Étréchy
Lotissement Le Clos des Vernes, dix-huit, cent cinquante La Guerche-sur-l'Aubois
Rue Lorient Lafleur, La Chapelle-Saint-Ursin
Cour Roussel à Bourges
trois rue Jacques Martel
Rue des Pijolins au numéro dix BIS
deux route de la Madone, dix-huit mille trois cent quatre-vingts Méry-ès-Bois
quarante-neuf route de Lamotte, dix-huit, quatre cent dix, Brinon-sur-Sauldre
six grande Rue des Saules, dix-huit, cent quatre-vingt-dix à Châteauneuf-sur-Cher
Rue de L'Île du Cher, dix-huit mille cent Vierzon
Chemin du Grand Rogerin, dix-huit, deux cent vingt Azy
Route de Saint-ÉLoy de Gy, Saint-Martin-d'Auxigny
La Franchise à Corquoy
huit rue de la Chaume de Blet
Allée Jean-François de la Pérouse au numéro seize
onze route du Petit Pont, dix-huit mille trois cent vingt Cours-les-Barres
un allée Pierre Gilles de Gennes, dix-huit, cinq cent soixante-dix, La Chapelle-Saint-Ursin
six rue Paul Cannier, dix-huit, trois cents à Saint-Satur
Chemin du Val d'Arnon, dix-huit mille cent vingt Lury-sur-Arnon
Rue de Rosières, dix-huit, trois cents Feux
Rue du Savoir, La Chapelle-d'Angillon
Rue Grillot à Jouet-sur-l'Aubois
vingt-trois rue Pierre Malgras
Impasse des Huguenots au numéro sept
un rue de la Landette, dix-huit mille cinq cents Vignoux-sur-Barangeon
huit chemin du Carroir, dix-huit, huit cents, Villabon
neuf impasse de la Pyrotechnie, dix-huit, zéro zéro zéro à Bourges
Allée Charles Pathé, dix-huit mille Bourges
Rue Édith Piqf, dix-huit, zéro zéro zéro Bourges
Chemin de l'Épinière, Bourges
Rue de Miéry à Moulins-sur-Yèvre
deux impasse des Gagnons
Rue du Collège Ribaton au numéro neuf
cent six chemin du Clos du Chat, dix-huit mille deux cent trente Saint-Doulchard
onze rue du seize Juin mille neuf cent quarante, dix-huit, deux cent quarante, Léré
dix allée des Dames Blanches, dix-huit, zéro zéro zéro à Bourges
Chemin des Capiounes, dix-huit mille cinq cents Vignoux-sur-Barangeon
Rue de la Malnoue, dix-huit, sept cents Aubigny-sur-Nère
Avenue Mal Philippe Leclerc de Ha, Vierzon
Rue de la Zae du Porche à Plaimpied-Givaudins
dix-sept rue Porte Jaune
Chemin du Chézal Riffet au numéro vingt-cinq
cinq cour de la Fontaine, dix-huit mille Bourges
un passage des Marais, dix-huit, cinq cents, Marmagne
douze BIS rue des Trappières, dix-huit, trois cent quarante à Plaimpied-Givaudins
Impasse Gustave Pailloux, dix-huit mille Bourges
Rue de Véreaux, dix-huit, six cents Sancoins
Rue Camelinat, Vierzon
Allée du Champ de Saint-Jean à Saint-Doulchard
dix impasse de la Chaume à la Rolande
Rue Sophie Barrère au numéro un
vingt-quatre rue Porte Mutin, dix-huit mille deux cents Saint-Amand-Montrond
quatorze rue de la Croix Chevreux, dix-huit, deux cent dix, Coust
onze route des Sabotiers, dix-huit, trois cent quatre-vingts à Méry-ès-Bois
Ruelle du Comeau, dix-huit mille cent Vierzon
Chemin du Stade Constant Duval, dix-huit, cent Vierzon
Clos des Pruneliers, Marmagne
Rue des Verdelets à Vignoux-sur-Barangeon
onze rue de la Slovénie
Cour de la Chapelle au numéro quatre
trois rue René Courtoison, dix-huit mille Bourges
trois impasse de la Landette, dix-huit, cinq cents, Vignoux-sur-Barangeon
douze route des Perpins, dix-huit, cent dix à Vasselay
Impasse la Grande Maison, dix-huit mille cent vingt Massay
Chemin de l'Étang du Verdin, dix-huit, cent Vierzon
Rue de Chevilly, Méreau
Quai de Loire Georges Simenon à Saint-Satur
dix-sept rue de la Givry
Rue des Morins au numéro huit
seize résidence Chantaloup, dix-huit mille cinq cents Mehun-sur-Yèvre
cinq cent douze chemin de la Boulatte, dix-huit, deux cent cinquante, Neuilly-en-Sancerre
soixante et onze route du Champ Giraud, dix-huit, deux cents à Nozières
Impasse du Champ du Crioux, dix-huit mille deux cent trente Saint-Doulchard
Place Maurice Chevalier, dix-huit, deux cent quarante Léré
Rue Jack Leveque, Saint-Florent-sur-Cher
Allée Saint-Jean à Trouy
treize rue du Chambord
Rue des Craverts au numéro trois
neuf chemin Henri Planchon, dix-huit mille trois cent quatre-vingt-dix Moulins-sur-Yèvre
cinquante-trois rue Marcel Lafleur, dix-huit, quatre cents, Saint-Florent-sur-Cher
deux route de la Chaume Blanche, dix-huit, trois cent vingt à Menetou-Couture
Chemin de la Brande de l'Étang, dix-huit mille deux cents Orcenais
Chemin de la Bercetterie, dix-huit, cent Vierzon
Rue des Pérrières, Bourges
Chemin du Gouyat à Saint-Bouize
douze impasse du Cardinal Célestin Dupont
Petite Rue du Chambon au numéro six
six impasse de la Grenouille, dix-huit mille cent cinquante Cuffy
douze BIS rue Jean de Gorris, dix-huit, zéro zéro zéro, Bourges
vingt-quatre route de Vallenay, dix-huit, deux cents à Farges-Allichamps
Rue de la Boucharderie, dix-huit mille trois cent vingt Jouet-sur-l'Aubois
Route de Theillay à Neuvy, dix-huit, trois cent trente Neuvy-sur-Barangeon
Rue de Villeville Bouloise, Mornay-Berry
Rue Germaine Lebrun à Bourges
un rue d'Orthe
Rue du Château du Gravier au numéro dix-huit
vingt-huit rue Grand Clément, dix-huit mille cent Vierzon
trois chemin de la Taupinière, dix-huit, zéro zéro zéro, Bourges
deux mille neuf cents route de Savigny-en-Septaine, dix-huit, trois cent quatre-vingt-dix à Osmoy
Route de l'Anerie, dix-huit mille trois cent quatre-vingts Méry-ès-Bois
Rue de la Croix Saint-Abdon, dix-huit, huit cents Baugy
Rue des Escargots, Orval
Place Rabelais à Bourges
quatre chemin de la Charbonnière
Rue de la Petite Bijouterie au numéro deux
douze rue des Deux Cédres, dix-huit mille huit cents Étréchy
deux chemin de la Chevrière, dix-huit, deux cent soixante, Sury-ès-Bois
neuf rue de la Croix du May, dix-huit, trois cent quarante à Vorly
Chemin de la Moussere, dix-huit mille trois cent quatre-vingts Méry-ès-Bois
Allée Frédéric Auguste Bartholdi, dix-huit, zéro zéro zéro Bourges
Rue du Général Désaix, Bourges
Place de la Fontaine Saint-Hilaire à Ménétréol-sous-Sancerre
vingt et un rue Jacques Tissier
Rue de la Groseillère au numéro un
un rue des Cours, dix-huit mille quatre cents Lunery
trois BIS rue du Chem Vert, dix-huit, cent trente, Dun-sur-Auron
trente-six rue du Râpe, dix-huit, cent cinquante à La Guerche-sur-l'Aubois
Rue des Angelets, dix-huit mille huit cents Gron
Route de la Grande Sauldre, dix-huit, deux cent cinquante Neuilly-en-Sancerre
Route de la Châtre, Châteaumeillant
Rue de la Citrouille à Saint-Éloy-de-Gy
cinq rue du Docteur Pierre Roux
Rue des Fraisières au numéro huit
six rue du Village aux Rois, dix-huit mille trois cent trente Saint-Laurent
huit A route de Chabrolles, dix-huit, trois cent vingt, Beffes
deux place Louis Lacombe, dix-huit, zéro zéro zéro à Bourges
Route de Subligny, dix-huit mille deux cent quarante Sainte-Gemme-en-Sancerrois
Rue du Champ Commun, dix-huit, cent Vierzon
Chemin de la Fontaine des Rogerets, Saint-Doulchard
Rue Pelvoysin à Bourges
deux route du Noyer
Chemin du Bourniziou au numéro trois
quatre route du Bertray, dix-huit mille trois cent quarante Saint-Just
neuf route de Châtillon Village, dix-huit, quatre cents, Villeneuve-sur-Cher
dix rue des Vieilles Prisons, dix-huit, deux cents à Saint-Amand-Montrond
Résidence des Hauts de Méreau, dix-huit mille cent vingt Méreau
Rue de l'Arentage, dix-huit, cent quatre-vingt-dix Chavannes
Impasse de la Chaume d'En Bas, Chassy
Place de la Grange aux Dimes à Saint-Outrille
sept allée du Vercors
Rue Vieil Castel au numéro treize
trente-quatre rue de la Luzernière, dix-huit mille deux cents Saint-Amand-Montrond
trois rue des Magnoux, dix-huit, deux cent quatre-vingt-dix, Saint-Ambroix
vingt et un allée du Prince de Condé, dix-huit, deux cents à Saint-Amand-Montrond
Rue Charles Spencer Chaplin, dix-huit mille Bourges
Rue de Maugue, dix-huit, deux cent quarante Savigny-en-Sancerre
Impasse du Four Chaud, Bourges
Chemin des Genièvres à Corquoy
seize rue Charles Migraine
Rue de Lunerette au numéro deux
un place de la Mémoire, dix-huit mille cent Vierzon
dix ruelle du Charbon, dix-huit, sept cents, Aubigny-sur-Nère
un rue des Bourdins, dix-huit, deux cent quarante à Léré
Impasse des Trois Noirs, dix-huit mille cinq cent soixante-dix Le Subdray
Rue Porte Sainte-Anne, dix-huit, sept cents Aubigny-sur-Nère
Allée du Docteur Armand Besson, Bourges
Rue des Petits Boulats à Sury-près-Léré
cinq rue du Carroir de Velours
Rue du Bois Rollet au numéro neuf
deux rue Henri Aubrun, dix-huit mille quatre cents Saint-Florent-sur-Cher
trente et un rue du Commandant Georges Malbert, dix-huit, zéro zéro zéro, Bourges
deux impasse de la Belle Vue, dix-huit, trois cent dix à Graçay
Plantefou, dix-huit mille cinq cents Mehun-sur-Yèvre
Rue Sarah Balland, dix-huit, quatre cent dix Brinon-sur-Sauldre
Route de Gardefort, Jalognes
Route de Préveranges à Saint-Saturnin
vingt-sept rue Sainte-Solange
Rue de la Gaguerolle au numéro trois
onze chemin de Saint-Phalier, dix-huit mille trois cent dix Graçay
trente route des Fromenteaux, dix-huit, deux cents, Saint-Amand-Montrond
neuf rue de Chaumereaux, dix-huit, cent quarante à Précy
Rue de Bauvais, dix-huit mille six cents Sancoins
Route du Moulin du Sein, dix-huit, cinq cents Vignoux-sur-Barangeon
Rue Célestin Gérard, Vierzon
Route de Thenioux à Massay
un allée des Terres Rouges
Chemin Pierre Dupont au numéro six
treize impasse de la Riche, dix-huit mille trois cent quatre-vingt-dix Savigny-en-Septaine
neuf impasse du Grand Casson, dix-huit, cent vingt, Méreau
deux rue du Richefort, dix-huit, cinq cents à Mehun-sur-Yèvre
Allée du Maine, dix-huit mille Bourges
Rue du Carroux, dix-huit, huit cents Gron
Chemin de la Croix de Bué, Bué
Espace des Petits Fossés à Saint-Outrille
sept rue Johanneau
Rue du Sergent Bobillot au numéro vingt-cinq C
neuf rue du Château de Bigny, dix-huit mille cent quatre-vingt-dix Vallenay
deux rue du Dogue, dix-huit, trois cents, Sancerre
quinze rue des Grenouillats, dix-huit, quatre cents à Saint-Caprais
Allée Jules Valles, dix-huit mille trois cent quatre-vingt-dix Saint-Germain-du-Puy
Route de la Normandie, dix-huit, cinq cents Vignoux-sur-Barangeon
Rue des Tramways de l'Indre, Vierzon
Impasse des Grévées à Cours-les-Barres
cinquante-huit impasse du Pré aux Blancs
Route de la Charnivolle au numéro dix
neuf rue de l'Ancienne Halle, dix-huit mille deux cent dix Bannegon
deux ruelle Chevrier, dix-huit, cent, Vierzon
neuf route du Village aux Rois, dix-huit, cinq cents à Vignoux-sur-Barangeon
Rue de Veves, dix-huit mille trois cent quarante Arçay
Rue du Baulieu, dix-huit, quatre cents Primelles
Place Albert Boyer, Clémont
Rond-Point Jacques Cœur à Rians
cinq rue de la Résidence Condé
Route de la Croix de Pierre au numéro trente et un
huit rue de la Fosse à Caillon, dix-huit mille cent soixante Chezal-Benoît
dix-neuf allée du onze Novembre, dix-huit, deux cent trente, Saint-Doulchard
un le Clos de la Cure, dix-huit, deux cent vingt à Parassy
Place du Pavé, dix-huit mille deux cents Meillant
Rue Jean-Moulin, dix-huit, cent soixante Lignières
Route de la Groutte, Drevant
Rue de la Croix Duchet à Saint-Amand-Montrond
six cour Morogues
Chemin de Long au numéro dix
un rue de Champault, dix-huit mille deux cent quatre-vingt-dix Plou
sept rue du Moulin du Pré, dix-huit, deux cents, Meillant
dix impasse du Gué Saint-Michel, dix-huit, deux cent quatre-vingt-dix à Chârost
Impasse de la Septaine, dix-huit mille trois cent quatre-vingt-dix Savigny-en-Septaine
Route de Boulleret, dix-huit, deux cent quarante Sainte-Gemme-en-Sancerrois
Chemin de Crézay, Mareuil-sur-Arnon
Faubourg d'Avexy à Graçay
un rue de l'Aroloir
Cour Sylvain Pichonnat au numéro quatre
trois petite Rue Babeuf, dix-huit mille cent Vierzon
trois rue de la Fossé aux Halles, dix-huit, trois cent dix, Genouilly
douze rue du Colonel Filloux, dix-huit, zéro zéro zéro à Bourges
Lotissement des Violettes, dix-huit mille cinq cent soixante-dix Trouy
Rue Vieille-Saint-Ambroix, dix-huit, zéro zéro zéro Bourges
Impasse du Ruisseau au Jules, Neuilly-en-Sancerre
Route de Parassy à Soulangis
douze rue des Feuillures
Rue du Merisier au numéro un
deux impasse de la Rossignolerie, dix-huit mille trois cent vingt Beffes
treize passerelle de l'Ecluzeau, dix-huit, cent vingt, Quincy
quatorze chemin de l'Echardon, dix-huit, cent quatre-vingt-dix à Corquoy
Chemin des Charbonneaux, dix-huit mille Bourges
Chemin des Migeons, dix-huit, trois cents Sens-Beaujeu
Rue du Mauvais Pas, Sury-ès-Bois
Rue de la Chotarderie à Bannay
trente rue de la Bardonnerie
Rue Albert Popineau au numéro sept
six rue Queue de Pelle, dix-huit mille sept cents Aubigny-sur-Nère
sept lotissement Clos Saint-Jean, dix-huit, cinq cents, Mehun-sur-Yèvre
trente-quatre rue du Crétet, dix-huit, cent dix à Saint-Éloy-de-Gy
Rue Roger Pearron, dix-huit mille cent soixante Touchay
Chemin de la Croix Béthonne, dix-huit, trois cent trente Nançay
Route de Saint-Août, Lignières
Chemin de Feularde à Fussy
seize rue de la Sablée
Impasse de la Bricole au numéro un
huit rue de la Jorandière, dix-huit mille cent Saint-Georges-sur-la-Prée
trois BIS rue Porte aux Bœufs, dix-huit, cent, Vierzon
huit impasse des Lunots, dix-huit, cent à Vierzon
Route des Vignolles, dix-huit mille cent quatre-vingt-dix Serruelles
Rue Jean Picot, dix-huit, cent Vierzon
Rue des Hautes Boiries, Graçay
Impasse de la Servoiserie à Soulangis
un rue d'Afrique
Avenue Albert Dumez au numéro trois
un rue du Berthelon, dix-huit mille deux cent quarante Léré
six rue de Chappe, dix-huit, trois cents, Saint-Satur
un rue du Bourg d'Oiseaux, dix-huit, deux cent cinquante à La Chapelotte
Rue Serge Duchailloux, dix-huit mille cent cinquante La Chapelle-Hugon
Cours de la Cocarde, dix-huit, zéro zéro zéro Bourges
Rue Surrerie, Chârost
Rue Cognée à Nançay
trois impasse des Terroirs d'en Haut
Rue Paul Mus au numéro dix
quatre rue des Rieaux, dix-huit mille cent cinquante La Chapelle-Hugon
trois impasse du Grelet, dix-huit, cent, Vierzon
quinze A rue de Briande, dix-huit, trois cent vingt à Jouet-sur-l'Aubois
Rue de Charost, dix-huit mille cent vingt Lazenay
Rue Maurice Mac-Nab, dix-huit, cent Vierzon
Rue du Commandant Marcel Ray Perrin, Bourges
Chemin de Lauraine à Vasselay
douze rue du Puits Taupin
Chemin des Grands Moulins au numéro deux
neuf allée des Garences, dix-huit mille Bourges
deux impasse Soufflot, dix-huit, deux cent trente, Saint-Doulchard
dix-huit rue du Briou, dix-huit, cent vingt à Méreau
Route de Martoux, dix-huit mille cent cinquante La Guerche-sur-l'Aubois
Chemin de la Verne, dix-huit, deux cents Drevant
Ruelle du Bourbonnais, La Guerche-sur-l'Aubois
Route de la Chapelle d'Angillon à Ennordres
treize allée Honoré de Balzac
Route de Sens-Beaujeu au numéro cent dix-huit
un rue Croix Pilau, dix-huit mille cent trente Dun-sur-Auron
neuf rue Achille Laforge, dix-huit, deux cent quarante, Léré
cinq rue du Champ de Devant, dix-huit, quatre cents à Villeneuve-sur-Cher
Route de Chalivoy-Milon, dix-huit mille cent trente Bussy
Rue du Vieux Pavé, dix-huit, trois cent quatre-vingts La Chapelle-d'Angillon
Rue Yves Lacelle, Lunery
Rue de la Croix Berthet à Saint-Martin-d'Auxigny
sept allée des Landes
Rue Charles Boulle au numéro cent trente-huit
treize clos de l'Etang, dix-huit mille cent dix Saint-Georges-sur-Moulon
un rue du Puit de Saint-Loup, dix-huit, cent soixante-dix, Loye-sur-Arnon
deux rue du Chanoine Volton, dix-huit, cinq cent vingt à Bengy-sur-Craon
Rue Maurice Canon, dix-huit mille Bourges
Clos de Lizy, dix-huit, cent dix Pigny
Rue des Epousardes, Saint-Amand-Montrond
Rue Henri Jossant à Bourges
cinq cent quatre-vingt-quatre place Léon Dupuis
Rue des Marmoussets au numéro quatre
neuf chemin de la Cerusée, dix-huit mille cent dix Allogny
deux impasse de la Fertisse, dix-huit, cent quarante, Sévry
deux rue Gaston Monmousseau, dix-huit, cent à Vierzon
Chemin des Prés Martins, dix-huit mille cent vingt Chéry
Rue de Feez, dix-huit, trois cent cinquante Flavigny
Rue Patrick Dewaere, Bourges
Impasse de Larré à Villequiers
douze cour des Vicaires
Rue du Pré de Chappes au numéro dix-sept
deux rue Marcel Isidore, dix-huit mille trois cent vingt Marseilles-lès-Aubigny
un route des Loges d'En Bas, dix-huit, cinq cent vingt, Bengy-sur-Craon
six square du Chemin Vert, dix-huit, cinq cents à Mehun-sur-Yèvre
Rue Auguste Charles Moricault, dix-huit mille deux cents Saint-Amand-Montrond
Rue Bout Henry, dix-huit, huit cents Chassy
Cour Colette, Villeneuve-sur-Cher
Allée de la Prée des Veaux à Bannegon
trois les Craicas
Rue des Vallières au numéro douze BIS
cinq rue Jean-Jacques Ragon, dix-huit mille trois cent cinquante Nérondes
six chemin du Soubeau, dix-huit, cinq cent soixante-dix, Morthomiers
sept rue du Puits Noir, dix-huit, zéro zéro zéro à Bourges
Rue du Général Marius Morin, dix-huit mille deux cent quarante Léré
Rue des Pannes, dix-huit, huit cents Farges-en-Septaine
Rue de la Simonnerie, Osmery
Chemin de la Dorée à Neuilly-en-Sancerre
cinq allée des Paquerettes
Route de la Petite École au numéro douze
douze allée de la Couture, dix-huit mille deux cent trente Saint-Doulchard
un chemin des Crots Blins, dix-huit, trois cents, Ménétréol-sous-Sancerre
six chemin de Charnay, dix-huit, cent à Vierzon
Rue des Deux Sapins, dix-huit mille cent dix Pigny
Rue Paul Rivet, dix-huit, zéro zéro zéro Bourges
Rue du Fanal, Trouy
Rue Amédée Marchand à Lunery
six chemin du COlombier
Rue d'Aindling au numéro onze
quatre cent trente-trois place Saint-Père, dix-huit mille trois cents Sancerre
six rue Zulma Carraud, dix-huit, trois cent dix, Graçay
sept rue du Pavé Noir, dix-huit, trois cents à Sancerre
Impasse des Traines, dix-huit mille huit cents Villequiers
Impasse des Chailloux, dix-huit, deux cent vingt Brécy
Chemin des Villeries, Neuilly-en-Sancerre
Route de Marseilles à Précy
deux les Champs Noirs
Rue de Bitterfeld au numéro cinquante et un
douze allée de la Croix Millet, dix-huit mille deux cent trente Saint-Doulchard
un cours des Brissets, dix-huit, trois cent quarante, Arçay
cinq rue des Chapons, dix-huit, cent quatre-vingt-dix à Châteauneuf-sur-Cher
Allée de Bourg, dix-huit mille deux cent cinquante Neuilly-en-Sancerre
Le Lavoir, dix-huit, cent quatre-vingt-dix Chambon
Lotissement des Martinettes, Soye-en-Septaine
Rue de Tonnevis à Cerbois
deux rue de la Pierre de May
Chemin des Banneries au numéro un
huit rue Jean-François Champollion, dix-huit mille Bourges
dix avenue des Fédérés, dix-huit, six cents, Sancoins
deux chemin de la Chaume à Got, dix-huit, trois cents à Ménétréol-sous-Sancerre
Passerelle de la Cure, dix-huit mille cent vingt Cerbois
Clos de la Lâche, dix-huit, sept cents Aubigny-sur-Nère
Place Bois Malon, Uzay-le-Venon
Cours Fleurus à Saint-Amand-Montrond
deux impasse Jules Hannequin
Route des Bassineries au numéro vingt-deux
deux chemin de Guébaron, dix-huit mille cent quatre-vingt-dix Corquoy
trois rue Millière, dix-huit, cent, Vierzon
trois route de Souligny, dix-huit, trois cent soixante à Saint-Vitte
Le Pleuzatte, dix-huit mille quatre cent dix Clémont
Passage de la Chaume, dix-huit, zéro zéro zéro Bourges
Cour Jean-Louis Boncoeur, Bourges
Rue Marcel Gourlier à Lignières
deux place Jean-Alexandre Buchon
Rue de Dieu au numéro dix-huit
dix-neuf allée Gaston Bachelard, dix-huit mille Bourges
dix-huit allée du Pré aux Clercs, dix-huit, zéro zéro zéro, Bourges
huit impasse de la Cour d'En Bas, dix-huit, trois cent cinquante à Mornay-Berry
Chemin de Bouzy, dix-huit mille sept cents Aubigny-sur-Nère
Allée Ingres, dix-huit, deux cents Saint-Amand-Montrond
Impasse du Fanal, Trouy
Rue de l'Abbé Bourgeade à Avord
quatre route de Groises
Allée Marcel Carné au numéro sept
trente-cinq route des Rosières, dix-huit mille quatre cents Saint-Florent-sur-Cher
six allée de Bois Vert, dix-huit, quatre cents, Saint-Florent-sur-Cher
sept route de Cernoy, dix-huit, deux cent soixante à Barlieu
Rue du Champ de Foire aux Moutons, dix-huit mille trois cent trente Neuvy-sur-Barangeon
Place Gustave Vinadelle, dix-huit, cent trente Dun-sur-Auron
Rue Léon Henriet, Mareuil-sur-Arnon
Route de Luçay à Nohant-en-Graçay
neuf chemin de la Buranlure
Chemin des Galeries au numéro six
un rue des quatre Marronniers, dix-huit mille deux cent quarante Savigny-en-Sancerre
quatre chemin de la Fosse aux Moines, dix-huit, deux cents, Bruère-Allichamps
deux route de Menetreau, dix-huit, deux cent quarante à Boulleret
Rue Jean de Villages, dix-huit mille Bourges
Rue Paul Lasnier, dix-huit, sept cents Aubigny-sur-Nère
Chemin d'Acre, Châteaumeillant
Place George Sand à Bourges
neuf rue du Chétif Bout
Rue de Chaumoux au numéro treize
sept rue Louis de Gournay, dix-huit mille deux cent trente Saint-Doulchard
onze allée Guillaume Apollinaire, dix-huit, cent, Vierzon
huit rue du Moulin de Fontenay, dix-huit, trois cents à Saint-Satur
Rue du Gros Caillou, dix-huit mille cent Vierzon
Rue du Champ Potot, dix-huit, deux cent quarante Belleville-sur-Loire
Impasse de la Pie, Sainte-Montaine
Rue du Noyer d'Amour à Dun-sur-Auron
huit rue des Culées
Impasse de Boucheteau au numéro sept
six chemin de la Vallée Neuve, dix-huit mille quatre cents Saint-Florent-sur-Cher
quatre cent un chemin des Musées, dix-huit, deux cent cinquante, Neuilly-en-Sancerre
quatre impasse des Pouillots, dix-huit, sept cents à Aubigny-sur-Nère
Chemin des Conduits, dix-huit mille trois cents Saint-Satur
Rue de la Gaudinière, dix-huit, quatre cents Lunery
Impasse du Limousin, Saint-Germain-du-Puy
Rue du Quai du Cher à Châteauneuf-sur-Cher
six A route de Lere
Rue de la Charité-sur-Loire au numéro deux
huit chemin des Bouliers, dix-huit mille quatre cent dix Blancafort
cinq rue Madeleine Vouillon Sologne, dix-huit, zéro zéro zéro, Bourges
un rue des Fagotiers, dix-huit, deux cent soixante à Barlieu
Rue des Chapelles aux Plots, dix-huit mille huit cents Gron
Cours Manuel, dix-huit, deux cents Saint-Amand-Montrond
Allée Louis Lherbet, Léré
Place Agénor Bardoux à Bourges
vingt chemin de la Milleterie
Rue de Ronvaux au numéro douze
dix rue des Fertes, dix-huit mille cinq cent soixante-dix Le Subdray
dix-neuf rue de la Fontaine de la Filasse, dix-huit, trois cents, Saint-Satur
deux chemin de la Merveille, dix-huit, trois cent vingt à Menetou-Couture
Place du Baron Haussmann, dix-huit mille Bourges
Rue de la Vigne Blanche, dix-huit, deux cents Saint-Amand-Montrond
Route de Guilly, Sainte-Solange
Avenue Jean Barillet à Sancoins
huit lotissement les Tilleuls
Rue du Bois au Prêtre au numéro deux
onze place Saint-Ursin, dix-huit mille deux cent soixante-dix Culan
quatre rue de Meslon, dix-huit, deux cents, Ainay-le-Vieil
quatre route de la Gargaude, dix-huit, trois cents à Ménétréol-sous-Sancerre
Rue de Couvache, dix-huit mille cent cinquante La Guerche-sur-l'Aubois
Route de Bois Audran, dix-huit, cent Thénioux
Place Arsène Mellot, Léré
Rue Émile Burieau à Mehun-sur-Yèvre
six place de la Barre
Rue Muret au numéro six
deux rue de l'Ouche aux Grains, dix-huit mille cent dix Pigny
huit rue André Borde, dix-huit, deux cent vingt, Les Aix-d'Angillon
deux rue du Bec d'Alouette, dix-huit, huit cents à Étréchy
Allée Yvonne de Galais, dix-huit mille trois cent trente Nançay
Route Ancienne Gare, dix-huit, cent soixante La Celle-Condé
Rue de l'Islon, Foëcy
Place Béguinot aux Aix-d'Angillon
neuf rue du Chézeau
Impasse Béraud au numéro cinq
onze rue Mayet Genetry, dix-huit mille Bourges
cent quinze route des Grandes Pierres, dix-huit, deux cents, Nozières
huit rue du Docteur Villepelet, dix-huit, deux cents à Saint-Amand-Montrond
Route de l'Ecoussat, dix-huit mille trois cent soixante Saint-Vitte
Place du Gapion, dix-huit, trois cent dix Graçay
Chemin de l'Homme Malade, Annoix
Chemin de Badineau à Barlieu
sept rue du Docteur Eschbach
Rue Sainte-Aldegonde au numéro quatre
sept route de la Couturanderie, dix-huit mille trois cent trente Saint-Laurent
dix rue du Boisseau de Noix, dix-huit, cent cinquante, La Chapelle-Hugon
un ruelle du Bourg, dix-huit, trois cent dix à Nohant-en-Graçay
Route de Pont Vert, dix-huit mille cinq cents Marmagne
Le Parc, dix-huit, cent quarante Herry
Rue Raphaël Casanova, Bourges
Rue des Crots à la Cane à Bourges
dix rue des Grelats
Rue de l'Aubois au numéro mille vingt-neuf
un rue du Petit Bonhomme, dix-huit mille cent dix Fussy
trois chemin des Grandes Vallées, dix-huit, trois cent quarante, Lapan
vingt-quatre rue de Fousselot, dix-huit, trois cent cinquante à Ourouer-les-Bourdelins
Route de Jussy le Chaudrier, dix-huit mille cent quarante Précy
