Ruelle Poulain, soixante-deux, deux cent quarante Desvres
Rue de Lillebonne, Noyelles-sous-Lens
Rue de Poznam à Hersin-Coupigny
deux cent cinquante-cinq route du Fort Batard
Place André Messager au numéro cent soixante-neuf
vingt rue Auguste Lavaurs, soixante-deux mille quatre cent quarante Harnes
trois cent vingt-deux rue de Guarbecque, soixante-deux, trois cent cinquante, Saint-Venant
dix rue de Miraumont, soixante-deux, cent seize à Puisieux
Rue du Tortillard, soixante-deux mille cent soixante-dix Écuires
Rue de Canteraine, soixante-deux, cent trente Saint-Pol-sur-Ternoise
Rue Baudoin, Guînes
Boulevard de Varsovie Les Sorbiers à Béthune
dix BIS rue du Grand Croc
Rue Adrien Danvers au numéro cinquante-neuf
cent soixante-seize rue du Pont Riqueult, soixante-deux mille cent trente-six Lestrem
huit rue Jean Qhéhen, soixante-deux, cent, Calais
sept TER rue de Tihen, soixante-deux, quatre cent quatre-vingts au Portel
Avenue Laurent de Rille, soixante-deux mille cent cinquante-cinq Merlimont
Rue des Maquereaux, soixante-deux, quatre cents Locon
Rue de Brétencourt, Rivière
Rue Etienne Opigez à Avion
deux cent quatre-vingt-cinq route du Banc à Groseilles
Rue du Fort Du Rietz au numéro quarante-huit
un lotissement Cedrat, soixante-deux mille cent quarante-sept Hermies
quarante et un rue Edmond Madaré, soixante-deux, trois cent soixante, Saint-Étienne-au-Mont
vingt-cinq rue Alexandre Bovè, soixante-deux, deux cent dix à Avion
Rue Maurice Fardoux, soixante-deux mille cent quatre-vingt-seize Hesdigneul-lès-Béthune
Rue Jules Weppe, soixante-deux, six cent soixante Beuvry
Rue Pétré, Arleux-en-Gohelle
Avenue du Détroit à Fréthun
quatre-vingt-cinq rue Terbolié
Rue Bollet au numéro trois
mille sept cent sept rue Delflie, soixante-deux mille cent trente-six Lestrem
deux cent vingt-neuf rue Supervielle, soixante-deux, sept cent cinquante, Loos-en-Gohelle
quarante-six rue Émile et Léopold Lesage, soixante-deux, neuf cent quarante à Haillicourt
Rue de Nempont, soixante-deux mille cent quatre-vingts Conchil-le-Temple
Route de Wailly, soixante-deux, cent quatre-vingts Verton
Rue Jean Domagalla, Hénin-Beaumont
Rue de Busnette à Lillers
huit rue Charles Dunant
Rue Juvénal Bienaimé au numéro cent un
vingt-deux rue Durazzo, soixante-deux mille quatre cent quarante Harnes
quatorze rue Jean Jacques Bocquet, soixante-deux, huit cent soixante-dix, Buire-le-Sec
quatorze rue de la Pourchinte, soixante-deux, trois cent quatre-vingts à Elnes
Rue d'Houchin, soixante-deux mille six cent vingt Barlin
Rue de Palluel, soixante-deux, huit cent soixante Écourt-Saint-Quentin
Rue de Recourt, Saudemont
Rue Hennelle à Richebourg
neuf rue de Mercatel
Rue de Calonne au numéro mille quarante-trois
cent quatre-vingt-dix rue Profonde, soixante-deux mille cinq cent soixante-dix Helfaut
huit rue Louis Leduc, soixante-deux, cent quatre-vingt-cinq, Fréthun
onze rue du Colonel Doyen, soixante-deux, cinq cents à Saint-Omer
Chemin du Mont Pourri, soixante-deux mille cent soixante-dix Saint-Aubin
Rue de la Chapelle du Saint-Esprit, soixante-deux, cent trente Saint-Pol-sur-Ternoise
Rue André Depecker, Calais
Rue du Général Franchet d'Espèrey à Vendin-le-Vieil
quinze rue Mousseron
Rue Ernest Wéry au numéro trois cent quarante-six
trente-huit rue du Révérend Père Coppin, soixante-deux mille quatre cent quatre-vingts Le Portel
quatre rue Leveux, soixante-deux, cent, Calais
six rue de la Sensée, soixante-deux, huit cent soixante à Écourt-Saint-Quentin
Rue Louis Piérard, soixante-deux mille quatre cent vingt Billy-Montigny
Chemin des Quatre Fossés, soixante-deux, cent dix-sept Brebières
Chemin Rivenet, Vieille-Église
Résidence Kennedy à Lumbres
soixante et un rue de la Montoire
Rue de la Côté au numéro trois
deux rue A de Saint-Exupéry Gar Gcinq, soixante-deux mille cinq cents Saint-Omer
sept rue de Berck, soixante-deux, trois cent quatre-vingt-dix, Le Ponchel
soixante-huit rue Alexandre Lambert, soixante-deux, cent à Calais
Rue d'Heuringhem, soixante-deux mille cent vingt Campagne-lès-Wardrecques
Rue du Vieux Dieu, soixante-deux, six cent quatre-vingt-dix Estrée-Cauchy
Rue André Pantigny, Dourges
Rue Ansart à Liévin
trente domaine des Hauts de Saint-Josse
Rue du Patendal au numéro sept
deux cent soixante-treize rue de la Planche des Vaches, soixante-deux mille quatre cents Locon
trois rue du Général Anders, soixante-deux, quatre cent dix, Wingles
sept cent quatre-vingt-six rue Sous Jumel, soixante-deux, neuf cent quatre-vingt-dix à Beaurainville
Rue Eugène Kleinhans, soixante-deux mille quatre cent soixante Divion
Rue Arthur Fassiaux, soixante-deux, trois cents Lens
Rue Lurçat, Arras
Rue Eugène Bar à Lens
neuf rue Jean Letienne
Rue Mongy au numéro huit BIS
cinquante-deux rue Philippe Mallet, soixante-deux mille six cent dix Ardres
quatre-vingt-sept ruelle du Baudet, soixante-deux, quatre cent soixante, Diéval
un route de Mory, soixante-deux, cent vingt-huit à Écoust-Saint-Mein
Rue des sept Maisons, soixante-deux mille huit cent vingt Libercourt
Résidence des Églantines, soixante-deux, deux cent quatre-vingts Saint-Martin-Boulogne
Rue Philéas Réant, Calais
Rue de Campaliane à Parenty
cinquante-trois rue d'Orléansville
Allée Jean-Pierre Vasseur au numéro sept
deux cent trente-neuf route de Merville Pecqueur, soixante-deux mille cent vingt Aire-sur-la-Lys
huit avenue Jeannette Prin, soixante-deux, six cent quatre-vingts, Méricourt
trente-deux rue Jeanne Nicod, soixante-deux, quatre cent quatre-vingt-dix à Vitry-en-Artois
Rue Napoléon Lebacq, soixante-deux mille cent soixante Grenay
Rue Désiré Sénéchal, soixante-deux, cent quarante-neuf Annequin
Route d'Harnes, Montigny-en-Gohelle
Rue Bertrand Crouy à Saint-Léonard
cinquante-deux rue Henri Elby
Impasse Bernard Chochoy au numéro quatre
neuf rue des Masurettes, soixante-deux mille deux cent trente Outreau
dix-huit résidence des Impressionnistes, soixante-deux, trois cent quatre-vingts, Lumbres
onze rue Valentin Denoyelle, soixante-deux, cent vingt à Racquinghem
Rue du Berck, soixante-deux mille trois cent quarante Campagne-lès-Guines
Rue des Violiers, soixante-deux, six cent trente Étaples
Rue du Blancbourg, Blendecques
Rue Alphonse de Neuville à Saint-Omer
quatre rue Saint-Anatole
Chemin Bouvelet au numéro trente-neuf
quatre-vingt-cinq rue Léon Coustre, soixante-deux mille trois cent soixante-dix Saint-Folquin
deux cent dix-huit rue Le Bout des Rues, soixante-deux, six cent cinquante, Aix-en-Ergny
un BIS impasse Guy Mollet, soixante-deux, deux cent dix-neuf à Longuenesse
Rue de Drouvin, soixante-deux mille cent trente et un Vaudricourt
Impasse du Fonds d'Henneveux, soixante-deux, cent quarante-deux Colembert
Rue du Professeur Clerc, Outreau
Rue de la Tour du Renard à Outreau
vingt-trois résidence du Moulin Dieu
Rue Marcel Bodelot au numéro quarante-huit
quarante-trois rue de la Trousse Bière, soixante-deux mille cinq cents Zudausques
huit rue Bochard, soixante-deux, quatre cent quatre-vingt-dix, Izel-lès-Équerchin
vingt-huit rue d'Enquin, soixante-deux, six cent cinquante à Preures
Rue du Battez, soixante-deux mille deux cent vingt-quatre Équihen-Plage
Ruelle des Fauchelles, soixante-deux, six cent cinquante Zoteux
Rue de Courtaigne, Noyelles-sous-Lens
Rue du Haut Banc à Berck
quarante-six rue des Fosses de la Ville
Aux Quinze au numéro dix
treize rue Fergusson, soixante-deux mille cent Calais
trente-sept rue de Lozinghem, soixante-deux, cent cinquante-sept, Allouagne
neuf rue Scaer, soixante-deux, huit cent vingt à Libercourt
Rue de Carly, soixante-deux mille trois cent soixante Hesdigneul-lès-Boulogne
Rue Étienne Flament, soixante-deux, trois cents Lens
Boulevard de la Loire, Bully-les-Mines
Rue Jean Baptiste Demailly à Annay
six ruelle du Mont Levin
Rue Pierre-Joseph Bouchez au numéro quarante
seize BIS rue des cinq cent vingt-huit Déportés Juifs, soixante-deux mille trois cents Lens
quinze place du Vainquai, soixante-deux, cinq cents, Saint-Omer
quinze B rue Marcel Maniez, soixante-deux, deux cent trente-deux à Vendin-lès-Béthune
Rue Louy, soixante-deux mille cent cinquante-six Étaing
Route d'Alquines, soixante-deux, huit cent cinquante Journy
Rue des trois Mousquetaires, Liévin
Impasse Fropot à Bayenghem-lès-Seninghem
un rocade Nord
Rue Victor Mitenne au numéro soixante-dix-huit
mille cent quarante-neuf rue Louis Lengagne, soixante-deux mille trois cent soixante-dix Saint-Folquin
sept rue Constant Martin, soixante-deux, cent trente et un, Verquin
dix rue Rothschild, soixante-deux, six cents à Berck
Rue d'Haillicourt, soixante-deux mille six cent vingt Barlin
Boulevard Henri Martel, soixante-deux, deux cent dix Avion
Rue des Charitables, Béthune
Rue Auguste Biblocq à Merlimont
vingt-sept rue Charles Helle
Rue Fernand Lemercier au numéro soixante-neuf
cent un rue du Front Populaire, soixante-deux mille deux cent dix Avion
neuf cent soixante et un avenue Adolphe Leroy, soixante-deux, cent cinquante-cinq, Merlimont
vingt-cinq résidence Les Alouettes, soixante-deux, neuf cent dix à Éperlecques
Avenue Henri Puchois, soixante-deux mille huit cent quarante Laventie
Rue Saint-Bertin, soixante-deux, cinq cents Saint-Omer
Rue Zeffe, Aix-Noulette
Sentier de Lozinghem à Allouagne
dix-neuf rue Césaire Gournay
Rue de Watten au numéro vingt-trois
vingt et un rue Paul Forestier, soixante-deux mille cent soixante-quatre Audresselles
un rue de Sempy, soixante-deux, neuf cent quatre-vingt-dix, Saint-Denœux
soixante-dix-huit rue des Marolliers, soixante-deux, six cent vingt à Barlin
Rue du Verger d'Helene, soixante-deux mille deux cent dix-sept Tilloy-lès-Mofflaines
Allée Véronique, soixante-deux, sept cent quatre-vingts Cucq
Route de la Liane, Crémarest
Rue du Bottiau à Chocques
seize résidence Pierre Loti
Rue de Tateville au numéro cinquante-trois
quarante et un rue du Capitaine Dulieux, soixante-deux mille cent trente-huit Douvrin
quatre cent soixante-douze rue du Parfum des Sapins, soixante-deux, cinq cent soixante-dix, Helfaut
quarante et un résidence Les Maisons dans la Colline, soixante-deux, cent cinquante à Rebreuve-Ranchicourt
Rue Amand Montois, soixante-deux mille cinq cent cinquante Floringhem
Rue de l'Abbé Sta, soixante-deux, cent quatre-vingt-cinq Fréthun
Rue Pont Pierreux, La Capelle-lès-Boulogne
Avenue du Mont de Lozinghem à Auchel
soixante-sept rue de Dohem
Avenue du Pont des Dames au numéro cent quatre-vingt-neuf
vingt-deux ruellette, soixante-deux mille cent vingt-huit Écoust-Saint-Mein
vingt-six rue Tom Souville, soixante-deux, cent, Calais
trois cent trente-neuf avenue de la Morinie, soixante-deux, deux cent trente-deux à Annezin
Rue Achille Thumerelle, soixante-deux mille deux cent dix Avion
Rue du Profond Chemin, soixante-deux, cent dix-sept Brebières
Rue Jules Duquesnoy, Bruay-la-Buissière
Rue Gaston Chevalier à Isbergues
dix-sept avenue du Royal
Rue Dierville au numéro soixante-dix
quinze rue de Bayonne, soixante-deux mille cinq cent quarante Marles-les-Mines
deux place des FFI, soixante-deux, cent quatre-vingt-dix, Lillers
deux cent un rue Arthur Bart, soixante-deux, cent trente-sept à Coulogne
Rue de la Croix Abot, soixante-deux mille deux cent quatre-vingts Saint-Martin-Boulogne
Rue d'Ecquedecques, soixante-deux, cent quatre-vingt-dix Lillers
Rue Charles Ramond, Annay
Rue des Waranges à Fauquembergues
mille cent quatre-vingt-quinze rue Hametz-Billet
Impasse Delville au numéro deux BIS
trente-trois rue Léopold Gleizes, soixante-deux mille cent trente-huit Douvrin
seize rue Abel Bergaigne, soixante-deux, cinq cent quatre-vingts, Vimy
douze rue Pierre Pad, soixante-deux, cent soixante à Grenay
Rue Martyn, soixante-deux mille cent Calais
Rue Tantanne, soixante-deux, cent soixante-dix Beaumerie-Saint-Martin
Cité de la Briqueterie, Tatinghem
Chemin d'Ecottes à Brêmes
vingt-huit rue Albert Michel
Rue de Landacres au numéro six cent dix-huit
six cent trente rue François Jacob, soixante-deux mille huit cents Liévin
trois cent quarante-deux rue d'Hebecourt, soixante-deux, huit cent soixante-dix, Saulchoy
sept rue de Givas, soixante-deux, cinq cent soixante à Renty
Rue Achille Bodelot, soixante-deux mille quatre cent soixante Divion
Rue de Mieurles, soixante-deux, six cent cinquante Bourthes
Rue du Mont Éventé, Menneville
Rue du Bois de Baillon à Lisbourg
sept rue de Beauffort
Rue Henri Prudhomme au numéro deux
quatre-vingts rue Emile Lemaître, soixante-deux mille deux cents Boulogne-sur-Mer
sept rue des Bannois, soixante-deux, huit cent quarante, Laventie
cinq rue Batisse, soixante-deux, huit cent trente à Verlincthun
Rue Bellay, soixante-deux mille cent soixante Bully-les-Mines
Rue du Bat l'Eau, soixante-deux, trois cent dix Fruges
Quai Hazebrouck, Wimereux
Rue de Grenas à Mondicourt
un rue Ch'Cafara
Route de Vermelles au numéro trois cent soixante
cinquante rue Michel Fiquet, soixante-deux mille cent quarante Grigny
cinq rue Jules Caron, soixante-deux, trois cent quatre-vingts, Elnes
deux cent neuf rue de la Murene, soixante-deux, cent dix à Hénin-Beaumont
Impasse de Hollande, soixante-deux mille quatre cents Béthune
Rue du Mont Pouret, soixante-deux, cent quarante-cinq Enquin-les-Mines
Rue Voltaire Dhennin, Beuvry
Rue des Cossettes à Audruicq
quatre-vingt-seize rue du Lélart
Hameau des Vanneaux au numéro dix
quarante et un résidence Jules Verne, soixante-deux mille cent trente-huit Auchy-les-Mines
sept rue des Viveriaux, soixante-deux, huit cent soixante, Récourt
trois BIS hameau des Moissons, soixante-deux, deux cent dix-sept à Beaurains
Rue Joseph Dambrine, soixante-deux mille cent soixante Bully-les-Mines
Rue du Pont Loquet, soixante-deux, cent soixante-deux Vieille-Église
Rue de la Croix de Grès, Saint-Martin-au-Laërt
Route de Dalles à Lacres
soixante-huit avenue de la Fosse
Place de la Mélodie au numéro soixante-dix
seize allée Raphael, soixante-deux mille huit cents Liévin
douze route de Simencourt, soixante-deux, cent vingt-trois, Berneville
cent vingt et un rue Henry Elby, soixante-deux, six cents à Groffliers
Rue du Buqueux, soixante-deux mille deux cent vingt Carvin
Rue Pierre Puis, soixante-deux, cent Calais
Rue Noel Trannin, Arras
Avenue Raoul Briquet à Lens
vingt-quatre BIS rue Alfred Gosselin
Rue de la Croix de Grés au numéro quarante et un
trois cent trente-six avenue André Boudringhin, soixante-deux mille cent cinquante-cinq Merlimont
quarante-trois rue de Brèmes, soixante-deux, huit cent quatre-vingt-dix, Bonningues-lès-Ardres
dix-neuf rue Henri Peucelle, soixante-deux, cent treize à Labourse
Rue Pierre Legrain, soixante-deux mille huit cent quatre-vingts Vendin-le-Vieil
Impasse du Bastion Richelieu, soixante-deux, quatre cent cinquante Bapaume
Rue Lamendin, Lapugnoy
Rue de l'Abbé Vanhove à Lens
quatre chemin de la Rocque
Impasse de la Cossette au numéro deux
cent quinze résidence Le Trinquet, soixante-deux mille huit cent quarante Fleurbaix
six cent vingt rue Northout, soixante-deux, six cent dix, Autingues
deux cité Rogliano, soixante-deux, neuf cent soixante-dix à Courcelles-lès-Lens
Rue de la Gohelle, soixante-deux mille deux cent vingt-trois Sainte-Catherine
Avenue Auguste Boulanger, soixante-deux, trois cent quarante Guînes
Rue de l'Abbé Palfart, Helfaut
Rue du Rabat à Béthune
vingt avenue du Blanc Pavé
Impasse Delbrayelle au numéro huit
deux mille trente-sept grand Voie, soixante-deux mille cent trente-six Lestrem
trente-deux rue de Neufchatel, soixante-deux, huit cent trente, Samer
un résidence du Bois du Tertre, soixante-deux, trois cent dix à Fruges
Rue du Rouliot, soixante-deux mille deux cent vingt-quatre Équihen-Plage
Rue des Gradins, soixante-deux, deux cent soixante Auchel
Avenue des Jonquilles Cd deux cent vingt-neuf, Guemps
Rue de Wicquinghem à Ergny
dix-neuf rue du Fond Cailloux
Rue du Docteur Victor Ménard au numéro quarante-deux
dix-neuf rue Gressier de Lagrave, soixante-deux mille six cent trente Étaples
vingt-quatre place Antoine Blanchant, soixante-deux, trois cent vingt, Rouvroy
vingt-quatre rue Hubert Hermant, soixante-deux, cent douze à Gouy-sous-Bellonne
Rue André Macquart, soixante-deux mille trois cent vingt Rouvroy
Rue Louis Clipet, soixante-deux, cent trente-sept Coulogne
Rue de l'Obloie, Isbergues
Rue François Cerf à Noyelles-sous-Lens
quatre-vingts rue de Bleue-Maison
Rue de Macquinghen au numéro soixante-deux
dix rue Daniel Langlet, soixante-deux mille quatre cent cinquante Bapaume
un T avenue Bernard Chochoy, soixante-deux, trois cent quatre-vingts, Lumbres
quatre résidence de la Falaise, soixante-deux, deux cent vingt-quatre à Équihen-Plage
Ruelle Gâ, soixante-deux mille deux cent vingt Carvin
Rue Panetié, soixante-deux, deux cents Boulogne-sur-Mer
Rue René Lacuisine, Douvrin
Impasse du Beau Marais à Calais
cent quatre-vingt-deux chemin des Bâteaux
Rue de l'Abbiette au numéro douze
trois résidence Albert Gambart, soixante-deux mille deux cent trente Outreau
trois cent vingt rue Benoite Vincent, soixante-deux, quatre cents, Béthune
vingt-huit TER rue François Galvaire, soixante-deux, six cent soixante à Beuvry
Rue de la Cluse, soixante-deux mille neuf cent dix Éperlecques
Rue Notre-Dame des Sables, soixante-deux, six cents Berck
Impasse T, Tilques
Rue Lucien Hénon à Outreau
un rue Henriette Crombez
Rue de Monchiet au numéro six
vingt-quatre rue d'Hucqueliers, soixante-deux mille cent quarante La Loge
cinquante-quatre résidence Raymond Devos, soixante-deux, cent trente-huit, Auchy-les-Mines
cinq rue René Six, soixante-deux, six cent quarante à Montigny-en-Gohelle
Rue de Fampoux, soixante-deux mille deux cent vingt-trois Athies
Boulevard Auguste Huguet, soixante-deux, quatre cent quatre-vingts Le Portel
Rue Sacco, Lens
Rue Marie Liétard à Liévin
trois cents rue du vingt et un Mai mille neuf cent quarante
Rue de la Guyenne au numéro soixante-treize
deux cent quarante-deux rue de Wierre, soixante-deux mille huit cent trente Samer
quatre rue de Cavin, soixante-deux, cent onze, Hébuterne
cent cinquante-deux rue des Festeux, soixante-deux, sept cents à Bruay-la-Buissière
Rue de Bihucourt, soixante-deux mille cent vingt et un Gomiécourt
Rue de Delettes, soixante-deux, cent vingt-neuf Thérouanne
Rue Lucien Dupire, Ramecourt
Avenue du Chemin Des Dames à Brebières
trente-trois rue François Calonne
Route d'Aix Lot La Bigache au numéro huit
cinq rue Moyecque, soixante-deux mille deux cent cinquante Landrethun-le-Nord
deux cent douze boulevard Marcel Wacheux, soixante-deux, six cent vingt, Barlin
vingt-trois rue de la Volville, soixante-deux, cent quatre-vingt-dix-neuf à Gosnay
Rue Cayet, soixante-deux mille huit cents Liévin
Rue François Gauthier, soixante-deux, trois cents Lens
Route d'Hestrus, Hernicourt
Chemin aux Œufs à Samer
quinze rue de Quéant
Rue d'Harnes au numéro quarante-cinq
quarante-six rue Louis Dagneaux, soixante-deux mille cinq cent quarante Lozinghem
cent six chemin des Régniers, soixante-deux, deux cent trente et un, Coquelles
vingt-deux rue du Fermont, soixante-deux, cent soixante-treize à Rivière
Rue d'Annezin, soixante-deux mille quatre cents Béthune
Résidence du Bois du Rietz, soixante-deux, quatre cent soixante Divion
Chemin Chocquoy, Mont-Bernanchon
Route de Rupembert à Wimille
douze rue Marceau Lelaure
Rue Rés Les Hirsons au numéro soixante-seize
mille cent quarante et un rue du Bas Chemin Sud, soixante-deux mille quatre cents Locon
deux cent vingt-neuf rue du Calaisis, soixante-deux, trois cent soixante-dix, Audruicq
seize lotissement du Petit Bois, soixante-deux, cent soixante-dix à Beutin
Rue de la Sucrerie Gary, soixante-deux mille cent quatre-vingts Rang-du-Fliers
Boulevard d'Alprech, soixante-deux, quatre cent quatre-vingts Le Portel
Rue des Clouteries, Saint-Omer
Rue Vladislav Volkov à Calais
trente-cinq rue du Pizet
Impasse Paul Broutta au numéro trente
cinq rue du Docteur Capiaux, soixante-deux mille six cent vingt Barlin
vingt-trois rue de Bois Bernard, soixante-deux, cinq cent quatre-vingts, Arleux-en-Gohelle
six rue Jean Caron, soixante-deux, huit cents à Liévin
Rue de Cherisy, soixante-deux mille cent cinquante-six Vis-en-Artois
Route du Petit Parenty, soixante-deux, six cent cinquante Parenty
Rue de Carbout, Surques
Rue Georges Lamiot à Aubigny-en-Artois
cent dix-huit rue Germain Delebecque
Voie Communale Les Riottes Parc Residenti au numéro soixante-trois
quarante-quatre rue Edmond Debeaumont, soixante-deux mille cent soixante Bully-les-Mines
trois cent soixante-deux rue Leflon, soixante-deux, cent soixante et un, Agnez-lès-Duisans
cent quatre-vingt-sept rue de Bogota, soixante-deux, cent à Calais
Rue Henri Crammer, soixante-deux mille deux cent dix Avion
Rue du Petit Feutre, soixante-deux, zéro zéro zéro Arras
Rue Jean Decques, Achiet-le-Petit
Rue de Questage à Moulle
vingt-quatre rue La Ruscame
Rue Baudimont au numéro vingt et un
cent douze route de Peuplingues, soixante-deux mille trois cent quarante Bonningues-lès-Calais
cinquante-huit grand Chemin de Loos, soixante-deux, trois cents, Lens
trois rue Marc Buissart, soixante-deux, huit cent soixante à Écourt-Saint-Quentin
Rue du Général Botha, soixante-deux mille quatre cent soixante Divion
Rue du Prètre, soixante-deux, trois cent quatre-vingts Bléquin
Rue du Portel, Auchel
Rue d'Achiet à Ablainzevelle
trente-six rue Émile Lenglet
Avenue Jean Garaïalde au numéro cent quatre-vingt-onze
trente-trois rue du Fort de Douaumont, soixante-deux mille deux cent dix Avion
six impasse René Magritte, soixante-deux, deux cent quinze, Oye-Plage
cinq rue Saint-Gengoult, soixante-deux, cent soixante-dix à Montreuil
Rue de Camblain, soixante-deux mille six cent quatre-vingt-dix Agnières
Rue Charles Lamarre, soixante-deux, quatre cent quatre-vingts Le Portel
Rue Augustin Delots, Lens
Route de Provin à Carvin
vingt-sept rue Albert Durer
Cité Sainte-Henriette au numéro dix-sept
quatre résidence de la Hem, soixante-deux mille huit cent quatre-vingt-dix Recques-sur-Hem
deux rue du Canot, soixante-deux, cent vingt-sept, Bailleul-aux-Cornailles
vingt et un avenue Corbier, soixante-deux, cinq cent cinquante à Pernes
Rue Jeanne Thil, soixante-deux mille cent Calais
Route de Souchez, soixante-deux, cent quarante-trois Angres
Rue Charles Bollard, Campagne-lès-Hesdin
Rue du Maréchal FOCH à Rouvroy
deux rue Meissonnier
Rue E Bezeau au numéro neuf
trois cent quatre-vingt-cinq impasse Ranulphe Caron, soixante-deux mille quatre cents Béthune
cinquante-quatre rue Jehan de Terline, soixante-deux, cinq cent soixante-quinze, Blendecques
neuf rue d'Embry, soixante-deux, neuf cent quatre-vingt-dix à Saint-Denœux
Rue Monsigny, soixante-deux mille deux cent quarante Desvres
Rue Joseph Pierrin, soixante-deux, trois cent quatre-vingt-dix Auxi-le-Château
Rue Danderhall, Angres
Rue Jarzembowski à Divion
vingt-six rue de Laires
Rue de Payelleville au numéro un T
cent quatre rue du Tilloy, soixante-deux mille cent dix Hénin-Beaumont
quatre rue Ave, soixante-deux, huit cent soixante, Sauchy-Cauchy
cent trente-sept impasse Jean-Baptiste Charcot, soixante-deux, sept cent trente à Marck
Rue Louis Roseaux, soixante-deux mille cent vingt Saint-Hilaire-Cottes
Rue Camphin, soixante-deux, trois cents Éleu-dit-Leauwette
Route de Cambrai, Tilloy-lès-Mofflaines
Rue d'Herquelingue à Saint-Léonard
dix-huit rue Dorothée
Rue Edouard Quenu au numéro deux cent cinquante-trois
quatre résidence Albert Schweitzer, soixante-deux mille cinq cent quatre-vingts Vimy
soixante-dix-neuf rue de Manin, soixante-deux, huit cent dix, Beaufort-Blavincourt
deux voie des Croix, soixante-deux, cent onze à Souastre
Chemin de Quilen, soixante-deux mille six cent cinquante Herly
Chemin Departemental deux cent quarante-huit Rue Principale, soixante-deux, trois cent quarante Campagne-lès-Guines
Rue de Verquigneul, Nœux-les-Mines
Résidence les Jardins de la Fôret à La Capelle-lès-Boulogne
deux sentier du Camp Louis
Rue Augustin Legrand au numéro quarante-sept
deux impasse du Mont de Piété, soixante-deux mille Arras
trois cent un rue du Pont d'Avelettes, soixante-deux, quatre cents, Locon
vingt-sept rue du Rietz Mottu, soixante-deux, trois cent quatre-vingts à Wismes
Rue des Sablières Prolongée, soixante-deux mille quatre cents Béthune
Rue de Blendecques, soixante-deux, cinq cent soixante-dix Helfaut
Rue Léon Dégreaux, Grenay
Rue des Oies Cendrées à Beuvry
cinq rue Henri Baussard
Avenue Pierre Bolle au numéro trente-quatre
treize rue Pierre Antoine Robbe, soixante-deux mille deux cent trente et un Sangatte
six cent cinquante-six rue du Pont de Nielles, soixante-deux, cent quatre-vingt-cinq, Nielles-lès-Calais
cent vingt-quatre rue Georges Devouges, soixante-deux, deux cent dix-huit à Loison-sous-Lens
Rue de Pas, soixante-deux mille deux cent dix-sept Wailly
Rue Jean Tison, soixante-deux, cinq cent quatre-vingts Neuville-Saint-Vaast
Route de Samer, Longfossé
Résidence Les Grouettes à Delettes
seize rue de Fresnaux
Rue du Fort Gassion au numéro cinquante-quatre
treize rue Désiré Lemaire, soixante-deux mille trois cents Éleu-dit-Leauwette
dix-huit rue Raymonde Delabre, soixante-deux, quatre cent quatre-vingt-dix, Quiéry-la-Motte
vingt-trois rue Charles Bocca, soixante-deux, six cent quatre-vingts à Méricourt
Rue d'Ecourt, soixante-deux mille huit cent soixante Palluel
Rue de Pressy, soixante-deux, cinq cent cinquante Tangry
Rue de la Pierre Trouée, Étaples
Boulevard de l'Arsenal à Aire-sur-la-Lys
dix-huit rue Robertson
Rue Zéphir Bajus au numéro neuf
vingt-huit avenue Roger de Rocquigny, soixante-deux mille six cent trente Étaples
vingt-trois rue Joseph Louis de Lagrange, soixante-deux, trois cents, Lens
vingt-neuf rue Ernest Descleve, soixante-deux, deux cent trente à Outreau
Rue du Parquet Sombret, soixante-deux mille sept cent soixante-dix Auchy-lès-Hesdin
Rue des Portefaix, soixante-deux, zéro zéro zéro Dainville
Route de Guines, Pihen-lès-Guînes
Avenue des Noisetiers à Étaples
