neuf rue de la Fleur de Lys, dix-huit mille cent cinquante La Guerche-sur-l'Aubois
quarante-cinq BIS route de Marmignolles, dix-huit, cinq cents, Marmagne
un rue de Werentzhouse, dix-huit, cent dix à Vasselay
Route de Menetou-Salon, dix-huit mille cent dix Vignoux-sous-les-Aix
Allée du Beugnon, dix-huit, cent vingt Méreau
Allée des Brigamilles, Trouy
Rue Auguste Bougrat à Avord
cinq avenue de l'Étang de Pin
Rue Philippe Labbé au numéro vingt et un
huit chemin des Passerelles, dix-huit mille trois cents Vinon
seize avenue Nationale, dix-huit, trois cent quarante, Levet
cinquante-quatre rue des Pieds Blancs, dix-huit, deux cent trente à Saint-Doulchard
Impasse du Facteur, dix-huit mille huit cents Étréchy
Impasse Pierre Michot, dix-huit, deux cent trente Saint-Doulchard
Rue du Coulevra, Jussy-le-Chaudrier
Route de Saint-Igny à Villabon
six route de Méreau
Route de Sainte-Montaine au numéro trente
vingt-trois route des Aix, dix-huit mille cinq cent dix Menetou-Salon
quarante-quatre route du Canal, dix-huit, trois cents, Ménétréol-sous-Sancerre
un BIS avenue de Saint-Amand, dix-huit, cinq cent soixante-dix à Trouy
Rue du Champ des Pierres, dix-huit mille deux cent dix Coust
Place Jean-Marie Le Stanguennec, dix-huit, six cents Sancoins
Rue Jean Girard, Bourges
Petite Route de Concressault à Blancafort
dix-huit rue Vincent Détharé
Rue Ronald Charles Ostend Beazer au numéro trente-six
vingt-trois quai de Loire Hervé Mhun, dix-huit mille trois cents Saint-Satur
six ruelle de la Debine, dix-huit, trois cents, Ménétréol-sous-Sancerre
trois cent quatre-vingt-quatre route de Charenton, dix-huit, deux cent dix à Charenton-du-Cher
Rue du Champanet, dix-huit mille cent Vierzon
Route de Saint-Martin d'Auxigny, dix-huit, cent dix Allogny
Rue de la Pennerie, Ourouer-les-Bourdelins
Chemin du Grand Fromangeux à Vignoux-sous-les-Aix
six allée du Maréchal Juin
Rue Émile Martin au numéro cinquante-quatre
treize A rue du Docteur Léo Mérigot, dix-huit mille cent Vierzon
quinze rue Béraud, dix-huit, zéro zéro zéro, Bourges
quatorze impasse du Barreau Vert, dix-huit, zéro zéro zéro à Bourges
Rue Charbon, dix-huit mille trois cent trente Neuvy-sur-Barangeon
Route de Neuilly-en-Sancerre, dix-huit, trois cents Sens-Beaujeu
Impasse de Vauvert, Bourges
Chemin d'Arpheuilles à Saint-Amand-Montrond
soixante-dix-huit avenue Jean Châtelet
Avenue de Fontenay au numéro cinquante-quatre
cent trente-trois rue de Mazières, dix-huit mille Bourges
vingt-six avenue Henri Massicot, dix-huit, quatre cents, Saint-Florent-sur-Cher
vingt et un E chemin de la Belle Croix, dix-huit, cinq cents à Mehun-sur-Yèvre
Route de Reuilly, dix-huit mille cent vingt Quincy
Impasse du Champ de la Cure, dix-huit, trois cent quarante Arçay
Route de Cerbois, Lury-sur-Arnon
Rue de la Renauderie à Sancoins
deux cent vingt-sept rue de Chenevière
Place F Perrusson au numéro onze
cent soixante-dix-sept route de Puits Berteau, dix-huit mille cent Vierzon
dix-neuf rue Le Ferty, dix-huit, cent quatre-vingt-dix, Vallenay
douze chemin du Pied du Râteau, dix-huit, deux cent trente à Saint-Doulchard
Rue du Bouillet, dix-huit mille Bourges
Rue des Écoinçons, dix-huit, cinq cents Vignoux-sur-Barangeon
Rue des Blessangis, Bourges
Rue Sableuse à Brinon-sur-Sauldre
deux impasse des Bois de Marmagne
Allée Charles Meryon au numéro huit
quatre le Chêne Vert, dix-huit mille deux cent soixante-dix Culan
quatorze rue de Villatte, dix-huit, cent quarante, Herry
vingt-quatre rue Jacques Fernault, dix-huit, zéro zéro zéro à Bourges
Allée du Rang des Noyers, dix-huit mille cinq cents Mehun-sur-Yèvre
Rue Ernest Masson, dix-huit, deux cent vingt Les Aix-d'Angillon
Résidence de la Paille, Plaimpied-Givaudins
Rue Albert Hervet à Bourges
deux route de la Grange Saint-Jean
Route de Marmagne au numéro trente et un
douze avenue Ferdinand Mège, dix-huit mille quatre cents Lunery
quatre rue Jean Chaumeau, dix-huit, zéro zéro zéro, Bourges
quatre route du Boischaut, dix-huit, cent quatre-vingt-dix à Vallenay
Route de Lignières, dix-huit mille deux cents Orval
Rue Germain Baujard, dix-huit, quatre cents Saint-Florent-sur-Cher
Avenue de la Pyrotechnie, Bourges
Route de Villaine à Orval
cinq route de Culan
Rue Roland Champenier au numéro vingt-neuf
quinze route de Sancerre, dix-huit mille deux cent vingt Morogues
vingt-sept route de Gron, dix-huit, huit cents, Baugy
trente A chemin de la Giraudière, dix-huit, cent à Vierzon
Chemin du Moulin Brûlé, dix-huit mille cent dix Fussy
Route de Nevers, dix-huit, trois cent vingt Cours-les-Barres
Rue de Coulon, Graçay
Rue des Cocuas à Plou
trente-huit chemin de Licé
Impasse du Petit Dureau au numéro vingt et un
six rue Gaston Berger, dix-huit mille Bourges
douze rue des Surgis, dix-huit, cent dix, Pigny
cent soixante-dix-huit rue Louis Mallet, dix-huit, zéro zéro zéro à Bourges
Rue Raymond Rousseau, dix-huit mille cinq cents Foëcy
Rue Augustin Guignard, dix-huit, cinq cents Mehun-sur-Yèvre
Rue d'Auron, Bourges
Rue Joseph Joubert à Bourges
treize rue Eirik Labonne
Rue Montcenoux au numéro seize C
quatre-vingt-six chemin de Blet, dix-huit mille Bourges
cent quatre-vingt-neuf rue du Commandant Georges Aubrey, dix-huit, deux cents, Saint-Amand-Montrond
quatre-vingt-quinze route de Saint-Bouize, dix-huit, trois cents à Vinon
Rue de Salbris, dix-huit mille trois cent trente Nançay
Rue Lemoine, dix-huit, quatre cents Lunery
Rue des Bas Blancs, Grossouvre
Route du Corbossier à Crézancy-en-Sancerre
trois cent cinquante route de Varye
Route de Moulin Sur Yèvre au numéro vingt
quarante rue Félix Chédin, dix-huit mille Bourges
quatre cent cinq route des Forêts, dix-huit, cent dix, Saint-Martin-d'Auxigny
onze résidence de la Beurte, dix-huit, quatre cent dix à Brinon-sur-Sauldre
Rue Pauline Kergomard, dix-huit mille Bourges
Rue de Darlowo, dix-huit, deux cent trente Saint-Doulchard
Rue Ernest Mallard, Saint-Amand-Montrond
Route des Racines à Bourges
six cent vingt-quatre rue de la Croix Montbrot
Rue Gourdon de Givry au numéro onze
huit rue de la Galotte, dix-huit mille trois cent vingt Jouet-sur-l'Aubois
cinquante route de Massay, dix-huit, cent, Vierzon
cent vingt-cinq sentier de Barmont, dix-huit, cinq cents à Mehun-sur-Yèvre
Route d'Issoudun, dix-huit mille deux cent quatre-vingt-dix Mareuil-sur-Arnon
Rue Maurice Bourbon, dix-huit, cinq cent vingt Avord
Rue de Juranville, Saint-Amand-Montrond
Rue Marcel Fève à Argent-sur-Sauldre
seize A rue de la Crele
Rue des Stuarts au numéro dix-sept
six route de la Guerche sur l'Aubois, dix-huit mille six cents Sancoins
un rue de la Septaine, dix-huit, cinq cent vingt, Avord
trente rue des Bourdonnes, dix-huit, deux cent trente à Saint-Doulchard
Route des Cassons, dix-huit mille deux cents Nozières
Rue de Castelnau, dix-huit, deux cent quatre-vingt-dix Chârost
Rue du Docteur Lobligeois, Vierzon
Rue Maxime Lebrun à Saint-Doulchard
huit route du Rogerin
Chemin de l'Usage au numéro cinq
soixante-neuf rue de la Rottée, dix-huit mille Bourges
soixante-dix-sept rue de Veauce, dix-huit, deux cent trente, Saint-Doulchard
vingt-trois rue entre les Deux Villes, dix-huit, deux cents à Saint-Amand-Montrond
Route de Garigny, dix-huit mille huit cents Villequiers
Chemin des Bordeliers, dix-huit, trois cents Saint-Bouize
Route de Chaon, Brinon-sur-Sauldre
Rue Anatole à Sancoins
vingt-deux route de la Poste
Avenue Hubert Gaulier au numéro trente-sept
six résidence du Jardin, dix-huit mille cent dix Pigny
vingt route de Feux, dix-huit, trois cents, Saint-Bouize
cent quatre-vingt-quatre avenue de Dun sur Auron, dix-huit, zéro zéro zéro à Bourges
Rue Charles Brown, dix-huit mille Bourges
Rue du Petit Briou, dix-huit, cent quarante Précy
Route de Villequiers, Laverdines
Allée Alfred Sisley à Bourges
vingt et un rue Vedeau
Chemin de Gron au numéro trois
seize route des Epournaux, dix-huit mille deux cents Saint-Georges-de-Poisieux
quatre lotissement Le Clos des Voutes, dix-huit, deux cent trente, Saint-Doulchard
dix route de Jou, dix-huit, cent dix à Vasselay
Rue de Croulas, dix-huit mille cinq cents Vignoux-sur-Barangeon
Rue Henri Sallé, dix-huit, zéro zéro zéro Bourges
Route du Gravereau, Boulleret
Route de Berry-Bouy à Mehun-sur-Yèvre
trois rue Montchèvre
Impasse de Loudin au numéro quatre
cinquante-quatre rue Pierre Michot, dix-huit mille deux cent trente Saint-Doulchard
trente-huit rue de Guéret, dix-huit, deux cents, Saint-Amand-Montrond
huit route de Fontillet, dix-huit, cinq cents à Berry-Bouy
Route Principale, dix-huit mille cent quarante Précy
Place de la Tarrière, dix-huit, cinq cent soixante-dix Trouy
Route de la Celle-Condé, Lignières
Ruelle de Chenevières à Ménétréol-sous-Sancerre
dix rue du Village d'en Haut
Route de Torteron au numéro neuf mille quatorze
trente-six route de Villegenon, dix-huit mille deux cent soixante Vailly-sur-Sauldre
trente-trois route des Coulangis, dix-huit, zéro zéro zéro, Bourges
huit résidence des Goulevents, dix-huit, zéro zéro zéro à Bourges
Route de Charpeigne, dix-huit mille trois cent quatre-vingts Méry-ès-Bois
Allée Roger Pernard, dix-huit, zéro zéro zéro Bourges
Avenue de la Grange des Dimes, Aubigny-sur-Nère
Rue René Vidal à Levet
huit rue Maurice Regnard
Rue Grenouillère au numéro trente-cinq
quatre allée de la Sauldre, dix-huit mille deux cent soixante Vailly-sur-Sauldre
huit cent quarante rue des Grands Villages, dix-huit, deux cents, Saint-Amand-Montrond
quarante impasse des Caves, dix-huit, trois cent dix à Graçay
Avenue du Gravier, dix-huit mille cent cinquante La Guerche-sur-l'Aubois
Rue Théophile Lamy, dix-huit, zéro zéro zéro Bourges
Route d'Aubigny, La Chapelotte
Rue Sainte-Angélique à Bourges
dix-huit route de Saint-Amand
Rue Jean Monnet (anciennement « Ruette aux Chiens ») au numéro deux
cinquante-trois rue Émile Desforges, dix-huit mille cent Vierzon
dix-neuf route d'Avord, dix-huit, huit cents, Baugy
neuf rue des Marjolaines, dix-huit, cinq cent soixante-dix à Trouy
Route de Quincy, dix-huit mille cent vingt Lury-sur-Arnon
Route de Ménétréol-sur-Sauldre, dix-huit, trois cent quatre-vingts Ennordres
Allée du Soleil Levant, La Chapelle-Saint-Ursin
Rue de Vauvert à Bourges
deux rue de la Malfondière
Rue Annie Girardot au numéro dix
soixante-six rue Jean Baffier, dix-huit mille Bourges
quatorze route de la Charité, dix-huit, trois cent cinquante, Mornay-Berry
un allée des Averdines, dix-huit, zéro zéro zéro à Bourges
Rue du Vieux Marseilles, dix-huit mille trois cent vingt Marseilles-lès-Aubigny
Rue Jeanne Labourde, dix-huit, cent Vierzon
Impasse Jean-Baptiste Clément, Vierzon
Rue des Bonnins à Bannay
onze route de Foëcy
Route de Saint-Florent au numéro vingt-deux
vingt-quatre rue du Docteur Doubre, dix-huit mille quatre cents Saint-Florent-sur-Cher
sept résidence de Nohant, dix-huit, sept cents, Oizon
trente-huit rue des Crots, dix-huit, quatre cents à Saint-Florent-sur-Cher
Route d'Henrichemont, dix-huit mille deux cent vingt Les Aix-d'Angillon
Rue du Pré d'Eau, dix-huit, zéro zéro zéro Bourges
Rue Charles Durand, Bourges
Allée Corneille à Saint-Amand-Montrond
cent neuf avenue de la Chaussée de César
Quai Vendémiare au numéro un
dix-huit route de la Digue de l'Étang du Puits, dix-huit mille quatre cent dix Argent-sur-Sauldre
trois route de Charlay, dix-huit, cent dix, Saint-Georges-sur-Moulon
cent quinze avenue de Meillant, dix-huit, deux cents à Saint-Amand-Montrond
Route de Quantilly, dix-huit mille cent dix Vignoux-sous-les-Aix
Rue Dulcardus, dix-huit, deux cent trente Saint-Doulchard
Chemin des Picardies, Saint-Georges-sur-la-Prée
Chemin des Linaires à Drevant
un place des Quatre Piliers
Rue de la Bouillauderie au numéro un
dix-sept rue de Passe Vaisseau, dix-huit mille cinq cent soixante-dix La Chapelle-Saint-Ursin
dix-sept rue Louis Billant, dix-huit, cinq cent soixante-dix, La Chapelle-Saint-Ursin
huit rue de Parassy, dix-huit, zéro zéro zéro à Bourges
Avenue Henri Debord, dix-huit mille deux cent trente Saint-Doulchard
Rue des Usages, dix-huit, trois cent vingt Marseilles-lès-Aubigny
Chemin de Bablou, Vignoux-sur-Barangeon
Rue du Puits des Fins à Sancerre
deux cour des Dominicaines des Campagnes
Rue Sarrault au numéro cent deux
vingt et un avenue Émile Chenon, dix-huit mille trois cent soixante-dix Châteaumeillant
neuf route de Lury, dix-huit, cent vingt, Quincy
soixante rue Armand Brunet, dix-huit, cent à Vierzon
Rue de la Sente aux Loups, dix-huit mille Bourges
Rue des Arotées, dix-huit, trois cent quarante Plaimpied-Givaudins
Chemin des Rogières, Bourges
Rue Boitard à Vierzon
cinq lotissement de l'Erable deux
Rue de la Ravoie au numéro douze
cinq cent quarante-six rue des Rogerets, dix-huit mille deux cent trente Saint-Doulchard
neuf rue Edmond Laroche, dix-huit, cent cinquante, La Guerche-sur-l'Aubois
quinze rue Godin des Odonais, dix-huit, deux cents à Saint-Amand-Montrond
Rue du Val de Loire, dix-huit mille deux cent quarante Savigny-en-Sancerre
Rue de la Croulotte, dix-huit, cinq cent vingt Bengy-sur-Craon
Route de Meillant, La Celle
Chemin de Champ d'Hyver à Nançay
treize rue de Palencia
Rond-Point des Sorbiers au numéro un
deux cent soixante-cinq chemin du Bois Moreau, dix-huit mille deux cent cinquante Neuilly-en-Sancerre
soixante boulevard de Juranville, dix-huit, zéro zéro zéro, Bourges
huit rue Jean Mercier, dix-huit, zéro zéro zéro à Bourges
Route de Bellon, dix-huit mille cent Vierzon
Route de Morogues, dix-huit, deux cent vingt Parassy
Rue Jacques Germain Soufflot, Bourges
Rue Urbain Nègre à Vierzon
trente et un rue de l'Abbé Moreux
Allée des Héllébores au numéro deux
deux route de Mornay, dix-huit mille huit cents Villequiers
cent trois rue de Lazenay, dix-huit, zéro zéro zéro, Bourges
quatre rue Theodore Roosevelt, dix-huit, cent à Vierzon
Rue Gaudine, dix-huit mille Bourges
Impasse d'Artois, dix-huit, trois cent quatre-vingt-dix Saint-Germain-du-Puy
Chemin des Millards, Vierzon
Rue de la Gadonnerie à Saint-Amand-Montrond
seize voie Communale Z un de l'Aujonniere
Route de Gien au numéro quatre
neuf chemin des Grandes Crêles, dix-huit mille cent Vierzon
trente rue de la Camuze, dix-huit, cent quarante, Sancergues
quatorze place de la Sablonnière, dix-huit, cent quarante à Sancergues
Allée des Berthomières, dix-huit mille cent vingt Méreau
Allée Beaumarchais, dix-huit, trois cent quatre-vingt-dix Saint-Germain-du-Puy
Rue Norbert Thebault, Plaimpied-Givaudins
Rue de l'Île d'Or à Bourges
seize allée Zélia Duchesne
Route du Coulis au numéro vingt-quatre
neuf route des Policards, dix-huit mille cent quarante Jussy-le-Chaudrier
quarante-quatre avenue Raoul Aladenize, dix-huit, cinq cents, Mehun-sur-Yèvre
vingt-six Y rue de la Société Française, dix-huit, cent à Vierzon
Rue Veuve Pateux, dix-huit mille cent soixante Lignières
Impasse du Clos Chabot, dix-huit, cent Vierzon
Rue de la Rongere, Saint-Éloy-de-Gy
Rue Bourdaloue à Bourges
sept rue des Donneaux
Rue de la Porte Chaussée au numéro six A
neuf route de la Croix Fanhienne, dix-huit mille deux cent soixante Assigny
un rue du Fraudin, dix-huit, deux cents, La Celle
seize avenue des Prés le Roi, dix-huit, zéro zéro zéro à Bourges
Chemin des Vignes de Chappe, dix-huit mille Bourges
Rue Jacques Rétif, dix-huit, six cents Sancoins
Rue Saint-Ligori, Aubigny-sur-Nère
Rue de Sarrebourg à Bourges
dix-neuf route de Beffes
Chemin de l'Orme à Teillot au numéro sept
deux route des Hauts Boulets, dix-huit mille trois cents Jalognes
huit route des Souchènes, dix-huit, cent, Vierzon
quatre-vingt-quatre rue Paul Besse, dix-huit, cinq cents à Mehun-sur-Yèvre
Route de Fublaine, dix-huit mille cinq cents Sainte-Thorette
Route de Sainte-Solange, dix-huit, deux cent vingt Rians
Route de Nérondes, Menetou-Couture
Rue Broca à Bourges
six rue du Hameau du Carré d'As
Rue de Fontbertrange au numéro cinq
trois rue de la Marge, dix-huit mille cent dix Pigny
vingt rue du Lavoir Reigny, dix-huit, trois cents, Crézancy-en-Sancerre
trois rue de Wittelsheim, dix-huit, cent à Vierzon
Rue de la Prisse, dix-huit mille cinq cent soixante-dix La Chapelle-Saint-Ursin
Route de Jussy, dix-huit, cent quarante Saint-Léger-le-Petit
Rue de Pignoux, Bourges
Allée Raymonde Vincent à Bourges
vingt-deux allée des Rivalettes
Résidence des Chalets au numéro seize
quinze rue Charles Girouard, dix-huit mille trois cent dix Graçay
trois A avenue Henri Laudier, dix-huit, zéro zéro zéro, Bourges
quatre-vingts BIS rue Bourbonnoux, dix-huit, zéro zéro zéro à Bourges
Rue du Poirier Molet, dix-huit mille deux cent quatre-vingt-dix Civray
Route de Sadard, dix-huit, cent quatre-vingt-dix Venesmes
Impasse Champmartin, Bourges
Route du Pondy à Saint-Amand-Montrond
cinq rue Maurice Gorse
Rue de l'Hyvernin au numéro trois
quatorze rue de l'Érable, dix-huit mille cent vingt Lazenay
vingt-trois rue de la Méridienne Verte, dix-huit, cinq cent soixante-dix, La Chapelle-Saint-Ursin
soixante-neuf avenue Ernest Renan, dix-huit, zéro zéro zéro à Bourges
Impasse Vauban, dix-huit mille Bourges
Avenue des Frères Voisin, dix-huit, zéro zéro zéro Bourges
Rue de Savigny, Sury-ès-Bois
Rue de la Croix de Bois à Sancerre
quatre chemin des Crouils
Cour du Pressoir au numéro trois
dix route de Sailly, dix-huit mille cent vingt Massay
soixante et un rue des Longueraies, dix-huit, cent, Vierzon
seize rue du Grand Bel Air, dix-huit, huit cents à Farges-en-Septaine
Rue de la Patrie, dix-huit mille deux cent quarante Léré
Rue de la Grange aux Dimes, dix-huit, cent vingt Cerbois
Résidence de la Forêt, Vierzon
Rue de la Tantinerie à Civray
six rue Claude Boussac
Avenue de Châteauroux au numéro cent deux
trois chemin de la Fauconnière, dix-huit mille deux cent vingt Brécy
quatre-vingt-quatre route de la Lœuf, dix-huit, cent, Vierzon
cinquante-cinq chemin Caraquis, dix-huit, zéro zéro zéro à Bourges
Allée de Bois Meillet, dix-huit mille cent dix Vasselay
Route du Vieux Domaine, dix-huit, cent Vierzon
Rue Jules de la Bully, Clémont
Allée de la Ruette à Trouy
dix-neuf rue des Chambellans
Résidence des Roseaux au numéro trois
quarante-sept rue Guillon, dix-huit mille deux cents Saint-Amand-Montrond
trois allée de la Borne, dix-huit, deux cent trente, Saint-Doulchard
trente-deux rue Koszalin, dix-huit, zéro zéro zéro à Bourges
Rue de l'École Maternelle, dix-huit mille trois cent dix Graçay
Impasse des Petites Chaumes, dix-huit, cent dix Saint-Éloy-de-Gy
Rue de la Vallée d'Yevre, Marmagne
Rue du Grand Meaulnes à Bourges
quarante-neuf rue Pierre Juglar
Rue des Margotteries au numéro soixante-trois
mille six cent quatre-vingts chemin du Grand Tertre, dix-huit mille deux cents Drevant
trente-neuf rue France Bloch-Sérazin, dix-huit, cent, Vierzon
quatre route d'Aubigny-sur-Nère, dix-huit, quatre cent dix à Blancafort
Rue du Gué Jeanin, dix-huit mille deux cent dix Charenton-du-Cher
Rue de la Gaucherie, dix-huit, cent Vierzon
Rue Étienne François Sallé de Chou, Moulins-sur-Yèvre
Chemin des Goulevents à Bourges
quinze route d'Allichamps
Rue Armand Bisson au numéro dix-sept
cent quatre rue Étienne Marcel, dix-huit mille cent Vierzon
trois rue d'Alléant, dix-huit, huit cents, Baugy
dix-huit rue de la Vigne Reinche, dix-huit, huit cents à Gron
Rue de la Gare Économique, dix-huit mille deux cents Saint-Amand-Montrond
Rue du Crot Loison, dix-huit, trois cents Ménétréol-sous-Sancerre
Rue du Champ Grillau, Cuffy
Rue Camille Mérault à Mehun-sur-Yèvre
trente chemin de Marigny
Route du Châtelet au numéro quarante-cinq
dix-sept rue Charles sept, dix-huit mille quatre cents Saint-Caprais
un rue des Cros, dix-huit, cent trente, Dun-sur-Auron
trente-cinq C impasse Gay Lussac, dix-huit, zéro zéro zéro à Bourges
Chemin des Maluettes, dix-huit mille Bourges
Route de Châteauroux, dix-huit, cent soixante Lignières
Route de Plancheton, Méry-ès-Bois
Rue René Perreau à Saint-Caprais
six rue du Bas Bourg
Rue Émile Pezard au numéro un
six cent vingt-neuf rue des Trois Piliers, dix-huit mille trois cents Sancerre
treize route de l'Orme Enseigne, dix-huit, deux cent vingt, Soulangis
six rue Michel de Bourges, dix-huit, zéro zéro zéro à Bourges
Route du Bois Bourbon, dix-huit mille deux cent vingt Azy
Chemin des Crias, dix-huit, cinq cent soixante-dix Morthomiers
Route de Vierzon, Neuvy-sur-Barangeon
Hameau du Bois d'Argent à Saint-Florent-sur-Cher
quatre route de Sainte-Thorette
Allée Vassily Kandinsky au numéro huit
deux lotissement du Champ Madame, dix-huit mille trois cent quatre-vingts Ivoy-le-Pré
quinze rue du Champ Grelet, dix-huit, deux cents, Bouzais
dix rue Henri Mealares, dix-huit, quatre cents à Saint-Florent-sur-Cher
Rue Charlet, dix-huit mille Bourges
Rue Étienne Nivet, dix-huit, cent Vierzon
Rue des Verdins, Saint-Doulchard
Rue Docteur Schweitzer à Saint-Germain-du-Puy
trente-neuf rue Gambon
Rue Paul Ladevèze au numéro six
onze rue Alphonse Pradat, dix-huit mille cent Vierzon
sept rue du Grand Voisy, dix-huit, trois cents, Veaugues
six rue du Premier Régiment d'Artillerie, dix-huit, zéro zéro zéro à Bourges
Avenue Eugène Brisson, dix-huit mille Bourges
Rue de l'Abricot, dix-huit, cent Vierzon
Rue des Prés Rabots, Lignières
Rue du Cardinal Dupont à Bourges
trois route Traversière
Rue Raymond Chassagne au numéro dix-sept
quinze avenue du Val d'Or, dix-huit mille deux cents Orval
cent quatre-vingt-quatorze route du Vieux Vignoux, dix-huit, cinq cents, Vignoux-sur-Barangeon
treize chemin des Maisons Rouges, dix-huit, zéro zéro zéro à Bourges
Rue de la Pertuisane, dix-huit mille cinq cent soixante-dix Trouy
Rue Henri Boulard, dix-huit, cinq cents Mehun-sur-Yèvre
Rue Cornière, Saint-Amand-Montrond
Boulevard Lahitolle à Bourges
dix-sept rue des Petites Vallées
Rue de Château-Gaillard au numéro douze
deux rue de Sainte-Laurette, dix-huit mille cent soixante-dix Le Châtelet
trois rue Béthune Charost, dix-huit, deux cent quatre-vingt-dix, Chârost
huit petite Rue des Longueraies, dix-huit, cent à Vierzon
Petite Rue Nationale, dix-huit mille trois cent cinquante Nérondes
Allée de Madrolle, dix-huit, cent vingt Méreau
Rue Alexandre Calder, Bourges
Route des Aleux à Arpheuilles
trente-cinq route de Pigny
Square Jacques Duclos au numéro vingt et un
vingt-quatre chemin des Grandes Noues Fontaines, dix-huit mille cent Vierzon
soixante route de Méry-ès-Bois, dix-huit, zéro zéro zéro, Bourges
quarante-quatre rue Bertie Albrecht, dix-huit, cent à Vierzon
Rue du Génada, dix-huit mille cent quatre-vingt-dix Châteauneuf-sur-Cher
Allée Jean-Baptiste Delambre, dix-huit, cinq cent soixante-dix La Chapelle-Saint-Ursin
Rue du Maréchal Franchet d'Espérey, Bourges
Rue de la Chaume à Got à Ménétréol-sous-Sancerre
trente-quatre rue Gaston Guillemin
Rue du Château Marin au numéro six
trente-sept route du Sale, dix-huit mille deux cents Arpheuilles
trois allée de la Boulaise, dix-huit, cent cinquante, Cuffy
quatre route du Chaumont, dix-huit, trois cent cinquante à Blet
Route d'Osmoy, dix-huit mille trois cent quatre-vingt-dix Moulins-sur-Yèvre
Allée du Vieux Moulin, dix-huit, deux cent trente Saint-Doulchard
Rue de la Marivol, Pigny
Rue de la Croupe à Massay
vingt rue Catherine d'Entragues
Rue de la Carolerie au numéro trois
quatre rue Bascoulard, dix-huit mille deux cent quatre-vingt-dix Civray
un chemin de Lunerette, dix-huit, quatre cents, Lunery
huit chemin de Bussière, dix-huit, trois cent soixante à Saint-Vitte
Rue Jeanne Dieulafoy, dix-huit mille Bourges
Rue André Guillemain, dix-huit, cent Vierzon
Rue du Parc Hugues Lapaire, Sancoins
Rue Van Craeynest à Vierzon
sept rue du Moulon
Rue Antonin Léraut au numéro vingt-cinq
cent dix-huit allée des Ânes, dix-huit mille trois cent dix Graçay
quarante-six rue Raymond Jacquet La Chaise, dix-huit, quatre cents, Saint-Florent-sur-Cher
cent soixante-trois rue André Brému, dix-huit, cinq cents à Mehun-sur-Yèvre
Boulevard Revenaz, dix-huit mille cent cinquante La Guerche-sur-l'Aubois
Rue du Docteur Zamenhof, dix-huit, zéro zéro zéro Bourges
Route du Val de Loire, Cours-les-Barres
Rue de Fay à Vierzon
dix-sept route de Saint-Amand Montrond
Route de Champlong au numéro un
soixante-seize rue Gustave Flourens, dix-huit mille cent Vierzon
douze impasse des Rabuteaux, dix-huit, cent vingt, Méreau
quatre rue de Grandfond, dix-huit, cinq cent soixante-dix à Trouy
Rue des Renardats, dix-huit mille deux cents Saint-Amand-Montrond
Rue de la Bidauderie, dix-huit, cent Vierzon
Chemin des Mardelles, Belleville-sur-Loire
Boulevard de la Nation à Vierzon
cinq cent seize rue des Coins de l'Enfer
Rue des Barangers au numéro trente-quatre
quatre les Ardillats, dix-huit mille quatre cent dix Clémont
trois hameau Saint-François, dix-huit, trois cent quarante, Senneçay
vingt-trois allée de l'Ancienne Gare, dix-huit, deux cent trente à Saint-Doulchard
Route des Chamignons, dix-huit mille cent quarante Jussy-le-Chaudrier
Rue Agnès Sorel, dix-huit, cinq cents Mehun-sur-Yèvre
Rue de Saint-Outrille, Bourges
Rue Baclée à Saint-Amand-Montrond
quinze rue du Petit Voisy
Rue du Clos du Chat au numéro trente-neuf
sept rue Zoé Berger, dix-huit mille trois cent soixante-dix Châteaumeillant
onze route des Tours, dix-huit, cent vingt, Lury-sur-Arnon
sept route des Cocqs, dix-huit, cent cinquante à La Chapelle-Hugon
Rue de Faubourg, dix-huit mille deux cent soixante-dix Culan
Rue du Bois Desséché, dix-huit, zéro zéro zéro Bourges
Square Henriette Dumun, Vierzon
Rue Gustave Tery à Bourges
quatre route de Fourchambault
Rue Marguerite Audoux au numéro un
vingt-trois A route de Farges-en-Septaine, dix-huit mille trois cent quatre-vingt-dix Savigny-en-Septaine
dix-huit chemin Tortu, dix-huit, zéro zéro zéro, Bourges
soixante-dix-sept rue André Ribaud, dix-huit, cent à Vierzon
Chemin de Villeret, dix-huit mille trois cents Vinon
