soixante-cinq avenue de Douvres, soixante-deux mille cent cinquante-cinq Merlimont
neuf rue Betterots, soixante-deux, cent quarante-neuf, Givenchy-lès-la-Bassée
huit rue de l'Estade, soixante-deux, six cent dix à Nielles-lès-Ardres
Rue Le Clos Planche Tournoire, soixante-deux mille trois cent quarante Hames-Boucres
Rue Julien Hermant, soixante-deux, six cent quatre-vingt-dix Aubigny-en-Artois
Chemin de Chiconet, Sallaumines
Rue du Mont Rôti à Preures
soixante-douze rue de Thérouanne
Rue des Coltineurs au numéro deux
cinquante-sept quai du Commerce, soixante-deux mille cent Calais
six cent quarante rue de la Jandrie, soixante-deux, deux cent trente-deux, Hinges
treize résidence du Clair Marais, soixante-deux, trois cent soixante-dix à Saint-Folquin
Chemin d'Aire Hameau de Bucamps, soixante-deux mille trois cent dix Azincourt
Rue André Mancey, soixante-deux, quatre cent soixante-dix Calonne-Ricouart
Rue d'Ervillers, Mory
Rue de Waben à Verton
vingt et un rue de Beaume
Rue Saint-Winocq au numéro cent dix-neuf
dix-huit rue d'Aumerval, soixante-deux mille cinq cent cinquante Floringhem
vingt et un rue de Noeux, soixante-deux, cent treize, Sailly-Labourse
cinquante-quatre rue Hector Laloux, soixante-deux, trois cents à Lens
Boulevard Fosse deux, soixante-deux mille trois cent vingt Rouvroy
Rue du Carloy, soixante-deux, cent soixante et un Duisans
Rue de Dippendal, Bouquehault
Chemin du Puits Bérault à Wailly-Beaucamp
dix chemin du Beauregard
Chemin de Manneret au numéro dix
deux cent vingt-trois rue Ignace Humblot, soixante-deux mille cent trente-huit Auchy-les-Mines
onze rue Charles Demuynck, soixante-deux, trois cent vingt, Rouvroy
dix-sept rue du Bonnier, soixante-deux, deux cent dix à Avion
Rue Léon Pinart, soixante-deux mille deux cent cinquante Marquise
Rue Gabriel Pollet, soixante-deux, neuf cent soixante-dix Courcelles-lès-Lens
Rue de Bus, Bertincourt
Rue de Pont à Vendin à Noyelles-sous-Lens
douze rue des Revers
Rue de Dourges au numéro quatre cent quatre-vingt-douze
quatorze rue de Louez, soixante-deux mille cent soixante et un Marœuil
trente-deux rue Samuel Goulet, soixante-deux, cinq cent quatre-vingt-dix, Oignies
six rue de Bacqueville, soixante-deux, deux cent vingt et un à Noyelles-sous-Lens
Rue Dubrulle, soixante-deux mille huit cent soixante-dix Douriez
Rue Victor Decriem, soixante-deux, trois cent trente Isbergues
Route de Méricourt, Rouvroy
Rue Augustin Lefebvre à Labourse
vingt-deux rue d'Annay
Rue Rice Oxley au numéro treize
quinze voie de l'Iseran, soixante-deux mille deux cent dix-sept Beaurains
un rue de l'Ascenseur, soixante-deux, cinq cent dix, Arques
quinze rue Soubitez, soixante-deux, six cents à Berck
Rue Mayeux, soixante-deux mille trois cents Lens
Rue de l'As de Licques, soixante-deux, trois cent quatre-vingts Bouvelinghem
Route de Mentque, Nort-Leulinghem
Rue Maistre à Vendin-le-Vieil
quarante-sept rue Edmond Mille
Rue de Grosville au numéro soixante-douze
trois cent trente boulevard Victor Poulain, soixante-deux mille sept cent quatre-vingts Cucq
quatorze rue de Witrepin, soixante-deux, six cent trente, Frencq
huit rue Achille Hibon, soixante-deux, cinq cent quarante à Lozinghem
Rue de Trézennes, soixante-deux mille cent vingt Aire-sur-la-Lys
Rue Henry Sainsard, soixante-deux, cent trente-sept Coulogne
Rue de Campagne, Bourthes
Allée Leo Delibes à Outreau
huit rue de Guestreville
Rue Édith Mary Garner au numéro cinq
onze rue de l'Ancien Moulin Beaussaut, soixante-deux mille six cents Berck
un résidence Les Chardonnerets, soixante-deux, huit cent quarante, Fleurbaix
dix-sept rue Boussingault, soixante-deux, deux cent dix à Avion
Rue de Matringhem, soixante-deux mille trois cent dix Hézecques
Rue Joseph Mattéi, soixante-deux, huit cent quatre-vingts Annay
Place Dalton, Boulogne-sur-Mer
Rue Guillaume Cliton à Saint-Omer
neuf place du Marché aux Chevaux
Centre Radio Alprech au numéro trois
six rue du Trou à la Marne, soixante-deux mille cent cinquante-sept Allouagne
trente-six route de La Bassée, soixante-deux, trois cents, Lens
dix-huit rue Jussieu, soixante-deux, zéro zéro zéro à Arras
Route d'Hénin-Liétard, soixante-deux mille cent dix-neuf Dourges
Route de Rebergues, soixante-deux, huit cent cinquante Surques
Rue de la Géharie, Houdain
Rue de l'Église Saint-Maurice à Isbergues
onze rue des Anciens d'Afrique Nord
Rue du Capitaine Maire au numéro quarante-huit
quinze rue du Crinchon, soixante-deux mille cent vingt-trois Bailleulmont
deux rue du Rietz, soixante-deux, neuf cent soixante, Bomy
onze rue de Vaulx, soixante-deux, sept cent soixante-dix à Béalencourt
Résidence de la Brasserie, soixante-deux mille neuf cent cinquante Noyelles-Godault
Rue Terlines, soixante-deux, trois cents Éleu-dit-Leauwette
Rue de Tortequenne, Noyelles-sous-Bellonne
Chemin du Troisième Banc à Guînes
cent quatre-vingt-un allée des Pilets
Rue du Parc des Anglais au numéro douze
soixante-sept rue de la Buqueuse, soixante-deux mille cent cinquante-deux Neufchâtel-Hardelot
deux cent dix-neuf rue de Fresnicourt, soixante-deux, six cent vingt, Barlin
cent quarante-quatre rue de Carency, soixante-deux, quatre cents à Béthune
Rue de Marquise, soixante-deux mille cent trente-deux Hardinghen
Rue Miseron, soixante-deux, cent vingt-huit Saint-Léger
Rue du Bois des Sapins, Rang-du-Fliers
Résidence Marignane à Vermelles
cinq cent sept rue Paul Descamps
Chemin de Régniers au numéro quatre-vingt-cinq
huit E rue Marcel Lancino, soixante-deux mille cent cinquante-trois Ablain-Saint-Nazaire
six rue Ernest Lejeune, soixante-deux, cent, Calais
vingt rue d'Incourt, soixante-deux, sept cent soixante-dix à Éclimeux
Avenue de Merlimont, soixante-deux mille cent soixante-dix Saint-Josse
Rue Édouard Bollaert, soixante-deux, trois cents Lens
Résidence Les Verts Paturages, Tatinghem
Rue de Cantraine à Lillers
cinq place d'Ipswich
Résidence du Bois du Soil au numéro cinq
seize impasse Champailler, soixante-deux mille cent Calais
dix-sept rue du Valtencheux, soixante-deux, cinq cent soixante, Renty
sept rue de Grevillers, soixante-deux, quatre cent cinquante à Ligny-Thilloy
Rue du Wicquet, soixante-deux mille deux cent quatre-vingt-dix Nœux-les-Mines
Rue William Willard, soixante-deux, huit cent quatre-vingts Pont-à-Vendin
Avenue François un er, Neufchâtel-Hardelot
Résidence Saint-Just à Sallaumines
trois cent cinquante-quatre rue du Volga
Rue de Wissant au numéro quarante-quatre
dix-huit impasse Neuve, soixante-deux mille cinq cent quatre-vingts Neuville-Saint-Vaast
trois cent soixante-trois route de Merlimont, soixante-deux, cent quatre-vingts, Rang-du-Fliers
quatorze chemin de Lens, soixante-deux, quatre cent dix à Wingles
Résidence Papillon, soixante-deux mille trois cent quatre-vingt-dix Auxi-le-Château
Rue le Sergeant, soixante-deux, cent soixante-quinze Hendecourt-lès-Ransart
Rue May, Houlle
Rue de Liencourt à Grand-Rullecourt
quatre rue Bocquet Flochel
Rue du Fol Penser au numéro onze
cent trois rue Auguste Delattre, soixante-deux mille quatre cent soixante-dix Calonne-Ricouart
dix-sept rue Henri Poitou, soixante-deux, cent soixante et un, Duisans
deux rue d'Arras Prolongee, soixante-deux, cent cinquante-trois à Ablain-Saint-Nazaire
Résidence Domaine du Grand Pré, soixante-deux mille cent cinquante-trois Souchez
Rue Edouard Plachez, soixante-deux, deux cent vingt Carvin
Rue de Maisnil, Teneur
Rue de Romanche à Bruay-la-Buissière
vingt et un place Louis Delannoy
Rue Marsy au numéro neuf cent cinq
onze rue d'Izel, soixante-deux mille huit cent dix Givenchy-le-Noble
quatre BIS place André Mancey, soixante-deux, deux cent soixante, Auchel
quatorze rue Frédéric Degeorge, soixante-deux, zéro zéro zéro à Arras
Impasse du Choquel, soixante-deux mille trois cent soixante Condette
Rue de Wathieumetz, soixante-deux, cent trente Saint-Pol-sur-Ternoise
Rue Coquel, Bruay-la-Buissière
Place de Dalles à Lacres
trente-quatre boulevard Louis Lesage
Rue du Chanoine Pillons au numéro soixante-quatre
cinq rue Emilienne Moreau, soixante-deux mille sept cents Bruay-la-Buissière
deux cent soixante-neuf rue Montpencher, soixante-deux, cent dix, Hénin-Beaumont
cent treize rue de Katowice, soixante-deux, quatre cent soixante-dix à Calonne-Ricouart
Rue du Pont Maudit, soixante-deux mille quatre cent quarante Harnes
Rue de Saulchoy, soixante-deux, huit cent soixante-dix Douriez
Rue Joseph Fontaine, Hénin-Beaumont
Avenue Percier et Fontaine à Boulogne-sur-Mer
cinquante-deux rue des Trois Hameaux
Rue Dutertre au numéro onze
huit mille trente-six rue Georges Auphelle, soixante-deux mille Arras
six cent trois boulevard du Maréchal Gallieni, soixante-deux, cent dix, Hénin-Beaumont
seize cité des Travailleurs, soixante-deux, deux cent vingt à Carvin
Rue Alfred Delcluze, soixante-deux mille cent Calais
Quai Lucien Lheureux, soixante-deux, cent Calais
Rue du Bas Haut Mont, Alembon
Allée de l'Escarbille à Avion
un rue d'Haplincourt
Rue Accary au numéro cent soixante-douze
cinquante avenue des Marlières, soixante-deux mille huit cent vingt Libercourt
neuf rue de Roquetoire, soixante-deux, cent vingt, Wittes
cent trente-quatre rue Francia, soixante-deux, cent à Calais
Rue du Noir-Cornet, soixante-deux mille cinq cents Saint-Martin-au-Laërt
Rue de la Palmeraie, soixante-deux, deux cent vingt Carvin
Rue André Corrion, Sallaumines
Avenue Henri Mory à Samer
dix-sept rue Gilbert Bavay
Rue Basse des Tintelleries au numéro sept
quinze rue de Cambligneul, soixante-deux mille six cent quatre-vingt-dix Aubigny-en-Artois
soixante-quatorze rue de l'Abbé Coppin, soixante-deux, deux cent vingt-quatre, Équihen-Plage
quatre cité des Ateliers, soixante-deux, huit cent vingt à Libercourt
Chemin de La Bassée, soixante-deux mille six cent soixante-dix Mazingarbe
Rue d'Aix en Issart, soixante-deux, neuf cent quatre-vingt-dix Saint-Denœux
Rue Pigault Lebrun, Calais
Route de Berck à Rang-du-Fliers
six rue d'Hardelot
Rue Charles Marlard au numéro soixante
cinquante-quatre rue du Bourdonnais, soixante-deux mille trois cents Lens
quinze rue de la Pisciculture, soixante-deux, cent quarante, Cavron-Saint-Martin
quatre-vingt-sept rue Moussy, soixante-deux, deux cent quatre-vingt-dix à Nœux-les-Mines
Rue Uriane Sorriaux, soixante-deux mille quatre cent dix Wingles
Rue Robert Aylé, soixante-deux, cent dix Hénin-Beaumont
Rue Marius Chambon, Berck
Rue Saint-Josse à Berck
douze rue François Lambert
Rue Marceau Gloriant au numéro soixante et un
un rue Bois Blancs, soixante-deux mille neuf cent soixante Febvin-Palfart
quatre-vingt-quatorze chemin du Royon Pierre Jacques, soixante-deux, six cents, Groffliers
trente-quatre rue Ludovic Boutleux, soixante-deux, quatre cents à Béthune
Le Grand Enclos, soixante-deux mille cent quatre-vingt-dix Auchy-au-Bois
Grande Rue du Petit Courgain, soixante-deux, cent Calais
Rue du Beau Marais, Calais
Avenue de la Fosse quatre à Sallaumines
treize rue Sévelingue
Rue Monseigneur Rappe au numéro cent dix-neuf
vingt-deux rue Fernand Degrugillier, soixante-deux mille deux cent soixante Auchel
cent neuf avenue du Docteur Croquelois, soixante-deux, trois cent soixante, Saint-Léonard
quatorze rue Plumecocq, soixante-deux, trois cents à Lens
Rue d'Anvin, soixante-deux mille quatre cent soixante-dix Calonne-Ricouart
Rue de Calvi, soixante-deux, six cent quarante Montigny-en-Gohelle
Rue Edmond Hedouin, Boulogne-sur-Mer
Voie des Bleuets à Pas-en-Artois
cinquante-deux rue des Trois Marquets
Rue de la Croix Marmuse au numéro dix-neuf
mille huit cent quarante-sept rue de Busnes, soixante-deux mille trois cent cinquante Saint-Venant
quatre-vingt-un rue Fernand Taverne, soixante-deux, six cent quatre-vingts, Méricourt
cinquante-huit rue des Brûlots, soixante-deux, huit cent quarante à Lorgies
Rue du Docteur Calvé, soixante-deux mille six cents Berck
Rue Leleu, soixante-deux, huit cent quatre-vingts Pont-à-Vendin
Rue des Hemmes, Oye-Plage
Rue de Leulingue à Hames-Boucres
seize rue Fourcroy
Rue Paul Guerre au numéro vingt
dix-sept rue Paul Baudin, soixante-deux mille neuf cent soixante-dix Courcelles-lès-Lens
vingt-deux rue du Cronquelet, soixante-deux, cent soixante-dix, Attin
onze rue de Saint-Josse, soixante-deux, cent cinquante-cinq à Merlimont
Rue des Diablotins, soixante-deux mille six cents Berck
Avenue du Groënland, soixante-deux, trois cent trente Isbergues
Rue Marcel Duquesnoy, Harnes
Quai du Haut Pont à Saint-Omer
deux cent trente et un rue Mithridate
Rue Dognin au numéro vingt-quatre
treize rue Adolphe Caron, soixante-deux mille cent soixante et un Étrun
soixante et onze rue Cyprien Quinet, soixante-deux, huit cent vingt, Libercourt
onze résidence de l'Artois, soixante-deux, huit cents à Liévin
Raquette du Pré Fleuri, soixante-deux mille neuf cent quatre-vingt-dix Contes
Rue Gilbert Regnault, soixante-deux, cent vingt-six Wimille
Les Mouettes, Oye-Plage
Rue Adolphe Delegorgue à Courcelles-lès-Lens
quatre-vingt-cinq rue Carnel
Rue Brocquoise au numéro vingt-neuf
huit ferme du Brandveld, soixante-deux mille cinq cents Clairmarais
vingt-cinq route de Wisques, soixante-deux, deux cent dix-neuf, Longuenesse
quinze chemin de la Flaque du Vieux Moulin, soixante-deux, cent quatre-vingts à Verton
Avenue Sully, soixante-deux mille quatre cents Béthune
Rue Rolls, soixante-deux, deux cent trente et un Sangatte
Rue Eugène Dumont, Rœux
Rue du Chergui à Marles-les-Mines
cent dix-sept rue des Marichelles
Route de Guînes au numéro quarante et un
un rue d'Ambrines, soixante-deux mille huit cent dix Givenchy-le-Noble
trente-neuf rue Noémie Delobelle, soixante-deux, cent cinquante et un, Burbure
trente-cinq rue D'entre Deux Monts, soixante-deux, huit cents à Liévin
Rue Paul Crampel, soixante-deux mille cent soixante-dix-neuf Wissant
Rue d'Hurionville, soixante-deux, cent cinquante et un Burbure
Rue Jean-Baptiste Defernez, Liévin
Rue Mauriac à Leforest
quatre passage de Strasbourg
Rue Salzinnes Namur au numéro quatorze
quatre-vingts route de Lumbres, soixante-deux mille trois cent quatre-vingts Wismes
onze rue Xavier Dourlens, soixante-deux, deux cent vingt-trois, Sainte-Catherine
cent quinze rue Alexandre Grez, soixante-deux, sept cents à Bruay-la-Buissière
Rue d'Ecurie, soixante-deux mille deux cent vingt-trois Roclincourt
Rue de la Marivoort, soixante-deux, huit cent quatre-vingt-dix Recques-sur-Hem
Rue Hénot, Saint-Martin-Boulogne
Rue Motte du Moulin à Wardrecques
deux rue Katowice
Rue Chrétien Lantoine au numéro quarante-deux
trente et un rue d'Erambeaucourt, soixante-deux mille cent quarante Le Quesnoy-en-Artois
trois rue Sans Soleil, soixante-deux, cent quarante, Tortefontaine
trois rue de Simencourt, soixante-deux, cent vingt-trois à Gouy-en-Artois
Boulevard Émile Basly, soixante-deux mille cent dix Hénin-Beaumont
Résidence Les Marguerites, soixante-deux, huit cent quarante Fleurbaix
Rue Augustin Lesage, Burbure
Rue de Djerba à Calais
douze avenue Normandie Niemen
Rue le Chatelier au numéro trente-quatre
quatre cent treize rue Lieussent, soixante-deux mille huit cent cinquante Hocquinghen
quinze rue de Marquion, soixante-deux, huit cent soixante, Bourlon
deux cent trente-deux route de Lens, soixante-deux, cent trente-huit à Douvrin
Chemin d'Aix, soixante-deux mille cent quarante-trois Angres
Rue Ricquefosse, soixante-deux, huit cent soixante-dix Buire-le-Sec
Rue du Mont Soret, Violaines
Rue Léon Régnier à Liévin
vingt-cinq BIS rue Béharelle
Rue de l'Abbé Max Carpentier au numéro sept
cinq rue Calotte, soixante-deux mille deux cent soixante Auchel
deux cent trente-quatre avenue d'Hyères, soixante-deux, sept cent quatre-vingts, Cucq
quatre-vingt-seize allée du Promontoire, soixante-deux, cent cinquante-deux à Neufchâtel-Hardelot
Impasse Bauduin, soixante-deux mille quatre cent trente Sallaumines
Rue François Chifflart, soixante-deux, cinq cents Saint-Omer
Rue du Cul Tout Nud, Richebourg
Rue du Mont Neuf à Outreau
deux cent sept rue Fernand Fanien
Rue de Lillers au numéro soixante-quatre
cent treize rue du Ganspette, soixante-deux mille neuf cent dix Éperlecques
vingt-trois BIS rue Marcel Rémy, soixante-deux, cinq cent trente, Hersin-Coupigny
vingt-trois rue de Wancourt, soixante-deux, cent dix-huit à Monchy-le-Preux
Rue Edouard Duhamel, soixante-deux mille cent dix Hénin-Beaumont
Rue de Labarrois, soixante-deux, deux cent quatre-vingt-dix Nœux-les-Mines
Rue Joseph Carlier, Lozinghem
Rue de Java à Loison-sous-Lens
quarante-deux route d'Hesdin
Avenue Alfred Maes au numéro deux cent vingt-neuf
quarante et un boulevard André Lepoivre, soixante-deux mille sept cent dix Courrières
vingt-huit chemin Castre, soixante-deux, cent, Calais
quatre-vingt-cinq rue du Bout des Digues, soixante-deux, cent à Calais
Rue de Valières, soixante-deux mille sept cent soixante-dix Willeman
Rue du Maréchal Lefebvre, soixante-deux, cent Calais
Résidence les Jardins Nobled, Vitry-en-Artois
Boulevard de Boulogne à Berck
dix rue Valentin Dupuis
Le Rietz au numéro dix
quatorze rue Léonard, soixante-deux mille huit cents Liévin
quinze rue Grassin Baledans, soixante-deux, zéro zéro zéro, Arras
quatre cent trente et un rue Germon, soixante-deux, six cent soixante à Beuvry
Rue du Ryonval, soixante-deux mille deux cent vingt-trois Saint-Nicolas
Rue de Mont Saint-Eloi, soixante-deux, cent quarante-quatre Villers-au-Bois
Rue Marc Tétard, Coupelle-Vieille
Rue de Bellacourt à Rivière
cent soixante et onze rue de l'Impératrice
Rue du Windal au numéro trois cent quatre-vingt-dix
cent dix-huit impasse des Hauts Marchés, soixante-deux mille cent dix Hénin-Beaumont
sept rue de la Roupie, soixante-deux, trois cent trente, Isbergues
soixante-neuf rue Monseigneur Piedfort, soixante-deux, cent à Calais
Rue Dessenne, soixante-deux mille trois cent soixante-dix Guemps
Route de Carnin, soixante-deux, deux cent vingt Carvin
Rue René Vaze, Pelves
Rue du Lieutenant Lemoine à Wingles
deux A place des Etenettes
Sentier des Castors au numéro deux
trois cent cinq route de Zudausques, soixante-deux mille cinq cents Quelmes
vingt-six rue de Fosseux, soixante-deux, huit cent dix, Hauteville
sept les Serins, soixante-deux, deux cent dix-neuf à Longuenesse
Rue Arthur Fauqueur, soixante-deux mille trois cents Lens
Route de Courrières, soixante-deux, deux cent vingt Carvin
Rue du Natoy, Rebecques
Rue du Moulin de Liettres à Liettres
deux rue du Surot
Rue Jean-François Regnard au numéro quatorze
dix rue Chaplain, soixante-deux mille trois cents Lens
onze résidence Les Palombes, soixante-deux, cinq cent quatre-vingts, Arleux-en-Gohelle
vingt-cinq rue de Robecq, soixante-deux, trois cent cinquante à Busnes
Sentier du Fayel, soixante-deux mille six cent trente Étaples
Rue du Maresquel, soixante-deux, huit cent soixante-dix Gouy-Saint-André
Rue du Pont A Trois Planches, Fréthun
Rue du Bois Choquet à Bonnières
trois rue de Sus-Saint-Léger
Rue de Coupigny au numéro vingt-quatre
seize rue Gaston Durieux, soixante-deux mille deux cent quatre-vingts Saint-Martin-Boulogne
trente et un rue de Biache, soixante-deux, cent dix-huit, Fampoux
vingt-sept rue du Colonel Dupuis, soixante-deux, deux cents à Boulogne-sur-Mer
Chemin du Bracheuil, soixante-deux mille huit cent soixante Écourt-Saint-Quentin
Rue Cambronne, soixante-deux, cent Calais
Ruelle Mérance, Vimy
Rue de la Res du Château à Flers
un rue Marcel Lemoine
Route de Watermel au numéro un
seize rue Correnson, soixante-deux mille deux cents Boulogne-sur-Mer
sept route d'Humeroeuille, soixante-deux, sept cent soixante-dix, Blangy-sur-Ternoise
dix B rue de Gaudiempré, soixante-deux, cent cinquante-huit à Humbercamps
Boulevard des Frères Herbaut, soixante-deux mille cent dix Hénin-Beaumont
Impasse Francisco Ferrer, soixante-deux, six cent vingt Barlin
Rue Richard Pruvost, Houvin-Houvigneul
Rue du Pire Aller à Fiennes
huit allée du Centenaire
Rue d'Allonge au numéro onze
quatre-vingt-dix-huit route de Roquetoire, soixante-deux mille cent vingt Aire-sur-la-Lys
cinq cent quarante-sept résidence Léon Blum, soixante-deux, trois cent quatre-vingts, Lumbres
vingt-deux rue Arthur Becquart, soixante-deux, six cents à Berck
Route de Bonningues, soixante-deux mille trois cent quarante Pihen-lès-Guînes
rue de Maubeuge, soixante-deux, sept cents Bruay-la-Buissière
Rue Lucien et André Laignel, Lillers
Route de Colline à Lépine
quatre cent vingt-trois rue Fernand Bar
Route de Wierre-Effroy au numéro neuf cent vingt-deux
deux rue de Saulty, soixante-deux mille huit cent dix Sombrin
quarante-six rue Jonnart, soixante-deux, cinq cents, Saint-Omer
quinze rue Louis Tenart, soixante-deux, cent trente-sept à Coulogne
Rue des Cormettes, soixante-deux mille cinq cents Saint-Martin-au-Laërt
Rue Gustave Cuvelier, soixante-deux, cent Calais
Rue d'Ouvert, Givenchy-lès-la-Bassée
Rue Falguières à Avion
trente avenue Dupleix
Rue de la Loisne au numéro vingt-six
deux cent cinquante-deux rue du Hanovre, soixante-deux mille cent dix Hénin-Beaumont
seize rue de Crémarest, soixante-deux, deux cent quarante, Desvres
deux rue de l'Aublet, soixante-deux, six cent cinquante à Campagne-lès-Boulonnais
Rue Édouard Harlet, soixante-deux mille huit cent soixante Buissy
Rue Raymond Potier, soixante-deux, huit cent quatre-vingts Annay
Rue Jean-Baptiste Delobel, Libercourt
Rue Joseph Daubrège à Merlimont
cinq allée Satie
Cité Jérôme Blondel au numéro quatorze
deux cent trente-quatre route de Carly, soixante-deux mille huit cent trente Halinghen
cinquante-deux route de Leuline, soixante-deux, cinq cents, Zudausques
sept rue Julien Chevalier, soixante-deux, quatre cent trente à Sallaumines
Résidence Barbara, soixante-deux mille neuf cent quatre-vingt-dix Beaurainville
Rue du Cavin, soixante-deux, cent cinquante et un Burbure
Rue John Jeffries, Guînes
Rue du Docteur Bailliet à Isbergues
quatre rue La Couture
Rue de Burbure au numéro quarante-deux
quatre-vingt-onze rue de l'Equateur, soixante-deux mille sept cents Bruay-la-Buissière
dix-huit résidence Coquelin, soixante-deux, deux cent trente, Outreau
trois TER rue du Doulac, soixante-deux, cinq cents à Saint-Omer
Rue Berthois, soixante-deux mille cent Calais
Rue Perrochaud, soixante-deux, six cents Berck
Rue Vasco De Gama, Liévin
Rue Picavet à La Couture
six allée des Milouins
Rue Pierre Bertrand au numéro trente-quatre
soixante-quatorze résidence Le Tortillard, soixante-deux mille cent quatre-vingts Verton
dix-neuf rue Jules Baudelocque, soixante-deux, deux cents, Boulogne-sur-Mer
six rue Jules Moleux, soixante-deux, six cent trente à Étaples
Rue du Quai de Bruay, soixante-deux mille quatre cents Béthune
Rue de Rosny, soixante-deux, deux cents Boulogne-sur-Mer
Rue des Frères Coint, Bapaume
Avenue Alfred Van Pelt à Lens
trente-cinq route de Lottinghen
La Ferme de la Crx au numéro deux cent soixante-dix
deux résidence Ma Campagne, soixante-deux mille neuf cent dix Éperlecques
trente-huit avenue Tom Simpson, soixante-deux, cent cinquante-deux, Neufchâtel-Hardelot
huit résidence Saint-Arnoult, soixante-deux, huit cent quarante à Sailly-sur-la-Lys
Rue Masclet, soixante-deux mille cent dix Hénin-Beaumont
Rue aux Raisins, soixante-deux, six cents Berck
Chemin de Boyeffles, Hersin-Coupigny
Rue des Hochettes à Arras
trois résidence Charles Delannoy
Rue Jean Baptiste Dubois au numéro un E
dix BIS rue de Coubronne, soixante-deux mille cent vingt Racquinghem
onze rue Marie-Jeanne Duparcq, soixante-deux, cinq cent quatre-vingt-dix, Oignies
cent quarante-quatre chemin de Leuléne, soixante-deux, deux cent trente et un à Peuplingues
Rue Eugène Livois, soixante-deux mille deux cents Boulogne-sur-Mer
Rue de Lillette, soixante-deux, cent vingt Norrent-Fontes
Rue de Pernes, Marest
Rue de Lattre-Saint-Quentin à Hauteville
trois cent quarante-cinq rue de Brunemont
Rue du Hocquevelt au numéro cinquante-sept
quatre cent quatre-vingt-quatorze rue de l'Abbé Louchez, soixante-deux mille huit cent quatre-vingt-dix Audrehem
quarante-huit rue de Barlin, soixante-deux, cent trente et un, Drouvin-le-Marais
trente-quatre rue Charles Debarge, soixante-deux, quatre cent quarante à Harnes
Lotissement Hameau Victoria, soixante-deux mille cent soixante-seize Camiers
Rue François Bourbotte, soixante-deux, deux cent dix-huit Loison-sous-Lens
Rue du Général de Saint-Just, Ardres
Rue du Baron Bucaille à Saint-Léonard
trente-six rue du Tailly
Rue Joseph Duponchel au numéro deux cent cinquante-neuf
cinq rue Henri Petitprès, soixante-deux mille sept cent vingt Rinxent
quarante-trois les Coquelicots, soixante-deux, deux cent quinze, Oye-Plage
deux cent trente et un rue du Rouge Manchon, soixante-deux, cent trente-six à Lestrem
Rue de Vis, soixante-deux mille cent cinquante-six Rémy
Rue Eugène Huret, soixante-deux, trois cent soixante Saint-Étienne-au-Mont
Route de Menneville, Desvres
Rue Duriez à Labourse
trente-trois rue du Grand Bois Hure
Rue Paul Porez au numéro dix-sept
vingt-trois rue Charles Ferrand, soixante-deux mille deux cent dix-sept Achicourt
deux rue Jules Serroen, soixante-deux, deux cent dix-huit, Loison-sous-Lens
cinq BIS rue Faucille, soixante-deux, cinq cent soixante-quinze à Blendecques
Rue des Petites Neuvilles, soixante-deux mille cent quatre-vingts Verton
Rue d'Egmont, soixante-deux, cent trente Saint-Pol-sur-Ternoise
Rue Octave Dreze, Pont-à-Vendin
Rue du Chemin d'Ardres à Zutkerque
soixante-quinze rue Decrombecque
Rue Georges Docquois au numéro six
soixante-dix-neuf impasse Paul Descamps, soixante-deux mille sept cents Bruay-la-Buissière
vingt-quatre rue de Sumatra, soixante-deux, deux cent dix-huit, Loison-sous-Lens
cent quatre-vingt-seize route Départementale deux cent vingt-sept (Cd), soixante-deux, six cent dix à Nielles-lès-Ardres
Rue Arthur Delétoille, soixante-deux mille Arras
Rue du Chemin d'Aire, soixante-deux, cent vingt-neuf Delettes
Rue d'Houdain, Beugin
Rue Jacques et Pierre de Wissant à Wissant
soixante-deux chemin Valois
