trois rue de la Croix Jaubier, dix-huit, deux cent quatre-vingt-dix, Civray
huit allée Charles Darwin, dix-huit, zéro zéro zéro à Bourges
Chemin des Colins, dix-huit mille deux cent vingt Azy
Rue François Chapeau, dix-huit, deux cent quarante Léré
Boulevard Victor, Neuvy-sur-Barangeon
Chemin des Parcelles à Aubigny-sur-Nère
trois chemin des Brosses
Ruette à Bacchus au numéro douze
deux chemin de Launay, dix-huit mille sept cents Aubigny-sur-Nère
onze rue de l'Étoile du Berger, dix-huit, cinq cent soixante-dix, La Chapelle-Saint-Ursin
quatre-vingt-un chemin des Grous, dix-huit, trois cents à Sancerre
Chemin de l'Abattoir, dix-huit mille cent trente Dun-sur-Auron
Allée des Thureaux, dix-huit, cinq cents Berry-Bouy
Impasse de la Fourchette, Bourges
Rue Federico García Lorca à Vierzon
quatorze BIS cours de l'Église
Rue André Huart au numéro cinq
cinquante-huit rue de l'Abbé Morin, dix-huit mille quatre cent dix Blancafort
douze avenue Arnaud de Vogue, dix-huit, zéro zéro zéro, Bourges
sept clos de la Pinaudière, dix-huit, cinq cent soixante-dix à La Chapelle-Saint-Ursin
Cour de la Butte, dix-huit mille Bourges
Impasse Hervé de Primauguet, dix-huit, zéro zéro zéro Bourges
Route de la Corbauderie, Saint-Martin-d'Auxigny
Route de Laverdines à Villequiers
cinq chemin du Briou
Chemin du Bois Jolet au numéro douze
un chemin de Saint-Ladre, dix-huit mille Bourges
cinq allée Jean Cocteau, dix-huit, zéro zéro zéro, Bourges
treize route de Barlieu, dix-huit, deux cent soixante à Vailly-sur-Sauldre
Route des Macaires, dix-huit mille cent Méry-sur-Cher
Route de Domery, dix-huit, deux cent vingt Azy
Rue Ranchot, Bourges
Rue des Bertrands à Flavigny
cinq route de Baugy
Rue Gallerand au numéro vingt-quatre
huit rue de la Pajone, dix-huit mille cent trente Dun-sur-Auron
six rue la Prairie, dix-huit, cent quatre-vingt-dix, Vallenay
quatorze rue du Bordelage, dix-huit, cent cinquante à La Guerche-sur-l'Aubois
Rue du Serre-Coeur, dix-huit mille trois cents Sancerre
Rue Ausburger Émile et Mathilde, dix-huit, deux cent quarante Léré
Rue de la Vélaterie, Le Châtelet
Cour Royale à Vailly-sur-Sauldre
quatre chemin des Joffrois
Rue des Forces Française de l'Interieur au numéro un
vingt rue Marin La Meslée, dix-huit mille cinq cent vingt Avord
onze place Malus, dix-huit, zéro zéro zéro, Bourges
vingt-neuf route du Pont de Larcher, dix-huit, cent à Saint-Georges-sur-la-Prée
Rue de la Croix Moreau, dix-huit mille cent Vierzon
Impasse des Mariniers, dix-huit, cent cinquante Cuffy
Chemin du Crot à l'Âne, Bourges
Place du Commandant Martin à Bourges
huit rue Gaston Cougny
Impasse des Champs Sorres au numéro vingt-trois
quatre rue Jean-Louis Boncoeur, dix-huit mille cent soixante Touchay
quatre-vingt-trois chemin de la Croix du Clair, dix-huit, deux cents, Arpheuilles
quarante-six chemin du Mélerat, dix-huit, cinq cents à Mehun-sur-Yèvre
Rue de l'Ouche Boyer, dix-huit mille cinq cents Mehun-sur-Yèvre
Rue Adélaïde Hautval, dix-huit, zéro zéro zéro Bourges
Rue de l'Étang de la Margauderie, Saint-Laurent
Rue de Navreau à Châteauneuf-sur-Cher
seize rue Mathias Poncet Rivière
Route de Loroy au numéro quinze
treize place Beurrière, dix-huit mille six cents Sancoins
cinquante-deux rue d'Autry, dix-huit, cent vingt, Méreau
treize rue du Champ Bon, dix-huit, cent quatre-vingt-dix à Châteauneuf-sur-Cher
Rue Armand Bazille, dix-huit mille cent Vierzon
Route de Vouzeron, dix-huit, trois cent trente Neuvy-sur-Barangeon
Rue Louis Bouffault, Graçay
Rue de la Verne des Privés à Saint-Amand-Montrond
quatorze rue du Petit Poucet
Rue du Petit Vougan au numéro vingt-quatre
vingt rue de la Mare des Chaumes, dix-huit mille cent dix Saint-Éloy-de-Gy
trois cent vingt route de la Chapelotte, dix-huit, deux cent cinquante, Neuilly-en-Sancerre
huit lotissement des Fauvettes, dix-huit, zéro zéro zéro à Bourges
Rue des Devants, dix-huit mille deux cents Saint-Amand-Montrond
Cour des Fauvettes, dix-huit, deux cent dix Coust
Impasse du Mardelot, Savigny-en-Sancerre
Rue du Remblai à Menetou-Salon
cinq route des Chailloux
Allée Claude Simon au numéro dix
quatre rue des Coucous, dix-huit mille quatre cents Saint-Florent-sur-Cher
trente-six rue Paul Bardin, dix-huit, trois cent quatre-vingt-dix, Moulins-sur-Yèvre
quatre rue Charles Gibault, dix-huit, cent à Vierzon
Route de Somme, dix-huit mille cinq cents Mehun-sur-Yèvre
Chemin de Nizerolles, dix-huit, cent trente Dun-sur-Auron
Route de Chézal Benoit, La Celle-Condé
Rue du Bourgneuf à Vierzon
cinq rue du Champ Roue
Impasse Chevreul au numéro onze BIS
cinq impasse de la Croix Barbière, dix-huit mille trois cent quarante Lissay-Lochy
douze allée Charles Fourier, dix-huit, zéro zéro zéro, Bourges
six impasse des Sittelles, dix-huit, sept cents à Aubigny-sur-Nère
Rue Roger Roblin, dix-huit mille huit cents Saligny-le-Vif
Rue Fradet, dix-huit, deux cents Saint-Amand-Montrond
Rue des Victoires, Saint-Amand-Montrond
Grande Levée de Napoléon à La Chapelle-Montlinard
quatre rue Michel Lucas
Rue Carolus au numéro trois BIS
huit impasse des Batailles, dix-huit mille trois cents Saint-Satur
trois chemin Légnier, dix-huit, zéro zéro zéro, Bourges
un avenue H de Chaumont Quitry, dix-huit, trois cent quatre-vingt-dix à Moulins-sur-Yèvre
Allée du Docteur Zamenhof, dix-huit mille Bourges
Impasse Pillemoy, dix-huit, cent trente Dun-sur-Auron
Passage du Pré d'Anet, Vierzon
Route de Drevant à La Groutte
dix route de Chaumois
Rue des Pillots au numéro trente-deux
huit allée Madeleine Renaud, dix-huit mille Bourges
six rue du Gué Joye, dix-huit, huit cents, Baugy
vingt-quatre rue Louis Demay, dix-huit, cent soixante à Lignières
Rue du Groupe Libération Nord, dix-huit mille Bourges
Chemin du Trou de Gouron, dix-huit, cent quarante La Chapelle-Montlinard
Rue du Gabiller, Boulleret
Impasse Bouvreuil à Avord
deux cent vingt chemin de la Fontaine Saint-Loup
Route de Vignoux-sous-les-Aix au numéro vingt
quatorze route de Saint-Michel de Volangis, dix-huit mille cent dix Fussy
soixante rue de l'Espingole, dix-huit, cinq cent soixante-dix, Trouy
douze rue Pierre Ferdonnet, dix-huit, zéro zéro zéro à Bourges
Rue Hubert Latham, dix-huit mille Bourges
Avenue de la Prospective, dix-huit, zéro zéro zéro Bourges
Route de Jacques au Bois, Preuilly
Route de Neuvy à Vouzeron
dix rue du Bois Chagnat
Impasse Les Genièvres au numéro deux
un chemin du Cheriot, dix-huit mille cent dix Pigny
deux route du Gué-de-la-Pierre, dix-huit, trois cent quatre-vingts, Ivoy-le-Pré
trois impasse de Saint-Marc, dix-huit, quatre cent dix à Argent-sur-Sauldre
Rue des Vieilles Rames, dix-huit mille cent cinquante Cuffy
Allée César, dix-huit, cinq cent soixante-dix Trouy
Impasse de Fay, Vierzon
Le Bois Clair à Clémont
sept chemin des Radicaux
Place René Vitoux au numéro neuf
dix-huit route de Crezançay, dix-huit mille cent quatre-vingt-dix Vallenay
treize rue du Général Gouraud, dix-huit, zéro zéro zéro, Bourges
vingt-quatre rue Raymond Pivin, dix-huit, cent trente à Vornay
Rue des Larges, dix-huit mille cinq cent soixante-dix La Chapelle-Saint-Ursin
Rue de la Nouratte, dix-huit, deux cent quatre-vingt-dix Civray
Rue Pierre Boucle, La Chapelle-Saint-Ursin
Allée de la Ronceraie à Bourges
dix-sept chemin de la Lœuf du Houx
Route de Trenay au numéro dix-huit
six rue des Grandes Chenevières, dix-huit mille deux cent quarante Léré
deux rue des Moreaux, dix-huit, deux cents, Ainay-le-Vieil
huit rue du Charmé, dix-huit, cent quarante à Argenvières
Rue Gilbert Bailly, dix-huit mille Bourges
Route de Soye, dix-huit, deux cents Saint-Georges-de-Poisieux
Rue Edmé Boiché, Bourges
Rue Henri Fournier à Saint-Caprais
un route de Saulzais
Route d'Argenvières au numéro neuf
six rue du Pré d'Agneau, dix-huit mille deux cents Colombiers
quatre rue Jules Grimau, dix-huit, cent, Vierzon
quatre rue des Haberts, dix-huit, deux cent quarante à Belleville-sur-Loire
Route des Petites Bruyères, dix-huit mille trois cent quatre-vingts Méry-ès-Bois
Rue de Boisbelle, dix-huit, deux cent soixante Concressault
Chemin de la Chaussée de César, Mehun-sur-Yèvre
Route de Saint-Ambroix à Saugy
trois mont Content
Route de Saint-Pierre-le-Moûtier au numéro seize
sept chemin des Petits Poiriers, dix-huit mille deux cent vingt Brécy
huit route de la Forêt de Charnes, dix-huit, trois cents, Saint-Satur
trois cent soixante-cinq rue Eudes de Sully, dix-huit, trois cent quatre-vingts à La Chapelle-d'Angillon
Allée des Bois des Rois, dix-huit mille cent dix Allogny
Passage des Fiacres, dix-huit, cent soixante Lignières
Impasse de l'Ancienne Cité de la Verrerie, Vierzon
Impasse de la Craillo à Vierzon
dix rue du Bois Valin
Chemin de Crux au numéro quatre
un route de Saint-Ladre, dix-huit mille cent vingt Massay
douze lotissement Les Bouloises, dix-huit, trois cent quarante, Plaimpied-Givaudins
neuf rue de Préfonds, dix-huit, cinq cent vingt à Bengy-sur-Craon
Rue de Piécot, dix-huit mille cinq cent soixante-dix La Chapelle-Saint-Ursin
Rue des Petits Danjons, dix-huit, zéro zéro zéro Bourges
Rue du Val de Nere, Aubigny-sur-Nère
Place du Donjon à Menetou-Couture
six allée Alberto Giacometti
Rue Casimir Lecomte au numéro dix-neuf
onze chemin des Noëls, dix-huit mille deux cent vingt Les Aix-d'Angillon
six A cour de la Couronne, dix-huit, zéro zéro zéro, Bourges
vingt-trois rue Gaston Boutillon, dix-huit, deux cent dix au Pondy
Rue du Moulin de Pruniers, dix-huit mille trois cent vingt Jouet-sur-l'Aubois
Rue Benjamin Constant, dix-huit, deux cents Saint-Amand-Montrond
Rue Porte Vieille, Sancerre
Rue Jean Giraud à Bruère-Allichamps
vingt rue de Montcameau
Ruelle des Gats au numéro neuf
quatre rue du Docteur Verneuil, dix-huit mille deux cents Saint-Amand-Montrond
trente-cinq avenue Béthune Charost, dix-huit, quatre cents, Saint-Florent-sur-Cher
neuf BIS route de la Vallée du Cher, dix-huit, cent quatre-vingt-dix à Corquoy
Impasse Gibault, dix-huit mille deux cents Saint-Amand-Montrond
Route de Perrières, dix-huit, huit cents Villabon
Route des Merisiers, Assigny
Rue du Docteur Ferdinand Belêtre à Sancoins
quinze chaussée de Chappe
Cours Fleur de Lys au numéro six
neuf impasse des Boeufs, dix-huit mille cent cinquante La Guerche-sur-l'Aubois
vingt-trois route du Château Gaillard, dix-huit, cent quarante, Jussy-le-Chaudrier
sept rue Marcel Fourré, dix-huit, cinq cents à Mehun-sur-Yèvre
Route de Vernais, dix-huit mille deux cent dix Bessais-le-Fromental
Rue Marcel Girard, dix-huit, cinq cents Foëcy
Le Pré du Bois, Oizon
Impasse du Clos du Roy à Vierzon
deux route de Charost
Allée du Champ des Pierres au numéro quarante
quatre cours des Chênes, dix-huit mille Bourges
cinq rue de la Ridaine, dix-huit, deux cent quatre-vingt-dix, Poisieux
vingt-cinq allée François Seurel, dix-huit, trois cent trente à Nançay
Rue des Irantèles, dix-huit mille cent dix Pigny
Rue des Gironnais, dix-huit, quatre cents Saint-Florent-sur-Cher
Rue Jacques Guesdon, La Chapelle-Saint-Ursin
Rue du Saintonge à Bourges
cinq cours des Chenevières
Rue du Clos Pelvet au numéro trois
huit cent soixante-dix route Bouchaille, dix-huit mille deux cents Arpheuilles
trois rue d'Héry, dix-huit, cent, Vierzon
neuf allée de Villâtre, dix-huit, cent vingt à Méreau
Rue de la Chaussée de César, dix-huit mille deux cent quatre-vingt-dix Saint-Ambroix
Rue Irène et Frédéric Joliot-Curie, dix-huit, deux cent trente Saint-Doulchard
Rue le Patureau du Chêne, Vallenay
Route des Bluises à Arpheuilles
trois rue Gabriel Gravier
Rue du Docteur Bonneau au numéro sept
trente-trois impasse Camille Pelletan, dix-huit mille Bourges
vingt et un rue de la Rivelaine, dix-huit, cinq cent soixante-dix, Trouy
cinq rue Jean Valette, dix-huit, deux cents à Ainay-le-Vieil
Allée de l'Aviateur Henry, dix-huit mille cent vingt Méreau
Rue de Vilotte, dix-huit, cent soixante-dix Le Châtelet
Route de Rousson, Saint-Loup-des-Chaumes
Rue du Placis à Bourges
six rue de la Magdelaine
Chemin de Presle au numéro neuf
neuf rue Constant Auclerc, dix-huit mille deux cents Bruère-Allichamps
onze rue Ney, dix-huit, deux cents, Saint-Amand-Montrond
cinq cent quarante-neuf rue Porte de Bruière, dix-huit, cent quatre-vingt-dix à Châteauneuf-sur-Cher
Rue de Chalivoy, dix-huit mille cent cinquante La Guerche-sur-l'Aubois
Rue de la Taille, dix-huit, cent cinquante La Guerche-sur-l'Aubois
Chemin de la Petite Noue, Vierzon
Rue Tabary à Saint-Amand-Montrond
six allée du Béarn
Lotissement des Thomas au numéro deux
dix-huit rue du trente-sept e Régiment d'Artillerie, dix-huit mille Bourges
six route de Guerry, dix-huit, zéro zéro zéro, Bourges
cinquante-huit chemin de Vauvert, dix-huit, zéro zéro zéro à Bourges
Chemin des Ouches, dix-huit mille deux cent vingt Brécy
Route des Margots, dix-huit, trois cents Jalognes
Chemin de la Grande Ouche, Sens-Beaujeu
Rue de Sizières à Marçais
dix allée Louis Ducoux
Rue Eugénie Carré au numéro deux cent quatre-vingt-sept A
treize rue Amédée Durand, dix-huit mille cinq cents Foëcy
douze route du Bois Ratier, dix-huit, quatre cents, Saint-Florent-sur-Cher
quatre chemin de l'Éguillon, dix-huit, trois cent quarante à Annoix
Avenue Henri Brisson, dix-huit mille cent Vierzon
Chemin de Grands Champs, dix-huit, cent Vierzon
Route de Jalognes, Gardefort
Rue Pierre Jacquet à Bourges
vingt et un rue de la Jacque
Rue Laurent Bilbeau au numéro un
quarante et un rue du Docteur Armand Besson, dix-huit mille Bourges
deux avenue Louis Billant, dix-huit, huit cents, Villabon
quatre cents route des Patineaux, dix-huit, trois cent quatre-vingts à Méry-ès-Bois
Rue Saint-Cosme, dix-huit mille cent trente Dun-sur-Auron
Rue Eugène Audonnet, dix-huit, trois cents Saint-Satur
Rue Raoul Rochette, Saint-Amand-Montrond
Rue Élie Brunet à Ainay-le-Vieil
seize A route d'Isdes
Allée Adrienne Bolland au numéro quatorze
dix-neuf route de Chancenay, dix-huit mille cinq cents Allouis
cinq route du Tremblay, dix-huit, trois cent quarante, Soye-en-Septaine
un impasse du Grand Essent, dix-huit, trois cent vingt à Beffes
Rue des Crias, dix-huit mille deux cent quatre-vingt-dix Civray
Rue Gassot de Deffend, dix-huit, zéro zéro zéro Bourges
Clos de la Minée, Vierzon
Impasse des Rompes à Cuffy
un chemin de la Font Prenat
Rue du Moulin de la Forge au numéro deux
seize chemin de Vouzay, dix-huit mille Bourges
vingt-six BIS passage des Champs Gourets, dix-huit, cent, Vierzon
vingt-quatre rue du Village Carré, dix-huit, quatre cents à Saint-Caprais
Rue François Pavillard, dix-huit mille quatre cents Saint-Florent-sur-Cher
Rue de la Grosse Armée, dix-huit, zéro zéro zéro Bourges
Route des Chagnières, Civray
Rue Porte Champion à Ivoy-le-Pré
vingt-sept avenue Jean Vacher
Impasse de la Chappe au numéro un
six cent dix-huit chemin de la Fontaine Saint-Marc, dix-huit mille quatre cent dix Blancafort
six cour Traversière Saint-Bonnet, dix-huit, zéro zéro zéro, Bourges
huit rue de la Pièce de Devant, dix-huit, deux cent quatre-vingt-dix à Civray
Rue de la Minauderie, dix-huit mille cinq cents Vignoux-sur-Barangeon
Rue de la Marguillerie, dix-huit, trois cent quatre-vingt-dix Saint-Germain-du-Puy
Chemin de la Ville de Pract, Azy
Chemin de la Défense à Aubigny-sur-Nère
deux impasse du Taillis Point
Rue du Bois d'Yèvre au numéro neuf
six chemin des Petées, dix-huit mille cinq cents Mehun-sur-Yèvre
cinq BIS rue Louis Rolland, dix-huit, zéro zéro zéro, Bourges
vingt-sept chemin de Tiregorge, dix-huit, quatre cents à Saint-Florent-sur-Cher
Chemin de Saint-Priest, dix-huit mille cent Vierzon
Route de Chateaumeillant, dix-huit, cent soixante-dix Le Châtelet
Impasse de l'Espingole, Trouy
Chemin de Chauchery à Bourges
trois rue Jeuslin de Villiers
Rue du Cavalier au numéro douze
vingt-deux petite Route de Bourges, dix-huit mille cent quatre-vingt-dix Châteauneuf-sur-Cher
quatre C passage de Ronvaux, dix-huit, cent, Vierzon
vingt-quatre route de Noirlac, dix-huit, deux cents à Bruère-Allichamps
Route de Saint-Loup, dix-huit mille cent quatre-vingt-dix Saint-Loup-des-Chaumes
Impasse des Feuillures, dix-huit, cent Vierzon
Allée Jean-Antoine Houdon, Bourges
Rue du Montet à Saint-Éloy-de-Gy
trois allée Hoche
Route de la Grande Cour au numéro trois
vingt et un rue d'Alnay, dix-huit mille cent vingt Méreau
sept rue du Docteur François Perrot, dix-huit, trois cent soixante-dix, Châteaumeillant
un allée des Bordes, dix-huit, deux cent soixante à Vailly-sur-Sauldre
Route Belleville, dix-huit mille deux cent quarante Sury-près-Léré
Impasse du Crot Hatin, dix-huit, cent quarante Herry
Rue de Gratouasse, Dun-sur-Auron
Rue Maurice Suplisson à Sancerre
neuf rue Jean Toubeau
Chemin des Grandes Ouches au numéro treize
dix route de la Gonne, dix-huit mille deux cents Orcenais
sept rue des Berlurettes, dix-huit, cent, Vierzon
quarante-trois rue des Charières, dix-huit, cent vingt à Méreau
Route du Ferrandeau, dix-huit mille cent vingt Lury-sur-Arnon
Chemin du Pré d'en Haut, dix-huit, deux cent trente Saint-Doulchard
Chemin du Champ des Renards, Vierzon
Chemin de la Fontenille à Lapan
onze cours de Fougery
Rue Pierre Desbois au numéro vingt et un
quarante-trois chemin du Bois Desséché, dix-huit mille cent dix Fussy
un route des Pérons, dix-huit, deux cent dix, Charenton-du-Cher
deux rue Albert Luquet, dix-huit, trois cent quatre-vingt-dix à Moulins-sur-Yèvre
Rue du Panorama, dix-huit mille cent Vierzon
Rue Daniel Matter, dix-huit, zéro zéro zéro Bourges
Route d'Azy, Rians
Les Bouloises à Boulleret
six rue de la Boissellerie
Route des Berthins au numéro huit
neuf rue du Général Georges Catroux, dix-huit mille Bourges
quatre chemin de la Contale, dix-huit, cinq cents, Marmagne
quatorze route de Crosses, dix-huit, trois cent quarante à Soye-en-Septaine
Rue des Castilleries, dix-huit mille deux cent dix Bessais-le-Fromental
Résidence Rollin, dix-huit, cent trente Osmery
Rue des Margueries, La Chapelle-Hugon
Rue du Croque Mahaut à Sancergues
quatre clos de la Caille
Chemin du Cheval Blanc au numéro trois
quatre chemin du Champ Jalot, dix-huit mille trois cents Saint-Bouize
cinq rue Charles Etienne, dix-huit, zéro zéro zéro, Bourges
dix-huit G route de Nizerolles, dix-huit, cent trente à Bussy
Route des Grenouilles, dix-huit mille cent quarante La Chapelle-Montlinard
Route de Sancergues, dix-huit, cent quarante Garigny
Rue des Armuriers, Bourges
Chemin des Mondors à Trouy
douze chemin du Gros Buisson
Rue de Malitorne au numéro cinquante-six
onze BIS rue Bissonnière, dix-huit mille deux cents Saint-Amand-Montrond
quatre-vingt-dix route de BoisBelle, dix-huit, deux cent cinquante, Henrichemont
deux place des Anciens d'Afrique du Nord, dix-huit, six cents à Sancoins
Route de Genouilly, dix-huit mille cent Thénioux
Chemin des Quartiers, dix-huit, trois cents Sens-Beaujeu
Chemin des Thomas, Ménétréol-sur-Sauldre
Rue Hubert de Lagarde à Bourges
cinq cent un cours Ménard
Rue de la Genetière au numéro sept
vingt-huit avenue de Bourges, dix-huit mille cinq cent vingt Avord
dix-sept rue de Baugy, dix-huit, cinq cent vingt, Avord
vingt-trois rue Pierre Motin, dix-huit, zéro zéro zéro à Bourges
Rue Bernard Dumont, dix-huit mille cent Vierzon
Impasse de Vieilfond, dix-huit, cent Vierzon
Route de Thérouanne, Saint-Georges-sur-Moulon
Route de Libadon à Vinon
dix-sept impasse Pierre-André de Suffren
Impasse des Grands Moulins au numéro trois
treize chemin du Chétif Village, dix-huit mille cent Thénioux
quatre rue Georges Rousseau, dix-huit, cent, Vierzon
un impasse André Messager, dix-huit, zéro zéro zéro à Bourges
Rue du Tour d'Amigny, dix-huit mille trois cents Sancerre
Chemin du Puits Cherrier, dix-huit, trois cent cinquante Mornay-Berry
Rue du Canal de Jonction, Saint-Satur
Le Pré du Curé à Bengy-sur-Craon
six allée Emmanuel Kant
Rue du Lac aux Fées au numéro vingt-six
vingt et un rue de la Montapeine, dix-huit mille trois cent vingt Jouet-sur-l'Aubois
deux rue des Pâtureaux, dix-huit, cent quatre-vingt-dix, Uzay-le-Venon
quatre impasse du Bois du Houx, dix-huit, zéro zéro zéro à Bourges
Rue de Venoize, dix-huit mille trois cents Bué
Rue du Champ des Chevaux, dix-huit, deux cent trente Saint-Doulchard
Allée de la Planète Bleue, La Chapelle-Saint-Ursin
Route de Fontland à Vasselay
sept rue Michael Lathomus
Impasse SAinte-Marthe au numéro trente-cinq
un rue de Lorroy, dix-huit mille Bourges
cinq impasse du Champ des Landes, dix-huit, cinq cents, Vignoux-sur-Barangeon
treize allée Auguste Rodin, dix-huit, zéro zéro zéro à Bourges
Rue Raoul Neron, dix-huit mille trois cent quatre-vingt-dix Saint-Germain-du-Puy
Rue Ludovic Martinet, dix-huit, trois cent dix Graçay
Chemin de la Fontenelle, Orcenais
Impasse de la Pertuisane à Trouy
cinq petite Rue des Donneaux
Chemin des Basses Sablonnières au numéro deux cent quarante
trois rue Pousse Panier, dix-huit mille sept cents Aubigny-sur-Nère
quatre chemin du Docteur Mornet, dix-huit, trois cent quatre-vingt-dix, Moulins-sur-Yèvre
trente-neuf chemin du Champ du Buisson, dix-huit, sept cents à Aubigny-sur-Nère
Rue Professeur d'Allaines, dix-huit mille quatre cent dix Clémont
Rue Joseph le Brix, dix-huit, zéro zéro zéro Bourges
Route de Boulet, Saint-Laurent
Rue de l'Abbé Émile Trouzier à Chârost
deux BIS rue de Linières
Rue du Blaudy au numéro dix
six chemin de la Terre à Bouillet, dix-huit mille sept cents Aubigny-sur-Nère
sept chemin du Coq, dix-huit, cent dix, Vignoux-sous-les-Aix
vingt et un ruelle des Quilles, dix-huit, sept cents à Aubigny-sur-Nère
Chemin des Reliques, dix-huit mille cent soixante Chezal-Benoît
Route des Aix d'Angillon, dix-huit, deux cent vingt Morogues
Route de Crézancy, Veaugues
Rue Victor Planchon à Mehun-sur-Yèvre
treize résidence Mermoz-Nord
Allée Henri Bergson au numéro seize
quinze cours du Puits, dix-huit mille deux cent trente Saint-Doulchard
neuf avenue de Vierzon, dix-huit, cent vingt, Méreau
trois les Vallées, dix-huit, cent quarante à Groises
Rue Gaston Wimbée, dix-huit mille Bourges
Rue d'Uzay, dix-huit, deux cents Meillant
Cour de l'Auberge, Oizon
Route de Bannegon à Chalivoy-Milon
cinq boulevard Maréchal Foch
Chemin des Mousseaux au numéro dix-neuf
onze rue Louis Breguet, dix-huit mille deux cents Saint-Amand-Montrond
dix rue Hubert Gouvernel, dix-huit, cent quarante, Sancergues
trois chemin des Chireux, dix-huit, deux cents à Drevant
Rue des Quatre Graines, dix-huit mille deux cent trente Saint-Doulchard
Route des Reddes, dix-huit, cent dix Saint-Palais
Place Daumy, Jouet-sur-l'Aubois
Rue de Pierrefi à Léré
vingt-six cité de la Motte
Route de Flavigny au numéro un
dix chemin du Bec d'Assiette, dix-huit mille trois cents Sens-Beaujeu
vingt-trois rue Pelletier Doisy, dix-huit, zéro zéro zéro, Bourges
quinze rue Pierre Debournou, dix-huit, cent à Vierzon
Rue du Bois au Moine, dix-huit mille trois cent quarante Plaimpied-Givaudins
Passage du Crot à Foulon, dix-huit, cent Vierzon
Route de Mabillois, Boulleret
Rue Mazières à Dun-sur-Auron
trois cent soixante-neuf route de Malvette
Rue Saint-Rhomble au numéro dix-sept
cinq rue des Étoiles Filantes, dix-huit mille cinq cent soixante-dix La Chapelle-Saint-Ursin
cinq chemin de la Belle Fontaine, dix-huit, trois cents, Vinon
quatre rue Bonnin, dix-huit, cent trente à Dun-sur-Auron
Rue Hervé de Primauguet, dix-huit mille Bourges
Rang des Roches, dix-huit, quatre cents Lunery
Rue Henri Vernoy, Sainte-Solange
Impasse Armand Bazille à Vierzon
treize route de Jariolle
Route d'Osmery au numéro dix-huit
quatorze rue de Valdéon, dix-huit mille trois cent quarante Annoix
deux rue des Sarrottes, dix-huit, trois cents, Crézancy-en-Sancerre
quatre chemin de la Maison Blanche, dix-huit, cent à Vierzon
Route des Clous, dix-huit mille cent dix Vasselay
Rue de la Croix de Mauconseil, dix-huit, sept cents Aubigny-sur-Nère
Rue Contrescarpe du Nord, Saint-Amand-Montrond
Route d'Argent-sur-Sauldre à Blancafort
cent dix rue des Maisons Blanches
Route de Tendron au numéro quatre
quinze rue des Ocreries, dix-huit mille cent Saint-Georges-sur-la-Prée
un rue Émile Fargeau, dix-huit, huit cents, Saligny-le-Vif
neuf square Louis Braille, dix-huit, cent à Vierzon
Esplanade Porte César, dix-huit mille trois cents Sancerre
Rue du Pré au Lièvre, dix-huit, trois cent quatre-vingt-dix Savigny-en-Septaine
Chemin des Groseilles, Les Aix-d'Angillon
Cours du Mail à Bourges
dix-neuf chemin du Ruisseau des Rechignardes
Rue Roger Perrinet au numéro huit
vingt et un route de Véreaux, dix-huit mille six cents Sancoins
deux rue des Usagés, dix-huit, cent cinquante, La Chapelle-Hugon
trois cent dix-neuf route du Champ Mirotin, dix-huit, deux cents à Nozières
Place des Bonnets, dix-huit mille cent quatre-vingt-dix Vallenay
Rue des Champs Noirs, dix-huit, trois cents Veaugues
Rue du Cheriot, Pigny
Allée du Pont des Romains à Bourges
vingt route de Vasselay
Allée Pierre Leroux au numéro quatre
quatorze A rue de la Fête Dieu, dix-huit mille huit cents Baugy
vingt-quatre BIS route du Creton, dix-huit, cent dix, Vasselay
huit allée du Maréchal Lyautey, dix-huit, zéro zéro zéro à Bourges
Cité de la Croix Chaptal, dix-huit mille trois cent trente Neuvy-sur-Barangeon
Route des Tripaudières, dix-huit, cent Thénioux
Rue Adeline, Sancoins
Route du Bois la Dame à Saint-Léger-le-Petit
un rue Robert Lazurick
Route du Poiriou au numéro vingt-deux
trente-sept allée Evariste Gallois, dix-huit mille Bourges
quatre chemin du Champ du Bois, dix-huit, cent vingt, Quincy
cinq impasse des Deserts, dix-huit, cent dix à Saint-Palais
Allée des Patureaux, dix-huit mille cent dix Vasselay
Rue de la Rubinerie, dix-huit, trois cents Bannay
Rue Charles Lefèvre, Aubigny-sur-Nère
Chemin des Bouvreuils à Nohant-en-Goût
deux rue Jean-Baptiste Kléber
Route du Petit Malleray au numéro deux
