un rue Ramon de Carbonnieres, soixante-quatre mille Pau
soixante-dix-huit rue Raymond et Marcel Glize, soixante-quatre, trois cent quarante, Boucau
cinquante-deux avenue de la Pioche, soixante-quatre, deux cents à Biarritz
Rue Raymond Sousbielle, soixante-quatre mille cent Bayonne
Chemin du Carrérot, soixante-quatre, quatre cents Goès
Rue Jean Mendiondou, Oloron-Sainte-Marie
Lotissement Arrougen à Montaut
sept rue du Docteur Constant Colbert
Route de Pontacq au numéro quatre
cinquante chemin de Batchalette, soixante-quatre mille cinq cent vingt Bidache
trois rue Jean-Baptiste Castaings, soixante-quatre, trois cent quarante, Boucau
sept place Cezaire, soixante-quatre, trois cent soixante-dix à Arthez-de-Béarn
Allée de Sensacq, soixante-quatre mille deux cent trente Aussevielle
Chemin de Pey, soixante-quatre, cinq cent trente Pontacq
Rue des Prés de Julie, Andoins
Rue de Souhara à Bidart
trente-deux chemin de Chauron
Impasse Naçay au numéro quarante-sept
vingt-deux chemin de Jouandic, soixante-quatre mille trois cent quarante Boucau
vingt-trois route de Brassalay, soixante-quatre, trois cents, Biron
cinq chemin du Clos du Balanh, soixante-quatre, quatre cent cinquante à Navailles-Angos
Rue Monréjau, soixante-quatre mille cent Bayonne
Lotissement de Bayne, soixante-quatre, cinq cent dix Assat
Allée du Domaine du Parc, Biarritz
Chemin du Coustalat à Coarraze
cinq rue de Maillarenea
Allée de la Bécassine au numéro vingt-trois
soixante-dix chemin de l'Arriec, soixante-quatre mille trois cents Orthez
trois cent soixante-douze route de Morlaàs, soixante-quatre, cent soixante, Buros
six mille deux cent seize chemin Legarreta, soixante-quatre, trois cent dix à Saint-Pée-sur-Nivelle
Rue de Moleressenia, soixante-quatre mille cinq cents Saint-Jean-de-Luz
Chemin de Riche, soixante-quatre, trois cents Baigts-de-Béarn
Rue Dibildos, Hasparren
Route de Maucor à Saint-Castin
neuf cent quatre-vingt-dix route des Cretes / d'deux cent trente-trois
Rue Auguste Peyre au numéro huit
trente et un TER rue de la Ribère, soixante-quatre mille huit cents Beuste
trois impasse Comet, soixante-quatre, six cents, Anglet
trois cent vingt chemin de la Hondine, soixante-quatre, deux cent quarante à Urt
Boulevard des Frères Farman, soixante-quatre mille cent quarante Lons
Chemin de Crémendy, soixante-quatre, cinq cent vingt Bidache
Rue Iraty, Billère
Route de Doazon à Serres-Sainte-Marie
dix-huit allée Recalde
Rue du Poundet au numéro vingt et un
onze allée Fontaine de Lartigaou, soixante-quatre mille cent Bayonne
cinq chemin de Suberbie, soixante-quatre, cent cinquante, Lahourcade
trois chemin de Bié, soixante-quatre, cent soixante à Saint-Armou
Rue Lapas, soixante-quatre mille six cent quatre-vingts Buziet
Allée Pottoroa, soixante-quatre, cinq cents Saint-Jean-de-Luz
Rue Arnaud de Maytie, Mauléon-Licharre
Chemin de Gendre à Daban à Morlaàs
quatorze rue Georges Messier
Route de Rivehaute au numéro cinq
quarante chemin Dous Balens, soixante-quatre mille cent soixante Gabaston
cent cinquante rue Mundustenea, soixante-quatre, deux cent dix, Bidart
quatorze rue Séraphin Haulon, soixante-quatre, cent à Bayonne
Chemin Chinou, soixante-quatre mille deux cent quatre-vingt-dix Aubertin
Avenue Las Bordes, soixante-quatre, quatre cent vingt Soumoulou
Route de Lembeye, Saint-Jammes
Avenue de Montardon à Pau
huit chemin Capbat
Rue Barthèque au numéro seize
trois rue Marguerite Cugnos, soixante-quatre mille Pau
cent trois rue du Balaïtous, soixante-quatre, cinq cent dix, Boeil-Bezing
trente-deux chemin de Roundelle, soixante-quatre, deux cent trente à Bougarber
Rue des Fleuristes, soixante-quatre mille six cents Anglet
Chemin du Griffet, soixante-quatre, trois cent soixante Monein
Chemin d'Etxehandikoborda, Ustaritz
Chemin d'Unamendi à Urrugne
trois avenue Jean-Baptiste Carassou
Carrèra au numéro deux
vingt-neuf rue Carrérot, soixante-quatre mille Pau
deux camin de Luc, soixante-quatre, cent quatre-vingt-dix, Préchacq-Navarrenx
un route de Lys, soixante-quatre, huit cents à Haut-de-Bosdarros
Route de Lourdes, soixante-quatre mille deux cent soixante Louvie-Juzon
Rue Castel Tambour, soixante-quatre, deux cent soixante-dix Escos
Rue d'Ayous, Idron
Rue de Jouanetote à Anglet
cent soixante chemin Sempé
Chemin de Barrandegi au numéro six cent soixante-neuf
un rue de Subernoa, soixante-quatre mille sept cents Hendaye
dix lotissement du Plateau, soixante-quatre, trois cent vingt, Lée
six lotissement Clabé, soixante-quatre, quatre cent cinquante à Thèze
Allée Gisu Labea, soixante-quatre mille neuf cent quatre-vingt-dix Saint-Pierre-d'Irube
Rue de Char, soixante-quatre, cent Bayonne
Chemin de Pandellé, Thèze
Impasse d'Escuret à Bidos
cinq avenue de la Légion Tchèque
Rue de Monpezat au numéro trente-neuf
trente BIS rue Cépé, soixante-quatre mille cinq cents Saint-Jean-de-Luz
trois rue Escoubet, soixante-quatre, deux cent soixante, Arudy
six mille soixante route de Souraide, soixante-quatre, trois cent dix à Saint-Pée-sur-Nivelle
Côte de la Paloumere, soixante-quatre mille deux cent trente Denguin
Chemin de Garia, soixante-quatre, trois cents Laà-Mondrans
Chemin Mirassou, Lagor
Avenue du Pic du Midi à Igon
cinquante-sept impasse de Portua
Avenue Fouchet au numéro quarante
mille cent chemin de Marque Débat, soixante-quatre mille cinq cent trente Ger
quatre chemin de Sombielle, soixante-quatre, quatre cents, Goès
six chemin de Lapeyrère, soixante-quatre, deux cent soixante à Lys
Rond-Point des Jardins, soixante-quatre mille trois cent quarante Boucau
Avenue de la Soule, soixante-quatre, huit cents Nay
Rue de Guindalos, Jurançon
Rue Lormand à Bayonne
seize route de Bayle
Chemin d'Istiartea au numéro neuf cent cinquante et un
trente et un chemin de Lapoutge, soixante-quatre mille cent soixante Abère
vingt-trois route de l'Arrioutort, soixante-quatre, deux cent trente, Mazerolles
sept rue du Baron Séguier, soixante-quatre, zéro zéro zéro à Pau
Chemin d'Ossau, soixante-quatre mille huit cents Bruges-Capbis-Mifaget
Place Elie Lambert, soixante-quatre, cent Bayonne
Allée du Col-Vert, Lons
Avenue Docteur Bernard Gaudeul à Bayonne
cinquante-six impasse de Birueta
Rue de Lascatalines au numéro un
six rue d'Arbore, soixante-quatre mille quatre cents Oloron-Sainte-Marie
cinq camin de Domecq, soixante-quatre, cent quatre-vingt-dix, Narp
vingt-trois rue Palassou, soixante-quatre, quatre cents à Oloron-Sainte-Marie
Avenue Georges Messier, soixante-quatre mille quatre cents Bidos
Rue Raymond Arnaud, soixante-quatre, huit cents Coarraze
Rue d'Arrousets, Bayonne
Allée du Concorde à Anglet
deux BIS avenue Denis Touzanne
Rue du Brise Lames au numéro quarante-sept
cinq chemin des Bengues, soixante-quatre mille huit cents Asson
six mille quarante-neuf chemin Oihan Bidéa, soixante-quatre, trois cent dix, Saint-Pée-sur-Nivelle
un chemin Tisné, soixante-quatre, cent dix à Rontignon
Rue Matachot, soixante-quatre mille trois cents Orthez
Rue Châteauneuf, soixante-quatre, deux cent soixante Louvie-Juzon
Rue Baradat, Artix
Rue Bere Viste à Serres-Morlaàs
trois impasse La Borde
Avenue de la Rhune au numéro douze
deux rue Paul Jean Toulet, soixante-quatre mille deux cent soixante-dix Salies-de-Béarn
cinq BIS avenue Tristan Deréme, soixante-quatre, quatre cents, Oloron-Sainte-Marie
vingt-sept rue des Frères Cousté, soixante-quatre, trois cent vingt à Bizanos
Avenue Philippon, soixante-quatre mille Pau
Chemin du Barrailh, soixante-quatre, trois cent vingt Idron
Rue de l'Escou, Goès
Lotissement de Ruchelle à Assat
vingt lotissement Gamboia
Rue de la Barthe au numéro onze
dix rue Vincent Partaix, soixante-quatre mille cent soixante Maucor
dix-neuf chemin de l'Untxin, soixante-quatre, cinq cents, Ciboure
neuf rue Albert Mora, soixante-quatre, trois cent quarante à Boucau
Rue du Lot de Batbielles, soixante-quatre mille huit cents Beuste
Rue des Cépes, soixante-quatre, deux cent trente Lescar
Rue Larroumette, Salies-de-Béarn
Rue Lapeyrère à Orthez
vingt passage Antxeta
Route Inthatarteak au numéro neuf cent quarante
cinquante-trois avenue de Tréville, soixante-quatre mille cent trente Mauléon-Licharre
un boulevard Tauzin, soixante-quatre, deux cents, Biarritz
six rue Tran, soixante-quatre, zéro zéro zéro à Pau
Rue Paul Gelos, soixante-quatre mille cinq cents Saint-Jean-de-Luz
Rue Itsas Ondo, soixante-quatre, cent vingt-deux Urrugne
Rue Sauveur Haramburu, Saint-Jean-Pied-de-Port
Rue des Mattets à Soumoulou
deux impasse du Saison
Chemin de Bizargorri au numéro cent seize
quinze rue de la Carrère, soixante-quatre mille deux cent trente Mazerolles
six rue Bagnères, soixante-quatre, trois cent soixante, Abos
cent quatre-vingts chemin des Écoles du Batan, soixante-quatre, cinq cent vingt à Bidache
Rue Martial Singher, soixante-quatre mille quatre cents Oloron-Sainte-Marie
Rue du Pic de Pan, soixante-quatre, zéro zéro zéro Pau
Impasse de Gavarnie, Siros
Chemin d'Anziola à Urrugne
mille cinq cent quatre-vingt-seize chemin de Chantaco
Avenue Pierre de Belsunce au numéro huit
un place Tamon, soixante-quatre mille cent quatre-vingt-dix Jasses
un rue Lacazette, soixante-quatre, deux cent soixante, Arudy
deux impasse Sagardoia, soixante-quatre, cent vingt à Béhasque-Lapiste
Rue des Falaises Beaurivage, soixante-quatre mille deux cents Biarritz
Route de Monein, soixante-quatre, cent cinquante Lahourcade
Route de Bassillon, Luc-Armau
Rue Mimonce à Orthez
vingt-trois rue Zaldi
Chemin de Lannegrand au numéro cinquante
cent cinquante-deux chemin Urde Basa, soixante-quatre mille neuf cent quatre-vingt-dix Lahonce
six mille cinq cent quatre-vingt-dix chemin de Karrika Zaharra, soixante-quatre, trois cent dix, Saint-Pée-sur-Nivelle
quatorze rue Mendi Alde, soixante-quatre, cinq cents à Saint-Jean-de-Luz
Avenue Sergent Capmas, soixante-quatre mille cent Bayonne
Avenue du Baïgura, soixante-quatre, cent Bayonne
Rue de l'Ursuia, Hasparren
Route d'Ogeu à Herrère
trente rue du Foyer Militaire
Rue Édouard Barrère au numéro cinq
cinquante-deux chemin de Pruette, soixante-quatre mille deux cent trente Denguin
trente et un route de Laruns, soixante-quatre, deux cent soixante, Rébénacq
trois chemin de l'Aumette, soixante-quatre, cinq cent trente à Pontacq
Rue Bourg Vieux, soixante-quatre mille trois cents Orthez
Chemin de la Biasse, soixante-quatre, cent quatre-vingt-dix Méritein
Rue de Hirigogne, Anglet
Cami dou Lées à Anoye
six cent trente-trois chemin de Soleta
Rue d'Arnousse au numéro deux
trois impasse Peyreblanque, soixante-quatre mille deux cent trente Artiguelouve
dix-huit rue d'Artouste, soixante-quatre, zéro zéro zéro, Pau
huit chemin Darricarrère, soixante-quatre, trois cent soixante à Monein
Chemin d'Aguerreberri, soixante-quatre mille sept cents Biriatou
Impasse Arkia, soixante-quatre, quatre cent quatre-vingts Ustaritz
Chemin de Bernatenea, Ahetze
Route Karrika Nagusia à Espelette
deux cent soixante-huit rue Berrua
Allée de Cabiroou au numéro quarante et un
sept lotissement l'Enclos du Marquis, soixante-quatre mille quatre cent vingt Nousty
soixante et un impasse Ur Alde, soixante-quatre, neuf cent quatre-vingt-dix, Urcuit
onze clos de Beaumont, soixante-quatre, trois cent vingt à Idron
Voie Communale Cami Salié, soixante-quatre mille trois cent vingt Sendets
Rue Intendant Général Lacrambe, soixante-quatre, cent Bayonne
Place de Jaca, Oloron-Sainte-Marie
Rue Jean Tucat à Espoey
vingt-quatre route de Maubourguet
Allée du Bastan au numéro quinze
deux avenue du Parnasse, soixante-quatre mille six cents Anglet
un rue de l'Agent Fauthous, soixante-quatre, cinq cents, Saint-Jean-de-Luz
vingt et un rue Pierre Bouvet de Thèze, soixante-quatre, cinq cents à Ciboure
Quai Maurice Ravel, soixante-quatre mille cinq cents Ciboure
Rues des Sorbiers, soixante-quatre, deux cent soixante Arudy
Chemin de Latestère, Crouseilles
Route de Lahitau à Barraute-Camu
quatre-vingt-quatre impasse La Sablière
Route de Ciboure A Olhette au numéro trois mille cent quatre-vingt-quinze
deux iMP PORT NEUF, soixante-quatre mille cent Bayonne
cinq cent quarante-huit route Portua, soixante-quatre, quatre cent quatre-vingts, Ustaritz
quatre BIS rue de Coarraze, soixante-quatre, huit cents à Nay
Rue Mendiko Karrika, soixante-quatre mille cent vingt-deux Urrugne
Rue Larrekokarrika, soixante-quatre, cent vingt-deux Urrugne
Route Marcotte Capsus, Ger
Rue Monseigneur Daguzan à Pau
huit allée des Silex
Rue Marie Duprat au numéro seize
cinq cent soixante chemin d'Artzainkoborda, soixante-quatre mille cent vingt-deux Urrugne
deux za Zone d'Activité du Plateau, soixante-quatre, trois cent vingt, Bizanos
quatre lotissement les Diamants, soixante-quatre, trois cent vingt à Lée
Chemin Barraqué, soixante-quatre mille cent quarante Lons
Camin Mourlanné, soixante-quatre, deux cent trente Uzein
Rue des Cinq Monts, Pau
Rue du Général Pommiès à Arbus
vingt-deux camin d'Aussau - Cd neuf cent vingt
Rue des Palombières au numéro six
un place Gandhi, soixante-quatre mille cent Bayonne
six mille cinquante-huit lotissement Gaztelu Zahar, soixante-quatre, trois cent dix, Saint-Pée-sur-Nivelle
cent quinze route Eskolaberri Ko Karrika, soixante-quatre, deux cent cinquante à Espelette
Avenue de la Hargouette, soixante-quatre mille six cents Anglet
Route de Jambet, soixante-quatre, cent soixante Gabaston
Rue d'Arques, Pau
Avenue du Sabaou à Biarritz
cinq chemin Déous Grabas
Impasse Peyré au numéro quatre-vingt-dix-huit
quatorze avenue Nitot, soixante-quatre mille Pau
neuf rue de Girouette, soixante-quatre, six cents, Anglet
deux rue Carcabueno, soixante-quatre, deux cents à Biarritz
Chemin de Vignau, soixante-quatre mille cinq cent dix Assat
Chemin de Maïtoenea, soixante-quatre, neuf cent quatre-vingt-dix Villefranque
Chemin de la Campagnotte, Siros
Route de la Souye à Gabaston
cent vingt montée de Mauléon
Route du Gave d'Aspe au numéro trente-trois
cent deux route de Lasseube, soixante-quatre mille deux cent quatre-vingt-dix Gan
quatre-vingt-dix chemin Guilhem, soixante-quatre, zéro zéro zéro, Pau
cent dix-sept avenue Trespoey, soixante-quatre, zéro zéro zéro à Pau
Chemin Dous Barras, soixante-quatre mille cent quatre-vingt-dix Méritein
Allée dou Broy Bos, soixante-quatre, six cents Anglet
Chemin de Larroude, Bidache
Chemin de la Bié à Espoey
deux chemin d'Audios
Cité Dufau au numéro cent vingt-quatre
un avenue de la Madrague, soixante-quatre mille six cents Anglet
quatre rue René Cabanne, soixante-quatre, cent quarante, Lons
sept route de Miramont, soixante-quatre, trois cent trente à Garlin
Cité Louis Béguerie, soixante-quatre mille cent trente Mauléon-Licharre
Avenue Joseph Besselère, soixante-quatre, cinq cents Ciboure
Rue du Gleysia, Ger
Avenue Henri de Navarre à Bayonne
trente-sept rue Raoul Bramarie
Route de Bassercles au numéro mille quatre cent cinquante-cinq
cent soixante route Gaztaindegi Ko Bidéa, soixante-quatre mille deux cent cinquante Espelette
cinq cent dix-huit chemin de Coustette, soixante-quatre, trois cent soixante, Lucq-de-Béarn
douze rue Hoo Paris, soixante-quatre, zéro zéro zéro à Pau
Chemin la Bourgade, soixante-quatre mille neuf cent quatre-vingt-dix Urcuit
Chemin de Marlats, soixante-quatre, trois cents Laà-Mondrans
Rue de Larrepunte, Biarritz
Rue d'Iratzia à Saint-Jean-de-Luz
deux cent quarante route d'Ustaritz
Avenue Jean Biray au numéro dix
six mille six cent vingt-cinq route d'Ahetze, soixante-quatre mille trois cent dix Saint-Pée-sur-Nivelle
huit chemin de Coeyret, soixante-quatre, cinq cent dix, Assat
treize rue Jean Lissar, soixante-quatre, deux cent quarante à Hasparren
Chemin de Berdou, soixante-quatre mille deux cent soixante-dix Léren
Chemin de Sanguinat, soixante-quatre, cent Bayonne
Allée André Puyade, Anglet
Route de Briscous à Lahonce
quatorze allée du Petchou
Impasse Darrichon au numéro huit
quinze rue du Touya, soixante-quatre mille deux cent soixante Arudy
trois cent cinquante et un chemin de Manchulas, soixante-quatre, deux cent dix, Bidart
dix rue Lagréou, soixante-quatre, cent à Bayonne
Rue Poumirau, soixante-quatre mille cent quatre-vingt-dix Sus
Impasse Bonacieux, soixante-quatre, zéro zéro zéro Pau
Chemin de Petit Chapéou, Ger
Rue Centulle à Oloron-Sainte-Marie
sept avenue Gaston Febus
Allée de Harriet au numéro vingt-cinq
vingt-cinq rue Michel Hounau, soixante-quatre mille Pau
quatre lotissement Les Bergeronettes, soixante-quatre, cinq cent dix, Assat
trente-neuf avenue Joseph Szydlowski, soixante-quatre, cinq cent dix à Bordes
Rue de Lestelette, soixante-quatre mille huit cents Lestelle-Bétharram
Allée Artémis, soixante-quatre, six cents Anglet
Avenue Joseph Abeberry, Ciboure
Avenue du Chanoine Passailh à Lons
vingt et un rue de Lasseguette
Avenue Daniel Argote au numéro vingt-trois
deux impasse Piquessary, soixante-quatre mille trois cent quarante Boucau
sept mille sept cent vingt-huit heroritz, soixante-quatre, six cent quarante, Hélette
trente et un rue du Docteur Paul Ricau, soixante-quatre, cinq cents à Saint-Jean-de-Luz
Chemin Biroulet, soixante-quatre mille deux cent trente Artiguelouve
Chemin du Somport, soixante-quatre, deux cent trente Siros
Impasse Harritx, Biarritz
Route de la Pouponnière à Cambo-les-Bains
douze allée Oihana
Rue Vincent de Bataille au numéro treize
vingt et un avenue Baron Séguier, soixante-quatre mille cent quarante Billère
vingt avenue de Rossi, soixante-quatre, cent, Bayonne
huit rue du Padoin, soixante-quatre, deux cent quatre-vingt-dix à Gan
Boulevard du Cami-Salié, soixante-quatre mille Pau
Chemin Larroudé, soixante-quatre, cent dix Gelos
Côte de la Marigue, Portet
Avenue d'Eskual-Herria à Chéraute
sept avenue du Bois de la Ville
Avenue de Miguélénia au numéro vingt-six
treize impasse Hondartza, soixante-quatre mille six cents Anglet
vingt route des Teoulères, soixante-quatre, trois cent soixante-dix, Arthez-de-Béarn
quatorze BIS route de Macaye, soixante-quatre, deux cent cinquante à Cambo-les-Bains
Cours Camou, soixante-quatre mille Pau
Chemin de Landalarre, soixante-quatre, quatre cent quatre-vingts Ustaritz
Route Rd huit cent dix-sept, Baigts-de-Béarn
Rue de la Hourquette à Eslourenties-Daban
sept cent quatre-vingt-onze chemin de Carrère de Marque Debat
Route de Monpezat au numéro vingt et un
quatre rue du Pic du Ger, soixante-quatre mille trois cent soixante Monein
sept lotissement Clos du Mourou, soixante-quatre, trois cent soixante-dix, Arthez-de-Béarn
deux avenue du Dix Huitième Ri, soixante-quatre, zéro zéro zéro à Pau
Rue Jacques Lemoine, soixante-quatre mille deux cent vingt Saint-Jean-Pied-de-Port
Route de Fichous, soixante-quatre, quatre cent dix Larreule
Rue d'Ouristy, Hendaye
Place des Gascons à Bayonne
huit impasse du Bigné
Avenue du Stade Nautique au numéro six
deux route d'Arnéguy, soixante-quatre mille deux cent vingt Uhart-Cize
dix-neuf chemin de Labielle, soixante-quatre, trois cent vingt, Aressy
onze lotissement Balentria, soixante-quatre, deux cent cinquante à Cambo-les-Bains
Avenue Copernic, soixante-quatre mille Pau
Rue Iturbidea-Pausu, soixante-quatre, cent vingt-deux Urrugne
Rue de l'Aragon, Bizanos
Chemin Ibarrondoa à Saint-Pée-sur-Nivelle
dix-huit rue de Numa
Chemin de Mulienea au numéro un
un chemin de la Saligue, soixante-quatre mille trois cent soixante Tarsacq
quatre-vingt-trois allée de l'Empereur, soixante-quatre, six cents, Anglet
trois cent quatre-vingt-onze camin de Coutolou, soixante-quatre, trois cent soixante-dix à Castillon
Allées Paulmy, soixante-quatre mille cent Bayonne
Chemin de la Coste de Laban, soixante-quatre, cinq cent trente Pontacq
Chemin de Serres Hautes, Eysus
Camin de la Serra à Arnos
cent soixante-quinze chemin Dous Boulurs
Lotissement Le Ruisseau au numéro huit
cinq allée du Park Lodge, soixante-quatre mille trois cent vingt Bizanos
six impasse du Téné, soixante-quatre, cent, Bayonne
un allée du Bois des Violettes, soixante-quatre, cent à Bayonne
Rue Larribau, soixante-quatre mille deux cent soixante Buzy
Chemin Caillaou, soixante-quatre, cent quatre-vingt-dix Angous
Camin Deus Pèyris, Montaner
Chemin Malihonda à Lons
un rue de L'Arrec
Chemin de la Humère au numéro huit
dix-huit route de Came, soixante-quatre mille deux cent soixante-dix Saint-Dos
vingt-cinq rue Clément Laurencena, soixante-quatre, cent vingt-deux, Urrugne
six cent soixante-quinze chemin de Béhérekoetxea, soixante-quatre, neuf cent quatre-vingt-dix à Mouguerre
Rue Iguskian, soixante-quatre mille neuf cent quatre-vingt-dix Saint-Pierre-d'Irube
Impasse Clouzard, soixante-quatre, deux cents Biarritz
Chemin de Lagisquet, Castagnède
Rue du Comte de Lambert à Pau
mille soixante chemin de Domenjun
Impasse de Pombie au numéro cent vingt-cinq
vingt impasse Labie, soixante-quatre mille cent quatre-vingt-dix Gurs
quatre allée Zubikoa, soixante-quatre, cinq cents, Saint-Jean-de-Luz
trente et un avenue Bié-Moulié, soixante-quatre, zéro zéro zéro à Pau
Allée du Moura, soixante-quatre mille six cents Anglet
Chemin de Larrecq, soixante-quatre, quatre cent vingt Espoey
Allée d'Oihan Tipia, Mouguerre
Avenue du Lac Marion à Biarritz
cent route Alzurene Ko Bidéa
Chemin de Moulios au numéro quatorze
cinq chemin de l'Oree du Bois, soixante-quatre mille quatre cent vingt Espoey
vingt-deux allée du Makila, soixante-quatre, deux cents, Bassussarry
huit rue Louis Colas, soixante-quatre, cent à Bayonne
Chemin Bohogu, soixante-quatre mille cent trente Barcus
Chemin de Parroun, soixante-quatre, cinq cent vingt Bidache
Rue Erretegia, Bidart
Rue Les Jardins du Bon Pasteur à Pau
trente-six rue Pierre Broussain
Route de Sans au numéro soixante-cinq
seize rue Gaston quatre le Croisé, soixante-quatre mille cent soixante Morlaàs
trois cent dix route de la Carrère, soixante-quatre, trois cent soixante-dix, Mesplède
six avenue Docteur Léon Moynac, soixante-quatre, cent à Bayonne
Chemin de Hounzet, soixante-quatre mille cinq cent trente Pontacq
Rue de Lamouly, soixante-quatre, six cents Anglet
Chemin Xearbaita, Urrugne
Rue du Hameau de Trespoey à Pau
vingt-sept avenue Bordart
Chemin Chuchuenia au numéro cent quatre-vingt-dix
vingt allée Landaburu, soixante-quatre mille cent vingt-deux Urrugne
cent soixante-dix camin d'Aïnsh, soixante-quatre, quatre cent soixante, Montaner
quarante-sept avenue Henri Fanfelle, soixante-quatre, cent dix à Gelos
Avenue de Belzunce, soixante-quatre mille cent trente Mauléon-Licharre
Allée du Labourd, soixante-quatre, six cents Anglet
Route de Bergeret, Lussagnet-Lusson
Rue du Gabizos à Meillon
treize BIS chemin Salié
Rue Jean Bague au numéro treize
deux rue Fossiè, soixante-quatre mille Pau
six rue Charles Macé, soixante-quatre, zéro zéro zéro, Pau
quarante-neuf chemin de Berdoulou, soixante-quatre, deux cent quatre-vingt-dix à Gan
Avenue Maurice Trubert, soixante-quatre mille deux cents Biarritz
Rue Magendie, soixante-quatre, cent dix Gelos
Chemin de Sianes, Momas
Chemin de Kixoenekoborda à Urrugne
sept rue de Miossens
Rue Bigarena au numéro quarante-quatre
soixante-deux boulevard Tourasse, soixante-quatre mille Pau
dix-neuf chemin de Castet, soixante-quatre, cent vingt et un, Serres-Castet
deux rue Broquedis, soixante-quatre, deux cents à Biarritz
Route Frantxuia Ko Bidéa, soixante-quatre mille deux cent cinquante Espelette
Rue Mongelous, soixante-quatre, cent quarante Billère
Rue Cachau, Lescar
Route de Sardasse à Saint-Palais
douze avenue de la Moutète
Boulevard Guillemin au numéro vingt-quatre BIS
quinze rue du Professeur Doléris, soixante-quatre mille Pau
quatre rue Marcadet Dessus, soixante-quatre, cent soixante, Morlaàs
trente et un avenue Carrerot, soixante-quatre, deux cent trente à Lescar
Chemin Harri Bidea, soixante-quatre mille deux cent dix Guéthary
Rue de l'Aulhé, soixante-quatre, cent dix Mazères-Lezons
Voie Communale Bourg l'Église, Monpezat
Route de Loubieng à Maslacq
un impasse du Baradot
Place Maxime Boyrie au numéro un
quatre-vingt-un rue du Moulin Barbot, soixante-quatre mille six cents Anglet
huit cent quatre-vingt-dix-huit chemin Placis, soixante-quatre, trois cents, Balansun
dix route Xamarin Eko Bidéa, soixante-quatre, deux cent cinquante à Espelette
Chemin de Bernes, soixante-quatre mille cinq cent dix Bordes
Rue de la Hont de Labat, soixante-quatre, cinq cent dix Bordes
Rue du Bois Belin, Anglet
Chemin Couralis à Laroin
deux cent onze chemin de Gachonenea
Camin Sent Bertran au numéro sept
vingt-trois rue Saint-Forcet, soixante-quatre mille cent Bayonne
huit rue de Harausta, soixante-quatre, deux cents, Biarritz
six chemin d'Arcaude, soixante-quatre, deux cent soixante à Sainte-Colome
Avenue Gabriel Delaunay, soixante-quatre mille cinq cents Ciboure
Chemin de la Houn de Pinoc, soixante-quatre, cent soixante Buros
Chemin de la Quinda, Sendets
Rue Pe de Lasserre à Buzy
vingt-cinq chemin de Pebarbe
Rue Jean Casabonne au numéro vingt et un
cent quinze route Oihan Bidéa, soixante-quatre mille deux cent cinquante Espelette
sept mille vingt-cinq voie Communale de Sadarria, soixante-quatre, six cent quarante, Iholdy
deux chemin du Castagnet, soixante-quatre, cent vingt et un à Montardon
Rue Jean de Gassion, soixante-quatre mille cent quatre-vingt-dix Audaux
Chemin de Lacabane, soixante-quatre, trois cent vingt Idron
Avenue du Mondarrain, Bayonne
Chemin de Ciogaraï à Urrugne
dix-sept rue Pierre Ransan
Route de Josbaig au numéro trente-huit
trente-sept rue de Bahinos, soixante-quatre mille six cents Anglet
soixante-quinze chemin de Betrienea, soixante-quatre, cent vingt-deux, Urrugne
quarante-quatre chemin de Ilos, soixante-quatre, deux cent quatre-vingt-dix à Gan
Avenue du Château d'Este, soixante-quatre mille cent quarante Billère
Route de Mouguerre, soixante-quatre, neuf cent quatre-vingt-dix Lahonce
Rue Caup, Artix
Rue Iguzkitan à Urcuit
dix-huit rue des Trois Frères Laborde
Impasse Henri Jeanpierre au numéro quatre
