six allée de Moyrie, soixante-quatre, six cents, Anglet
cent vingt-deux rue Dufau, soixante-quatre, cent soixante-dix à Artix
Chemin de Hourrègue, soixante-quatre mille cent vingt et un Serres-Castet
Chemin Haran, soixante-quatre, neuf cent quatre-vingt-dix Urcuit
Chemin de Louvigny, Séby
Chemin Haizpean à Souraïde
quatre rue Olazo
Allée de Pondicq au numéro quatre cents
un rue Les Sansonnets, soixante-quatre mille cinq cent trente Barzun
mille trois cent quatre-vingt-dix route d'neuf cent quarante-six, soixante-quatre, trois cent soixante-dix, Mesplède
cinq route d'Artigueloutan, soixante-quatre, quatre cent vingt à Andoins
Rue Courtade, soixante-quatre mille cinq cents Saint-Jean-de-Luz
Camin de Pérulh, soixante-quatre, trois cent soixante-dix Arnos
Rue Source du Luy, Limendous
Rue Charles Moureu à Pau
seize route des Aoûles
Rue Hondaa au numéro six
six clos de la Tour de Lannes, soixante-quatre mille six cents Anglet
deux cent quarante rue Larrecq, soixante-quatre, cent soixante-dix, Artix
sept chemin de Hourticq, soixante-quatre, huit cents à Bruges-Capbis-Mifaget
Ancien Chemin de Loung, soixante-quatre mille cent Bayonne
Rue Bergerau, soixante-quatre, trois cents Orthez
Route de Marpaps, Sault-de-Navailles
Rue du Pic d'Anie à Pardies
vingt-neuf rue Louis Daran
Impasse Lasmugues au numéro trois
six chemin de Sucra, soixante-quatre mille deux cent soixante Lys
mille cinq cent trente-cinq chemin de Catanabaita, soixante-quatre, cent vingt-deux, Urrugne
dix-neuf allée du Benou, soixante-quatre, cent vingt et un à Serres-Castet
Rue du Helder, soixante-quatre mille deux cents Biarritz
Rue André Etcheverlepo, soixante-quatre, cent Bayonne
Rue Charles Palassié, Cambo-les-Bains
Chemin de Hourcloum à Loubieng
quatre-vingt-quinze route de Souhara
Rue Frédéric Miramon au numéro dix-sept
treize rue du Goundet, soixante-quatre mille trois cents Orthez
quatre camin Faustin, soixante-quatre, trois cent cinquante, Monpezat
quatre rue Jean Duhourcau, soixante-quatre, huit cents à Coarraze
Route du Pont Long, soixante-quatre mille deux cent trente Bougarber
Rue de la Hourquie, soixante-quatre, cent soixante Morlaàs
Chemin de Galharret, Mouguerre
Rue d'Arcondau à Bayonne
vingt-quatre avenue de Camayou
Routé de Sauveterre au numéro quatre cent soixante-neuf
un route de Limendous, soixante-quatre mille quatre cent vingt Andoins
trois chemin Lajunte, soixante-quatre, quatre cent cinquante, Navailles-Angos
huit chemin de Tech, soixante-quatre, huit cents à Saint-Vincent
Chemin Lampoulette, soixante-quatre mille deux cent quatre-vingt-dix Estialescq
Avenue Karsinenea, soixante-quatre, cinq cents Saint-Jean-de-Luz
Route de Navarrenx, Laà-Mondrans
Voie Communale N° dix Dite d'Eslayas à Orthez
quatre-vingt-dix rue Vc Olhaingo Landako Bidéa
Rue de Dongaitz au numéro cinq
dix chemin Majourau, soixante-quatre mille six cent quatre-vingts Ogeu-les-Bains
seize rue Alexander Taylor, soixante-quatre, zéro zéro zéro, Pau
cent cinquante chemin Dophiné, soixante-quatre, deux cent quatre-vingt-dix à Aubertin
Rue d'Etchérouty, soixante-quatre mille neuf cent quatre-vingt-dix Saint-Pierre-d'Irube
Chemin de Larrechtakoborda, soixante-quatre, deux cent quarante Briscous
Rue Cami Dou Nabèra, Géus-d'Arzacq
Chemin d'Agerrea à Ahetze
deux rue du Lannot
Rue de Courasson au numéro sept BIS
vingt-sept carrérot de la Forge, soixante-quatre mille cent soixante-dix Labastide-Cézéracq
quatre cent quatre-vingt-dix rue de la Vallée d'Ossau, soixante-quatre, cent vingt et un, Serres-Castet
neuf rue Domingoenia Gaenean, soixante-quatre, sept cents à Hendaye
Rue du Lot La Croix de Mirot, soixante-quatre mille huit cents Beuste
Chemin Pescadou, soixante-quatre, cent vingt et un Serres-Castet
Allée de Peyras, Bayonne
Lotissement Uhaldeko Borda à Ascain
six rue du Bourialaa
Route de Morlàas au numéro cent soixante-huit
trois chemin de Coadebés, soixante-quatre mille huit cents Haut-de-Bosdarros
six rue d'Iraty, soixante-quatre, cinq cent dix, Bordes
trois cent vingt chemin d'Harizmendi, soixante-quatre, cent vingt-deux à Urrugne
Rue de la Soule, soixante-quatre mille cent trente Chéraute
Voie Communale de Biouya, soixante-quatre, quatre cent soixante Ponson-Dessus
Rue Mesplès, Pontacq
Rue de Fatxipi à Urrugne
trois chemin du Herré
Impasse Pioche au numéro vingt-cinq
quatre-vingts chemin du Cournau, soixante-quatre mille deux cent trente Sauvagnon
seize chemin du Brangot, soixante-quatre, cinq cent dix, Narcastet
douze chemin de la Côte de Capbat, soixante-quatre, cinq cent trente à Livron
Chemin de Tougnet, soixante-quatre mille cinq cent vingt Bidache
Rue Etchegaray-Haria, soixante-quatre, deux cent vingt Uhart-Cize
Route de Lahonce, Urcuit
Rue de Baigt à Buziet
quarante-deux impasse du Castérot
Chemin de Bereterrenborda au numéro six
trois rue Guy Petit, soixante-quatre mille deux cents Biarritz
vingt-trois rue du Loulié, soixante-quatre, cent dix, Gelos
deux cent quatre-vingt-dix-huit chemin Junqua, soixante-quatre, deux cent trente à Artiguelouve
Rue de Bela, soixante-quatre mille cent trente Mauléon-Licharre
Impasse Duler, soixante-quatre, deux cents Biarritz
Avenue Simin Palay, Gelos
Avenue Harrokan à Saint-Pierre-d'Irube
trente-huit chemin d'Artigueloutan
Rue Henri Lapuyade au numéro sept
cinquante rue d'Aïzpurdi, soixante-quatre mille sept cents Hendaye
six TER allée Iguzki Alde, soixante-quatre, cent vingt, Saint-Palais
trente rue Philippe Veyrin, soixante-quatre, cinq cents à Saint-Jean-de-Luz
Rue des Lucanes, soixante-quatre mille six cents Anglet
Lotissement Sagardia, soixante-quatre, sept cents Hendaye
Avenue Duvergier de Hauranne, Bayonne
Allée Raphaël à Mourenx
douze carrère Saint-Pierre
Route de Saint-Faust au numéro trente-quatre
deux cent quarante-cinq rue de Sarrières, soixante-quatre mille cent vingt et un Serres-Castet
deux rue Monhau, soixante-quatre, deux cents, Biarritz
quatre cent quatre-vingt-sept route de Mounichou, soixante-quatre, trois cent soixante-dix à Morlanne
Rue Mont Saint-Sauveur, soixante-quatre mille cent vingt Saint-Palais
Rue Jean Sarrailh, soixante-quatre, trois cent soixante Monein
Chemin Chisné, Lamayou
Chemin de Cabanné à Ogenne-Camptort
vingt-trois chemin Clos de Baix
Rue d'Ourouty au numéro seize
onze chemin Couroucoulé, soixante-quatre mille trois cent cinquante Séméacq-Blachon
six rue de Lacq, soixante-quatre, zéro zéro zéro, Pau
six allée du Val des Prés, soixante-quatre, trois cent quarante à Boucau
Chemin de Pinte, soixante-quatre mille huit cents Arthez-d'Asson
Chemin de Noguères, soixante-quatre, cent cinquante Mourenx
Chemin d'Artigaret, Asson
Rue du Hameau de la Cavette à Lescar
cent trente-sept rue de Kulor
Chemin de Mikelategia au numéro six mille cinq cent soixante-six
vingt-quatre chemin de Constantin, soixante-quatre mille neuf cent quatre-vingt-dix Mouguerre
dix rue Jean-Baptiste Bégarie, soixante-quatre, cinq cent trente, Pontacq
dix-neuf allée de la Soule, soixante-quatre, cent quarante à Lons
Impasse Harguignenia, soixante-quatre mille cinq cents Saint-Jean-de-Luz
Chemin de Cap Arré, soixante-quatre, cinq cent trente Pontacq
Avenue Vicbayle, Escout
Chemin Xantxinenea à Ustaritz
mille neuf cent quarante route de Momas
Chemin de Bixuxtea au numéro deux cent vingt-cinq
six allée Ramuntcho, soixante-quatre mille cinq cents Saint-Jean-de-Luz
neuf rue Borde de Saut, soixante-quatre, six cent quatre-vingts, Ogeu-les-Bains
trois chemin Lapoudge, soixante-quatre, trois cent cinquante à Arrosès
Avenue Despourrins, soixante-quatre mille quatre cents Bidos
Avenue Alphonse treize, soixante-quatre, deux cents Biarritz
Route de Legarcia, Urrugne
Rue du Maréchal Harispe à Saint-Jean-de-Luz
deux cent quarante-sept chemin Tourugasses
Impasse Émeraude au numéro trois
six rue René Fournets, soixante-quatre mille quatre cents Oloron-Sainte-Marie
dix rue Bourg Mayou, soixante-quatre, cent soixante, Morlaàs
vingt-trois rue du Cabeilh, soixante-quatre, cent quarante à Lons
Rue du Champ Lacombe, soixante-quatre mille deux cents Biarritz
Chemin Menta, soixante-quatre, neuf cent quatre-vingt-dix Lahonce
Rue des Salinis, Morlaàs
Route de Garos à Fichous-Riumayou
soixante-quatre route d'Escou
Avenue Cordilleta au numéro quatorze
vingt-deux rue Xoko Berri, soixante-quatre mille deux cent quarante Hasparren
vingt allée du Pic du Midi, soixante-quatre, deux cent trente, Sauvagnon
cent quarante chemin de Plassis, soixante-quatre, trois cents à Castétis
Allée Jean-Claude Arriaga, soixante-quatre mille deux cents Bassussarry
Avenue André Ithurralde, soixante-quatre, cinq cents Saint-Jean-de-Luz
Impasse de Jeanbach, Mesplède
Rue Maurice Estrabaut à Pau
quatorze carrère du Château
Rue d'Alsace et Lorraine au numéro huit
vingt et un rue Marca, soixante-quatre mille Pau
vingt-quatre rue Port Neuf, soixante-quatre, cent, Bayonne
seize impasse Tembous, soixante-quatre, six cent quatre-vingts à Ogeu-les-Bains
Chemin Jean Guilhem, soixante-quatre mille trois cents Sallespisse
Chemin Birabens, soixante-quatre, cent vingt et un Montardon
Chemin Salpidia, Villefranque
Avenue des Anciens Combattants d'Algérie à Artix
mille cent quatre-vingts chemin Laharraga
Avenue de l'Ursuya au numéro cinquante-deux
mille cent quarante-huit chemin de Larreule, soixante-quatre mille trois cent soixante-dix Uzan
cinquante-trois rue Gensemin, soixante-quatre, cent quarante, Billère
cent soixante et un rue d'Agoretta, soixante-quatre, deux cent dix à Bidart
Chemin du Bas Leren, soixante-quatre mille deux cent soixante-dix Léren
Place de la Pomme d'Or, soixante-quatre, deux cent soixante Arudy
Avenue de Buros, Pau
Route Haut de Bordes / Mont à Mont
vingt-huit chemin Passades
Rue Cauhapé au numéro deux
dix-huit place des Basques, soixante-quatre mille cent Bayonne
deux chemin de la Perpinière, soixante-quatre, cent soixante, Saint-Armou
cinq route de Vic-en-Bigorre, soixante-quatre, quatre cent soixante à Maure
Chemin de Bernèze, soixante-quatre mille deux cent trente Momas
Avenue Henri Grenet, soixante-quatre, cent Bayonne
Chemin Gelousé, Ance
Route de Caubios à Momas
trois cents chemin de Bibe
Chemin de Pau au numéro soixante-dix-neuf
dix-sept rue Alberte Maïté, soixante-quatre mille six cents Anglet
cinq cent soixante-cinq route de Moulié, soixante-quatre, trois cent soixante-dix, Mesplède
quatorze rue Rebeque, soixante-quatre, cent quarante à Lons
Chemin d'Etxehasia, soixante-quatre mille quatre cent quatre-vingts Ustaritz
Chemin Haroztegia, soixante-quatre, deux cent dix Ahetze
Rue Chiquito de Cambo, Cambo-les-Bains
Chemin de la Barade Rouge à Pontacq
vingt impasse Labielle
Chemin Bordenave au numéro sept cent quatorze
quinze rue Galos, soixante-quatre mille Pau
deux avenue de Migron, soixante-quatre, deux cents, Biarritz
sept BIS rue de l'Arlas, soixante-quatre, trois cents à Orthez
Chemin de Galharet, soixante-quatre mille neuf cent quatre-vingt-dix Saint-Pierre-d'Irube
Rue de Codry, soixante-quatre, cent Bayonne
Avenue de la Croix de Mouguerre, Mouguerre
Rue du Luy de Béarn à Morlaàs
vingt-deux rue Charles Lacoste
Chemin de Xantana au numéro douze
mille cent route Irazabale Ko Bidéa, soixante-quatre mille deux cent cinquante Espelette
trois cent quarante chemin de Borda, soixante-quatre, neuf cent quatre-vingt-dix, Mouguerre
quarante-trois avenue Lalanne, soixante-quatre, cent quarante à Billère
Rue de Tichené, soixante-quatre mille neuf cent quatre-vingt-dix Saint-Pierre-d'Irube
Route de Tarbes - Rd huit cent dix-sept, soixante-quatre, trois cent vingt Idron
Route de Cantinat, Arthez-de-Béarn
Rue Etchehoun à Mauléon-Licharre
deux lotissement Domaine de la Cheneraie
Allée de Fontaine Laborde au numéro quinze BIS
dix chemin Fatxaenea, soixante-quatre mille quatre cent quatre-vingts Ustaritz
treize chemin d'Aussevielle, soixante-quatre, deux cent trente, Poey-de-Lescar
six avenue Lahubiague, soixante-quatre, cent à Bayonne
Rue Saint-Basil's, soixante-quatre mille trois cent vingt Bizanos
Route Rd cent quarante-huit, soixante-quatre, quatre cent soixante Monségur
Avenue de Larochefoucauld, Anglet
Route de Cambo à Hasparren
un chemin Beth Ceü
Route de Navailles au numéro trente
cent chemin Larreburua, soixante-quatre mille quatre cent quatre-vingts Ustaritz
dix rue du Bedat, soixante-quatre, deux cent trente, Arbus
huit chemin d'Arrascles Dessus, soixante-quatre, huit cents à Arthez-d'Asson
Chemin Biskarenea, soixante-quatre mille deux cent dix Bidart
Lotissement Denek Bat, soixante-quatre, deux cent quarante Hasparren
Route de Lagor, Maslacq
Rue de Pardeilhan à Anglet
neuf chemin de Lasmugues
Route du Corps Franc Pommies au numéro quinze
trente allée Loretan, soixante-quatre mille cent vingt-deux Urrugne
vingt-neuf rue d'Orognen, soixante-quatre, cent quatre-vingt-dix, Dognen
un rue de Poumirau, soixante-quatre, trois cent soixante-dix à Arthez-de-Béarn
Avenue du Cam d'André, soixante-quatre mille deux cents Biarritz
Chemin Rural Errepira Ko Bidea, soixante-quatre, deux cent dix Bidart
Rue du Mourax, Lons
Route d'Agnos à Bidos
trente et un avenue Charles Touzet
Route de Mauléon au numéro mille deux cent quatre-vingt-quinze
mille neuf cent quatre-vingt-trois chemin de Roumieu, soixante-quatre mille cent soixante Buros
deux cent cinquante chemin Courreyes, soixante-quatre, cent soixante, Sévignacq
quatre cent soixante et onze chemin Legarrekoborda, soixante-quatre, quatre cent quatre-vingts à Ustaritz
Rue Albert le Barillier, soixante-quatre mille six cents Anglet
Route Elgartemix, soixante-quatre, cent vingt Aïcirits-Camou-Suhast
Route de Bosdarros, Rébénacq
Rue Ondicola à Saint-Jean-de-Luz
quatre cent cinquante-deux chemin Séré
Rue Lou Nouste Henric au numéro vingt-neuf
quatre rue Catherine Aguirre, soixante-quatre mille cinq cents Ciboure
un chemin du Bridet, soixante-quatre, deux cent trente, Arbus
un impasse du Bialé, soixante-quatre, deux cent trente à Lescar
Rue Barada, soixante-quatre mille trois cent soixante Monein
Route de Burgaronne, soixante-quatre, trois cent quatre-vingt-dix Andrein
Chemin de Sainte-Colome, Lys
Rue Cyprien Loustau à Jurançon
vingt-deux rue du Castérar
Rue Hirigoyen au numéro trois
cinq rue Landa Handi, soixante-quatre mille cinq cents Saint-Jean-de-Luz
dix-neuf allée de l'Impératrice, soixante-quatre, six cents, Anglet
huit chemin de Bascoin A Soustouy, soixante-quatre, cent quatre-vingt-dix à Rivehaute
Chemin de Bauzées, soixante-quatre mille trois cent vingt Sendets
Lotissement Hameau Lous Camous, soixante-quatre, cent quatre-vingt-dix Méritein
Rue La Carrère, Arthez-de-Béarn
Rue Benoît Barou à Laruns
trois lotissement Layerez
Avenue Mgr Mugabure au numéro trente et un
seize rue du Theâtre, soixante-quatre mille sept cents Hendaye
cinquante-neuf chemin Lauronce, soixante-quatre, deux cent quatre-vingt-dix, Estialescq
quatre cent cinquante-cinq chemin de Seigné, soixante-quatre, trois cents à Saint-Girons-en-Béarn
Chemin de Parenties, soixante-quatre mille trois cent quatre-vingt-dix Guinarthe-Parenties
Lotissement Clos Tourne Brides, soixante-quatre, deux cent trente Arbus
Chemin Bois Rompu, Laroin
Chemin de Goyetchea à Urrugne
cent soixante-douze chemin d'Elhorria
Rue Etche Spi au numéro quatre
un avenue de Chassin, soixante-quatre mille deux cents Biarritz
deux rue Dalbarade, soixante-quatre, cinq cents, Saint-Jean-de-Luz
neuf passage Basile, soixante-quatre, trois cent soixante-dix à Arthez-de-Béarn
Chemin de la Bathorbe, soixante-quatre mille huit cents Asson
Rue de Sansu, soixante-quatre, cinq cents Saint-Jean-de-Luz
Rue de l'Infante, Hendaye
Rue Jean Marmande à Bayonne
un chemin de Crouzades
Rue des Pottoks au numéro deux
un BIS avenue de l'Impératrice, soixante-quatre mille deux cents Biarritz
cent vingt-sept route de Pomps, soixante-quatre, trois cent soixante-dix, Doazon
vingt-quatre rue du Faur Dou Paysaa, soixante-quatre, cent dix à Jurançon
Chemin d'Iturbidea, soixante-quatre mille deux cent dix Ahetze
Rue de l'Ossau, soixante-quatre, cinq cent dix Bordes
Chemin d'Iturbidenborda, Ahetze
Rue de Léger à Saint-Pierre-d'Irube
quatorze chemin de Mallardenx
Impasse du Paddock au numéro sept
trente-trois chemin Fébus, soixante-quatre mille deux cent quatre-vingt-dix Lasseubetat
deux rue Guanille, soixante-quatre, trois cents, Orthez
trente-trois route de la Canardière, soixante-quatre, deux cents à Bassussarry
Rue Elsa Triollet, soixante-quatre mille trois cent quarante Boucau
Rue Guilhaume Provençal, soixante-quatre, trois cents Orthez
Impasse du Pénin, Lons
Avenue des Frères Barthélémy à Jurançon
neuf allée Louis Bréguet
Chemin de Lalo au numéro cent trente-quatre
dix-neuf rue du Bialé, soixante-quatre mille quatre cents Moumour
dix-neuf avenue Pellot, soixante-quatre, cinq cents, Saint-Jean-de-Luz
trois impasse du Lombré, soixante-quatre, huit cents à Bénéjacq
Chemin Pargade, soixante-quatre mille deux cent trente Sauvagnon
Impasse Yoko Lekua, soixante-quatre, cinq cents Saint-Jean-de-Luz
Rue du Pic d'Anéto, Bordes
Chemin de la Castagnère à Idron
cinq allée Novion
Chemin de Pinaquy Dit Couma au numéro neuf cent quatre-vingt-dix-sept
un chemin de la Cabette, soixante-quatre mille quatre cents Saint-Goin
vingt-deux avenue de Bérasteguia, soixante-quatre, cinq cents, Ciboure
vingt-huit chemin Marca, soixante-quatre, cent dix à Saint-Faust
Rue d'Augeron, soixante-quatre mille six cents Anglet
Rue de l'Abbé Bremond, soixante-quatre, zéro zéro zéro Pau
Impasse Elizagaraia, Ustaritz
Allée Dante Antonini à Saint-Jean-de-Luz
quinze avenue Gaston Cambot
Rue du Castérot au numéro vingt-trois
trente et un lotissement Delbarre, soixante-quatre mille deux cent cinquante Cambo-les-Bains
cinquante-sept avenue du Bezet, soixante-quatre, zéro zéro zéro, Pau
quarante-neuf quartier Lamerens, soixante-quatre, cent vingt à Aïcirits-Camou-Suhast
Chemin de Cabale, soixante-quatre mille trois cents Balansun
Rue du Pont Germe, soixante-quatre, deux cent soixante Arudy
Rue de Tartillon, Anglet
Allée de Baratzeder à Saint-Jean-de-Luz
quatre cent soixante-dix chemin de Bichitola
Chemin de Martikotgain au numéro trois cents
un avenue de l'Ayguette, soixante-quatre mille cent quarante Billère
douze rue du Docteur Talamon, soixante-quatre, huit cents, Nay
un chemin Darré Fouchet, soixante-quatre, cinq cent trente à Pontacq
Rue Anglade, soixante-quatre mille deux cent soixante Buzy
Chemin Deuze, soixante-quatre, quatre cent cinquante Navailles-Angos
Route de Saint-Pe, Léren
Place du Petit Valantin à Anglet
cinq chemin des Arious
Rue Dongaitz Anaiak au numéro onze
trente-trois route de Larreule, soixante-quatre mille deux cent trente Mazerolles
vingt-sept rue Bonado, soixante-quatre, zéro zéro zéro, Pau
dix-neuf avenue du Polo, soixante-quatre, cent à Bayonne
Rue Benoit Sourigues, soixante-quatre mille cent Bayonne
Avenue Léon Heid, soixante-quatre, trois cent vingt Bizanos
Rue de Pétricot, Biarritz
Route d'Arthez de Bearn à Hagetaubin
quatre route de Labatmale
Chemin Bordaberria au numéro quatre cent cinquante-six
seize rue Capdebat, soixante-quatre mille huit cents Pardies-Piétat
huit impasse Sabarots, soixante-quatre, cent soixante-dix, Serres-Sainte-Marie
huit cent quarante-quatre chemin de Pourtaou, soixante-quatre, trois cents à Orthez
Rue Geneviève de Gaulle Anthon, soixante-quatre mille cent quarante Billère
Rue Baron de Longueil, soixante-quatre, cent quarante Billère
Chemin de Landatxoa, Urrugne
Cité des fleurs à Monein
cinq cents chemin Bergemayou
Impasse Masmontet au numéro sept
quarante et un avenue de Gaztelaia, soixante-quatre mille cent trente Chéraute
neuf rue Jules Paquier, soixante-quatre, cinq cents, Ciboure
mille sept cent quatre-vingts chemin Bindé, soixante-quatre, cent soixante à Sévignacq
Route de N'Haux, soixante-quatre mille trois cent soixante-dix Arthez-de-Béarn
Avenue du Doyen Henry Vizioz, soixante-quatre, zéro zéro zéro Pau
Allée de Montdeville, Anglet
Place Sulzbach à Urrugne
cent onze allée de Portes
Route du Bialé au numéro deux cent quarante-huit
dix-neuf route des Lanots, soixante-quatre mille deux cent trente Mazerolles
mille huit cent quatre-vingt-dix-neuf route de Chatortéguy, soixante-quatre, neuf cent quatre-vingt-dix, Urcuit
quatre avenue du Docteur Dhers, soixante-quatre, trois cents à Orthez
Rue J P Thimbaud, soixante-quatre mille trois cent quarante Boucau
Rue Orok Bat, soixante-quatre, quatre cent quatre-vingts Ustaritz
Rue Salagoity, Saint-Jean-de-Luz
Rue Erato à Anglet
douze chemin de Bernat
Voie du Lotissement Burguette au numéro quatre
quinze chemin du Bourde, soixante-quatre mille cent soixante Morlaàs
onze rue du Docteur Micé, soixante-quatre, cinq cents, Ciboure
vingt chemin Cazaubon, soixante-quatre, deux cent trente à Denguin
Boulevard Champetier de Ribes, soixante-quatre mille Pau
Allée de Peyre, soixante-quatre, six cents Anglet
Chemin Jolimon de Haraneder, Urrugne
Chemin de Devèzes à Serres-Castet
huit chemin d'Aouts Tailhats
Chemin Mouneu au numéro quatre-vingt-dix
cinquante-six chemin d'Haïspoure, soixante-quatre mille deux cent dix Guéthary
dix-neuf chemin de Parlamentia, soixante-quatre, deux cent dix, Bidart
cinquante routé de Bayonne, soixante-quatre, trois cents à Orthez
Rue Nogué, soixante-quatre mille Pau
Chemin de Langlès, soixante-quatre, cent soixante Buros
Rue Guitte, Moumour
Rue Lore Landa à Bidart
deux chemin de la Monjoie
Boulevard Henri Laclau au numéro un A
quatre avenue des Cimes, soixante-quatre mille cent soixante Morlaàs
huit rue Paul Mirat, soixante-quatre, zéro zéro zéro, Pau
quatre avenue Jean Darrigrand, soixante-quatre, cent à Bayonne
Chemin du Gabas, soixante-quatre mille cent soixante Espéchède
Rue du Bourg Neuf Claa, soixante-quatre, quatre cent quarante Laruns
Chemin du Serrot, Angous
Rue Adrien Camy-Peyret à Bizanos
quatre route de Buros
Rue Emile Casamayor Dufaur au numéro cinq
quatre cent quatre-vingts chemin de Mountargou, soixante-quatre mille trois cents Bonnut
cinq allée Caparocenia, soixante-quatre, cinq cents, Ciboure
un chemin Morlanne, soixante-quatre, cent soixante à Saint-Castin
Chemin du Trinquet, soixante-quatre mille deux cent dix Guéthary
Impasse du Cournau, soixante-quatre, deux cent trente Sauvagnon
Chemin du Grand Basque, Bayonne
Chemin de Berhartia à Cambo-les-Bains
vingt-quatre rue de l'Azerque
Allée Louis Victor Gabriac au numéro un
six cent cinquante chemin Berdot, soixante-quatre mille cent soixante Sévignacq
un chemin Carrere, soixante-quatre, huit cents, Coarraze
cinq rue Uralde, soixante-quatre, neuf cent quatre-vingt-dix à Saint-Pierre-d'Irube
Avenue Pierre Larramendy, soixante-quatre mille cinq cents Saint-Jean-de-Luz
Lotissement Amatchi, soixante-quatre, trois cent vingt Sendets
Allée de Bécadine, Bayonne
Clos Plein Sud à Ousse
six rue Larralde
Rue François Turnaco au numéro neuf
trois rue de la Vallée de l'Ousse, soixante-quatre mille quatre cent vingt Artigueloutan
quatre avenue des Trois Couronnes, soixante-quatre, deux cents, Biarritz
trois impasse du Pic d'Ossau, soixante-quatre, zéro zéro zéro à Pau
Rue Saint-André Hubert Fournier, soixante-quatre mille quatre cent quatre-vingts Ustaritz
Allée Sofia, soixante-quatre, six cents Anglet
Impasse Arriu de Pale, Siros
Impasse de Purguko Teilaberriak à Ustaritz
seize rue du Cap de Lalanne
Allée du Balaing au numéro un
trois impasse de Pagnet, soixante-quatre mille quatre cent soixante Maure
un pL DE GAULLE, soixante-quatre, cent, Bayonne
trente-cinq chemin Portugal, soixante-quatre, deux cent quatre-vingt-dix à Lasseubetat
Passage de Numa, soixante-quatre mille six cents Anglet
Chemin de Corroal Baïta, soixante-quatre, cent vingt-deux Urrugne
Rue de Barchalot, Biarritz
Impasse Alessandro Volta à Lescar
soixante rue de Sègues
Rue Bernède au numéro six
cinq cent soixante-deux chemin de Laslannes, soixante-quatre mille trois cents Orthez
huit avenue du Bayle, soixante-quatre, cent, Bayonne
dix-sept impasse de Landa Handi, soixante-quatre, quatre cent quatre-vingts à Ustaritz
Chemin de Lacamie, soixante-quatre mille cinq cent trente Ger
Rue du Marcot, soixante-quatre, cinq cent dix Bordes
Rue de Lavigerie, Biarritz
Route Départementale N° trois à Arcangues
onze rue Ramuntcho
Chemin Teillatubaïta au numéro cinq cent soixante-quinze
trois chemin Prive de l'Observatoire, soixante-quatre mille cent soixante Saint-Castin
cinq rue Joseph Szydlowski, soixante-quatre, cent, Bayonne
quarante-deux chemin de Bahetenea, soixante-quatre, quatre cent quatre-vingts à Ustaritz
Place André Emlinger, soixante-quatre mille cent Bayonne
Chemin d'Ahontz Berroa, soixante-quatre, deux cent dix Guéthary
Rue de Luyet, Bugnein
Chemin Aguerria à Urcuit
dix rue Edmond Sée
Chemin de Gaztenalde au numéro quatre cent dix-huit
neuf rue Simin Palay, soixante-quatre mille Pau
cent quatre-vingts chemin Sagardoyhegui, soixante-quatre, cent trente, Barcus
cinq rue René Cuzacq, soixante-quatre, cent à Bayonne
Rue du Colonel de Laveaucoupet, soixante-quatre mille cinq cents Saint-Jean-de-Luz
Rue Adrien Lahourcade, soixante-quatre, deux cent dix Guéthary
Rue Raymond Sedze, Abos
Rue Arnaud Massy à Ciboure
trente et un chemin Isabé
Allée de la Petite Borde au numéro quatre
trois rue Yan de Guichot, soixante-quatre mille Pau
quinze chemin du Pont de la Bigue, soixante-quatre, quatre cents, Eysus
seize rue d'Aguerria, soixante-quatre, sept cents à Hendaye
Lotissement Hameau des Sources, soixante-quatre mille quatre cent vingt Artigueloutan
Rue de Masure, soixante-quatre, cent Bayonne
Route des Vicomtes de Sault, Hasparren
Place Camps à Louvie-Juzon
dix-sept rue Dominique Fontan
Camin deu Mouret au numéro mille quarante-cinq
vingt et un chemin Gaïneko Bidea, soixante-quatre mille cinq cents Saint-Jean-de-Luz
cent dix route de Saint-Pée-sur-Nivelle, soixante-quatre, deux cent cinquante, Souraïde
