dix-neuf rue Paul et François Vasseur, soixante-deux mille deux cent trente-deux Annezin
quarante-trois rue Alfred Wattiez, soixante-deux, deux cent dix-huit, Loison-sous-Lens
six BIS rue Michel de Boncourt, soixante-deux, trois cent soixante à Condette
Domaine du Moulin, soixante-deux mille cent quatre-vingts Rang-du-Fliers
Rue André Gerschel, soixante-deux, cent Calais
Quai Gustave Lamarle, Calais
Boulevard Blanchard à Guînes
douze rue Tour Notre-Dame
Rue Bréguet au numéro cinq
quatorze rue du Général Humbert, soixante-deux mille cent cinquante Houdain
cent cinquante-six route d'Etienville, soixante-deux, deux cent cinquante, Leubringhen
trente-quatre rue Gustave Lampin, soixante-deux, huit cents à Liévin
Résidence Le Moulin, soixante-deux mille huit cent quarante Sailly-sur-la-Lys
Boulevard de la Cité deux, soixante-deux, cent soixante Bully-les-Mines
Rue du Fort à Puces, Guemps
Rue de Camiers à Étaples
quarante-six rue d'Aire-sur-la-Lys
Chemin de la Marie Madeleine au numéro six
six rue Caillette, soixante-deux mille cent Calais
vingt-deux résidence Pierre Mendes France, soixante-deux, six cents, Berck
dix-sept rue des Jours Heureux, soixante-deux, cent soixante à Grenay
Rue Baptiste Poulain, soixante-deux mille cent vingt-sept Tincques
Route d'Escalles, soixante-deux, deux cent trente et un Peuplingues
Avenue Andreï Sakharov, Le Touquet-Paris-Plage
Place Henri et Christ Collette à Licques
cinq cent dix-neuf C rue de la Nostraeten
Rue du Chemin d'Août au numéro cent cinquante et un
sept rue de la Dime Royale, soixante-deux mille huit cents Liévin
quarante-cinq avion, soixante-deux, deux cent dix, Avion
quatre rue de la Neuve Terre, soixante-deux, huit cent soixante à Sauchy-Cauchy
Rue de Recques, soixante-deux mille six cent trente Longvilliers
Rue Victor Genel, soixante-deux, quatre cents Locon
Rue Marcial, Lottinghen
Résidence les Pinsons à La Capelle-lès-Boulogne
quarante et un rue Pierre Rivet
Residence Les Arts au numéro dix-huit
deux cent quarante-neuf route Nationale Berthem, soixante-deux mille trois cent soixante-dix Zutkerque
quarante-huit rue d'Escardes, soixante-deux, trois cent soixante-dix, Audruicq
seize rue de Vedringhem, soixante-deux, trois cent quatre-vingts à Wavrans-sur-l'Aa
Rue Felix Adam, soixante-deux mille deux cents Boulogne-sur-Mer
Rue de Ervillers, soixante-deux, cent vingt-huit Hénin-sur-Cojeul
Voie Communale Res La Roseraie, Beaurains
Rue de Mourmelon à Courcelles-lès-Lens
cinq résidence La Courtillière
Rue François Mirnick au numéro trente-neuf
trois rue du Docteur Brassart, soixante-deux mille Arras
quarante-neuf rue d'Ambleteuse, soixante-deux, deux cents, Boulogne-sur-Mer
soixante-deux rue de l'Estracelle, soixante-deux, six cent soixante à Beuvry
Rue François Lefebvre, soixante-deux mille deux cent dix Avion
Rue Roland Sergeant, soixante-deux, huit cent quatre-vingts Pont-à-Vendin
Rue d'Houlouve, Wimille
Rue Molonne à Ablain-Saint-Nazaire
quinze rue de Roeux
Rue du Val d'Anchin au numéro quatre-vingt-treize
cinq rue de Vélu, soixante-deux mille cent vingt-quatre Lebucquière
vingt rue de Muret, soixante-deux, trois cent vingt, Rouvroy
quinze rue Léona Occre, soixante-deux, six cent quatre-vingt-dix à Aubigny-en-Artois
Rue de l'Epissotte, soixante-deux mille deux cent quatre-vingts Saint-Martin-Boulogne
Résidence de la Verte Vallée, soixante-deux, cent vingt-six Conteville-lès-Boulogne
Chemin des Échevins, Mont-Bernanchon
Rue François Baucourt à Annay
trois place Jehan d'Aire
Rue Oscar Bréhon au numéro trois cent dix-huit
soixante-douze ruelle Binot, soixante-deux mille trois cent cinquante Robecq
dix rue Guy Lux, soixante-deux, quatre cent soixante, Divion
neuf rue Crespin, soixante-deux, cent à Calais
Voie du Simplon, soixante-deux mille deux cent dix-sept Beaurains
Allée Jules Poutas, soixante-deux, zéro zéro zéro Arras
Rue Henri Darre, Béthune
Rue Albert Saussez à Drocourt
deux cent quatre-vingt-quinze route d'Alembon
Rue Joseph Foulon au numéro un
seize rue Marcel Dandré, soixante-deux mille deux cent dix Avion
dix-neuf rue de Saint-Exupéry Les Ormes, soixante-deux, cinq cents, Saint-Omer
cent quatre rue du Watergang, soixante-deux, six cent dix à Brêmes
Chemin de la Raperie, soixante-deux mille cent vingt Aire-sur-la-Lys
Rue Emery Bulcourt, soixante-deux, huit cent quatre-vingts Annay
Rue de l'Abbayette, Anzin-Saint-Aubin
Faubourg Le Faubourg à Izel-lès-Hameau
dix-huit rue de Warnes
Rue du Beau Rivage Assinghem au numéro soixante-sept
vingt-trois rue du Vaudieu, soixante-deux mille cent cinquante et un Burbure
deux rue de Duisbourg, soixante-deux, cent, Calais
cinquante-huit allée de Marseille, soixante-deux, sept cent quatre-vingts à Cucq
Rue Pierre Lecoeuche, soixante-deux mille cent trente-huit Violaines
Rue François Sailly, soixante-deux, cent soixante-dix Écuires
Rue Basse du Marais, Ruminghem
Rue Tailliandier à Souchez
cinq rue Charles Cazin
Route de la Slack au numéro quatre
dix impasse Boucher de Perthes, soixante-deux mille deux cents Boulogne-sur-Mer
neuf rue de Boyeffles, soixante-deux, cent soixante, Aix-Noulette
quatre-vingts rue de Flandre-Dunkerque, soixante-deux, trois cents à Lens
Rue de Turkève, soixante-deux mille deux cent soixante Auchel
Résidence Casimir Gressier, soixante-deux, trois cent quatre-vingts Lumbres
Chemin de Pihem, Hallines
Rue Le Sénéchal à Wingles
vingt-trois rue Jean Druon
Rue Joseph Facq au numéro trente
quatre voie du Forez, soixante-deux mille deux cent dix-sept Beaurains
vingt et un rue Paul Lefebvre, soixante-deux, cent vingt, Campagne-lès-Wardrecques
onze rue Jean Molinet, soixante-deux, deux cents à Boulogne-sur-Mer
Square Paul Camphin, soixante-deux mille deux cent dix-sept Achicourt
Avenue Princesse Louise, soixante-deux, cent cinquante-deux Neufchâtel-Hardelot
Rue Albert Vermaelen, Auxi-le-Château
Route de Waldam à Oye-Plage
seize rue Plate
Rue de la Preuse au numéro treize
sept rue de Boubers, soixante-deux mille deux cent soixante-dix Nuncq-Hautecôte
sept rue du Docteur Trézéguet, soixante-deux, trois cent quatre-vingts, Lumbres
quatre rue Alexandre Maniez, soixante-deux, sept cent cinquante à Loos-en-Gohelle
Rue de Mailly-Mallet, soixante-deux mille cent seize Puisieux
Rue du Pot-au-Feu, soixante-deux, deux cent quarante Wirwignes
Rue Pierre Boutrouille, Oisy-le-Verger
Rue de Cochendal à Quiestède
dix-huit rue de Quiéry
Chemin André Ballekens Prolongé au numéro cent sept
un rue de Sorrus, soixante-deux mille cent soixante-dix Campigneulles-les-Petites
huit rue de Berles, soixante-deux, cent vingt-trois, Bailleulval
quatre route De Saint-Omer, soixante-deux, huit cent cinquante à Alquines
Rue Emile Nempont, soixante-deux mille six cent trente Étaples
Rue du Lieutenant Jules Grébaut, soixante-deux, deux cent trente-deux Annezin
Route de Desvres, Saint-Martin-Boulogne
Rue du Pré des Sœurs à Béthune
quatre BIS avenue de l'Amiral Tourville
Rue Sans Binot au numéro un
soixante-seize rue du Hameau Merlin, soixante-deux mille deux cent quarante Selles
dix-huit place Crèvecoeur, soixante-deux, cent, Calais
quatorze rue Marcel Rosey, soixante-deux, six cent trente à Étaples
Rua Marcel Grébaut, soixante-deux mille deux cent soixante Cauchy-à-la-Tour
Rue Henri Puype, soixante-deux, cinq cent dix Arques
Rue du Château de la Côte, Longuenesse
Rue de Mannequebeurre à Sainte-Marie-Kerque
sept résidence du Soir Paisible
Allée des Setrières au numéro douze
soixante-seize quai de la Gendarmerie, soixante-deux mille cent Calais
huit rue Sosthene Lacroix, soixante-deux, quatre cent dix, Wingles
cinq rue de Wissocq, soixante-deux, cinq cents à Saint-Omer
Rue Robert Brandin, soixante-deux mille cinq cent cinquante Floringhem
Rue Pepin, soixante-deux, quatre cents Béthune
Cité des Trois Fontaines, Sainte-Catherine
Chemin à Charrettes à Leulinghem
seize BIS rue du Wetz
Rue Henri Béthouart au numéro sept cent soixante-neuf
trois rue de Ribecourt, soixante-deux mille cent quarante-sept Havrincourt
dix rue du Pré Lorette, soixante-deux, six cent quatre-vingt-dix, Camblain-l'Abbé
neuf domaine Carabin, soixante-deux, cent quatre-vingts à Rang-du-Fliers
Rue du quatre-vingt-huit e RI, soixante-deux mille deux cent vingt-trois Roclincourt
Rue Neuve du Rietz, soixante-deux, zéro zéro zéro Arras
Route de Divion, Houdain
Route des Aulnes à Henneveux
quatorze allée Louis Bouclet
Rue Louis Bouquet au numéro cent trente-quatre
cent soixante et un rue de la Commandance, soixante-deux mille trois cent quarante Guînes
trois A rue Machue, soixante-deux, huit cent quatre-vingt-dix, Bonningues-lès-Ardres
vingt-deux rue des Grosses Bornes, soixante-deux, cent douze à Corbehem
Rue du Capitaine Ferber, soixante-deux mille cent Calais
Rue de la Digue de Calais, soixante-deux, cent soixante-deux Vieille-Église
Rue de Billy-Montigny, Sallaumines
Rue Eugène Canu à Boulogne-sur-Mer
un rue Roger Marechal
Rue de Fauquembergues au numéro trente-huit
cent quatre rue de la Coupignies, soixante-deux mille quatre cent dix Wingles
quarante et un résidence H Dunant Rue Croix Rouge, soixante-deux, huit cents, Liévin
cent vingt-deux rue Jules Marmottan, soixante-deux, sept cents à Bruay-la-Buissière
Rue Clotaire, soixante-deux mille huit cents Liévin
Résidence Domaine d'Athéas, soixante-deux, deux cent vingt-trois Athies
Avenue Philippe Lebas, Frévent
Rue de l'Ecluse Carrée aux Attaques
quatre rue Pierre Poutrain
Rue de la Calique au numéro cent soixante-quinze
quatre-vingt-trois rue Roger Grébert, soixante-deux mille sept cents Bruay-la-Buissière
quarante-neuf impasse Vendeville, soixante-deux, sept cent cinquante, Loos-en-Gohelle
quarante-trois rue d'Aire Prolongée, soixante-deux, quatre cents à Béthune
Rue Pierre-Ange Romain, soixante-deux mille cent vingt-six Wimille
Rue de Belval, soixante-deux, cent trente Hernicourt
Rue d'Oesbern, Locon
Résidence Huplandre à La Capelle-lès-Boulogne
dix-sept rue des Garinelles
Route de Clairmarais au numéro quarante-neuf
vingt-neuf rue La Bruyére, soixante-deux mille cent soixante Bully-les-Mines
trois rue de la Symphorine, soixante-deux, neuf cent trente, Wimereux
quatorze rue de l'Escoterie, soixante-deux, cinq cents à Saint-Omer
Place de Cercamp, soixante-deux mille deux cent soixante-dix Frévent
Résidence Ham de Neuville, soixante-deux, cent cinquante-trois Souchez
Rue de Rosamel, Frencq
Rue Isidore Fougère à Hénin-Beaumont
dix-neuf rue Monseigneur Haffreingue
Rue Rohart Courtin au numéro huit
huit résidence le Village du Golf, soixante-deux mille quatre cent soixante-dix Calonne-Ricouart
quatre rue Edouard Froissart, soixante-deux, trois cents, Lens
six rue Henri Duquesne, soixante-deux, neuf cent quatre-vingts à Vermelles
Allée Comtesse Mahaut d'Artois, soixante-deux mille sept cents Bruay-la-Buissière
Rue Albert Bécard, soixante-deux, deux cent vingt-quatre Équihen-Plage
Route de Maroeuil, Mont-Saint-Éloi
Chemin du Bois du Biez à Lorgies
dix-sept rue du Docteur Breynaert
Rue du Triaumont au numéro trente et un
soixante et un rue de Diéval, soixante-deux mille cent cinquante Bajus
cinquante-sept rue des Franciscaines, soixante-deux, deux cent trente et un, Sangatte
quatre cent quatre-vingt-cinq avenue des Églantines, soixante-deux, cent soixante-seize à Camiers
Rue Louis Duquesne, soixante-deux mille quatre cents Locon
Grand Place Grande Place, soixante-deux, huit cent quarante Laventie
Chemin d'Audembert, Leubringhen
Rue de la Dévallonne à Chocques
dix-huit boulevard de la Fosse n°quatre
Rue des Frères Dubaele au numéro deux
deux cent trente-trois rue Jules Dumon, soixante-deux mille cent soixante-deux Saint-Omer-Capelle
neuf impasse du Chapelet, soixante-deux, cinq cents, Saint-Omer
dix-neuf rue Chante aux Vents, soixante-deux, cent soixante-seize à Camiers
Rue des Prés de Mincques, soixante-deux mille trois cent cinquante Calonne-sur-la-Lys
Chemin de la Houblonnerie, soixante-deux, deux cent quarante Crémarest
Rue Malbrancq Wissocq, Saint-Omer
Avenue du Groupe Lorraine à Brebières
un ruelle de Brailly
Rue du Vieil Houdain au numéro vingt
deux rue des Baudets, soixante-deux mille quatre cent cinquante Le Transloy
six cent quarante-trois route de Baincthun, soixante-deux, trois cent soixante, Echinghen
vingt-huit rue Émile Chrétien, soixante-deux, sept cents à Bruay-la-Buissière
Rue Jerzy Popieluszko, soixante-deux mille quatre cents Béthune
Hameau des Lièvres, soixante-deux, deux cent vingt-trois Saint-Nicolas
Rue Agadir, Calais
Rue Hochedez à Pont-à-Vendin
dix rue du Grand Hôtel
Rue Camille Enlart au numéro cent quarante-deux
sept route Nationale quarante-trois, soixante-deux mille cinq cents Tilques
cinquante rue Basse Boulogne, soixante-deux, cent quarante-neuf, Cambrin
soixante-douze rue de Licques, soixante-deux, huit cent quatre-vingt-dix à Bonningues-lès-Ardres
Rue du Mont Hulain, soixante-deux mille cent quarante Fressin
Route Aubengue, soixante-deux, neuf cent trente Wimereux
Boulevard Jacques Lefebvre, Étaples
Rue Georges Grivel à Auchy-lès-Hesdin
quarante-quatre rue de Villers-au-Bois
Rue de Wy au numéro quatorze
cent cinquante-six rue de Saternault, soixante-deux mille cent cinquante-huit Saulty
huit rue Henri Quéval, soixante-deux, cent, Calais
neuf rue des Perroquets, soixante-deux, cent soixante à Aix-Noulette
Rue de la Moulière, soixante-deux mille trois cent quatre-vingts Remilly-Wirquin
Rue de Lattre, soixante-deux, trois cent quatre-vingt-dix Vaulx
Rue Edouard Dépret, Avion
Rue des Chauds Fourneaux à Sailly-sur-la-Lys
trois cent soixante-six rue de Cauchie
Chemin des Plantis au numéro trente-cinq
dix-sept chemin d'en Bas, soixante-deux mille cent vingt Quiestède
dix-huit rue des Glattignies, soixante-deux, huit cent quarante, Fleurbaix
dix-neuf rue Cagin Penel, soixante-deux, cent cinquante-neuf à Vaulx-Vraucourt
Rue des Saucelles, soixante-deux mille six cent quarante Montigny-en-Gohelle
Rue du London Scottish, soixante-deux, zéro zéro zéro Dainville
Allée Alexandre Line, Boulogne-sur-Mer
Rue Édouard Singer à Labourse
treize rue Raymond Dupuich
Rue Wallet au numéro vingt-six
dix-huit rue Philippe Auguste Jeanron, soixante-deux mille deux cents Boulogne-sur-Mer
cinquante-deux rue des Blancs Chiens, soixante-deux, cent trente-six, Richebourg
dix-huit avenue Moitier, soixante-deux, huit cent soixante-dix à Campagne-lès-Hesdin
Rue Mathieu Orfila, soixante-deux mille Arras
Résidence Simone Delahodde, soixante-deux, cinq cents Saint-Martin-au-Laërt
Route de Fruges, Boubers-lès-Hesmond
Rue du Moulin Bon à Blendecques
huit route de Carency
Route de la Menandelle au numéro un
trente rue Albert Duplouy, soixante-deux mille quatre cent soixante Divion
trente-sept rue du Seigneur de Gourdan, soixante-deux, cent, Calais
un rue d'Ostreville, soixante-deux, cent trente à La Thieuloye
Rue Couderousse, soixante-deux mille deux cent cinquante Landrethun-le-Nord
Rue du Blockhaus, soixante-deux, cent trente Siracourt
Ruelle Mitan, Buire-le-Sec
Rue Gation à Ivergny
cinq rue Gilbert Romme
Esplanade du Mal Leclerc au numéro huit
deux BIS rue Joseph Hay, soixante-deux mille deux cent vingt et un Noyelles-sous-Lens
dix résidence de Lorette, soixante-deux, neuf cent quatre-vingts, Vermelles
trois voie Notre-Dame de Lorette, soixante-deux, zéro zéro zéro à Arras
Rue de Gosnay, soixante-deux mille deux cent trente-deux Fouquereuil
Rue au Sable, soixante-deux, cent soixante-dix-neuf Wissant
Rue Brazza, Lens
Rue de Barly à Fosseux
dix-sept impasse Plateau
Rue Paul Daumont au numéro quatre-vingt-trois
sept D rue du Pont à Ham, soixante-deux mille cent vingt Quiestède
deux cent seize avenue Roland Huguet, soixante-deux, cinq cent soixante, Fauquembergues
huit rue Pierre-Ignace Corroyer, soixante-deux, quatre cent quarante à Harnes
Rue de Verdrel, soixante-deux mille cinq cent trente Servins
Chemin du Premier Banc, soixante-deux, trois cent quarante Guînes
Rue André Deprez, Harnes
Rue de Vaudricourt à Bruay-la-Buissière
vingt-neuf rue John Whitley
Résidence Jehan de Marigny au numéro trois
sept rue Claude Fournier, soixante-deux mille quatre cent quarante Harnes
quatre-vingt-deux rue des Têtu, soixante-deux, sept cent quatre-vingts, Cucq
cinq cent quatre-vingt-neuf route du Haut Loquin, soixante-deux, huit cent cinquante à Rebergues
Rue d'Houvelin, soixante-deux mille cent cinquante Bajus
Impasse de la Rue de la Gare, soixante-deux, neuf cent vingt Chocques
Rue de Doudeville, Noyelles-sous-Lens
Rue Coteaux de l'Aa Res Hamel à Fauquembergues
vingt-trois rue de Féture
Rue de Ruitz au numéro deux
dix mille neuf cent quatre-vingt-onze rue d'Eperlecques, soixante-deux mille neuf cent dix Bayenghem-lès-Éperlecques
trois rue Martin d'Ostrel, soixante-deux, cent vingt-sept, Magnicourt-en-Comte
quarante rue Mont Jean, soixante-deux, trois cent quarante à Bonningues-lès-Calais
Rue Edmond Dumont, soixante-deux mille deux cent quatre-vingts Saint-Martin-Boulogne
Route de Doullens, soixante-deux, zéro zéro zéro Dainville
Rue du Beau Rietz, Lorgies
Rue du Fort Montplaisir à Boulogne-sur-Mer
sept TER petit Chemin des Augustines
Rue du Beurre Fondu au numéro trois
deux rue Florian Delcroix, soixante-deux mille quatre cent cinquante Bapaume
trente-neuf boulevard du Docteur Jules Pouget, soixante-deux, cinq cent vingt, Le Touquet-Paris-Plage
cinquante-deux rue du Guit, soixante-deux, cinq cent cinquante à Pernes
Rue Umberto Tomasi, soixante-deux mille huit cent quatre-vingts Pont-à-Vendin
Rue de Créville, soixante-deux, cinq cent soixante Audincthun
Rue de Graincourt, Havrincourt
Impasse Saint-Pierre et Miquelon à Marck
trente-sept rue des Frères Camus
Rue Constant Lequeux au numéro dix-neuf
seize chemin du Petit Lambus, soixante-deux mille cent quarante Mouriez
cent trente-cinq impasse du Fort Batard, soixante-deux, trois cent soixante-dix, Audruicq
deux cent neuf lotissement Les Abrets, soixante-deux, six cent dix à Rodelinghem
Rue du Moulin Jérome, soixante-deux mille Dainville
Place du Poillevelt, soixante-deux, trois cent soixante-dix Audruicq
Rue Léon Théry, Saint-Martin-Boulogne
Rue de Bomy à Reclinghem
quinze résidence Pierre Bérégovoy
Cité du Carreau au numéro quatorze
quatre rue Henri Boussoutrot, soixante-deux mille huit cents Liévin
quatre cent cinq rue Paul Lemaître, soixante-deux, sept cent quatre-vingts, Cucq
dix rue du Bas Ruisseau, soixante-deux, deux cent quarante à Saint-Martin-Choquel
Avenue Belle Dune, soixante-deux mille cinq cent vingt Le Touquet-Paris-Plage
Rue Balain, soixante-deux, cent trente-deux Caffiers
Chemin du Bois de Souverain Moulin, Wimille
Impasse de l'Oduel à Aire-sur-la-Lys
trente rue Schumann
Rue du Pont de Grès au numéro trois cent cinquante-six
quarante-sept avenue d'Amiens, soixante-deux mille deux cent dix-sept Beaurains
soixante esplanade Parmentier, soixante-deux, six cents, Berck
vingt-huit boulevard du Chatillon, soixante-deux, deux cents à Boulogne-sur-Mer
Rue du Faubourg d'Aval, soixante-deux mille cent quatre-vingt-dix Lillers
Résidence de la Reine des Pres, soixante-deux, sept cent soixante-dix Auchy-lès-Hesdin
Rue Raymond Sulliger, Méricourt
Rue de la Vieille Bombe à Neuve-Chapelle
cinquante-trois rue Gustave Souquet
Rue Victor Gressier au numéro sept
quatre boulevard Domont, soixante-deux mille cent quarante Hesdin
trente-huit rue du Vincq, soixante-deux, neuf cent dix, Houlle
quatorze chemin d'Ardequin, soixante-deux, deux cent vingt à Carvin
Rue de Bailleulval, soixante-deux mille cent vingt-trois Berles-au-Bois
Rue Jean Lefrancq, soixante-deux, quatre cents Locon
Passerelle du Théâtre, Montreuil
Rue de Coupelle Vieille à Verchocq
quatre rue d'Hendecourt
Rue d'Esquerdes au numéro deux
quarante-trois rue de l'Abbé Léon Guerlet, soixante-deux mille huit cent quatre-vingt-dix Tournehem-sur-la-Hem
quinze rue d'Hérimel, soixante-deux, trois cent soixante, Baincthun
quarante-quatre rue Jean Lennes, soixante-deux, trois cent vingt à Acheville
Avenue du Gassion, soixante-deux mille cent quarante Hesdin
Boulevard Thierry Sabine, soixante-deux, cinq cent vingt Le Touquet-Paris-Plage
Place des Mines, Drocourt
Rue Deladiénnée à Ourton
quatre résidence les Tilleuls
Route de Questrecques au numéro quatre
quatre rue des Cagniers, soixante-deux mille cinq cent soixante Coyecques
deux cent vingt-six boulevard Sarraz Bournet, soixante-deux, quatre cent quatre-vingts, Le Portel
soixante-deux allée Talma, soixante-deux, deux cents à Boulogne-sur-Mer
Rue René Lannoy, soixante-deux mille deux cent dix Avion
Rue Gustave Lecointe, soixante-deux, six cent quarante Montigny-en-Gohelle
Rue de Zelucq, Tubersent
Ruelle des Grelets à Haillicourt
trente-deux allée Achille Caron
Place Hagimont au numéro quatre
dix-huit A rue de Villers-Brûlin, soixante-deux mille cent vingt-sept Tincques
deux rue Cathelinette, soixante-deux, trois cent quatre-vingts, Acquin-Westbécourt
cent quatre-vingt-dix-huit rue Henri et Florentin Meresse, soixante-deux, cent quarante et un à Évin-Malmaison
Rue de Moustier, soixante-deux mille deux cent soixante Auchel
Rue de la Gare d'Harnes, soixante-deux, sept cent dix Courrières
Allée Angot, Liévin
Avenue Lucien Dufour à Cucq
sept cent soixante rue du Cent Trois
Rue de Berlencourt au numéro treize
quatre rue Jérôme France, soixante-deux mille neuf cent cinquante Noyelles-Godault
dix rue d'Happe, soixante-deux, six cent cinquante, Campagne-lès-Boulonnais
dix rue d'Avesnes-sur-Helpe, soixante-deux, quatre cent trente à Sallaumines
Lotissement de l'Aa, soixante-deux mille trois cent quatre-vingts Setques
Résidence Le Quesnoy, soixante-deux, huit cent quarante Sailly-sur-la-Lys
Rue François Delattre, Harnes
Rue des Vieux Berckois à Berck
sept boulevard d'Armolis
Avenue de Saint-Quentin au numéro vingt-deux
huit rue Victor Filipic, soixante-deux mille quatre cent trente Sallaumines
sept impasse Quehen, soixante-deux, deux cents, Boulogne-sur-Mer
deux cent cinquante chemin Denoyelle, soixante-deux, cent quarante à Marconnelle
Sentier d'Haillicourt, soixante-deux mille sept cents Bruay-la-Buissière
Rue Lumière, soixante-deux, zéro zéro zéro Arras
Rue du Docteur Henri Wagon, Souchez
Rue du Zodiaque à Saint-Nicolas
vingt-six route de Marquise
Impasse du Soldat Harry Beauchamp au numéro trois
huit rue Victor Delaporte, soixante-deux mille deux cent dix-sept Achicourt
douze boulevard Einstein, soixante-deux, cent, Calais
un rue des Neuves Rues, soixante-deux, huit cent quatre-vingt-dix à Recques-sur-Hem
Résidence Éric Tabarly, soixante-deux mille huit cent quarante Sailly-sur-la-Lys
Rue de Marrakech, soixante-deux, cent Calais
Résidence la Capry, Saint-Hilaire-Cottes
Rue de Neuf-Manoir à Senlecques
seize rue du Royaume
Place Pierre Bonhomme au numéro deux A
trois rue de Ergste, soixante-deux mille cent cinquante-sept Allouagne
six cent quarante rue d'Hurtevent, soixante-deux, trois cent cinquante, Saint-Venant
huit cents le Dso de la Rue Verte, soixante-deux, cent soixante-deux à Vieille-Église
Rue de Ginchy, soixante-deux mille quatre cent cinquante Morval
Rue du Général Leclercq, soixante-deux, cent vingt et un Courcelles-le-Comte
Rue de Colombie, Bruay-la-Buissière
Rue Delalain à Sombrin
trois cent dix boulevard de Sainte-Cécile
Avenue Georges Buffon au numéro treize
trois cent trente-sept rue du Marincamp, soixante-deux mille cent quatre-vingt-dix Ames
vingt-cinq rue Louise Ball Demont, soixante-deux, cent soixante-dix-neuf, Wissant
quinze résidence du Sable, soixante-deux, cent quatre-vingt-sept à Dannes
Rue de Saint-Folquin, soixante-deux mille cent quarante-deux Henneveux
Rue Sans Sens, soixante-deux, six cent trente Étaples
Chemin des Blattiers, Libercourt
Rue du Vert Tilleul à Maisnil
cent soixante rue Joseph Bodart
Rue Taillis au numéro cent quatorze
deux cent cinquante et un rue de Connincthun, soixante-deux mille deux cent cinquante Beuvrequen
dix-neuf chemin du Malannoy, soixante-deux, cent vingt, Aire-sur-la-Lys
six rue de Mandelieu, soixante-deux, deux cent vingt à Carvin
Rue de Lecalipe, soixante-deux mille deux cent quarante Brunembert
Chemin du Manillet, soixante-deux, trois cent quatre-vingts Ouve-Wirquin
Rue Cyr Bouchart, Lapugnoy
Rue de Linzeux à Œuf-en-Ternois
onze rue du Grand Batard de Bourgogne
Rue de Guizelin au numéro quatre
six cent deux hameau de Tournes, soixante-deux mille trois cent soixante Echinghen
cinquante-deux rue Auguste Lefebvre, soixante-deux, trois cents, Lens
cinq rue du Marais Gourlet, soixante-deux, sept cent quarante à Fouquières-lès-Lens
Rue à Galettes, soixante-deux mille cent seize Puisieux
Rue van Grutten, soixante-deux, cent Calais
Rue de Targette, Méricourt
Rue Ozanam à Arras
mille trois cent cinquante-cinq rue du Brûle
Rue Jean Alphand au numéro trente-six
deux rue Bacquet, soixante-deux mille six cent vingt Maisnil-lès-Ruitz
cinquante et un rue Du Souich, soixante-deux, huit cents, Liévin
cinq route de Nuncq, soixante-deux, deux cent soixante-dix à Écoivres
Rue de la Longeville, soixante-deux mille six cent cinquante Hucqueliers
Rue du Long Chemin, soixante-deux, neuf cent dix Serques
Rue du Clivet, Preures
Square Hyppolite Renaut à Wimille
dix-huit rue Victor Gallois
Vieux Chemin Vieux Chem de Cambrai au numéro un
trente-deux rue Dambrine, soixante-deux mille Arras
vingt-trois avenue de Londres, soixante-deux, quatre cents, Béthune
quatre-vingt-quatre rue André Pezé, soixante-deux, quatre cent dix à Wingles
Rue Darnel, soixante-deux mille cent Calais
Rue du Blanc Aubert, soixante-deux, quatre cent quatre-vingt-dix Vitry-en-Artois
Rue des Ollieurs, Estevelles
Rue Clusius à Arras
vingt et un résidence Le Champêtre
Avenue Maxence Van der Meersch au numéro quatre cent vingt-six
trente-quatre chemin Ringot, soixante-deux mille trois cent cinquante Saint-Venant
trois cent vingt-cinq rue Route Nationale n°quarante-trois, soixante-deux, huit cent quatre-vingt-dix, Nordausques
