Impasse de la Champêtre, dix-huit, cent vingt Méreau
Allée de l'Aviateur Shipton, Méreau
Route de Guérigny à Vignoux-sur-Barangeon
deux impasse de Villers
Allée du Bon Marché au numéro huit
dix route de Grossouvre, dix-huit mille six cents Vereaux
trois rue du Crot Vert, dix-huit, deux cents, Meillant
onze clos de la Maladrerie, dix-huit, sept cents à Aubigny-sur-Nère
Rue des Obuses, dix-huit mille trois cents Saint-Satur
Route des Terres, dix-huit, cent Méry-sur-Cher
Place Pierre Brun, Dun-sur-Auron
Chemin du Grouillat à Morogues
sept rue de Santranges
Rue Maurice Ripoche au numéro cinq
un chemin du Riau du Lac, dix-huit mille deux cents Orcenais
deux rue Jacques Richard, dix-huit, cent, Vierzon
neuf rue du Général Weygand, dix-huit, zéro zéro zéro à Bourges
Impasse du Moulin Tintard, dix-huit mille deux cents Saint-Amand-Montrond
Rue des Cros Jaunes, dix-huit, trois cent vingt Cours-les-Barres
Rue Porte César, Sancerre
Rue Guignards à Marçais
dix-neuf BIS place Gallerand
Route d'Arpheuilles au numéro vingt-trois
cinq petite Rue du Bourdoiseau, dix-huit mille cent Vierzon
cinq impasse des Beaumonts, dix-huit, cent vingt, Preuilly
deux cent quinze rue du Puits Moreau, dix-huit, deux cent quatre-vingt-dix à Chârost
Rue Sainte-Louise, dix-huit mille Bourges
Les Chétives Maisons, dix-huit, cinq cents Foëcy
Rue Louis Charby, Saint-Caprais
Passage de l'Abricot à Vierzon
treize rue Farnaud Guichard
Chemin de la Font Morvée au numéro trois cent vingt-cinq
cinq rue Jean Baptiste Touret, dix-huit mille six cents Sancoins
trente-huit place de la Seigneurerie, dix-huit, trois cent quarante, Soye-en-Septaine
douze rue Gilbert Demay, dix-huit, cinq cents à Mehun-sur-Yèvre
Levée Bec d'Allier, dix-huit mille cent cinquante Cuffy
Impasse de la Coutrelle, dix-huit, cent quatre-vingt-dix Châteauneuf-sur-Cher
Résidence des Stuarts, Aubigny-sur-Nère
Place Jacques Brel à Saint-Amand-Montrond
trois cent trente-cinq avenue Jules Roussel
Champ de la Réserve au numéro huit
huit rue du Village Aubry, dix-huit mille cent Vierzon
quatre impasse Jean Chaumeau, dix-huit, zéro zéro zéro, Bourges
quatre route des Trois Ormes, dix-huit, quatre cents à Villeneuve-sur-Cher
Chemin des Pochettes, dix-huit mille Bourges
Rue de la Collégiale Saint-Martin, dix-huit, deux cent quarante Léré
Chemin de Haut Berri, Méreau
Allée Camille Guérin à Bourges
cinq rue du Chevalier Du Guesclin
Route de la Clouze au numéro cent soixante et onze
deux cent trente-cinq avenue de la Compagnie Surcouf, dix-huit mille deux cents Saint-Amand-Montrond
six rue des trois Maillets, dix-huit, zéro zéro zéro, Bourges
quatre cour Mauduit, dix-huit, zéro zéro zéro à Bourges
Rue de la Thaumassière, dix-huit mille Bourges
Rue Jean Montigny, dix-huit, zéro zéro zéro Bourges
Cours de l'Oratoire, Bourges
Chemin de la Folie Bâton à Bourges
six rue Hardoin Mansard
Rue Matter au numéro un BIS
deux clos des Varennes, dix-huit mille cinq cent soixante-dix La Chapelle-Saint-Ursin
deux cent quarante-six petite Rue des Fossés, dix-huit, cent quarante, Sancergues
cinq allée de la Jonchère, dix-huit, cent dix à Vasselay
Chemin du Genouillet, dix-huit mille cent vingt Quincy
Rue Hubert Delas, dix-huit, cinq cents Foëcy
Rue Étienne Soyer, Aubigny-sur-Nère
Chemin de Grand Champs à Vierzon
dix-huit route des Picardeaux
Rue des Trois Perdrix au numéro trois cent trente-deux
quatorze rue Claude Rameau, dix-huit mille trois cents Saint-Satur
dix cour des Chailloux, dix-huit, trois cents, Veaugues
douze rue des Couardes, dix-huit, deux cent quatre-vingt-dix à Civray
Rue de Lesseps, dix-huit mille quatre cent dix Argent-sur-Sauldre
Allée Henri Guillaumet, dix-huit, zéro zéro zéro Bourges
Impasse de la Croix Moreau, Vierzon
Rue Capitaine Poupat à Aubigny-sur-Nère
trois rue du Trou Jaune
Rue Jean Calas au numéro cinq
onze rue des Frères Limbourg, dix-huit mille Bourges
trois rue des Beaux-Arts, dix-huit, zéro zéro zéro, Bourges
quatre rue du Lavoir Carré, dix-huit, deux cents à Meillant
Chemin des Croupions, dix-huit mille trois cents Saint-Bouize
Chemin de Colombiers, dix-huit, cent trente Bussy
Rue d'Hamenon, Plou
Rue de Levet à Senneçay
huit chemin des Augustins
Route du Village d'en Haut au numéro un
un cour des Jacobins, dix-huit mille Bourges
huit rue du trente Avril mille neuf cent quarante-quatre, dix-huit, trois cent vingt, Beffes
quarante avenue de Gionne, dix-huit, zéro zéro zéro à Bourges
Allée Henri Gillet, dix-huit mille Bourges
Avenue du Docteur Témoin, dix-huit, quatre cents Lunery
Ruelle Bernigault, Saint-Satur
Route de Reigny à Azy
quatre chemin de l'Abreuvoir de Pignoux
Rue Étienne Desroches au numéro trente-six
deux cent quatre-vingt-douze route de Bourgneuf, dix-huit mille cent dix Saint-Martin-d'Auxigny
trois allée Napoléon trois, dix-huit, zéro zéro zéro, Bourges
seize rue Miranda d'Ebro, dix-huit, cent à Vierzon
Chemin de Pignol, dix-huit mille trois cents Sancerre
Rue de Breuilly, dix-huit, cent dix Saint-Éloy-de-Gy
Chemin de la Gravoche, Saint-Bouize
Impasse du Clou à Gron
dix rue Cyril Ashe
Rue du Capitaine Locard au numéro six
cinq place François Bailly, dix-huit mille Bourges
un chemin de la Métairie de Rozay, dix-huit, cent, Saint-Georges-sur-la-Prée
treize allée de l'Hommée, dix-huit, cent vingt à Méreau
Route des Ecorcelles, dix-huit mille deux cent vingt Brécy
Impasse du Chemin Court, dix-huit, trois cent trente Saint-Laurent
Chemin d'Houët, Lapan
Route du Tronc à Berry-Bouy
quatre place Pierre Agogue
Rue Anthony Gaulmier au numéro quatorze
quatre allée André Giraudon, dix-huit mille Bourges
dix-neuf place du Docteur Guyot, dix-huit, trois cent soixante-dix, Châteaumeillant
sept allée des Murs, dix-huit, cent vingt à Méreau
Route du Corot, dix-huit mille cent dix Vignoux-sous-les-Aix
Rue du Gué Rond, dix-huit, deux cents Bouzais
Rue de la Fontaine Saint-Marc, Aubigny-sur-Nère
Chemin du Pommier de la Fontaine à Assigny
six rue de Sauvigny
Rue des Carrouges au numéro un
cinq rue de la Vève, dix-huit mille cinq cents Vignoux-sur-Barangeon
douze allée des Renauderies, dix-huit, cent vingt, Méreau
trois chemin du Danjon, dix-huit, cent dix à Saint-Éloy-de-Gy
Impasse Saint-Lazare, dix-huit mille cent soixante Lignières
Chemin des Petites Chaumes, dix-huit, cinq cents Sainte-Thorette
Chemin des Crèles, Vierzon
Rue des Amours à Menetou-Salon
quatre-vingt-deux allée Grands Crets
Route de Migny au numéro deux
deux cours du Bois Lopineau, dix-huit mille Bourges
treize rue Firmin Boulanger, dix-huit, deux cent vingt, Les Aix-d'Angillon
douze rue de la Pierre Bure, dix-huit, cent trente à Dun-sur-Auron
Cours de l'Aujonnières, dix-huit mille Bourges
Rue des Ramines, dix-huit, deux cent vingt Les Aix-d'Angillon
Route du Grand Malleray, Primelles
Route de Fontenette à Vignoux-sur-Barangeon
un rue du Moulin de la Font
Route de Plaimpied au numéro deux
onze passage du Bourdoiseau, dix-huit mille cent Vierzon
soixante-sept chemin des Chapitres, dix-huit, deux cents, Arpheuilles
huit cent quatorze impasse des Rouettes, dix-huit, trois cent soixante-dix à Châteaumeillant
Avenue Alphonse Dumez, dix-huit mille quatre cents Lunery
Rue de Loudin, dix-huit, cent quarante Précy
Route de Neuilly en Sancerre, La Chapelotte
Impasse de la Beuillerie à Foëcy
six impasse Karl Marx
Allée Henri Sallé au numéro douze
onze rue Peschereau, dix-huit mille Bourges
cinq impasse des Crots, dix-huit, trois cent vingt, Jouet-sur-l'Aubois
six hameau Les Marguerites, dix-huit, deux cents à Colombiers
Rue Pierre et Jane Boiteau, dix-huit mille Bourges
Rue Brivault, dix-huit, deux cent quatre-vingt-dix Chârost
Route de Montboulin, Saint-Martin-d'Auxigny
Impasse du Beugnon à Méreau
trois chemin des Tains Nains
Allée Émile Antoine Bourdelle au numéro huit
onze chemin de la Grande Cheminée, dix-huit mille cent dix Saint-Martin-d'Auxigny
un cours des Jardiniers, dix-huit, deux cents, La Celle
trois rue de Sinay, dix-huit, deux cent trente à Saint-Doulchard
Chemin des Blanchisseuses, dix-huit mille trois cents Sancerre
Chemin de Biou, dix-huit, trois cent quarante Crosses
Rue Phalier, Saint-Outrille
Chemin des Gallerands à Bessais-le-Fromental
dix route de Vatan
Chemin de l'Ancien Bourg au numéro cinq
trois rue de Jars, dix-huit mille deux cent soixante Sury-ès-Bois
cinq cours Croix de Bois, dix-huit, zéro zéro zéro, Bourges
quinze rue de la Fontaine Saint-Clair, dix-huit, deux cents à La Celle
Rue de la Chaume Fleury, dix-huit mille trois cent quarante Senneçay
Chemin de la Baraterie, dix-huit, cent soixante Lignières
Rue Pet Aujonnière, Bourges
Rue des Sentes de Barmont à Mehun-sur-Yèvre
sept impasse du Sauvignon
Chemin Planches au numéro neuf
un chemin des Canichons, dix-huit mille deux cent dix Bessais-le-Fromental
quarante et un chemin de Gratin, dix-huit, cent trente, Dun-sur-Auron
un impasse de la Tanière, dix-huit, deux cent soixante-dix à Culan
Rue de Milandre, dix-huit mille deux cent quatre-vingt-dix Chârost
Rue A Massicard, dix-huit, trois cent soixante-dix Châteaumeillant
Cour Barbarin, Bourges
Route du Vivier à Léré
trois rue des Ruchers
Rue de la Charboyaterie au numéro six
trois chemin de la Gimonette, dix-huit mille cent quatre-vingt-dix Corquoy
deux allée Jacques Ange Gabriel, dix-huit, zéro zéro zéro, Bourges
douze rue de la Gauderie, dix-huit, deux cents à Colombiers
Chemin du Petit Fromangeux, dix-huit mille cent dix Vignoux-sous-les-Aix
Route des Usages, dix-huit, deux cent quatre-vingt-dix Mareuil-sur-Arnon
Avenue Roland Garros, Trouy
Impasse René Godichet à Torteron
quatre impasse des Plantes Saint-Jeanne
Cour des Colombiers au numéro un
douze rue de la Maillée, dix-huit mille cent soixante-dix Le Châtelet
six rue Charles Richet, dix-huit, zéro zéro zéro, Bourges
six cour du Four, dix-huit, cent quarante à Saint-Martin-des-Champs
Impasse des Gironnais, dix-huit mille quatre cents Saint-Florent-sur-Cher
Chemin du Moulin des Filles, dix-huit, sept cents Aubigny-sur-Nère
Route de la Guerche-sur-l'Aubois, La Chapelle-Hugon
Impasse du Port Pise à Chéry
sept chemin des Poupées
Rue du Pré-Doulet au numéro six B
dix-sept TER rue Armand Desternes, dix-huit mille trois cent soixante-dix Châteaumeillant
quatre TER cours du Nord, dix-huit, zéro zéro zéro, Bourges
un rue du Détour, dix-huit, cent quatre-vingt-dix à Uzay-le-Venon
Rue Georges Bellenger, dix-huit mille cinq cent vingt Avord
Place de l'Étape aux Vins, dix-huit, sept cents Aubigny-sur-Nère
Rue Paul-Emile Victor, Saint-Doulchard
Route de la Reculée à Azy
deux rue de Thou
Rue des Urbets au numéro vingt-cinq
seize chemin du Village des Clous, dix-huit mille cent dix Vasselay
deux rue du Lassay, dix-huit, huit cents, Étréchy
sept route d'Anjouin, dix-huit, trois cent dix à Genouilly
Place Saint-Bonnet, dix-huit mille Bourges
Route des Bordigalles, dix-huit, trois cent quarante Lapan
Cour Pierre Philippe, Saint-Bouize
Rue Jeanne Campan à Bourges
deux impasse de la Centenaire
Rue Buhot de Kersers au numéro six
cinq place du Puits Saint-Jean, dix-huit mille trois cents Sancerre
neuf impasse de Parassy, dix-huit, zéro zéro zéro, Bourges
cinq rue des Billonneries, dix-huit, deux cent trente à Saint-Doulchard
Rue du Champ de Pierre, dix-huit mille cent trente Vornay
Rue des Goyonnes, dix-huit, cent quatre-vingt-dix Venesmes
Chemin du Coin de l'Enfer, Civray
Impasse du Peson à Trouy
deux chemin des Litords
Chemin du Vernoy au numéro six
six ruelle du Vergnol, dix-huit mille cent quarante Saint-Martin-des-Champs
quatre allée Walter Gropius, dix-huit, zéro zéro zéro, Bourges
quatre rue Michel Bellot, dix-huit, six cents à Sancoins
Chemin des Barbotins, dix-huit mille cent quatre-vingt-dix Chavannes
Passage des Épinettes, dix-huit, cent Vierzon
Allée du Port de Plaisance, Saint-Satur
Route d'Humbligny à Neuilly-en-Sancerre
trois impasse de l'Aquitaine
Cour du Cerf au numéro deux
sept lotissement de la Griffe, dix-huit mille cent quatre-vingt-dix Chavannes
un rue Pierre Calmettes, dix-huit, cent, Vierzon
trois rue Désiré Deschamps, dix-huit, cinq cent vingt à Avord
Chemin du Grand Bois Audran, dix-huit mille cent Thénioux
Clos Belle Croix, dix-huit, cinq cents Mehun-sur-Yèvre
Chemin Creux des Tremblets, Bourges
Place Louis Billon à Corquoy
six place Bascoulard
Allée du Patureau au numéro deux
un rue de la Caillère, dix-huit mille deux cent trente Saint-Doulchard
un chemin du Patis, dix-huit, quatre cent dix, Brinon-sur-Sauldre
trois chemin des Potences, dix-huit, sept cents à Aubigny-sur-Nère
Rue Mayotte, dix-huit mille trois cent quatre-vingts Ennordres
Chemin du Gardieu, dix-huit, cent quatre-vingt-dix Vallenay
Rue Bourbounnoux, Mornay-Berry
Rue de Trézy à La Chapelle-Hugon
vingt rue Meunier
Allée de l'Aviateur Dutton au numéro dix
deux chemin de la Ruelle aux Veaux, dix-huit mille cent soixante Lignières
trois les Boutons d'Or, dix-huit, trois cent vingt, Cours-les-Barres
trois route de Nohant en Goût, dix-huit, deux cent vingt à Sainte-Solange
Rue de Fondmorigny, dix-huit mille Bourges
Chemin des Écossais, dix-huit, trois cents Bué
Rue des Hémerettes, Bourges
Rue du Mariniers à Cuffy
quatre rue Pierre Brun
Rue de Morize au numéro deux
un rue du Bois à la Dame, dix-huit mille cent dix Saint-Éloy-de-Gy
cinq chemin du Domaine du Chêne, dix-huit, trois cents, Sens-Beaujeu
quatre cour François Bailly, dix-huit, zéro zéro zéro à Bourges
Clos des Carrieres, dix-huit mille trois cent quatre-vingt-dix Savigny-en-Septaine
Rue Louis Boileau, dix-huit, deux cents Saint-Amand-Montrond
Rue Croix de Mission, La Guerche-sur-l'Aubois
Allée Youri Gagarine à Bourges
huit cent quatre-vingt-huit route du Pré au Merle
Impasse de Boissereau au numéro dix-sept
trois cents rue de l'Acces, dix-huit mille cent quatre-vingt-dix Châteauneuf-sur-Cher
cinq rue Catherine Pateux, dix-huit, cinq cents, Mehun-sur-Yèvre
neuf route de Saint-Céols, dix-huit, deux cent vingt à Rians
Clos du Sentier, dix-huit mille cinq cent soixante-dix La Chapelle-Saint-Ursin
Côte du Puits, dix-huit, cent quatre-vingt-dix Corquoy
Rue des Fontaines Villeprévoir, Crézancy-en-Sancerre
Rue d'Arpheuilles à Meillant
douze rue Port
Route de Saint-Jeanvrin au numéro un
cent dix rue du Frère Alfred Stanke, dix-huit mille deux cent trente Saint-Doulchard
dix chemin du Bois de Bonne Bûche, dix-huit, trois cent cinquante, Ignol
dix-sept chemin de Fernet, dix-huit, cent à Thénioux
Chemin de Saclée, dix-huit mille trois cent cinquante Mornay-Berry
Chemin des Pieds Blancs, dix-huit, deux cent trente Saint-Doulchard
Rue Vladimir Jankelevitch, Bourges
Chemin du Bois de Genièvre à Brécy
quatre chemin de la Guicharde
Rue Gaston Beaubois au numéro cinq
deux route de l'Étang de Goule, dix-huit mille deux cent dix Bessais-le-Fromental
neuf route de la Maison Rouge, dix-huit, cent dix, Vasselay
quatre rue de la Jumelle, dix-huit, deux cents à Colombiers
Rue Blanche Baron, dix-huit mille cent Vierzon
Chemin du Taureau, dix-huit, trois cents Veaugues
Chemin des Obuses, Saint-Satur
Rue Maurice Lallier à Bessais-le-Fromental
neuf impasse François Coillard
Rue Paul et Albert Thouvenin au numéro un
cinq rue du Docteur Prunet, dix-huit mille Bourges
sept cent quinze A chemin du Champ de la Dame, dix-huit, cinq cent dix, Menetou-Salon
deux allée d'Aveiro, dix-huit, zéro zéro zéro à Bourges
Cour du Bât d'Argent, dix-huit mille Bourges
Square Georges Brassens, dix-huit, cent Vierzon
Impasse Babeuf, Vierzon
Rue de la Petite Régie à Torteron
deux route du Roulier
Route de la Forest au numéro quatre cent quarante-cinq
sept rue des Canches, dix-huit mille cent cinquante Cuffy
un cour des Augustins, dix-huit, zéro zéro zéro, Bourges
quatorze rue de l'Ecu, dix-huit, deux cents à Saint-Amand-Montrond
Rue de la Pierre Folquières, dix-huit mille cinq cent soixante-dix Le Subdray
Rue des Trepieres, dix-huit, trois cent cinquante Chaumont
Rue du Four au Roi, Bourges
Route de Mehun sur Yèvre à Saint-Laurent
dix-huit allée Icare
Rue Louis Bertrand au numéro quatorze
vingt et un rue du Gué Marin, dix-huit mille cinq cents Mehun-sur-Yèvre
deux route de Bengy-sur-Craon, dix-huit, huit cents, Saligny-le-Vif
quatre rue des Piches, dix-huit, cent soixante-dix au Châtelet
Route de Saint-Marien, dix-huit mille trois cent soixante-dix Préveranges
Chemin du Champ Chapelet, dix-huit, cent Vierzon
Rue du Crouston, Aubigny-sur-Nère
Impasse du Poinçon à Civray
huit route de la Pontonne
Carrefour René Gachot au numéro quatorze
trente impasse Félix Chédin, dix-huit mille Bourges
deux BIS route de Farges, dix-huit, huit cents, Villabon
quinze rue Paul Marguerita, dix-huit, zéro zéro zéro à Bourges
Rue de la Salle d'Armes, dix-huit mille Bourges
Rue Martial, dix-huit, cent trente Chalivoy-Milon
Rue Charlotte, Saint-Amand-Montrond
Rue du Pré Néré à Saint-Amand-Montrond
cent vingt-cinq chemin de Chiloux
Rue de la Velouse au numéro six
trente rue Julien Guillemin, dix-huit mille huit cents Étréchy
neuf route de Vignoux sur Barangeon, dix-huit, trois cent trente, Saint-Laurent
mille six cent quarante et un place Auguste Fournier, dix-huit, cent cinquante à La Guerche-sur-l'Aubois
Place Charles Gounod, dix-huit mille cent dix Fussy
Impasse aux Sangliers, dix-huit, trois cents Vinon
Chemin de Louy, Lissay-Lochy
Chemin des Champs aux Moines à Neuilly-en-Sancerre
quatorze rue Anne-Marie Delahaye
Route du Lieu au numéro treize
deux route de Sévry, dix-huit mille cent quarante Couy
quatre rue de Brives, dix-huit, zéro zéro zéro, Bourges
vingt-neuf place Renée Bertheaud, dix-huit, trois cent vingt à Menetou-Couture
Rue de la Piatte, dix-huit mille trois cent vingt Jouet-sur-l'Aubois
Rue des Guichets, dix-huit, trois cent dix Graçay
Chemin de l'Aujonniere, Vierzon
Allée de la Loge Grelet à La Groutte
quatre rue de Vignot
Route de Menetou au numéro vingt
quatre rue Jean-Marie Tjibaou, dix-huit mille Bourges
un impasse des Trois Pommes, dix-huit, zéro zéro zéro, Bourges
cinq route de Nohant en Graçay, dix-huit, trois cent dix à Genouilly
Chemin des Quatre Fonts, dix-huit mille deux cents Arpheuilles
Impasse des Crias, dix-huit, deux cent quatre-vingt-dix Civray
Impasse du Petit Puits, Crézancy-en-Sancerre
Rue des Roulletins à Marseilles-lès-Aubigny
huit rue de l'Écu
Rue Alfred Remanjon au numéro neuf
sept route des Tureaux, dix-huit mille cent dix Saint-Georges-sur-Moulon
cinq rue Joseph Brunet, dix-huit, zéro zéro zéro, Bourges
huit route Jacques Cœur, dix-huit, deux cent vingt à Soulangis
Rue de Farges, dix-huit mille cinq cent vingt Avord
Place Robert Lagarde, dix-huit, six cents Givardon
Rue de Tannois, Sancergues
Rue Marigny à Sancoins
mille quatre cent cinquante-deux place du Bas de Grange
Rue du Brioux au numéro six
quatre route de Clémont, dix-huit mille quatre cent dix Brinon-sur-Sauldre
treize résidence Haddington, dix-huit, sept cents, Aubigny-sur-Nère
deux allée des Gravoches, dix-huit, cent vingt à Méreau
Impasse de Provence, dix-huit mille cinq cent soixante-dix La Chapelle-Saint-Ursin
Impasse du Bois des Cheminées, dix-huit, cinq cent soixante-dix Morthomiers
Chemin de la Saulnière, Jalognes
Impasse du Champ de Mars à Aubigny-sur-Nère
un cour Saint-Vincent
Allée du Faix des Cheminées au numéro deux
quatre chemin de Mehun, dix-huit mille trois cent trente Neuvy-sur-Barangeon
quatre rue de la Chèvre Blanche, dix-huit, trois cents, Sancerre
vingt-quatre rue du Champ de la Dame, dix-huit, cinq cent dix à Menetou-Salon
Avenue du dix-huit Juin mille neuf cent quarante, dix-huit mille trois cent quatre-vingts La Chapelle-d'Angillon
Rue de Babylone, dix-huit, zéro zéro zéro Bourges
Rue Philippe Kieffer, Bourges
Route d'Autry-le-Châtel à Blancafort
cinq rue Au Dau
Allée de Saint-Marc au numéro un
un rue des Piats, dix-huit mille trois cent cinquante Chaumont
cinq route de Saint-Caprais, dix-huit, trois cent quarante, Arçay
trois cent quatre-vingt-six chemin du National, dix-huit, cent soixante à Chezal-Benoît
Avenue de Saint-Sauveur, dix-huit mille cent vingt Méreau
Impasse du Tardy, dix-huit, cinq cents Foëcy
Rue André Raimbourg Dit Bourvil, Bourges
Rue des Araults à Saint-Hilaire-de-Court
deux cour de Candie
Allée Henri Wallon au numéro sept
cinq cent vingt-quatre chemin des Patureaux, dix-huit mille cinq cents Vignoux-sur-Barangeon
trois allée Cavalière, dix-huit, zéro zéro zéro, Bourges
cinq rue Antoine Chopin, dix-huit, cent cinquante à La Chapelle-Hugon
Impasse Serpente, dix-huit mille deux cents Saint-Amand-Montrond
Chemin de Beauséjour, dix-huit, quatre cents Saint-Florent-sur-Cher
Impasse de la Fontaine Saint-Marc, Aubigny-sur-Nère
Chemin des Tasnières à Soulangis
quatorze rue François Elie Dugenne
Rue Basse des Roches au numéro neuf
dix BIS place du Connétable, dix-huit mille trois cents Sancerre
un rue de L'Écluse, dix-huit, trois cent vingt, Marseilles-lès-Aubigny
deux cent quatre-vingts chemin du Pré au Meunier, dix-huit, deux cent cinquante à Neuilly-en-Sancerre
Route de Romorantin, dix-huit mille trois cent dix Graçay
Chemin des Brissaudières, dix-huit, cinq cents Vignoux-sur-Barangeon
Cours des Miracle, Menetou-Salon
Route de Chaumoux à Sévry
dix lotissement Plancheton
Place Du Marché au numéro vingt-six
trois impasse du Rucher, dix-huit mille deux cent quatre-vingt-dix Saint-Ambroix
trois place du Moulin de la Poterne, dix-huit, deux cent dix, Charenton-du-Cher
dix rue du Petit Sarru, dix-huit, cent quatre-vingt-dix à Vallenay
Impasse André Ampère, dix-huit mille cent dix Fussy
Allée des Vignes du Briou, dix-huit, cent vingt Méreau
Route du Chatelier, Coust
Allée des Jardins de la Margelle à Morthomiers
trois impasse du Bois de la Ferme
Impasse de Chichevet au numéro deux
cinquante et un chemin de Guédemont, dix-huit mille cent trente Dun-sur-Auron
treize impasse du seize Juin, dix-huit, deux cent vingt, Les Aix-d'Angillon
deux route de Prévert, dix-huit, cent soixante à Touchay
Ruelle de l'Hôpital Prolongée, dix-huit mille trois cents Saint-Satur
Route de Sury-en-Vaux, dix-huit, trois cents Sancerre
Le Champ du Moulin, Oizon
Rue de la Roue à Paul à Vailly-sur-Sauldre
douze rue du Pont Beaumont
Allée du Château d'Autry au numéro quatre cent quatre-vingt-huit
dix rue de Liberté, dix-huit mille cent cinquante La Guerche-sur-l'Aubois
deux allée Marco Polo, dix-huit, cent dix, Fussy
huit B chemin des Gaudrets, dix-huit, cent à Vierzon
Rue de l'Yevre, dix-huit mille cinq cent vingt Avord
Rue du Chanoine Chatain, dix-huit, cent quarante Couy
Chemin du Village de Guérigny, Vignoux-sur-Barangeon
Chemin de l'Usine des Eaux à Saint-Amand-Montrond
quatre chemin du Cloître
Rue des Compagnons du Tour de France au numéro dix-sept
trois chemin du Moulin à Foulon, dix-huit mille cinq cents Mehun-sur-Yèvre
quatre rue de Gron, dix-huit, huit cents, Gron
huit avenue Charles Glandaz, dix-huit, quatre cents à Lunery
Impasse de la Californie, dix-huit mille quatre cents Saint-Florent-sur-Cher
Route de la Planche de Moussiau, dix-huit, cent soixante Touchay
Rue de l'Anerie, Bannay
Chemin des Grainetières à Saint-Amand-Montrond
sept rue de la Fausse Rivière
Route de Senneçay au numéro cinq
six impasse du Lac Adam, dix-huit mille trois cent dix Genouilly
un chemin de la Blancherie, dix-huit, trois cents, Saint-Bouize
dix-neuf BIS rue Jules Hannequin, dix-huit, huit cents à Villabon
Place de Barmont, dix-huit mille cinq cents Mehun-sur-Yèvre
Chemin de Mehun sur Yèvre, dix-huit, cent dix Allogny
Rue de la Bienfaisance, Bourges
Rue des Grandes Ouches à Vignoux-sur-Barangeon
deux avenue Jacques Cœur
Rue des Chéseaux au numéro un
quatre chemin des Lavoirs, dix-huit mille quatre cents Lunery
deux rue Paul Fabre, dix-huit, trois cent quatre-vingt-dix, Moulins-sur-Yèvre
sept rue des Savinges, dix-huit, huit cents à Gron
Rue des Terres de l'Étoile, dix-huit mille cinq cents Vignoux-sur-Barangeon
Rue des Trois Sabots, dix-huit, deux cents Saint-Amand-Montrond
Chemin de la Margauderie, Saint-Laurent
Rue Bourguignon à Saint-Amand-Montrond
dix chemin de la Rue Creuse
Place de Crécy au numéro quatre
deux chemin du Domaine de Crux, dix-huit mille huit cents Villequiers
huit rue Antoine Cambournac, dix-huit, zéro zéro zéro, Bourges
deux impasse Numéro un de l'Hirondelle, dix-huit, cent trente à Dun-sur-Auron
Rue du Docteur Témoin, dix-huit mille Bourges
Impasse de Beauséjour, dix-huit, cent quatre-vingt-dix Saint-Loup-des-Chaumes
Impasse du CHat, Chéry
Rue de la Trempée à Aubigny-sur-Nère
trois route des Moreaux
Rue Jean-Baptiste au numéro deux
cent trente impasse des Croquenettes, dix-huit mille deux cent cinquante Neuilly-en-Sancerre
onze chemin du Verdin, dix-huit, cent, Vierzon
cinquante-six la Bouloie, dix-huit, cent quatre-vingt-dix à Venesmes
Route de Gaudard, dix-huit mille cent Thénioux
Route de Bué, dix-huit, trois cents Vinon
Rue des Ailloux, Plou
Rue de Villequiers à Gron
quatre chemin des Brians
Allée René Ménard au numéro treize C
deux raccourci du Puits Mardelon, dix-huit mille deux cent quarante Sury-près-Léré
cinq rue du Bois Mervier, dix-huit, trois cent cinquante, Charly
neuf rue MacDonald, dix-huit, zéro zéro zéro à Bourges
Chemin des Plantons, dix-huit mille Bourges
Impasse du Bout du Pont, dix-huit, deux cent quatre-vingt-dix Saint-Ambroix
Rue Cognacq-Jay, Vierzon
Rang Noir à Lunery
huit ruelle de Chichevet
Impasse du Dureau au numéro deux
un chemin du Champ Luseau, dix-huit mille trois cent trente Vouzeron
treize impasse Gendarme Pierre Valençon, dix-huit, cinq cent vingt, Avord
vingt-sept rue de Beaujouan, dix-huit, zéro zéro zéro à Bourges
Rue Porte Serrure, dix-huit mille trois cents Sancerre
Rue de Primelles, dix-huit, cent soixante Saint-Baudel
Rue des Chétives Terres, Ourouer-les-Bourdelins
Route de Vignoux sous les Aix à Sainte-Solange
six résidence des Pommiers
