quarante et un rue Colonel Grandier-Vazeille, trente-trois mille Bordeaux
seize rue du Docteur Fauché, trente-trois, six cent soixante-dix, Créon
quatre-vingt-dix avenue du Cap Ferret, trente-trois, cent vingt-sept à Saint-Jean-d'Illac
Allée de Chappaz, trente-trois mille quatre cent soixante Arsac
Lotissement Bouleaux de la Possession, trente-trois, trois cent quatre-vingts Marcheprime
Rue Francis Planté, Pessac
Rue Berruer à Bordeaux
quarante-quatre rue Auguste Brutails
Rue Chantecrit au numéro soixante-dix-huit
seize avenue du Chemin de la Vie, trente-trois mille quatre cent quarante Ambarès-et-Lagrave
dix rue de la Réousse, trente-trois, sept cent quarante, Arès
sept rue de l'Amiral Besson, trente-trois, sept cent dix à Bourg
Chemin Barreyres, trente-trois mille trois cent quatre-vingts Biganos
Rue de l'Amiral Pierre Mouly, trente-trois, cent vingt Arcachon
Rue Saint-Jean d'Etampes, Ayguemorte-les-Graves
Allée du Petit Mestey à Gujan-Mestras
vingt-trois quai Port de la Hume
Route d'Arcachon au numéro quarante-quatre
quinze rue de Ruat, trente-trois mille Bordeaux
quarante cours de l'Yser, trente-trois, zéro zéro zéro, Bordeaux
trente-trois rue Pierre Massieux, trente-trois, quatre cents à Talence
Route de Gouas, trente-trois mille trois cent quatre-vingt-dix Cartelègue
Rue Dubarry, trente-trois, cinq cent trente Bassens
Chemin de Guérin, Salles
Rue Bahus à Talence
vingt-trois rue Paul Commarieu
Allée de Grabasse au numéro douze
trente-cinq rue de la Dune Pontac, trente-trois mille cent vingt Arcachon
cent trente-six rue de Graney, trente-trois, quatre cent cinquante, Izon
quarante-huit cours Georges Mandel, trente-trois, cinq cent quatre-vingt-dix à Saint-Vivien-de-Médoc
Allée des Bruyères Cazaux, trente-trois mille cent quinze La Teste-de-Buch
Cours Xavier Moreau, trente-trois, sept cent vingt Podensac
Chemin du Biala, Cestas
Rue Chante Cigale à Gujan-Mestras
douze lotissement Les Moulins
Rue Medecin Jean Vialar Goudou au numéro quatre-vingt-six
cinq allée d'Anjou, trente-trois mille cinq cent dix Andernos-les-Bains
neuf rue Dubrana, trente-trois, trois cent vingt, Eysines
soixante et un rue Armand Sully Prudhomme, trente-trois, neuf cent quatre-vingts à Audenge
Rue de Piget, trente-trois mille deux cent quatre-vingt-dix Ludon-Médoc
Rue Fontaine du Bayle, trente-trois, cinq cent cinquante Le Tourne
Allée de Moulerens, Gradignan
Avenue des Galipes à La Teste-de-Buch
un avenue de la Croix d'Hors
Allée du Rivage au numéro douze
huit cité de Caulet, trente-trois mille Bordeaux
vingt-deux route de Roaillan, trente-trois, deux cent dix, Langon
vingt-huit rue Formigé, trente-trois, cent dix au Bouscat
Route de Langoiran, trente-trois mille cinq cent cinquante Capian
Impasse du Moulin de Pelissey, trente-trois, cent soixante-dix Gradignan
Avenue de Maubuisson, Carcans
Rue André Pujol à Pessac
douze rue Lageyre
Rue de Malbos au numéro trente-trois
vingt-cinq rue Félix-le-Carvennec, trente-trois mille sept cent quatre-vingts Soulac-sur-Mer
six rue Lagueyte, trente-trois, six cent quatre-vingts, Lacanau
onze rue Charles Nungesser, trente-trois, cent quinze à La Teste-de-Buch
Impasse du Cuvier, trente-trois mille trois cent vingt Le Taillan-Médoc
Route de Grimard, trente-trois, six cent soixante-dix Créon
Rue Desplats, Talence
Chemin Darnauran à Castelnau-de-Médoc
six allée Antonio Canova
Allée Tournesol au numéro quatre
cinq rue Jean Soula, trente-trois mille Bordeaux
onze rue Jean Pares, trente-trois, cent vingt-trois, Le Verdon-sur-Mer
cent soixante et un lotissement Village des Pins, trente-trois, quatre cent soixante-dix à Gujan-Mestras
Route du Port de Goulée, trente-trois mille trois cent quarante Valeyrac
Chemin de Courtade, trente-trois, cent quatre-vingt-cinq Le Haillan
Chemin de Vignac, Carignan-de-Bordeaux
Rue Daniel Danet à Eysines
quarante-trois B rue Binaud
Lotissement Les Alouettes au numéro trente-neuf
quatre allée Alouettes, trente-trois mille six cent dix Canéjan
huit chemin du Nid de l'Agasse, trente-trois, six cent dix, Cestas
trois chemin de Nenin, trente-trois, cinq cents à Pomerol
Hameau de Perrin, trente-trois mille trois cent soixante-dix Tresses
Rue Jean Iriquin, trente-trois, quatre cents Talence
Rue des Jasmins Cap Ferret, Lège-Cap-Ferret
Rue de Saarburg à Soulac-sur-Mer
neuf rue Emile Doussy
Rue du Marlacca au numéro vingt-deux
quatorze A rue de Maugis, trente-trois mille cent quinze La Teste-de-Buch
trente-cinq chemin du Follet, trente-trois, trois cent soixante, Quinsac
deux place de la Pupe, trente-trois, six cent dix à Cestas
Allée Robert Schumann, trente-trois mille sept cent quatre-vingts Soulac-sur-Mer
Rue de Millassot, trente-trois, deux cent dix Toulenne
Chemin de l'Aoudougue, Cestas
Route de Campenna à Beychac-et-Caillau
quatre chemin des Pargaux
Rue Mandron au numéro cinquante-neuf
quatorze rue de Lucasson, trente-trois mille neuf cent quatre-vingts Audenge
trente-trois rue Angel Durand, trente-trois, quatre cents, Talence
trois cours de la Marne, trente-trois, zéro zéro zéro à Bordeaux
Lotissement La Métairie, trente-trois mille six cent quatre-vingts Lacanau
Rue de Cantelaude, trente-trois, six cent quatre-vingts Lacanau
Avenue de la Chênaie, Cestas
Rue d'Audenge à Bordeaux
quatre allée de Lussac
Boulevard du Président Franklin Roosevelt au numéro cinquante-trois
trente-cinq rue Pierre Baour, trente-trois mille Bordeaux
treize route du Gardés, trente-trois, sept cent soixante, Faleyras
trente et un avenue de Bellevue Pyla, trente-trois, cent quinze à La Teste-de-Buch
Chemin du Maroc, trente-trois mille cinq cent quatre-vingt-dix Grayan-et-l'Hôpital
Allée de la Filolie, trente-trois, cent soixante-dix Gradignan
Chemin de Pierran, Sadirac
Rue Francis Garnier à Bruges
dix-neuf BIS route de Sampau
Rue Théodore Gardère au numéro quarante-sept
dix-sept rue Malleret, trente-trois mille Bordeaux
dix lotissement Henri Roger, trente-trois, cent vingt-cinq, Hostens
quarante-sept rue Arnaud Miqueu, trente-trois, zéro zéro zéro à Bordeaux
Rue du Pigeonnay, trente-trois mille deux cent quatre-vingt-dix Blanquefort
Allée du Petit Port, trente-trois, trois cent quatre-vingts Biganos
Chemin de lou Jun, Cestas
Rue Henri Rol-Tanguy à Saint-Médard-en-Jalles
treize rue Marcel Loubens
Avenue des Pratviels au numéro douze
treize rue du Tarrey d'Aillabau, trente-trois mille quatre cent quarante Ambarès-et-Lagrave
trente-quatre avenue de Gourinat, trente-trois, cinq cents, Libourne
quatre rue Vandebrande, trente-trois, zéro zéro zéro à Bordeaux
Rue Deyriès, trente-trois mille Bordeaux
Avenue Eugène Delacroix, trente-trois, huit cent dix Ambès
Boulevard Broustey, Canéjan
Allée de l'Île aux Oiseaux à Pessac
huit rue Lyrot
Résidence La Cheneraie au numéro vingt-huit
soixante-huit route de Valeyrac, trente-trois mille cinq cent quatre-vingt-dix Jau-Dignac-et-Loirac
vingt-deux rue de Biars, trente-trois, trois cent quarante, Bégadan
quatorze lotissement les Dunes Vertes, trente-trois, sept cent quarante à Arès
Rue Jean Adrien Pioceau, trente-trois mille deux cent quarante Saint-André-de-Cubzac
Avenue Saint-Jacques de Compostelle, trente-trois, six cent dix Cestas
Allée du Marathon, Mérignac
Place F Coureau à Saint-Savin
vingt-six avenue d'Eysines
Rue Catros-Gerand au numéro douze
dix-sept route de Curchade, trente-trois mille trois cent quatre-vingts Mios
treize impasse Jules Simon, trente-trois, cinq cents, Libourne
trois rue du Gastounet, trente-trois, six cent cinquante à Saint-Selve
Rue de Mexico, trente-trois mille Bordeaux
Rue de Vigneau, trente-trois, trois cent quarante Gaillan-en-Médoc
Lotissement Les Hauts Graves, Léognan
Avenue du Président Robert Schuman au Bouscat
dix allée de Chambrelent
Impasse Taillis Vert au numéro sept
quatre rue du Vignan, trente-trois mille trois cent vingt Eysines
trois rue de Lacanau, trente-trois, zéro zéro zéro, Bordeaux
soixante-cinq route de Feydit, trente-trois, cent soixante à Saint-Médard-en-Jalles
Allée de Fontebride, trente-trois mille quatre cent soixante-dix Gujan-Mestras
Chemin Côte de Pomadis, trente-trois, six cent soixante-dix Sadirac
Rue Edouard Ferret, Bazas
Allée Jean Chaptal à Cenon
treize chemin du Pitey
Boulevard de l'Amélie au numéro quatre
quatre BIS route de Ferrier, trente-trois mille huit cent trente Lugos
trois chemin de Jambes, trente-trois, quatre cent quarante, Ambarès-et-Lagrave
deux cent vingt-six avenue des Colonies, trente-trois, cinq cent dix à Andernos-les-Bains
Rue Crabeyres, trente-trois mille cinq cent vingt Bruges
Rue de Lucie, trente-trois, cinq cent soixante Carbon-Blanc
Rue Danseperré, Virelade
Chemin du Pont de l'Eau Bourde à Cestas
trente-deux rue Rodrigues Péreire
Résidence Daniel Brettes au numéro onze
sept avenue de Saige, trente-trois mille six cents Pessac
six lotissement les Châtaigniers de la Possession, trente-trois, trois cent quatre-vingts, Marcheprime
vingt rue de Peycamin, trente-trois, cent soixante-dix à Gradignan
Rue Raymond Bordier, trente-trois mille Bordeaux
Cours Balguerie Stuttenberg, trente-trois, zéro zéro zéro Bordeaux
Lotissement Les Allées Courbet, Saint-Seurin-sur-l'Isle
Avenue de la Roudet à Libourne
trente-sept cité du Fils
Allée Pierre Joseph Proudhon au numéro un
dix-neuf rue lou Cabeuil, trente-trois mille cent quatorze Le Barp
huit lotissement la Châtaigneraie, trente-trois, deux cent dix, Fargues
dix avenue de Bir Hakeïm, trente-trois, cinq cent vingt à Bruges
Lotissement Le Parc du Chateau, trente-trois mille cent quarante Cadaujac
Cours du Maréchal Joffre, trente-trois, quatre cent trente Bazas
Résidence Hameaux de l'Amélie, Soulac-sur-Mer
Chemin Lafitte à Bordeaux
cinquante-deux rue Frantz Despagnet
Lotissement les Jardins d'Isabelle au numéro onze
quatre allée du Sable, trente-trois mille quatre cent soixante-dix Gujan-Mestras
cent neuf rue Marsan, trente-trois, zéro zéro zéro, Bordeaux
vingt-six route de Saint-Macaire, trente-trois, quatre cent dix à Cadillac
Rue Archevêque Amanieu de Grézillac, trente-trois mille quatre cent dix Rions
Allée André Bauchant, trente-trois, deux cent quatre-vingt-dix Parempuyre
Impasse du Courneau, Gradignan
Allée Jeanneret à Pessac
trente-deux chemin de Péloc
Route de la Palus au numéro quatre-vingt-six
cinquante-trois rue De Carbon Blanc, trente-trois mille quatre cent quarante Ambarès-et-Lagrave
sept lotissement de la Côte d'Argent, trente-trois, trois cent quatre-vingts, Marcheprime
quinze rue André Dumercq, trente-trois, cent cinquante à Cenon
Rue du Traversan, trente-trois mille six cent quarante Ayguemorte-les-Graves
Rue Madame Roland, trente-trois, cent soixante Saint-Médard-en-Jalles
Place Faubourguet, Preignac
Rue de Tauzia à Auros
six rue de l'Hereteyre
Rue Bertrand de Noailhan au numéro un
trente-cinq rue de Nérac, trente-trois mille Bordeaux
trois avenue de Cap de Bos, trente-trois, cent soixante, Saint-Médard-en-Jalles
trois place de Figean, trente-trois, cent quatre-vingt-cinq au Haillan
Rue de Caplande, trente-trois mille quatre cent soixante-dix Le Teich
Route du Preuilh, trente-trois, huit cent trente Belin-Béliet
Allée Pingouins Cap Ferret, Lège-Cap-Ferret
Rue des Grivres à Artigues-près-Bordeaux
un chemin de Pimpanet
Cours de l'Intendance au numéro quarante-huit
deux avenue Maurice Martin, trente-trois mille Bordeaux
cent soixante et un cours Desbiey, trente-trois, cent vingt, Arcachon
trente et un chemin Dou Castets, trente-trois, six cent dix à Cestas
Rue El-Alamein, trente-trois mille Bordeaux
Rue Bauducheu, trente-trois, zéro zéro zéro Bordeaux
Allée du Cachemire, Arsac
Rue Maurice Martin à Bègles
soixante-cinq route de Vérac
Lotissement Le Clos du Pre Extension au numéro deux
soixante-dix-huit rue François Marceau, trente-trois mille Bordeaux
un rue Albert Massias, trente-trois, deux cent trente, Saint-Médard-de-Guizières
deux lotissement Le Clos des Palombes, trente-trois, cinq cent dix à Andernos-les-Bains
Chemin du Ginestra, trente-trois mille trois cent quarante Lesparre-Médoc
Route du Gd Verger, trente-trois, deux cent quatre-vingt-dix Ludon-Médoc
Rue Max Linder, Saint-Ciers-d'Abzac
Allée de la Procession à Gujan-Mestras
dix-huit rue de Lentillac
Allée Ginestas au numéro vingt-cinq
six allée Pavarotti, trente-trois mille quatre cent soixante-dix Gujan-Mestras
quinze rue de Moulis, trente-trois, zéro zéro zéro, Bordeaux
quatre-vingts rue Naujac, trente-trois, zéro zéro zéro à Bordeaux
Rue Marmory, trente-trois mille cent quatre-vingt-dix La Réole
Impasse Courbey, trente-trois, sept cent quarante Arès
Lotissement Les Solariales, La Teste-de-Buch
Lotissement La Fontaine d'Albion à Sallebœuf
quatorze cité Conrad
Rue de la Chambrère au numéro cent dix-neuf
quatorze rue du Professeur Devaux, trente-trois mille Bordeaux
cinq rue de Jacques, trente-trois, trois cent vingt, Le Taillan-Médoc
vingt-six route de Charruaud, trente-trois, sept cent dix à Tauriac
Rue Poujeau, trente-trois mille Bordeaux
Place de Monnan, trente-trois, quatre cent soixante Cussac-Fort-Médoc
Rue Démosthène, Mérignac
Rue Edmond Marin Lameslée à Pessac
treize allée du Club de Voile
Allée François Dandreau Cazaux au numéro neuf
dix-sept rue Dupaty, trente-trois mille deux cent quatre-vingt-dix Blanquefort
vingt-neuf rue Alfred Giret, trente-trois, cent cinquante, Cenon
quatre carbouey, trente-trois, deux cent dix à Castillon-de-Castets
Route de Lesparre, trente-trois mille neuf cent trente Vendays-Montalivet
Avenue du Peyret, trente-trois, six cent cinquante La Brède
Chemin de Sempey, Salles
Rue de Langalerie à Sainte-Foy-la-Grande
trente et un impasse d'Agen
Rue de Puynormand au numéro vingt et un
vingt avenue Rosa Bonheur, trente-trois mille cent trente-huit Lanton
trois allée Richelieu, trente-trois, deux cent trente, Coutras
sept impasse du Moulin de Boisset, trente-trois, quatre cent soixante-dix à Gujan-Mestras
Rue de Mongran, trente-trois mille cent vingt-sept Saint-Jean-d'Illac
Rue Fougnet, trente-trois, six cents Pessac
Rue Jean Bottgen, Pineuilh
Avenue des Tauzins à Cestas
dix-huit rue Albert Gombert
Allée René Clément au numéro quatre
sept rue Chambrelent, trente-trois mille neuf cent quatre-vingt-dix Hourtin
cent cinquante-quatre avenue Sainte-Marie, trente-trois, quatre cent soixante-dix, Gujan-Mestras
cinq impasse des Cedres, trente-trois, trois cent quatre-vingts à Marcheprime
Allée Jean Richepin, trente-trois mille sept cents Mérignac
Route du Porge, trente-trois, six cent quatre-vingts Lacanau
Place Pierre Orus, Castillon-la-Bataille
Route du Treytin à Grayan-et-l'Hôpital
dix-sept route Castillonnaise
Rue de l'Ancienne Douane au numéro huit
trois impasse des Sapinettes, trente-trois mille cent vingt-sept Martignas-sur-Jalle
vingt C chemin de Pargade, trente-trois, huit cent cinquante, Léognan
sept rue Émile Videau, trente-trois, cinq cent vingt à Bruges
Rue Camille Dignac, trente-trois mille quatre cent soixante-dix Gujan-Mestras
Avenue Austin-Conte, trente-trois, cinq cent soixante Carbon-Blanc
Rue de Saget, Bordeaux
Rue de Lestaing à Blanquefort
quarante-cinq cours du Quatorze Juillet
Route des Reynats au numéro trois
quatre-vingt-six cours des Girondins, trente-trois mille cinq cents Libourne
cent quatre avenue Pointe Chevaux Gran Piquey, trente-trois, neuf cent cinquante, Lège-Cap-Ferret
cent quatre chemin des Plateaux, trente-trois, deux cent soixante-dix à Floirac
Avenue de lou Bournac, trente-trois mille six cent dix Cestas
Chemin de la Caillahude, trente-trois, cinq cent quatre-vingt-dix Grayan-et-l'Hôpital
Allée du Haut Levequ, Pessac
Route de Loustalade à Léognan
dix avenue Pierre Raymond
Allée Camille Jullian au numéro quinze
huit route de la Landotte, trente-trois mille quatre cent cinquante Izon
quatre-vingt-douze cours du Maréchal Gallieni, trente-trois, quatre cents, Talence
trois BIS chemin de Heutge, trente-trois, sept cent soixante-dix à Salles
Rue de Bizet, trente-trois mille deux cent soixante-dix Floirac
Chemin de la Carasse, trente-trois, neuf cent cinquante Lège-Cap-Ferret
Chemin de Leysotte, Talence
Passage Hermitte à Bordeaux
dix-sept avenue de la Boëtie
Avenue de Gradignan au numéro trente-huit
deux allée des Arrivaux, trente-trois mille quatre cent soixante Lamarque
dix-huit rue André Blanc, trente-trois, trois cent vingt, Eysines
six allée Daniel Rastel, trente-trois, cent vingt à Arcachon
Avenue Premiere Armee Francaise, trente-trois mille sept cents Mérignac
Avenue des Landes, trente-trois, six cent quatre-vingts Lacanau
Chemin des Résineux, Captieux
Avenue Jean Cordier à Pessac
trois rue des Canelons
Chemin de Saujeon au numéro un
quarante-sept allée de la Garosse, trente-trois mille deux cent quarante Saint-André-de-Cubzac
vingt rue de la Croix des Gunes, trente-trois, deux cent cinquante, Cissac-Médoc
vingt et un rue Joseph Boyé, trente-trois, trois cent quarante à Couquèques
Allée Matato, trente-trois mille quatre cent soixante-dix Gujan-Mestras
Avenue Lucien Lerousseau, trente-trois, cent trente Bègles
Allée Perrucade, La Brède
Avenue des Cassignols à La Brède
vingt-huit avenue du Chut
Route des Pichons au numéro onze
onze boulevard d'Arcachon, trente-trois mille cent quinze La Teste-de-Buch
quatre-vingt-onze avenue Marcelin Berthelot, trente-trois, cent dix, Le Bouscat
dix-huit avenue de la Coste, trente-trois, quatre cent soixante à Macau
Chemin de Mathyadeux, trente-trois mille trois cent vingt Le Taillan-Médoc
Rue Belle Étoile, trente-trois, zéro zéro zéro Bordeaux
Rue Alphonse Micheau, Saint-Savin
Chemin de Pujau à Cestas
douze rue Desfourniel
Avenue du Docteur Fern Grosse au numéro quatre
treize chemin des Bouchonnets, trente-trois mille trois cent quarante Lesparre-Médoc
vingt-deux rue Dépé, trente-trois, zéro zéro zéro, Bordeaux
vingt-trois avenue Phénix Haut-Brion, trente-trois, six cents à Pessac
Allée du Moulin de Cazeaux, trente-trois mille cent soixante-dix Gradignan
Rue J Rudel, trente-trois, trois cent quatre-vingt-dix Blaye
Passage Kieser, Bordeaux
Cité La Cave à Blaye
dix rue Dupuy Jean
Rue Alfred Charlionnet au numéro soixante-treize
trente-huit avenue Jean Guérin, trente-trois mille six cent quatre-vingt-dix Grignols
trente-quatre chemin du Chai, trente-trois, trois cent vingt, Le Taillan-Médoc
cinquante-trois boulevard Pierre Despagne, trente-trois, cinq cent dix à Andernos-les-Bains
Rue Joseph Castera, trente-trois mille cent quinze La Teste-de-Buch
Rue Dantagnan, trente-trois, deux cent quarante Saint-André-de-Cubzac
Chemin Departemental dix-neuf, Saint-Maixant
Route de Naz de Hé à Salles
cent trente-deux route d'Anglade
Chemin d'Arcins au numéro six
trente-trois avenue de la Fraternelle, trente-trois mille sept cents Mérignac
cinq cent cinquante-cinq place Pioceau, trente-trois, trois cent trente, Saint-Émilion
douze route de Bertrine, trente-trois, huit cent trente à Belin-Béliet
Avenue Muscadelle Cap Ferret, trente-trois mille neuf cent cinquante Lège-Cap-Ferret
Rue André Guérin, trente-trois, cent trente Bègles
Cours de la Martinique, Bordeaux
Rue Leydet à Bordeaux
quarante-cinq cité de l'Église Saint-Augustin
Route de Peylahon au numéro quarante-cinq
treize rue de Menespey, trente-trois mille cent quatre-vingt-cinq Le Haillan
vingt-quatre chemin de la Travette, trente-trois, sept cent trente, Préchac
huit impasse Jean Deyrich, trente-trois, cent trente à Bègles
Route de Langon, trente-trois mille sept cent trente Uzeste
Rue de la Boiresse, trente-trois, six cent quarante Ayguemorte-les-Graves
Chemin des Arestieux, Cestas
Rue André Lafittau à Lesparre-Médoc
vingt-six avenue du Bassin
Lotissement les Pins de la Possession au numéro neuf
onze avenue de la Châtaigneraie, trente-trois mille six cents Pessac
quarante-neuf avenue des Roussettes, trente-trois, neuf cent cinquante, Lège-Cap-Ferret
trois rue de Maître Jean, trente-trois, zéro zéro zéro à Bordeaux
Chemin de Pichelèbre, trente-trois mille six cent dix Cestas
Chemin du Ribeyrot, trente-trois, six cent dix Cestas
Chemin de Loustaou, Gradignan
Rue Dubos à Villenave-d'Ornon
treize rue de la Carreyre
Résidence les Mûriers un au numéro seize
vingt et un route du Biac, trente-trois mille sept cent soixante Faleyras
onze rue Socrate, trente-trois, sept cents, Mérignac
deux rue Eugène Atget, trente-trois, cinq cents à Libourne
Rue Herman Lemoine, trente-trois mille six cents Pessac
Rue Gabriel Dupuy, trente-trois, sept cents Mérignac
Avenue Henri Grisel, Lège-Cap-Ferret
Chemin des Menuts à Camblanes-et-Meynac
quatre rue Fernand Favre
Rue De Fontainebleau au numéro cinq
un rue Rosalie, trente-trois mille Bordeaux
deux allée Saint-Sauveur, trente-trois, quatre cent trente, Bazas
treize rue Avelane, trente-trois, zéro zéro zéro à Bordeaux
Rue du Docteur Da Cruz Texeira, trente-trois mille cent vingt Arcachon
Rue Henri Dheûrle, trente-trois, cent quinze La Teste-de-Buch
Impasse du Parc des Sports, Saint-Médard-de-Guizières
Rue Théodore Blanc à Bruges
trente et un route du Pin Franc
Chemin de Gueyrosse au numéro vingt-quatre
cinq rue Jean Bouchet, trente-trois mille quatre cent soixante Labarde
cent quatre-vingt-dix-sept rue de la Benauge, trente-trois, zéro zéro zéro, Bordeaux
dix-huit rue du Bois du Pont, trente-trois, cent quarante à Cadaujac
Chemin du Tambour, trente-trois mille sept cent soixante-dix Salles
Rue de Gilamon, trente-trois, deux cent quatre-vingt-dix Blanquefort
Rue de Laones, Créon
Avenue du Truc à Mérignac
quarante et un impasse Roger Hourquet
Avenue Gaston Cabannes au numéro quinze
vingt-huit route des Artigues, trente-trois mille cinq cent quatre-vingt-dix Saint-Vivien-de-Médoc
trois cent dix-sept allée de Saussets, trente-trois, cent vingt-sept, Saint-Jean-d'Illac
trente-cinq rue André Nhevoit, trente-trois, cinq cents à Libourne
Impasse du Petit Feydieu, trente-trois mille deux cent quatre-vingt-dix Le Pian-Médoc
Rue Fonneuve, trente-trois, cinq cents Libourne
Rue de l'Abbé Belet, Arbanats
Rue du Docteur Meignie à Lesparre-Médoc
cent douze avenue Roul
Allée du Bruc au numéro quatre
trente et un avenue des Tropiques Pyla, trente-trois mille cent quinze La Teste-de-Buch
quatre impasse de la Pignada Cazaux, trente-trois, cent quinze, La Teste-de-Buch
trente-six rue Edmond Daubric, trente-trois, quatre cent soixante-dix à Gujan-Mestras
Rue Pierre Ducasse, trente-trois mille cinq cent vingt Bruges
Rue des Echassiers, trente-trois, cinq cent dix Andernos-les-Bains
Lotissement Les Allées du Cordon d'Or, Saint-Médard-d'Eyrans
Rue du Martouret à La Réole
cinquante-cinq rue Guillaume Leblanc
Rue Colonel Klein au numéro quatre-vingt-quatorze
quatre chemin Petit Chemin, trente-trois mille cent quatre-vingts Saint-Estèphe
vingt-quatre rue Jules Mabit, trente-trois, zéro zéro zéro, Bordeaux
soixante-dix-neuf route du Cap Ferret, trente-trois, neuf cent cinquante à Lège-Cap-Ferret
Rue Galin, trente-trois mille Bordeaux
Rue de Rigoulet, trente-trois, zéro zéro zéro Bordeaux
Chemin de Bissaut, Saint-Romain-la-Virvée
Avenue du Bourdieu à Mouliets-et-Villemartin
quarante-quatre allée du Pas du Renard
Rue Dotezac au numéro neuf BIS
trente-sept route de la Brède, trente-trois mille sept cent vingt Saint-Michel-de-Rieufret
trente-trois rue du Professeur Daguin, trente-trois, cent quarante, Villenave-d'Ornon
quatorze route de Jean de Jeanne, trente-trois, sept cent soixante-dix à Salles
Rue du Professeur Villemin, trente-trois mille Bordeaux
Rue Charles Capsec, trente-trois, cent soixante Saint-Médard-en-Jalles
Cité Marsan, Bordeaux
Chemin de Lamego à Yvrac
seize route du Cadeau
Route de Gaillard au numéro dix
trois lotissement le Clos de Barenne, trente-trois mille neuf cent trente Vendays-Montalivet
dix rue Chabrely, trente-trois, zéro zéro zéro, Bordeaux
vingt-cinq B rue de Montalon, trente-trois, deux cent quarante à Saint-André-de-Cubzac
Rue de Guiton, trente-trois mille quatre cent soixante Arsac
Allée des Prés Salés, trente-trois, quatre cent soixante-dix Gujan-Mestras
Rue Renault, Bordeaux
Avenue des Morilles à Lège-Cap-Ferret
onze rue du Zic
Impasse de Toulouse au numéro un
huit lotissement de Couleyre, trente-trois mille deux cent dix Preignac
quatre avenue de Paris Pyla, trente-trois, cent quinze, La Teste-de-Buch
soixante rue de Lauriol, trente-trois, cent trente à Bègles
Route du Trétin, trente-trois mille six cent cinquante Cabanac-et-Villagrains
Impasse des Marées, trente-trois, quatre cent soixante-dix Gujan-Mestras
Route des Moureys, Valeyrac
Lotissement de la Prevote à Saint-Médard-de-Guizières
cent vingt-trois route de Créon
Rue de Peyfur au numéro deux
dix-huit chemin de Jarroudic, trente-trois mille quatre cent trente Bernos-Beaulac
cinq cent cinq rue du Thau, trente-trois, trois cent trente, Saint-Émilion
douze TER lotissement Résidence des Pins Francs, trente-trois, quatre cent cinquante à Saint-Loubès
Rue Jean Despujols, trente-trois mille sept cent soixante-dix Salles
Boulevard Deganne, trente-trois, cent vingt Arcachon
Route du Bois de Savis, Castres-Gironde
Allée de Bireboussaou à Gujan-Mestras
six lotissement de Mutin Sud
Rue Gouffrand au numéro six
vingt-deux rue de l'Archevêque, trente-trois mille trois cent dix Lormont
cinquante et un rue Roland Dorgelés, trente-trois, sept cent quatre-vingts, Soulac-sur-Mer
cinquante-sept route de Conneau, trente-trois, trois cent quarante à Lesparre-Médoc
Rue Charles Leveque, trente-trois mille Bordeaux
Rue du Docteur Albert Barraud, trente-trois, zéro zéro zéro Bordeaux
Cours Georges Clemenceau, Saint-André-de-Cubzac
Avenue de la Pompe à Eysines
dix-huit allée Charles Leconte de Lisle
Lotissement Daunade au numéro quatorze
trente et un avenue des Baies Pyla, trente-trois mille cent quinze La Teste-de-Buch
cinquante-trois TER avenue de Magonty, trente-trois, six cents, Pessac
