deux rue Villette, quarante-huit mille cent Marvejols
deux rue Gilbert Portalier, quarante-huit, quatre cents, Florac
sept rue Jean Chastel, quarante-huit, deux cents à Saint-Chély-d'Apcher
Chemin d'Yssenges, quarante-huit mille quatre cents Florac
Impasse de la Faïsse, quarante-huit, zéro zéro zéro Mende
Route de l'Empéry, Marvejols
Boulevard Lucien Arnault à Mende
quinze chemin de l'Abbé de Born
Rue de Rémuret au numéro un
quarante-huit chemin de Séjalan, quarante-huit mille Mende
sept rue des Carces, quarante-huit, zéro zéro zéro, Mende
cinq rue Adrien Troupel, quarante-huit, trois cents à Langogne
Avenue de Ramilles, quarante-huit mille Mende
Route de Saint-Léger-du-Malzieu, quarante-huit, cent quarante Le Malzieu-Ville
Avenue de la Méridienne, Marvejols
Avenue du Docteur Conturie à Langogne
dix-neuf avenue Théophile Roussel
Route d'Aubrac au numéro dix
deux A route de Rieucros, quarante-huit mille Mende
treize chemin du Géant, quarante-huit, cent, Marvejols
vingt et un rue du Chazalet, quarante-huit, huit cents à Villefort
Lotissement des Grèzes, quarante-huit mille quatre cents Florac
Avenue Jean Monestier, quarante-huit, quatre cents Florac
Avenue François Olive (mille huit cent quatre-vingt-dix-mille neuf cent cinquante-huit), Marvejols
Rue Théodore Jean à Marvejols
seize rue Pierre Grasset
Rue du Docteur Yves Dalle au numéro quatre TER
seize route du Mas Neuf, quarante-huit mille trois cents Langogne
trois place Urbain cinq, quarante-huit, zéro zéro zéro, Mende
trois BIS chemin du Lignon, quarante-huit, cent à Marvejols
Rue Picaucel, quarante-huit mille Mende
Impasse des Hauts du Langouyrou, quarante-huit, trois cents Langogne
Route du Causse d'Auge, Mende
Rue du Faubourg Saint-Gervais à Mende
vingt chemin de la Maison Forte
Rue Piencourt au numéro treize
un route du Viala, quarante-huit mille deux cent vingt Fraissinet-de-Lozère
cinq chemin de Fraissinet, quarante-huit, trois cent vingt, Ispagnac
vingt-quatre rue Alexandre Bécamel, quarante-huit, zéro zéro zéro à Mende
Quartier Plaisance, quarante-huit mille deux cent vingt Fraissinet-de-Lozère
Allée Paul Doumer, quarante-huit, zéro zéro zéro Mende
Rue de la Cabalade, Les Vignes
Rue du Cros Del Rieu à Aumont-Aubrac
trente-deux chemin de Marijoulet
Avenue Jean-Antoine Chaptal au numéro dix
dix rue du Petit Tour de Ville, quarante-huit mille trois cents Langogne
un BIS impasse du Four Moulon, quarante-huit, zéro zéro zéro, Mende
trois rue Grand Charriera, quarante-huit, zéro zéro zéro à Badaroux
Route du Languedoc, quarante-huit mille cent trente Aumont-Aubrac
Rue de l'Estouranche, quarante-huit, cent Chirac
Cité du Rance, Mende
Chemin de Chaldecoste à Mende
quinze route de Sarroul
Rue René Gibelin au numéro douze
deux A avenue Paulin Daudé, quarante-huit mille Mende
treize avenue du Docteur de Framond, quarante-huit, cent, Marvejols
quatorze avenue de Pineton, quarante-huit, cent à Marvejols
Place du Clos de Rieucros, quarante-huit mille Mende
Route de la Margeride, quarante-huit, cent trente Aumont-Aubrac
Rue d'Aigues Passes, Mende
Rue l'Estival au Monastier-Pin-Moriès
neuf avenue du Malzieu
Place de Chirac au numéro cinq
quatre impasse du Coteau des Ecureuils, quarante-huit mille Mende
deux chemin de Costevieille Basse, quarante-huit, cent, Marvejols
trente-sept avenue Pierre Pignide, quarante-huit, deux cents à Saint-Chély-d'Apcher
Route de la Brèze, quarante-huit mille cent cinquante Meyrueis
Avenue de Peyre, quarante-huit, cent trente Aumont-Aubrac
Rue de Sabel, Barjac
Esplanade Marceau Farelle à Florac
un impasse Bringer
Chemin de Saint-Ilpide au numéro deux
dix rue d'Espinassoux, quarante-huit mille cent Marvejols
vingt et un route de Marijoulet, quarante-huit, deux cent trente, Chanac
cinq rue Gui de Chaulhac, quarante-huit, zéro zéro zéro à Mende
Chemin de Villerousset, quarante-huit mille Mende
Impasse du Val d'Allier, quarante-huit, trois cents Langogne
Rue d'Emborelle, Marvejols
Rue des Tours Redondes à Chanac
vingt-huit rue de Genévriers
Route du Ron de Montal au numéro onze
six avenue Nelson-Mandela, quarante-huit mille Mende
cinq place du Soubeyran, quarante-huit, cent, Marvejols
sept rue de la Laine, quarante-huit, cent à Marvejols
Rue Léon Vizier, quarante-huit mille cinq cents Banassac
Rue de la Bavière, quarante-huit, zéro zéro zéro Mende
Rue du Ferradou, Mende
Rue du Minal à Aumont-Aubrac
quarante rue des Charchaires
Rue Monseigneur de Ligonnes au numéro deux
six BIS chemin des Pousets, quarante-huit mille Mende
seize rue des Branchettes, quarante-huit, deux cents, Saint-Chély-d'Apcher
sept impasse du Versant, quarante-huit, deux cents à Saint-Chély-d'Apcher
Rue Marie de Marnhac, quarante-huit mille cent Marvejols
Rue des Martyrs du Maquis, quarante-huit, deux cents Saint-Chély-d'Apcher
Rue des Finets, Mende
Rue des Terres Bleues à Mende
quatre chemin de Séjas
Chemin de Saint-Privat au numéro dix-sept
quatorze rue du Barruel, quarante-huit mille deux cents Saint-Chély-d'Apcher
quatre rue de la Couvertoirade, quarante-huit, zéro zéro zéro, Mende
huit rue de l'Arjal, quarante-huit, zéro zéro zéro à Mende
Chemin de Préfontaines, quarante-huit mille cent Marvejols
Place Boyer, quarante-huit, quatre cents Florac
Rue David Quet, Fraissinet-de-Lozère
Rue Chon del Cabat à Mende
vingt rue Gustave Pelisse
Rue du Lotissement des Bruguières au numéro six mille trois cent onze
dix rue Prunières, quarante-huit mille cent Marvejols
un rue Lou Chon, quarante-huit, cent, Le Monastier-Pin-Moriès
dix-neuf rue des Hauts de Rieucros, quarante-huit, zéro zéro zéro à Mende
Place Louis Dides, quarante-huit mille quatre cents Florac
Rue de l'Escure du Bois, quarante-huit, cent trente Aumont-Aubrac
Boulevard de Chambrun, Marvejols
Quartier de la Crotz de Runes à Fraissinet-de-Lozère
sept impasse de la Petite Combe
Chemin de Ramilles au numéro quatorze
cinq chemin de Janicot, quarante-huit mille Mende
dix-neuf rue du Faubourg La Vabre, quarante-huit, zéro zéro zéro, Mende
six mille trente-neuf chemin des Freres, quarante-huit, huit cents à Villefort
Rue Gérard Donnadieu, quarante-huit mille quatre cents Florac
Boulevard Henri Bourrillon, quarante-huit, zéro zéro zéro Mende
Rue Armand Jullie, Florac
Route du Chapitre à Mende
trente-neuf chemin de Sénouard
Impasse de Ramilles au numéro six
huit A chemin des Mègres, quarante-huit mille Mende
trente-six chemin des Quatre Roues, quarante-huit, cent, Marvejols
six impasse des Milans, quarante-huit, zéro zéro zéro à Mende
Rue Justin Gruat, quarante-huit mille quatre cents Florac
Rue de Galastre, quarante-huit, cent quarante Le Malzieu-Ville
Quartier du Pont de Peyre, Marvejols
Rue de la Tendelle à Mende
trois rue Jean Roujon
Avenue du Serre au numéro quinze
deux BIS quai du Langouyrou, quarante-huit mille trois cents Langogne
onze quartier du Pont d'Allier, quarante-huit, trois cents, Langogne
quatre impasse Poussegnat, quarante-huit, cent au Monastier-Pin-Moriès
Quartier de la Croisette, quarante-huit mille quatre cents Florac
Rue du Thérond, quarante-huit, quatre cents Florac
Avenue de Tatula, Saint-Chély-d'Apcher
Route de Salenson à Ispagnac
un traverse de la Villette
Rue de la Font-Bonne au numéro vingt-six
neuf raccourci de la Boulaine, quarante-huit mille Mende
quatorze boulevard Rever Père de Jabrun, quarante-huit, cent, Marvejols
seize rue de Chambareille, quarante-huit, deux cents à Saint-Chély-d'Apcher
Impasse du Chapelierou, quarante-huit mille Mende
Quartier de la Bessède, quarante-huit, quatre cents Florac
Rue de la Ginèze, Barjac
Rue du Pourtal Chabrit à Sainte-Enimie
cinq lotissement Castanier
Rue des Allemandous au numéro huit
seize rue Ville de la Baie, quarante-huit mille Mende
deux allée Pré du Seigneur, quarante-huit, quatre cents, Florac
vingt-deux A chemin de Crouzas, quarante-huit, zéro zéro zéro à Mende
Chemin des Plots, quarante-huit mille trois cent vingt Ispagnac
Rue du Colonel Thomas, quarante-huit, zéro zéro zéro Mende
Avenue de Mende, Saint-Alban-sur-Limagnole
Avenue de Saugues à Saint-Alban-sur-Limagnole
seize avenue de Mirandol
Rue des Sèdaries au numéro neuf
six mille trois cent vingt-six chemin Antouasse, quarante-huit mille cinq cents La Canourgue
deux impasse de l'Ensoleiade, quarante-huit, trois cents, Langogne
huit lotissement la Gravette, quarante-huit, quatre cents à Florac
Rue de la Fonde, quarante-huit mille huit cents Villefort
Allée Piencourt, quarante-huit, zéro zéro zéro Mende
Rue Magdeleine Quarante, Banassac
Rue de la Pastura à Langogne
sept chemin Del Ron Del Chastel
Rue Traversière Notre-Dame au numéro trois
deux avenue du Repos, quarante-huit mille cent trente Aumont-Aubrac
un rue Claude Erignac, quarante-huit, cent, Le Monastier-Pin-Moriès
un chemin de Coste Drèche, quarante-huit, cent à Marvejols
Chemin de Costevieille Ségala, quarante-huit mille cent Marvejols
Rue des Boulaines, quarante-huit, zéro zéro zéro Mende
Chemin de Costechalde, Marvejols
Boulevard Guérin d'Apcher à Saint-Chély-d'Apcher
douze rue de la Combe aux Fées
Rue d'Almontet au numéro un
quatre rue Chanial, quarante-huit mille trois cents Langogne
deux TER place Marthe Dupeyron, quarante-huit, trois cents, Langogne
onze rue de Wunsiedel, quarante-huit, zéro zéro zéro à Mende
Impasse de Bessière, quarante-huit mille cent Marvejols
Quartier des Abattoirs, quarante-huit, trois cents Langogne
Chemin d'Azinières, Florac
Rue de la Jarretière à Bagnols-les-Bains
quinze rue des Esclops
Rue de Volterra au numéro douze
cinq lotissement Belvezet, quarante-huit mille quatre cents Florac
trois lotissement Montmartre, quarante-huit, deux cents, Saint-Chély-d'Apcher
vingt-quatre rue Jules Daudé, quarante-huit, cent à Marvejols
Rue Alexis Solanet, quarante-huit mille deux cent dix Les Vignes
Rue Paulin Talabot, quarante-huit, huit cents Villefort
Lotissement le Vallon d'Olt, Banassac
Chemin de Gardes à Mende
vingt-cinq chemin Marcellin Pellet
Impasse Font Fadette au numéro un
trois traverse de Sénouard, quarante-huit mille cent Marvejols
deux mille trente route du Malzieu, quarante-huit, deux cents, Saint-Chély-d'Apcher
quatre rue Armand Guilhon, quarante-huit, trois cents à Langogne
Rue de Vila Real, quarante-huit mille Mende
Avenue du Père Coudrin, quarante-huit, zéro zéro zéro Mende
Chemin de Castelsec, Mende
Route de Pignol à Langogne
un place au Blé
Rue du Pré Claux au numéro vingt
vingt-sept allée Raymond Fages, quarante-huit mille Mende
huit route de Chirac, quarante-huit, cent, Le Monastier-Pin-Moriès
sept rue Bonnet de Pailleret, quarante-huit, cent à Marvejols
Rue Chauvets, quarante-huit mille trois cents Langogne
Rue de la Limagnole, quarante-huit, cent vingt Saint-Alban-sur-Limagnole
Rue Indira-Gandhi, Mende
Chemin de Costevieille Haute à Marvejols
dix rue Guillaume Chaulhac
Rue du Fourniols au numéro six
huit rue de Brioude, quarante-huit mille quatre cents Florac
trois chemin du Val d'Allier, quarante-huit, trois cents, Langogne
deux B rue des Trois Mulets, quarante-huit, zéro zéro zéro à Mende
Chemin de Costevieille, quarante-huit mille cent Marvejols
Impasse du Tarnon, quarante-huit, quatre cents Florac
Boulevard Britexte, Mende
Lotissement d'Azinières à Florac
vingt-huit rue de la Grèzotière
Impasse de Saint-Ilpide au numéro quinze
sept mille cinq rue du Lotissement du Golf, quarante-huit mille cinq cents La Canourgue
huit rue Ravat, quarante-huit, trois cents, Langogne
un chemin du Moulin de Marce, quarante-huit, trois cents à Langogne
Rue Basse Colagne, quarante-huit mille cent Le Monastier-Pin-Moriès
Route Départementale neuf cent quatre-vingt-huit, quarante-huit, six cents Auroux
Chemin de la Safranière, Mende
Impasse Coustillou au Monastier-Pin-Moriès
quinze rue Fourdoules
Chemin de la Charze au numéro un
six mille six cent sept route de la Fare, quarante-huit mille cent Chirac
quatre avenue du Triadou, quarante-huit, deux cent trente, Chanac
trois rue de la Font Catada, quarante-huit, deux cent vingt à Fraissinet-de-Lozère
Impasse de la Tendelle, quarante-huit mille Mende
Avenue de la Thébaïde, quarante-huit, cent Marvejols
Route des Bessons, Saint-Chély-d'Apcher
Chemin de la Chapelude à Langogne
quatre A boulevard Aurelle de Paladines
Chemin de l'Enclos Roussel au numéro trente
huit route du Ron Musel, quarante-huit mille deux cent vingt Fraissinet-de-Lozère
trois place d'Arbucies, quarante-huit, quatre cents, Florac
huit impasse Bouos Del Bon, quarante-huit, cent au Monastier-Pin-Moriès
Place du Planaguet, quarante-huit mille deux cent trente Chanac
Impasse Planchette, quarante-huit, cent Le Monastier-Pin-Moriès
Place des Bateliers, Les Vignes
Impasse Guillaume Chaulhac à Saint-Chély-d'Apcher
cinq impasse des Oreillettes
Place de l' église au numéro quatre
sept rue de la Rovère, quarante-huit mille Mende
onze rue du Moulin de Sicard, quarante-huit, trois cents, Langogne
dix-huit route des Grèzes, quarante-huit, quatre cents à Florac
Rue Henri Guigon, quarante-huit mille trois cents Langogne
Rue de Fontanilles, quarante-huit, zéro zéro zéro Mende
Enclos Boutin, Florac
Impasse Ermitage à Langogne
deux chemin des Clapasses
Rue du Lotissement de la Retz au numéro six mille quatre cent soixante-douze
huit lotissement Broussous, quarante-huit mille quatre cents Florac
quatre impasse Chon Gabriel, quarante-huit, trois cents, Langogne
six impasse de la Honde, quarante-huit, trois cents à Langogne
Avenue du Cheyla, quarante-huit mille cent Marvejols
Rue Foncouverte, quarante-huit, deux cents Saint-Chély-d'Apcher
Voie Communale Quartier du Chambon, Florac
Chemin des Gachassous à Langogne
six mille trois cent cinquante et un lotissement Les Estournelles
Lotissement Saint-Léger au numéro deux
six mille deux cent quatre-vingt-neuf avenue Jacques de Felligonde, quarante-huit mille cent quarante Le Malzieu-Ville
neuf rue Mascoussel, quarante-huit, cent, Marvejols
deux A rue Léopold Monestier, quarante-huit, zéro zéro zéro à Mende
Chemin du Meylet, quarante-huit mille Mende
Rue Pré Vival, quarante-huit, zéro zéro zéro Mende
Rue de la Gleyzette, Villefort
Rue Jean-Jacques-Rousseau à Mende
six mille trois cent quatre-vingt-six rue Cante Gal
Rue de Saint-Préjet au numéro sept
quatre lotissement Terre Rouge, quarante-huit mille quatre cents Florac
quarante-trois traverse de l'Aubrac, quarante-huit, cent, Marvejols
six chemin de la Sous Station, quarante-huit, cent au Monastier-Pin-Moriès
Route de Florac, quarante-huit mille cent cinquante Meyrueis
Place Frère Cros, quarante-huit, trois cents Langogne
Route de Naussac, Langogne
Rue Léon Jalbert à Saint-Chély-d'Apcher
trois chemin du Galion
Rue Paulin Daudé au numéro cinq
dix-sept BIS boulevard de Soubeyran, quarante-huit mille Mende
cinq BIS place René Estoup, quarante-huit, zéro zéro zéro, Mende
trois rue du Faubourg Montbel, quarante-huit, zéro zéro zéro à Mende
Traverse Chaldecoste, quarante-huit mille Mende
Avenue de Fournels, quarante-huit, deux cents Saint-Chély-d'Apcher
Rue Paul Mendras, Marvejols
Chemin du Bressal à Mende
quinze rue du Razas
Rue du Coulas au numéro six mille trente
six route de Granet, quarante-huit mille trois cents Langogne
sept impasse Monseigneur Louis Dalle, quarante-huit, zéro zéro zéro, Mende
sept rue de l'Ensolelhada, quarante-huit, deux cent vingt à Fraissinet-de-Lozère
Quai de Berlière, quarante-huit mille Mende
Rue de la Baysse, quarante-huit, cent vingt Saint-Alban-sur-Limagnole
Rue de la Campanade, Le Bleymard
Rue des Mouchios à Saint-Chély-d'Apcher
deux chemin des Couars
Chemin de Rivemale au numéro deux
cinq impasse Vidal, quarante-huit mille cent Marvejols
deux place du Triadou, quarante-huit, deux cent trente, Chanac
quatre impasse du Général-Leclerc, quarante-huit, zéro zéro zéro à Mende
Rue des Chabrières, quarante-huit mille Mende
Lotissement Le Sabot, quarante-huit, trois cent vingt Ispagnac
Hameau de Beldoire, Les Vignes
Impasse du Chanoine Félix Remize à Mende
trente-quatre avenue Jean-Moulin
Place Henri Cordesse au numéro sept
douze rue Marie et Raymond Martin, quarante-huit mille trois cent vingt Quézac
six impasse de la Mimente, quarante-huit, quatre cents, Florac
quatre route de Saint-Alban en Montagne, quarante-huit, trois cents à Langogne
Impasse du Faubourg La Vabre, quarante-huit mille Mende
Rue de l'Ancienne Maison Consulaire, quarante-huit, zéro zéro zéro Mende
Place Auguste Plagnes, Quézac
Promenade du Vieux Pont à Mende
sept rue du Chou Vert
Rue des Hermes au numéro vingt-neuf
neuf rue Lou Toura, quarante-huit mille cent vingt Saint-Alban-sur-Limagnole
six mille deux cent trente-trois grandrieu Village, quarante-huit, six cents, Grandrieu
trois place Paul Comte, quarante-huit, quatre cents à Florac
Chemin du Courtet, quarante-huit mille deux cent vingt Fraissinet-de-Lozère
Rue du Planaguet, quarante-huit, deux cent trente Chanac
Lotissement Penote Nord, Saint-Alban-sur-Limagnole
Passage de la Vicairie aux Vignes
quatre lotissement de la Draille d'Yssenges
Place Jules André au numéro sept
six rue de l'Expansion, quarante-huit mille Mende
cinq impasse Jean-Giono, quarante-huit, zéro zéro zéro, Mende
cinq place du Martinet, quarante-huit, huit cents à Villefort
Impasse Castanier, quarante-huit mille cent Marvejols
Rue du Chaousse, quarante-huit, trois cents Langogne
Rue d'Angiran, Mende
Lotissement La Margeride au Malzieu-Ville
quatorze rue de la Coustarelle
Rue Maillan au numéro six mille sept cent quarante-deux
deux promenade Louis Cabanettes, quarante-huit mille cent Marvejols
trois rue de la Toscane, quarante-huit, zéro zéro zéro, Mende
cinq BIS impasse de l'Ayrette, quarante-huit, zéro zéro zéro à Mende
Quai La Petite Roubeyrolle, quarante-huit mille Mende
Place Pierre Galtier, quarante-huit, trois cents Langogne
Chemin des Deux Bouches, Badaroux
Chemin Jean Fontugne à Marvejols
cinq chemin des Cayres
Lotissement Les Côteaux au numéro sept
dix lotissement Desbouis, quarante-huit mille quatre cents Florac
un rue Albert-Einstein, quarante-huit, zéro zéro zéro, Mende
huit route du Mont Lozère, quarante-huit, cent quatre-vingt-dix au Bleymard
Rue du Clos de Rieucros, quarante-huit mille Mende
Impasse des Allemandous, quarante-huit, trois cents Langogne
Impasse des Lombards, Langogne
Traversière Janicot à Mende
six mille soixante-dix-huit quai de la Barrière
Traverse Jean-de-La Fontaine au numéro un
quatre quartier La Croix du Gendre, quarante-huit mille trois cent vingt Ispagnac
sept impasse de la Roubeyrolle, quarante-huit, zéro zéro zéro, Mende
dix rue Rochevallier, quarante-huit, cent à Marvejols
Quai Grande Roubeyrolle, quarante-huit mille Mende
Chemin de Montjezieu, quarante-huit, cent Le Monastier-Pin-Moriès
Impasse Maria-Callas, Mende
Rue du Pourtagou à Chanac
douze cité de Giboulet
Rue Félix Viallet au numéro vingt-quatre
cinq chemin Édouard-Alfred Martel, quarante-huit mille quatre cents Florac
six mille cent trente-quatre zone Artisanale de Capjalat, quarante-huit, cinq cents, Banassac
trois boulevard Théophile Roussel, quarante-huit, zéro zéro zéro à Mende
Rue de l'Ancienne Vigne, quarante-huit mille quatre cents Florac
Voie Communale Quartier de la Gravette, quarante-huit, quatre cents Florac
Rue Callongue, La Canourgue
Rue Marthe Boissier à Florac
six mille quatre-vingt-trois route de Montalbert
Chemin de Sirvens au numéro dix
un chemin de l'Oultre, quarante-huit mille deux cent vingt Fraissinet-de-Lozère
trois impasse des Branchettes, quarante-huit, deux cents, Saint-Chély-d'Apcher
deux rue de la Biogue, quarante-huit, zéro zéro zéro à Badaroux
Rue Florit, quarante-huit mille cent quarante Le Malzieu-Ville
Rue Victor Cordesse, quarante-huit, cent Marvejols
Chemin de la Chazette, Le Malzieu-Ville
Lou Chambon à Recoules-d'Aubrac
quatre rue des Plaisirs
Chemin du Beldou au numéro quatre
neuf rue Henri-Cordesse, quarante-huit mille Mende
trois traverse du Carmel, quarante-huit, zéro zéro zéro, Mende
trente-neuf rue Roger Baffie, quarante-huit, deux cents à Saint-Chély-d'Apcher
Quartier de Malasanha, quarante-huit mille deux cent vingt Fraissinet-de-Lozère
Rue de la Chastre, quarante-huit, cent vingt Saint-Alban-sur-Limagnole
Voie Communale Quartier du Plo, Ispagnac
Impasse du Merle-Rieur à Mende
deux impasse Pelaprat
Rue de la Tieule au numéro un
six mille six cent quatre-vingt-neuf route du Val de Colagne, quarante-huit mille cent Chirac
cinq impasse d'Aigues Passes, quarante-huit, zéro zéro zéro, Mende
huit rue de l'Estancogne, quarante-huit, cent à Marvejols
Rond-Point des Combelles, quarante-huit mille deux cents Saint-Chély-d'Apcher
Avenue de Saint-Chély, quarante-huit, cent quarante Le Malzieu-Ville
Rue Jean-de-La Fontaine, Mende
Rue de la Tride à Mende
un impasse Les Hauts de la Gare
Rue de Boutarottes au numéro deux
dix chemin de Vachery, quarante-huit mille Mende
huit lotissement Billières, quarante-huit, cent, Marvejols
un rue del Cantonier, quarante-huit, deux cent vingt à Fraissinet-de-Lozère
Passage du Riou, quarante-huit mille Badaroux
Porte de Chanelles, quarante-huit, cent Marvejols
Lotissement Les Ayres, Meyrueis
Lotissement le Clos Roussel à Marvejols
trois rue du Vallon de Rieucros
Rue Croix de Chapel au numéro huit
six mille cent quarante-deux route de Biffarès, quarante-huit mille cent vingt Saint-Alban-sur-Limagnole
dix-neuf rue de la Draine, quarante-huit, zéro zéro zéro, Mende
dix rue Chanteronne, quarante-huit, zéro zéro zéro à Mende
Rue des Oreillettes, quarante-huit mille Mende
Chemin Dels Pradets, quarante-huit, deux cent vingt Fraissinet-de-Lozère
Traverse du Mazet, Marvejols
Rue de Palhères à Villefort
sept quartier de la Table Ronde
Rue du Vibron au numéro cinq
dix lotissement le Clos du Chambon, quarante-huit mille quatre cents Florac
quarante pignol, quarante-huit, trois cents, Langogne
trois rue du Toural, quarante-huit, deux cents à Saint-Chély-d'Apcher
Avenue Maurice Tour, quarante-huit mille quatre cents Florac
Place de la Coustarade, quarante-huit, cent Marvejols
Chemin Placide Louis Chapelle, Fraissinet-de-Lozère
Rue de la Ruaille à Saint-Chély-d'Apcher
six mille route du Mas de la Barque
Impasse Adrien Troupel au numéro dix-huit BIS
six mille trois cent trente-neuf lotissement Le Villeret, quarante-huit mille cent quarante Le Malzieu-Ville
un rue de l'Oule, quarante-huit, quatre cents, Florac
un BIS chemin du Rejal, quarante-huit, trois cent vingt à Ispagnac
Route de Molines, quarante-huit mille trois cent vingt Ispagnac
Rue Jules Laget, quarante-huit, zéro zéro zéro Mende
Lotissement La Truyère, Le Malzieu-Ville
Rue de Soubestragne à Barjac
six rue Tourette
Rue Charriera Crose au numéro quatre
deux impasse Guigon, quarante-huit mille trois cents Langogne
deux rue Chicane, quarante-huit, cent, Marvejols
onze chemin de Prat-Negret, quarante-huit, zéro zéro zéro à Mende
Impasse du Castanet, quarante-huit mille Badaroux
Traverse du Fourniols, quarante-huit, quatre cents Florac
Rue Albert-Camus, Mende
Boulevard Robert de Flers au Malzieu-Ville
un avenue du Pont Roupt
Rue du Pré de la Foire au numéro sept
six chemin Del Cros de Palhassa, quarante-huit mille deux cent vingt Fraissinet-de-Lozère
dix boulevard Saint-Dominique, quarante-huit, cent, Marvejols
trois chemin Del Grand Champ, quarante-huit, deux cent vingt à Fraissinet-de-Lozère
Chemin Dels Orts, quarante-huit mille deux cent vingt Fraissinet-de-Lozère
Rue d'Èbes, quarante-huit, deux cent trente Chanac
Place du Portalou, La Canourgue
Route de Chassignole à Saint-Chély-d'Apcher
vingt-huit voie Communale Qrt Espinassous Saint-Privat
Route de Montcayroux au numéro six mille six cent quatre-vingt-trois
quatre impasse Prunières, quarante-huit mille cent Le Monastier-Pin-Moriès
un place du Saguenay, quarante-huit, quatre cents, Florac
un impasse de la Blachère, quarante-huit, zéro zéro zéro à Badaroux
Rue Rascalou, quarante-huit mille Badaroux
Lestrado Basso, quarante-huit, six cents Grandrieu
Chemin Dels Croses, Fraissinet-de-Lozère
Impasse de Crespin à Marvejols
deux route des Choisinets
Impasse Rascalon au numéro cinq
neuf rue Henri Rivière, quarante-huit mille Mende
sept chemin du Moulin de la Griffette, quarante-huit, deux cents, Saint-Chély-d'Apcher
deux rue du Vialaret, quarante-huit, cent à Chirac
Impasse du Villaret, quarante-huit mille Mende
Rue de Cessenou, quarante-huit, cent trente Aumont-Aubrac
Chemin du Roussel, Mende
Rue des Tourdres à Mende
huit rue de Sipple Sert
Chemin des Fangouses au numéro cinq
dix route de Palhassa, quarante-huit mille deux cent vingt Fraissinet-de-Lozère
six mille six esplanade André Chamson, quarante-huit, cent cinquante, Meyrueis
neuf impasse François-Rabelais, quarante-huit, zéro zéro zéro à Mende
Chemin de la Font del Pic, quarante-huit mille deux cent vingt Fraissinet-de-Lozère
Allée de Belvezet, quarante-huit, trois cents Langogne
Impasse Saint-Privat, Mende
Chemin Luis-Mariano à Mende
six mille soixante route de Meyrueis
Impasse du Couffin au numéro six mille cinq cent dix-sept
sept rue Coste Ebesse, quarante-huit mille Badaroux
deux impasse du Pastura, quarante-huit, zéro zéro zéro, Badaroux
deux place Alphonse Nouet, quarante-huit, trois cents à Langogne
Rue de Montjézieu, quarante-huit mille cent Chirac
Rue des Rives de l'Urugne, quarante-huit, cinq cents La Canourgue
Rue Hippolyte Chalvet, Saint-Chély-d'Apcher
Rue du Claouset à Meyrueis
six mille quatre chemin de Capelade
Chemin de Ferrussac au numéro six mille treize
six mille cinq cent trente-cinq place de Montjézieu, quarante-huit mille cent Chirac
quatre rue du Briançon, quarante-huit, quatre cents, Florac
trois impasse Prat, quarante-huit, trois cents à Langogne
Avenue de Saint-Chély d'Apcher, quarante-huit mille cent vingt Saint-Alban-sur-Limagnole
Impasse Bès de Berc, quarante-huit, cent Marvejols
