dix chemin de Peyssillieu, soixante-neuf, trois cent trente, Meyzieu
vingt-cinq rue Bourget, soixante-neuf, zéro zéro neuf à Lyon
Rue Sainte Marie des Terreaux, soixante-neuf mille un Lyon
Rue Lieutenant-Général Chabert, soixante-neuf, quatre cents Villefranche-sur-Saône
Rue Claude Vignard, Villefranche-sur-Saône
Rue Commandant Pégout à Lyon
soixante-sept route du Larion
Chemin des Renavelles au numéro six mille dix-huit
un rue Claude Chenevière, soixante-neuf mille six cent quatre-vingt-dix Brussieu
huit place Janisson, soixante-neuf, cent soixante-dix, Tarare
cinquante-six chemin du Cagnon, soixante-neuf, deux cent dix à Chevinay
Route de la Croix d'Ajoux, soixante-neuf mille quatre cent trente Chénelette
Impasse Docteur Louis Jugnet, soixante-neuf, cent quatre-vingt-dix Saint-Fons
Chemin du Sauzet, Dareizé
Impasse Benoit Berlioz à Chassieu
huit chemin du Bois des Côtes
Chemin de Chanzé au numéro cinq cent quatorze
trente-cinq rue Auguste Villy, soixante-neuf mille cinq cent cinquante Amplepuis
deux chemin du Vieux Crépieux, soixante-neuf, trois cents, Caluire-et-Cuire
treize place Gilbert Boissier, soixante-neuf, cent vingt à Vaulx-en-Velin
Allée des Rouettes, soixante-neuf mille cinq cent soixante-dix Dardilly
Quai de la Jonchère, soixante-neuf, six cent soixante Collonges-au-Mont-d'Or
Rue Saint Eusèbe, Lyon
Montée de la Sauvagie à Ternay
deux rue Gabriel Lambesky
Chemin du Clos des Sapins au numéro un
deux cent vingt-quatre chemin de la Greffière, soixante-neuf mille trois cent quatre-vingts Châtillon
quatre allée Robert Perrier, soixante-neuf, deux cent soixante, Charbonnières-les-Bains
trois rue de Chassignole, soixante-neuf, trois cent trente à Meyzieu
Route des Trottières, soixante-neuf mille trois cent quatre-vingts Alix
Impasse Flesselles, soixante-neuf, zéro zéro un Lyon
Rue de la Servantière, Saint-Romain-en-Gal
Chemin du Ronzère à Chaponost
neuf rue Antoine Louvier
Rue des Plattards au numéro deux
sept cent soixante-dix route de Champanard, soixante-neuf mille deux cent vingt Saint-Jean-d'Ardières
cinquante allée des Seigneurs, soixante-neuf, deux cent dix, Saint-Germain-Nuelles
vingt-quatre allée des Muses, soixante-neuf, deux cent trente à Saint-Genis-Laval
Rue des Rivoisières, soixante-neuf mille cent vingt-quatre Colombier-Saugnieu
Rue Fine, soixante-neuf, trois cent vingt Feyzin
Impasse Reclaine, Thizy-les-Bourgs
Rue du Tabagnon à Bessenay
sept A rue de l'Inverse
Avenue Armand Chouffet au numéro quatre cent soixante et onze
trois allée de la Santé, soixante-neuf mille cinq Lyon
quinze place Fleury Lancelin, soixante-neuf, deux cent quatre-vingts, Marcy-l'Étoile
trois montée des Religieuses, soixante-neuf, deux cent dix à Sain-Bel
Place Bayère, soixante-neuf mille cinq cent soixante-dix Dardilly
Rue du Moulin Berthier, soixante-neuf, cinq cent quarante Irigny
Allée des Jardins de Bianne, Jons
Allée Levigne à Tassin-la-Demi-Lune
quarante-deux route de Crussilleux
Allée Philibert Piccot au numéro trois
cinquante allée du Côteau d'Anse, soixante-neuf mille quatre cent quatre-vingts Anse
neuf chemin de Chantevent, soixante-neuf, cinq cent trente, Brignais
quatre lotissement du Haut des Vignes, soixante-neuf, trois cent quatre-vingts à Lozanne
Lotissement Les Éparviers, soixante-neuf mille trois cent soixante Solaize
Dix Neuvieme Rue, soixante-neuf, huit cents Saint-Priest
Chemin de Méginand, Tassin-la-Demi-Lune
Chemin de Broulon à Montagny
onze impasse Baraille
Impasse du Rave au numéro huit
trois cent sept avenue Elie Vignal, soixante-neuf mille trois cents Caluire-et-Cuire
huit impasse Monge, soixante-neuf, trois cent trente, Meyzieu
quatre rue Nicolas Berthet, soixante-neuf, cent dix à Sainte-Foy-lès-Lyon
Rue de la Rize, soixante-neuf mille trois Lyon
Rue Jeanne Koehler, soixante-neuf, zéro zéro trois Lyon
Montée de la Petite Collonge, Gleizé
Rue Noël Maximin Descormes à Saint-Fons
quatre rue Charles Porcher
Allée du Vieux Porche au numéro cinq
un chemin des Avoraux, soixante-neuf mille deux cent cinquante Albigny-sur-Saône
six rue de Marmion, soixante-neuf, six cent quatre-vingt-dix, Brussieu
un rue Laurent Paul, soixante-neuf, cent dix à Sainte-Foy-lès-Lyon
Rue Yves Coppens, soixante-neuf mille deux cent vingt Saint-Jean-d'Ardières
Rue Passet, soixante-neuf, zéro zéro sept Lyon
Montée de la Guillardière, Oingt
Impasse des Piarris à Chiroubles
seize route du Millénaire
Allée de Chatanay au numéro huit
sept allée du Ruisseau de Ribbes, soixante-neuf mille cent soixante Tassin-la-Demi-Lune
cent chemin de la Charpière, soixante-neuf, quatre cent vingt, Longes
quinze chemin du Vignau, soixante-neuf, cent vingt-six à Brindas
Passage Davallée, soixante-neuf mille deux cent dix Saint-Pierre-la-Palud
Allée des Amandières, soixante-neuf, deux cent cinquante Montanay
Rue de la Boatière, Saint-Genis-les-Ollières
Place De Paisy à Dardilly
treize rue Thirard
Montée du Chambard au numéro cent quarante-quatre
quatre-vingt-dix-neuf mille neuf cent quatre-vingt-dix-neuf passage René Cassin, soixante-neuf mille trois cent trente Meyzieu
soixante-dix avenue des Taillis, soixante-neuf, neuf cent soixante, Corbas
trois passage Maquis de la Croix du Ban, soixante-neuf, deux cent dix à Saint-Pierre-la-Palud
Montée des Carmes Déchaussés, soixante-neuf mille cinq Lyon
Rue Stéphane Dalud, soixante-neuf, cent soixante-dix Tarare
Rue du Professeur Santy, Pontcharra-sur-Turdine
Impasse de Sain Bel à Tassin-la-Demi-Lune
treize avenue Léon Foillard
Rue de Serpaton au numéro dix-sept
deux allée Henri Lanfranchi, soixante-neuf mille trois cent trente Meyzieu
dix-huit rue Joseph Comeau, soixante-neuf, cinq cent dix, Soucieu-en-Jarrest
vingt-quatre rue Baudrand, soixante-neuf, cinq cent quarante à Irigny
Chemin des Plasses, soixante-neuf mille cinq cent soixante-dix Dardilly
Impasse du Clos Joli, soixante-neuf, deux cent quatre-vingt-dix Craponne
Rue du Chevalier Decouleur, Arnas
Rue Jean Goujat à Amplepuis
cent vingt-cinq chemin de Trézette
Rue Fabian Martin au numéro trois
quatre cent soixante-cinq route de la Crête de Chalier, soixante-neuf mille quatre cent quatre-vingts Pommiers
quatre place des Buers, soixante-neuf, cent, Villeurbanne
soixante et un allée de Tourmaline, soixante-neuf, huit cent quatre-vingt-dix à La Tour-de-Salvagny
Allée des Hauts du Bochu, soixante-neuf mille trois cent quarante Francheville
Rue Docteur Jean Sauzay, soixante-neuf, quatre cent dix Champagne-au-Mont-d'Or
Rue Chapillon, Vernaison
Chemin de la Pierre Ecuelle à Chevinay
quatre-vingt-dix-neuf mille neuf cent quatre-vingt-dix-neuf place Bourgneuf
Rue Henri Teissier au numéro vingt-trois
soixante-dix rue des Roullières, soixante-neuf mille deux cent vingt Charentay
cent vingt-huit impasse de l'Oblong, soixante-neuf, sept cents, Montagny
soixante chemin des Vosges, soixante-neuf, deux cent soixante-dix à Fontaines-Saint-Martin
Chemin de Saint-Trys, soixante-neuf mille quatre cent quatre-vingts Pommiers
Rue Antoine Salvadori, soixante-neuf, cent vingt Vaulx-en-Velin
Rue Antoine Rouillat, Chaponost
Montée de la Vigourette à Cailloux-sur-Fontaines
vingt et un rue Sainte Anne de Baraban
Route du Paisy au numéro cinq
douze allée du Champ d'Asile, soixante-neuf mille cent dix Sainte-Foy-lès-Lyon
cinq allée des Croix, soixante-neuf, cinq cent quatre-vingts, Sathonay-Village
huit rue du Commandant Bianchetti, soixante-neuf, deux cent vingt à Belleville
Allée du Bancillon, soixante-neuf mille quatre cent quatre-vingts Anse
Côte Berthaud, soixante-neuf, cinq cent quarante Irigny
Rue Jean Marcuit, Lyon
Rue de la Mitanaise à Saint-Laurent-de-Mure
cent huit chemin des Monthieux
Rue Pierre-Louis Bernaix au numéro trois
quinze rue Deshay, soixante-neuf mille cent dix Sainte-Foy-lès-Lyon
quatre passage Cazenove, soixante-neuf, zéro zéro six, Lyon
quinze rue Pernon, soixante-neuf, zéro zéro quatre à Lyon
Route de Dormon, soixante-neuf mille sept cent vingt Saint-Bonnet-de-Mure
Chemin de la Cadière, soixante-neuf, cent dix Sainte-Foy-lès-Lyon
Rue Eugène Guillemin, Bron
Rue Docteur Horand à Lyon
quatre rue de Privas
Route de Thizy au numéro quinze
huit BIS avenue des Portes de Lyon, soixante-neuf mille trois cent soixante Saint-Symphorien-d'Ozon
dix-sept BIS rue de la Doulline, soixante-neuf, trois cent quarante, Francheville
trois rue Général Brulard, soixante-neuf, zéro zéro trois à Lyon
Rue de la Grosse Roche, soixante-neuf mille sept cents Montagny
Rue Wakatsuki, soixante-neuf, zéro zéro huit Lyon
Allée de la Pastourelle, Mions
Chemin Paul Cabane à Caluire-et-Cuire
soixante-trois rue de la Joanna
Rue du Clos d'Azieu au numéro un
neuf allée de Béziers, soixante-neuf mille cent quatre-vingt-dix Saint-Fons
dix-neuf BIS impasse du Bois Brouillat, soixante-neuf, deux cent quatre-vingt-dix, Grézieu-la-Varenne
sept rue Oscar Galline, soixante-neuf, cinq cent quatre-vingts à Sathonay-Village
Chemin des Grillières, soixante-neuf mille sept cent quatre-vingts Saint-Pierre-de-Chandieu
Chemin des Romanettes, soixante-neuf, neuf cent soixante Corbas
Place de la Font Porée, Savigny
Impasse Cour du Buisson à Fontaines-Saint-Martin
trois TER impasse du Général Brosset
Parc Marx Dormoy au numéro quatre-vingt-dix-neuf mille neuf cent quatre-vingt-dix-neuf
huit chemin du Belledonne, soixante-neuf mille cinq cent soixante-dix Dardilly
cinq chemin de Décines, soixante-neuf, six cent quatre-vingts, Chassieu
sept place Jules Hottin, soixante-neuf, zéro zéro trois à Lyon
Rue du Catalpa, soixante-neuf mille six cent quarante Saint-Julien
Impasse Florian, soixante-neuf, deux cent cinquante Neuville-sur-Saône
Rue de Finale en Émilie, Grézieu-la-Varenne
Chemin de Chalay à Chasselay
deux avenue Cabias
Avenue du Casino Avenue Georges Bassinet au numéro trois
cinq allée Charles Gerhardt, soixante-neuf mille cent quatre-vingt-dix Saint-Fons
cent soixante-cinq chemin de la Combe au But, soixante-neuf, deux cent quatre-vingt-dix, Pollionnay
dix-neuf cité de Clerimbert, soixante-neuf, cinq cent quatre-vingt-dix à Saint-Symphorien-sur-Coise
Rue Alphonse Coche, soixante-neuf mille sept cent vingt Saint-Laurent-de-Mure
Rue de la Croix Fleurie, soixante-neuf, quatre cents Villefranche-sur-Saône
Place Dumas de Loire, Lyon
Montée des Rochauds à Villié-Morgon
quatre-vingt-dix-neuf mille neuf cent quatre-vingt-dix-neuf autoroute Aquarante-trois de Chambéry à Lyon
Impasse de la Platière au numéro quatre-vingt-dix-neuf mille neuf cent quatre-vingt-dix-neuf
un A chemin du Toursom, soixante-neuf mille trois cent quarante Francheville
quarante-sept chemin Verdoyant, soixante-neuf, quatre cent quatre-vingts, Pommiers
six chemin du Devès Ouest, soixante-neuf, trois cent soixante à Ternay
Chemin de Pimotin, soixante-neuf mille quatre cent vingt Tupin-et-Semons
Route de Balmondon, soixante-neuf, sept cents Saint-Andéol-le-Château
Boulevard de la Bataille de Stalingrad, Villeurbanne
Route du Patin à Oingt
vingt avenue Lucien Blanc
Rue du Brûlet au numéro sept
trois impasse Presle, soixante-neuf mille deux cent trente Saint-Genis-Laval
deux cent quatre-vingt-trois chemin du Bois Seigneur, soixante-neuf, deux cent dix, Lentilly
dix-neuf impasse de Tourvielle, soixante-neuf, zéro zéro cinq à Lyon
Place Andrée-Marie Perrin, soixante-neuf mille deux cent quatre-vingt-dix Craponne
Avenue Jean Durand, soixante-neuf, cinq cent vingt Grigny
Avenue Brianne, Anse
Chemin du Pérollier à Écully
sept impasse Jean Cotton
Rue des Pinaises au numéro deux cent vingt-six
douze rue Joseph Venet, soixante-neuf mille quatre cent quarante Mornant
trente-six route de Briante, soixante-neuf, deux cent vingt, Saint-Lager
sept allée René Char, soixante-neuf, cent vingt à Vaulx-en-Velin
Rue du Pont de Collonges, soixante-neuf mille six cent soixante Collonges-au-Mont-d'Or
Domaine de Goiffieu, soixante-neuf, sept cents Montagny
Rue de Beer Sheva, Lyon
Allée du Vieux Frêne à Craponne
un place des Frères Giraudet
Passage Mas au numéro trois
trois cent cinquante-huit chemin Rural du Plany, soixante-neuf mille cinq cent soixante Saint-Cyr-sur-le-Rhône
six impasse Lefèvre, soixante-neuf, cent vingt, Vaulx-en-Velin
cent quatre-vingt-seize rue du Champ du Garet, soixante-neuf, quatre cents à Arnas
Impasse Claude Jourdan, soixante-neuf mille huit Lyon
Rue Camille Rolland, soixante-neuf, six cents Oullins
Ruelle des Gones, Saint-Romain-de-Popey
Place Maréchal Lyautey à Lyon
seize allée Marpeau
Rue François-Joseph Bietrix au numéro six
dix rue des quatre Chapeaux, soixante-neuf mille deux Lyon
trois route du Vélair, soixante-neuf, six cent quatre-vingt-dix, Courzieu
vingt et un chemin de la Martiniére, soixante-neuf, cinq cent dix à Thurins
Marmion, soixante-neuf mille six cent quatre-vingt-dix Brussieu
Chemin de la Rosette, soixante-neuf, quatre cent quarante Taluyers
Passage Souchon, Saint-Andéol-le-Château
Place Pierre Marie Durand à L'Arbresle
cinq impasse de la Gaîté
Rue Albert Ferrus au numéro quatre
huit route de Vénissieux, soixante-neuf mille trois cent vingt Feyzin
trois allée du Clos du Centre, soixante-neuf, six cent quatre-vingt-dix, Bessenay
cinq place Saint Irénée, soixante-neuf, zéro zéro cinq à Lyon
Rue Garon Duret, soixante-neuf mille huit Lyon
Rue Edmond Cinquin, soixante-neuf, sept cents Loire-sur-Rhône
Le Fouilloux, Morancé
Allée Pierre Wroblewski à Mions
sept rue de la Condemine
Square de Morzine au numéro un
deux cent quatre-vingt-six chemin de Gyre, soixante-neuf mille quatre cent quatre-vingts Pommiers
un rue Pierre-Joseph Martin, soixante-neuf, six cents, Oullins
huit rue Claudius Collonge, soixante-neuf, zéro zéro deux à Lyon
Rue du Contal, soixante-neuf mille huit cent quatre-vingt-dix La Tour-de-Salvagny
Rue Jacques Cortay, soixante-neuf, six cent vingt Le Bois-d'Oingt
Chemin des Gonettes, Saint-Pierre-la-Palud
Rue de la Croix Clément à Montagny
huit allée de Rozières
Allée des Jardins d'Elise au numéro cent cinquante
trois montée de la Cumine, soixante-neuf mille cinq cent dix Soucieu-en-Jarrest
sept rue Emile Dorel, soixante-neuf, deux cent trente, Saint-Genis-Laval
dix-sept avenue des Catelines, soixante-neuf, sept cent vingt à Saint-Laurent-de-Mure
Passage Feuillat, soixante-neuf mille trois Lyon
Rue Favre-Garin, soixante-neuf, six cent trente Chaponost
Impasse de la Folletière, Amplepuis
Place Georges Dutrève à Belleville
deux rue du Pont des Planches
Rue du Pré de la Cour au numéro treize A
trois cent vingt chemin de Sagris, soixante-neuf mille quatre cent quarante Taluyers
six impasse Louis Chirpaz, soixante-neuf, cent trente, Écully
neuf avenue Prof Flemming, soixante-neuf, sept cents à Givors
Allée du Camping International, soixante-neuf mille cinq cent soixante-dix Dardilly
Chemin de la Haute Jardinière, soixante-neuf, trois cent soixante-dix Saint-Didier-au-Mont-d'Or
Rue du Franc Lyonnais, Cailloux-sur-Fontaines
Lotissement le Hameau de Saint-Étienne à Saint-Étienne-des-Oullières
quatre passage des Antonins
Parc Municipal au numéro un
soixante-sept rue du Rivat, soixante-neuf mille trois cent quatre-vingt-dix Millery
vingt rue Julie, soixante-neuf, zéro zéro trois, Lyon
treize rue Daniel Llacer, soixante-neuf, cent à Villeurbanne
Place Antonin Jutard, soixante-neuf mille trois Lyon
Route du Darroux, soixante-neuf, quatre cent soixante Saint-Étienne-des-Oullières
Montée de la Carette, Caluire-et-Cuire
Rue Jehan du Mas à Chazay-d'Azergues
douze chemin de Moussy
Chemin de Beille au numéro deux cent vingt-six
trois impasse des Tupiniers, soixante-neuf mille deux cent dix Savigny
seize rue Maurice Bellemain, soixante-neuf, zéro zéro cinq, Lyon
treize BIS rue du Trillet, soixante-neuf, trois cent trente à Meyzieu
Traverse de Cruzols, soixante-neuf mille deux cent dix Lentilly
Rue Albert Romain, soixante-neuf, cent quarante Rillieux-la-Pape
Chemin de la Grange Botton, Anse
Avenue Jean Goujon au Bois-d'Oingt
quatre cent six chemin de Ponce
Rue de Jardins au numéro neuf
cinq cent quatre-vingt-cinq chemin des Grands Plantiers, soixante-neuf mille quatre cent quatre-vingts Lucenay
quatre cent quatre-vingt-quinze voie Asa Paulini, soixante-neuf, quatre cent quatre-vingts, Anse
trois square Maréchal Lyautey, soixante-neuf, six cent quatre-vingts à Chassieu
Rue Ronat, soixante-neuf mille cent soixante-dix Tarare
Chemin du Tredo, soixante-neuf, quatre cent quatre-vingts Morancé
Chemin de Combefort, Le Bois-d'Oingt
Place Ludovic Monnier à Champagne-au-Mont-d'Or
deux cent vingt-deux route du Trève
Rue du Professeur Louis Paufique au numéro dix-neuf
un impasse Charles Fourrier, soixante-neuf mille six cents Oullins
quatre rue Claude Dominget, soixante-neuf, six cent trente, Chaponost
deux rue Jean Merle, soixante-neuf, deux cent quarante à Thizy-les-Bourgs
Rue Louis Archer, soixante-neuf mille deux cent trente Saint-Genis-Laval
Rue du Pré de l'Église, soixante-neuf, deux cent vingt Dracé
Boulevard Burdeau, Villefranche-sur-Saône
Rue Jean-Marie Chavant à Lyon
cent chemin de Trêve Gay
Montée des Jacquetières au numéro mille soixante-douze
vingt chemin de Gizard, soixante-neuf mille sept cents Givors
trente-sept petite Rue Pasteur, soixante-neuf, cent, Villeurbanne
huit rue Serroux, soixante-neuf, cent soixante-dix à Tarare
Petite Route des Serrières, soixante-neuf mille cinq cent quarante Irigny
Rue Pierre Ducognon, soixante-neuf, cent vingt Vaulx-en-Velin
Chemin du Finday, Brindas
Passage Gonin à Lyon
quatre impasse Charavay
Rue Louis Gattefossé au numéro six
trois impasse Chapuis, soixante-neuf mille cinq cents Bron
onze allée de l'Ormoise, soixante-neuf, trois cent quarante, Francheville
dix place Renoir, soixante-neuf, cent quarante à Rillieux-la-Pape
Rue Antoine Barbier, soixante-neuf mille six Lyon
Allée des Fanges, soixante-neuf, cinq cent quatre-vingt-dix Saint-Symphorien-sur-Coise
Chemin de Saint-Bonnet-de-Mure, Saint-Priest
Chemin du Signeret à Gleizé
onze impasse des Bassieux
Rue de Bassenon au numéro trois
quinze allée Benoît Raclet, soixante-neuf mille trois cent quatre-vingts Chazay-d'Azergues
dix-huit impasse Dr Alexandre Reymond mille neuf cent onze, soixante-neuf, sept cent quarante, Genas
deux place Pierre Puget, soixante-neuf, zéro zéro neuf à Lyon
Rue Eugène Villon, soixante-neuf mille trois cents Caluire-et-Cuire
Boulevard Victor Vermorel, soixante-neuf, quatre cents Villefranche-sur-Saône
Rue du Canon Braque, Belleville
Chemin de Roty à Lissieu
quinze chemin du Tapis Vert
Place Bachaga-Boualem au numéro quatre-vingt-dix-neuf mille neuf cent quatre-vingt-dix-neuf
cinq rue Jean-Pierre Lévy, soixante-neuf mille trois Lyon
cent quatre-vingt-cinq montée de Buisante, soixante-neuf, quatre cent quatre-vingts, Pommiers
cinq allée du Forest, soixante-neuf, quatre cents à Limas
Chemin des Gerles, soixante-neuf mille trois cent quatre-vingts Saint-Jean-des-Vignes
Chemin du Raton, soixante-neuf, six cent quatre-vingt-dix Bessenay
Rue des Anciennes Mines, Communay
Avenue de Böhlen à Vaulx-en-Velin
cinq rue Claude Chapuis
Autoroute Aquarante-six Sud de Aquarante-trois à Asept au numéro quatre-vingt-dix-neuf mille neuf cent quatre-vingt-dix-neuf
vingt et un chemin de la Pechette, soixante-neuf mille trois cent quatre-vingt-dix Millery
vingt et un rue de Montrond, soixante-neuf, sept cents, Givors
cinq placette des Ormeaux, soixante-neuf, cent vingt-six à Brindas
Rue de la Grillette, soixante-neuf mille deux cent cinquante Fleurieu-sur-Saône
Rue de Méginand, soixante-neuf, deux cent quatre-vingt-dix Saint-Genis-les-Ollières
Rue Gaston Salet, Tarare
Chemin de Fontaine Poivre à Saint-Didier-au-Mont-d'Or
soixante-quatorze montée de Fonas
Allée des Épis d'Or au numéro dix
cent soixante-douze chemin d'Amorges, soixante-neuf mille deux cent vingt Saint-Jean-d'Ardières
onze impasse Poncet, soixante-neuf, cent, Villeurbanne
huit place Saint Quentin, soixante-neuf, quatre cent cinquante à Saint-Cyr-au-Mont-d'Or
Chemin Vigne de la Fond, soixante-neuf mille quatre cent quatre-vingts Lucenay
Rue Professeur Roux, soixante-neuf, trois cents Caluire-et-Cuire
Route de Rivoire, Orliénas
Impasse du Tremagnard à Civrieux-d'Azergues
trois cent douze chemin de la Gonthière
Montée de Chervinges au numéro quatre cent quatre-vingt-quatre
quatorze rue Ecorche Boeuf, soixante-neuf mille quatre cent vingt Condrieu
quatre rue Tisserière, soixante-neuf, six cent quatre-vingts, Chassieu
trois square Averroès, soixante-neuf, zéro zéro neuf à Lyon
Impasse des Mouilles, soixante-neuf mille quatre cents Gleizé
Route du Pré du Roy, soixante-neuf, sept cents Chassagny
Impasse Thibaudon, Vaulx-en-Velin
Rue Catherine de Chaponay à Vénissieux
deux quai Fillon
Rue Galland au numéro six
trois place de l'Ancienne Préfecture, soixante-neuf mille cinq cent trente Orliénas
deux place Le Nôtre, soixante-neuf, cent quarante, Rillieux-la-Pape
trente rue Dussaussoy, soixante-neuf, zéro zéro six à Lyon
Allée des Clots, soixante-neuf mille quatre cent dix Champagne-au-Mont-d'Or
Montée Georges Kubler, soixante-neuf, zéro zéro quatre Lyon
Allée du Petit Poizat, Charly
Autoroute Asix de Paris à Lyon à Écully
trois rue Jacques Feuillet
Passage Claude Mussieu au numéro dix-neuf
sept chemin de Champvillard, soixante-neuf mille cinq cent quarante Irigny
un B rue Claudia, soixante-neuf, cent vingt, Vaulx-en-Velin
trois cent seize rue Joseph Remuet, soixante-neuf, quatre cents à Gleizé
Rue Malik Oussekine, soixante-neuf mille sept cents Givors
Rue de la Maillarde, soixante-neuf, cinq cent dix Soucieu-en-Jarrest
Chemin du Libéral, Saint-Pierre-la-Palud
Rue des Frères Rivier à Chassieu
trois rue du Moulin Dézalaire
Impasse Alexandre Godard au numéro huit
trois allée de la Rayonne, soixante-neuf mille cent vingt Vaulx-en-Velin
quatre-vingt-un impasse du Bois Don, soixante-neuf, trois cent quatre-vingts, Lozanne
deux rue des Trois Enfants, soixante-neuf, zéro zéro quatre à Lyon
Chemin des Levrières, soixante-neuf mille quatre cent quatre-vingts Anse
Allée Jean Chorel, soixante-neuf, cinq cent quatre-vingts Sathonay-Village
Chemin de Montlys, Saint-Cyr-sur-le-Rhône
Route de Berne à Blacé
quarante-cinq impasse Lathuilière
Rue de Sutin au numéro onze
cinquante-six chemin de la Pra, soixante-neuf mille cinq cent dix Messimy
cinq chemin de la Ratière, soixante-neuf, cinq cent dix, Thurins
deux rue Julien Baudrand, soixante-neuf, cinq cents à Bron
Route du Château de Porrières, soixante-neuf mille trois cent quatre-vingts Belmont-d'Azergues
Impasse Julien Racamond, soixante-neuf, deux cents Vénissieux
Petit Parc Serin, Lyon
Rue de Tullin à Saint-Marcel-l'Éclairé
dix rue Jean-Baptiste Couty
Route de Machezal au numéro huit
trois cent quinze traverse de Cosset, soixante-neuf mille six cent quarante Ville-sur-Jarnioux
quatre-vingt-dix-neuf mille neuf cent quatre-vingt-dix-neuf place Maréchal Juin, soixante-neuf, cent quarante, Rillieux-la-Pape
trois D chemin de la Crépillère, soixante-neuf, cinq cent soixante-dix à Dardilly
Route de Saint-Laurent d'Agny, soixante-neuf mille quatre cent quarante Taluyers
Rue Jules Dru, soixante-neuf, deux cent soixante-dix Couzon-au-Mont-d'Or
Lotissement du Bois du Four, Lozanne
Montée de la Balme à Saint-Fons
soixante-quinze chemin de la Pronde
Chemin du Ravatel au numéro quatre-vingt-dix-huit
deux rue de la Combabelle, soixante-neuf mille six cent quatre-vingt-dix Brussieu
deux rue du Professeur Émile Bouvier, soixante-neuf, cent, Villeurbanne
dix rue de Sourzy, soixante-neuf, sept cents à Montagny
Rue Alexandre Poidebard, soixante-neuf mille quatre cent trente Régnié-Durette
Rue du Grand Cerisier, soixante-neuf, deux cent dix Fleurieux-sur-l'Arbresle
Rue Chambfort, Villeurbanne
Impasse de la Pustière à La Tour-de-Salvagny
douze chemin de Pomponey
Rue des Fayettes au numéro trente-trois
onze rue Adolphe Chapoutier, soixante-neuf mille trois cent trente Pusignan
neuf rue Jean Bergeret, soixante-neuf, cent cinquante, Décines-Charpieu
deux cent six chemin de Coquerieux, soixante-neuf, quatre cent quatre-vingts à Anse
Place de la Pèse, soixante-neuf mille sept cents Saint-Andéol-le-Château
Chemin des Laies, soixante-neuf, cinq cent quarante Irigny
Avenue David Ben Gourion, Lyon
Rue de la Grume à Lantignié
cinq chemin des Rames
Impasse Hector Malot au numéro un
trois place Xavier Ricard, soixante-neuf mille cent dix Sainte-Foy-lès-Lyon
un petite Rue de la Crépillère, soixante-neuf, cinq cent soixante-dix, Dardilly
dix-neuf impasse Mirabelle, soixante-neuf, cent dix à Sainte-Foy-lès-Lyon
Rue Jean-Antoine Baif, soixante-neuf mille sept cent quatre-vingts Mions
Rue Paul Bovier Lapierre, soixante-neuf, cinq cent trente Brignais
Rue Clapisson, Thizy-les-Bourgs
Chemin du Grand Bresselan à Fontaines-Saint-Martin
six chemin du Mont Cindre
Impasse Vermorel au numéro quarante-huit
cent vingt-six rue Cochard, soixante-neuf mille cinq cent soixante Sainte-Colombe
deux rue Jean Piccandet, soixante-neuf, deux cent quatre-vingt-dix, Saint-Genis-les-Ollières
six rue Philippe Damiron, soixante-neuf, quatre cents à Arnas
Chemin du Mas Joint, soixante-neuf mille deux cent soixante-dix Fontaines-Saint-Martin
Chemin de Barbesi, soixante-neuf, trois cent vingt Feyzin
Route d'Echalas, Givors
Rue des Puiseurs à Lyon
deux impasse des Vignes de Nany
Impasse du Puits d'Alos au numéro sept
dix montée du Vieux Pont, soixante-neuf mille deux cent soixante Charbonnières-les-Bains
deux avenue Joseph Rivière, soixante-neuf, cent soixante-dix, Tarare
trois cent soixante-douze chemin des Morguères, soixante-neuf, six cent vingt au Bois-d'Oingt
Chemin des Anciennes Vignes, soixante-neuf mille quatre cent dix Champagne-au-Mont-d'Or
Place Marc Sangnier, soixante-neuf, zéro zéro huit Lyon
Rue Sabine et Miron Zlatin, Lyon
Impasse des Grandes Verchères à Corbas
quatorze passage Martin
Impasse Colomban au numéro vingt-deux
