vingt-six chemin de Marieu, quatre-vingt-deux mille quatre cent quarante Réalville
quatorze avenue du Roc Deymie, quatre-vingt-deux, cent quarante, Saint-Antonin-Noble-Val
quatre-vingt-quinze rue Morin-Védrines, quatre-vingt-deux, zéro zéro zéro à Montauban
Route de Vignarnaud, quatre-vingt-deux mille Montauban
Route de Verlhaguet, quatre-vingt-deux, deux cent quatre-vingt-dix Montbeton
Impasse Maginot, Golfech
Chemin de Fayence à Montauban
cent cinquante-trois côte du Gasaillant
Chemin de Brial au numéro cent quatre-vingt-quinze C
mille trois cent quarante-cinq B chemin de Cascaret, quatre-vingt-deux mille sept cent dix Bressols
quatre lotissement Des Bastides de Gillac, quatre-vingt-deux, cinq cents, Beaumont-de-Lomagne
cent vingt-cinq chemin de Tarayre, quatre-vingt-deux, trois cents à Monteils
Chemin des Gascous, quatre-vingt-deux mille Montauban
Avenue Auguste Grèze, quatre-vingt-deux, quatre cents Valence
Rue Ernest Mercadier, Montauban
Route de Saint-Porquier aux Barthes
sept avenue Saturne
Chemin de Lafaderie au numéro cinq cent quatre-vingt-quatorze
mille cent quatre-vingt-un voie Communale de Saint-Nicolas de la Grave, quatre-vingt-deux mille deux cents Moissac
mille deux cent un chemin de Prévost, quatre-vingt-deux, zéro zéro zéro, Montauban
deux mille trente route de Trixe, quatre-vingt-deux, sept cent dix à Bressols
Rue de Marchet, quatre-vingt-deux mille trois cent quarante Auvillar
Avenue de Courbieu, quatre-vingt-deux, cent Castelsarrasin
Chemin de Lapeyriere, Bessens
Chemin des Jaquettes à Monteils
deux mille six cent trente route de Corbarieu
Route de Bonnanech au numéro trois mille cinquante-deux
quatorze impasse du Cassé, quatre-vingt-deux mille sept cents Montech
quarante et un rue du Général Gras, quatre-vingt-deux, deux cents, Moissac
cent soixante-seize chemin de Falgayrines, quatre-vingt-deux, zéro zéro zéro à Montauban
Route de Saint-Nauphary, quatre-vingt-deux mille trois cent soixante-dix Villebrumier
Impasse de Bernuze, quatre-vingt-deux, deux cent quatre-vingt-dix La Ville-Dieu-du-Temple
Départementale huit cent treize de Toulouse, Saint-Porquier
Chemin des Ariaux à Donzac
cent onze route de Lizac
Rue des Ardeilles au numéro quarante-cinq
sept rue des Donateurs, quatre-vingt-deux mille deux cents Moissac
mille deux cent quatre-vingt-treize route de Cornillas, quatre-vingt-deux, quatre cents, Valence
quatre-vingt-deux chemin de la Vallée du Tordre, quatre-vingt-deux, deux cent trente à Léojac
Chemin de Débat, quatre-vingt-deux mille deux cent dix Saint-Nicolas-de-la-Grave
Rue du Plantié, quatre-vingt-deux, cinq cents Beaumont-de-Lomagne
Avenue des Anciens Combattants d'Indochine, Nègrepelisse
Rue Cabarrot à Golfech
seize rue Fortuné Cantecor
Chemin de Bro au numéro mille cinq cent cinquante
mille cent cinq route de la Brive, quatre-vingt-deux mille huit cents Vaïssac
un rue Léon Lemartin, quatre-vingt-deux, trois cent quarante, Dunes
treize rue de l'Union Compagnonnique, quatre-vingt-deux, zéro zéro zéro à Montauban
Chemin de Carrayrou, quatre-vingt-deux mille cent trente Montastruc
Chemin Clos de Lauzin, quatre-vingt-deux, zéro zéro zéro Montauban
Chemin de Travaux, Nohic
Avenue de Larché à Molières
soixante-huit route des Brels
Chemin des Lebrats au numéro mille huit cent dix-sept
mille cent cinquante-trois route de Reyniès, quatre-vingt-deux mille trois cent soixante-dix Saint-Nauphary
dix-neuf impasse Georges Herment, quatre-vingt-deux, zéro zéro zéro, Montauban
mille deux cent vingt-deux route de Montbartier, quatre-vingt-deux, zéro zéro zéro à Montauban
Chemin des Gardios, quatre-vingt-deux mille huit cents Nègrepelisse
Route d'Auty, quatre-vingt-deux, deux cent soixante-dix Montpezat-de-Quercy
Rue de Cayssac, Saint-Antonin-Noble-Val
Chemin de Sainte-Livrade à Labastide-du-Temple
quarante chemin de Finelle
Chemin de Mondot au numéro deux cent quatre-vingt-quatre
deux cent trente-huit chemin de Saint-Coufan, quatre-vingt-deux mille deux cent dix Castelmayran
mille deux cent vingt-deux chemin de Pousinies, quatre-vingt-deux, quatre cent dix, Saint-Étienne-de-Tulmont
mille quatre-vingt-six route des Courounets, quatre-vingt-deux, trois cent cinquante à Albias
Impasse Mespoulié, quatre-vingt-deux mille cent soixante-dix Dieupentale
Avenue de Léojac, quatre-vingt-deux, zéro zéro zéro Montauban
Chemin du Moulin de Gandalou, Castelsarrasin
Plateau des Gascous à Montauban
trente et un rue Despeyroux
Chemin de Jean Dauby au numéro mille cent soixante-treize
cinq cent cinquante-huit chemin de Delbès, quatre-vingt-deux mille deux cents Moissac
quarante-neuf chemin de Layrolle, quatre-vingt-deux, zéro zéro zéro, Montauban
dix-neuf quai Ducos, quatre-vingt-deux, deux cents à Moissac
Rue de Jordy, quatre-vingt-deux mille cent cinquante Montaigu-de-Quercy
Rue Emile Pereire, quatre-vingt-deux, zéro zéro zéro Montauban
Rue du Faubourg Sainte-Blanche, Moissac
Rue des Frères Quéméré à Montaigu-de-Quercy
six cent quarante et un route du Traversié
Route des Planques au numéro trois mille huit cent trente-six
cinq cent quatre-vingt-trois chemin de Villemade, quatre-vingt-deux mille Montauban
cent soixante et un zone Artisanale de Simarre, quatre-vingt-deux, trois cent soixante-dix, Saint-Nauphary
sept rue des Anciennes Postes, quatre-vingt-deux, zéro zéro zéro à Montauban
Chemin du Bois Mesnil, quatre-vingt-deux mille deux cent quatre-vingt-dix Montbeton
Route du Magnolias, quatre-vingt-deux, sept cents Montech
Chemin de Barraux, Castelsarrasin
Impasse d'Umberti à Bressols
treize route de Mengane
Chemin de Bourdens au numéro deux cent sept
mille deux cent huit chemin Communal de Bas Pays, quatre-vingt-deux mille Montauban
quatorze rue Vigouroux, quatre-vingt-deux, trois cent soixante-dix, Labastide-Saint-Pierre
sept cents route d'Escatalens, quatre-vingt-deux, deux cent quatre-vingt-dix à Montbeton
Chemin de Saboye, quatre-vingt-deux mille deux cent trente Léojac
Impasse Faurès, quatre-vingt-deux, sept cents Montbartier
Route de Labastide-du-Temple, Meauzac
Route de Bénech à Fabas
trois cent trente-six avenue de Fonneuve
Route de Cos au numéro deux mille soixante-deux
deux mille six cent quatre-vingts chemin Barthelot-Coulassy, quatre-vingt-deux mille huit cents Nègrepelisse
sept cent soixante-cinq chemin las Planes, quatre-vingt-deux, huit cents, Nègrepelisse
cent quatre-vingt-un chemin de la Vigne École, quatre-vingt-deux, zéro zéro zéro à Montauban
Rue de Rouméguil, quatre-vingt-deux mille cent trente Lafrançaise
Avenue du Pasteur Louis Lafon, quatre-vingt-deux, zéro zéro zéro Montauban
Avenue de Molières, Caussade
Rue Laujol à Valence
cinquante-cinq rue Mary Lafon
Chemin Rural de Breil-Bas au numéro neuf cent quatre-vingt-cinq
cent cinquante route des Rives du Tarn, quatre-vingt-deux mille deux cent quatre-vingt-dix Barry-d'Islemade
trois cent trente-huit chemin de la Mondote, quatre-vingt-deux, cent, Labastide-du-Temple
quarante-sept faubourg du Moustier, quatre-vingt-deux, zéro zéro zéro à Montauban
Chemin de Baré, quatre-vingt-deux mille deux cent quatre-vingt-dix Meauzac
Avenue de Vidouze, quatre-vingt-deux, quatre cents Valence
Rue de Pater, Montauban
Chemin de Bourguès à Campsas
quatre-vingt-quatre impasse de Vaysseillie
Route de Charros au numéro mille quatre cent quatre-vingts
deux mille cent quarante route de Gandalou, quatre-vingt-deux mille cent Castelsarrasin
mille quatre cent soixante-cinq route d'Albias, quatre-vingt-deux, quatre cent quarante, Mirabel
trois mille quatre cent quarante route de Puygaillard, quatre-vingt-deux, huit cents à Vaïssac
Rue de Gibelot, quatre-vingt-deux mille huit cents Nègrepelisse
Route de la Bénèche, quatre-vingt-deux, trois cents Caussade
Chemin de Tournès, Montbeton
Chemin des Hébrards à Montpezat-de-Quercy
deux route de Pech Blanc
Côte de l'Evêque au numéro dix-huit
six cent cinq chemin de Sarraille, quatre-vingt-deux mille Montauban
un BIS rue d'Occident, quatre-vingt-deux, deux cent quarante, Septfonds
trois cent onze route du Frontonnais, quatre-vingt-deux, trois cent soixante-dix à Nohic
Rue Jean Lacaze, quatre-vingt-deux mille sept cents Finhan
Sentier des Condamines, quatre-vingt-deux, trois cents Monteils
Chemin de Pourrat, Castelsarrasin
Rue des Frères Poncelet à Montauban
huit cent cinquante-cinq chemin de Coupiac
Rue du Chemin Nouveau au numéro quatre-vingt-douze BIS
sept cent vingt B chemin de Cauty, quatre-vingt-deux mille sept cent dix Bressols
sept cent huit chemin des Tourrels, quatre-vingt-deux, huit cents, Bioule
cent vingt-sept route du Pont de Reyniès, quatre-vingt-deux, trois cent soixante-dix à Orgueil
Route de la Tour de Chappe, quatre-vingt-deux mille trois cent quarante Saint-Loup
Chemin de Pech Vidal, quatre-vingt-deux, deux cent soixante-dix Montalzat
Chemin du Rieu Tort, Pompignan
Rue André Abbal à Moissac
treize chemin de Rapin
Chemin de Las Trabesses au numéro deux cent trois
six cent soixante-dix-neuf chemin des Palanques, quatre-vingt-deux mille cent soixante-dix Bessens
quatre cent soixante-treize rue Gaston Bonnemort, quatre-vingt-deux, zéro zéro zéro, Montauban
onze rue des Carlots, quatre-vingt-deux, deux cent dix à Saint-Nicolas-de-la-Grave
Chemin de Virlande, quatre-vingt-deux mille trois cent soixante-dix Saint-Nauphary
Route de Castelsarrasin, quatre-vingt-deux, deux cent quatre-vingt-dix Meauzac
Lotissement Labastide, Espalais
Impasse Mélassou à Montech
deux mille cent trente et un chemin de Belpech
Boulevard Léonce Granié au numéro trente-huit
cent douze chemin de Roudié, quatre-vingt-deux mille cent Labastide-du-Temple
quatre cent trente chemin de la Frondaison, quatre-vingt-deux, deux cent soixante-dix, Montalzat
vingt-deux avenue du Docteur Olive, quatre-vingt-deux, trois cents à Caussade
Chemin de Lavilledieu, quatre-vingt-deux mille cent Labastide-du-Temple
Avenue d'Ardus, quatre-vingt-deux, zéro zéro zéro Montauban
Boulevard Gustave Garrisson, Montauban
Rue Gamot à Montauban
quatre cent quinze route d'Escazeaux
Chemin du Fraysse Haut au numéro mille cent quarante-cinq
mille cent quarante et un route de Saint-Martial, quatre-vingt-deux mille Montauban
quatre lotissement Lavalette, quatre-vingt-deux, cent soixante-dix, Dieupentale
quatre cent quarante-deux chemin d'Abadie, quatre-vingt-deux, cinq cents à Beaumont-de-Lomagne
Route de Moissac, quatre-vingt-deux mille cent Castelsarrasin
Rue Mauran, quatre-vingt-deux, cinq cents Beaumont-de-Lomagne
Chemin de la Serre Belay, Reyniès
Impasse des Aluminiers à Moissac
soixante-sept rue du Brésidou
Chemin de Lériet au numéro cent soixante-dix-sept
mille sept cent dix boulevard de Chantilly, quatre-vingt-deux mille Montauban
trente-huit faubourg Lafeuillade, quatre-vingt-deux, sept cents, Montech
cent soixante-dix-sept chemin de Fégnier, quatre-vingt-deux, cent à Castelsarrasin
Chemin de Sers Bas, quatre-vingt-deux mille trois cent soixante-dix Varennes
Rue du Pays de Serres, quatre-vingt-deux, deux cent vingt Vazerac
Rue de la Provençale, Castelsarrasin
Route de Laujol à Moissac
cinq cent cinquante route de Cayrac
Rue du Lotissement du Pigeonnier au numéro trente-six
seize route du Moulin d'Alric, quatre-vingt-deux mille deux cent quarante Septfonds
cent vingt-cinq chemin de Lusclade, quatre-vingt-deux, deux cent soixante-dix, Montpezat-de-Quercy
mille sept cents impasse d'Austrie, quatre-vingt-deux, zéro zéro zéro à Montauban
Rue des Bouygues, quatre-vingt-deux mille cent quarante Saint-Antonin-Noble-Val
Chemin de Vilette, quatre-vingt-deux, cent Castelsarrasin
Vieux Chemin de Sérignac, Beaumont-de-Lomagne
Rue Abbé de Prades à Castelsarrasin
mille quatre cent soixante chemin de Deymie
Place Prax-Paris au numéro treize TER
deux esplanade de la Liberté, quatre-vingt-deux mille cent soixante-dix Grisolles
trois rue des Petits Drôles, quatre-vingt-deux, zéro zéro zéro, Montauban
sept cent vingt-deux rue de Glatens, quatre-vingt-deux, cinq cents à Beaumont-de-Lomagne
Allée de Mortarieu, quatre-vingt-deux mille Montauban
Chemin de Portal, quatre-vingt-deux, zéro zéro zéro Montauban
Route de Gaillardou, Montastruc
Route des Marres à Cordes-Tolosannes
mille quatre-vingt-cinq route de la Vitarelle
Boulevard Vergnes au numéro neuf
soixante-quatre avenue du dix e Dragons, quatre-vingt-deux mille Montauban
mille huit cent quatre-vingt-seize route de Campsas, quatre-vingt-deux, trois cent soixante-dix, Orgueil
quatre A chemin du Tour de Ronde, quatre-vingt-deux, six cents à Saint-Sardos
Chemin de Fayard, quatre-vingt-deux mille cent Castelsarrasin
Rue Eugénie de Guerin, quatre-vingt-deux, zéro zéro zéro Montauban
Rue du Jardin de l'Êvéque, Montauban
Chemin de la Camarèle à Montpezat-de-Quercy
soixante-quatorze chemin de Planquemarquet
Route de Molières au numéro mille trois cent quarante-huit C
neuf cent quarante-cinq chemin de la Croix de Lauzerte, quatre-vingt-deux mille deux cents Moissac
dix-neuf cours d'Alsace Lorraine, quatre-vingt-deux, deux cent quarante, Septfonds
quatre cent vingt-quatre chemin de Boutines, quatre-vingt-deux, trois cent soixante-dix à Campsas
Chemin de Preyssac, quatre-vingt-deux mille Montauban
Faubourg du Prieuré, quatre-vingt-deux, deux cent trente Monclar-de-Quercy
Chemin de Castelet, Mirabel
Chemin de Longues Aygues à Nègrepelisse
trois mille quatre cents route des Deux Mers
Vieille Route de Saint-Étienne au numéro mille quatre cent soixante-cinq
mille huit cent quatre-vingts route de Chouastrac, quatre-vingt-deux mille deux cent trente Monclar-de-Quercy
mille trois cent vingt-quatre chemin des Mondettes, quatre-vingt-deux, huit cents, Bioule
quinze avenue Léon Brun, quatre-vingt-deux, cent à Castelsarrasin
Avenue Fernand Belondrade, quatre-vingt-deux mille Montauban
Rue René Gabach, quatre-vingt-deux, zéro zéro zéro Montauban
Impasse des Partisous, Montastruc
Impasse du Docteur Lahennec à Montauban
mille six cent quinze hameau de Gandoulés
Route de Choisi au numéro mille six cent soixante-dix
cent cinquante-cinq chemin de Gascougne, quatre-vingt-deux mille cent soixante-dix Monbéqui
soixante et onze faubourg Lacapelle, quatre-vingt-deux, zéro zéro zéro, Montauban
cinquante-neuf chemin de Maury Raffine, quatre-vingt-deux, zéro zéro zéro à Montauban
Rue Peyre de Lunel, quatre-vingt-deux mille trois cent soixante-dix Corbarieu
Chemin des Oules, quatre-vingt-deux, zéro zéro zéro Montauban
Chemin de la Fongrande, Molières
Route de Galon à Albias
mille neuf chemin de Rastely
Rue Laniel au numéro trente-six
quinze chemin Amiral, quatre-vingt-deux mille quatre cents Pommevic
treize voie Jules Ladoumègue, quatre-vingt-deux, zéro zéro zéro, Montauban
deux mille cinq cent cinquante-cinq chemin de Bozouls, quatre-vingt-deux, zéro zéro zéro à Montauban
Chemin de Délizy, quatre-vingt-deux mille deux cents Moissac
Route de Perches, quatre-vingt-deux, deux cent soixante-dix Montalzat
Chemin de Promes, Castelsarrasin
Allées du quatre Septembre à Valence
onze rue Hugues Panassié
Chemin des Crabatous au numéro un
cent quarante-cinq route de Pa-Signat, quatre-vingt-deux mille cent soixante-dix Fabas
trois cent trente et un chemin de Riounet, quatre-vingt-deux, cent soixante-dix, Fabas
dix-sept rue du Balat Biel, quatre-vingt-deux, cent soixante-dix à Grisolles
Chemin des Cabouillous, quatre-vingt-deux mille Montauban
Chemin de Biscardel, quatre-vingt-deux, cent trente L'Honor-de-Cos
Route de Saint-Antonin, Montauban
Allée des Reines-Claudes à Moissac
un A place de la Capelane
Rue Pierre Fermat au numéro quarante-huit
trois A boulevard Léon Cladel, quatre-vingt-deux mille deux cents Moissac
quinze route Départementale huit cent treize de Castelsarrasin, quatre-vingt-deux, sept cents, Saint-Porquier
cinquante rue Ginette Augier, quatre-vingt-deux, zéro zéro zéro à Montauban
Lotissement Hameau de Nogaye, quatre-vingt-deux mille six cents Verdun-sur-Garonne
Lotissement Clau Redon, quatre-vingt-deux, cent Saint-Aignan
Boulevard Jean Sabathé, Lavit
Avenue du Cami-Néou à Saint-Nicolas-de-la-Grave
quatre-vingt-un avenue Marceau Hamecher
Boulevard de Torsiac au numéro six
vingt chemin de Mourrailles, quatre-vingt-deux mille quatre cent quarante Réalville
dix-huit résidence Les Belles Demeures, quatre-vingt-deux, huit cents, Nègrepelisse
cent soixante-deux chemin des Melets, quatre-vingt-deux, cent à Castelsarrasin
Rue Augustin Gignoux, quatre-vingt-deux mille quatre cents Valence
Route de Clau Redon, quatre-vingt-deux, cent Saint-Aignan
Chemin de Montagné, Bressols
Lotissement Gandillou à Réalville
deux rue Mila
Chemin de la Belle Gabrielle au numéro six cent dix
trois impasse Belle Rive, quatre-vingt-deux mille deux cent quatre-vingt-dix Albefeuille-Lagarde
quinze chemin de Beral, quatre-vingt-deux, quatre cent quarante, Réalville
douze avenue de Monclar, quatre-vingt-deux, trois cent cinquante à Albias
Chemin Ernest Laplace, quatre-vingt-deux mille Montauban
Chemin de Capiol, quatre-vingt-deux, huit cents Vaïssac
Lotissement Embrana, Beaumont-de-Lomagne
Rue Croix Maillet à Mas-Grenier
deux cent quarante et un chemin de Fonbonne
Route de Nègrepelisse au numéro sept cent trente-cinq
cent quarante-huit chemin de Frayre, quatre-vingt-deux mille Montauban
huit cent soixante-six chemin de Meauzaguels, quatre-vingt-deux, deux cent quatre-vingt-dix, La Ville-Dieu-du-Temple
neuf rue Du Bac, quatre-vingt-deux, zéro zéro zéro à Montauban
Chemin d'Auvillar, quatre-vingt-deux mille deux cent dix Saint-Nicolas-de-la-Grave
Route de la Ville Dieu, quatre-vingt-deux, sept cent dix Bressols
Rue Jean-Ursule Devals, Montauban
Lotissement Val de Garonne à Saint-Porquier
quatre-vingt-quinze BIS chemin de Rhodié
Avenue Chamier au numéro vingt-cinq
onze BIS chemin du Moulin du Bidounet, quatre-vingt-deux mille deux cents Moissac
quarante-six rue Lomagne, quatre-vingt-deux, cinq cents, Beaumont-de-Lomagne
mille huit cent cinq chemin de La Margue, quatre-vingt-deux, zéro zéro zéro à Montauban
Avenue de Falguières, quatre-vingt-deux mille Montauban
Rue Faubourg du quatre Septembre, quatre-vingt-deux, sept cents Montech
Route de Pinard, Goudourville
Impasse Sioulayre à Campsas
cent soixante-quatre chemin des Coques
Impasse Jean-Pierre Manau au numéro un
quatre cent soixante-douze chemin de Sigoulène, quatre-vingt-deux mille trois cent soixante-dix Saint-Nauphary
quarante-neuf chemin de Biargou, quatre-vingt-deux, cent trente, L'Honor-de-Cos
vingt-huit boulevard Marceau Faure, quatre-vingt-deux, cent à Castelsarrasin
Route d'Albefeuille-Lagarde, quatre-vingt-deux mille Montauban
Chemin de Montescot, quatre-vingt-deux, deux cents Moissac
Chemin de Sarret, Nègrepelisse
Avenue des Albarèdes à Montauban
cinq cent trente-six avenue de Finlande
Chemin des Dames Noires au numéro cent cinquante-trois
vingt et un lotissement Grange, quatre-vingt-deux mille trois cent quarante Donzac
deux cent soixante lotissement les Jardins de Bérot, quatre-vingt-deux, trois cent soixante-dix, Saint-Nauphary
quatre cent cinq route des Teules, quatre-vingt-deux, cent à Garganvillar
Rue du Pré Benais, quatre-vingt-deux mille Montauban
Route d'Aucamville, quatre-vingt-deux, six cents Verdun-sur-Garonne
Boulevard de la Papayette, Auvillar
Chemin de Salut à Saint-Nauphary
sept cent soixante-cinq chemin des Couloumbayres
Chemin de Bellel au numéro cent trois
mille sept cent quatre-vingt-quinze route de GeneBrières, quatre-vingt-deux mille deux cent trente Monclar-de-Quercy
vingt-trois rue Lagrèze Fossat, quatre-vingt-deux, deux cents, Moissac
six impasse Jacques Chapou, quatre-vingt-deux, zéro zéro zéro à Montauban
Impasse Lacoste, quatre-vingt-deux mille sept cents Montech
Place des Dames Noires, quatre-vingt-deux, cent quarante Saint-Antonin-Noble-Val
Route de Labourgade, Garganvillar
Chemin du Vergnet à Labastide-Saint-Pierre
quarante-neuf BIS avenue Pierre Chabrié
Chemin de Capelanios au numéro deux cent quatre-vingt-quatorze
mille huit cent quatre-vingt-quatre route de Réalville, quatre-vingt-deux mille quatre cent quarante Mirabel
huit rue Daubasse, quatre-vingt-deux, deux cents, Moissac
quatre rue la Vicomté, quatre-vingt-deux, sept cents à Saint-Porquier
Rue Léon de Maleville, quatre-vingt-deux mille Montauban
Chemin de Trescasses, quatre-vingt-deux, cent Castelsarrasin
Chemin de la Côte de Landerose, Moissac
Chemin de Laujol à Viarose à Moissac
cinquante avenue Georges d'Esparbes
Rue de Castels au numéro quarante-six
six cent quatre-vingt-huit côte des Lièvres, quatre-vingt-deux mille deux cents Moissac
dix rue de la Porte du Moustier, quatre-vingt-deux, zéro zéro zéro, Montauban
quatre BIS boulevard du vingt-deux Septembre, quatre-vingt-deux, cent à Castelsarrasin
Route de Malceifique, quatre-vingt-deux mille huit cents Vaïssac
Route de Meauzac, quatre-vingt-deux, deux cent quatre-vingt-dix La Ville-Dieu-du-Temple
Route de Montech, Meauzac
Les Cendriers à Monclar-de-Quercy
sept cent soixante-huit rue Henriette Guiral
Plaine de Lavit au numéro quinze
cinq cent trente-trois route de Montricoux, quatre-vingt-deux mille trois cents Caussade
douze rue des Tambourets, quatre-vingt-deux, six cents, Verdun-sur-Garonne
trois mille quatre-vingt-dix route de La Mégère, quatre-vingt-deux, deux cents à Moissac
Route de Détours, quatre-vingt-deux mille deux cents Moissac
Chemin de Menens, quatre-vingt-deux, zéro zéro zéro Montauban
Rue du Maréchal de Pérignon, Montech
Chemin de Castel Bas à Caussade
deux mille quatre cent quatre-vingt-quinze vieille Route de Montauban
Chemin de Canans au numéro trois cent trente
huit cents rue Issanchou, quatre-vingt-deux mille Montauban
dix rue Jean Barrera, quatre-vingt-deux, zéro zéro zéro, Montauban
mille deux cent vingt-trois chemin de Gabiat, quatre-vingt-deux, cent soixante-dix à Canals
Route de Nivelle, quatre-vingt-deux mille deux cent quatre-vingt-dix Albefeuille-Lagarde
Chemin de Parcous, quatre-vingt-deux, trois cent soixante-dix Labastide-Saint-Pierre
Impasse des Docteurs, Montech
Avenue du Père Leonid Chrol à Montauban
trois cent onze route de la Paillole
Route de la Rivalière au numéro mille quatre cent cinquante-trois
soixante-dix-sept chemin de Figarol, quatre-vingt-deux mille cent soixante-dix Pompignan
quinze rue Georges Tessier, quatre-vingt-deux, zéro zéro zéro, Montauban
deux cent vingt-trois chemin de Fourmen, quatre-vingt-deux, cent à Castelsarrasin
Chemin de Sirech, quatre-vingt-deux mille cent soixante-dix Canals
Route de Coupet, quatre-vingt-deux, quatre cents Valence
Chemin de Magdelaine, Réalville
Route des Taillades à Lafrançaise
deux cent quatre-vingt-dix-sept chemin Rural de Figuèris
Impasse Jean de Vales au numéro six
quatorze rue Larramet, quatre-vingt-deux mille sept cents Montech
quatre mille deux cent soixante-cinq côte de Mirabel, quatre-vingt-deux, cent trente, L'Honor-de-Cos
deux impasse Croix de Rouby, quatre-vingt-deux, deux cent quatre-vingt-dix à La Ville-Dieu-du-Temple
Chemin de Poujoulat, quatre-vingt-deux mille trois cents Caussade
Rue Crochue, quatre-vingt-deux, deux cents Moissac
Rue de Cluzel, Valence
Chemin de Pech de Lafon à Montpezat-de-Quercy
vingt-huit chemin des Nadals
Cité Verte au numéro quatre
deux mille six cents chemin de Carbounel, quatre-vingt-deux mille quatre cent quarante Réalville
dix rue Darquier, quatre-vingt-deux, cinq cents, Beaumont-de-Lomagne
cinq cent vingt B chemin de Barraque, quatre-vingt-deux, deux cent quatre-vingt-dix à Montbeton
Rue Mirabey, quatre-vingt-deux mille trois cents Caussade
Rue du Biard, quatre-vingt-deux, cent soixante-dix Grisolles
Rue Perez, Valence
Route de Montbeton à Lacourt-Saint-Pierre
quatre cent cinquante-neuf chemin de Bioule
Route des Charretiers au numéro vingt-cinq
mille trente chemin de Pintre, quatre-vingt-deux mille deux cent quatre-vingt-dix Montbeton
six mille soixante-deux rue Frezal, quatre-vingt-deux, cent quarante, Saint-Antonin-Noble-Val
quatre cent vingt-sept chemin de Patouquet, quatre-vingt-deux, quatre cent quarante à Mirabel
Rue Victor Bergis, quatre-vingt-deux mille Montauban
Route de Braguillou, quatre-vingt-deux, cent soixante-dix Fabas
Rue Bombet, Montauban
Rue du Rougeron à Dunes
mille sept cent quatre-vingt-seize chemin de Gimbelet
Chemin de Margastau au numéro mille trois cent cinquante-six
sept cent quatorze route des Filhols, quatre-vingt-deux mille trois cent soixante-dix Varennes
deux cent seize chemin de Failleres, quatre-vingt-deux, cent soixante-dix, Pompignan
huit cent dix chemin de la Moissagaise, quatre-vingt-deux, cent soixante-dix à Pompignan
Avenue Capin, quatre-vingt-deux mille cent quarante Saint-Antonin-Noble-Val
Rue Falhière, quatre-vingt-deux, deux cents Moissac
Place Antoine Bourdelles, Castelsarrasin
Chemin Castelus à Castelsarrasin
deux cent dix-huit rue du Rebequet
Rue Mathieu Jouy au numéro neuf
trois domaine d'Hippolyte, quatre-vingt-deux mille Montauban
mille six cent quinze route de Salcevert, quatre-vingt-deux, sept cents, Montbartier
trois impasse Lebernes, quatre-vingt-deux, cent soixante-dix à Dieupentale
Rue Barbazan, quatre-vingt-deux mille Montauban
Rue des Soleils, quatre-vingt-deux, sept cents Montech
Rue Lizotte, Valence
Rue du Docteur Boyé à Montauban
quatre lotissement Blanque
Faubourg Launet au numéro quatre B
six cent trente chemin de Taillefer, quatre-vingt-deux mille cent Castelsarrasin
trois cent seize chemin de Lattes, quatre-vingt-deux, deux cents, Moissac
quatre-vingt-dix-sept chemin de Grande Borde, quatre-vingt-deux, deux cents à Moissac
Rue Baragnon, quatre-vingt-deux mille sept cents Montbartier
Route de Carrié, quatre-vingt-deux, sept cents Montech
Route de Finhan, Bressols
Rue Boulbène à Grisolles
soixante et onze avenue Marcel Lacassagne
Chemin de Pech Quercy au numéro trois
neuf rue Armand Saintis, quatre-vingt-deux mille Montauban
deux chemin de la Guillotte, quatre-vingt-deux, cent trente, Lafrançaise
