Rue de Chassignolle, soixante-dix mille sept cents Montboillon
Route de Recologne, soixante-dix, cent quatre-vingt-dix Villers-Bouton
Rue Lotissement de Fontenottes, Grandvelle-et-le-Perrenot
Chemin Mignard à Sorans-lès-Breurey
six rue du Champ de la Nuit
Impasse les Revaux au numéro un
trois impasse Paul Billotte, soixante-dix mille quatre cents Granges-le-Bourg
six rue de la Petite Fontaîne, soixante-dix, quatre cents, Échavanne
deux route de Courchaton, soixante-dix, cent dix à Vellechevreux-et-Courbenans
Ruelle de la Boucherie, soixante-dix mille deux cent trente Montbozon
Impasse du Tissage, soixante-dix, trois cent dix La Longine
La Collonge, Sainte-Marie-en-Chanois
Chemin du Faulot à Ainvelle
quatre rue de la Bressotte
Rue du Maiguyot au numéro un
trois BIS impasse du Champ Royen, soixante-dix mille Comberjon
six chemin de la Passée, soixante-dix, deux cent quatre-vingt-dix, Champagney
dix-huit rue Mougin, soixante-dix, deux cent vingt à Fougerolles
Au Monneret, soixante-dix mille quatre cents Trémoins
Rue de la Petite Rochotte, soixante-dix, trois cent dix Faucogney-et-la-Mer
Impasse de l'Ognon, Magny-Vernois
Rue de Gerlingen à Vesoul
cinq rue Beauchamp
Route de Germigney au numéro neuf
quarante-sept en Chievache, soixante-dix mille Charmoille
un route de Cugney, soixante-dix, sept cents, Velloreille-lès-Choye
deux chemin des Prés Montchamp, soixante-dix, deux cent soixante-dix à Saint-Barthélemy
Route de Raddon, soixante-dix mille trois cents Magnivray
Rue de Neurey-lès-la-Demie, soixante-dix, zéro zéro zéro Vallerois-Lorioz
Rue En Rossot, Mailley-et-Chazelot
Route de Pomoy à La Creuse
six impasse du Clos Tillon
La Plaine au numéro six
onze route des Champs de la Bèche, soixante-dix mille deux cents Frédéric-Fontaine
quatre rue du Blanc Poirier, soixante-dix, cent dix, Senargent-Mignafans
un rue du Chaffeaux Prolongée, soixante-dix, cent vingt à Confracourt
Rue Carron, soixante-dix mille sept cents Étrelles-et-la-Montbleuse
Le Mont de Beau, soixante-dix, deux cent soixante-dix Ternuay-Melay-et-Saint-Hilaire
Rue de Savegny, Mignavillers
Chemin du Préjour à Velet
trois impasse de la Portotte
Pres et Champs de la Besse au numéro un
quatre rue du Momiron, soixante-dix mille sept cents Bucey-lès-Gy
cinq route d'Ainvelle, soixante-dix, huit cents, Briaucourt
dix rue Gevrey, soixante-dix, zéro zéro zéro à Vesoul
Les Sauvages, soixante-dix mille sept cents Sainte-Reine
Rue Abbé Maley, soixante-dix, deux cents Magny-Vernois
Ruelle des Coccinelles, Velle-le-Châtel
Rue des Champs Tisserands à Faymont
sept route de Magnivray
Rue des Évêques au numéro huit
douze rue Eugène de Vault, soixante-dix mille deux cents Lure
deux cent vingt-huit la Rauche, soixante-dix, deux cent soixante-dix, Fresse
quatre place Beauchamp, soixante-dix, zéro zéro zéro à Vesoul
Rue du Côney, soixante-dix mille deux cent dix Demangevelle
Passerelle Flamand, soixante-dix, trois cent soixante Scey-sur-Saône-et-Saint-Albin
Sur La Velle, Faymont
Route de Velle-le-Châtel à Baignes
un A chemin de la Croix du Crotot
Chavane au numéro huit
un rue En Prêle, soixante-dix mille cent quatre-vingt-dix Grandvelle-et-le-Perrenot
neuf route de La Neuvelle, soixante-dix, deux cent soixante-dix, Montessaux
quatre chemin du Rosbeck, soixante-dix, deux cent soixante-dix à Belonchamp
Route de Cuve, soixante-dix mille deux cent dix Dampvalley-Saint-Pancras
Impasse des Prés Neufs, soixante-dix, quatre cents Crevans-et-la-Chapelle-lès-Granges
Rue du Vo, Brevilliers
Place René Hologne à Vesoul
un vieille Route d'Angirey
Rue Louis Sirguey au numéro trois
deux chemin Sous Theurey, soixante-dix mille deux cent quatre-vingt-dix Champagney
un impasse du Pré Au Sire, soixante-dix, cent trente, Fresne-Saint-Mamès
deux place Edwige Feuillère, soixante-dix, zéro zéro zéro à Vesoul
Rue Lili Jobard, soixante-dix mille Vesoul
Rue En Blanchard, soixante-dix, zéro zéro zéro Pusy-et-Épenoux
Ruelle des Viaux, Champagney
Rue des Prés Croissant à Champagney
deux ruelle du Petit Ormeau
Château Grenouille au numéro deux
six rue des Cornes Lambert, soixante-dix mille cent soixante Cubry-lès-Faverney
trois estravaux, soixante-dix, cent trente, Greucourt
douze rue de l'Ancien Octroi, soixante-dix, zéro zéro zéro à Vesoul
Impasse du Clos Miney, soixante-dix mille deux cent quatre-vingt-dix Champagney
Chemin des Contances, soixante-dix, deux cent soixante-dix Ternuay-Melay-et-Saint-Hilaire
Rue Flamand, Scey-sur-Saône-et-Saint-Albin
Route de Beveuge à Villers-la-Ville
deux impasse du Bois Beuchot
Impasse des Centenaires au numéro un
un rue du Cratey, soixante-dix mille deux cent dix Mailleroncourt-Saint-Pancras
un chemin de la Fiolle, soixante-dix, cent quatre-vingt-dix, Boult
six impasse de la Broche, soixante-dix, quatre cents à Frahier-et-Chatebier
Avenue Chrysologue, soixante-dix mille sept cents Gy
Chemin des Gouty, soixante-dix, cent soixante Faverney
Rue Parc Maunoury, Héricourt
Impasse Griboulard à Autrey-le-Vay
six impasse de Bourdieu
Rue de la Niotte au numéro trois
deux rue Eugène Revillou, soixante-dix mille deux cent dix Vauvillers
cinq hameau Grange Rouge, soixante-dix, deux cent trente, Thieffrans
vingt-six rue de L'Aérodrome, soixante-dix, deux cents à Roye
Rue du Pré Colelle, soixante-dix mille deux cent dix Hurecourt
Corne Jardin, soixante-dix, cent soixante Cubry-lès-Faverney
Avenue Jules Jeanneney, Rioz
Lotissement La Clairegoutte à Lyoffans
trois rue Roland Munier
Riue Petite Rampe au numéro six
six champs du Chêne, soixante-dix mille quatre cents Étobon
deux chemin des Fenils, soixante-dix, cent dix, Beveuge
un passage des Longues Rayes, soixante-dix, zéro zéro zéro à Échenoz-la-Méline
Rue de la Noue Mourot, soixante-dix mille deux cent dix Betoncourt-Saint-Pancras
Chemin de la Rouchotte, soixante-dix, deux cents Le Val-de-Gouhenans
Le Petit Rang, Amage
Rue de Folle à Bucey-lès-Gy
sept ruelle Traje Saint-Jacques
Rue de la Gypsière au numéro un
un route de Montdoré, soixante-dix mille deux cent dix Vauvillers
quatre place Émile Bardouillet, soixante-dix, cent, Champtonnay
trois rue des Collonches, soixante-dix, trois cent vingt à Corbenay
Route de la Montbleuse, soixante-dix mille sept cents Étrelles-et-la-Montbleuse
Chemin des Échavais, soixante-dix, deux cent quarante Genevrey
Les Scies Cossin, Fontenois-la-Ville
Les Allieres à Velleminfroy
deux petits Fignots
Rue des Champs Nalot au numéro trois
trois impasse Poirier La Chèvre, soixante-dix mille deux cent dix Melincourt
un impasse des Ceugnots, soixante-dix, deux cent dix, Selles
trois chemin de Chaillot, soixante-dix, deux cent trente à Fontenois-lès-Montbozon
Chemin du Cimetière des Juifs, soixante-dix mille cent Gray
Impasse du Pré Au Clair, soixante-dix, quatre cents Chavanne
Ruelle Chez Pirolley, Mont-le-Vernois
Rue de Colombotte à Velleminfroy
sept impasse des Avies
Clos Martin au numéro un
un chemin du Tarey, soixante-dix mille Rosey
sept chemin de Germiney, soixante-dix, zéro zéro zéro, Pusey
huit ruelle Serrée, soixante-dix, deux cent trente à Montbozon
Rue Champ La Caille, soixante-dix mille Villers-le-Sec
Rue des Frères Grimm, soixante-dix, quatre cents Héricourt
Rue Ruffier d'Epenoux, Pusy-et-Épenoux
Rue Sous Courbot à Fallon
un place de l'Abondance
Rue du Grattery au numéro un
six champs Moyens, soixante-dix mille Villeparois
quatre route de Noiron, soixante-dix, cent, Gray
six place Jean Lyautey, soixante-dix, zéro zéro zéro à Montcey
Rue du Giradorge, soixante-dix mille sept cents Choye
Rue de Liéffrans, soixante-dix, cent trente Neuvelle-lès-la-Charité
Chemin Rural de Chez Canet, Ronchamp
Les Frondeys à Saint-Gand
trois route du Chanois
Chemin de la Quemenne au numéro trois
un rue de la Traction, soixante-dix mille Vesoul
douze rue de l'Étang des Maisons, soixante-dix, sept cents, Igny
six impasse du Bouchot, soixante-dix, deux cents à Roye
Rue du Grand Pâtis, soixante-dix mille cinq cents Gevigney-et-Mercey
Les Bertheys, soixante-dix, deux cent soixante-dix Ternuay-Melay-et-Saint-Hilaire
Rue du Pré l'Évèque, Gy
Impasse Ferry aux Fessey
un chemin de Protey
Rue de Byans au numéro six
deux BIS rue du Paquot, soixante-dix mille quatre cents Luze
trois BIS rue Marc Coursilly, soixante-dix, sept cents, Bucey-lès-Gy
neuf impasse des Hauts Prés, soixante-dix, deux cents à Saint-Germain
Impasse Sous Saint-Martin, soixante-dix mille trois cent dix Faucogney-et-la-Mer
Chemin des Broudoux, soixante-dix, trois cents Magnivray
Chemin de la Vaivre, Voray-sur-l'Ognon
Impasse des Quevillots à Saint-Germain
six hameau de Besancenot
Rue du Breuchin au numéro un
deux impasse Champ Lajus, soixante-dix mille deux cent quatre-vingts Breuchotte
deux chemin de Pagot, soixante-dix, sept cents, Velleclaire
un rue Mafioli, soixante-dix, deux cent dix à Passavant-la-Rochère
Impasse de Solborde, soixante-dix mille Échenoz-la-Méline
Chemin de Miseroles, soixante-dix, deux cent quarante Vilory
Espace Quentin, Mailleroncourt-Saint-Pancras
Quai Vergy à Gray
deux impasse des Mulares
Route de Fondremand au numéro un
quatre rue de la Mesière, soixante-dix mille sept cents Igny
un route de Cubry, soixante-dix, deux cent dix, Anchenoncourt-et-Chazel
sept rue de l'Inventaire, soixante-dix, deux cents à Lure
Route de Girefontaine, soixante-dix mille huit cents Jasney
Nouerot, soixante-dix, sept cents Velleclaire
La Tenue, La Lanterne-et-les-Armonts
Rue du Lieutenant Barbeyrac à Noidans-lès-Vesoul
quatre place d'Onormont
Rue Sous la Cototte au numéro un
deux impasse du Raveret, soixante-dix mille Clans
deux rue de Chambornay, soixante-dix, sept cents, Montboillon
un rue Robert Vanel, soixante-dix, sept cents à Bucey-lès-Gy
Rue des Allues, soixante-dix mille deux cents Clairegoutte
Rue de Villers Pater, soixante-dix, deux cent trente Ormenans
Rue des Prés Ferrés, Cubry-lès-Faverney
En Protey à Melincourt
un rue Marcel Ponsot
Bois de la Roche Miquey au numéro deux
deux impasse de la Galette, soixante-dix mille trois cent soixante Aroz
deux rue du Docteur Championnet, soixante-dix, zéro zéro zéro, Vesoul
un route des Lavières, soixante-dix, trois cents à La Corbière
Rue du Taulion, soixante-dix mille Montigny-lès-Vesoul
Rue Charrière du Rhin, soixante-dix, huit cents Dampierre-lès-Conflans
Rue de Malvoisin, Champey
Place de la Pesée à Ainvelle
six A rue de la Fontaine du Prince
Allée du Colonel Fournier au numéro quatre
deux rue Louis Ravillon, soixante-dix mille cent Arc-lès-Gray
trois route du Champ Jacquerey, soixante-dix, deux cent dix, Ambiévillers
huit rue des Forges en Haut, soixante-dix, deux cent dix à Passavant-la-Rochère
Chemin des Garnières, soixante-dix mille cent Ancier
Impasse Gremillot, soixante-dix, quatre cents Héricourt
Rue des Landres, Servigney
Impasse de la Pierre-Étienne à Mailley-et-Chazelot
un le Grand Fey
Ruelle des Prés Javelle au numéro deux
quatre impasse des Blessonniers, soixante-dix mille quatre cents Mandrevillars
un la Morte Goutte, soixante-dix, deux cent soixante-dix, Saint-Barthélemy
sept rue Bassot, soixante-dix, cent à Rigny
Rue Eprettes, soixante-dix mille cinq cents Gevigney-et-Mercey
Résidence Fontaine Aloy, soixante-dix, trois cent soixante Scey-sur-Saône-et-Saint-Albin
Impasse le Seux, Corravillers
Rue de Rougin à Granges-la-Ville
huit rue Georges et Albert Piercy
Champs Cauquin au numéro un
quatre rue de la Creux, soixante-dix mille huit cents Francalmont
soixante A place Saint-Antide, soixante-dix, trois cent soixante, Pontcey
un BIS rue de Mignafans, soixante-dix, cent dix à Senargent-Mignafans
Route de Seveux La Madeleine, soixante-dix mille sept cents Sainte-Reine
Rue des Giranaux, soixante-dix, cent Arc-lès-Gray
Chemin de la Revialotte, Champagney
Rue de Fontenoilles à Andelarre
six rue Joseph Henri
Impasse du Bourgeot au numéro trois
six rUE DE L ETANG, soixante-dix mille cent soixante-dix Vauchoux
quatre chemin de Plumont, soixante-dix, sept cents, Bucey-lès-Gy
un chemin du Poirier Au Loup, soixante-dix, huit cents à Anjeux
Rue du Cenne, soixante-dix mille cent dix Autrey-le-Vay
Rue l'Abbaye, soixante-dix, cent soixante Faverney
Rue d'Anthon, Traitiéfontaine
Route des Fouillies à Belmont
dix champs du Mont
La Corvée au numéro quatre
trois chemin du Pré Bresson, soixante-dix mille huit cents Briaucourt
trois chemin des Chanas, soixante-dix, zéro zéro zéro, Clans
trois chemin des Envers, soixante-dix, quatre cents à Chenebier
Impasse Prahy, soixante-dix mille quatre cents Héricourt
Rue de la Vigne Bouquez, soixante-dix, deux cent trente Fontenois-lès-Montbozon
Rue des Longs Vernois, Bourguignon-lès-la-Charité
Impasse Vernier à Saint-Loup-Nantouard
un chemin de la Faux
Rue des Prédurupts au numéro dix
deux rue du Trot, soixante-dix mille cent quatre-vingts Autet
un rue du Mont-Jarroz, soixante-dix, deux cents, Amblans-et-Velotte
un BIS le Charmoy, soixante-dix, deux cent soixante-dix à La Lanterne-et-les-Armonts
Rue de Chambrotte, soixante-dix mille cent quatre-vingt-dix Recologne-lès-Rioz
Champs de la Carrière, soixante-dix, deux cent soixante-dix La Lanterne-et-les-Armonts
Hameau du Mouliney, Adelans-et-le-Val-de-Bithaine
Impasse en Rossey à Adelans-et-le-Val-de-Bithaine
un impasse des Prés de la Selle
Chemin Patouillet au numéro un
deux rue des Chaminadas, soixante-dix mille cent soixante Saint-Remy
trente-cinq rue du vingt Novembre mille neuf cent quarante-quatre, soixante-dix, deux cent quatre-vingt-dix, Plancher-Bas
un chemin des Vignes Cantot, soixante-dix, deux cent dix à Mailleroncourt-Saint-Pancras
Rue de Battrans, soixante-dix mille cent Champvans
Rue de la Pellerotte, soixante-dix, cent soixante-dix Bougnon
Impasse de la Collonge, Auxon
Rue Saint-Desle à Lure
onze rue de la Matiotte
Rue du Poirier Béni au numéro cinq
un sentier du Courbot, soixante-dix mille cent soixante Purgerot
trois charrière Saint-Martin, soixante-dix, zéro zéro zéro, Vesoul
quatre chemin des Cralots, soixante-dix, sept cents à Oiselay-et-Grachaux
Rue du Landau, soixante-dix mille Échenoz-la-Méline
Rue du Monthaureux, soixante-dix, deux cent soixante-dix Saint-Barthélemy
Rue des Chanois, Amblans-et-Velotte
Impasse Derriere la Ville à Senargent-Mignafans
vingt rue du Docteur Guillet Michel
Rue Sabliere au numéro deux
six cent soixante-dix-sept le Grand Clos un Er Canton, soixante-dix mille deux cent vingt Fougerolles
un impasse Céres, soixante-dix, sept cents, Vantoux-et-Longevelle
un impasse de la Chevrière, soixante-dix, zéro zéro zéro à Frotey-lès-Vesoul
Chemin des Cras, soixante-dix mille cent Germigney
Impasse Bonhotal, soixante-dix, quatre cents Héricourt
Rue du Champ d'Avaux, Fougerolles
Rue Georges Ponsot à Vesoul
un impasse des Ruottes
Chemin de Virey au numéro deux
huit rue d'Andelarre, soixante-dix mille Chariez
quatre route de Varigney, soixante-dix, huit cents, Briaucourt
un rue d'Écrepont, soixante-dix, deux cent quarante à Vellefrie
Rue du Calicot, soixante-dix mille cent dix Moimay
L'Abbayotte, soixante-dix, cent quatre-vingt-dix Fondremand
Rue Vergy, Gray
Route de Meurcourt à Conflans-sur-Lanterne
deux route de Vaudey
Rue de l'Athée au numéro un
un impasse de la Couas, soixante-dix mille trois cent soixante Rupt-sur-Saône
trois BIS rue René Faure, soixante-dix, sept cents, Bucey-lès-Gy
six route de la Demie, soixante-dix, zéro zéro zéro à Navenne
Rue de la Rizotte, soixante-dix mille deux cent quatre-vingt-dix Plancher-les-Mines
Rue du Petit Magny, soixante-dix, cent dix Villersexel
Impasse des Corots, Les Fessey
Rue Delaforge à Échenoz-la-Méline
cent quatre-vingt-un impasse Champ Suli
Rue de la Côte Laye au numéro quatre
quatre place Accarier, soixante-dix mille cent Arc-lès-Gray
cent champs Suez, soixante-dix, cent, Velet
trois chemin Sous Le Mont de Vannes, soixante-dix, deux cent soixante-dix à Belonchamp
Route de Cubrial, soixante-dix mille cent dix Pont-sur-l'Ognon
La Cornaz Machuree, soixante-dix, deux cent soixante-dix Montessaux
Rue Saint-Ferjeux, Beveuge
Impasse du Paquis à Cubry-lès-Faverney
deux rue du Breuleux
Le Thieloup au numéro vingt
deux chemin de Vauros, soixante-dix mille Montcey
quatre le Verger Aux Chats, soixante-dix, quatre cents, Étobon
dix rue Noël Courvoisier, soixante-dix, zéro zéro zéro à Vesoul
Chemin de la Grande Roche, soixante-dix mille cent soixante Mersuay
Impasse du Prelot, soixante-dix, quatre cents Granges-la-Ville
Rue Pigalle, Gray
Rue de Fretey à Auxon
cinq impasse du Chemin
Route de Vauchoux au numéro un
quatre impasse de la Bessole, soixante-dix mille cent Saint-Loup-Nantouard
trois impasse de la Gossotte, soixante-dix, quatre cents, Héricourt
quatre rue des Fléchières, soixante-dix, quatre cents à Mignavillers
Ruelle des Miracles, soixante-dix mille deux cent quatre-vingt-dix Champagney
Chemin du Haut du Ban, soixante-dix, trois cents Saint-Valbert
Chemin des Grandes Paules, Bucey-lès-Traves
Rue de la Nava à Passavant-la-Rochère
quatre chemin des Champs Sapraz
Rue du Bénon au numéro onze
un impasse Devant La Ville, soixante-dix mille sept cents Velleclaire
cinq rue Marcel Lemaire, soixante-dix, zéro zéro zéro, Noidans-lès-Vesoul
quatre champs Boileau, soixante-dix, zéro zéro zéro à Pusey
Route de Passavant, soixante-dix mille deux cent dix Demangevelle
Impasse de Fonteneille, soixante-dix, cent soixante-dix Bougnon
Rue Maréchal Delattre, Vesoul
Rue Martin Niemöller à Héricourt
deux impasse de la Converse
Impasse de l'Aigle Noir au numéro sept
quatre impasse des Vins Clairs, soixante-dix mille Frotey-lès-Vesoul
deux rue de Grapigny, soixante-dix, cent soixante, Saint-Remy
douze presles un Er Canton, soixante-dix, zéro zéro zéro à Échenoz-la-Méline
Viaux Les Champs, soixante-dix mille trois cent dix Esmoulières
Chemin de Bard, soixante-dix, cent quarante Pesmes
La Noye Titi, Fresse
Impasse Lesigne à Vesoul
trois lotissement Derrière Les Vergers
Impasse des Cottets au numéro quatre
onze rue de la Nitrière, soixante-dix mille cent Arc-lès-Gray
trois rue Louis Carmien, soixante-dix, quatre cents, Héricourt
cinq rue de Saint-Albin, soixante-dix, trois cent soixante à Scey-sur-Saône-et-Saint-Albin
Les Bouillandes, soixante-dix mille Échenoz-la-Méline
Place Jean Lagelée, soixante-dix, deux cent cinquante Ronchamp
Canton des Polognes, Héricourt
Impasse des Pinfaux à Lomont
sept le Breuret
Chemin du Breuchot au numéro quatre
six place du Pont du Four, soixante-dix mille sept cents Bucey-lès-Gy
deux rue de Frasnières, soixante-dix, zéro zéro zéro, Quincey
deux route de Chazel, soixante-dix, deux cent dix à Anchenoncourt-et-Chazel
Chemin des Breuleux, soixante-dix mille trois cents Magnivray
Place Saint-Pierre et Saint-Paul, soixante-dix, cent trente Soing-Cubry-Charentenay
Route de la Vergenne, Moffans-et-Vacheresse
Sur La Cote à Francalmont
huit chemin de Côte Chat
Rue du Seurey au numéro un
onze rue Alfred Dornier, soixante-dix mille cent quatre-vingts Dampierre-sur-Salon
deux chemin du Pré d'Oro, soixante-dix, deux cent quatre-vingts, Amage
dix rue du Poirlot, soixante-dix, cent à Nantilly
Les Vignes de la Goutte, soixante-dix mille Échenoz-la-Méline
Ruelle de Chenevry, soixante-dix, deux cent dix Betoncourt-Saint-Pancras
Impasse de le Colonge, Champagney
Route de Vyans à Héricourt
trois rue de Virey
Rue de la Pernette au numéro un
un allée des Champs du Haut, soixante-dix mille deux cents Froideterre
six impasse Marie-Catherine d'Aulnoy, soixante-dix, quatre cents, Héricourt
un route Vers Le Lavoir, soixante-dix, sept cents à Velloreille-lès-Choye
Allée de Boucon, soixante-dix mille Échenoz-la-Méline
Rue de Lauban, soixante-dix, trois cent dix Corravillers
Chemin du Verdot, Champagney
Chemin de Ray à Noidans-le-Ferroux
trois chemin du Dromont
Impasse des Prés Blandin au numéro six
six rue Roger Campredon, soixante-dix mille deux cent quatre-vingt-dix Champagney
un square Minal, soixante-dix, quatre cents, Héricourt
deux rue de Revers Mat, soixante-dix, sept cents à Montboillon
Route de la Pierre Mourey, soixante-dix mille trois cent dix Les Fessey
La Grange Brûlée, soixante-dix, trois cent dix La Proiselière-et-Langle
Rue de Tourchevey, Maizières
Rue des Gudots à Autet
douze anneau La Cagne
Haut des Fouillies au numéro six
deux rue de Dancourt, soixante-dix mille deux cent quarante Calmoutier
six route de Beulotte La Guillame, soixante-dix, trois cent dix, Esmoulières
quatre chemin des Éperjus, soixante-dix, cent quatre-vingt-dix à Quenoche
Rue de la Mourlotte, soixante-dix mille huit cents Conflans-sur-Lanterne
Hameau du Clos Vaudot, soixante-dix, trois cent dix La Proiselière-et-Langle
Rue des Bassennes, Colombier
Haut des Gouttes à La Lanterne-et-les-Armonts
trois rue des Champs Versa
Ruelle Valley au numéro un BIS
quatre passage Bel-Air, soixante-dix mille deux cents Lure
un rue de la Ramasse, soixante-dix, deux cent trente, Fontenois-lès-Montbozon
six route des Champrons, soixante-dix, trois cents à La Corbière
Les Grands Journaux, soixante-dix mille sept cents La Chapelle-Saint-Quillain
Rue de Brossotte, soixante-dix, huit cents Briaucourt
Rue du un er Jour, Lure
Passerelle Armand Éme à Esprels
cinq derriere Les Champs
Impasse de Grandvelle au numéro deux
quatre chemin Bouton, soixante-dix mille deux cent quarante Genevrey
un chemin du Rang des Gouttes, soixante-dix, deux cent quatre-vingts, Amage
trois fond des Grands Pas, soixante-dix, deux cent soixante-dix à La Lanterne-et-les-Armonts
Rue Valet, soixante-dix mille cent soixante Faverney
Rue du Fahiney, soixante-dix, quatre cents Belverne
Chemin du Rougelot, Vallerois-Lorioz
Granges Jean Mourey à Fontenois-la-Ville
deux rue des Valvains
Voie du Garde au numéro trois
un rue Riotte Monnin, soixante-dix mille cent quatre-vingt-dix Cromary
sept lotissement Les Vorpes, soixante-dix, sept cents, Gy
deux rue Berçot, soixante-dix, cent dix aux Magny
Route de Faymont, soixante-dix mille deux cents Moffans-et-Vacheresse
Chemin du Moulin Rouge, soixante-dix, deux cent dix Pont-du-Bois
Champs de la Haie, La Lanterne-et-les-Armonts
Rue du Moto Cross à Frotey-lès-Vesoul
quatre rue de la Douin
Champs du Bas au numéro dix-sept
trois cent quarante-sept le Pont Nini, soixante-dix mille deux cent soixante-dix Fresse
un rue de la Machurelle, soixante-dix, cent trente, Les Bâties
cinq rue Lavizat, soixante-dix, zéro zéro zéro à Mont-le-Vernois
Chemin du Champ du Rot, soixante-dix mille deux cent soixante-dix Saint-Barthélemy
Rue de la Dannelle, soixante-dix, cent Nantilly
Lès Raguettes, Aillevillers-et-Lyaumont
Rue du Moulin du Val à Varogne
trois impasse de Girondey
Chemin de la Féculerie au numéro un
cinq rue Gaston Vichard, soixante-dix mille Vesoul
un rue de la Charrière Aux Lièvres, soixante-dix, cent soixante, Mersuay
deux champs de la Montoillotte, soixante-dix, zéro zéro zéro à Vesoul
Impasse des Frères Mozer, soixante-dix mille deux cent quatre-vingt-dix Champagney
Route de Chatebier, soixante-dix, quatre cents Chenebier
Route de la Mechère, Saulx
Rue de la Périlleuse à Vesoul
trois le Nid d'Agasse
Impasse Fleurier au numéro trois
un rue de la Souffroide, soixante-dix mille cent Nantilly
deux cent vingt-neuf les Combottes, soixante-dix, deux cent soixante-dix, Fresse
un les Abbayottes, soixante-dix, cent quatre-vingt-dix à Montarlot-lès-Rioz
Rue Dewier, soixante-dix mille Navenne
Chemin des Champs Pougeot, soixante-dix, deux cent quatre-vingts Amage
Voie de Saint-Georges, Athesans-Étroitefontaine
Route de Bouhans à Amblans-et-Velotte
deux rue des l'Écoles
Rue de Bétoncourt au numéro cinq
trois rue de la Maison de Justice, soixante-dix mille deux cent dix Vauvillers
cinq chemin du Théâtre, soixante-dix, cent quatre-vingt-dix, Hyet
trois cent quarante-neuf BIS derriere l'Etang, soixante-dix, deux cent soixante-dix à Fresse
Rue des Bourrots, soixante-dix mille sept cents Vaux-le-Moncelot
Le Freuteau, soixante-dix, deux cent soixante-dix Fresse
Ferme du Craillon, Melincourt
Impasse de la Bollerie à Angirey
un BIS escaliers de la Roche
Rue de Senoncourt au numéro quatre
un les Voies de Villers, soixante-dix mille cent quatre-vingt-dix Boult
trois impasse Rigoulot, soixante-dix, cent soixante-dix, Bougnon
quatre chemin du Cumenail, soixante-dix, deux cent quatre-vingt-dix à Champagney
Impasse Racle, soixante-dix mille quatre cents Granges-le-Bourg
Le Lyaumont, soixante-dix, trois cent vingt Aillevillers-et-Lyaumont
Chemin de la Voie d'Igny, Saint-Broing
Route du Vieux Lavoir à Saint-Germain
un ferme du Champonnet
Rue du Rougeot au numéro quatre
un rue de la Vieille Vau, soixante-dix mille huit cents Bourguignon-lès-Conflans
un route de Purgerot, soixante-dix, cent soixante, Fouchécourt
quatre rue des Champs du Sû, soixante-dix, cent cinquante à Étuz
Impasse de la Côte des Moines, soixante-dix mille deux cent dix Melincourt
Impasse de la Noye, soixante-dix, quatre cents Mandrevillars
Chemin des Champs Vautier, Étobon
Chemin d'Anthon à Quenoche
deux rue de la Metaye
Ruelle de la Raye au numéro un
deux rue des Haberges, soixante-dix mille Vesoul
un rue Jean Rougetet, soixante-dix, cent, Gray
un pré Le Poulain, soixante-dix, deux cent soixante-dix à La Lanterne-et-les-Armonts
Impasse du Bout du Chien, soixante-dix mille sept cents Vaux-le-Moncelot
Rue de Belfays, soixante-dix, cent quatre-vingt-dix Maizières
Pré Thiebaud, Champagney
Le Gros Pré à La Lanterne-et-les-Armonts
quatre rue Derrière les Tours
Impasse Greget au numéro cinq
deux ferme du Pré du Chapelot, soixante-dix mille cent trente Soing-Cubry-Charentenay
trois chemin d'Étobon, soixante-dix, deux cent quatre-vingt-dix, Champagney
neuf rue des Rvières, soixante-dix, trois cent dix à Faucogney-et-la-Mer
La Charmotte, soixante-dix mille sept cents Gy
Les Creux de la Terre, soixante-dix, deux cent soixante-dix Montessaux
Route de Brumbief, Esmoulières
Hameau La Logeotte à Hautevelle
trois impasse de la Cugne
