un rue des Perchées, trente-neuf mille huit cents Poligny
vingt-quatre rue d'Olivet, trente-neuf, cent dix, Salins-les-Bains
deux rue du Champ Belland, trente-neuf, deux cents à Avignon-lès-Saint-Claude
Rue Général Baratier, trente-neuf mille cent Dole
Chemin de la Chaux Berthod, trente-neuf, trois cent dix Lamoura
Chemin de Rosset, Choux
Rue Jean Breuil à Arinthod
cent vingt-sept rue de Charrière
Rue des Grandes Carrières au numéro trente-neuf
trente-huit B rue François Monin, trente-neuf mille cinq cent soixante-dix Montmorot
sept route du Val d'Amour, trente-neuf, six cents, Écleux
cent vingt-trois route de Lons-le-Saunier, trente-neuf, trois cents à Ney
Rue du Vanneret, trente-neuf mille quatre cent soixante Foncine-le-Haut
Route de Dole, trente-neuf, trois cent quatre-vingts Mont-sous-Vaudrey
Rue de Guenebout, Jouhe
Rue des Boisdels à Cuisia
deux cent vingt-six rue des Tappes
Charrière Baron au numéro cinq
deux cent quatre-vingt-treize rue de la Lathe, trente-neuf mille cinq cent soixante-dix Perrigny
treize rue du Louvot, trente-neuf, cent quarante, Nance
six rue Jean Weber, trente-neuf, huit cents à Poligny
Rue des Moutelles, trente-neuf mille cent Crissey
Rue du Mattier, trente-neuf, cent trente Doucier
Route de Chaussin, Saint-Baraing
Rue Louis Grandchavin à Morez
trente rue de Samerey
Rue de Fleurier au numéro dix
cent trente route de Juhans, trente-neuf mille cent quarante Arlay
cinq rue du Processionnal, trente-neuf, deux cent cinquante, Mignovillard
quatre B route du Deschaux, trente-neuf, trois cent quatre-vingts à Mont-sous-Vaudrey
Rue Roger Merlin, trente-neuf mille huit cents Colonne
Rue du Viseney, trente-neuf, cinq cent soixante-dix Mirebel
Ruelle des Pitoux, Rahon
Place sur la Chapelle à Lect
neuf rue Jean Joseph Pallu
Montée de l'Ermitage au numéro six BIS
deux chemin de Bonlieu, trente-neuf mille deux cent trente Saint-Lothain
onze rue des Poisets, trente-neuf, trois cents, Crotenay
neuf rue des Turots, trente-neuf, trois cent quatre-vingts à La Vieille-Loye
Rue de Peintre, trente-neuf mille deux cent quatre-vingt-dix Chevigny
Impasse du Pertuis, trente-neuf, cent Baverans
Chemin de Montenay, Lons-le-Saunier
Rue Coquaine à Vosbles
quatorze A avenue de Northwich
Rue de Friquet au numéro onze
onze rue du Déroube, trente-neuf mille cinq cent soixante-dix Vernantois
sept rue Jean de Chalon, trente-neuf, deux cent quarante, Arinthod
cinq rue des Chanerons, trente-neuf, cent quarante à Desnes
Route de Maisod, trente-neuf mille deux cent soixante Charchilla
Rue d'Azans, trente-neuf, cent Dole
Route de Marignat, Chassal
Rue des Caboulots à Tavaux
six rue Parandier
Route de l'Abergement au numéro vingt-huit
seize chemin des Toupes, trente-neuf mille cinq cent soixante-dix Trenal
un rue Lillette, trente-neuf, deux cent cinquante, Nozeroy
trois champ du Rafourg, trente-neuf, cent dix à Pont-d'Héry
La Petite Biolée, trente-neuf mille cent quatre-vingt-dix Cuisia
Rue des Grand Vignes, trente-neuf, deux cent quatre-vingt-dix Rainans
Rue de Grand Contour, Belmont
Rue Alano Di Piave à Moirans-en-Montagne
deux impasse Combernoz
Rue du Petit-Montagna au numéro treize
onze les Pessettes, trente-neuf mille cent cinquante Prénovel
soixante-huit rue du Saulçois, trente-neuf, cent vingt, Petit-Noir
quatre rue Lecourbe, trente-neuf, cent vingt à Chaussin
Rue du Mont-Joly, trente-neuf mille cent Sampans
Rue du Quart d'Avaux, trente-neuf, deux cent trente Passenans
Rue d'Hauterive, Gevry
Rue de la Bretenière à Authume
quatorze côte du Four
Route de Lons au numéro vingt-deux
quatre place Gaston Jeannin, trente-neuf mille cinq cents Damparis
treize rue du Pré de la Tour, trente-neuf, cinq cent soixante-dix, Montmorot
cinq cent seize rue Bourichet, trente-neuf, cent quarante à Villevieux
Avenue Reine Elisabeth, trente-neuf mille cinq cents Tavaux
Rue Tripet, trente-neuf, six cents Arbois
Rue d'Abergement, Damparis
Rue d'Orgemont à Salins-les-Bains
mille cent vingt-quatre rue des Trois Lacs
Rue des Cares au numéro un
dix impasse Chambard, trente-neuf mille trois cent vingt Lains
dix rue Clairtant, trente-neuf, cinq cent soixante-dix, Moiron
vingt rue du Valjon, trente-neuf, cinq cents à Abergement-la-Ronce
Rue de Montu, trente-neuf mille cinq cent soixante-dix Perrigny
Rue Roger Bridé, trente-neuf, cinq cents Damparis
Rue du Cournot, Arbois
Rue Louis le Grand à Bletterans
huit rue du Coulon
Rue de Crotenay au numéro douze
huit lotissement Les Curtillets, trente-neuf mille trois cent dix Septmoncel
seize rue de la Fontaine du Murger, trente-neuf, trois cents, Cize
huit passage de l'Oratoire, trente-neuf, quatre cents à Morbier
Rue des Longues Fins, trente-neuf mille cinq cents Damparis
Rue de la Malatière, trente-neuf, cent vingt Chaussin
Impasse de la Confise, Thoiria
Rue de Bonneville à Saint-Claude
vingt-deux route d'Arbois
Rue du Faubourg Marcel au numéro vingt-trois
cent soixante-quatre rue des Gay, trente-neuf mille cinq cent soixante-dix Courlaoux
trois rue de Combe Rive, trente-neuf, cent quatre-vingt-dix, Rotalier
trente-six rue Lamartine A Azans, trente-neuf, cent à Dole
Rue du Bois du Prince, trente-neuf mille cent quarante Nance
Rue Sous Plumont, trente-neuf, cent Champvans
Rue Léon et G. Bazinet, Champagnole
Chemin des Morel à Morbier
neuf rue de la Tope
Chemin des Champs Nouveaux au numéro deux cent quatre-vingt-quinze
vingt-huit rue Sage, trente-neuf mille sept cents Auxange
vingt-deux route de Lons Le Saunier, trente-neuf, cent trente, Clairvaux-les-Lacs
huit rue Patot, trente-neuf, cent à Authume
Rue du Mont Roland, trente-neuf mille cent Dole
Les Fans, trente-neuf, cent cinquante Prénovel
Chemin de la Ferté, Lons-le-Saunier
Avenue Camille Prost à Lons-le-Saunier
six rue de la Combe A Martan Monta
Rue du Moulin Toussaint au numéro onze BIS
soixante-cinq rue de la Grémone, trente-neuf mille cinq cent soixante-dix Perrigny
vingt-cinq rue du Champ Planet, trente-neuf, deux cent soixante, Moirans-en-Montagne
deux cent soixante-dix-neuf rue de la Blondelle, trente-neuf, cinq cent soixante-dix à Villeneuve-sous-Pymont
Champs Guerrins, trente-neuf mille cinq cent soixante-dix Saint-Maur
Route de Lajoux, trente-neuf, trois cent dix Lamoura
Voie Communale Trépaillard, Morbier
Rue de la Vuarde à Saint-Laurent-la-Roche
sept rue du Colonel Champion
Rue de l'Haut au numéro neuf cent cinquante
douze rue Stephen Pichon, trente-neuf mille trois cents Vers-en-Montagne
cinq rue des Engreseules, trente-neuf, trois cents, Sirod
quarante-deux rue de la Clauge, trente-neuf, cent à Dole
Route de Dortan, zéro un, cinq cent quatre-vingt-dix Lavancia-Epercy
Rue du Pré Millet, trente-neuf, huit cents Buvilly
Route du Poisel, Les Hays
Rue des Meix Brûlés à Tavaux
quinze chemin des Lances
Rue de la Fontenette au numéro trois cent vingt-sept
quatre cent trente-cinq rue Marcel Berger, trente-neuf mille Lons-le-Saunier
dix lotissement Aux Genévriers, trente-neuf, deux cent soixante-dix, Dompierre-sur-Mont
quatre-vingt-trois rue Charles Blind, trente-neuf, cent à Dole
Chemin des Fontenottes, trente-neuf mille trois cent quatre-vingts Chatelay
Chemin de Machefin, trente-neuf, deux cent trente Vincent
Rue du Faubourg Saint-Antoine, Chissey-sur-Loue
Rue Claude Guyon à Foucherans
deux rue Balafin
Route de Nilly au numéro six cent dix
quinze rue du Bourg Dessus, trente-neuf mille cent quarante Arlay
quarante-quatre avenue du Cardinal Mercier, trente-neuf, cinq cents, Tavaux
cinquante-deux rue Léon Chifflot, trente-neuf, cent à Dole
Rue de la Perouse, trente-neuf mille cinq cent soixante-dix Vevy
Rue des Vallès, trente-neuf, quatre cent soixante Foncine-le-Haut
Rue des Larges Pierres, Choisey
Chemin de Boutru à Bletterans
neuf route de Banne
Impasse de la Corvée Sous Bois au numéro deux
cent huit rue du Val d'Amour, trente-neuf mille cent Dole
sept rue de Ronchaud, trente-neuf, cent soixante-dix, Saint-Lupicin
un place Joseph Chevalet, trente-neuf, trois cents à Saint-Germain-en-Montagne
Rue Jacques Coittier, trente-neuf mille huit cents Poligny
Rue des Enversys, trente-neuf, cent soixante Saint-Amour
Chemin du Haut Gauvin, Courlaoux
Place Frédéric Barberousse à Dole
trois cent trente-neuf route de Montépile
Rue Baronne Delort au numéro huit
vingt-huit BIS rue de la Dhuye, trente-neuf mille deux cent soixante Moirans-en-Montagne
six place Berthelot, trente-neuf, cent dix, Salins-les-Bains
trente et un route de Chalain, trente-neuf, cent trente à Doucier
Chemin de la Reisse, trente-neuf mille quatre cents Longchaumois
Rue Edmond Chapuis, trente-neuf, zéro zéro zéro Lons-le-Saunier
Route d'Ivrey, La Chapelle-sur-Furieuse
Parc de Brevans à Brevans
seize route de Poitte
Rue Roselet au numéro quatre
deux cent soixante-trois rue de Rostaing, trente-neuf mille deux cent trente Passenans
deux cent vingt-quatre rue Bourgeat d'Amont, trente-neuf, quatre cents, La Mouille
trois rue de Preyat, trente-neuf, trois cents à Sirod
Rue Roger Siblot, trente-neuf mille cent Dole
Rue Chanaux, trente-neuf, cent vingt Saint-Loup
Rue de la Ronceraie, Crissey
Rue des Nicottes à Choisey
sept route Corne d'Aury
Rue de Damparis au numéro quinze
cinq route Principale du Bois Laurent, trente-neuf mille cent quatre-vingt-dix Augea
vingt-cinq rue Marcel Hugon, trente-neuf, trois cents, Monnet-la-Ville
quatorze rue de Repoutot, trente-neuf, huit cents à Aumont
Chemin de la Grange Rouge, trente-neuf mille cinq cent soixante-dix Geruge
Rue de la Liade, trente-neuf, cinq cent soixante-dix Crançot
Route de Goux, Villette-lès-Dole
Rue Charles Blanc à Amange
quatre-vingt-quinze rue du Creuilly
Rue du Bas de la Fin au numéro six
douze rue de la Proie, trente-neuf mille cent Dole
dix-neuf rue des Ruottes, trente-neuf, cent, Sampans
sept rue Alexandre Volta, trente-neuf, trois cents à Champagnole
Rue de la Sambine, trente-neuf mille deux cent vingt Prémanon
Montée de Saint-Vernier, trente-neuf, cinq cent soixante-dix Vernantois
Rue du Champ Minet, Larnaud
Rue de l'Épicéa à La Pesse
six impasse Constantin
Rue du Champ Dez au numéro neuf
deux bourguignons, trente-neuf mille cent Brevans
trois cour des Ursulines, trente-neuf, huit cents, Poligny
deux rue du Coiffeur, trente-neuf, trois cents à Chapois
Rue du Jeu de Quille, trente-neuf mille deux cent soixante-dix La Tour-du-Meix
Rue des Equevillons, trente-neuf, cent Dole
Lotissement sous les Vignes, Lavans-lès-Dole
Rue Bugnon à Commenailles
quatre-vingts rue du Chanelet
Rue Reybert au numéro sept
douze BIS rue de Champdivers, trente-neuf mille cinq cents Molay
quinze rue de la Burille, trente-neuf, cent quatre-vingt-dix, Beaufort
quatre route de Mallerey, trente-neuf, cent quatre-vingt-dix à Vincelles
Rue Perrine Nord, trente-neuf mille cent soixante-dix Ravilloles
Rue d'Oisenans, trente-neuf, cent quarante Ruffey-sur-Seille
Rue de Penu, Cesancey
Rue des Vernaux à Tavaux
trois rue Renobert Nelaton
Rue du Docteur Roch au numéro seize
cinq hameau de Creve Coeur, trente-neuf mille cent quatre-vingt-dix Orbagna
huit rue de l'Abergement, trente-neuf, cinq cents, Tavaux
neuf chemin du Meix Questien, trente-neuf, huit cents à Bersaillin
Rue Guénot, trente-neuf mille cinq cent soixante-dix Cesancey
Rue du Petit Villard, trente-neuf, deux cent soixante Villards-d'Héria
Champs de Barge, Marnoz
Rue du Curé Marquis à Saint-Lupicin
vingt-neuf les Champs du Pont
Rue de la Saisse au numéro quatre
deux cent soixante-trois rue du Grépillon, trente-neuf mille deux cent vingt Les Rousses
six rue de la Malacote, trente-neuf, deux cent quarante, Arinthod
vingt-cinq rue des Anciennes Forges, trente-neuf, cent à Foucherans
Rue Victor Lorain, trente-neuf mille Lons-le-Saunier
Rue Pavé, trente-neuf, trois cents Champagnole
Rue de Montalent, Le Louverot
Chemin de Saint-Ylie à Foucherans
cinq rue Georges Vallerey
Rue Mouthier le Vieillard au numéro dix
six chez Les Basset, trente-neuf mille deux cent dix Lavigny
un quartier La Serra, trente-neuf, cent trente, Soucia
douze rue du Montaubin, trente-neuf, trois cent trente à Mouchard
Avenue Abbé Lemire, trente-neuf mille Lons-le-Saunier
Rue du Ploussard, trente-neuf, six cents Pupillin
Rue Pierre Langue, Champagnole
Rue des Bevoyes à Falletans
onze chemin des Grettes
Rue des Paters au numéro trois
vingt-six rue de Tichey, trente-neuf mille quatre cent dix Saint-Aubin
cinq cent quatre-vingt-quinze montée Gauthier Villars, trente-neuf, zéro zéro zéro, Lons-le-Saunier
sept rue de Brêche, trente-neuf, cent soixante à Saint-Amour
Rue Boyvin, trente-neuf mille cent Dole
Avenue de Franche-Comté, trente-neuf, deux cent soixante Moirans-en-Montagne
Descente du Couchant, Morbier
Rue Léon Guignard à Dole
deux cent vingt rue du Puits à Sel
Rue de l'Angillon au numéro quatorze
dix route de Foulenay, trente-neuf mille deux cent trente Les Deux-Fays
dix-sept rue La Buissière, trente-neuf, sept cents, Rochefort-sur-Nenon
trente-cinq route de Tortelet, trente-neuf, deux cent dix à Saint-Germain-lès-Arlay
Quartier Les Grands Plans, trente-neuf mille deux cent soixante Les Crozets
Route de Longwy, trente-neuf, cent vingt Chaussin
Rue du Duché, Champagney
Rue Charles Favre à Moirans-en-Montagne
un lotissement les Grands Champs
Rue du Bois d'Amont au numéro six
quatre-vingt-neuf rue de la Bienne, trente-neuf mille trois cent soixante Vaux-lès-Saint-Claude
cinq rue des Mauchamps, trente-neuf, deux cent quatre-vingt-dix, Menotey
deux impasse les Mélèzes, trente-neuf, cent à Dole
Rue Auguste Vantard, trente-neuf mille cent Dole
Route d'Équevillon, trente-neuf, trois cents Saint-Germain-en-Montagne
Rue Jean Heberling, Dole
Rue Herbert Marcuse à Dole
dix rue Pointelin
Route de Louhans au numéro deux mille trois cent vingt-deux
quatre-vingt-sept rue de Boussières, trente-neuf mille huit cents Poligny
soixante quartier Le Village, zéro un, quatre cent dix, Lajoux
un B impasse du Bois de Lahier, trente-neuf, sept cents à Lavans-lès-Dole
Sous Les Bouchets, trente-neuf mille cent cinquante Prénovel
Avenue Etienne Lamy, trente-neuf, trois cents Cize
Avenue Jacques Duhamel, Dole
Rue de Molay à Gevry
quatre-vingt-six rue Boudier
Impasse des Doucettes au numéro deux BIS
treize route de Mesnois, trente-neuf mille cent trente Mesnois
soixante-neuf rue des Peroseys, trente-neuf, zéro zéro zéro, Lons-le-Saunier
six pont de Morbier, trente-neuf, quatre cents à Morbier
Rue Sur les Cotes, trente-neuf mille trois cent soixante Vaux-lès-Saint-Claude
Rue de Mouchet, trente-neuf, six cents Les Arsures
Route de Barges, Marnoz
Rue du Sauju à Sirod
deux cents rue de La Cotette
Rue Henri Prost au numéro treize
vingt-sept rue Paul Cretin, trente-neuf mille trois cents Champagnole
quatre cent soixante-quinze rue du Mont du Cerf, trente-neuf, deux cent soixante, Maisod
quarante-trois place Robert Monnier, trente-neuf, deux cent soixante à Moirans-en-Montagne
Rue Farachat, trente-neuf mille cinq cent soixante-dix Moiron
Chemin de l'Echaillier, trente-neuf, cent trente Mesnois
Rue Château Charrin, Voiteur
Route du Centre à Pleure
mille trois cent huit rue du Petit Sugny
Route de Loulle au numéro vingt-quatre
six impasse Jean Moreal, trente-neuf mille cent Foucherans
trois cent dix route du Génie, trente-neuf, deux cent vingt, Les Rousses
huit rue des Murtins, trente-neuf, cent quarante à Desnes
Route de la Haute Combe, trente-neuf mille quatre cents Morbier
Place Jules Girod, trente-neuf, quatre cents Morez
Rue Alexis Janet, Sellières
Rue Saint-Néron à Bornay
trente hameau Fontaine Aux Loups
Chemin du Grimont au numéro treize
trois rue du Coin Ch'André, trente-neuf mille cinq cent soixante-dix Crançot
soixante-quatorze montée de la Derrache, trente-neuf, deux cent vingt, Bois-d'Amont
dix-sept rue de la Boutière, trente-neuf, cent à Crissey
Rue Louis Guillaume, trente-neuf mille trois cent quatre-vingts Mont-sous-Vaudrey
Rue des Clia-Cliats, trente-neuf, trois cent quatre-vingts La Vieille-Loye
Rue de l'Arne, Lavans-lès-Dole
Rue des Petits Beaux à Courbouzon
deux cent soixante et un chemin des Tuffes
Rue Georges Trouillot au numéro trois cent quatre-vingt-cinq
deux rue de l'Œillette, trente-neuf mille cinq cent soixante-dix Vernantois
onze chemin de Vornes, trente-neuf, cent vingt, Asnans-Beauvoisin
cinq rue Clair-Matin, trente-neuf, cent soixante à Saint-Amour
Grande Rue de la Bresse, trente-neuf mille deux cent trente Chaumergy
Rue Léon et Cécile Mathy, trente-neuf, cinq cent soixante-dix Montmorot
Rue du Bas des Roches, Chapois
Rue du Général Michel à Pointre
vingt rue des Petites Fouilles
Place des Alliés et de la Resist au numéro trois
cinq rue des Laisines, trente-neuf mille deux cent soixante Maisod
cent cinquante-huit A avenue Eisenhower, trente-neuf, cent, Dole
deux rue Charnal, trente-neuf, deux cent soixante-dix à Présilly
Route de Taxenne, trente-neuf mille trois cent cinquante Ougney
Impasse du Plain Champ, trente-neuf, deux cent soixante Villards-d'Héria
Rue du Sous-Bois, Arlay
Impasse Athanase Babey à Orgelet
neuf rue Louis Gerriet
Route de Froideville au numéro deux cent vingt-neuf
cent cinquante-deux rue des Champs Ramboz, trente-neuf mille deux cent dix Domblans
deux cent vingt rue de Chiriat, trente-neuf, trois cent soixante, Vaux-lès-Saint-Claude
dix rue Ferdinand de Rye, trente-neuf, cent à Dole
Place Nation Charles de Gaulle, trente-neuf mille cent Dole
Chemin des Repôts, trente-neuf, cinq cent soixante-dix Courlaoux
Route de Messia Sarrogna, Sarrogna
Rue Clertant à Lons-le-Saunier
six avenue de Grandvaux
Rue de la Tour du Loup au numéro deux
six cent vingt-cinq chemin de la Chaumette, trente-neuf mille cinq cent soixante-dix Pannessières
quinze rue du Bénédegand, trente-neuf, trois cents, Cize
cinquante-sept montée Félix Péclet, trente-neuf, deux cent vingt aux Rousses
Rue Bercaille, trente-neuf mille Lons-le-Saunier
Rue des Monderets, trente-neuf, deux cents Saint-Claude
Rue des Chenevriers, Mantry
Rue Louis De La Verne à Dole
quarante-huit rue de Trey la Fontaine
Rue de Crissey au numéro vingt-six
sept rue du Mont Rivel, trente-neuf mille trois cents Équevillon
vingt avenue Louis Paget, trente-neuf, quatre cents, Morez
huit rue Jean Bavilley, trente-neuf, trois cent quatre-vingts à Mont-sous-Vaudrey
Route de Courlans, trente-neuf mille cinq cent soixante-dix Chilly-le-Vignoble
Impasse des Champs Patins, trente-neuf, deux cent trente Chaumergy
Rue des Avaux, Champvans
Rue des Orcières à Aiglepierre
cinq chemin de la Molaine
Montée des Tilleuls au numéro six
quatre champ Au Biou, trente-neuf mille cent dix Salins-les-Bains
un rue du Capitaine Magnien, trente-neuf, cent, Dole
trois impasse du Rochet, trente-neuf, cent quatre-vingt-dix à Orbagna
Rue de la Croix de la Teppe, trente-neuf mille deux cent vingt Prémanon
Chemin des Bauvrettes, trente-neuf, cent Choisey
Rue des Mollets, Moiron
Impasse Marigna à Orbagna
trois cent vingt-neuf rue du Champ au Loup
Rue des Champs Rouges au numéro sept
trente et un rue de Pupillin, trente-neuf mille six cents Arbois
six rue de May Fauchette, trente-neuf, huit cents, Aumont
vingt rue des Mouillères, trente-neuf, zéro zéro zéro à Lons-le-Saunier
Rue du Château Montjouvent, trente-neuf mille deux cent soixante-dix Sarrogna
Route de Villechantria, trente-neuf, trois cent vingt Villechantria
Vers Chez Putillet, Foncine-le-Haut
Route de Savarin à Châtel-de-Joux
onze chemin Vinetier
Rue Baron Bouvier au numéro deux
six rue des Roclins, trente-neuf mille cent trente Fontenu
six impasse de la Corne, trente-neuf, cent quatre-vingt-dix, Vercia
huit rue de Loiteau, trente-neuf, trois cents à Équevillon
Rue Désiré Barodet, trente-neuf mille cinq cent soixante-dix Frébuans
Quai des Écoles, trente-neuf, quatre cents Morez
Rue du Chauvent, Villette-lès-Arbois
Chemin des Sondes à Montmorot
douze quartier La Montagne Au Paul
Rue de Trey La Ville au numéro huit
treize rue du Gouvenon, trente-neuf mille cent Dole
vingt-quatre rue du Carrouge, trente-neuf, cent vingt, Tassenières
deux cent soixante route de Syam, trente-neuf, trois cents à Bourg-de-Sirod
Rue Gédéon David, trente-neuf mille trois cents Champagnole
Rue François Bussenet, trente-neuf, zéro zéro zéro Lons-le-Saunier
Rue Simone Michel Lévy, Chaussin
Rue Séraphin Morand à Saint-Aubin
seize rue Gutt Grancher
Rue des Champs des Contours au numéro cent quatre-vingt-huit
six rue Principale Sarrogna, trente-neuf mille deux cent soixante-dix Sarrogna
trente-huit rue Gaudard Pacha, trente-neuf, cent, Dole
dix rue Natisse, trente-neuf, sept cents à Éclans-Nenon
Côte a la Luce, trente-neuf mille quatre cents Morbier
Avenue de Saint-Claude, trente-neuf, deux cent soixante Moirans-en-Montagne
Route de la Fresse, Saint-Germain-en-Montagne
Chemin des Coulonges à Montmorot
un rue des Prémoureaux
Rue du Cléau au numéro cinq
neuf chemin des Prés Viards, trente-neuf mille deux cent trente Bréry
deux chemin de Lardière, trente-neuf, trois cents, Cize
dix voie Communale A l'Orée des Bois, trente-neuf, quatre cents à Morbier
Rue Léon Perraudin, trente-neuf mille cent Dole
Chemin des Crouchettes, trente-neuf, cinq cent soixante-dix Saint-Didier
Chemin Combe Caneau, Villard-sur-Bienne
Rue du Marché au Bois Blanc à Lons-le-Saunier
vingt-deux chemin des Noches
Rue du cinq Août mille neuf cent quarante-quatre au numéro quatre
treize A rue André Bouvier, trente-neuf mille cinq cent soixante-dix Montmorot
huit route de la Borne au Lion, trente-neuf, trois cent soixante-dix, La Pesse
deux route de Savigna, trente-neuf, deux cent quarante à Fétigny
Route de Bletterans, trente-neuf mille cent quarante Fontainebrux
Rue Fontaine Chaumereau, trente-neuf, trois cent vingt Gigny
Rue René Lorin, Morbier
Chemin du Cuyard à Domblans
vingt-neuf rue Champ Didier
Rue de la Langouette au numéro soixante-neuf
quatorze rue Necy, trente-neuf mille six cents Arbois
trois impasse Ferdinand Belin, trente-neuf, cent, Foucherans
quatre TER route Louis Pasteur, trente-neuf, six cents à Villers-Farlay
Rue du Val de Sorne, trente-neuf mille cinq cent soixante-dix Messia-sur-Sorne
Rue Henri Ponard, trente-neuf, cinq cent soixante-dix Montmorot
Rue de la Croix Baptiste, Buvilly
Chemin du Pétasson à Villard-sur-Bienne
vingt-sept rue de la Plassotte
Rue de la Margotte au numéro deux
cent cinquante chemin de Chaudon, trente-neuf mille Lons-le-Saunier
quatre cent cinquante-trois rue du Grand Messia, trente-neuf, cinq cent soixante-dix, Messia-sur-Sorne
quarante-quatre B rue Pierre Hebmann, trente-neuf, zéro zéro zéro à Lons-le-Saunier
Chemin des Epargillères, trente-neuf mille cent soixante Saint-Amour
Impasse Abbé Gaidot, trente-neuf, cent dix Chilly-sur-Salins
Impasse des Cheneviers, Chille
Rue de la Pierre Qui Vire à Saint-Claude
deux cent cinquante rue des Replats
Rue du Pont de l'Antenne au numéro trois
quatre rue des Malans, trente-neuf mille deux cent quatre-vingt-dix Thervay
deux BIS rue Armand Tisserand, trente-neuf, trois cent quatre-vingts, Mont-sous-Vaudrey
dix rue des Claristes, trente-neuf, cent dix à Salins-les-Bains
Rue d'en Dessous, trente-neuf mille huit cents Miéry
Chemin du Nivelet, trente-neuf, cent vingt Asnans-Beauvoisin
Route de l'Étang Neuf, Biefmorin
Rue des Nayards à Beaufort
mille quatre cent onze route de Lamarre
Impasse des Marnes Bleues au numéro trois
huit rue du Mératon, trente-neuf mille cent vingt Petit-Noir
cent soixante-cinq rue de la Parire, trente-neuf, cent trente, Étival
trente-cinq rue du Docteur Gouhot, trente-neuf, trois cent quatre-vingts à Mont-sous-Vaudrey
Impasse de Mouchet, trente-neuf mille six cents Les Arsures
Chemin du Vernolet, trente-neuf, cent vingt Le Deschaux
Rue du Champ Bouvier, Beaufort
Route du Val de Sorne à Courbouzon
trois cent quarante-quatre rue Désiré Monnier
Rue du Petit Villey au numéro un
cent quatre-vingt-dix-neuf le Grand Carteron, trente-neuf mille cent cinquante Lac-des-Rouges-Truites
vingt-huit voie Communale Les Fretes, trente-neuf, deux cents, Saint-Claude
six rue A Piron, trente-neuf, cent cinquante aux Chalesmes
Rue des Hauts de Plumont, trente-neuf mille cent Dole
Avenue de Landon, trente-neuf, cent Dole
Route des Lattes, La Mouille
Route de Mirebel à La Marre
huit rue du Village Neuf
Rue René Maire au numéro soixante-quinze
huit rue Joseph Cordier, trente-neuf mille deux cent soixante-dix Orgelet
sept chemin des Rougelots, trente-neuf, cent, Choisey
seize rue du Général Malet, trente-neuf, cent à Dole
Impasse du Vergerot, trente-neuf mille deux cent dix Domblans
Chemin des Madeleines, trente-neuf, cinq cent soixante-dix Saint-Didier
Rue de Ribie, Bourcia
Rue du Quarteaux à Port-Lesney
trente-sept rue des Commards
Rue Adolphe Brune au numéro trente-huit
cinquante-cinq rue Général Charles Diego Brosset, trente-neuf mille cent Dole
un chemin de Montmirey, trente-neuf, deux cent quatre-vingt-dix, Dammartin-Marpain
deux cent vingt-sept rue des Guinches, trente-neuf, deux cent vingt à Bois-d'Amont
Rue des Léchères, trente-neuf mille trois cent vingt Montagna-le-Templier
Rue de la Colombiére, trente-neuf, huit cents Buvilly
Rue du Champ Beaulieu, Courlaoux
Promenade des Joublottes à Menotey
soixante-dix-huit rue de Larney
Rue de Faramand au numéro vingt-quatre
dix rue des Prés Bourgeois, trente-neuf mille trois cent quatre-vingts Montbarrey
cent rue des Cartes, trente-neuf, deux cent dix, Plainoiseau
vingt rue Travot, trente-neuf, huit cents à Poligny
Rue du Grand Villard, trente-neuf mille deux cent soixante Villards-d'Héria
Rue de l'Etang du Moulin, trente-neuf, sept cents Éclans-Nenon
Route de Poligny, La Marre
Route Internationale aux Rousses
un rue Alphonse Rousset
Lotissement Le Clos des Dorés au numéro huit
sept route de Conté, trente-neuf mille trois cents Sirod
quatre chemin du Grand Bodon, trente-neuf, cent vingt, Petit-Noir
six route de Pleure, trente-neuf, cent vingt aux Essards-Taignevaux
Rue du Boichot, trente-neuf mille cent Dole
Rue Regnaud de Chalon, trente-neuf, zéro zéro zéro Lons-le-Saunier
