trente-neuf grande Rue de Saint-Clair, soixante-neuf, trois cents à Caluire-et-Cuire
Rue Général André, soixante-neuf mille huit Lyon
Rue des Forces, soixante-neuf, zéro zéro deux Lyon
Chemin du Champ du Roy, Rillieux-la-Pape
Avenue Lionel Terray à Meyzieu
dix allée des Angelards
Impasse François Mermet au numéro vingt
trente rue Francis Popy, soixante-neuf mille quatre cents Villefranche-sur-Saône
soixante-cinq rue des Rancy, soixante-neuf, zéro zéro trois, Lyon
huit chemin de la Tappe, soixante-neuf, trois cent quatre-vingts à Lissieu
Avenue du Docteur Georges Lévy, soixante-neuf mille deux cents Vénissieux
Rue du Mont Cindre, soixante-neuf, cent quarante Rillieux-la-Pape
Chemin de la Fromentière, Sourcieux-les-Mines
Chemin d'Aigue à Anse
trente-huit rue Antoine Péricaud
Chemin Jean Baptiste Gilliard au numéro trois
vingt-sept chemin de la Civaude, soixante-neuf mille quatre cent quarante Mornant
vingt-trois allée du Textile, soixante-neuf, cent vingt, Vaulx-en-Velin
quatre allée de la Rivoyre, soixante-neuf, cent vingt-six à Brindas
Boulevard des Allées, soixante-neuf mille quatre cent vingt Ampuis
Route de la Saigne, soixante-neuf, cinq cent dix Messimy
Résidence Domaine de la Côte, Brignais
Rue Francisque Jomard à Oullins
deux rue du Bât-d'Argent
Route de la Cime d'Huire au numéro dix-sept
quatre cent treize rue Marius Donjon, soixante-neuf mille neuf Lyon
cent soixante-trois route d'Anse, soixante-neuf, six cent vingt, Frontenas
trente-deux rue de Chavorlay, soixante-neuf, huit cents à Saint-Priest
Impasse des Pyrites, soixante-neuf mille trois cent quatre-vingts Chessy
Impasse Gord, soixante-neuf, zéro zéro quatre Lyon
Rue Andrée Brevet, Villeurbanne
Chemin du Planil à Yzeron
trois cent treize rue Dechavanne
Rue Alexandre Berthier au numéro trois
huit cent quarante-trois route de la Croix du Ban, soixante-neuf mille deux cent quatre-vingt-dix Pollionnay
quarante-quatre impasse Port Perret, soixante-neuf, trois cent quatre-vingt-dix, Vernaison
onze impasse Grange Villeroy, soixante-neuf, deux cent dix à Savigny
Avenue Auguste Wissel, soixante-neuf mille deux cent cinquante Neuville-sur-Saône
Rue des Trois Artichauts, soixante-neuf, zéro zéro cinq Lyon
Chemin du Cèdre Vert, Écully
Rue Banette et Planchon à Vénissieux
sept cent soixante-sept rue du Château de l'Eclair
Chemin de la Pillotte au numéro cinq
vingt-sept rue du Laval, soixante-neuf mille six cent soixante-dix Vaugneray
dix chemin de la Clôtre, soixante-neuf, trois cent quatre-vingts, Lissieu
douze rue Jean de Tournes, soixante-neuf, zéro zéro deux à Lyon
Place de la Flette, soixante-neuf mille cinq cent dix Soucieu-en-Jarrest
Allée des Sauvages, soixante-neuf, trois cent soixante Ternay
Avenue du Château de Gerland, Lyon
Rue des Garinnes à Saint-Germain-Nuelles
un avenue Raymond de Veyssière
Rue Raymond Terracher au numéro un BIS
dix-huit rue Général Mouton-Duvernet, soixante-neuf mille trois Lyon
quarante-sept avenue Édouard Millaud, soixante-neuf, deux cent quatre-vingt-dix, Craponne
deux chemin de Frontigny, soixante-neuf, trois cent quatre-vingt-dix à Millery
Rue Artaud, soixante-neuf mille quatre Lyon
Rue Claude Curtat, soixante-neuf, trois cent trente Meyzieu
Route des Tatières, Cailloux-sur-Fontaines
Montée de la Ruelle à Fontaines-Saint-Martin
neuf avenue Alexandre Godard
Chemin de la Brossonnière au numéro quatorze
quatre cent quatre-vingt-dix-huit rue Jean Carron, soixante-neuf mille deux cent vingt Saint-Jean-d'Ardières
quinze rue de Ressy, soixante-neuf, deux cent dix, Savigny
un rue de la Vieille Guilletière, soixante-neuf, cinq cent quatre-vingt-dix à Saint-Symphorien-sur-Coise
Allée des Closes, soixante-neuf mille deux cents Vénissieux
Rue Turbil, soixante-neuf, zéro zéro trois Lyon
Chemin du Ménestrel, Dardilly
Allée Andros à Saint-Genis-Laval
sept F chemin de Cluzelle
Rue Sala au numéro huit
deux rue Jean Corona, soixante-neuf mille cent vingt Vaulx-en-Velin
trente et un rue du quatre Septembre mille sept cent quatre-vingt-dix-sept, soixante-neuf, cent, Villeurbanne
vingt et un rue des Mourrons, soixante-neuf, deux cent quatre-vingt-dix à Saint-Genis-les-Ollières
Rue Henri Valencin, soixante-neuf mille neuf cent soixante-dix Chaponnay
Rue de Chantabeau, soixante-neuf, trois cent soixante Solaize
Rue des Remparts d'Ainay, Lyon
Rue de la Bugnetière à Charly
huit rue Pierre-Marie Faye
Impasse des Galandières au numéro quatre
quarante-huit rue de Billy le Jeune, soixante-neuf mille six cent cinquante Quincieux
dix-sept rue Roux Rivoire, soixante-neuf, cinq cent vingt, Grigny
quarante-quatre rue Béla Bartók, soixante-neuf, deux cents à Vénissieux
Avenue Paul Marcellin, soixante-neuf mille cent vingt Vaulx-en-Velin
Boulevard des Droits de l'Homme, soixante-neuf, cent vingt Vaulx-en-Velin
Place de la Croix Jaune, Irigny
Allée du Dalot à Pommiers
vingt impasse de Chapoly
Rue Michel Aulas au numéro deux cent vingt-sept
un les Charbottes Ouest, soixante-neuf mille quatre cent cinquante Saint-Cyr-au-Mont-d'Or
six cent douze chemin de Seizeray, soixante-neuf, trois cent quatre-vingts, Lozanne
neuf impasse du Velin, soixante-neuf, huit cents à Saint-Priest
Rue de la Trolanderie, soixante-neuf mille deux cent cinquante Curis-au-Mont-d'Or
Montée des Lilas, soixante-neuf, sept cent trente Genay
Avenue Guy de Collongue, Écully
Avenue des Avoraux à Albigny-sur-Saône
cinquante-cinq chemin du Vallon du Ruisseau
Rue Gabriel Rongier au numéro neuf
vingt-six rue Claudius Savoye, soixante-neuf mille quatre cent soixante Odenas
quatre quai Romain Rolland, soixante-neuf, zéro zéro cinq, Lyon
trois cent cinquante-six route du Terrier, soixante-neuf, quatre cent soixante à Saint-Étienne-des-Oullières
Rue du Docteur Edmond Locard, soixante-neuf mille cinq Lyon
Chemin de l'Indiennerie, soixante-neuf, quatre cent cinquante Saint-Cyr-au-Mont-d'Or
Chemin du Plan du Loup, Sainte-Foy-lès-Lyon
Place Charles Beraudier à Lyon
trente-six rue Professeur Tavernier
Chemin Rivière de la Cour au numéro cinquante-huit
sept rue Lieutenant Michaud, soixante-neuf mille cent quarante Rillieux-la-Pape
un allée de Viego, soixante-neuf, trois cent quatre-vingts, Chazay-d'Azergues
dix avenue Burdeau, soixante-neuf, deux cent cinquante à Neuville-sur-Saône
Parc Montchoisy, soixante-neuf mille trois cents Caluire-et-Cuire
Chemin de l'Étang Thizy, soixante-neuf, deux cent quarante Thizy-les-Bourgs
Chemin des Grenettes, Quincieux
Rue Jérôme Dulaar à Lyon
deux rue de Montessuy
Rue Paul Cazeneuve au numéro quatorze
seize rue du Docteur Horand, soixante-neuf mille deux cent trente Saint-Genis-Laval
vingt-trois rue Jean-Baptiste Perret, soixante-neuf, six cent soixante, Collonges-au-Mont-d'Or
un rue de la Venne, soixante-neuf, cent soixante-dix à Tarare
Allée des Gondi, soixante-neuf mille trois cent dix Pierre-Bénite
Rue Jean Bajard, soixante-neuf, trois cent dix Pierre-Bénite
Route d'Épinay, Quincié-en-Beaujolais
Rue Émile Dunière à Villeurbanne
quinze rue Jean et Catherine Reynier
Chemin de Bonnebouche au numéro vingt-six
neuf rue Aimé Collomb, soixante-neuf mille trois Lyon
quatorze avenue Pierre Terrasse, soixante-neuf, trois cents, Caluire-et-Cuire
cinq impasse des Feuillantines, soixante-neuf, deux cent quatre-vingt-dix à Craponne
Rue Alfred Ancel, soixante-neuf mille cent vingt Vaulx-en-Velin
Lotissement Le Pré Piquet, soixante-neuf, quatre cent soixante Saint-Étienne-des-Oullières
Ruette Bazan, Charly
Rue des Combattants d'Afrique du Nord mille neuf cent cinquante-deux-mille neuf cent soixante-deux à Caluire-et-Cuire
quarante-deux domaine des Cèdres
Impasse Magnaudi au numéro huit
quatre-vingt-dix-neuf mille neuf cent quatre-vingt-dix-neuf chemin de la Garaine, soixante-neuf mille deux cents Vénissieux
six rue René et Marguerite Pellet, soixante-neuf, zéro zéro trois, Lyon
quatre-vingt-dix-huit chemin de la Servonnière, soixante-neuf, cinq cent soixante à Saint-Cyr-sur-le-Rhône
Passage de la Romaine, soixante-neuf mille cinq cent trente Orliénas
Rue Philippe de Lassalle, soixante-neuf, zéro zéro quatre Lyon
Rue Sergent Michel Berthet, Lyon
Rue de Tarare à Gleizé
cinq rue Joseph Serre
Rue Antoine Bernoux au numéro neuf
quatre rue Lucien Cozon, soixante-neuf mille six cent trente Chaponost
treize impasse du Pinay, soixante-neuf, cinq cent soixante-dix, Dardilly
vingt et un rue Tramassac, soixante-neuf, zéro zéro cinq à Lyon
Chemin du Torey, soixante-neuf mille trois cent quarante Francheville
Rue Edgar Varèse, soixante-neuf, deux cents Vénissieux
Rue Henri Perrier, Meyzieu
Place Pierre Vauboin à Tassin-la-Demi-Lune
vingt-six route de Mions
Rue des Macchabées au numéro seize
deux cent quatre-vingts chemin de la Croix Bourguignon, soixante-neuf mille trois cent quatre-vingt-dix Charly
deux cent soixante et un route de Celibety, soixante-neuf, six cent quarante, Cogny
cent neuf chemin de Planèze, soixante-neuf, cinq cent soixante à Saint-Cyr-sur-le-Rhône
Rue de la Croix Saint-Verand, soixante-neuf mille deux cent dix Fleurieux-sur-l'Arbresle
Chemin de Ferraguet, soixante-neuf, trois cent trente Pusignan
Avenue Léon Tolstoï, Décines-Charpieu
Allée Beauvallon à Saint-Genis-Laval
neuf rue Georges Gouy
Rue du Mont Verdun au numéro dix-huit
dix-sept rue des Hauts de Montbel, soixante-neuf mille trois cent quatre-vingt-dix Vourles
onze rue Marcel-Gabriel Rivière, soixante-neuf, zéro zéro deux, Lyon
onze C rue Professeur René Guillet, soixante-neuf, zéro zéro trois à Lyon
Rue Stéphane Coignet, soixante-neuf mille huit Lyon
Place Jean Jasserand, soixante-neuf, deux cent quatre-vingt-dix Grézieu-la-Varenne
Rue Hector Berlioz, Pontcharra-sur-Turdine
Square de Milly à Saint-Étienne-des-Oullières
quatre-vingt-quatre rue du Clos Morgon
Chemin du Grand Revoyet au numéro soixante-douze
onze allée de la Jument Noire, soixante-neuf mille sept cents Givors
vingt-quatre rue de Celette, soixante-neuf, cinq cent quarante, Irigny
sept rue des Reines-Marguerites, soixante-neuf, huit cents à Saint-Priest
Rue de la Grange Dodieu, soixante-neuf mille quatre cent quarante Mornant
Rue Eugène Déchavanne, soixante-neuf, deux cent quarante Thizy-les-Bourgs
Allée des Croisettes, Tassin-la-Demi-Lune
Route de Pontcharra à Saint-Romain-de-Popey
quatre cent quarante et un route de Charentay
Rue de l'Orgeole au numéro treize
mille quatre cent cinquante-huit chemin des Molaizes, soixante-neuf mille quatre cent quatre-vingts Anse
cinquante impasse de Vareille, soixante-neuf, deux cent dix, Fleurieux-sur-l'Arbresle
cinq route des Seguines, soixante-neuf, deux cent soixante-dix à Saint-Romain-au-Mont-d'Or
Rue Massu, soixante-neuf mille six cent cinquante Saint-Germain-au-Mont-d'Or
Rue Baronnat, soixante-neuf, cent soixante-dix Tarare
Boulevard Laurent Gérin, Vénissieux
Boulevard des Monts du Lyonnais à Saint-Symphorien-sur-Coise
vingt-six rue Piccandet
Chemin du Compagnon au numéro quarante-cinq
neuf rue Badan, soixante-neuf mille cinq cent vingt Grigny
un chemin du Cortelet, soixante-neuf, cinq cent quatre-vingts, Sathonay-Village
quatre lotissement La Rotonnière, soixante-neuf, cinq cent vingt à Grigny
Place Jules Grandclément, soixante-neuf mille cent Villeurbanne
Rue Louis Vernay, soixante-neuf, trois cent quatre-vingt-dix Vourles
Rue Suzanne Melk, Bron
Chemin de Marduis à Liergues
cinq chemin de Champs Grillet
Chemin du Bigout au numéro trois cent vingt-deux
quinze chemin des Plates, soixante-neuf mille cent vingt Vaulx-en-Velin
treize rue Jeanne-Marie Célu, soixante-neuf, zéro zéro quatre, Lyon
cent soixante-douze allée de Montfleuri, soixante-neuf, quatre cents à Gleizé
Rue Barthélémy Pierre Sornin, soixante-neuf mille cent quatre-vingt-dix Saint-Fons
Route de Brussieu, soixante-neuf, six cent quatre-vingt-dix Brussieu
Allée de la Bonnetière, Toussieu
Rue Charles Boeuf à Bron
quatre rue Jean Malton
Avenue Joannès Hubert au numéro dix-huit BIS
vingt BIS rue Denuzière, soixante-neuf mille deux Lyon
cinq cent trois chemin du Haut Privas, soixante-neuf, trois cent quatre-vingt-dix, Charly
cinquante rue de la Fondation Dorothée Petit, soixante-neuf, cinq cent quarante à Irigny
Rue de la Charrassine, soixante-neuf mille deux cent dix Saint-Germain-Nuelles
Rue Saint-Gérald, soixante-neuf, sept cents Givors
Montée des Gaudets, Villié-Morgon
Rue du Professeur Grignard à Lyon
cinq rue des Bluets
Rue du Puits de la Sarra au numéro onze
neuf cents avenue Burago di Molgora, soixante-neuf mille trois cent soixante Saint-Symphorien-d'Ozon
trois cent soixante-seize chemin de Valroing, soixante-neuf, trois cent quatre-vingts, Chasselay
trente-quatre chemin Jean-Baptiste Poquelin, soixante-neuf, trois cent trente à Jonage
Rue Hô Chi Minh, soixante-neuf mille deux cents Vénissieux
Cours Docteur Long, soixante-neuf, zéro zéro trois Lyon
Passage des Marguilliers, Genas
Rue des Frères Emmanuel-Joseph et Louis Amadéo à Vénissieux
six rue Bourg-Chanain
Chemin de Moly au numéro soixante-dix-neuf
cinq impasse Jérémie Fontrobert, soixante-neuf mille sept cent quatre-vingts Mions
quatre-vingt-treize hameau des Chanturières, soixante-neuf, trois cent soixante, Communay
soixante-six chemin du Morillon, soixante-neuf, deux cent dix à Fleurieux-sur-l'Arbresle
Chemin de Four, soixante-neuf mille deux cent soixante-dix Cailloux-sur-Fontaines
Allée des Verchères, soixante-neuf, trois cents Caluire-et-Cuire
Chemin de la Colletière, Châtillon
Allée d'Uzès à Saint-Fons
huit place Jf Dechet
Boulevard Marcel-Yves André au numéro trois cent dix
trois rue Marius Gonin, soixante-neuf mille cinq Lyon
cinq allée Marius Donjon, soixante-neuf, zéro zéro neuf, Lyon
soixante et un rue des Arpinières, soixante-neuf, trois cent quarante à Francheville
Rue Docteur Prost, soixante-neuf mille trois cent vingt Feyzin
Rue Charles Sève, soixante-neuf, quatre cents Villefranche-sur-Saône
Rue Delandine, Lyon
Impasse du Jarlot à Belleville
un allée de Beaulieu-Montribloud
Rue du Frère Benoît au numéro vingt-quatre
vingt rue Imbert Colomès, soixante-neuf mille un Lyon
neuf quai de la Gare d'Eau, soixante-neuf, sept cents, Givors
trente-deux avenue Jean Cagne, soixante-neuf, deux cents à Vénissieux
Petite Rue d'Alma, soixante-neuf mille quatre cents Villefranche-sur-Saône
Rue Georges Lyvet, soixante-neuf, deux cents Vénissieux
Rue de Montcorin, Irigny
Place Ampère à Neuville-sur-Saône
cinq cent quarante-deux rue Alexandre Richetta
Rue Marie Alibert au numéro cinquante et un
trente-cinq chemin des Célestins, soixante-neuf mille six cents Oullins
huit rue Montgelas, soixante-neuf, six cent soixante, Collonges-au-Mont-d'Or
treize avenue Silvin, soixante-neuf, cent cinquante à Décines-Charpieu
Chemin du Rémilly, soixante-neuf mille cinq cent soixante Saint-Cyr-sur-le-Rhône
Impasse des Méharis, soixante-neuf, deux cent vingt Saint-Jean-d'Ardières
Rue des Villards, Saint-Jean-d'Ardières
Route de Buffetières à Saint-Romain-de-Popey
soixante-sept D chemin des Flachères
quatorze e Rue au numéro vingt et un
cent quatre-vingts route des Pierres Dorées, soixante-neuf mille six cent quarante Cogny
trois allée des Basses Barolles, soixante-neuf, deux cent trente, Saint-Genis-Laval
trente-huit route de Rive-de-Gier, soixante-neuf, sept cents à Givors
Route d'Huire, soixante-neuf mille quatre cent trente Quincié-en-Beaujolais
Rue Fernand Rey, soixante-neuf, zéro zéro un Lyon
Allée de la Pie Verte, Francheville
Rue Eugène Maréchal à Vénissieux
six impasse des Gerfauts
Place Eugène Wernert au numéro deux
quatre-vingt-treize rue de Merlo, soixante-neuf mille six cents Oullins
cent soixante-treize route du Trève Oray, soixante-neuf, deux cent soixante-dix, Cailloux-sur-Fontaines
vingt-quatre allée du Parc de Montchoisy, soixante-neuf, trois cents à Caluire-et-Cuire
Montée Saint-Sébastien, soixante-neuf mille un Lyon
Rue Victor Thoviste, soixante-neuf, deux cent quarante Thizy-les-Bourgs
Rue Benoit Bennier, Charbonnières-les-Bains
Rue Barrier à Lyon
douze petite Rue de Monplaisir
Quai du Raffour au numéro quatorze
quatre-vingts chemin de Chalamont, soixante-neuf mille cent quarante Rillieux-la-Pape
vingt-sept chemin de Maintenue, soixante-neuf, six cent cinquante, Saint-Germain-au-Mont-d'Or
vingt-cinq avenue Joannès Gazagne, soixante-neuf, cinq cent quarante à Irigny
Impasse de Vilnius, soixante-neuf mille trois cent vingt Feyzin
Rue Auguste Tramier, soixante-neuf, cent trente Écully
Centre d'Echanges Perrache, Lyon
Rue Michel Félizat à Lyon
quatre-vingt-deux chemin de Tredo
Allée de la Pêche Guilloux au numéro deux
quatre-vingt-neuf chemin de Pizière, soixante-neuf mille sept cent trente Genay
huit chemin de Montbel, soixante-neuf, trois cent quatre-vingt-dix, Vourles
quatre-vingt-douze route d'Albigny, soixante-neuf, deux cent cinquante à Curis-au-Mont-d'Or
Impasse de la Pêcherie, soixante-neuf mille six cent quatre-vingt-dix Brussieu
Boulevard Pierre Pasquier, soixante-neuf, quatre cents Villefranche-sur-Saône
Chemin des Bruyères Vaines, Morancé
Avenue Laurent Bonnevay à La Mulatière
trois cent soixante chemin du Payet
Impasse du Chessy au numéro quatre-vingt-dix
trente-trois avenue Rosa Parks, soixante-neuf mille neuf Lyon
huit chemin du Cantonniau, soixante-neuf, cinq cent trente, Brignais
huit chemin de l'Arquillère, soixante-neuf, cent soixante-dix à Tarare
Rue Stéphane Déchant, soixante-neuf mille trois cent cinquante La Mulatière
Rue René Fusier, soixante-neuf, trois cent trente Meyzieu
Allée de Fonvielle, La Tour-de-Salvagny
Rue des Frères Lanfranchi à Vénissieux
cinq chemin Pierre-Alexandre Guillet
Place Berthe Morisot au numéro trois
sept ruette de la Bussiere, soixante-neuf mille quatre cent cinquante Saint-Cyr-au-Mont-d'Or
sept allée Antonin Louvier, soixante-neuf, trois cent soixante, Saint-Symphorien-d'Ozon
cent quarante route du Bâtard, soixante-neuf, quatre cent quarante à Taluyers
Rue des Frères Bertrand, soixante-neuf mille cent vingt Vaulx-en-Velin
Route de la Chanade, soixante-neuf, deux cent dix Savigny
Chemin de l'Yzeron, Sainte-Foy-lès-Lyon
Avenue Galline à Villeurbanne
quatorze route des Écharmeaux
Rue du Bois de la Caille au numéro dix B
quatre-vingt-neuf avenue Charles André, soixante-neuf mille deux cent trente Saint-Genis-Laval
quarante mail Pieton Brianne, soixante-neuf, quatre cent quatre-vingts, Anse
cent dix-neuf rue de la Quarantaine, soixante-neuf, quatre cents à Villefranche-sur-Saône
Cours de Verdun Gensoul, soixante-neuf mille deux Lyon
Place Louise, soixante-neuf, zéro zéro trois Lyon
Allée des Carolingiens, Saint-Genis-Laval
Montée Victor Hugo à Caluire-et-Cuire
vingt-neuf chemin de la Halte du Méridien
Rue Jean Sellier au numéro trente-neuf
quarante-sept rue Thomas Blanchet, soixante-neuf mille huit Lyon
deux cent quinze rue du Marme, soixante-neuf, sept cents, Loire-sur-Rhône
cinq cent quatre-vingt-cinq chemin des Maisons Blanches, soixante-neuf, quatre cent vingt à Tupin-et-Semons
Rue du Grésigny, soixante-neuf mille deux cent dix Saint-Pierre-la-Palud
Allée du Pré du Cogny, soixante-neuf, cinq cent soixante-dix Dardilly
Allée de la Croix des Hormes, Montanay
Place Claude Farrère à Saint-Priest
trente-cinq rue Honoré Petetin
Rue Joannès Vallet au numéro vingt et un
huit impasse Édison, soixante-neuf mille huit cents Saint-Priest
seize rue Louis Bocquet, soixante-neuf, cent, Villeurbanne
mille cinq cent soixante-dix route d'Ordilly, soixante-neuf, quatre cent quatre-vingt-dix à Saint-Romain-de-Popey
Front de Saône, soixante-neuf mille huit cent trente Saint-Georges-de-Reneins
Rue Ferdinand Gauthier, soixante-neuf, sept cent vingt Saint-Laurent-de-Mure
Rue Victor Lagrange, Lyon
Chemin du Ravagnon à Grézieu-la-Varenne
un chemin des Boucherattes
Route de Nuelles au numéro six cent quatre-vingt-six
vingt-six rue de Flesselles, soixante-neuf mille un Lyon
neuf place Rodin, soixante-neuf, sept cent quatre-vingts, Mions
quatre montée du Vieux Château, soixante-neuf, deux cent cinquante à Neuville-sur-Saône
Rue Omer Louis, soixante-neuf mille trois Lyon
Rue Masaryk, soixante-neuf, zéro zéro neuf Lyon
Chemin du Grand Coquerieux, Anse
Chemin de la Molinette à Saint-Genis-Laval
huit place Dugas
Montée des Carrières au numéro huit cent vingt et un
trente montée du Cantin, soixante-neuf mille deux cent soixante-dix Fontaines-Saint-Martin
cent trente-huit impasse Pierre Louvet, soixante-neuf, quatre cents, Villefranche-sur-Saône
deux les Allées Champigny, soixante-neuf, deux cent quatre-vingt-dix à Craponne
Square Édouard Mouriquand, soixante-neuf mille neuf Lyon
Rue des Tables Claudiennes, soixante-neuf, zéro zéro un Lyon
Rue Guilloux, Saint-Genis-Laval
Rue Georges Marrane à Vénissieux
sept cent deux route de la Combe Reynard
Lotissement Les Gruizards au numéro un
deux cité Gustave Courbet, soixante-neuf mille sept cents Givors
seize montée de la Chazière, soixante-neuf, cinq cent dix, Yzeron
six rue des Grands Violets, soixante-neuf, six cent soixante à Collonges-au-Mont-d'Or
Chemin de Lagay, soixante-neuf mille deux cent dix Saint-Pierre-la-Palud
Chemin des Prés Secs, soixante-neuf, trois cent quatre-vingts Civrieux-d'Azergues
Rue du Puits du Monde, Irigny
Rue Commandant Faurax à Lyon
vingt-neuf rue Jean Cagne
treize e Rue au numéro cinq
trois rue Le Pré du Luminaire, soixante-neuf mille sept cents Échalas
trois allée Folk de Cardon, soixante-neuf, cinq cent quatre-vingts, Sathonay-Village
trois cent quarante-quatre route de Noailleux, soixante-neuf, deux cent soixante-dix à Cailloux-sur-Fontaines
Lotissement du Domaine de Sourzy, soixante-neuf mille sept cents Montagny
Rue Jules Froment, soixante-neuf, zéro zéro huit Lyon
Rue de Luyzine, Saint-Bonnet-de-Mure
Impasse de la Place de l'Église à Irigny
quarante-deux rue de Charriolle
Rue Georges Villeneuve au numéro sept
onze rue Gilibert, soixante-neuf mille deux Lyon
treize A rue Auguste Delage, soixante-neuf, six cent quatre-vingts, Chassieu
cent cinquante-sept rue des Éparviers, soixante-neuf, trois cent soixante à Solaize
Rue de Mercruire, soixante-neuf mille huit cent quatre-vingt-dix La Tour-de-Salvagny
Impasse du Matineau, soixante-neuf, sept cent vingt Saint-Bonnet-de-Mure
Rue de la Boube, Villeurbanne
Allée Simon Saint-Jean à Écully
quarante-six chemin du Monteillier
Allée des Sillons au numéro cinq
cinquante-deux montée du Gourguillon, soixante-neuf mille cinq Lyon
quatre cent soixante-neuf C chemin des Ferratières, soixante-neuf, trois cent quatre-vingt-dix, Charly
vingt-six rue Saint-Irénée, soixante-neuf, six cent quatre-vingt-dix à Bessenay
Impasse Pommier, soixante-neuf mille trois Lyon
Impasse Chambonne, soixante-neuf, six cent vingt Frontenas
Lotissement La Muzardière, Saint-Germain-Nuelles
Boulevard Louis Pradel à Jonage
soixante avenue du Professeur Paul Santy
Place Gailleton au numéro quatre
deux cent quatre-vingt-cinq chemin du Taravel, soixante-neuf mille cinq cent trente Orliénas
quatorze chemin du Rubillon, soixante-neuf, trois cent soixante-dix, Saint-Didier-au-Mont-d'Or
vingt-deux rue Charles Montaland, soixante-neuf, cent à Villeurbanne
Place du Paleyron, soixante-neuf mille sept cent vingt Saint-Bonnet-de-Mure
Avenue des Anciens Combattants d'Afrique du Nord, soixante-neuf, cent cinquante Décines-Charpieu
Montée de la Butte, Lyon
Allée de Place Paty à La Tour-de-Salvagny
soixante et un chemin de Guillermy
Chemin des Ardillaux au numéro deux
quinze BIS rue Lortet, soixante-neuf mille sept Lyon
cent treize chemin de Viralamande, soixante-neuf, cent quarante, Rillieux-la-Pape
deux rue Monnier, soixante-neuf, cent cinquante à Décines-Charpieu
Montée du Grillet, soixante-neuf mille quatre cents Liergues
Troisième Avenue, soixante-neuf, huit cents Saint-Priest
Rue Chinard, Lyon
Rue Charles Machet à Limonest
cinq rue Maurice Dubost
Rue Armanet au numéro quatre
dix-huit rue Jean-François Veyret, soixante-neuf mille sept cent vingt Saint-Bonnet-de-Mure
six chemin du Sycomore, soixante-neuf, trois cents, Caluire-et-Cuire
quatre rue Edouard Prenat, soixante-neuf, sept cents à Givors
Rue des Charpennes, soixante-neuf mille trois cent trente Pusignan
Allée des Hermières, soixante-neuf, cent vingt-six Brindas
Rue de la Ferriere, Montanay
Rue Geoffray à Villeurbanne
cinq cent dix-sept route de Grézieu
Allée du Clos Manet au numéro trois
quatre-vingt-neuf chemin des Grands Taillis, soixante-neuf mille quatre cent quatre-vingts Lachassagne
trente-trois rue Sergent Blandan, soixante-neuf, zéro zéro un, Lyon
deux place Renée Dufourt, soixante-neuf, zéro zéro deux à Lyon
Rue Victor et Roger Thomas, soixante-neuf mille huit Lyon
Chemin du Miollan, soixante-neuf, quatre cent quatre-vingt-dix Saint-Loup
Allée de Borée, Saint-Genis-Laval
Chemin du Charroi à Caluire-et-Cuire
quarante et un route Albert Damez
Rue Claude Faye au numéro dix
quatorze chemin de Feyzin, soixante-neuf mille deux cents Vénissieux
vingt-deux rue de la Grande Rotonnière, soixante-neuf, cinq cent vingt, Grigny
dix rue Montel, soixante-neuf, quatre cent quarante à Mornant
Route de Frontigny, soixante-neuf mille trois cent quatre-vingt-dix Charly
Rue de Pérouges, soixante-neuf, deux cent soixante-dix Rochetaillée-sur-Saône
Rue François Perraud, Chaponost
Rue Docteur Jean Barbier à Sainte-Foy-lès-Lyon
quatorze rue Andréï Sakharov
Rue de Croix Cotton au numéro trente-deux
quinze rue Philibert Gaillard, soixante-neuf mille deux cent soixante-dix Couzon-au-Mont-d'Or
quarante-neuf rue Professeur Grignard, soixante-neuf, zéro zéro sept, Lyon
cent soixante-dix-huit rue de la Grange Blazet, soixante-neuf, quatre cents à Villefranche-sur-Saône
Rue de la Chimbaude, soixante-neuf mille cinq cent soixante Saint-Romain-en-Gal
Chemin de Montvenoux, soixante-neuf, cent soixante-dix Tarare
Rue Paul Duvivier, Lyon
Allée de l'Escadrille Normandie Niémen à Vaulx-en-Velin
quarante-trois rue de la Feyssine
