un sentier de Saint-Louis, zéro sept, cent soixante Le Cheylard
quatre-vingts impasse Bertholand, zéro sept, trois cent soixante-dix, Ozon
quatre-vingts route de Malatray, zéro sept, trois cent soixante aux Ollières-sur-Eyrieux
Rue du Roury, zéro sept, quatre cents Le Teil
Rue de Mascoinet, zéro sept, deux cent dix Baix
Montée de la Mairie, Vinzieux
Calle Calade de la Rouisserie à Saint-Alban-Auriolles
quarante chemin de Chante Graille
Chemin des Gaudins au numéro trois cent trente
cinq BIS rue Gaston Perrassi, zéro sept, quatre cents Le Teil
quatre rue Paul Langevin Pôle deux mille, zéro sept, cent trente, Saint-Péray
quatre-vingts passage du Plos, zéro sept, trois cent soixante aux Ollières-sur-Eyrieux
Chemin du Dépôt, zéro sept, quatre cents Le Teil
Rue des Fileurs, zéro sept, zéro zéro zéro Privas
Chemin de Bethanie, Vinezac
Impasse Chautard à Rochemaure
quatre cent quatre-vingts chemin de Beaudier
Rue de la Solitude au numéro sept
vingt-six passage de la Soie, zéro sept, quatre cent trente Vernosc-lès-Annonay
quinze traverse de la Madeleine, zéro sept, deux cents, Aubenas
deux cent quarante-cinq chemin de Chazal, zéro sept, cent trente à Saint-Romain-de-Lerps
Impasse des Basses Rues, zéro sept, cent trente Saint-Péray
Chemin des Champeaux, zéro sept, trois cent trente Thueyts
Rue Le Violet, Saint-Cyr
Chemin de Saint-Cerisse à Vogüé
soixante chemin de la Balme
Rue des Ruines au numéro deux
huit cent cinquante route de Mercier, zéro sept, trois cent trente Thueyts
cinquante-deux chemin du Grand Mûrier, zéro sept, cent, Annonay
deux cent quinze route du Grand Lieu, zéro sept, cent soixante à Jaunac
Impasse des Orchis, zéro sept, trois cent quarante Bogy
Impasse des Planètes, zéro sept, quatre cent trente Davézieux
Chemin des Sôts, Chauzon
Rue Épiphanie à Annonay
cent quatre-vingts impasse Léli
Chemin du Cros de Reaux au numéro cent cinq
trois cent trente chemin du Haut Darbousset, zéro sept, sept cents Bourg-Saint-Andéol
six impasse du Bergeot, zéro sept, deux cents, Vogüé
quatre-vingt-cinq chemin de Champredon, zéro sept, cent soixante-dix à Lavilledieu
Impasse des Artistes, zéro sept, deux cent quatre-vingt-dix Quintenas
Chemin de Guérimbet, zéro sept, cent trente Soyons
Place de l'Aire, Saint-Barthélemy-le-Plain
Route de la Cabane à Talencieux
trois cent vingt-cinq chemin de Bourgeon
Qrt La Rouvière au numéro six mille cent quatre-vingt-seize
vingt-cinq rue de Calade, zéro sept, quatre cent quarante Champis
six rue des Pillats, zéro sept, deux cent quatre-vingt-dix, Quintenas
cent treize rue de la Pitié, zéro sept, six cent dix à Vion
Traverse Eugène Contassot, zéro sept, deux cents Aubenas
Chemin Lachaud, zéro sept, cent Boulieu-lès-Annonay
Montée de la Gardette, Lussas
Rue du Bois Madame à Saint-Félicien
quatre cent dix chemin de Rioubargès
Chemin de Leygua au numéro cent quatre-vingts C
cinquante chemin des Rouchis, zéro sept, deux cent quatre-vingt-dix Saint-Romain-d'Ay
neuf rue de Cance, zéro sept, cent, Annonay
deux cent cinquante chemin de Bruchon, zéro sept, six cent dix à Lemps
Chemin de l'Autagnette, zéro sept, cent soixante-dix Lavilledieu
Chemin de l'Itep, zéro sept, trois cent soixante-dix Eclassan
Montée des Margirands, Saint-Désirat
Lotissement Les Muriers à Roiffieux
cinq allée Elsa Triolet
Chemin du Haut Ternis au numéro cent vingt-six
cent soixante-quinze impasse du Fabricou, zéro sept, zéro zéro zéro Coux
un impasse du Coquetier, zéro sept, quatre cent quarante, Boffres
cinq passage André Gerland, zéro sept, deux cent quarante à Vernoux-en-Vivarais
Place de la Commune, zéro sept, cent Roiffieux
Passage du Gardon, zéro sept, huit cents La Voulte-sur-Rhône
Impasse des Bonnetiers, Saint-Péray
Chemin du Cépage à Talencieux
un rue Docteur Pradelle
Chemin de Brun au numéro cent vingt
quarante place du Bouix, zéro sept, trois cent trente Barnas
treize belvédère du Pecheylard, zéro sept, deux cent soixante-dix, Lamastre
quatre clos de Sainte-Épine, zéro sept, trois cents à Saint-Jean-de-Muzols
Rue des Clinchins, zéro sept, deux cents Aubenas
Chemin du Baril, zéro sept, deux cents Lachapelle-sous-Aubenas
Rue des Vieux Murs, Satillieu
Place Galfard à Laurac-en-Vivarais
deux passage Notre-Dame
Impasse des Osches au numéro vingt et un
cent route du Cayres, zéro sept, trois cent trente Barnas
quarante-quatre rue Van Gogh, zéro sept, quatre cent trente, Davézieux
trois cent trente-huit rue des Biens, zéro sept, quatre cent trente à Vernosc-lès-Annonay
Impasse du Petit Médier, zéro sept, quatre cent dix Saint-Félicien
Route du Vieux Pont, zéro sept, cent dix Vinezac
Allée du Palladio, Guilherand-Granges
Chemin de Côte Plaine à Saint-Barthélemy-le-Plain
deux cent cinq chemin des Valens
Chemin de Chaveroche au numéro trois cent trente
quatre cent quarante route de Lablachère, zéro sept, deux cent soixante Joyeuse
quarante-trois impasse Chomette, zéro sept, six cent dix, Vion
deux rue Albert Chambouleyron, zéro sept, zéro zéro zéro à Privas
Impasse des Côteaux, zéro sept, cent dix Vinezac
Chemin de Devesson, zéro sept, cent soixante-dix Lussas
Impasse d'Aubert, Saint-Jean-de-Muzols
Route Royale à Châteauneuf-de-Vernoux
deux cent trois voie de Saint-Jean
Route de Corneduc au numéro sept cent cinq
cent quinze chemin du Plateau, zéro sept, zéro zéro zéro Coux
quatre-vingt-cinq A cHE DU HAUT MARIJON, zéro sept, cent soixante, Mariac
quatre rue des Confins, zéro sept, trois cents à Mauves
Chemin de la Fontaine de Mïa, zéro sept, cent soixante-dix Lussas
Impasse de Peychores, zéro sept, quatre cent dix Saint-Félicien
Impasse Gagée de Bohème, Bogy
Chemin de Toulaud à Guilherand-Granges
quatre cent quatre-vingt-seize les Hauts de Veyras
Chemin des Collanges au numéro trois cent cinquante-cinq
quatre rue Sauzéat, zéro sept, cent Annonay
cent huit chemin des Ilons Nord, zéro sept, trois cent cinquante, Cruas
dix impasse du Courbier, zéro sept, cent vingt à Saint-Alban-Auriolles
Chemin des Souchères, zéro sept, deux cents Lanas
Route des Sceautaux, zéro sept, trois cent soixante Les Ollières-sur-Eyrieux
Allée des Auches, Saint-Romain-d'Ay
Chemin du Cfd à Saint-Sauveur-de-Montagut
dix place Basse Place
Place de la Ligne au numéro quatorze
six rue de l'Abri de la Fontaine, zéro sept, cent soixante-dix Saint-Andéol-de-Berg
cent vingt-sept rue de Gourdan, zéro sept, trois cent quarante, Saint-Désirat
soixante impasse de Cance, zéro sept, trois cent quarante à Andance
Chemin de l'Antenne, zéro sept, trois cent quarante Brossainc
Route de la Fabrique, zéro sept, trois cent quatre-vingts Pont-de-Labeaume
Chemin du Fada, Joyeuse
Rue de Montlaur à Montpezat-sous-Bauzon
deux cent vingt-cinq chemin de la Cantone
Traverse de Chaudabri au numéro trois
cent soixante chemin de Nervy, zéro sept, cent trente Saint-Romain-de-Lerps
cent impasse des Blancs, zéro sept, trois cent soixante-dix, Eclassan
cent dix cHE DES JALLATS, zéro sept, cent soixante à Mariac
Qrt Le Patre, zéro sept, quatre cents Le Teil
Chemin du Champ des Mas, zéro sept, deux cent quatre-vingt-dix Quintenas
Rue de la Pailhouse, Aubenas
Rue Mas du Bateau à Ruoms
cinq cent dix route Sous Les Chatenelles
Colombier au numéro dix
vingt rue du Bertois, zéro sept, trois cent quarante Félines
cent quatre-vingt-cinq route du Suc de Verre, zéro sept, deux cent quatre-vingt-dix, Ardoix
dix route Vieille de Lagorce, zéro sept, cent vingt à Pradons
Rue de la Mazade, zéro sept, cinq cent soixante Montpezat-sous-Bauzon
Allée d'Areire, zéro sept, deux cent quatre-vingt-dix Saint-Romain-d'Ay
Chemin de Sauzet, Rochemaure
Rue Cendrillon à Tournon-sur-Rhône
soixante rue de la Légion Romaine
Place de la Concorde au numéro deux
quarante-deux chemin des Bourras, zéro sept, trois cent quarante Félines
cinquante-cinq chemin de la Pendouline, zéro sept, deux cents, Lachapelle-sous-Aubenas
soixante-dix chemin des Fonds de la Besse, zéro sept, trois cent quarante à Peaugres
Route d'Aric Industrie, zéro sept, cent soixante Le Cheylard
Impasse Echaudun, zéro sept, quatre cents Rochemaure
Impasse des Girolles, Peaugres
Impasse du Riolet à Soyons
cent vingt-cinq allée des Plantas
Rue de la Fauque au numéro cinq
dix chemin de Nardy, zéro sept, trois cent soixante-dix Eclassan
quatre rue Ferdinand Pin, zéro sept, cent, Annonay
cent trente-cinq impasse du Serre, zéro sept, trois cent trente à Barnas
Chemin de Peychiot, zéro sept, trois cents Étables
Chemin de la Pereyre, zéro sept, quatre cent dix Saint-Félicien
Chemin de Malorier, Quintenas
Rue Porte Embroye à Charmes-sur-Rhône
cent soixante rue du Pré de Vidalon
Passage des Ruines au numéro deux
cent cinq chemin de la Trénière, zéro sept, trois cent quarante Andance
six mille cent quarante-quatre qrt Le Pelican, zéro sept, quatre cents, Le Teil
six mille cent quatre-vingt-quatre quartier Levêque, zéro sept, quatre cents au Teil
Avenue du Pont du Rhône, zéro sept, quatre cents Le Teil
Route du Gruel, zéro sept, deux cents Ucel
Rue Méyère, Saint-Julien-en-Saint-Alban
Rue de Granouly au Pouzin
dix place Robespierre
Chemin du Souillet au numéro trente
trente-cinq chemin du Grand Marzillac, zéro sept, trois cents Étables
un rue du Chanoine Hilaire, zéro sept, deux cent quatre-vingt-dix, Satillieu
trente impasse des Rivières, zéro sept, zéro zéro zéro à Coux
Chemin de Basse Croix, zéro sept, cent soixante Mariac
Rue des Brandons, zéro sept, cinq cents Guilherand-Granges
Chemin du Champfagot, Barnas
Rue du Communal à Davézieux
soixante rUE DU PONT
Chemin de Petit Chere au numéro quatre cent quarante-cinq
trois place de Clavière, zéro sept, quatre cent dix Saint-Félicien
dix chemin de Saint-Jean-Roure, zéro sept, cent soixante, Saint-Cierge-sous-le-Cheylard
quarante-cinq chemin des Issartoux, zéro sept, deux cents à Saint-Étienne-de-Fontbellon
Passage des Gardes Malades, zéro sept, deux cent quatre-vingt-dix Satillieu
Chemin de Margillières, zéro sept, cent trente Saint-Romain-de-Lerps
Impasse de l'Androme, Le Cheylard
Chemin d'Ardoquois à Bogy
quatre cent neuf route de Blanchard
Chemin du Mas Rose au numéro mille cent soixante-dix
six mille huit cent treize le Bouvier, zéro sept, deux cent quatre-vingt-dix Satillieu
six mille neuf rue Chevrière, zéro sept, quatre cents, Meysse
onze route des Bugnats, zéro sept, trois cent quarante à Charnas
Chemin d'Aric, zéro sept, cent soixante Le Cheylard
Impasse de la Grand Font, zéro sept, trois cent trente Thueyts
Place Marie Banc Soeur, Saint-Félicien
Avenue Léonce Verny à Aubenas
quatre-vingt-quinze impasse de la Cario
Route de Picot au numéro quatre-vingt-douze
trois chemin des Cités, zéro sept, deux cent quatre-vingt-dix Quintenas
cent vingt-quatre rue Barbiere, zéro sept, cinq cent soixante-dix, Désaignes
cinq impasse de Paradis, zéro sept, trois cent trente à Thueyts
Impasse du Beal, zéro sept, six cents Vals-les-Bains
Chemin de la Croisette, zéro sept, deux cents Lachapelle-sous-Aubenas
Chemin de Chavaray, Saint-Péray
Route des Thuilières Sud à Charnas
trente-cinq rUE DU COLOMBIER
Chemin de Champfagoux au numéro deux mille quatre-vingt-quinze
cent trente-huit avenue Danielle Casanova, zéro sept, trois cent cinquante Cruas
quatre-vingt-quinze impasse de Beaufoura, zéro sept, quatre cent dix, Saint-Félicien
deux impasse des Estugnes, zéro sept, deux cents à Vogüé
Place des Papetiers, zéro sept, cent Saint-Marcel-lès-Annonay
Impasse Champart, zéro sept, zéro zéro zéro Saint-Julien-en-Saint-Alban
Chemin du Bordelet, Saint-Just-d'Ardèche
Chemin de la Veyrune à Joyeuse
cinquante chemin de Lembras
Chemin du Mas de la Fremigère au numéro quinze
un place du Parc, zéro sept, trois cent quarante Talencieux
cent quatre-vingt-quinze chemin de Champas, zéro sept, quatre cent dix, Colombier-le-Vieux
cent quatre-vingt-cinq route des Coins, zéro sept, trois cent quarante à Charnas
Place du Centre, zéro sept, trois cent quarante Charnas
CHE DU MANSON, zéro sept, cent soixante Mariac
Chemin du Bourdaric, Lavilledieu
Chemin de Manicieux à Roiffieux
cent quatre-vingt-dix cHE DES POIGNETS
Chemin du Clos d'en Bas au numéro huit
deux ruelle des Crozes, zéro sept, quatre cent dix Saint-Félicien
quatre cent soixante chemin de Cheylus, zéro sept, cent trente, Toulaud
huit impasse des Récollets, zéro sept, cent à Annonay
Chemin des Routisses, zéro sept, trois cents Cheminas
Impasse des Grads, zéro sept, cent soixante-dix Lavilledieu
Chemin des Cots, Étables
Chemin de Font Besset à Quintenas
trois les Melezes
Montée de la Mure au numéro quarante et un
un rue Marius Vincent, zéro sept, sept cents Bourg-Saint-Andéol
quatorze A rue du Docteur Reybard, zéro sept, cent, Annonay
onze rue Centrale Nord, zéro sept, trois cent soixante-dix à Sarras
Route de Claret, zéro sept, trois cent trente Thueyts
Impasse de la Réforme, zéro sept, cent Annonay
Rue Montlaur, Aubenas
Impasse de Denis à Ozon
vingt-cinq rue des Fileuses
Chemin des Terres Dorées au numéro quatre-vingt-six
trois rue du Ruisseau de Malconseil, zéro sept, cent quatre-vingt-dix Saint-Sauveur-de-Montagut
mille quatre cent quatre-vingt-douze chemin de Chateau Reynard, zéro sept, quatre cents, Rochemaure
cinquante impasse des Chenilles, zéro sept, cent trente à Toulaud
Allée Jaulan, zéro sept, cent trente Soyons
Rue des Guilhots, zéro sept, trois cent quarante Félines
Route des Vernets, Le Cheylard
Chemin de Montselgues à Pradons
quatre-vingt-dix place Edmond Largier
Rue du Pousterlou au numéro neuf
trois cent vingt-six route de Macheloup, zéro sept, quatre cent trente Saint-Clair
cent vingt-cinq chemin des Vidales, zéro sept, deux cent quatre-vingt-dix, Quintenas
six mille huit cent trente-cinq les Cleaux, zéro sept, sept cent quatre-vingt-dix à Saint-Alban-d'Ay
Rue des Pastouriaux, zéro sept, zéro zéro zéro Privas
Route des Barratières, zéro sept, trois cent quarante Charnas
Place Louis Pize, Bourg-Saint-Andéol
Route de la Plage aux Ollières-sur-Eyrieux
quinze rue Merdançon
Chemin des Moureaux au numéro trente-cinq
dix impasse des Papillons, zéro sept, cent trente Toulaud
soixante-trois rue du Maillet, zéro sept, trois cent quarante, Limony
deux cent quatre-vingt-dix impasse de Chirouze, zéro sept, quatre cent dix à Saint-Félicien
Impasse Bouras, zéro sept, zéro zéro zéro Coux
Chemin Via-Rhona, zéro sept, deux cent quatre-vingt-dix Quintenas
Place Prosper Allignol, Viviers
Chemin des Abricotiers à Andance
dix-huit place du Fougot
Impasse du Gué au numéro trente-cinq
soixante-quinze impasse de Chavat, zéro sept, trois cent soixante Les Ollières-sur-Eyrieux
dix-neuf la Banne, zéro sept, huit cents, La Voulte-sur-Rhône
vingt-cinq rUE QUARTIER D'ADEGIROND, zéro sept, cent soixante à Mariac
Route du Sauzet, zéro sept, cent soixante Le Cheylard
Chemin des Chapeliers, zéro sept, trois cents Saint-Barthélemy-le-Plain
Chemin de Chamont, Eclassan
Voie Communale de Lavandière à Meysse
quatre chemin du Fraysse
Impasse de Picatou au numéro six
trois impasse des Clapas, zéro sept, cent soixante-dix Lavilledieu
vingt impasse des Vieux Murs, zéro sept, trois cent quarante, Charnas
trente-cinq chemin des Railles, zéro sept, trois cents à Étables
Chemin du Meil, zéro sept, six cent dix Sécheras
Chemin d'Écouvelle, zéro sept, cent Saint-Marcel-lès-Annonay
Place de la Fève, La Voulte-sur-Rhône
Chemin de la Ceriseraie à Saint-Félicien
huit cent vingt allée de Chaudeval
Route de Notre-Dame d'Ay au numéro quatre cents
quatre rue du Frayol, zéro sept, quatre cents Le Teil
soixante-cinq allée des Lèches, zéro sept, cent trente, Soyons
quatre-vingt-dix impasse Fontanille, zéro sept, sept cents à Saint-Just-d'Ardèche
Rue de la Michoulasse, zéro sept, deux cents Vogüé
Chemin de Gignac, zéro sept, six cents Vals-les-Bains
Impasse des Fonts, Talencieux
Chemin de Pechiot à Cheminas
quatre chemin de Valgelas
Rue du Campo Santo au numéro un
dix impasse Clauzel, zéro sept, zéro zéro zéro Saint-Julien-en-Saint-Alban
quarante allée de l'Etra, zéro sept, trois cent quarante, Andance
quatre cent vingt-cinq impasse de Lussas, zéro sept, trois cent soixante-dix à Ozon
Chemin de la Grange du Seigneur, zéro sept, quatre cent quarante Champis
Rue du Musée, zéro sept, trois cent quarante Serrières
Route de Brézenaud, Roiffieux
Place Joseph Monier à Boulieu-lès-Annonay
quatre-vingt-neuf cHE DE LA REYNEE
Route de Liponnet au numéro six cent soixante
neuf ruelle du Ht Village, zéro sept, huit cents Charmes-sur-Rhône
vingt-huit chemin de Charmenton, zéro sept, cent, Annonay
quinze chemin de Padenelle, zéro sept, cent dix à Vinezac
Rue du Candide, zéro sept, cent soixante-dix Lavilledieu
Ruelle de Jeanne, zéro sept, trois cent soixante-dix Ozon
Rue de Lomes, Sécheras
Chemin de Morteveille à Saint-Barthélemy-le-Plain
quatre-vingt-cinq impasse de l'Ouvèze
RTE DES TRAVERSES au numéro huit cent soixante-dix
quarante-cinq rue du Couloir, zéro sept, quatre cents Aubignas
cent trente rue des Guindres, zéro sept, cent soixante-dix, Lavilledieu
quarante rue Jean Vergier, zéro sept, deux cent quatre-vingt-dix à Ardoix
Passage du Parc, zéro sept, quatre cent dix Saint-Félicien
Place du Colon, zéro sept, six cent dix Vion
Chemin de la Traversière, Ruoms
Impasse de la Cavalle à Lavilledieu
vingt-trois impasse de la Comtesse de Ségur
Boulevard Jacques de Sugny au numéro six
quatre place Camille Claudel, zéro sept, quatre cents Le Teil
deux cent dix chemin de Gachon, zéro sept, cent, Boulieu-lès-Annonay
deux place du Port, zéro sept, trois cents à Tournon-sur-Rhône
Chemin de l'Hortense, zéro sept, trois cents Glun
Rue de Serres, zéro sept, cent soixante-dix Villeneuve-de-Berg
Impasse de la Cerisaie, Toulaud
Route des Hauts de la Grasse à Peaugres
cent soixante-cinq impasse des Coudiolles
Chemin de Cantieux au numéro quatre cent vingt
trois mille trois cent quatre-vingt-dix route de Largelas, zéro sept, quatre cents Aubignas
six mille cent cinquante-trois allée Paul Avon, zéro sept, quatre cents, Le Teil
cent quatre-vingt-quinze chemin des Cigalières, zéro sept, deux cents à Saint-Étienne-de-Fontbellon
Chemin de Rosières, zéro sept, quatre cent quarante Champis
Allée du Merlot, zéro sept, cent Saint-Marcel-lès-Annonay
Rue Beau Séjour, Brossainc
Chemin de la République à Cheminas
quatre-vingt-dix route de Saint-Jeure-d'Ay
Chemin de la Croix du Jean au numéro deux mille deux cent soixante-dix-neuf
dix avenue de Delfzijl, zéro sept, deux cents Aubenas
deux cent quatre-vingts chemin de Billaud, zéro sept, quatre cent dix, Saint-Félicien
six impasse du Vieux Marcale, zéro sept, cent trente à Saint-Péray
Rue du Bourdaric, zéro sept, quatre cent soixante Saint-André-de-Cruzières
Impasse des Ifs, zéro sept, trois cents Saint-Jean-de-Muzols
Route de Malafosse, Jaunac
Sous La Gare à Aubenas
cinq cent cinquante-quatre chemin de la Planche
CHE DES PLANCHAS au numéro trois cent cinq
vingt et un chemin du Coupier, zéro sept, cent trente Saint-Péray
dix impasse Nord, zéro sept, cent, Saint-Marcel-lès-Annonay
vingt-cinq rue du Dominan, zéro sept, trois cent soixante-dix à Eclassan
Rue Révérend Père Canaud, zéro sept, sept cents Bourg-Saint-Andéol
Rue de la Réforme, zéro sept, cent Annonay
Avenue Ferdinand Nadal, Les Vans
Calle du Four à Salavas
cent cinquante-huit chemin de la Chanelette
Rue des Caïras au numéro sept
vingt-cinq chemin Côte de Montalivet, zéro sept, trois cent quarante Andance
vingt rue de la Petite Calade, zéro sept, zéro zéro zéro, Saint-Julien-en-Saint-Alban
trois rue Saint-Ignace, zéro sept, cent à Annonay
Impasse du Boulevard, zéro sept, trois cent soixante Les Ollières-sur-Eyrieux
Passage Aloysia de Chanaleilles, zéro sept, cent soixante-dix Lavilledieu
Rue Coupelliol, Vernosc-lès-Annonay
Route de Plats à Mauves
mille chemin de la Chavas
Chemin de la Couarde au numéro vingt-cinq
deux chemin du Pont du Doux, zéro sept, trois cents Saint-Jean-de-Muzols
cent trente chemin d'Eclassan, zéro sept, deux cent quatre-vingt-dix, Ardoix
vingt-cinq impasse de Nizoule, zéro sept, deux cents à Lachapelle-sous-Aubenas
Chemin de Montgagnan, zéro sept, cent Roiffieux
Impasse du Nord, zéro sept, trois cent quarante Talencieux
Rue de Romère, Vernosc-lès-Annonay
Place du Mollard à Saint-Jean-de-Muzols
trois cent trente impasse de Bénistant
Rue du Puits du Moine au numéro deux
deux cents chemin de Berguier, zéro sept, cent dix Laurac-en-Vivarais
cent soixante rue des Roisses, zéro sept, trois cent quarante, Félines
vingt-huit rue d'Ayos, zéro sept, quatre cent trente à Davézieux
Impasse de Chadenac, zéro sept, trois cent trente Barnas
Route de Broé, zéro sept, trois cent soixante-dix Eclassan
Impasse Marcel Paul, Cruas
Rue du Moutât à Toulaud
quinze ruelle du Mûrier
CHE RESERVOIRS au numéro deux cent quatre-vingt-cinq
soixante-cinq impasse Royer, zéro sept, trois cent quarante Serrières
cinq cent quatre-vingt-douze route du Pilat, zéro sept, trois cent quarante, Félines
un rue Ramade, zéro sept, sept cents à Bourg-Saint-Andéol
Impasse des sept Hommes, zéro sept, cent Roiffieux
Impasse du Gymnase, zéro sept, quatre cent dix Saint-Félicien
Chemin de la Tour du Moulin, Salavas
Impasse de Rejuillet à Barnas
trois impasse de l'Arzalier
Place Étienne Jargeat au numéro deux
un rue des Religieuses, zéro sept, trois cents Tournon-sur-Rhône
six mille quatre cent quatre-vingts chemin de la Moutte, zéro sept, deux cent vingt, Viviers
trois cent quatre-vingt-cinq chemin de Victouron, zéro sept, quatre cent dix à Colombier-le-Vieux
Impasse Le Coin, zéro sept, cent soixante Saint-Cierge-sous-le-Cheylard
Chemin de Dardet, zéro sept, trois cent trente Thueyts
Impasse de Champ-Bracol, Lachapelle-sous-Aubenas
Ruelle Berthold à Talencieux
deux cent quarante-huit route La Remise
Place Joliot Curie au numéro trois
cinq route de Daumas, zéro sept, trois cent quarante Peaugres
cinq A chemin de Chabanet Bas, zéro sept, trois cents, Saint-Barthélemy-le-Plain
douze avenue des Droits de Homme, zéro sept, cent quarante aux Vans
Allée des Genévriers, zéro sept, quatre cents Le Teil
Chemin de Cheyron, zéro sept, quatre cents Rochemaure
Impasse Gustave Thibon, La Voulte-sur-Rhône
Impasse de Grasset à Andance
cinq cent quarante chemin du Grand Gour
Passage de Chirols au numéro quatre-vingt-deux
trente chemin du Ripeon, zéro sept, cent soixante-dix Lussas
cinq allée du Tramontel, zéro sept, trois cent trente, Thueyts
trois rue du Petit Collège, zéro sept, cent à Annonay
Route du Pouget, zéro sept, trois cent trente Barnas
Rue des Couas, zéro sept, quatre cent trente Vernosc-lès-Annonay
Rue Bellerime, Guilherand-Granges
Impasse de Coudouleyre à Barnas
cinquante-trois route du Roi des Bois
Chemin des Prauds au numéro trois
huit cent soixante-seize route des Reynauds, zéro sept, trois cent quarante Félines
un impasse Croix Saint-Martin, zéro sept, deux cents, Ucel
soixante-quinze montée de Seive, zéro sept, cent à Boulieu-lès-Annonay
Place de Bayssac, zéro sept, cent soixante-dix Lavilledieu
Chemin de Vignes, zéro sept, zéro zéro zéro Saint-Julien-en-Saint-Alban
Impasse Marcel Jullian, Lavilledieu
Rue Dareyre à Lamastre
un place Paul Éluard
Chemin Blaches au numéro cent quarante
cent chemin de l'Olivat, zéro sept, deux cent quatre-vingt-dix Saint-Romain-d'Ay
huit impasse Chopard, zéro sept, six cent dix, Vion
quarante-cinq chemin des Tisseuses, zéro sept, deux cent quatre-vingt-dix à Quintenas
Rue des Poireaux, zéro sept, zéro zéro zéro Privas
Impasse Charles Gounod, zéro sept, quatre cent trente Davézieux
Chemin du Chareyrou, Les Vans
Chemin de l'Olivière au Teil
un rue du Fournas
Chemin des Champs de Mercier au numéro deux cent cinquante
six mille six cent soixante-huit place du Vieux Temple, zéro sept, deux cent dix Chomérac
trois montée du Maréchal, zéro sept, trois cent quarante, Bogy
trois cent cinquante chemin de Combe Grand, zéro sept, trois cent soixante-dix à Eclassan
Chemin de l'Houiller, zéro sept, cent trente Toulaud
Rue de la Jacquerie, zéro sept, cent soixante-dix Lavilledieu
Rue Condamine, Tournon-sur-Rhône
Lhodemare à Glun
vingt et un les Perrettes
Impasse d'Aric au numéro cinquante-cinq
trois cent trente impasse de Chaumet, zéro sept, quatre cent dix Saint-Félicien
deux rue Valpeyrouse, zéro sept, deux cent vingt, Viviers
quatre-vingt-dix chemin de Mélinas, zéro sept, sept cents à Saint-Just-d'Ardèche
Impasse Louis Devise, zéro sept, trois cents Tournon-sur-Rhône
Impasse Barnerie, zéro sept, cent vingt Saint-Alban-Auriolles
Place Henri Johannot, Annonay
Chemin de l'Artisanat à Saint-Félicien
huit sentier de Noirols
Montee du Bosc au numéro cent douze
deux cent quatre-vingt-cinq impasse du Randiguon, zéro sept, zéro zéro zéro Coux
trois BIS boulevard du Lycée, zéro sept, zéro zéro zéro, Privas
cent chemin de Blassenac, zéro sept, cinq cent soixante-dix à Labatie-d'Andaure
Chemin de la Chaux, zéro sept, trois cent quarante Saint-Désirat
Avenue Duclaux Monteil, zéro sept, cent quarante Les Vans
Place de l'Herboux, Laurac-en-Vivarais
CHE DE CHAMBONNET à Mariac
deux cent soixante et onze chemin de Bramefan
Impasse des Montaux au numéro quarante-cinq
quatre cent quinze chemin de la Routisse, zéro sept, quatre cent dix Saint-Félicien
un rue Jean Aurenche, zéro sept, zéro zéro zéro, Privas
douze rue Conrad Kilian, zéro sept, deux cent soixante-dix à Lamastre
Rue des Puces, zéro sept, deux cents Vogüé
Rue du Sonneur, zéro sept, trois cent quarante Champagne
Chemin de Leyrisse, Champis
Chemin de Labeaume à Tournon-sur-Rhône
deux cent vingt impasse des Monneries
Place du Pouzin au numéro un
deux mille neuf cent trente et un route d'Eclassan, zéro sept, trois cent soixante-dix Sarras
