cent quinze rue de Lanséria, quarante-quatre, quatre cent vingt à Mesquer
Boulevard Dumesnildot, quarante-quatre mille cinq cent soixante Paimbœuf
Rue des Gabarres, quarante-quatre, huit cent cinquante Le Cellier
Chemin du Coin Sarah, Les Moutiers-en-Retz
Avenue de la Voie Lactée à La Baule-Escoublac
douze avenue de Bangor
Rue de l'Aurière au numéro cinq BIS
deux sainte-Marie, quarante-quatre mille quatre cent quarante Joué-sur-Erdre
cinq allée du Garde, quarante-quatre, cinq cents, La Baule-Escoublac
vingt-trois rue de la Boizonnière, quarante-quatre, trois cent vingt à Arthon-en-Retz
Route de la Jourdannais, quarante-quatre mille cent soixante Pontchâteau
La Robinière, quarante-quatre, cent cinquante Anetz
La Rotardière, Saint-Hilaire-de-Chaléons
Impasse des Havenets à La Turballe
quatre impasse de la Sitelle
Chemin du Pont d'Orvin au numéro cinq
deux impasse Cathelineau, quarante-quatre mille cent quarante Aigrefeuille-sur-Maine
dix rue du Bourg Mignon, quarante-quatre, deux cent soixante-dix, Machecoul
vingt-cinq rue des Cahéraux, quarante-quatre, deux cent quarante à La Chapelle-sur-Erdre
Rue de Valliers, quarante-quatre mille sept cent dix Saint-Léger-les-Vignes
Impasse Fraboulet, quarante-quatre, zéro zéro zéro Nantes
Rue du Petit Brandais, Saint-Léger-les-Vignes
Rue des Levées Miraud à La Chapelle-des-Marais
neuf rue de L'Ile de Beaumard
Impasse Montéverdi au numéro quatorze
treize allée Émile Bellorge, quarante-quatre mille cinq cent dix Le Pouliguen
vingt-cinq rue du Rocher-Saille, quarante-quatre, trois cent cinquante, Guérande
dix rue des Gassières, quarante-quatre, quatre cents à Rezé
Rue du Moulin de la Halvêque, quarante-quatre mille Nantes
Rue Françis Le Guilloux, quarante-quatre, deux cent vingt Couëron
Rue de Heurthauds, Saint-Julien-de-Concelles
Boulevard José Arribas à Rezé
six rue de la Belle
Rue de la Périchole au numéro cinq
vingt-sept rue Louis Primault, quarante-quatre mille Nantes
trente-deux rue Paul Deltombe, quarante-quatre, zéro zéro zéro, Nantes
cinq rue du Faubourg Saint-Michel, quarante-quatre, cent dix à Châteaubriant
Chemin de la Guzoire, quarante-quatre mille quatre cents Rezé
Impasse du Petit Rocher, quarante-quatre, trois cent quarante Bouguenais
Boulevard Bellanger, La Turballe
Allée de Mafoué à Pornichet
sept passage du Champ de Foire
Rue Baboneau au numéro deux
trois passage Pommeraye, quarante-quatre mille Nantes
dix rue Basse Grande Rue, quarante-quatre, cent cinquante, Ancenis
sept rue de la Fontaine Grillée, quarante-quatre, six cent quatre-vingt-dix à La Haie-Fouassière
Rue Du Vannier, quarante-quatre mille huit cent dix La Chevallerais
Rue de la Viaudière, quarante-quatre, six cent quatre-vingt-dix La Haie-Fouassière
Rue des Mazères, Le Cellier
Impasse du Jonchas à Saint-Molf
treize avenue Alfred Lucas
Place du Port Communeau au numéro six
dix-neuf boulevard du Manoir Saint-Lo, quarante-quatre mille Nantes
cinquante-sept avenue Ferdinand de Lesseps, quarante-quatre, six cents, Saint-Nazaire
six impasse de Tourneuve, quarante-quatre, sept cents à Orvault
Rue de la Surboisière, quarante-quatre mille cent quinze Haute-Goulaine
Avenue Auguste Brizeux, quarante-quatre, sept cent trente Saint-Michel-Chef-Chef
Rue du Petit Méan, Trignac
Rue de Barbotte à Nantes
trente-quatre BIS avenue Jean de La Fontaine
Impasse de la Mouette au numéro six
huit cent quarante-deux route de Bézillé, quarante-quatre mille deux cent quarante Sucé-sur-Erdre
cinquante-cinq quai du Port de Méan, quarante-quatre, six cents, Saint-Nazaire
onze rue Dionysos, quarante-quatre, quatre cent soixante-dix à Carquefou
Rue des Malifestes, quarante-quatre mille cent quatre-vingt-dix Clisson
Route de Merquel, quarante-quatre, quatre cent vingt Mesquer
Avenue Joseph Desfosse, Saint-Michel-Chef-Chef
Impasse du Port de la Ramée à Vertou
vingt-cinq rue de la Blordière
Rue du Ponton au numéro huit
huit place Bretagne, quarante-quatre mille trois cent soixante Saint-Étienne-de-Montluc
un B rue Michel Jazy, quarante-quatre, huit cent trente, Bouaye
sept rue Claude et Simone Millot, quarante-quatre, zéro zéro zéro à Nantes
Rue des Déportés Résistants, quarante-quatre mille cent dix Châteaubriant
Rue de la Ville Marie, quarante-quatre, cent dix Châteaubriant
Rue Pierre Blard, Saint-Herblain
Rue du Clos-Bernard à Puceul
cent vingt et un route de la Haie-Fouassière
Rue du Docteur Renoul au numéro dix-neuf
cinq rue du Petit Bel Air, quarante-quatre mille sept cent dix Port-Saint-Père
trois impasse des Arcis, quarante-quatre, huit cent trente, Brains
seize avenue des Samourais, quarante-quatre, zéro zéro zéro à Nantes
Rue de l'Amazonie, quarante-quatre mille Nantes
Avenue de la Bresse, quarante-quatre, deux cent cinquante Saint-Brevin-les-Pins
Rue du Pré Colas, Le Bignon
Avenue du Petit Trianon à Saint-Herblain
deux rue du Chanoine Dubois
Rue du Clos des Granges au numéro sept
vingt avenue Clio, quarante-quatre mille quatre cent soixante-dix Carquefou
huit rue de la Bienassiserie, quarante-quatre, six cent quarante, Rouans
dix-neuf rue Francisque Poulbot, quarante-quatre, huit cents à Saint-Herblain
Allée des Lichens, quarante-quatre mille cinq cents La Baule-Escoublac
Rue de la Moncire, quarante-quatre, trois cent dix La Limouzinière
Rue du Moulin des Carmes, Nantes
Rue des Hauts Pavés à Nantes
deux rue Dudrézène
Rue du Bois de la Musse au numéro vingt
vingt et un rue de Bilon, quarante-quatre mille quatre cent dix Herbignac
onze allée des Élodées, quarante-quatre, neuf cent quatre-vingts, Sainte-Luce-sur-Loire
vingt bry, quarante-quatre, quatre cent quarante à Joué-sur-Erdre
Chemin du Battoir, quarante-quatre mille deux cent quarante Sucé-sur-Erdre
Rue de l'Orée du Golf, quarante-quatre, quatre cent soixante-dix Carquefou
Avenue des Diligences, Nantes
Rue de l'Ouche Cormier à Orvault
cent quatre-vingt-dix-neuf square du Grenier à Sel
Avenue du Petit Moulin au numéro dix-huit
trois impasse François Blourde, quarante-quatre mille quatre cents Rezé
seize B avenue de la Praudière, quarante-quatre, sept cents, Orvault
vingt-trois rue de Barbin, quarante-quatre, zéro zéro zéro à Nantes
Rue des Petites Industries, quarante-quatre mille quatre cent soixante-dix Carquefou
Rue Frederic Bartholdi, quarante-quatre, sept cents Orvault
Rue Jean-Baptiste Legeay, Guérande
Avenue des Évens à Pornichet
six avenue Provost
Rue de Soulbary au numéro sept
quatorze boulevard de Chantenay, quarante-quatre mille Nantes
dix-sept B rue Jean-Baptiste Hamon, quarante-quatre, quatre cents, Rezé
six rue du Vallon de la Gavre, quarante-quatre, cent quatre-vingt-dix à Gorges
Route de Kerroux, quarante-quatre mille trois cent cinquante Guérande
Rue des Typhas, quarante-quatre, cinq cent cinquante Saint-Malo-de-Guersac
Impasse du Clos de Bel Air, Mauves-sur-Loire
Rue des Saulsaies à Geneston
onze rue des Maçonnières
Rue des Porteaux au numéro quatre
cinq rue Maurice Sibille, quarante-quatre mille Nantes
deux rue de la Chintière, quarante-quatre, cent vingt, Vertou
huit avenue de Cuy, quarante-quatre, cinq cents à La Baule-Escoublac
Boulevard du Docteur René Dubois, quarante-quatre mille cinq cents La Baule-Escoublac
La Pécotaie, quarante-quatre, trois cent quatre-vingt-dix Saffré
Rue de l'Olivraie, Nantes
Impasse des Vieux Métiers à Puceul
vingt-cinq rue Gilles de Retz
Rue des Ecobuts au numéro cinq
quatre-vingt-quatre place du Pareillier, quarante-quatre mille deux cent quarante Sucé-sur-Erdre
quarante-quatre TER route de Penhoët, quarante-quatre, cinq cent soixante-dix, Trignac
cinq allée d'Aspin, quarante-quatre, huit cents à Saint-Herblain
Avenue des Cornouillers, quarante-quatre mille quatre cents Rezé
Avenue du Rouet, quarante-quatre, trois cent quatre-vingts Pornichet
Rue Saint-Mihiel, Nantes
Cour des Charmilles à Saffré
quatre-vingt-treize rue de la Minutais
Passage de l'Ouchette au numéro dix-huit
quarante-huit rue Colonel Desgrées du Lou, quarante-quatre mille Nantes
treize allée Albert Schweitzer, quarante-quatre, neuf cent quatre-vingts, Sainte-Luce-sur-Loire
cinq chemin de La Terroussais, quarante-quatre, trois cent soixante à Saint-Étienne-de-Montluc
Rue de Ker d'Abas, quarante-quatre mille sept cent quarante Batz-sur-Mer
Route de Chéméré, quarante-quatre, six cent quarante Rouans
Place Lemot, Gétigné
Rue du Bas Falleron à Machecoul
deux route de la Ville au Gal-Marland
Rue Bouchaud au numéro quarante et un
deux rue Claude Gaulué, quarante-quatre mille quatre cents Rezé
vingt-trois rue de la Haute Noé, quarante-quatre, huit cent cinquante, Saint-Mars-du-Désert
trois impasse des Rues, quarante-quatre, cent dix-huit à La Chevrolière
Rue des Colporteurs, quarante-quatre mille Nantes
Hameau des Bocages, quarante-quatre, neuf cent quatre-vingts Sainte-Luce-sur-Loire
Place de l'Asile, Vertou
Route de la Villès Heulin à Saint-Nazaire
dix rue de la Bannerie
Rue des Yais au numéro sept mille deux cent quarante-six
trois impasse des Landes de Garambeau, quarante-quatre mille cent dix-neuf Treillières
un rue Auguste Lerat, quarante-quatre, cent vingt, Vertou
quatre impasse de l'Etier, quarante-quatre, trois cent quarante à Bouguenais
Rue Eugène Le Roux, quarante-quatre mille Nantes
Chemin de la Hulnière, quarante-quatre, cinq cent vingt-deux Mésanger
Impasse de la Carrée, Saint-Herblain
Boulevard Pierre de Gondy à Machecoul
trois route de la Trourie
Allée de la Fragonette au numéro un
dix rue Alfredo Gomez Ollero, quarante-quatre mille Nantes
trois square Henri Allanet, quarante-quatre, six cents, Saint-Nazaire
huit rue de la Cornouaille, quarante-quatre, zéro zéro zéro à Nantes
Rue de La Chapelle, quarante-quatre mille trois cent soixante Le Temple-de-Bretagne
Avenue Colette, quarante-quatre, huit cents Saint-Herblain
Rue Saint-Molf, La Turballe
Route la Chaussée Neuve à Saint-André-des-Eaux
vingt-sept BIS rue de la Caillerie
Rue de Saint-Domingue au numéro huit
vingt-deux rue Auguste Métiveau, quarante-quatre mille sept cent soixante La Bernerie-en-Retz
treize rue du Rotin, quarante-quatre, quatre cent cinquante, La Chapelle-Basse-Mer
deux cents rue Henri le Chatelier, quarante-quatre, cent cinquante à Ancenis
Impasse du Logui, quarante-quatre mille quatre cent dix Saint-Lyphard
Avenue Charlie Chaplin, quarante-quatre, zéro zéro zéro Nantes
Avenue de l'Engoulevent, Nantes
Avenue Lucien Guitry à La Baule-Escoublac
dix-neuf avenue des Noés
Avenue du Cristal au numéro onze
vingt-sept rue du soixante-cinq e Régiment d'Infanterie, quarante-quatre mille Nantes
six rue des Caboteurs, quarante-quatre, six cents, Saint-Nazaire
un impasse Michel Berger, quarante-quatre, cinq cent soixante-dix à Trignac
Avenue du Colonel Jean Cavalin, quarante-quatre mille cinq cents La Baule-Escoublac
Vièvre, quarante-quatre, six cent quarante Le Pellerin
Chemin de Kersalio, Guérande
Place de Preux à Saint-Herblain
quarante-cinq avenue de Saint-Goustan
Rue de la Patience au numéro huit
un rue du Sept Juin mille neuf cent quarante-quatre, quarante-quatre mille cent vingt Vertou
six rue de Langâtre, quarante-quatre, cinq cent trente, Saint-Gildas-des-Bois
huit impasse Modot, quarante-quatre, zéro zéro zéro à Nantes
Rue de la Floride, quarante-quatre mille six cents Saint-Nazaire
Rue du Colorado, quarante-quatre, quatre cent soixante-dix Carquefou
Square des Courtils, Varades
Rue de l'Ilot à La Plaine-sur-Mer
sept T rue de Port la Blanche
Allée Brunellière au numéro trois
trois rue de l'Artimon, quarante-quatre mille quatre cent vingt Piriac-sur-Mer
treize impasse des Baliveaux, quarante-quatre, trois cent quatre-vingt-dix, Casson
cinquante rue du Tillou, quarante-quatre, cinq cent cinquante à Montoir-de-Bretagne
Chemin du Clos d'Arlo, quarante-quatre mille cinq cents La Baule-Escoublac
Le Champion, quarante-quatre, trois cent quatre-vingt-dix Saffré
Rue du Quartron du Moulin, Arthon-en-Retz
Allée de la Baie du Nid à La Plaine-sur-Mer
onze B rue Louis Fortun
Rue René Debatisse au numéro quatorze
six avenue de la Comtesse de Noailles, quarante-quatre mille huit cents Saint-Herblain
six impasse des Champs Marins, quarante-quatre, trois cent cinquante, Saint-Molf
quatorze chemin du Pont de la Perche, quarante-quatre, sept cents à Orvault
Rue du Miron, quarante-quatre mille trois cent soixante Vigneux-de-Bretagne
Lotissement la Chapaudais, quarante-quatre, cent soixante Crossac
Square de la Parcheminerie, Carquefou
Rue du Gènois à La Turballe
quatre parc de la Messinière
Place Georges Gaudet au numéro soixante
un allée Saint-Hubert, quarante-quatre mille deux cent soixante-dix Machecoul
huit impasse des Carex, quarante-quatre, cent dix-sept, Saint-André-des-Eaux
douze allée des Hauts Viviers, quarante-quatre, cent vingt à Vertou
Route des Tertreaux, quarante-quatre mille huit cent quatre-vingts Sautron
Rue Alexandre Arnaud, quarante-quatre, cent vingt Vertou
Rue de la Begaudais, La Chevallerais
Allée du Cep de Vigne à Vertou
cinq cent vingt rue de la Hillet
Rue Jean-Baptiste Rabillard au numéro vingt-neuf
onze rue Marcel Guiheneuf, quarante-quatre mille deux cent vingt Couëron
quinze rue de l'Abbé Cussoneau, quarante-quatre, cent dix, Soudan
trente-trois rue du Butai, quarante-quatre, trois cent vingt à Arthon-en-Retz
Impasse de la Marquetterie, quarante-quatre mille cent soixante-dix Nozay
Avenue Bon Accueil, quarante-quatre, zéro zéro zéro Nantes
Rue de la Basse Canterie, Vertou
Avenue du Loing à Nantes
quarante-deux vigne de la Basse Chaume
Rue du Clos Moutin au numéro cinq
six rue de la Chedorgère, quarante-quatre mille cent dix-neuf Treillières
sept impasse des Choysias, quarante-quatre, deux cent cinquante, Saint-Brevin-les-Pins
vingt-huit route des Coteaux de la Turbalière, quarante-quatre, deux cent quarante à Sucé-sur-Erdre
Rue de l'Étoile du Matin, quarante-quatre mille six cents Saint-Nazaire
Rue de la Durantaie, quarante-quatre, cinq cent quarante Saint-Mars-la-Jaille
Allée du Lac de Grand Lieu, Rezé
Impasse de l'Apprie à Erbray
six chemin des Écusseaux
Rue Louis Rosier au numéro onze
un rue Robert Scott, quarante-quatre mille cent quinze Basse-Goulaine
dix rue du Geai des Chênes, quarante-quatre, cent trente, Notre-Dame-des-Landes
vingt-neuf T rue du Clos Siban, quarante-quatre, huit cents à Saint-Herblain
Rue de Martigné, quarante-quatre mille six cent soixante Soulvache
Rue Fidelio, quarante-quatre, trois cent quarante Bouguenais
Route du Pas Chevalier, Casson
Rue de la Chausserie à Saint-Léger-les-Vignes
deux rue Ambroise Pierre Audouard
Rue Georges Painvin au numéro onze
dix rue du Bon Port, quarante-quatre mille cinq cent quatre-vingts Bourgneuf-en-Retz
treize rue du Pont Badeau, quarante-quatre, six cent quatre-vingts, Sainte-Pazanne
neuf rue Paré, quarante-quatre, zéro zéro zéro à Nantes
Avenue du Petit Canon, quarante-quatre mille trois cent quatre-vingts Pornichet
Rue Louis Bizeul, quarante-quatre, cent trente Blain
Route du Marais d'Ust, Saint-Nazaire
Les Grandes Landes à Guémené-Penfao
vingt-deux rue Henri Radigois
Allée de la Grée au numéro quinze
vingt et un le Pressoir, quarante-quatre mille cent cinquante Saint-Herblon
trois cent trente-quatre B avenue du Séquoïa, quarante-quatre, zéro zéro zéro, Nantes
un impasse de la Sapinette, quarante-quatre, zéro zéro zéro à Nantes
Rue des Morinières, quarante-quatre mille trois cent dix La Limouzinière
Rue François Luneau, quarante-quatre, trois cent trente Vallet
Lotissement des Écottais, Donges
Rue de la Tourmentinerie à Saint-Mars-du-Désert
huit TER impasse Tout Grain
Avenue des Monts d'Auvergne au numéro trois
vingt-six avenue de Rochalot, quarante-quatre mille cinq cents La Baule-Escoublac
quatre rue d'Altair, quarante-quatre, sept cents, Orvault
cinq route du Tertre Rouge, quarante-quatre, deux cent soixante à Bouée
Rue de la Prunière, quarante-quatre mille six cent quarante Saint-Jean-de-Boiseau
Rue du Moulin des Brosses, quarante-quatre, trois cent quatre-vingt-dix Nort-sur-Erdre
Passage Bouchaud Zacharie, Geneston
Impasse de la Morlière à Saint-Herblain
huit route de la Saule
Rue Jean Jacotot au numéro douze
vingt-sept avenue Monnier, quarante-quatre mille trois cent quatre-vingts Pornichet
cent treize rue Gaston Turpin, quarante-quatre, zéro zéro zéro, Nantes
deux avenue Henri, quarante-quatre, trois cent quatre-vingts à Pornichet
Boulevard Général Pierre Koenig, quarante-quatre mille Nantes
Route de Sainte-Reine Bosselas, quarante-quatre, cent soixante Crossac
Avenue Sagamore, Nantes
Chemin de la Garnerie à Saint-Nazaire
un chemin Barbier
Boulevard Vincent Gâche au numéro trente et un
deux avenue Richelieu, quarante-quatre mille Nantes
vingt et un rue du seize Septembre, quarante-quatre, huit cents, Saint-Herblain
treize rue des Mortraits, quarante-quatre, deux cent trente à Saint-Sébastien-sur-Loire
Route de Saint-Dolay, quarante-quatre mille cinq cent trente Sévérac
Rue de la Vigne du Champ, quarante-quatre, trois cent trente Mouzillon
Rue de Mallève, Nantes
Allée de la Croix Gruais à Mésanger
treize route de la Tranchais
Rue des Jardins d'Hélène au numéro quatre B
un impasse Océane, quarante-quatre mille sept cent soixante-dix La Plaine-sur-Mer
six rue Barban, quarante-quatre, quatre cents, Rezé
quinze rue des Aumiettes, quarante-quatre, deux cent dix à Pornic
Rue Maurice Jouaud, quarante-quatre mille quatre cents Rezé
Rue du Brigandin, quarante-quatre, six cent quatre-vingts Chéméré
Rue Eugène Orieux, Rezé
Rue du Lerioux à Saint-Nazaire
un rue de la Mierre
Vault au numéro trois
quinze rue Raymond Berr, quarante-quatre mille cinq cent soixante Paimbœuf
vingt-six franchaud, quarante-quatre, quatre cent quarante, Joué-sur-Erdre
douze rue de l'Aire Matté, quarante-quatre, cent quatre-vingt-dix à Boussay
Route de Bilac, quarante-quatre mille cent dix-sept Saint-André-des-Eaux
Rue des Brues, quarante-quatre, cent dix-huit La Chevrolière
Rue Fellonneau, Nantes
Rue d'Issé à Saint-Vincent-des-Landes
trois avenue Gustave Lusseaud
Chemin des Gîtes au numéro vingt et un
deux hameau du Chêne, quarante-quatre mille sept cent quatre-vingts Missillac
huit avenue Marguerite Jean, quarante-quatre, cinq cents, La Baule-Escoublac
quatorze route de Savenay, quarante-quatre, sept cent cinquante à Campbon
Place Emmanuel Caux, quarante-quatre mille cinq cent soixante-dix Trignac
Rue de l'Indève, quarante-quatre, sept cent cinquante Campbon
Rue de Pimodan, Nantes
Rue de la Quératière à Rezé
trois rue de la Havane
Rue de la Prairie de la Haie au numéro dix-huit
onze chemin de la Govelle, quarante-quatre mille sept cent quarante Batz-sur-Mer
cinq rue de la Bérangerais, quarante-quatre, deux cent quarante, La Chapelle-sur-Erdre
huit impasse de la Grande Pièce, quarante-quatre, sept cent cinquante à Campbon
Impasse du Vert Clos, quarante-quatre mille huit cents Saint-Herblain
Chemin des Cracauds, quarante-quatre, sept cent trente Saint-Michel-Chef-Chef
Rue Théophile Ceineray, Vigneux-de-Bretagne
Rue Martine Carol à Nantes
quatre avenue des Mohicans
Rue André et Roger Perruche au numéro dix-neuf
treize place de l'Église Madame, quarante-quatre mille sept cent soixante Les Moutiers-en-Retz
dix boulevard de Sunderland, quarante-quatre, six cents, Saint-Nazaire
neuf esplanade Édouard Glissant, quarante-quatre, zéro zéro zéro à Nantes
Rue Georges Sicard, quarante-quatre mille cent trente Fay-de-Bretagne
Rue de la Dutée, quarante-quatre, huit cents Saint-Herblain
Route de la Fertais, La Plaine-sur-Mer
Avenue du Roi Henri quatre à Vertou
cinq boulevard Luc Olivier Merson
Rue de la Petite Bourrelière au numéro sept
neuf rue du Gousset, quarante-quatre mille cinq cent quatre-vingt-dix Saint-Vincent-des-Landes
deux B rue Damrémont, quarante-quatre, zéro zéro zéro, Nantes
trente-cinq le Pommain, quarante-quatre, trois cent quatre-vingt-dix à Saffré
Chemin de la Gesvrière, quarante-quatre mille Nantes
Rue de Frocrain, quarante-quatre, cent soixante Pontchâteau
Rue de la Souillarderie, Nantes
Chemin des Réages à La Chapelle-sur-Erdre
trente rue du Bignonnet
Rue de la Martignère au numéro douze
dix-sept chemin des Hunaudais, quarante-quatre mille six cent quarante Rouans
cinquante-huit route de la Mossardière, quarante-quatre, deux cent dix, Pornic
neuf allée Mélusine, quarante-quatre, cent quatre-vingt-dix à Gorges
Avenue Chéneau, quarante-quatre mille Nantes
Avenue du Bois Robin, quarante-quatre, cinq cents La Baule-Escoublac
Rue des Bas Carterons, Sainte-Luce-sur-Loire
Rue du Port Chassé au Pellerin
sept rue du Pré de la Ramée
Route de Lizien au numéro quatorze
treize allée de Montbazon, quarante-quatre mille deux cent trente Saint-Sébastien-sur-Loire
sept place du vingt-quatre-vingt-cinq Juillet mille neuf cent quarante-quatre, quarante-quatre, quatre cent quatre-vingts, Donges
sept route du Prouhaud, quarante-quatre, sept cent trente à Saint-Michel-Chef-Chef
Avenue Hélène, quarante-quatre mille deux cent cinquante Saint-Brevin-les-Pins
Rue de l'Auxence, quarante-quatre, trois cent soixante-dix Belligné
Allée du Château d'Aux, La Montagne
Passage Henri Vandernotte à Saint-Nazaire
sept impasse des Matelots
Quai Saint-Paul au numéro dix-huit
seize rue de la Cadaine, quarante-quatre mille quatre cent soixante-dix Thouaré-sur-Loire
trois cent dix la Fouquière, quarante-quatre, trois cent quatre-vingt-dix, Nort-sur-Erdre
cinq place du Bihoreau Gris, quarante-quatre, zéro zéro zéro à Nantes
Allée Charles Mirallie, quarante-quatre mille Nantes
Rue Jean Guynemer, quarante-quatre, deux cent dix Pornic
Rue de l'Enclose, Pont-Saint-Martin
Avenue Sainte-Anne à Pornichet
six mille sept cent quatre-vingt-quatorze route de Kervarin
Rue Lorette de la Refoulais au numéro sept
deux rue Georges Caillaud, quarante-quatre mille cent quatre-vingt-dix Clisson
trente-deux rue de L'Aunis, quarante-quatre, cinq cent cinquante, Montoir-de-Bretagne
vingt-quatre allée Amiral Leray, quarante-quatre, deux cent cinquante à Saint-Brevin-les-Pins
Hameau du Maine, quarante-quatre mille neuf cent quatre-vingts Sainte-Luce-sur-Loire
Place de la Grée, quarante-quatre, cinq cent quatre-vingt-dix Derval
Rue Jean Debay, Nantes
Rue Jean-Baptiste Ceineray à Saint-Étienne-de-Montluc
vingt route des Sensives
Rue René Guillouzo au numéro trente-deux
onze route Clémence Lefeuvre, quarante-quatre mille quatre cent cinquante Saint-Julien-de-Concelles
sept rue Élisa Mercoeur, quarante-quatre, deux cent trente, Saint-Sébastien-sur-Loire
cinquante-deux allée Jacques Duquesne, quarante-quatre, sept cent trente à Saint-Michel-Chef-Chef
Rue Bocandé, quarante-quatre mille deux cent dix Pornic
Chemin des Millauds, quarante-quatre, six cents Saint-Nazaire
Route du Montru, La Chapelle-Heulin
Rue du Moutardier à La Limouzinière
cent cinquante-neuf rue de la Sinandière
Chemin de La Grimaudière au numéro trois
douze chemin Poisson, quarante-quatre mille Nantes
trois route du Patis Vert, quarante-quatre, cent trente, Blain
trois rue Henri de Monfreid, quarante-quatre, sept cents à Orvault
Rue d'Indret, quarante-quatre mille six cent vingt La Montagne
Rue de l'Aubinière, quarante-quatre, huit cent quatre-vingts Sautron
Avenue du Cimetière Saint-Clair, Nantes
Impasse d'Aha à Puceul
dix-huit rue de l'Ouche Colin
La Grée au numéro deux
un impasse du Long Fût, quarante-quatre mille cent quatre-vingt-dix Clisson
soixante-dix-sept rue de la Bellaudière, quarante-quatre, cent quinze, Haute-Goulaine
quarante et un rue des Sensives, quarante-quatre, cent cinquante à Saint-Géréon
Rue de Saint-Andrew, quarante-quatre mille quatre cent vingt Mesquer
Rue de Belsunce, quarante-quatre, zéro zéro zéro Nantes
Impasse de la Ville en Bois, Bouaye
Chemin de la Musse à Nantes
neuf rue des Fluteaux Nageants
Rue Louis Loday au numéro trente-sept
trois cent neuf la Chatelière, quarante-quatre mille trois cent quatre-vingt-dix Les Touches
trois place Irène Joliot Curie, quarante-quatre, six cent quarante, Saint-Jean-de-Boiseau
quatre rue de la Biliais, quarante-quatre, sept cents à Orvault
Les Vauds Durons, quarante-quatre mille cinq cent vingt et un Oudon
Route de Puceul, quarante-quatre, cent soixante-dix Nozay
Rue de Grénebo, Pontchâteau
Avenue du Courage à Saint-Sébastien-sur-Loire
douze rue de Polymnie
Avenue Florian au numéro dix
huit rue Alexandre Vézin, quarante-quatre mille six cents Saint-Nazaire
vingt-huit BIS rue de L'Angle, quarante-quatre, cent dix-huit, La Chevrolière
treize avenue Jean de Savonnières, quarante-quatre, quatre cent soixante-dix à Carquefou
Rue du Clos Lumette, quarante-quatre mille quatre cent dix Herbignac
Rue Gabriel Luneau, quarante-quatre, zéro zéro zéro Nantes
Route du Petit Brossais, Savenay
Avenue du Laurier Fleuri à Vertou
un rue de Bel Etre
Rue du Douet Garnier au numéro cinquante-neuf
douze le Hameau du Boisillet, quarante-quatre mille quatre cent quarante Riaillé
neuf rue Monteverdi, quarante-quatre, deux cent quarante, La Chapelle-sur-Erdre
trente rue de chez Gâtin, quarante-quatre, huit cent quarante aux Sorinières
Avenue Joseph Bodinier, quarante-quatre mille Nantes
Rue de la Lourneau, quarante-quatre, deux cent trente Saint-Sébastien-sur-Loire
Impasse de l'Ouche Guernon, Saint-Philbert-de-Grand-Lieu
Cour des Frênes à Saffré
quarante-six rue de Kervabon
Impasse de la Galarnière au numéro deux
sept rue du Pré Poulain, quarante-quatre mille quatre cent soixante-dix Thouaré-sur-Loire
quatre rue du Puy Charrier, quarante-quatre, cinq cent quatre-vingts, Bourgneuf-en-Retz
quatorze rue Huygens, quarante-quatre, sept cents à Orvault
Rue du Bois Robillard, quarante-quatre mille Nantes
Avenue du Champ de la Roche, quarante-quatre, deux cent cinquante Saint-Brevin-les-Pins
Rue du Docteur Malécot, Le Fresne-sur-Loire
Chemin de la Tremblaie à Bouguenais
un allée des Ecoinçons
Impasse de la Trêperie au numéro deux
