Rue Robert Douineau, quarante-quatre mille deux cent trente Saint-Sébastien-sur-Loire
Route de l'Angerais, quarante-quatre, cent trente Blain
Rue de Kerban, Batz-sur-Mer
Avenue du Castouillet au Croisic
quarante et un avenue Henri Bertho
Route de Saint-Père au numéro cinq
six allée des Bourelliers, quarante-quatre mille cent soixante Pontchâteau
dix-huit avenue Collet, quarante-quatre, trois cent quatre-vingts, Pornichet
quatre rue de la Vergnaie, quarante-quatre, cent quatre-vingt-dix à Saint-Hilaire-de-Clisson
Rue de la Bauche Tue Loup, quarante-quatre mille huit cent soixante Pont-Saint-Martin
Route d'Ancenis, quarante-quatre, trois cent trente Mouzillon
Rue des Ouches de Froland, Saint-Julien-de-Concelles
Rue d''Aquitaine à Montoir-de-Bretagne
cinquante-deux rue Joseph et Lucien Leclerc
Allée du Frégonnay au numéro huit
quinze chemin de Ferline, quarante-quatre mille quatre cent vingt Piriac-sur-Mer
cinq rue de Joigny, quarante-quatre, zéro zéro zéro, Nantes
vingt-deux rue François Sorin, quarante-quatre, quatre cents à Rezé
Rue du Prinquiau, quarante-quatre mille Nantes
Avenue Guy de La Morandais, quarante-quatre, cinq cents La Baule-Escoublac
Rue de la Verdonnière, Haute-Goulaine
Allée Hanneloup à Saint-Brevin-les-Pins
deux rue des Courtilets
Rue Joseph Beaulieu au numéro six
trente-quatre avenue Egazel, quarante-quatre mille deux cent cinquante Saint-Brevin-les-Pins
vingt et un rue de Retz, quarante-quatre, quatre cent dix, Herbignac
quatre rue Betelgeuse, quarante-quatre, trois cent quarante à Bouguenais
Rue du Trélagot, quarante-quatre mille quatre cent quatre-vingts Donges
Chemin de la Minoterie, quarante-quatre, cinq cent dix Le Pouliguen
Place de la Vannerie, Carquefou
Rue Philippe de Cabrol à Nantes
six rue de la Maison Cochée
Rue Alphonse Tramblay au numéro neuf
vingt-deux route de la Louée, quarante-quatre mille cent vingt Vertou
treize avenue Bettine, quarante-quatre, cinq cents, La Baule-Escoublac
six rue de la Peignère, quarante-quatre, sept cent soixante-dix à La Plaine-sur-Mer
Rue Jean Dedron, quarante-quatre mille neuf cent quatre-vingts Sainte-Luce-sur-Loire
Avenue de la Bretonnière, quarante-quatre, cent vingt Vertou
Avenue du Général Berthelot, La Baule-Escoublac
Impasse de la Rivetière à Saint-Jean-de-Boiseau
onze rue de la Métairie de l'Angle
Rue Alexandre Olivier au numéro quarante-sept
deux route du Bois du Pont, quarante-quatre mille trois cent cinquante Guérande
six rue de l'Arche Sèche, quarante-quatre, zéro zéro zéro, Nantes
vingt-huit rue de l'Abbé Ménardeau, quarante-quatre, six cent quatre-vingt-dix à Château-Thébaud
Rue Régnard, quarante-quatre mille Nantes
Avenue de la Convention, quarante-quatre, sept cent trente Saint-Michel-Chef-Chef
Rue du Genétais, Rezé
Allée des Sarments à Mesquer
cinquante et un avenue Louis Lajarrige
Route de la Croix Labert au numéro trente et un
cinq cent trente-cinq chemin de la Chambre, quarante-quatre mille quatre cent vingt Mesquer
dix rue Yves Ponceau, quarante-quatre, deux cent dix, Pornic
cent trente-trois boulevard Auguste Péneau, quarante-quatre, zéro zéro zéro à Nantes
Rue du Plessis Gautron, quarante-quatre mille Nantes
Rue Fredo Krumnow, quarante-quatre, trois cent quarante Bouguenais
Rue Magin, Nantes
Rue du Marais Breton aux Moutiers-en-Retz
trois place de Perros-Guirec
Impasse de la Castille au numéro cinquante et un
un avenue du Miroir d'Eau, quarante-quatre mille Nantes
quatre avenue des Joncs Fleuris, quarante-quatre, huit cent soixante, Pont-Saint-Martin
dix clos des Vieux Chenes, quarante-quatre, deux cent soixante à Savenay
Voie Communale de la Pommeraie, quarante-quatre mille trois cent trente Vallet
Chemin des Hibaudières, quarante-quatre, trois cent quarante Bouguenais
Boulevard de La Libération, Saint-Étienne-de-Montluc
Avenue Modigliani à Nantes
quatre-vingt-douze BIS avenue Saint-Georges
Rue de la Gourhandais au numéro deux
quatre ruelle Charles Milcendeau, quarante-quatre mille trois cent quarante Bouguenais
trente-six rue Docteur Brindeau, quarante-quatre, zéro zéro zéro, Nantes
quatre rue Léon Say, quarante-quatre, zéro zéro zéro à Nantes
Avenue Marie-Louise, quarante-quatre mille cinq cents La Baule-Escoublac
Rue Bélanton, quarante-quatre, zéro zéro zéro Nantes
Rue des Vingt-Sept Otages, Châteaubriant
Impasse Guston à Nantes
quatre rue du Rolly
Avenue des Troënes au numéro sept
sept chemin des Petites Soeurs, quarante-quatre mille quatre cent vingt La Turballe
huit rue de la Gavrée, quarante-quatre, cent quatre-vingt-dix, Gorges
vingt et un rue Pierre Garreau, quarante-quatre, cent quarante à Remouillé
Allée de la Maladrie, quarante-quatre mille cent vingt Vertou
Impasse Jean de Savonnières, quarante-quatre, quatre cent soixante-dix Carquefou
Rue Eugène Couëtoux du Tertre, Bouvron
Impasse des Jardins de la Caradouère à Pornic
huit rue Amiral du Chaffault
Impasse Pérroné au numéro cinq
vingt et un chemin du Buron, quarante-quatre mille Nantes
vingt-six rue de la Saulzinière, quarante-quatre, zéro zéro zéro, Nantes
sept avenue Lieutenant Coiffard, quarante-quatre, zéro zéro zéro à Nantes
Chemin de la Monteguère, quarante-quatre mille sept cents Orvault
Rue de la Pré Neuve, quarante-quatre, trois cent cinquante Guérande
Allée de la Villa Pinsonne, Mauves-sur-Loire
Rue de Bernier à La Plaine-sur-Mer
vingt avenue des Violons
Rue de Kerfut au numéro vingt et un
un allée des Melroses, quarante-quatre mille cent vingt Vertou
huit avenue des Noëlles, quarante-quatre, cinq cents, La Baule-Escoublac
trois avenue des Mélodies, quarante-quatre, zéro zéro zéro à Nantes
Rue de Tréméac, quarante-quatre mille Nantes
Avenue des Douets, quarante-quatre, sept cent soixante La Bernerie-en-Retz
Rue du Zambèze, Saint-Herblain
Rue des Giraudais à Nantes
vingt et un rue de Saint-Dolay
Allée des Celtes au numéro onze
quatre résidence des Ormeaux, quarante-quatre mille quatre cent vingt Mesquer
un rue du Clos Paulet, quarante-quatre, six cent quatre-vingts, Saint-Hilaire-de-Chaléons
trente-cinq rue Alexandre Fourny, quarante-quatre, deux cent trente à Saint-Sébastien-sur-Loire
Route de Saint-Malo de Guersac, quarante-quatre mille cinq cent cinquante Montoir-de-Bretagne
Rue de Muzon, quarante-quatre, cent dix-neuf Treillières
Rue Grégoire Orain, Fégréac
Route de la Ville Hougard à Saint-André-des-Eaux
soixante et un avenue de la Riottière
Chemin de Bretineau au numéro trois
quarante-cinq rue de Kerdando, quarante-quatre mille trois cent cinquante Guérande
douze rue de Kergaigne, quarante-quatre, trois cent cinquante, Guérande
vingt-huit allée Racine, quarante-quatre, quatre cent soixante-dix à Carquefou
Rue de la Bohème, quarante-quatre mille trois cent quarante Bouguenais
Allée du Volcan d'Or, quarante-quatre, huit cent quatre-vingts Sautron
Route de la Roderie, Bouaye
Rue de Kervaquet au Croisic
treize boulevard Saint-Laurent
Rue du Petit Paillier au numéro quatre
vingt-neuf rue Alexis Maneyrol, quarante-quatre mille trois cent trente La Chapelle-Heulin
quatorze rue de l'Île de Reton, quarante-quatre, six cents, Saint-Nazaire
un la Morrhonnaie, quarante-quatre, trois cent quatre-vingt-dix à Saffré
Chemin de la Basse Bouguinière, quarante-quatre mille trois cent quarante Bouguenais
Rue de Roche Buttée, quarante-quatre, cinq cent trente Guenrouet
Avenue de Grandlieu, Pont-Saint-Martin
Rue du Pont de Terre à La Bernerie-en-Retz
vingt-cinq B route de Barbechat
Impasse de la Dixnotterie au numéro un
six B rue Auguste Bournigal, quarante-quatre mille deux cent vingt Couëron
trois BIS avenue des Gâts, quarante-quatre, quatre cents, Rezé
douze BIS rue du Lotissement de la Garenne, quarante-quatre, cent dix à Châteaubriant
Impasse d'Arz, quarante-quatre mille huit cent cinquante Ligné
Avenue du Mont Saint-Michel, quarante-quatre, zéro zéro zéro Nantes
Avenue des Ondes, Nantes
Rue de la Montaubonnière à Carquefou
dix route de Porchal
Rue du Grand Lin au numéro trois
six rue Christian Lescaudron, quarante-quatre mille cinq cent dix Le Pouliguen
neuf avenue Robinson, quarante-quatre, deux cent cinquante, Saint-Brevin-les-Pins
neuf avenue de la Sèvre, quarante-quatre, six cent quatre-vingt-dix à Château-Thébaud
Route du Radeau, quarante-quatre mille cinq cents La Baule-Escoublac
Petite Avenue de la Coquetterie, quarante-quatre, zéro zéro zéro Nantes
Impasse des Ronds Puits, Le Temple-de-Bretagne
Rue de la Gombergère à Vertou
vingt-cinq rue de Bois-Colombes
Avenue de la Chataigneraie au numéro quatre
cinquante rue de Bongarant, quarante-quatre mille huit cent quatre-vingts Sautron
neuf route de Goulaine, quarante-quatre, quatre cent cinquante, Saint-Julien-de-Concelles
vingt et un rue de Montbert, quarante-quatre, trois cent dix à Saint-Colomban
Rue du Més, quarante-quatre mille quatre cent dix Assérac
Rue Révérend Père Brottier, quarante-quatre, deux cent dix Pornic
Rue du Landier Roussel, Guérande
Rue Edmond Bertreux à Bouguenais
cinq rue Montée des Bigannes
Route du Drouillet au numéro douze
cinq rue Cacault, quarante-quatre mille cent quatre-vingt-dix Clisson
deux avenue du Spi, quarante-quatre, trois cent quatre-vingts, Pornichet
dix-huit chemin du Moulin des Buttes, quarante-quatre, trois cent quatre-vingt-dix aux Touches
Le Fretais, quarante-quatre mille quatre cent quarante Riaillé
Rue de la Chicotière, quarante-quatre, huit cents Saint-Herblain
Le Landreau Village, Vallet
Rue du Pladreau à Piriac-sur-Mer
dix rue Jean-Albert Tanguy
Allée Julien Duvivier au numéro six
vingt-cinq rue Jules Piédeleu, quarante-quatre mille Nantes
vingt-cinq boulevard des Batignolles, quarante-quatre, zéro zéro zéro, Nantes
sept rue Lieutenant Sageran, quarante-quatre, zéro zéro zéro à Nantes
Rue Georges Durivault, quarante-quatre mille Nantes
Rue du Jardin de la Fontaine, quarante-quatre, cent dix-huit La Chevrolière
Route de Landemont, Le Loroux-Bottereau
Lotissement des Saules à Sainte-Anne-sur-Brivet
trente-quatre rue Crucy
Chemin du Bigorneau au numéro vingt-six
seize chemin de la Piogerie, quarante-quatre mille huit cent trente Bouaye
quarante-quatre B rue du Brandais, quarante-quatre, six cent quatre-vingts, Chéméré
cinq B route de Saint-Colomban, quarante-quatre, trois cent dix à Saint-Philbert-de-Grand-Lieu
Chemin des Petites Grolles, quarante-quatre mille trois cent dix Saint-Philbert-de-Grand-Lieu
Rue des Tamariniers, quarante-quatre, sept cent trente Saint-Michel-Chef-Chef
Allée des Îles, Saint-Sébastien-sur-Loire
Rue Danaé à Carquefou
trente-six rue Etienne Chaillon
Rue Marie-Anne du Boccage au numéro quinze
trois C route du Grand Poissevin, quarante-quatre mille trois cent cinquante Guérande
seize rue Olivier De Sesmaisons, quarante-quatre, deux cent quarante, La Chapelle-sur-Erdre
huit rue Général de Goyon, quarante-quatre, zéro zéro zéro à Nantes
Rue Francoise de Foix, quarante-quatre mille cent dix Châteaubriant
Avenue du Grand Charpentier, quarante-quatre, trois cent quatre-vingts Pornichet
Rue de la Vigne Rosée, Saint-Nazaire
Rue de la Génêtière à Saint-Sébastien-sur-Loire
vingt-cinq rue de l'Ancien Hopital
Avenue Raymond Lalande au numéro dix C
dix-sept place Maurice Renoul, quarante-quatre mille cent quatre-vingt-dix Gorges
quarante-deux route Départementale vingt-neuf, quarante-quatre, cent soixante-dix, Jans
neuf mail des Magnolias, quarante-quatre, quatre cent soixante-dix à Thouaré-sur-Loire
Chemin de la Censive du Tertre, quarante-quatre mille Nantes
Avenue de la Brosse, quarante-quatre, cent vingt Vertou
Rue Donatien Bahaud, Nantes
Rue de Trévigale à Mesquer
un avenue du Puisatier
Chemin Lafeu au numéro dix-huit
trois rue des Marouettes, quarante-quatre mille huit cent soixante Saint-Aignan-Grandlieu
vingt et un B rue des Champs Renaudins, quarante-quatre, quatre cents, Rezé
quatre avenue du Lavoir, quarante-quatre, zéro zéro zéro à Nantes
Rue Guillet, quarante-quatre mille huit cent cinquante Saint-Mars-du-Désert
Rue de la Commanderie des Templiers, quarante-quatre, trois cent soixante Le Temple-de-Bretagne
Impasse des Avocettes, Carquefou
Route de la Sablette à Clisson
quinze rue des Gauvignets
Faubourg Bizienne au numéro cinquante-huit
onze allée Dominique Larrey, quarante-quatre mille huit cents Saint-Herblain
dix-huit rue du Val de Sèvre, quarante-quatre, cent quatre-vingt-dix, Boussay
quatre avenue de la Polka, quarante-quatre, zéro zéro zéro à Nantes
Route de la Favrière, quarante-quatre mille cent dix-neuf Grandchamp-des-Fontaines
Avenue de l'Hallali, quarante-quatre, cinq cents La Baule-Escoublac
Avenue des Plantes Débarquées, La Bernerie-en-Retz
Place des Centaures à Bouguenais
sept rue du Guatemala
Rue de la Ferme Gauloise au numéro un
dix-neuf rue Francois Madiot, quarante-quatre mille six cents Saint-Nazaire
neuf impasse de l'Ouche du Mieux, quarante-quatre, cent dix-huit, La Chevrolière
trente-cinq quai du Président Wilson, quarante-quatre, zéro zéro zéro à Nantes
Côte Saint Sébastien, quarante-quatre mille Nantes
Rue Docteur Jean Rostand, quarante-quatre, huit cents Saint-Herblain
Rue des Landes de Tréjet, La Chevrolière
Rue de la Rodrie à Saint-Joachim
huit rue des Quatres-Chemins
Rue Stanislas Luneau au numéro trois
quatre rue Aristide Nogues, quarante-quatre mille quatre cents Rezé
quatorze allée Urbain Pion, quarante-quatre, deux cent cinquante, Saint-Brevin-les-Pins
vingt et un avenue Gariguette, quarante-quatre, cinq cents à La Baule-Escoublac
Impasse Martin Dupas, quarante-quatre mille huit cent cinquante Saint-Mars-du-Désert
Rue de la Buchetière, quarante-quatre, cent dix-huit La Chevrolière
Rue de la Bourdonnais, Nantes
Avenue de la Pierre Longue au Croisic
quarante-deux avenue du Docteur Rappin
Allée des Varechs au numéro trois
huit rue Rohan Chabot, quarante-quatre mille deux cent soixante-dix Machecoul
cinquante-huit route de la Miellerie, quarante-quatre, sept cent trente, Saint-Michel-Chef-Chef
douze rue des Petites Orphelines, quarante-quatre, trois cent quatre-vingts à Pornichet
Le Sabot Doré, quarante-quatre mille trois cent quatre-vingt-dix Nort-sur-Erdre
Rue Kerbouchard, quarante-quatre, sept cent quarante Batz-sur-Mer
Lotissement Le Trait de la Vallée, Pornic
Rue du Tertre Princeau à Saint-Étienne-de-Montluc
cinq rue du Général Charette de la Contrie
Impasse Adrien Berselli au numéro vingt-sept
dix-huit rue Désirée Tartoué, quarante-quatre mille six cents Saint-Nazaire
quarante-trois B rue de la Durantière, quarante-quatre, zéro zéro zéro, Nantes
quatre-vingt-sept rue de La Lande, quarante-quatre, sept cent vingt à Saint-Joachim
Rue de la Polhaie, quarante-quatre mille cinq cent trente Saint-Gildas-des-Bois
Rue de la Jaguère, quarante-quatre, quatre cents Rezé
Rue du Verdelet, Haute-Goulaine
Rue de Kerbrun à Saint-Nazaire
quatorze rue du Léard
Allée des Grèbes au numéro trois
douze allée Waroc'h, quarante-quatre mille trois cent cinquante Guérande
quarante et un rue du Champ Quenot, quarante-quatre, cent soixante, Crossac
cinquante-deux BIS route des Murlasines, quarante-quatre, quatre cent cinquante à Saint-Julien-de-Concelles
Rue du Château de l'Éraudière, quarante-quatre mille Nantes
Route de la Pévelière, quarante-quatre, huit cent cinquante Le Cellier
Venelle Jean B. Fletcher, Nantes
Rue de la Croix-Truin à Saint-Jean-de-Boiseau
cinquante-trois boulevard de la Chauvinière
Avenue de la Brière au numéro quarante-deux
six rue des Gauteries, quarante-quatre mille quatre cent soixante-dix Carquefou
neuf lotissement le Pré au Gué, quarante-quatre, trois cent soixante, Saint-Étienne-de-Montluc
dix rue du Bois Pean, quarante-quatre, cent dix à Châteaubriant
Rue des Carterons, quarante-quatre mille deux cent vingt Couëron
Rue Eugène et Léoncie Kerivel, quarante-quatre, six cent dix Indre
Rue Petite Biesse, Nantes
La Bretonnière à Casson
dix BIS rue des Boisiers
Rue Alfred Lallié au numéro quarante-quatre
neuf rue des Vingt Boisselées, quarante-quatre mille quatre cent cinquante La Chapelle-Basse-Mer
quatorze avenue d'Ouessant, quarante-quatre, zéro zéro zéro, Nantes
trois B route de Bouguenais, quarante-quatre, six cent vingt à La Montagne
Rue du Pas Guillaume, quarante-quatre mille deux cent quatre-vingt-dix Pierric
Boulevard François Blancho, quarante-quatre, deux cent vingt Couëron
Rue du Fleuve Amour, Carquefou
Impasse Bienvenue à Vallet
cent vingt-neuf chemin du Gorget
Rue de Billiou au numéro huit
dix-sept rue Artémis, quarante-quatre mille quatre cent soixante-dix Carquefou
six mille deux cent vingt-cinq rue de la Noë Gast, quarante-quatre, sept cent soixante-dix, Préfailles
quatre rue Saint-Méen, quarante-quatre, huit cent cinquante au Cellier
Route de Moraudeau, quarante-quatre mille sept cent soixante Les Moutiers-en-Retz
Avenue de la Haute Maillardière, quarante-quatre, deux cent cinquante Saint-Brevin-les-Pins
Rue Henri Delahaye, Vertou
Rue Jean-François de La Pérouse à Rezé
vingt-trois passage Saint-Yves
Route de l'Estran au numéro huit
neuf avenue de Samothrace, quarante-quatre mille Nantes
sept A rue Jean Tharaud, quarante-quatre, quatre cents, Rezé
cinq la Gâtine, quarante-quatre, trois cent quatre-vingt-dix à Nort-sur-Erdre
Allée du Parc des Mahaudières, quarante-quatre mille quatre cents Rezé
Avenue de la Ferrière, quarante-quatre, sept cents Orvault
Rue du Lieutenant Gaston Nicol, Le Pouliguen
Rue Tourmauvillain à Machecoul
neuf allée du Clos de Versailles
Impasse de la Bretonnière au numéro six
sept boulevard de la Croix Blanche, quarante-quatre mille six cent cinquante Legé
deux allée de la Bisquine, quarante-quatre, cinq cents, La Baule-Escoublac
quatre-vingt-dix-huit A rue F R de Chateaubriand, quarante-quatre, quatre cent soixante-dix à Carquefou
Route de Bressun, quarante-quatre mille cent soixante Pontchâteau
Impasse du Prazillon, quarante-quatre, six cents Saint-Nazaire
Rue du Marché Commun, Nantes
Rue Jean-Marie Perret à Trignac
quarante et un allée du Clos Farais
Allée des Touzelles au numéro vingt-quatre
cinquante-neuf rue Joseph Blanchart, quarante-quatre mille Nantes
trois cent cinq la Réauté, quarante-quatre, trois cent quatre-vingt-dix, Les Touches
sept mille quatre-vingt-treize rue Jean Gouzo, quarante-quatre, quatre cent quatre-vingt-dix au Croisic
Rue de la Noë Tremble, quarante-quatre mille deux cent vingt Couëron
Rue de la Lune d'Eau, quarante-quatre, zéro zéro zéro Nantes
Rue du Menec, Guérande
Impasse de la Châtellenie à Couëron
vingt-quatre boulevard Hennecart
Rue de Haute Perche au numéro trente-six BIS
soixante et un route de Crossac, quarante-quatre mille cent soixante Pontchâteau
vingt-cinq rue des Cormerais, quarante-quatre, huit cent dix, La Chevallerais
seize rue de la Lande Perrin, quarante-quatre, trois cent soixante au Temple-de-Bretagne
Rue de Winnipeg, quarante-quatre mille Nantes
Allée Pierre Broussonet, quarante-quatre, six cents Saint-Nazaire
Route de la Prévennerie, La Baule-Escoublac
Rue des Écoublères à Saint-Julien-de-Vouvantes
vingt-trois rue du Pinker
Avenue des Ibis au numéro six
vingt-sept rue des Goldens, quarante-quatre mille cent vingt Vertou
quinze le Moulin Roty, quarante-quatre, trois cent quatre-vingt-dix, Saffré
six rue Cavendish, quarante-quatre, sept cents à Orvault
Rue Jean Rouxel, quarante-quatre mille sept cents Orvault
Rue de la Rivetière, quarante-quatre, six cent quarante Saint-Jean-de-Boiseau
Rue du Traité de Paris, Pornic
Rue de Blandeau à Saint-Père-en-Retz
douze rue de Belledone
Chemin des Garniers au numéro quarante-deux
huit allée des Salicaires, quarante-quatre mille deux cent quarante La Chapelle-sur-Erdre
vingt avenue de la Gagnerie, quarante-quatre, cent quarante, Geneston
huit place Mauperthuis, quarante-quatre, cinq cent dix au Pouliguen
Rue du Patisseau, quarante-quatre mille neuf cent quatre-vingts Sainte-Luce-sur-Loire
Avenue du Pré du Ruisseau, quarante-quatre, cinq cents La Baule-Escoublac
Avenue Nungesser, Nantes
Rue de la Grée Saint-Jacques à Vritz
six TER rue Pierre Morin
Chemin du Bel Endroit au numéro trois
treize impasse Brochard, quarante-quatre mille Nantes
vingt-quatre route de la Noue, quarante-quatre, huit cent soixante, Saint-Aignan-Grandlieu
vingt-neuf rue du Clos Toreau, quarante-quatre, deux cent trente à Saint-Sébastien-sur-Loire
Route de la Bernerie, quarante-quatre mille sept cent soixante Les Moutiers-en-Retz
Rue de la Guichardière, quarante-quatre, sept cent soixante-dix La Plaine-sur-Mer
Place du Commandant Aubin, Rezé
Rue Joseph Barnave à Saint-Nazaire
quatorze chemin des Pontreaux
Boulevard de Launay au numéro dix-neuf B
deux cent trente rue de la Malorière, quarante-quatre mille quatre cent soixante-dix Mauves-sur-Loire
quarante-quatre rue de Ker-Houx, quarante-quatre, quatre cent quatre-vingt-dix, Le Croisic
seize rue Pierre Overney, quarante-quatre, trois cent quarante à Bouguenais
Rue des Ménardières, quarante-quatre mille cinq cent vingt Moisdon-la-Rivière
Cité Hector Pétin, quarante-quatre, cent soixante-dix Abbaretz
Allée du Haut Vignaud, La Chapelle-sur-Erdre
Rue Octave Rousseau à Rezé
trois route d'Aisne
Rue Deshoulières au numéro vingt-quatre
treize B route de Pont Caffino, quarante-quatre mille cent vingt Vertou
cinquante rue Amand Franco, quarante-quatre, cent dix, Châteaubriant
cent cinquante-quatre rue de la Raffardière, quarante-quatre, cent cinquante à Anetz
Rue du Brossis, quarante-quatre mille quatre cents Rezé
Route de la Lande d'Ust, quarante-quatre, cent dix-sept Saint-André-des-Eaux
Avenue Junon, Nantes
Rue Henri Loiret à Nantes
un allée du Terrier
La Milsandière au numéro trois cent vingt et un
vingt-quatre chemin de la Bridelais, quarante-quatre mille deux cent cinquante Saint-Brevin-les-Pins
soixante route de la Jouetterie Cresne, quarante-quatre, huit cent trente, Bouaye
deux cent dix-sept avenue des Merlettes, quarante-quatre, cinq cent vingt-deux à Mésanger
Rue du Mortrait, quarante-quatre mille quatre cents Rezé
Rue Haute Grande Rue, quarante-quatre, quatre cent quatre-vingt-dix Le Croisic
Allée Georges Rolland, Saint-Nazaire
Chemin du Moulinier à Haute-Goulaine
deux place de la Monnaie
Route de la Jonelière au numéro six
quatre rue de la Croix Barel, quarante-quatre mille cinq cent trente Guenrouet
douze rue du Pont Allard, quarante-quatre, six cent dix, Indre
mille soixante-quatorze chemin de la Nantaise, quarante-quatre, trois cent cinquante à Guérande
Rue du Plessis Allais, quarante-quatre mille deux cent dix Pornic
Rue des Gripôts, quarante-quatre, deux cent trente Saint-Sébastien-sur-Loire
Route de Kerpiraud, Guérande
Cour des Petits Pavés à Bouguenais
treize avenue de la Michelière
Avenue du Patis Vert au numéro soixante-douze
onze avenue de Cavaro, quarante-quatre mille trois cent quatre-vingts Pornichet
vingt-six rue du Petit Anjou, quarante-quatre, deux cent trente, Saint-Sébastien-sur-Loire
vingt-neuf rue Paul Griveaud, quarante-quatre, zéro zéro zéro à Nantes
Route de la Pree, quarante-quatre mille sept cent soixante-dix La Plaine-sur-Mer
Rue Paul Lesage, quarante-quatre, cinq cent dix Le Pouliguen
Rue de Beau-Soleil, Bouguenais
Rue du Petit Choisy à Rezé
deux mille six cent soixante-cinq rue de Bréveneux
Rue Jean du Plessis de Grenedan au numéro quatorze
vingt-huit impasse de Chantilly, quarante-quatre mille trois cent quatre-vingt-dix Nort-sur-Erdre
six B passage Proutier, quarante-quatre, zéro zéro zéro, Nantes
trois rue du Coteau de la Robinière, quarante-quatre, quatre cent soixante-dix à Thouaré-sur-Loire
Rue de l'Ouche Bignon, quarante-quatre mille Nantes
Rue Marion Cahour, quarante-quatre, quatre cents Rezé
Avenue du Mortier, Saint-Géréon
Rue de l'Île d'Yeu à Guérande
cent vingt-cinq rue des Goffedins
Boulevard des Nations Unies au numéro sept
six chemin du Padibon, quarante-quatre mille six cent quatre-vingts Sainte-Pazanne
vingt-cinq rue du Pont de l'Angle, quarante-quatre, cent soixante, Besné
quatorze rue Préfet Bonnefoy, quarante-quatre, zéro zéro zéro à Nantes
Rue de l'Ouchette, quarante-quatre mille Nantes
Rue des Bourderies, quarante-quatre, zéro zéro zéro Nantes
Avenue de la Havane, Saint-Nazaire
Rue du Pont Marchand à Orvault
cinq impasse du Pâtis de la Bouteillerie
Messan au numéro huit
cinquante rue Fontaine de Barbin, quarante-quatre mille Nantes
deux rue des Rouzins, quarante-quatre, quatre cent quatre-vingt-dix, Le Croisic
quinze allée Louis Delluc, quarante-quatre, six cents à Saint-Nazaire
Avenue du Clos du Cens, quarante-quatre mille Nantes
Rue des Vinaigriers, quarante-quatre, cent cinquante Ancenis
Route de la Frelaudais, Blain
Allée Michel à Saint-Brevin-les-Pins
quatre place du Pé de Buzay
Allée Clara Schumann au numéro sept BIS
vingt et un rue des Tannins, quarante-quatre mille quatre cent soixante Saint-Nicolas-de-Redon
dix rue de l'Abbé Souchay, quarante-quatre, cinq cent quatre-vingt-dix, Derval
un rue du Béziau, quarante-quatre, six cent quatre-vingts à Chéméré
Rue du Cormier Rouge, quarante-quatre mille trois cent dix Saint-Philbert-de-Grand-Lieu
Route d'Ermur, quarante-quatre, trois cent quatre-vingts Pornichet
Route de Saint-Fiacre, Vertou
Avenue Josselin à La Baule-Escoublac
quatre rue du Saule Blanc
Rue du Rouchais au numéro dix
quarante-sept rue René Halluard, quarante-quatre mille six cents Saint-Nazaire
quatre chemin de la Pierre Percée, quarante-quatre, zéro zéro zéro, Nantes
six rue de la Guindonnière, quarante-quatre, huit cent quarante aux Sorinières
Venelle Wangari Muta Maathai, quarante-quatre mille Nantes
Rue Marcel Schwob, quarante-quatre, zéro zéro zéro Nantes
Avenue de Villandry, Carquefou
Rue de la Bourrelière à Haute-Goulaine
onze avenue de la Valtaiserie
Rue de la Bourdaillerie au numéro vingt-deux
trente-neuf avenue des trois Mousquetaires, quarante-quatre mille Nantes
