deux rue d'Arlande, zéro sept, trois cents, Tournon-sur-Rhône
soixante-dix-neuf impasse des Maures, zéro sept, trois cent quarante à Peaugres
Route de la Patelle, zéro sept, trois cent soixante-dix Eclassan
Chemin de Liverset, zéro sept, trois cents Cheminas
Rue André Philip, Privas
Rue Albert Seibel à Aubenas
neuf rue Pierre Bonnet
Place Yvonne et Madelaine Testud au numéro six
trente-quatre allée du Muscat, zéro sept, cent Saint-Marcel-lès-Annonay
cent cinquante-cinq D traverse du Bosquet, zéro sept, deux cents, Saint-Étienne-de-Fontbellon
cinquante-deux avenue Helvetia, zéro sept, trois cent quarante à Serrières
Route de Saint-Sauveur, zéro sept, trois cent soixante Les Ollières-sur-Eyrieux
Rue Raoul Dufy, zéro sept, trois cents Tournon-sur-Rhône
Impasse des Cholettes, Saint-Jean-de-Muzols
Rue Lavilleon à Tournon-sur-Rhône
cent dix chemin de la Boulade
Rue de Chanaly au numéro seize
six allée des Péchers, zéro sept, huit cents La Voulte-sur-Rhône
cinq C chemin de la Charreyrasse, zéro sept, deux cents, Aubenas
deux cent soixante-deux chemin des Guillottes, zéro sept, cent à Boulieu-lès-Annonay
Rue de la Ciboulette, zéro sept, huit cents La Voulte-sur-Rhône
Impasse de Richard, zéro sept, deux cents Lachapelle-sous-Aubenas
Lotissement Les Terrasses de Laoul, Bourg-Saint-Andéol
Chemin de Chapouillère à Chauzon
deux cent quarante-neuf chemin de la Côte Sainte-Épine
Rue de Baza au numéro sept
vingt-cinq A calle de la Forge, zéro sept, cent cinquante Salavas
sept rue Lorion-Blachère, zéro sept, cent cinquante, Vallon-Pont-d'Arc
cinq rue d'Orange, zéro sept, trois cent quarante à Peyraud
Route des Fonds de Maclan, zéro sept, trois cent quarante Peaugres
Chemin de l'Arbre, zéro sept, zéro zéro zéro Saint-Julien-en-Saint-Alban
Chemin de Garaud, Les Ollières-sur-Eyrieux
Place de Saint-Jean à Champagne
deux cent trente-cinq impasse de la Revicole
Route de Chere au numéro sept cent trente-cinq
deux cent quatre rue Thomas Edison, zéro sept, cinq cents Guilherand-Granges
cent six C rue Sarah Bernhardt, zéro sept, quatre cent trente, Davézieux
huit place du Pontet, zéro sept, deux cent quatre-vingt-dix à Quintenas
Rue de l'Ancien Hôpital, zéro sept, zéro zéro zéro Privas
Rue des Terres, zéro sept, cent Roiffieux
Chemin des Pras, Bogy
Chemin des Ayvides à Barnas
cent quatre-vingt-un chemin de Cailles-Terres
Impasse du Bres au numéro sept
deux cent quatre-vingt-dix chemin de la Crouzette, zéro sept, cent trente Soyons
neuf cent trente-deux chemin des Hauches de Tourton, zéro sept, quatre cent trente, Savas
cent chemin des Garots, zéro sept, cent soixante à Saint-Jean-Roure
Place du Chateau, zéro sept, six cents Vals-les-Bains
Route de Maclas, zéro sept, trois cent quarante Félines
Chemin de la Grosse Roche, Quintenas
Allée du Nova à Saint-Marcel-lès-Annonay
dix-sept rue des Terrasses du Rhône
Impasse Petit Mistra au numéro cent
cent cinq chemin de Ribal, zéro sept, trois cent quatre-vingts Pont-de-Labeaume
sept impasse du Couderc, zéro sept, trois cent trente, Thueyts
quatre place des Gauds, zéro sept, deux cent quatre-vingt-dix à Satillieu
Rue du Vieux Champis, zéro sept, quatre cent quarante Champis
Rue Béranger de la Tour, zéro sept, deux cents Aubenas
Rue François Valleton, Aubenas
Place du Marche à Pont-de-Labeaume
cent quatre-vingt-dix lotissement Le Grand Chemin
Chemin de Siveyrac au numéro deux cent cinquante-huit
deux rue Lachanal, zéro sept, trois cents Tournon-sur-Rhône
quatre-vingt-dix rue des Margirands, zéro sept, trois cent quarante, Saint-Désirat
soixante chemin de Prachy, zéro sept, zéro zéro zéro à Coux
Place Maxime Chantier, zéro sept, trois cent quarante Andance
Allée des Buis, zéro sept, cent cinquante Salavas
Route du Masson, Eclassan
Impasse de l'Estrade à Thueyts
neuf rue des Sarments
Boulevard des Foulons au numéro deux cent sept
quatre cent quarante-quatre chemin de Croze, zéro sept, quatre cents Rochemaure
douze impasse des Boscs, zéro sept, quatre cent trente, Vernosc-lès-Annonay
six cent quarante route de Barret, zéro sept, trois cent soixante-dix à Eclassan
Impasse du Vignal, zéro sept, trois cent trente Thueyts
Rue de la Montée du Château, zéro sept, trois cent quarante Peyraud
Chemin de Biguet, Saint-Romain-de-Lerps
Allée des Hautes Freydières à Soyons
soixante-deux route de Biérat
Allée de Plein Ciel au numéro quatre
cent quarante chemin de la Jaubernie, zéro sept, zéro zéro zéro Coux
deux rue Maryse Dufour, zéro sept, quatre cent dix, Saint-Félicien
quarante B impasse du Clos de Picatou, zéro sept, six cent dix à Lemps
Rue des Gareurs, zéro sept, trois cent soixante-dix Sarras
Chemin des Défendues, zéro sept, quatre cent dix Saint-Félicien
Place Paul Sévin, Tournon-sur-Rhône
Allée Les Hauts du Mialan à Saint-Péray
six BIS rue Victor Camille Artige
Chemin de Chauvière au numéro sept cent quatorze
soixante-cinq rue des Payas, zéro sept, trois cents Étables
quatre cent quatre-vingt-cinq chemin de la Garina, zéro sept, quatre cent quarante, Champis
deux cent quatre-vingt-quinze chemin du Moutet, zéro sept, trois cent trente à Thueyts
Calle du Drapier, zéro sept, quatre cent quarante Boffres
Chemin de la Source du Parc, zéro sept, six cents Vals-les-Bains
Rue de Plein Sud, Davézieux
Rue Louis Billion à Privas
soixante et onze route de Mouras
Place Voltaire au numéro quatre
deux cent cinquante-trois rue de Joannard, zéro sept, cent Saint-Marcel-lès-Annonay
quatre cent cinquante-cinq chemin de Chabrières, zéro sept, zéro zéro zéro, Coux
cent vingt allée du Clos du Morier, zéro sept, deux cent quatre-vingt-dix à Saint-Romain-d'Ay
Route des Fumades, zéro sept, deux cent soixante Joyeuse
Chemin des Pironnes, zéro sept, cent Boulieu-lès-Annonay
Rue François Lauzun, Bourg-Saint-Andéol
Rue Albert Schweitzer à Annonay
deux cent soixante-quinze A chemin de la Reynarde
Route de Tourton au numéro huit cent soixante-six
soixante-dix route de la Grand Font, zéro sept, trois cent trente Thueyts
deux rue Gaschet, zéro sept, trois cent trente, Thueyts
quatre place du Terras, zéro sept, trois cent trente à Thueyts
Chemin de Chanteperdrix, zéro sept, cent trente Saint-Romain-de-Lerps
Rue des Mouillas, zéro sept, deux cent cinquante Le Pouzin
Rue du Docteur Boissin, Saint-Alban-Auriolles
Chemin de Chapotte à Tournon-sur-Rhône
quinze rue de l'École Privée
Place de l'Alambic au numéro cinq
trois cent cinquante-cinq route de Jaloine, zéro sept, deux cent quatre-vingt-dix Saint-Romain-d'Ay
deux cent soixante-sept chemin des Fontanilles, zéro sept, cent, Boulieu-lès-Annonay
quatre-vingt-deux E montée des Bornes, zéro sept, cent à Saint-Marcel-lès-Annonay
Impasse des Côteaux de l'Ardeche, zéro sept, sept cents Saint-Just-d'Ardèche
Passage Pont Arnaud, zéro sept, cent Annonay
Place Barbiere, Désaignes
Impasse Haute Viale à Ozon
trente et un chemin de la Temple
Chemin de Lapra au numéro soixante-douze
cent quinze chemin de Marinette, zéro sept, trois cent quarante Andance
un rue Surel, zéro sept, sept cents, Bourg-Saint-Andéol
dix C rue Auguste Bravais, zéro sept, cent à Annonay
Rue de la Micheline, zéro sept, deux cents Vogüé
Rue Frère Jean, zéro sept, zéro zéro zéro Saint-Julien-en-Saint-Alban
Rue Croix du Cros, Saint-Clair
Chemin de Guillaume à Quintenas
mille deux cents chemin du Besset
Route de la Cheze au numéro trois cent quarante-cinq
cent soixante rue des Tireuses de Soie, zéro sept, cent soixante-dix Lavilledieu
soixante-cinq chemin du Vieux Chêne, zéro sept, trois cent quarante, Talencieux
un place F. Cheyron, zéro sept, deux cents à Vogüé
Route du Creux de Char, zéro sept, cent trente Toulaud
Chemin de la Chave, zéro sept, cent trente Saint-Romain-de-Lerps
RTE DU STADE, Mariac
Rue Coutarel à Bourg-Saint-Andéol
soixante-cinq avenue de Sierre
Place de la Grenette au numéro dix
quatre las Solelhades, zéro sept, cent quarante Les Vans
soixante-quinze impasse du Grand Col, zéro sept, cent dix, Vinezac
trois cent vingt chemin de Serrecourt, zéro sept, trois cent trente à Thueyts
Route de Pailharès, zéro sept, quatre cent dix Saint-Félicien
Rue Pierres Vieilles, zéro sept, zéro zéro zéro Privas
Rue Henri Abel, Vernoux-en-Vivarais
Place des Rameaux à Serrières
cent vingt-cinq rue du Viognier
Rue du Silence au numéro trente
quatre rue du Paturel, zéro sept, trois cents Tournon-sur-Rhône
six chemin de la Fredeira, zéro sept, deux cents, Aubenas
vingt-cinq place de Salivas, zéro sept, cent à Saint-Marcel-lès-Annonay
Route d'Éclassan, zéro sept, trois cent soixante-dix Eclassan
Place Colonel Tourre, zéro sept, cent vingt Ruoms
CHE DE PRASSIMAC, Mariac
Avenue du onze Novembre mille neuf cent dix-huit au Teil
quatre cent soixante-quinze chemin de Pairard
Chemin des Rasis au numéro deux cent un B
cent quinze impasse du Grand Courin, zéro sept, quatre cent dix Saint-Félicien
quinze chemin de la Bessie, zéro sept, deux cent quatre-vingt-dix, Satillieu
trente et un rue du Rond, zéro sept, quatre cent trente à Saint-Cyr
Chemin de Lafarge, zéro sept, zéro zéro zéro Privas
Route des Chaux et de Contreau, zéro sept, six cent dix Sécheras
Chemin de la Chareyre, Thueyts
Avenue du Lumas à Cruas
deux impasse Robert Jean-Pierre
Chemin du Berthier au numéro cent quarante-cinq
trois rue Jourdan, zéro sept, deux cents Aubenas
soixante-cinq rue de la Chapelle de Lucquet, zéro sept, cent trente, Toulaud
cinquante-cinq chemin de Montpeyroux, zéro sept, quatre cent dix à Saint-Félicien
Chemin des Ramades, zéro sept, deux cents Lachapelle-sous-Aubenas
Rue des Candilles, zéro sept, cent trente Soyons
Allée de Montplaisir, Charmes-sur-Rhône
Impasse Camille Saint-Saëns à Davézieux
trois impasse Ferrachat
Chemin du Cros de Bouttier au numéro cent
quatre-vingt-quatre chemin de la Devière, zéro sept, trois cent cinquante Cruas
onze rue du Docteur Escoffier, zéro sept, quatre cent trente, Saint-Clair
deux cents avenue des Valérianes, zéro sept, zéro zéro zéro à Privas
Chemin de Vinchannes, zéro sept, deux cent soixante Joyeuse
Chemin de Villard, zéro sept, trois cents Tournon-sur-Rhône
Impasse Tournette, Bourg-Saint-Andéol
Chemin des Bros à Coux
quarante-neuf rue des Garottes
Chemin de Romanet au numéro quatre-vingt-cinq
quatre-vingt-dix ruelle des Amblards, zéro sept, cent soixante-dix Lussas
cinq rue Simon Julien, zéro sept, zéro zéro zéro, Privas
cent soixante route de Champal, zéro sept, trois cent soixante-dix à Eclassan
Rue de Plantade, zéro sept, trois cent soixante-dix Arras-sur-Rhône
Chemin de la Grange de Gay, zéro sept, cent Saint-Marcel-lès-Annonay
Impasse Guy Vendran, Le Teil
Chemin du Pas de Mialan à Toulaud
quatre-vingt-dix-neuf chemin des Rouvieres
Rue Maxime Pépin au numéro quatre
vingt-cinq route du Fez, zéro sept, cent dix Vinezac
neuf avenue de Stalingrad, zéro sept, cent, Annonay
vingt impasse de l'Ay, zéro sept, deux cent quatre-vingt-dix à Ardoix
Rue de l'Églantine, zéro sept, quatre cent trente Saint-Cyr
Rue du Baïn, zéro sept, deux cent dix Alissas
Chemin de Robert le Diable, Coux
Rue Paul Bourget à Peaugres
quarante route de Chaudons
Calade du Pont au numéro cent vingt
onze rue Édouard Joubert, zéro sept, trois cents Tournon-sur-Rhône
trois cent quatre-vingts route de Brenieux, zéro sept, deux cent quatre-vingt-dix, Quintenas
trois cent trente-cinq rTE DE RIBEFAITE, zéro sept, cent soixante à Mariac
Rue du Docteur Chalvet, zéro sept, cent vingt Saint-Alban-Auriolles
Chemin de la Petite Vigne, zéro sept, six cent dix Lemps
Route de la Seauve, Toulaud
Route de Ladou à Saint-Andéol-de-Berg
cinq cent quatre-vingt-onze route de la Charelle
Chemin de Gouny au numéro cent vingt-quatre
quatre cent cinq chemin de Brus, zéro sept, zéro zéro zéro Coux
trois mille sept cents route de Novid, zéro sept, cent, Roiffieux
un cHE DU PLANTIER, zéro sept, deux cents à Ucel
Chemin du Suc de la Garde, zéro sept, trois cent quarante Bogy
Chemin de Montagne, zéro sept, deux cent quarante Vernoux-en-Vivarais
Place de Cance, Annonay
Rue Jean-Baptiste Marcet à Annonay
trois allée Pierre de Coubertin
Rue de Brèze au numéro quatre-vingt-six
cent trente-cinq chemin du Bas de la Roche, zéro sept, cent soixante-dix Lussas
douze rue du Chantou, zéro sept, cent dix, Vinezac
six mille deux cent quarante-cinq qrt Saint-Pierre, zéro sept, quatre cents au Teil
Allée du Grand Page, zéro sept, cinq cents Guilherand-Granges
Rue Abbé Pierre, zéro sept, cent trente Saint-Péray
Chemin de la Croix de l'Houme, Thueyts
Chemin du Grand Cypres à Pont-de-Labeaume
six allée de Farlaix
Rue des Bouviers au numéro neuf BIS
soixante-cinq rue du Dolmen, zéro sept, cent vingt Saint-Alban-Auriolles
un lotissement Les Lavandes Allée un, zéro sept, deux cents, Saint-Sernin
quarante rue de Saint-Étienne, zéro sept, quatre cent trente à Savas
Route du Quatrième Spahis, zéro sept, cent Annonay
Chemin du Bois de Bressieux, zéro sept, cent trente Saint-Romain-de-Lerps
Chemin de Courbine, Saint-Sauveur-de-Montagut
Rue de l'Amiral à La Voulte-sur-Rhône
un chemin Sous le Thym
Route Départementale N° deux cent soixante-sept au numéro huit cent quatre-vingt-onze
un rue Muzard, zéro sept, cent Boulieu-lès-Annonay
cent soixante-treize allée du Viognier, zéro sept, cent, Saint-Marcel-lès-Annonay
quarante-sept allée Germain Soufflot, zéro sept, cinq cents à Guilherand-Granges
Route de Vias, zéro sept, trois cent quarante Peaugres
Place Fernand Vinson, zéro sept, zéro zéro zéro Saint-Julien-en-Saint-Alban
Rue des Massorts, Lamastre
Route de Saint-Sylvestre à Saint-Romain-de-Lerps
cinq route de la Voulte
Rue des Fossés du Champ au numéro deux
six impasse de Costerue, zéro sept, cent soixante Le Cheylard
un impasse de Mars, zéro sept, quatre cents, Le Teil
dix-huit lotissement Lot Les Lavandes Allée deux, zéro sept, deux cents à Saint-Sernin
Route de la Breure, zéro sept, trois cent soixante Les Ollières-sur-Eyrieux
Chemin des Pierres Hautes, zéro sept, cent soixante-dix Lavilledieu
Chemin des Rouvières, Lavilledieu
Rue Henri Boyer au Teil
treize allée des Vergers du Villard
Rue de Pré Conta au numéro cent sept
cent soixante-quinze rue du Marquis du Fauré, zéro sept, deux cent quatre-vingt-dix Satillieu
vingt chemin de Peyrache, zéro sept, zéro zéro zéro, Coux
soixante allée des Tulipes, zéro sept, cent trente à Soyons
Impasse de Cézanne, zéro sept, trois cent quarante Charnas
Rue de la Pize, zéro sept, cent soixante Le Cheylard
Chemin du Couturier, Étables
Chemin de Brogieux à Roiffieux
treize place Parmentier
Route de Dragonnet au numéro cent soixante
quinze route du Pont Romain, zéro sept, deux cent cinquante Le Pouzin
mille deux cent quinze A route du Pinet, zéro sept, cent trente, Toulaud
deux cent dix route de Larin Le Haut, zéro sept, trois cent quarante à Félines
Chemin de Roumanie, zéro sept, huit cents La Voulte-sur-Rhône
Rue Louis Victor Allier, zéro sept, cent trente Saint-Péray
Allée de la Syrah, Saint-Marcel-lès-Annonay
Rue des Bragalons au Teil
cinq allée de la Briale
Chemin de Riol au numéro trente
vingt-six rue de Chalaix, zéro sept, trois cents Mauves
six mille cent cinquante-trois chemin de Chantegay, zéro sept, cent quarante, Les Vans
cinq passage de la Terrasse, zéro sept, trois cents à Tournon-sur-Rhône
Chemin de Tourtouans, zéro sept, zéro zéro zéro Privas
Impasse des Prés du Mouchet, zéro sept, cent trente Toulaud
Chemin de Misery, Sécheras
Route de la Vignasse à Toulaud
quarante-six rue Victor Baltard
Chemin de Jean-François au numéro cent soixante-quinze
vingt-six impasse Jean Monnet, zéro sept, deux cents Aubenas
cinquante impasse de Bourgène, zéro sept, cent vingt, Saint-Alban-Auriolles
douze impasse Benjamin Franklin, zéro sept, cinq cents à Guilherand-Granges
Route de la Tuilière, zéro sept, six cent dix Lemps
Chemin de Vivier, zéro sept, cent trente Saint-Romain-de-Lerps
Chemin de Sarlin, Étables
Rue de la Béguette à Saint-Barthélemy-le-Plain
quatre-vingt-quinze chemin de la Béllière
Chemin de Champagnac au numéro six cent quatre-vingt-dix
quinze chemin de la Croix de Brige, zéro sept, trois cent trente Thueyts
vingt-trois rue Alphonse Franc, zéro sept, cent, Annonay
trois cent cinquante-cinq rue de Masse, zéro sept, deux cent quatre-vingt-dix à Ardoix
Chemin des Goules, zéro sept, trois cents Tournon-sur-Rhône
Place Léopold Ollier, zéro sept, cent quarante Les Vans
Rue Auguste Bouchet, Aubenas
Chemin des Amblards à Lussas
quatre impasse du Combeau
Impasse Ravi au numéro cent vingt B
quarante-cinq route de Cheminas, zéro sept, six cent dix Sécheras
deux cent quatre-vingts chemin de Pampelonne, zéro sept, zéro zéro zéro, Saint-Julien-en-Saint-Alban
un rUE DE RAVEYRON, zéro sept, cent cinquante à Vallon-Pont-d'Arc
Rue des Rabières, zéro sept, deux cents Lanas
Impasse de la Combette, zéro sept, quatre cent trente Davézieux
Rue des Bas Ilons, Cruas
Rue du cinq Juillet mille neuf cent quarante-quatre au Cheylard
cent soixante impasse du Cros de Biguet
Chemin des Promeneurs au numéro dix
sept rue Marc Sauzet, zéro sept, trois cents Tournon-sur-Rhône
trois cent trente-cinq rue des Dévideuses, zéro sept, cent soixante-dix, Lavilledieu
vingt-sept faubourg la Cire, zéro sept, deux cent vingt à Viviers
Route de Marcland, zéro sept, cent Roiffieux
Rue des Chazettes, zéro sept, deux cent dix Saint-Symphorien-sous-Chomérac
Chemin d'Aurives, Le Cheylard
Chemin du Riou de Vel à Saint-Georges-les-Bains
six mille seize place du Monument Aux Morts
Chemin des Cluzeaux au numéro cent dix TER
deux place des Chrysanthemes, zéro sept, trois cent cinquante Cruas
deux allée de l'Ardoise, zéro sept, cent trente, Soyons
onze allée des Brémondières, zéro sept, cent trente à Saint-Péray
Impasse de l'Eygue, zéro sept, quatre cents Rochemaure
Route de Bramefond, zéro sept, deux cents Ucel
Impasse de la Condamine, Lavilledieu
Rue des Vignes du Médecin à Davézieux
neuf boulevard de Lachaud
Avenue Jean Jaurés au numéro soixante-dix
sept rue du Porte de l'Oie, zéro sept, cent quarante Les Vans
mille cinq cent quatre-vingt-cinq route Nationale quatre-vingt-six, zéro sept, six cent dix, Vion
un route du Gué, zéro sept, deux cents à Ucel
IMP ARMAND PUAUX, zéro sept, cent cinquante Vallon-Pont-d'Arc
Chemin des Eymards, zéro sept, trois cent trente Thueyts
Chemin du Petit Saint-Just, Tournon-sur-Rhône
Route de Minodier à Ardoix
cent soixante-quatorze rue Lazare Durif
Chemin de la Côte de Fontbonne au numéro vingt-deux
quatre-vingt-cinq allée de Maure, zéro sept, deux cent quatre-vingt-dix Quintenas
cent trente-cinq route de Saint-Laurent En Coiron, zéro sept, cent soixante-dix, Lussas
dix-huit rue Jean-Baptiste Bechetoille, zéro sept, cent à Annonay
Ruelle de l'Eyrieux, zéro sept, trois cent soixante Les Ollières-sur-Eyrieux
Chemin des Helviens, zéro sept, quatre cents Le Teil
Lotissement Le Pré des Saints, Saint-Cyr
Impasse Cornaire à Soyons
cent trente chemin des Roquelles
Allée du Vallon de Jaloine au numéro cent vingt
cent dix rue de Lavoir, zéro sept, trois cent soixante-dix Eclassan
quarante allée du Suchet, zéro sept, deux cent quatre-vingt-dix, Saint-Romain-d'Ay
quatre cent cinq chemin du Chazalet, zéro sept, trois cent trente à Mayres
Route de Saint-Cyr, zéro sept, quatre cent trente Vernosc-lès-Annonay
Rue de l'Huile, zéro sept, trois cents Tournon-sur-Rhône
Rue de la Passerelle d'Auzon, Joyeuse
Boulevard Charles De Gaulle à Guilherand-Granges
deux place du Martouret
Rue Paul Girard au numéro sept
vingt ruelle du Robinet, zéro sept, trois cent soixante Les Ollières-sur-Eyrieux
trente passage des Valérianes, zéro sept, zéro zéro zéro, Privas
trois mille neuf cent quarante-cinq chemin Ancienne Rn, zéro sept, quatre cents à Aubignas
Impasse de la Glorie, zéro sept, cent soixante Le Cheylard
Route de Saint-Romain d'Ay, zéro sept, deux cent quatre-vingt-dix Ardoix
Rue de Labrot, Mauves
Rue de Grangevieille à Cruas
deux chemin de Chante Love
Impasse du Roudillon au numéro cinq
soixante-quatre route des Guénettes, zéro sept, trois cent quarante Peaugres
cinquante-trois route de la Cotte du Nay, zéro sept, trois cent quarante, Charnas
cinquante-deux rue de Boulieu, zéro sept, quatre cent trente à Davézieux
Impasse Noël Claret, zéro sept, deux cent dix Baix
RTE DE LA FAYE, zéro sept, cent soixante Mariac
Rue Saint-Prix Barou, Annonay
Impasse du Pradet à Lachapelle-sous-Aubenas
un chemin du Mercoire
Rue Clotilde de Surville au numéro douze
vingt-huit rue du Virou, zéro sept, cent Roiffieux
six rue Perrin, zéro sept, trois cents, Tournon-sur-Rhône
deux place du Berger, zéro sept, trois cents à Glun
Côte du Pouly, zéro sept, six cent dix Lemps
Chemin du Ron de Ceila, zéro sept, deux cents Aubenas
Route des Bruyères, Ardoix
Rue de la Place Saléon Terras au Cheylard
un chemin de la Riaille
Chemin des Riailles au numéro deux cent vingt
mille trente chemin de Forasson, zéro sept, trois cents Saint-Barthélemy-le-Plain
onze chemin de Desvaux, zéro sept, quatre cents, Le Teil
mille deux cent quarante route de Théolier, zéro sept, trois cents à Cheminas
Rue de l'Arbre de Sully, zéro sept, trois cents Étables
Route de Fontgarenne, zéro sept, trois cent soixante-dix Eclassan
Rue de la Traverse, Toulaud
Chemin du Gaz à Aubenas
six mille sept cent cinquante-huit rue des Trémolets
Avenue de Privas au numéro dix-sept
sept escalier de la Traverse, zéro sept, cent Roiffieux
cent quinze allée des Mûriers, zéro sept, cent soixante-dix, Lavilledieu
trois cent quatre-vingt-dix chemin de Rimbeau, zéro sept, cent vingt à Pradons
Rue des Rouchas, zéro sept, cent dix Laurac-en-Vivarais
Chemin du Logis du Roi, zéro sept, zéro zéro zéro Privas
Allée Hippolyte Bernéra, Saint-Péray
Passage Verbeurgt à Tournon-sur-Rhône
deux cent soixante-quinze route du Ternay
Allée du Moulin au numéro huit cent soixante-dix-neuf
cent quatre-vingt-quinze chemin de la Tourasse, zéro sept, deux cents Saint-Didier-sous-Aubenas
huit cent quatre-vingt-quinze route du Coulet, zéro sept, cent soixante, Le Cheylard
deux place des Basses Rues, zéro sept, cent trente à Cornas
Route de Brintenas, zéro sept, quatre cent dix Saint-Félicien
Route des Compagnons, zéro sept, cent Boulieu-lès-Annonay
Rue du Général Vincent, Davézieux
Route des Mouleyres à Thueyts
trente rue Frédéric Nodin
Chemin de la Noyère au numéro cent vingt
cent dix impasse des Bois, zéro sept, trois cent quarante Talencieux
cent vingt-cinq chemin du Vignet, zéro sept, deux cent quatre-vingt-dix, Quintenas
cent cinq route de Philipon, zéro sept, quatre cent dix à Saint-Félicien
Impasse du Vigneau, zéro sept, trois cents Saint-Jean-de-Muzols
Le Belvédère, zéro sept, huit cents Charmes-sur-Rhône
Passage de l'Ancien Théâtre, Privas
Rue Croix du Roure à Privas
cinquante rUE DES IRIS
Chemin de Greignac au numéro trente et un
quatre-vingt-quinze impasse Cassagne, zéro sept, cent vingt Saint-Alban-Auriolles
trois cents chemin de Chalendon, zéro sept, trois cents, Saint-Barthélemy-le-Plain
deux mille deux cent soixante-dix route du Deves, zéro sept, cent cinquante à Salavas
Chemin de Chirol, zéro sept, cent Saint-Marcel-lès-Annonay
Route de Mantelin, zéro sept, trois cent quarante Brossainc
Corniche de la Cigale, Saint-Clair
Route des Chalayes à Toulaud
quarante-cinq chemin du Tour des Rieux
Chemin de la Vallée des Eygas au numéro deux mille six cents
deux chemin de Côte Chaude, zéro sept, six cents Vals-les-Bains
dix-huit avenue Marc Bouvat, zéro sept, cent trente, Saint-Péray
six mille soixante-dix-sept rue Sarmejeane, zéro sept, cent quarante aux Vans
Allée de la Sauge, zéro sept, huit cents La Voulte-sur-Rhône
Chemin Sainte-Croix, zéro sept, sept cents Bourg-Saint-Andéol
Chemin de Bonnet, Saint-Barthélemy-le-Plain
Rue de l'École Publique à Ardoix
un impasse du Condoye
Rue Les Quatre Soleils au numéro deux cents
deux rue de la Coquille, zéro sept, cent dix Largentière
soixante-quinze lotissement Le Pêcher, zéro sept, trois cent soixante-dix, Eclassan
vingt impasse Cécilien Béolet, zéro sept, deux cent quatre-vingt-dix à Ardoix
Chemin de la Bâtie, zéro sept, quatre cent quarante Champis
Chemin de Pauchelon, zéro sept, cent soixante Saint-Jean-Roure
Impasse de la Branche, Coux
Chemin des Rimbeaux à Saint-Étienne-de-Fontbellon
deux rue de Farlaix
Rue Diane de Poitiers au numéro six
soixante-dix impasse Sous La Roche, zéro sept, trois cent trente Thueyts
huit avenue de Cesenatico, zéro sept, deux cents, Aubenas
deux cent quatre-vingts B chemin du Servidal, zéro sept, deux cents à Lachapelle-sous-Aubenas
CHE DU FEZ, zéro sept, cent cinquante Vallon-Pont-d'Arc
Rue du Platou, zéro sept, cent Saint-Marcel-lès-Annonay
Ruelle de la Chareyre, Les Ollières-sur-Eyrieux
Chemin du Bouvier à Satillieu
six mille deux cent cinquante qrt Le Pont Neuf
Avenue André Chabanel au numéro cinq
dix impasse de la Coste, zéro sept, trois cent trente Thueyts
quatre venelle des Celliers, zéro sept, zéro zéro zéro, Saint-Julien-en-Saint-Alban
trois cent vingt chemin d'Avenas, zéro sept, cent soixante à Saint-Jean-Roure
Chemin de Roubiac, zéro sept, quatre cent quarante Champis
Montée de Barès, zéro sept, deux cents Lanas
Chemin de Belieu, Colombier-le-Vieux
Montée du Bois Vert à Ucel
cinquante-cinq chemin de Bonnevie
Avenue Pierre Brossolette au numéro six
quatre-vingt-quinze chemin de la Valette, zéro sept, cent trente Saint-Romain-de-Lerps
six mille six cent quatre-vingts rue du Pont Sicard, zéro sept, deux cent dix, Chomérac
quarante chemin de la Vallonière, zéro sept, cent à Saint-Marcel-lès-Annonay
Route d'Autuche, zéro sept, six cents Vals-les-Bains
Rue Les Ramières, zéro sept, huit cents Beauchastel
Rue Jacques Monod, Guilherand-Granges
