Rue Jean-Gabriel Goulinat, Montauban
Avenue de Mansonville à Lavit
trois allée du Marché
Rue de l'Inondation de mille neuf cent trente au numéro trente-six
cent trente-deux chemin de Trelissac, quatre-vingt-deux mille Montauban
cinq cent vingt-sept chemin des Najats, quatre-vingt-deux, six cents, Verdun-sur-Garonne
trois cent quatre-vingt-dix chemin du Biarnais, quatre-vingt-deux, cent trente à L'Honor-de-Cos
Chemin des Maynards, quatre-vingt-deux mille quatre cent dix Saint-Étienne-de-Tulmont
Avenue Hugues quatre de Cardaillac, quatre-vingt-deux, huit cents Bioule
Route de Leojac, Saint-Étienne-de-Tulmont
Impasse Frappât à Montech
cinquante-deux impasse de Camp de Cournes
Avenue du Sarlac au numéro quinze
cent quarante-quatre chemin du Roudié, quatre-vingt-deux mille trois cent soixante-dix Orgueil
quatre rue Marius Barbarou, quatre-vingt-deux, deux cents, Moissac
six rue Guilhem Peyre, quatre-vingt-deux, cent quarante à Saint-Antonin-Noble-Val
Côte de Pignols, quatre-vingt-deux mille deux cents Moissac
Chemin de la Fontaine de Paris, quatre-vingt-deux, six cents Verdun-sur-Garonne
Avenue Louis Resses, Montaigu-de-Quercy
Chemin de Lapeyrière à Dieupentale
cent quarante-cinq impasse de Fromant
Rue Paul Darasse au numéro trois
trois rue de Loria, quatre-vingt-deux mille sept cent dix Bressols
quatre petite Rue de la Mandoune, quatre-vingt-deux, zéro zéro zéro, Montauban
sept mille quatre cent un cussot, quatre-vingt-deux, quatre cents à Valence
Chemin de Cantecor, quatre-vingt-deux mille cent Castelsarrasin
Rue des Fâcheries, quatre-vingt-deux, six cents Verdun-sur-Garonne
Chemin de Rataboul, Moissac
Chemin Côte de Gazals à Montauban
cinq cent dix-neuf chemin de Couffignal
Rue des Brugues au numéro cent dix-neuf
vingt-six rue Michel Bilheran, quatre-vingt-deux mille sept cents Finhan
quarante chemin de Bénis, quatre-vingt-deux, cent, Castelsarrasin
quatre cent soixante-cinq chemin de Bouchens, quatre-vingt-deux, zéro zéro zéro à Montauban
Rue Charles Monfrini, quatre-vingt-deux mille trois cents Caussade
Chemin de Coustou, quatre-vingt-deux, zéro zéro zéro Montauban
Chemin de Merle au Tarn, Moissac
Avenue Andre Vidalot à Dunes
deux impasse Etienne Carquet
Chemin des Guiraudis au numéro trente-deux
cinq cent dix-huit rue Maffrot, quatre-vingt-deux mille sept cents Montbartier
cinquante-quatre route de Laroude, quatre-vingt-deux, cent, Saint-Aignan
deux mille soixante chemin de Saint-Béarn, quatre-vingt-deux, deux cents à Moissac
Impasse de la Reynale, quatre-vingt-deux mille cent Les Barthes
Chemin de Bernard, quatre-vingt-deux, zéro zéro zéro Montauban
Rue de Pages, Dunes
Impasse de Sabis à Montech
quatre-vingt-dix-neuf chemin Montagne
Impasse Maximilien de Robespierre au numéro dix
deux chemin de Carrète, quatre-vingt-deux mille quatre cents Golfech
mille trois cent vingt chemin de Granès, quatre-vingt-deux, quatre cent quarante, Réalville
quatre bassin du Canal, quatre-vingt-deux, deux cents à Moissac
Chemin de Bergaire, quatre-vingt-deux mille quatre cent quarante Réalville
Route de Vazerac, quatre-vingt-deux, cent trente Lafrançaise
Rue de l'Appel du dix-huit Juin, Albias
Chemin de Carrie Bas à Montauban
un rue Figuèris
Route Départementale quatorze de Lavilledieu au numéro mille cinq cent quatre-vingt-dix
deux cent cinq chemin de Ségaud, quatre-vingt-deux mille deux cent quatre-vingt-dix Montbeton
quatre cent soixante-dix chemin de Campemengard, quatre-vingt-deux, cent soixante-dix, Grisolles
deux mille seize chemin de Merlanes, quatre-vingt-deux, cent à Castelsarrasin
Chemin de Massagot, quatre-vingt-deux mille cent Castelsarrasin
Chemin de Boissel, quatre-vingt-deux, trois cent soixante-dix Villebrumier
Chemin de la Croix de l'Agneau, Montbeton
Place Mazerac à Saint-Antonin-Noble-Val
cent soixante-dix-sept chemin des Janoutaous
Rue des Guillermounes au numéro cent vingt et un
sept rue de l'Escauderie, quatre-vingt-deux mille deux cents Moissac
neuf cent trois route de la Salvetat-Belmontet, quatre-vingt-deux, trois cent soixante-dix, Saint-Nauphary
deux cent cinquante et un rue d'Esparsac, quatre-vingt-deux, cinq cents à Beaumont-de-Lomagne
Rue Dérua, quatre-vingt-deux mille deux cents Moissac
Impasse As Bousquets, quatre-vingt-deux, trois cent soixante-dix Campsas
Chemin de la Pio, Montauban
Cité Galineste à Corbarieu
trois impasse René Gaillard Lala
Côte de Joly au numéro mille cinq cent dix
cent soixante-neuf route de Cachecau, quatre-vingt-deux mille deux cent quatre-vingt-dix La Ville-Dieu-du-Temple
deux mille quatre cent dix chemin des Caubetous, quatre-vingt-deux, deux cent dix, Castelmayran
cent soixante-quinze chemin d'Escudie, quatre-vingt-deux, zéro zéro zéro à Montauban
Route du Fourc, quatre-vingt-deux mille deux cent trente Verlhac-Tescou
Rue Gillis Jean, quatre-vingt-deux, cent soixante-dix Grisolles
Chemin de Maynard, Moissac
Chemin de Guillabeau à Labastide-du-Temple
vingt-huit rue Auguste Quercy
Rue du Soleil deux mille au numéro cinq
six lotissement Badio, quatre-vingt-deux mille cent Castelferrus
quatre cent quatre-vingt-onze route de Fontpeyre, quatre-vingt-deux, deux cents, Boudou
six cent trente et un chemin des Biguès, quatre-vingt-deux, deux cent dix à Saint-Nicolas-de-la-Grave
Rue Paulette Ferlin, quatre-vingt-deux mille Montauban
Impasse de Sainte-Marie, quatre-vingt-deux, sept cents Finhan
Chemin de Thoumaze, Montauban
Route de Tissougnères à Barry-d'Islemade
quatre lotissement David
Route de Merles au numéro cinq cent soixante-sept
neuf avenue Mars, quatre-vingt-deux mille quatre cents Valence
cent vingt-trois chemin de Bernon, quatre-vingt-deux, deux cent quatre-vingt-dix, Meauzac
deux cent soixante impasse Coustou, quatre-vingt-deux, deux cent dix à Castelmayran
Chemin des Landes Basses, quatre-vingt-deux mille trois cents Monteils
Route de Génébrières, quatre-vingt-deux, deux cent trente Léojac
Rue Frédéric Cayrou, Montauban
Place Sylvain Dumon à Valence
cent soixante et un rue Edouard Forestié
Chemin des Payrols au numéro huit cent quatre-vingt-dix
quatorze rue Charles Caperan, quatre-vingt-deux mille trois cent soixante-dix Labastide-Saint-Pierre
huit cent cinq rue du Ramièrou, quatre-vingt-deux, zéro zéro zéro, Montauban
deux cent soixante-dix-neuf chemin du Pont de Tuile, quatre-vingt-deux, deux cent quatre-vingt-dix à Albefeuille-Lagarde
Route des Jauberts, quatre-vingt-deux mille deux cent dix Angeville
Rue Victor Brun, quatre-vingt-deux, zéro zéro zéro Montauban
Chemin de Mathio Bas, Monteils
Chemin de Pouzergues à Monteils
cinq cent soixante-cinq rue Henri Lapauze
Place Bernard Marceillac au numéro un
neuf rue du Moulin du Bessarel, quatre-vingt-deux mille cent quarante Saint-Antonin-Noble-Val
six cent soixante-douze route Borde Basse, quatre-vingt-deux, sept cents, Montech
deux mille cent dix-neuf chemin de Gibrou, quatre-vingt-deux, deux cents à Moissac
Chemin de Saint-Jean des Vignes, quatre-vingt-deux mille cent Castelsarrasin
Chemin de Philippou, quatre-vingt-deux, zéro zéro zéro Montauban
Chemin de Saint-Laurent à la Madeleine, Moissac
Chemin de Truffié à Saint-Nauphary
cinq place des Cornières
Lotissement des Hauts de Saint-Martial au numéro dix-huit
huit cent vingt et un chemin de Bordes Neuves, quatre-vingt-deux mille cent Castelsarrasin
quatre-vingt-dix-neuf rue de Rouges, quatre-vingt-deux, zéro zéro zéro, Montauban
vingt et un rue Joseph Flamens, quatre-vingt-deux, cent à Castelsarrasin
Vieux Chemin de Savenes, quatre-vingt-deux mille six cents Verdun-sur-Garonne
Rue Pierre Bonhoure, quatre-vingt-deux, deux cent quatre-vingt-dix Montbeton
Chemin du Bord de l'Angle, Léojac
Rue Couderc à Montauban
mille soixante-deux chemin de Colomé
Route de Montels au numéro six cent soixante
quarante-deux avenue Jean Baylet, quatre-vingt-deux mille quatre cents Valence
deux route Départementale soixante-dix-neuf des Barthes, quatre-vingt-deux, sept cents, Saint-Porquier
mille trois cent soixante-dix-huit chemin de Poujoles, quatre-vingt-deux, trois cents à Caussade
Chemin de Lestanet, quatre-vingt-deux mille Montauban
Route d'Angeville, quatre-vingt-deux, deux cent dix Castelmayran
Impasse des Barènes, Bioule
Voie Communale de Sèges à la Madeleine à Moissac
vingt T rue Tourreilh
Cité des Tuileries au numéro six
trente-sept A rue des Soubirous Bas, quatre-vingt-deux mille Montauban
huit cent onze chemin de l'Abelanie, quatre-vingt-deux, huit cents, Bioule
trois rue Paschal Grousset, quatre-vingt-deux, cent soixante-dix à Grisolles
Chemin d'Al Gal, quatre-vingt-deux mille cent Castelsarrasin
Rue Alfred Chanzy, quatre-vingt-deux, zéro zéro zéro Montauban
Impasse des Araucarias, Montauban
Route de Belleplaine à La Ville-Dieu-du-Temple
deux mille trois cent quarante route des Lials
Place de Las Graves au numéro six mille quatre cent quatre-vingt-cinq
cinq chemin de la Sapinette, quatre-vingt-deux mille trois cent soixante-dix Campsas
dix chemin de la Brive, quatre-vingt-deux, trois cent cinquante, Albias
deux mille cinq cent neuf avenue de Belcante, quatre-vingt-deux, sept cents à Montech
Lotissement de Lestang, quatre-vingt-deux mille cent trente Villemade
Rue Saint-Angel, quatre-vingt-deux, cent quarante Saint-Antonin-Noble-Val
Chemin des Tessonniers, Cayrac
Route de Lagarde Dieu à Mirabel
six rue Garric
Chemin de Viminies au numéro cent quarante-deux
cent soixante-huit rue Paul Roussel, quatre-vingt-deux mille deux cent quatre-vingt-dix Albefeuille-Lagarde
deux cent quatre-vingt-dix chemin de Cavale, quatre-vingt-deux, cent soixante-dix, Grisolles
quatre-vingt-quatorze impasse du Tescou, quatre-vingt-deux, trois cent soixante-dix à Saint-Nauphary
Rue des Soubiroux Hauts, quatre-vingt-deux mille Montauban
Chemin de Saint-Orens, quatre-vingt-deux, deux cent dix Angeville
Residence Maurice Ravel, Montauban
Rue du Cantarel à Lafrançaise
cinq cent quarante-cinq chemin de Breil Haut
Rue Henri Gauthier au numéro huit
mille six cent un chemin de Reilles, quatre-vingt-deux mille cent trente L'Honor-de-Cos
deux mille sept cent soixante-deux route De Montpezat, quatre-vingt-deux, quatre cent quarante, Mirabel
treize lotissement Laplane, quatre-vingt-deux, sept cent dix à Bressols
Chemin Sardy Lescaut, quatre-vingt-deux mille huit cents Nègrepelisse
Rue de la Place Neuve, quatre-vingt-deux, huit cents Montricoux
Rue del Miech, Varennes
Route de Lacarral à Montech
trente-sept avenue Pierre Latécoère
Grand-Rue d'Ardus au numéro deux
trois place Marcel Lenoir, quatre-vingt-deux mille Montauban
cinq TER boulevard du Quercy, quatre-vingt-deux, deux cents, Moissac
quatre route de Labaquère, quatre-vingt-deux, quatre cents à Golfech
Chemin de Joukil, quatre-vingt-deux mille Montauban
Chemin de Trastet, quatre-vingt-deux, deux cent trente Verlhac-Tescou
Chemin de Noble, Villebrumier
Route du Saye Haut à La Ville-Dieu-du-Temple
un place de la Garonne
Route de Croix de Saumade au numéro quatre cent huit
un boulevard Louis Sicre, quatre-vingt-deux mille cent Castelsarrasin
un rue Pertuzet, quatre-vingt-deux, quatre cents, Espalais
mille six cent quatre-vingt-douze route de la Comtesse, quatre-vingt-deux, deux cents à Moissac
Rue Jean-Baptiste Marie Delpech, quatre-vingt-deux mille deux cents Malause
Boulevard Didier Rey, quatre-vingt-deux, trois cents Caussade
Rue de la Bouyère, Labastide-Saint-Pierre
Chemin de la Plaine d'Auriol à Monclar-de-Quercy
onze rue Pierre de Sainte-Marie
Rue du Commandant Bayssade au numéro deux cent cinquante-six
dix rue des Canebals, quatre-vingt-deux mille cent Castelsarrasin
sept cent quarante-cinq route de Puycornet, quatre-vingt-deux, cent trente, L'Honor-de-Cos
deux cent soixante-cinq chemin de Labernède, quatre-vingt-deux, quatre cent quarante à Mirabel
Avenue du Cardinal des Prés, quatre-vingt-deux mille deux cent soixante-dix Montpezat-de-Quercy
Boulevard Irénée Bonnafous, quatre-vingt-deux, zéro zéro zéro Montauban
Chemin de Loubet, Labastide-Saint-Pierre
Impasse de la Cisampe à Montpezat-de-Quercy
mille cent quarante chemin de Lacan
Chemin des Placettes au numéro mille six cent soixante-sept
deux mille trente-cinq chemin Bellerive, quatre-vingt-deux mille quatre cent quarante Cayrac
deux cent cinquante rue de Croix de Peyret, quatre-vingt-deux, deux cent quatre-vingt-dix, La Ville-Dieu-du-Temple
cent soixante-cinq impasse des Balosses, quatre-vingt-deux, trois cents à Caussade
Chemin de Peyrole, quatre-vingt-deux mille cent Castelferrus
Route de Vigueron, quatre-vingt-deux, cinq cents Beaumont-de-Lomagne
Route de Vaïssac, Monclar-de-Quercy
Rue Georges Talbot à Caussade
quatre cent quarante chemin de Catiès
Route du Faillal au numéro cent quarante-cinq
six rue Louis Dupiech, quatre-vingt-deux mille quatre cents Castelsagrat
sept cent onze chemin de la Garenne Basse, quatre-vingt-deux, deux cent quatre-vingt-dix, Montbeton
mille quatre cent quatre-vingt-dix-sept chemin de L'Evêque, quatre-vingt-deux, deux cent quatre-vingt-dix à Montbeton
Boulevard Sanguinenc, quatre-vingt-deux mille cent Castelsarrasin
Péligry, quatre-vingt-deux, zéro zéro zéro Montauban
Rue du Vieux Poids, Montauban
Place du Centre Commercial à Bressols
un impasse Labastiolle
Résidence del Sol au numéro dix-sept
quatre cent vingt-quatre chemin de Ferrie, quatre-vingt-deux mille Montauban
deux cent soixante-quatorze chemin de Barbié, quatre-vingt-deux, quatre cent dix, Saint-Étienne-de-Tulmont
vingt-cinq chemin des Saponaires, quatre-vingt-deux, huit cents à Nègrepelisse
Rue des Dipladénias, quatre-vingt-deux mille deux cents Malause
Avenue de Pouty, quatre-vingt-deux, zéro zéro zéro Montauban
Chemin de Jamounet, Castelsarrasin
Route du Bac de Cos à Albias
deux cent cinq chemin du Rouch
Rue du Général Albert d'Amade au numéro douze
dix-sept rue des Vieux Colombiers, quatre-vingt-deux mille sept cents Montech
un faubourg Saint-Joseph, quatre-vingt-deux, sept cents, Escatalens
quatre-vingt-quatre impasse Al Casse, quatre-vingt-deux, deux cents à Boudou
Chemin de Chaubard, quatre-vingt-deux mille Montauban
Lotissement le Clos de Cattie, quatre-vingt-deux, deux cent trente Léojac
Route du Treilhou, Caussade
Place du Faubourg d'Auriac à Lauzerte
deux quai du Docteur Lafforgue
Chemin de Cap de l'Homme au numéro cent quarante et un
quarante-cinq rue Guileran, quatre-vingt-deux mille deux cents Moissac
mille deux cent quatre-vingts chemin de Julias, quatre-vingt-deux, cent soixante-dix, Dieupentale
six chemin du Pech Déjean, quatre-vingt-deux, deux cent vingt à Molières
Lotissement Parc de la Nauzette, quatre-vingt-deux mille trois cent soixante-dix Orgueil
Promenade de Versailles, quatre-vingt-deux, trois cent quarante Dunes
Impasse Solleville, Montauban
Rue de la Nauze à Lafrançaise
quatre cent quatorze chemin de Bartete
Rue Louis d'Anjou au numéro vingt-six
cinq roy Haut, quatre-vingt-deux mille deux cent quarante Septfonds
soixante-dix lotissement du Picoy, quatre-vingt-deux, cent trente, L'Honor-de-Cos
cent soixante-quinze chemin de Lardit, quatre-vingt-deux, cent soixante-dix à Grisolles
Rue Grand Selve, quatre-vingt-deux mille cinq cents Beaumont-de-Lomagne
Esplanade du Port, quatre-vingt-deux, trois cent quarante Auvillar
Place de Laborie, Labastide-Saint-Pierre
Impasse de la Négrette à Labastide-Saint-Pierre
deux mille quatre-vingt-un route de Monclar de Quercy
Chemin de Cailloulet au numéro neuf cent quinze
quarante et un rue Camille Carrié, quatre-vingt-deux mille cinq cents Beaumont-de-Lomagne
mille trois cent trente-six chemin de Monestie, quatre-vingt-deux, cent, Castelsarrasin
dix-huit rue Roger Alphonsy, quatre-vingt-deux, cent à Castelsarrasin
Boulevard Ouest, quatre-vingt-deux mille cinq cents Beaumont-de-Lomagne
Chemin de Marjouen, quatre-vingt-deux, deux cent dix Saint-Nicolas-de-la-Grave
Boulevard Jacques Rodriguez, Réalville
Rue de Valgilade à Villebrumier
douze lotissement Des Lauriers
Chemin de Batut au numéro deux cent soixante-quatorze
cinq cent soixante-trois chemin de Malengane, quatre-vingt-deux mille deux cents Moissac
six impasse Caminole, quatre-vingt-deux, trois cent soixante, Lamagistère
sept rue Jules Sancé, quatre-vingt-deux, trois cent soixante-dix à Labastide-Saint-Pierre
Route de Coustalettes, quatre-vingt-deux mille quatre cents Golfech
Impasse de Marot, quatre-vingt-deux, trois cents Caussade
Rue de Plombis, Castelsagrat
Chemin de Lugan Bas à Monteils
cinquante-cinq rue des Mercadies
Chemin de Pefourque au numéro quatre-vingt-dix-huit
six cent quatre-vingt-six chemin des Courbets, quatre-vingt-deux mille deux cent dix Castelmayran
deux cent cinquante et un chemin Pascalet, quatre-vingt-deux, deux cents, Boudou
un impasse Pupille, quatre-vingt-deux, quatre cents à Golfech
Avenue de la Mouscane, quatre-vingt-deux mille sept cents Montech
Rue de la Porte Grande, quatre-vingt-deux, quatre cents Castelsagrat
Impasse des Grouilles, Montauban
Chemin du Rodoul à Orgueil
six rue André Castel
Chemin du Guirou au numéro dix-sept
cinq route de Barry d'Islemade, quatre-vingt-deux mille deux cent quatre-vingt-dix Meauzac
trente et un chemin de Barres, quatre-vingt-deux, zéro zéro zéro, Montauban
onze rue Antoine de Larroque, quatre-vingt-deux, cent soixante-dix à Grisolles
Chemin de Mansou, quatre-vingt-deux mille deux cent dix Saint-Nicolas-de-la-Grave
Rue Henri de Saint-Julien, quatre-vingt-deux, sept cents Montech
Chemin de Lauzard, Labastide-Saint-Pierre
Route de Caylus à Septfonds
trois cent cinquante-neuf chemin de la Garouille
Chemin de Gamarre au numéro mille deux cent dix
sept rue Pierre Teissie Solier, quatre-vingt-deux mille sept cents Finhan
cinquante-six domaine de l'Hippodrome, quatre-vingt-deux, zéro zéro zéro, Montauban
cent rue Fragneau, quatre-vingt-deux, zéro zéro zéro à Montauban
Rue de la Matalene, quatre-vingt-deux mille cent soixante-dix Bessens
Chemin des Ses, quatre-vingt-deux, trois cents Monteils
Route de Belers, Saint-Porquier
Route de la Biarne à Saint-Nicolas-de-la-Grave
sept route de Bardigues
Route de Daynes au numéro six cent neuf
trois cent cinquante-neuf avenue des Mourets, quatre-vingt-deux mille Montauban
quarante-neuf impasse de Barthe-Folle, quatre-vingt-deux, trois cents, Caussade
deux cent quatre-vingt-quinze chemin de Larouy, quatre-vingt-deux, cent aux Barthes
Chemin Rural de Rouhan à la Megère, quatre-vingt-deux mille deux cents Moissac
Lotissement de Poutantan, quatre-vingt-deux, trois cent quarante Auvillar
Chemin de Gatille, Montauban
Boulevard Pierre Flamens à Castelsarrasin
trois cent dix route de Bellechasse
Quai de Sapiac au numéro trois
soixante-deux impasse de Las Croux, quatre-vingt-deux mille trois cents Caussade
quatre cent soixante-cinq route de Maurel, quatre-vingt-deux, deux cent soixante-dix, Montalzat
vingt place Duras, quatre-vingt-deux, huit cents à Nègrepelisse
Rue le Gascon, quatre-vingt-deux mille trois cent quarante Dunes
Chemin de Cagues Loup, quatre-vingt-deux, cent Labastide-du-Temple
Chemin de Mortarieu, Lacourt-Saint-Pierre
Route de Soudène à Montech
trente A limite Administrative
Rue Campieu au numéro vingt
neuf avenue de la Grande Forêt, quatre-vingt-deux mille sept cents Montech
onze chemin de Crouzet, quatre-vingt-deux, cent trente, Lafrançaise
deux cent quatre-vingt-quatorze chemin de Palesy, quatre-vingt-deux, zéro zéro zéro à Montauban
Chemin de Gailladet, quatre-vingt-deux mille Montauban
Chemin De Ribet, quatre-vingt-deux, quatre cent dix Saint-Étienne-de-Tulmont
Rue Domaine du Lac, Meauzac
Route de Gravel Bas à Saint-Aignan
un route de la Gimone
Impasse des Tendolles au numéro treize
cinq cent quatre-vingt-cinq rue Louis Sabatier, quatre-vingt-deux mille Montauban
trois cent quatre-vingt-dix chemin de Matras, quatre-vingt-deux, zéro zéro zéro, Montauban
quinze rue Jean de la Valette, quatre-vingt-deux, cent soixante à Parisot
Impasse Nelly Roussel, quatre-vingt-deux mille Montauban
Traverse d'Encessoy, quatre-vingt-deux, six cents Verdun-sur-Garonne
Impasse du Pont du Clos, Valence
Place du Clôt à Mas-Grenier
mille six cent quatre-vingt-neuf route de Castanède
Impasse de Malpelas au numéro quarante
quinze rue d'Elie, quatre-vingt-deux mille Montauban
trente-huit chemin de Rastelet, quatre-vingt-deux, quatre cent dix, Saint-Étienne-de-Tulmont
cinq cent un chemin de Rouges, quatre-vingt-deux, zéro zéro zéro à Montauban
Impasse Baillères, quatre-vingt-deux mille Montauban
Chemin de Pérayrols, quatre-vingt-deux, sept cent dix Bressols
Route du Moutet, Saint-Nicolas-de-la-Grave
Chemin de Callory à Labastide-Saint-Pierre
dix rue Dominique Claverie
Chemin de Naudin au numéro six
cinq impasse des Dussardes, quatre-vingt-deux mille quatre cent dix Saint-Étienne-de-Tulmont
un impasse Jean des Bois, quatre-vingt-deux, cent soixante-dix, Dieupentale
trente-six chemin de Cap Dieu, quatre-vingt-deux, deux cent dix à Castelmayran
Rue Mathalie, quatre-vingt-deux mille cent soixante Caylus
Boulevard des Fossés Raoul, quatre-vingt-deux, deux cent dix Saint-Nicolas-de-la-Grave
Rue Gasseras, Verdun-sur-Garonne
Chemin Peyrat à La Ville-Dieu-du-Temple
un rue de L'Ancolie Bleue
Rue des Falbas au numéro deux cent trente et un
cinq chemin des Clauzades, quatre-vingt-deux mille cent Labastide-du-Temple
deux mille sept cent quatre-vingt-quatre chemin de Vinche, quatre-vingt-deux, quatre cent quarante, Réalville
sept chemin du Moulin de Robert, quatre-vingt-deux, deux cent vingt à Vazerac
Lotissement de Guiringaud, quatre-vingt-deux mille cent Castelsarrasin
Place du Reduch, quatre-vingt-deux, deux cent soixante-dix Montpezat-de-Quercy
Chemin de Bondillou, Montauban
Côte de Mares à Montastruc
quarante et un rue Saint-Gauzy
Hameau de Pilou au numéro dix
deux cent soixante-seize chemin de Jean Vieil, quatre-vingt-deux mille quatre cent quarante Réalville
trois cent trente-quatre chemin de Fontanié, quatre-vingt-deux, cent trente, Lafrançaise
huit cent soixante-six chemin du Ramierou, quatre-vingt-deux, zéro zéro zéro à Montauban
Chemin Roubiac, quatre-vingt-deux mille deux cents Boudou
Route des Saysses, quatre-vingt-deux, sept cents Montech
Lotissement le Clos du Rossignol, Montauban
Place Mercadiel à Montaigu-de-Quercy
cent trente-neuf chemin des Doudous
Rue Henri Nazon au numéro vingt-quatre
cent cinquante-trois chemin de Canto Merle, quatre-vingt-deux mille Montauban
quarante et un avenue André Bonnet, quatre-vingt-deux, sept cents, Montech
cent soixante-douze impasse Garros, quatre-vingt-deux, trois cent soixante-dix à Campsas
Chemin de Saint-Caprais, quatre-vingt-deux mille trois cent soixante-dix Saint-Nauphary
Chemin de Seguin, quatre-vingt-deux, trois cent soixante-dix Labastide-Saint-Pierre
Traverse de Bonnemort, Caussade
Chemin de Castagné à Albefeuille-Lagarde
mille cinq cent sept chemin de Carrel
Chemin de la Serre du Moulin à Vent au numéro mille huit cent vingt-six
mille quatre-vingts rue Côte de l'Ile, quatre-vingt-deux mille cent trente Lafrançaise
quatre cent dix-neuf chemin de Foulquié, quatre-vingt-deux, zéro zéro zéro, Montauban
deux cent quatre-vingt-quatorze chemin de Guiral, quatre-vingt-deux, zéro zéro zéro à Montauban
Rue Maria Pierre, quatre-vingt-deux mille sept cents Montech
Rue des Frères Duclos, quatre-vingt-deux, trois cents Caussade
Chemin de Morture, Labastide-Saint-Pierre
Lotissement Bernadas à Moissac
trente-trois chemin de Récard
Chemin des Gourdis au numéro mille neuf cent quatre-vingt-cinq
mille neuf cent soixante-seize chemin de la Doumegale, quatre-vingt-deux mille cent trente Lafrançaise
quatre rue du Bosquet Bleu, quatre-vingt-deux, sept cents, Montech
trois rue Bernard Barokas, quatre-vingt-deux, zéro zéro zéro à Montauban
Place de Pinard, quatre-vingt-deux mille quatre cents Goudourville
Impasse de la Brunette, quatre-vingt-deux, deux cent soixante-dix Montalzat
Chemin de Laquette, Saint-Étienne-de-Tulmont
Route de Bernèses à Donzac
cent quatre-vingt-onze chemin Pilate
Impasse Jean-Baptiste Chaumeil au numéro huit
treize rue de la Piboulette, quatre-vingt-deux mille trois cents Caussade
deux chemin de l'École de Saint-Benoît, quatre-vingt-deux, deux cents, Moissac
neuf chemin de Sémenol, quatre-vingt-deux, cent trente à Lamothe-Capdeville
Route du Barry, quatre-vingt-deux mille sept cents Montech
Route du Castéron, quatre-vingt-deux, cent vingt Lavit
Impasse Prat de Valat, Bressols
Résidence HLM à Canals
sept rue Tour du Four
Impasse Louis Lépine au numéro deux cent vingt-deux
un chemin de la Perrine, quatre-vingt-deux mille deux cent vingt Molières
soixante et un route de Bio, quatre-vingt-deux, trois cent soixante-dix, Corbarieu
trois cents chemin de Pouzargues, quatre-vingt-deux, cent à Castelsarrasin
Rue Poumel, quatre-vingt-deux mille deux cents Moissac
Chemin de Marot, quatre-vingt-deux, trois cents Caussade
Faubourg Paillous, Escatalens
Rue Moissagaise à Caussade
deux mille trois cent quatre-vingt-quatre chemin de la Tauge
Rue Launac au numéro deux T
soixante chemin de Bardissou, quatre-vingt-deux mille Montauban
dix-huit avenue Frédéric Cayrou, quatre-vingt-deux, cent, Castelsarrasin
cent cinquante chemin de Guibal, quatre-vingt-deux, deux cent quatre-vingt-dix à Meauzac
Rue des Plombiers, quatre-vingt-deux mille cent soixante Caylus
Route du Vigne, quatre-vingt-deux, trois cent soixante-dix Orgueil
Chemin des Bartholots, Montauban
Rue Clément Bressou à Castelsarrasin
sept port Ardus
Route de Sadoul au numéro six cent quatre-vingt-treize
vingt-huit chemin de Luachos, quatre-vingt-deux mille deux cent quarante Septfonds
soixante-neuf route de Pardiac, quatre-vingt-deux, sept cents, Saint-Porquier
mille neuf cent quarante-neuf chemin de Jouanicou, quatre-vingt-deux, zéro zéro zéro à Montauban
Chemin de Fustie, quatre-vingt-deux mille Montauban
Impasse Linon, quatre-vingt-deux, zéro zéro zéro Montauban
Chemin de Poupel, Montauban
Impasse de Rambouillet à Montauban
douze rue du Coin de Vignet
