Lotissement La Croisette, cinquante-quatre, deux cent dix Azelot
Rue des Sœurs Macarons, Nancy
Allée de Colmar à Liverdun
un chemin des Ragones
Rue du Chanoine Clanché au numéro douze
deux cent soixante-sept rue du Clos des Grèves, cinquante-quatre mille deux cents Toul
huit la Louvière, cinquante-quatre, trois cent trente, Hammeville
cinq cour de Blanzey, cinquante-quatre, sept cent soixante-dix à Bouxières-aux-Chênes
Rue de Genu Pré, cinquante-quatre mille cent quinze Lalœuf
Rue les Résidences de la Forêt, cinquante-quatre, neuf cent quarante Belleville
Sentier Ambroise Thomas, Nancy
Rue Émile Erckmann à Lunéville
cinq rue Pol Glandié
Rue Marcel Gasser au numéro dix
sept rue des Tiercelins, cinquante-quatre mille Nancy
trois allée Dorat, cinquante-quatre, six cents, Villers-lès-Nancy
deux rue Jeanne Martin, cinquante-quatre, deux cents à Francheville
Rue de la Croix Cherrière, cinquante-quatre mille neuf cent cinquante Saint-Clément
Allée de la Faisanderie, cinquante-quatre, trois cents Lunéville
Chemin des Jardins sur l'Eau, Sommerviller
Rue Édouard Grosjean à Laxou
quatre BIS place de la Belle Croix
Léman au numéro vingt-cinq
soixante-quinze rue de l'Abbé d'Ollières, cinquante-quatre mille sept cent vingt Lexy
soixante-seize rue de Manonville, cinquante-quatre, cent treize, Moutrot
neuf allée de la Chèvre Haie, cinquante-quatre, cent dix à Anthelupt
Rue du Général Paradis, cinquante-quatre mille cent vingt Thiaville-sur-Meurthe
Rue de Joyeuse, cinquante-quatre, huit cent quatre-vingt-dix Waville
Place des Dentellières, Jarville-la-Malgrange
Route de Flainval à Dombasle-sur-Meurthe
quatre chemin des Aulnois
Rue Abbé Striebel au numéro deux
dix-sept allée Victor Huel, cinquante-quatre mille Nancy
quatre rue du Haut Rivage, cinquante-quatre, trois cents, Chanteheux
cinq rue Lucien Clavel, cinquante-quatre, cent quatre-vingt-dix à Villerupt
Rue Pierre-Albert Labro, cinquante-quatre mille quatre cents Longwy
Rue Madame de Vannoz, cinquante-quatre, zéro zéro zéro Nancy
Rue des Pertusots, Baccarat
Rue Général Rapp à Lunéville
neuf rue de Griffonge
Rue Nicolas Chenin au numéro six cent vingt
cent soixante a La Croix Burné, cinquante-quatre mille neuf cent quatre-vingt-dix Xeuilley
dix-neuf rue Jean-Baptiste Molière, cinquante-quatre, cent quatre-vingt-dix, Villerupt
trois route de Crion, cinquante-quatre, trois cents à Sionviller
Terrasse de la Pépinière, cinquante-quatre mille Nancy
Impasse Drouin, cinquante-quatre, sept cent dix Ludres
Rue de Rodange, Saulnes
Rue Valot-Chrétien à Lunéville
quarante-deux rue Lionel Billas
Rue Alexandre Gauche au numéro trois BIS
douze lotissement Les Périllons, cinquante-quatre mille sept cent quatre-vingt-dix Mancieulles
neuf rue Gustave Petit, cinquante-quatre, zéro zéro zéro, Nancy
trois impasse de la Haute Sente, cinquante-quatre, cent treize à Crézilles
Rue des Tunnels, cinquante-quatre mille trois cent dix Homécourt
Allée de la Herse, cinquante-quatre, quatre cent vingt-cinq Pulnoy
Rue de la Picotte, Neuves-Maisons
Cité des Croix de Mission à Foug
deux rue de Chaouilley
Rue du Clos Saint-Charles au numéro douze
huit boulevard du Recteur Senn, cinquante-quatre mille Nancy
trois rue Edile Klein, cinquante-quatre, cent quarante, Jarville-la-Malgrange
vingt-huit rue du Fond de Chenet, cinquante-quatre, deux cent trente à Chaligny
Rue Bergnier, cinquante-quatre mille Nancy
Les Royes Montants, cinquante-quatre, cent soixante-dix Colombey-les-Belles
Rue de Charton, Crantenoy
Allée du Nid à Saulxures-lès-Nancy
un passage Saint-Laurent
Rue du Docteur Alexis Giry au numéro neuf
deux rue de la Rouge Terre, cinquante-quatre mille cent vingt-deux Vathiménil
huit chemin des Gadines, cinquante-quatre, cent vingt, Baccarat
six rue Marc Broyer, cinquante-quatre, cinq cent soixante à Audun-le-Roman
Rue Maurice Kriegel Valrimont, cinquante-quatre mille huit cents Jarny
Rue de la Jaufaite, cinquante-quatre, sept cent dix Ludres
Rue de l'Alzette, Thil
Rue de Neleu à Dieulouard
vingt-neuf rue de Faymont
Rue Alexandre Joly au numéro deux
cinq impasse Parisot, cinquante-quatre mille huit cents Labry
quatre chemin de la Froide Fontaine, cinquante-quatre, cinq cent quarante, Pierre-Percée
six route de Xeuilley, cinquante-quatre, trois cent trente à Parey-Saint-Césaire
Allée du Petit Gerbeau, cinquante-quatre mille trois cent quatre-vingts Dieulouard
Rue du huit e Bataillon des Chasseurs à Pied, cinquante-quatre, deux cents Dommartin-lès-Toul
Rue du Sonofré, Chaudeney-sur-Moselle
Rue Louis Guingot à Lay-Saint-Christophe
seize rue Gaillardot
Impasse Gallois au numéro cinquante-huit
seize place du vingt-quatre Juillet mille huit cent quatre-vingt-dix-sept, cinquante-quatre mille huit cent dix Longlaville
six rue Traversière du Four, cinquante-quatre, huit cent quarante, Gondreville
cinquante rue Georges Hance, cinquante-quatre, deux cents à Toul
Allée du Rupt de Mad, cinquante-quatre mille cinq cent vingt Laxou
Route de Tichémont, cinquante-quatre, huit cents Jarny
Chemin de Derrière la Neuve Rue, Blénod-lès-Toul
Rue de Chemenez à Chaligny
trente-trois BIS rue de Renevaux
Boulevard Pinteville au numéro quarante
vingt-trois cour des Arts, cinquante-quatre mille Nancy
douze z.un. du Roitelet, cinquante-quatre, sept cent trente, Gorcy
un chemin de Grosrouvres, cinquante-quatre, trois cent quatre-vingt-cinq à Noviant-aux-Prés
Rue Clément Humbert, cinquante-quatre mille huit cents Jarny
Rue des Brice, cinquante-quatre, zéro zéro zéro Nancy
Rue Palentin, Forcelles-Saint-Gorgon
Ruelle des Grands Jardins à Hudiviller
un place de la deux e Division de Cavalerie
Rue de Jantival au numéro dix-neuf
six rue Bénit, cinquante-quatre mille Nancy
deux rue Dominique Level, cinquante-quatre, trois cents, Lunéville
deux avenue Désiré Masson, cinquante-quatre, cinq cents à Vandœuvre-lès-Nancy
Impasse François Bernier, cinquante-quatre mille sept cent dix Ludres
Allée Gaston Ramon, cinquante-quatre, six cents Villers-lès-Nancy
Rue de la Croix Hocquard, Praye
Allée de Saint-Cloud à Villers-lès-Nancy
treize rue au Haut Buisson
Rue de la Vanne du Moulin au numéro quatre
un chemin d'Elui Champs, cinquante-quatre mille sept cent vingt Cutry
vingt et un impasse de Saint-Lambert, cinquante-quatre, zéro zéro zéro, Nancy
cinquante-deux esplanade Jacques Baudot, cinquante-quatre, zéro zéro zéro à Nancy
Cité Frontières, cinquante-quatre mille cent quatre-vingt-dix Villerupt
Rue de la Pierre Fendue, cinquante-quatre, deux cents Bicqueley
Allée de Miramas, Liverdun
Rue GrandJean à Pagny-sur-Moselle
soixante-treize rue du Closé
Rue Edmond Braux au numéro dix-neuf
trente et un rue de la Haute Corvée, cinquante-quatre mille trois cent soixante-dix Coincourt
six impasse du Val du Moulin, cinquante-quatre, cent quarante, Jarville-la-Malgrange
vingt-deux cité Saint-Ernest, cinquante-quatre, cent quatre-vingt-dix à Villerupt
Chemin de Courberaie, cinquante-quatre mille deux cent trente Chaligny
Avenue du Docteur Sprauel, cinquante-quatre, cent dix Rosières-aux-Salines
Rue du Haut du Chêne, Bicqueley
Rue de Rombas à Homécourt
onze chemin du Toupot
Rue Basse Molière au numéro cinq
cinq lotissement Les Chaussetis, cinquante-quatre mille cinq cent soixante Serrouville
six rue de Lancelot, cinquante-quatre, neuf cent trente, Gugney
vingt-six chemin du Haut de Lesse, cinquante-quatre, trois cent vingt à Maxéville
Allée des Pâquis, cinquante-quatre mille cent quatre-vingts Houdemont
Rue du neuf e Bataillon de Chasseurs à Pied, cinquante-quatre, quatre cents Longwy
Rue du Fort de Kehl, Maidières
Impasse de Gerbéviller à Blainville-sur-l'Eau
dix rue du Trait
Quai de Sélestat au numéro trois BIS
deux allée Victor Jara, cinquante-quatre mille cinq cent dix Tomblaine
trois rue Francois Raspail, cinquante-quatre, cent quatre-vingt-dix, Villerupt
trente-cinq rue du Boucau, cinquante-quatre, trois cent dix à Homécourt
Rue du Capitaine Gibaudan, cinquante-quatre mille trois cents Vitrimont
Allée des Châteaux d'Eau, cinquante-quatre, cent quarante Jarville-la-Malgrange
Rue du Franclos, Ludres
Sentier du Tie à Jezainville
neuf qrt de la Gare
Rue du Gai Coteau au numéro dix-huit
quatorze en Chatterue, cinquante-quatre mille quatre cent soixante-dix Jaulny
quatre rue des Prairières, cinquante-quatre, deux cent dix, Ferrières
sept avenue de Saurupt, cinquante-quatre, six cents à Villers-lès-Nancy
Rue des Léonards, cinquante-quatre mille sept cents Maidières
Impasse du Colonel Péchot, cinquante-quatre, deux cents Toul
Rue Emile Michel, Audun-le-Roman
Rue du Versoir à Dieulouard
vingt-sept rue de Pagny sur Moselle
Chemin du Bois Saint-Pancré au numéro un
trois rue Traversière du Murot, cinquante-quatre mille deux cents Toul
dix rue du Fontenat, cinquante-quatre, six cents, Villers-lès-Nancy
neuf rue Thérèse Griselin, cinquante-quatre, huit cent quatre-vingts à Thil
Rue de Clairlieu, cinquante-quatre mille deux cent trente Chaligny
Rue de la Torterue, cinquante-quatre, cent dix-huit Moyen
Rue Gravelot, Magnières
Impasse Jules Saunier à Nancy
huit rue Charles Victor Jacquet
Rue de Loromontzey au numéro un BIS
six rue du Meix Blot, cinquante-quatre mille cent dix Hudiviller
trois cents rue des Mazurots, cinquante-quatre, sept cent dix, Ludres
un rue Gaudard, cinquante-quatre, quatre cent soixante-dix à Bouillonville
Rue de la Fontaine Aux Corbeau, cinquante-quatre mille sept cents Montauville
Rue de Jaulny, cinquante-quatre, quatre cent soixante-dix Pannes
Place Séraphin Demange, Écrouves
Rue de Rogéville à Rosières-en-Haye
trois rue du Clos Jules Ferry
Rue La Poirière au numéro cinq
huit quartier Derrière le Four, cinquante-quatre mille cent cinquante Mance
cinq route Nationale cinquante-deux Bis, cinquante-quatre, cent cinquante, Mairy-Mainville
dix rue de Briey, cinquante-quatre, neuf cent dix à Valleroy
Rue du Haut Boschet, cinquante-quatre mille neuf cent vingt Morfontaine
Place du Quartier Igert, cinquante-quatre, cent cinquante Briey
Rue du Cèdre Bleu, Rosières-aux-Salines
Route de Fillières à Bréhain-la-Ville
trois allée San Salvo
Rue du Pré Jodin au numéro dix
vingt-six place Saint-Mansuy, cinquante-quatre mille deux cents Toul
dix rue Sonaire, cinquante-quatre, deux cents, Toul
deux rue de la Sance, cinquante-quatre, six cents à Villers-lès-Nancy
Ruelle Chevalier, cinquante-quatre mille cinq cent quarante Badonviller
Hameau de Brabant, cinquante-quatre, cinq cent soixante Anderny
Chemin de la Maxelle, Fréménil
Chemin de Malavillers à Audun-le-Roman
sept rue René Dorme
Rue Hauts de Caure au numéro treize
neuf rue de Mainvaux, cinquante-quatre mille cent trente Saint-Max
deux rue Jean Conrard, cinquante-quatre, deux cent vingt, Malzéville
quatre cent un route d'Ecrouves, cinquante-quatre, deux cents à Pagney-derrière-Barine
Rue d'Inglemur, cinquante-quatre mille deux cents Toul
Quartier de l'Étang, cinquante-quatre, trois cent soixante-dix Parroy
Rue de Béthléem, Goviller
Rue de Piemont à Vandières
cinq rue Général Kellermann
Rue Madeleine Zani au numéro neuf
vingt rue des Abbés Frouard, cinquante-quatre mille cent vingt Baccarat
seize au Vieux Château, cinquante-quatre, trois cent quatre-vingts, Dieulouard
dix rue de L'Orée du Bois, cinquante-quatre, cinq cent dix à Tomblaine
Rue de l'Abbé Dardaine, cinquante-quatre mille cinq cent dix Art-sur-Meurthe
Route de Haraucourt, cinquante-quatre, trois cent soixante-dix Drouville
Rue Roland Daret, Labry
Rue de la Table à Tucquegnieux
six rue Jean Royer
Impasse Jean Lamour au numéro soixante-quatre
un lotissement Maxelle, cinquante-quatre mille quatre cent cinquante Herbéviller
huit rue du Génevaux, cinquante-quatre, cinq cent soixante-dix, Trondes
vingt-quatre rue Bicquilley, cinquante-quatre, deux cents à Toul
Rue Marie Odile, cinquante-quatre mille Nancy
Allée de la Bardanne, cinquante-quatre, quatre cent vingt-cinq Pulnoy
Rue Antoine de Soreau, Houdemont
Rue du Général Mathis à Réméréville
trois rue du trois E Regiment Cuirassiers
Allée des Nautoniers au numéro dix-huit
un clos Hinzelin, cinquante-quatre mille Nancy
sept rue du Breuillot, cinquante-quatre, quatre cent vingt-cinq, Pulnoy
six rue du Chaux Four, cinquante-quatre, cent trente-six à Bouxières-aux-Dames
Rue Dante Pederzoli, cinquante-quatre mille cinq cent quatre-vingts Auboué
Rue de la Malaisée, cinquante-quatre, trois cent trente Thélod
Rue Pierre Chalnot, Nancy
Rue de Tavannes à Mancieulles
quatre viviers Sur Chiers
Rue de la Woivre au numéro neuf
un BIS rue de la Vieille Pierre, cinquante-quatre mille trois cent quatre-vingt-dix Frouard
trois chemin de la Maix, cinquante-quatre, sept cent soixante, Faulx
un rue du Maix Devant, cinquante-quatre, trois cent soixante-dix à Laneuveville-aux-Bois
Rue Damay, cinquante-quatre mille sept cents Pont-à-Mousson
Rue Chapelain, cinquante-quatre, cent dix Lenoncourt
Rue de Rayeterre, Val-et-Châtillon
Rue Langathe à Champenoux
quarante-cinq rue Alphonse Dozard
Rue du Haut de Siry au numéro soixante-quatre
cinq rue Robert Chanel, cinquante-quatre mille cent seize Tantonville
cinq impasse Saint-Vincent-de-Paul, cinquante-quatre, zéro zéro zéro, Nancy
vingt-cinq rue Lepois, cinquante-quatre, zéro zéro zéro à Nancy
Allée Louis Brésolin, cinquante-quatre mille neuf cent dix Valleroy
Rue des Triboulottes, cinquante-quatre, deux cents Bruley
Boucle de la Châtelaine, Beuvillers
Rue de l'Abbaye de Clairlieu à Villers-lès-Nancy
cinq chemin de Liverdun
Rue du Grand Raimont au numéro cinq
huit rue Camille Rouzé, cinquante-quatre mille cent quatre-vingts Houdemont
quinze rue des Morées, cinquante-quatre, sept cents, Blénod-lès-Pont-à-Mousson
sept rue Pavillon du Parc, cinquante-quatre, six cent quatre-vingts à Errouville
Rue d'Arly, cinquante-quatre mille deux cent quarante Jœuf
Rue Jacques Delivre, cinquante-quatre, zéro zéro zéro Nancy
Rue du Banquillon, Réhon
Rue de Saint-Quirin à Bertrambois
trois route d'Urbule
Rue de Batinchêne au numéro six
quatre rue Lucien Riff, cinquante-quatre mille quatre cent dix Laneuveville-devant-Nancy
seize rue Donatien Haxaire, cinquante-quatre, cent vingt, Bertrichamps
vingt et un rue Maix Gammeron, cinquante-quatre, quatre cent quatre-vingts à Val-et-Châtillon
Rue du Luton, cinquante-quatre mille cinq cent soixante-dix Foug
Allée du Bonhomme, cinquante-quatre, deux cent quatre-vingts Seichamps
Rue de la Croix Jacob, Badonviller
Ruelle des Presles à Faulx
trente-neuf avenue Cinquième Avenue
Rue Thiébaux au numéro douze
six rue Joseph Robin, cinquante-quatre mille cent treize Blénod-lès-Toul
onze rue de la Botte Longue, cinquante-quatre, quatre cent trente, Réhon
seize rue de Nichefontaine, cinquante-quatre, neuf cent vingt à Villers-la-Montagne
Place de Karlsruhe, cinquante-quatre mille Nancy
Place Marguerite Guichard, cinquante-quatre, quatre cent soixante-dix Mamey
Rue de Dommartemont, Saint-Max
Rue de la Gale au Dry à Réhon
cinq rue du Clair Lacé
Rue Charles-Vue au numéro trente
neuf hameau de Grand Champ, cinquante-quatre mille huit cent quarante Velaine-en-Haye
dix-neuf rue de la Chapelle Sainte-Croix, cinquante-quatre, deux cents, Choloy-Ménillot
deux chemin de Verzel, cinquante-quatre, sept cents à Jezainville
Rue Canal de la Marne au Rhin, cinquante-quatre mille quatre cent dix Laneuveville-devant-Nancy
Chemin de Prény, cinquante-quatre, huit cent quatre-vingt-dix Villecey-sur-Mad
Parc de Boufflers, Nancy
Chemin des Grandes Rayes à Roville-devant-Bayon
onze rue du Grand Sauvoy
Allée du Galibier au numéro douze
cinq rue de Manonchamp, cinquante-quatre mille sept cent dix Fléville-devant-Nancy
quatorze rue de Haigneville, cinquante-quatre, deux cent quatre-vingt-dix, Bayon
quatre chemin de la Prairie de Vaux, cinquante-quatre, neuf cent trente à Diarville
Rue Edmond Goncourt, cinquante-quatre mille sept cent dix Ludres
Rue du Chanoine Pérignon, cinquante-quatre, trois cent quarante Pompey
Rue Lucien Gille, Labry
Rue d'Hermigny à Ugny
vingt-trois lotissement Les Naux
Allée de la Haute Bergerie au numéro quatre
deux rond-Point des Carrières, cinquante-quatre mille trois cent soixante Damelevières
neuf rue des As De quatorze/dix-huit, cinquante-quatre, cent vingt-deux, Vathiménil
douze rue de Reménaumont, cinquante-quatre, six cents à Villers-lès-Nancy
Impasse des Brasseurs, cinquante-quatre mille deux cent cinquante Champigneulles
Rue Fernand Peltier, cinquante-quatre, quatre cent soixante-dix Mamey
Rue du Poiron, Crépey
Impasse Aimé Béxon à Ludres
dix-neuf rue Drouin
Place Jean Lamour au numéro deux
dix-sept rue Gino Raimondi, cinquante-quatre mille quatre cent quatre-vingt-dix Piennes
dix rue Pierre Ory, cinquante-quatre, six cent quatre-vingt-dix, Lay-Saint-Christophe
quarante et un rue du Fond de Piedmont, cinquante-quatre, trois cent cinquante à Mont-Saint-Martin
Rue Claude Bolling, cinquante-quatre mille sept cent quarante Xirocourt
Rue du Haut de Corbeil, cinquante-quatre, cent seize Praye
Chemin de Nancy, Réméréville
Route de Bayon à Lamath
deux rue des Trois Frères Lièvre
Rue des Hazards au numéro quatre
neuf rue Saint-Guérin, cinquante-quatre mille sept cents Blénod-lès-Pont-à-Mousson
six rue du Champ des Féves, cinquante-quatre, deux cent trente, Chaligny
trente-trois rue Pierre Cremel, cinquante-quatre, quatre cent dix à Laneuveville-devant-Nancy
Chemin des Prisonniers, cinquante-quatre mille cent dix Dombasle-sur-Meurthe
Rue du Commandant Henry Lanrezac, cinquante-quatre, trois cents Lunéville
Rue Emile Thomas, Longwy
Haute Seille à Cirey-sur-Vezouze
treize rue de Virton
Rue de Puvenelle au numéro vingt-huit
cinq rue de la Cure d'Air, cinquante-quatre mille Nancy
douze rue Laurent Chatrian, cinquante-quatre, neuf cent cinquante, Saint-Clément
huit rue de l'Orpheline, cinquante-quatre, sept cents à Maidières
Chemin de Buret, cinquante-quatre mille quatre cent soixante-dix Rembercourt-sur-Mad
Rue du Clairbois, cinquante-quatre, cinq cent quarante Saint-Maurice-aux-Forges
Rue Robert Damery, Laneuveville-devant-Nancy
Lotissement au Porry à Chenières
quarante-sept faubourg de Humbépaire
Chemin du Haut du Ré au numéro un
quinze rue Cavalier Latour, cinquante-quatre mille six cent vingt Beuveille
dix route de Sommerviller, cinquante-quatre, cent dix, Dombasle-sur-Meurthe
deux rue Émile Chemine, cinquante-quatre, cinq cent quatre-vingts à Auboué
Rue Joseph Colombo, cinquante-quatre mille huit cents Labry
Rue de Forbach, cinquante-quatre, sept cents Pont-à-Mousson
Rue Gustave Raty, Longwy
Lotissement Cottage des Saules à Chavigny
dix lotissement Le Sorgue
Route de Doncourt au numéro un
vingt-quatre les Ecluses, cinquante-quatre mille deux cents Écrouves
trois rue de l'Hôpital Militaire, cinquante-quatre, deux cents, Toul
quatorze chemin de la Moselle, cinquante-quatre, quatre cent soixante à Liverdun
Route d'Hannonville, cinquante-quatre mille huit cents Sponville
Impasse Pierre-Ange Romain, cinquante-quatre, cent cinquante Briey
Rue du Bourbillon, Lalœuf
Allée du Loriot à Moncel-lès-Lunéville
dix rue de l'Abbé Schlienger
Rue du Bon Père au numéro vingt-deux
quatre TER chemin des Clouyères, cinquante-quatre mille quatre cent soixante-dix Thiaucourt-Regniéville
quatorze rue du Timois, cinquante-quatre, cent douze, Gibeaumeix
sept rue du Puits Sec, cinquante-quatre, quatre cent soixante à Liverdun
Ruelle Saint-Médard, cinquante-quatre mille cent trente Saint-Max
Place de France, cinquante-quatre, trois cent quatre-vingts Gézoncourt
Rue Victor Jungers, Doncourt-lès-Conflans
Avenue Marguerite Puhl-Demange à Briey
quinze rue de Ludres
Cités Nouvelles au numéro huit
deux rue Georges Lenôtre, cinquante-quatre mille six cent quatre-vingts Errouville
sept rue Mantrand, cinquante-quatre, six cent cinquante, Saulnes
sept impasse Retinchamps, cinquante-quatre, six cent dix à Éply
Rue du Quartier Richeval, cinquante-quatre mille quatre cent quatre-vingts Tanconville
Rue des Bises, cinquante-quatre, deux cents Villey-Saint-Étienne
Rue du Général Franiatte, Nomeny
Sentier des Greffins à Bouxières-aux-Chênes
cinquante-six rue Raymond Clause
Chemin Pré de Hon au numéro deux
vingt allée des Herbuelles, cinquante-quatre mille huit cent quarante Fontenoy-sur-Moselle
dix-sept impasse du Colonel Moll, cinquante-quatre, cinq cent vingt, Laxou
un rue Nicolas Bouton, cinquante-quatre, deux cent soixante à Saint-Jean-lès-Longuyon
Rue des Pâtres, cinquante-quatre mille six cent vingt Doncourt-lès-Longuyon
Rue du Nouveau Brin, cinquante-quatre, deux cent quatre-vingts Brin-sur-Seille
Rue du Fontaine Chopin, Essey-et-Maizerais
Chemin du Prélat à Azelot
vingt-deux rue des Chantons
Chemin Monseigneur au numéro deux
dix BIS rue du Manois, cinquante-quatre mille quatre cent quarante Herserange
quarante-six quai Charles François, cinquante-quatre, sept cents, Pont-à-Mousson
huit chemin de Pont-à-Mousson, cinquante-quatre, trois cent quatre-vingts à Gézoncourt
Le Clos Mathieu de Dombasle, cinquante-quatre mille deux cent vingt Malzéville
Rue du Moitrier, cinquante-quatre, six cents Villers-lès-Nancy
Rue de Froidmont, Bouxières-sous-Froidmont
Rue Étienne Bastien à Tellancourt
onze BIS rue de la Crépière
Chemin Departemental neuf cent treize au numéro huit
sept rue de Battant Pré, cinquante-quatre mille trois cent soixante-dix Bures
cinquante-trois rue Capitaine Paturaud, cinquante-quatre, deux cents, Chaudeney-sur-Moselle
deux rue Malvina Cézard, cinquante-quatre, cent quatre-vingts à Houdemont
Impasse Henri Lévy, cinquante-quatre mille Nancy
Rue d'Aulla, cinquante-quatre, cent quatre-vingt-dix Villerupt
Rue Jean Baptiste Boury, Bertrichamps
Rue Moulnot à Damelevières
vingt lotissement Les Noires Terres
Impasse Leclerc au numéro quatorze
six allée du Séminaire, cinquante-quatre mille cinq cent dix Art-sur-Meurthe
deux impasse du Chauxfour, cinquante-quatre, huit cent quarante, Velaine-en-Haye
huit rue de Seichamps, cinquante-quatre, quatre cent vingt-cinq à Pulnoy
Rue de Thumeréville, cinquante-quatre mille huit cents Jeandelize
Rue de Crévic, cinquante-quatre, cinq cents Vandœuvre-lès-Nancy
Route de Lorey, Bayon
Rue Pierre Masson à Ochey
treize rue de l'Isoard
Rue Sur l'Ecusson au numéro un
cinq rue d'Heubach, cinquante-quatre mille cinq cent vingt Laxou
vingt-quatre rue des Andelins, cinquante-quatre, cinq cent trente, Pagny-sur-Moselle
vingt-trois chemin du Val du Fer, cinquante-quatre, deux cent trente à Neuves-Maisons
Rond-Point Pierre de Ronsard, cinquante-quatre mille trois cents Lunéville
Rue Louis Bousval, cinquante-quatre, deux cent cinquante Champigneulles
Route de Maixe, Einville-au-Jard
Rond-Point Jean Renoir à Tomblaine
deux cent deux chemin des Vouachalons
Rue Simon Moycet au numéro onze
huit BIS rue Lucien Colson, cinquante-quatre mille cent soixante-dix Ochey
cinquante-neuf place Paul Erard, cinquante-quatre, trois cents, Jolivet
trente-trois rue Moncel, cinquante-quatre, huit cent quatre-vingt-dix à Bayonville-sur-Mad
Chemin de Derrière la Ville, cinquante-quatre mille cent soixante Pierreville
Rue du Duc Antoine, cinquante-quatre, zéro zéro zéro Nancy
Quai de Phalsbourg, Lunéville
Rue du Chanoine Peitz à Heillecourt
six rue Léon Songeur
Rue du dix-sept Septembre mille neuf cent quarante-quatre au numéro cent quarante
trois rue Ognon, cinquante-quatre mille neuf cent dix Valleroy
onze ruelle de l'Esprit, cinquante-quatre, zéro zéro zéro, Nancy
quatre rue du Général Balfourier, cinquante-quatre, zéro zéro zéro à Nancy
Cité de Gorcy, cinquante-quatre mille six cent soixante Moutiers
Rue de la Viergeotte, cinquante-quatre, deux cents Toul
Rue Émile Friant, Nancy
Rue du Tendon à Pulnoy
trois rue Barbezan
Rue Bionzon au numéro dix-huit
un BIS rue Théodore Chachay, cinquante-quatre mille cent vingt Bertrichamps
onze rue Charles Welche, cinquante-quatre, zéro zéro zéro, Nancy
six rue de l'Euron, cinquante-quatre, deux cent quatre-vingt-dix à Clayeures
Rue du Haut-Maix, cinquante-quatre mille quatre cent cinquante Halloville
Rue du Haut de Bras, cinquante-quatre, cent dix Dombasle-sur-Meurthe
Rue d'Albertville, Vandœuvre-lès-Nancy
Rue du Pré Montant à Bayon
deux cité des Belges
Rue de Molney au numéro un
quinze rue des Quatre Églises, cinquante-quatre mille Nancy
deux impasse des Pâtis, cinquante-quatre, neuf cent cinquante, Saint-Clément
vingt et un cité des Bingottes, cinquante-quatre, cent vingt à Baccarat
Rue de la Renommière, cinquante-quatre mille quatre cent soixante-dix Saint-Baussant
Rue Alfred Krug, cinquante-quatre, zéro zéro zéro Nancy
Ruelle de l'Ancienne Poste, Onville
Rue des Lanterniers à Jarville-la-Malgrange
trois rue Nicolas Noël
Rue Maurice Barrés au numéro sept
six rue de l'Ile de Corse, cinquante-quatre mille Nancy
trente-quatre chemin des Basses Ruelles, cinquante-quatre, deux cent soixante-dix, Essey-lès-Nancy
neuf rue de Poiroux, cinquante-quatre, six cent soixante-dix à Custines
Place Saint-Epvre, cinquante-quatre mille Nancy
Rue Adrienne Jouclard, cinquante-quatre, huit cent quatre-vingt-dix Onville
Route de la Grange en Haye, Villecey-sur-Mad
Rue de la Brigade à Heillecourt
cinq chemin du Sablier
Rue Paul Richard au numéro cinq
deux chemin du Petit Ban, cinquante-quatre mille cent dix Dombasle-sur-Meurthe
trois route du Chauffour, cinquante-quatre, trois cent quatre-vingts, Villers-en-Haye
vingt-quatre rue Lambanie, cinquante-quatre, deux cent quatre-vingts à Champenoux
Rue Saint-Antoine Prolongée, cinquante-quatre mille trois cent soixante Blainville-sur-l'Eau
Rue Pierre Paul Demoyen, cinquante-quatre, deux cent quatre-vingts Champenoux
Avenue du Colonel Péchot, Toul
Rue Daniel Paul-Cavallier à Nancy
deux place Provençal
Rue Pâquis en Forêt au numéro neuf
un clos des Abeilles, cinquante-quatre mille cent soixante Pierreville
cinq chemin de Thiary, cinquante-quatre, trois cents, Xermaménil
