Rue Gaston Brissac, soixante-neuf, zéro zéro huit Lyon
Chemin De Ripan, Bessenay
Rue Jean Collet à Meyzieu
cinq rue Cornil
Rue de Cuzieu au numéro trente-cinq
neuf rue Marius Chardon, soixante-neuf mille trois cent dix Pierre-Bénite
quatre place d'Ainay, soixante-neuf, zéro zéro deux, Lyon
douze rue Fouilloud Buyat, soixante-neuf, trois cent trente à Meyzieu
Chemin de Saule, soixante-neuf mille deux cent quatre-vingts Marcy-l'Étoile
Chemin du Pin Coupé, soixante-neuf, cent soixante Tassin-la-Demi-Lune
Route de Graves, Anse
Chemin de Grange Haute à Saint-Bonnet-de-Mure
deux cent quarante-quatre rue André Loste
Rue des Murinières au numéro deux
vingt-quatre impasse Gaston Tessier, soixante-neuf mille quatre cents Villefranche-sur-Saône
quatre-vingt-dix-neuf mille neuf cent quatre-vingt-dix-neuf chemin de la Vanère, soixante-neuf, deux cent cinquante, Montanay
cinq avenue Jean Capelle, soixante-neuf, cent à Villeurbanne
Route de Lozanne, soixante-neuf mille trois cent quatre-vingts Chazay-d'Azergues
Passage de l'Etoile, soixante-neuf, cent Villeurbanne
Allée de Traluy, Lentilly
Rue Jean Courjon à Meyzieu
vingt et un rue Barodet
Place Charles Dufraine au numéro neuf
trente-deux route de Lurcieux, soixante-neuf mille six cent quatre-vingt-dix Bessenay
deux chemin d'Écully, soixante-neuf, deux cent soixante, Charbonnières-les-Bains
soixante-dix allée du Manège, soixante-neuf, cent quarante à Rillieux-la-Pape
Allée des Grandes Varennes, soixante-neuf mille trois cent quatre-vingts Chazay-d'Azergues
Rue Docteur Ollier, soixante-neuf, cent Villeurbanne
Chemin de la Bouvardière, Feyzin
Rue Louis Hugonnencq à Lyon
deux cent soixante-six chemin de Chez Maraud
Chemin du Blain au numéro soixante
cinq impasse Le Bief du Moulin, soixante-neuf mille quatre cents Liergues
cent quatre C rue Michel Lapandery, soixante-neuf, deux cent dix, L'Arbresle
cent trente-quatre rue Nicolas Rissler, soixante-neuf, quatre cents à Villefranche-sur-Saône
Rue des Minguettes, soixante-neuf mille deux cents Vénissieux
Rue Paupière, soixante-neuf, deux cent soixante-dix Couzon-au-Mont-d'Or
Rue de Valissant Haut, Cours-la-Ville
Impasse du Carriau à Colombier-Saugnieu
trois chemin de Findez
Allée Belle Isabeau au numéro un
deux impasse des Vieux Ceps, soixante-neuf mille trois cent quatre-vingts Charnay
dix-sept impasse Fort Marais, soixante-neuf, trois cents, Caluire-et-Cuire
quatre chemin Marcel Michaud, soixante-neuf, cent vingt à Vaulx-en-Velin
Rue Roquette, soixante-neuf mille neuf Lyon
Chemin des Allobroges, soixante-neuf, trois cent vingt Feyzin
Rue Apollon, Saint-Genis-Laval
Allée des Estivales à Saint-Pierre-la-Palud
dix-huit rue Louis Burdin
Rue Danielle Faynel Duclos au numéro onze
treize impasse Marius Chardon, soixante-neuf mille deux cent trente Saint-Genis-Laval
neuf impasse Fradin, soixante-neuf, quatre cents, Villefranche-sur-Saône
dix-huit rue de la Cité de la Rive, soixante-neuf, cent vingt à Vaulx-en-Velin
Rue de la Félodière, soixante-neuf mille quatre cent vingt Ampuis
Barray, soixante-neuf, cinq cent trente Brignais
Chemin de Queue d'Âne, Irigny
Allée des Hautes Vallières à Saint-Genis-Laval
six rue de la Bigue
Chemin de la Patelière au numéro huit
dix-huit rue Alfred Béraud, soixante-neuf mille cent vingt Vaulx-en-Velin
onze rue de Peillon, soixante-neuf, deux cent vingt, Belleville
seize rue Bellicard, soixante-neuf, zéro zéro trois à Lyon
Rue Louis Fort, soixante-neuf mille cent Villeurbanne
Route de la Croix Polage, soixante-neuf, quatre cent soixante Blacé
Rue Hermann Sabran, Lyon
Rue des Terres Dessus à Lancié
quatre-vingt-six rue des Chantiers du Beaujolai
Route du Moulin Rose au numéro un
cent cinquante-neuf montée de la Gigandon, soixante-neuf mille deux cent dix Sourcieux-les-Mines
six allée des Pierres Dorées, soixante-neuf, cinq cent soixante-dix, Dardilly
quarante rue du Payet, soixante-neuf, huit cents à Saint-Priest
Montée du Boulard, soixante-neuf mille cinq cent trente Orliénas
Rue du Hêtre Pourpre, soixante-neuf, cent trente Écully
Chemin de Planchamp, Poleymieux-au-Mont-d'Or
Rue Basse Cruzille à Cours-la-Ville
six rue Monseigneur Ancel
Chemin de la Poizatière au numéro deux cent quatre-vingt-seize
dix rue de Batailly, soixante-neuf mille trois cent quatre-vingts Chazay-d'Azergues
un rue du Mas de la Forêt, soixante-neuf, cinq cents, Bron
cinq allée du Zonchet, soixante-neuf, huit cent quatre-vingt-dix à La Tour-de-Salvagny
Allée Des Bruyères, soixante-neuf mille cinq cent quatre-vingt-dix Saint-Symphorien-sur-Coise
Chemin des Broussatiéres, soixante-neuf, cent vingt-six Brindas
Place des Hautinières, Charbonnières-les-Bains
Chemin du Raimon à Sainte-Consorce
dix lotissement Domaine des Vignes
Rue de Verdun Boug de Thizy au numéro dix
douze rue Louis Muller, soixante-neuf mille deux cents Vénissieux
deux cent cinquante-cinq route d'Écussol, soixante-neuf, quatre cent trente, Quincié-en-Beaujolais
deux cent vingt-quatre rue des peupliers, soixante-neuf, sept cents à Saint-Jean-de-Touslas
Avenue Verguin, soixante-neuf mille six Lyon
Impasse Chapolard, soixante-neuf, trois cent quatre-vingts Charnay
Impasse du Bois Galland, Saint-Priest
Rue du Rozard à Vaugneray
quatre-vingt-quatre impasse de la Croix Senave
Lotissement La Sapinière au numéro neuf
vingt-trois rue Docteur Louis Théodore Jugnet, soixante-neuf mille cent quatre-vingt-dix Saint-Fons
quatre cent quatre-vingt-dix-neuf rue de Malataverne, soixante-neuf, trois cent quatre-vingts, Dommartin
cinq rue Antoine-Marius Bererd, soixante-neuf, six cent cinquante à Quincieux
Rue Antoine Salles, soixante-neuf mille deux Lyon
Pont Winston Churchill, soixante-neuf, zéro zéro quatre Lyon
Rue Gigodot, Lyon
Impasse de Montgriffon à Chaponost
vingt-deux rue Philémon Descaillots
Rue Commandant Marchand au numéro cinq
six allée Etienne Buyat, soixante-neuf mille cent cinquante Décines-Charpieu
deux cent quatre-vingt-dix-huit chemin de la Torchetière, soixante-neuf, sept cent soixante, Limonest
trente allée de Montregard, soixante-neuf, cent dix à Sainte-Foy-lès-Lyon
Rue Margurite Yourcenar, soixante-neuf mille quatre cents Gleizé
Chemin des Hauts de Celette, soixante-neuf, cinq cent quarante Irigny
Allée des Chambettes, La Tour-de-Salvagny
Chemin de Maillabert à Craponne
quarante-cinq allée de la Commune
Lotissement Les Hauts de Chalier au numéro deux
quatre rue Vaisse, soixante-neuf mille six Lyon
quatre-vingt-dix-neuf mille neuf cent quatre-vingt-dix-neuf allée Paul Savy, soixante-neuf, cent trente, Écully
neuf rue Docteur Victor Despeignes, soixante-neuf, zéro zéro huit à Lyon
Montée du Moly, soixante-neuf mille six cent quarante Cogny
Allée Henri Victor Chailly, soixante-neuf, trois cent quatre-vingts Chazay-d'Azergues
Passage Dumont, Lyon
Allée du Parc d'Estrées à Montanay
quatre cent vingt rue de la Maison Rose
Route du Nandron au numéro cent quarante-huit
quatre cent trente-neuf avenue André Lassagne, soixante-neuf mille deux cent dix L'Arbresle
soixante-dix chemin de Pressin, soixante-neuf, deux cent trente, Saint-Genis-Laval
quatre rue Louis Chapuy, soixante-neuf, zéro zéro huit à Lyon
Place Capitaine Maurice Anjot, soixante-neuf mille sept cent quatre-vingts Saint-Pierre-de-Chandieu
Rue François Giraud, soixante-neuf, quatre cents Villefranche-sur-Saône
Avenue de Gadagne, Saint-Genis-Laval
Impasse de la Fournache à Sainte-Foy-lès-Lyon
sept place du Griffon
Rue Chaussée d'Erpent au numéro quinze
six rue Ludovic Bonin, soixante-neuf mille deux cents Vénissieux
cinq rue Paul Montrochet, soixante-neuf, zéro zéro deux, Lyon
cinq chemin des Corneilles, soixante-neuf, cinq cent soixante-dix à Dardilly
Rue de la Chabaudière, soixante-neuf mille quatre cent quarante Taluyers
Rue du Falque, soixante-neuf, trois cent quatre-vingts Dommartin
Rue Jean Frizon, Amplepuis
Impasse du Bletton à Pusignan
cent soixante-dix chemin de la Belle Barbe
Chemin des Grandes Combes au numéro dix-huit
treize route de Cézailles, soixante-neuf mille sept cents Échalas
dix rue Professeur Roger Froment, soixante-neuf, six cent quatre-vingts, Chassieu
trois rue Chrysostome, soixante-neuf, huit cents à Saint-Priest
Route de Chuzelles, soixante-neuf mille trois cent soixante Simandres
Chemin de Grande Vigne, soixante-neuf, huit cents Saint-Priest
Passage Saint-Olive, Couzon-au-Mont-d'Or
Rue Louis Varignier à Vaulx-en-Velin
huit cents chemin de la Pénière
Chemin du Freydon au numéro trois
cent trente chemin des Bidons, soixante-neuf mille quatre cent trente Lantignié
soixante-seize impasse du Font Vernay, soixante-neuf, deux cent quatre-vingts, Marcy-l'Étoile
sept place Louis Chazette, soixante-neuf, zéro zéro un à Lyon
Avenue de Lauterbourg, soixante-neuf mille cent soixante Tassin-la-Demi-Lune
Avenue Henri Schneider, soixante-neuf, trois cent trente Jonage
Rue George Gershwin, Vénissieux
Passage Roger Bréchan à Lyon
dix-sept lotissement Hameau de Chatenay
Allée du Mas au numéro cent quatre-vingt-quatre
dix-huit chemin de Traine-Cul, soixante-neuf mille cinq cent soixante-dix Dardilly
un place de Paris, soixante-neuf, zéro zéro neuf, Lyon
six rue de Saint-Genis-Laval, soixante-neuf, cinq cent quarante à Irigny
Rue Armand Zipfel, soixante-neuf mille deux cent cinquante Albigny-sur-Saône
Allée de la Boule en Soie, soixante-neuf, cent vingt Vaulx-en-Velin
Rue Jean-Michel Grobon, L'Arbresle
Montée de Bel-Air à Albigny-sur-Saône
quatre-vingt-seize chemin de Charmont
Lotissement Le Clos du Monteiller au numéro sept
quatre-vingt-treize avenue du Pré aux Moutons, soixante-neuf mille quatre cent quatre-vingts Anse
sept impasse Général Brosset, soixante-neuf, cent quarante, Rillieux-la-Pape
huit rue Louis Teillon, soixante-neuf, cent à Villeurbanne
Rue Dunoir, soixante-neuf mille trois Lyon
Impasse Georges Courteline, soixante-neuf, trois cent trente Meyzieu
Rue de Vilanes, Collonges-au-Mont-d'Or
Allée des Cavatines à Lyon
trois fromental Ouest
Rue Renée Barge au numéro quatre
vingt-trois route de la Roue, soixante-neuf mille six cent quatre-vingt-dix Bessenay
huit rue de l'Archinière, soixante-neuf, trois cent soixante-dix, Saint-Didier-au-Mont-d'Or
quarante-cinq place de la Bouterie, soixante-neuf, cinq cent quatre-vingt-dix à Saint-Symphorien-sur-Coise
Montée de Beaulieu, soixante-neuf mille quatre cent quatre-vingts Morancé
Rue Antonin Terme, soixante-neuf, six cent vingt Chamelet
Rue Joseph Brissaud, Mions
Rue des Gobins à Charly
deux allée la Bâtie
Rue Chanoine Pavailler au numéro soixante-seize
deux cent trente-cinq rue du Crêt de la Roche, soixante-neuf mille deux cent dix Chevinay
huit rue Cardinal Girard, soixante-neuf, cinq cent quatre-vingt-dix, Saint-Symphorien-sur-Coise
six cent quatre-vingts route de Saint- Laurent, soixante-neuf, six cent dix à Saint-Genis-l'Argentière
Rue Perrin Frères, soixante-neuf mille deux cent quarante Thizy-les-Bourgs
Clos du Tupinier, soixante-neuf, deux cent quatre-vingt-dix Grézieu-la-Varenne
Boulevard du Commandant Thivel, Tarare
dix-sept e Rue à Saint-Priest
douze rue de Hartford
Rue Garon au numéro seize
quatre-vingt-six rue Joseph Ronin, soixante-neuf mille sept cent quatre-vingts Saint-Pierre-de-Chandieu
dix-huit montée de Fornel, soixante-neuf, six cent quarante, Ville-sur-Jarnioux
vingt-deux rue Victor Vermorel, soixante-neuf, quatre cents à Limas
Route du Grand Veissieux, soixante-neuf mille six cent cinquante Quincieux
Route de Corsel, soixante-neuf, six cent quarante Cogny
Rue Jean-Marie Merle, Vaulx-en-Velin
Chemin de Pontet et Crases à Écully
cinq cité de l'Yzeronne
Rue Jangot au numéro seize
trois impasse Turquet, soixante-neuf mille cinq Lyon
quatre allée du Domaine de la Perrière, soixante-neuf, deux cents, Vénissieux
dix rue Chatelard-Dru, soixante-neuf, deux cent dix à Lentilly
Rue Désiré Walter, soixante-neuf mille quatre cents Villefranche-sur-Saône
Rue du Docteur Jean Roux, soixante-neuf, cent quarante Rillieux-la-Pape
Route de Rivolet, Cogny
Passage Robert Namiand à Quincieux
soixante allée du Bernay
Rue Jean-Baptiste Simon au numéro trente-cinq
trois chemin du Colin, soixante-neuf mille trois cent soixante-dix Saint-Didier-au-Mont-d'Or
vingt-deux BIS avenue Édouard Aynard, soixante-neuf, cent trente, Écully
neuf rue Jean Cardona, soixante-neuf, zéro zéro trois à Lyon
Lotissement des Cazardes, soixante-neuf mille cinq cent vingt Grigny
Route de Vindry, soixante-neuf, quatre cent quatre-vingt-dix Saint-Loup
Rue Jean-Baptiste Anjolvy, Couzon-au-Mont-d'Or
Rue Roposte à Lyon
deux cent soixante-huit route du Morillon
Montée de Vauzelles au numéro vingt-cinq
cent quarante-huit avenue de Lacroix-Laval, soixante-neuf mille deux cent quatre-vingts Marcy-l'Étoile
quatre impasse Le Clos des Sapins, soixante-neuf, sept cent vingt, Saint-Bonnet-de-Mure
cent trente-trois rue Philippe Héron, soixante-neuf, quatre cents à Villefranche-sur-Saône
Cite Marcel Cachin, soixante-neuf mille cent vingt Vaulx-en-Velin
Montée de la Soeur Vially, soixante-neuf, trois cents Caluire-et-Cuire
Rue de Léonard Cimetière, Villefranche-sur-Saône
Chemin des Mouillés à Grézieu-la-Varenne
cinq clos des Chassagnes
Allée Cazot au numéro seize
six chemin des Aveynières, soixante-neuf mille six cent cinquante Saint-Germain-au-Mont-d'Or
deux impasse des Razes, soixante-neuf, trois cent vingt, Feyzin
vingt-neuf rue des Vérines, soixante-neuf, huit cent quatre-vingt-dix à La Tour-de-Salvagny
Boulevard Lucien Sampaix, soixante-neuf mille cent quatre-vingt-dix Saint-Fons
Boulevard de Ludna, soixante-neuf, huit cent trente Saint-Georges-de-Reneins
Rue Auguste Chollat, Lyon
Montée de Rognard à Chaponnay
douze rue de Boutras
Chemin du Chanay au numéro vingt et un
trois impasse Pierre Proudhon, soixante-neuf mille neuf cent soixante Corbas
sept B rue Gabillot, soixante-neuf, zéro zéro trois, Lyon
dix rue Belestat, soixante-neuf, deux cent dix à L'Arbresle
Impasse Bernard Vallot, soixante-neuf mille cinq cents Bron
Avenue d'Annonay, soixante-neuf, cinq cents Bron
Les Hauts d'Albigny, Albigny-sur-Saône
Rue de Champemin à Vourles
sept cent cinquante route du Souzy
Rue Jean Vatoux au numéro vingt-sept
dix-sept avenue Philibert Gaillard, soixante-neuf mille deux cent cinquante Fleurieu-sur-Saône
six place Docteur Lazare Goujon, soixante-neuf, cent, Villeurbanne
deux rue Aymon de Virieu, soixante-neuf, cinq cent quatre-vingts à Sathonay-Village
Rue Jean Berlioz, soixante-neuf mille deux cents Vénissieux
Rue Marcel Desplaces, soixante-neuf, trois cent trente Meyzieu
Allée du Val de Saône, Pommiers
Rue Auguste Aucour à Villefranche-sur-Saône
un allée Jean Antoine Dubost
Rue René Venturini au numéro trente et un
dix rue de Castries, soixante-neuf mille deux Lyon
deux rue de la Micolière, soixante-neuf, trois cent quatre-vingts, Chazay-d'Azergues
deux rue des Sarmentelles, soixante-neuf, deux cent vingt à Belleville
Rue de Piamot, soixante-neuf mille sept cent trente Genay
Rue du Bricollet, soixante-neuf, deux cent dix Lentilly
Côte des Vaches, Irigny
Rue Pierre Gay à Décines-Charpieu
deux BIS avenue Honoré Esplette
Chemin du Pinet à la Molière au numéro quatre
quatorze place Humbert trois, soixante-neuf mille quatre cents Villefranche-sur-Saône
quarante chemin du Ronzay, soixante-neuf, quatre cent quatre-vingts, Marcy
trente-quatre rue Francisque Bois, soixante-neuf, sept cent quatre-vingts à Saint-Pierre-de-Chandieu
Impasse Alexandre Aujas, soixante-neuf mille trois Lyon
Rue de la Barmelle, soixante-neuf, deux cent cinquante Montanay
Route de la Rocade, Toussieu
Place Abbé Pierre à Lyon
cent vingt-huit route du Garret
Place Port du Bief au numéro douze
huit chemin de la Dresière, soixante-neuf mille six cent quatre-vingt-dix Courzieu
six cent quatre-vingt-onze rue des Babets, soixante-neuf, deux cent vingt, Dracé
trente-huit route de la Vallée du Garon, soixante-neuf, cinq cent dix à Thurins
Rue de la Tase, soixante-neuf mille cent vingt Vaulx-en-Velin
Impasse de la Bergère, soixante-neuf, quatre cents Gleizé
Impasse des Troignes, Craponne
Impasse du Drivet à Civrieux-d'Azergues
soixante rue Sainte-Anne de Baraban
Montée Saint-Barthélémy au numéro trois
quinze rue Jean Bourgey, soixante-neuf mille cent Villeurbanne
trois ruelle Sous l'Église, soixante-neuf, sept cents, Échalas
vingt-sept rue des Trois Amants, soixante-neuf, deux cent soixante-dix à Fontaines-Saint-Martin
Avenue du Docteur Zamenhof, soixante-neuf mille trois cents Caluire-et-Cuire
Square des Ancolies, soixante-neuf, six cent cinquante Saint-Germain-au-Mont-d'Or
Impasse Bourru, Villeurbanne
Place de la Baleine à Lyon
cent onze route de Sainte-Geneviève
Rue Émile Chaze au numéro treize
six rue Germain David, soixante-neuf mille trois Lyon
cent soixante-trois impasse du Bouchage, soixante-neuf, sept cents, Givors
quinze rue du Penon, soixante-neuf, sept cent quatre-vingts à Mions
Rue Pouteau, soixante-neuf mille un Lyon
Allée du Crêt, soixante-neuf, trois cent quatre-vingts Dommartin
Boulevard Bellevue Bourg de Thizy, Thizy-les-Bourgs
Rue de Garantèze à Irigny
quatre-vingt-dix-sept allée de la Verpillère
Allée Maurice Druon au numéro quatre
dix rue Henri Forest, soixante-neuf mille cent soixante-dix Tarare
trois impasse de Montbel, soixante-neuf, trois cent quatre-vingt-dix, Vourles
cinq place Decurel, soixante-neuf, sept cent soixante à Limonest
Rue Eugène Riboulet, soixante-neuf mille cent soixante-dix Tarare
Rue Henri Gormand, soixante-neuf, cent vingt Vaulx-en-Velin
Rue François Crozat, Givors
Allée des Colombières à Craponne
dix-huit rue Alexis Petit
six e Rue au numéro dix-sept
dix chemin des Buissonnières, soixante-neuf mille trois cent trente Jonage
quatre-vingt-deux rue du Cunier, soixante-neuf, sept cent soixante, Limonest
neuf rue du Docteur Vacher, soixante-neuf, sept cent vingt à Saint-Laurent-de-Mure
Rue Méhy, soixante-neuf mille trois cent trente Meyzieu
Allée de la Bretonniere, soixante-neuf, cinq cent soixante-dix Dardilly
Allée des Greffières, La Tour-de-Salvagny
Boulevard de l'Yzeron à Oullins
quatre rue Louis Querbes
Chemin du Mont Pilat au numéro quatre
cent cinquante et un rue Bayoux, soixante-neuf mille quatre cent quatre-vingts Anse
trois cent trois petit Chemin Petit Che de Bordelan, soixante-neuf, quatre cents, Villefranche-sur-Saône
un place Claudius Bodet, soixante-neuf, deux cent quarante à Saint-Vincent-de-Reins
Rue du Py, soixante-neuf mille trois cent quatre-vingt-dix Vernaison
Montée des Marronniers, soixante-neuf, six cent quarante Ville-sur-Jarnioux
Chemin de la Guillère, Dardilly
Chemin de Balme Baron à Rillieux-la-Pape
soixante-quinze route de l'Ancienne Église
Chemin de Charrière Blanche au numéro deux
dix-sept chemin du Coteon, soixante-neuf mille sept cents Givors
dix-huit chemin du Coq Gaulois, soixante-neuf, cinq cent trente, Brignais
quatre impasse de la Combe aux Loups, soixante-neuf, trois cent trente à Meyzieu
Chemin du Postier, soixante-neuf mille trois cent soixante-dix Saint-Didier-au-Mont-d'Or
Rue Gensoul, soixante-neuf, cent dix Sainte-Foy-lès-Lyon
Rue de Gutturieu, Bully
Rue René et Raphaël Ringue à Chassieu
quatre BIS chemin de Petite Champagne
Chemin d'Alix au numéro douze BIS
dix-sept montée de la Sarra, soixante-neuf mille cinq Lyon
quatre allée du Pastour, soixante-neuf, cent trente, Écully
quinze rue Pierre Fourel, soixante-neuf, deux cent trente à Saint-Genis-Laval
Chemin des Gaupières, soixante-neuf mille trois cent quatre-vingt-dix Vernaison
Rue Ennemond Ullard, soixante-neuf, quatre cents Villefranche-sur-Saône
Rue Pléney, Lyon
Rue Dominique Perfetti à Lyon
quatre-vingt-dix montée des Pins
Rue Alexandre Vial au numéro treize
quatre place du Lieutenant Morel, soixante-neuf mille un Lyon
neuf rue Louis de Saint-Just, soixante-neuf, deux cents, Vénissieux
soixante-trois rue Frédéric Monin, soixante-neuf, quatre cent quarante à Mornant
Allée des Fanchons, soixante-neuf mille deux cent quatre-vingt-dix Saint-Genis-les-Ollières
Chemin de la Champine, soixante-neuf, quatre cent quarante Taluyers
Rue Lanterne, Lyon
Chemin de Malataverne à La Tour-de-Salvagny
dix-huit allée des Jardins de Francheville
Avenue Notre-Dame de la Lorette au numéro trois cent vingt-trois
un allée du Joffroy, soixante-neuf mille deux cent dix Éveux
trente-deux rue Bancel, soixante-neuf, zéro zéro sept, Lyon
onze placa de la Merlatière, soixante-neuf, deux cent vingt à Lancié
Impasse Albert de Mun, soixante-neuf mille quatre cents Villefranche-sur-Saône
Impasse de la Terre aux Chantres, soixante-neuf, huit cents Saint-Priest
Place Général André, Lyon
Rue Ferrandière à Lyon
douze rue Antoine Bazin
Route du Kiosque au numéro vingt
treize rue Louis Michoy, soixante-neuf mille cent vingt Vaulx-en-Velin
huit rue Maguy France, soixante-neuf, cent vingt, Vaulx-en-Velin
soixante-sept montée de Jussieu, soixante-neuf, six cent quatre-vingt-dix à Bessenay
Avenue Marie-Thérèse Prost, soixante-neuf mille deux cent cinquante Neuville-sur-Saône
Chemin de la Vigneronne, soixante-neuf, cent vingt-six Brindas
Rue du Val d'Isère, Caluire-et-Cuire
Place Tobie Robatel à Lyon
trois rue Velten
Rue Saint Sébastien au numéro treize
vingt impasse des Marendiers, soixante-neuf mille huit cents Saint-Priest
huit rue des Gravelines, soixante-neuf, huit cent quatre-vingt-dix, La Tour-de-Salvagny
onze impasse du Buisset, soixante-neuf, six cents à Oullins
Rue de l'Arbuel, soixante-neuf mille quatre cent vingt Condrieu
Rue Jean Biez, soixante-neuf, deux cent trente Saint-Genis-Laval
Chemin de Saint-Gobain, Saint-Fons
Rue Jean-Pierre Trépot à Fontaines-Saint-Martin
dix impasse Burdy
Passage du Ténor au numéro dix
cinq cent cinquante-huit route de Sain Bel, soixante-neuf mille deux cent dix L'Arbresle
huit appagnié, soixante-neuf, quatre cent trente, Lantignié
trois chemin de Cachemouche, soixante-neuf, deux cent quatre-vingts à Sainte-Consorce
Avenue des Temps Modernes, soixante-neuf mille huit cents Saint-Priest
Chemin de la Rave, soixante-neuf, deux cent dix Lentilly
Ancienne Grande Rue, Châtillon
Route de Montessuis à Marcy
onze rue Frédéric Dard
Route du Verdy au numéro cent soixante-dix-neuf
trente-cinq montée Saint-Eloi, soixante-neuf mille quatre cents Liergues
quatre place Lumiere, soixante-neuf, six cent soixante-dix, Vaugneray
cinq passage Verdier Sud, soixante-neuf, cinq cents à Bron
Passage Henri Malartre, soixante-neuf mille sept cent trente Genay
Avenue du Crottay, soixante-neuf, trois cent trente Meyzieu
Rue du Rupetit, Genas
Rue Cortelain à Bron
sept allée du Château Lyonnet
Les Vavres au numéro deux cent soixante-huit
trente et un rue du Docteur Besançon, soixante-neuf mille quatre cents Villefranche-sur-Saône
cent quatorze rue des Humberts, soixante-neuf, trois cent quatre-vingts, Dommartin
quatre cent quarante-six route du Carry, soixante-neuf, quatre cent quatre-vingts à Pommiers
Allée de Pré-Magnin, soixante-neuf mille huit cent quatre-vingt-dix La Tour-de-Salvagny
Rue Decomberousse, soixante-neuf, cent Villeurbanne
Passage Raisin, Villefranche-sur-Saône
Allée des Ormalines à Craponne
sept allée Horizon
Square Simon Saint-Jean au numéro cinquante-deux
deux D chemin de la Bastéro, soixante-neuf mille trois cent cinquante La Mulatière
quinze impasse Fontanières, soixante-neuf, cent, Villeurbanne
huit passage des Troupeaux, soixante-neuf, huit cents à Saint-Priest
Chemin du Buisset, soixante-neuf mille trois cent cinquante La Mulatière
Rue François Garcin, soixante-neuf, zéro zéro trois Lyon
Allée de l'Ardelière, Grézieu-la-Varenne
Crécy Nord à Saint-Didier-au-Mont-d'Or
dix impasse Fernand Rey
Impasse du Capot au numéro dix
cinq impasse des Frères Rivier, soixante-neuf mille six cent quatre-vingts Chassieu
sept rue Jean-Marie Chevalier, soixante-neuf, trois cent quatre-vingt-dix, Vourles
quatorze quai de Villevert, soixante-neuf, deux cent cinquante à Albigny-sur-Saône
Chemin du Gonnet, soixante-neuf mille cent soixante-dix Tarare
Chemin de Boistrolles, soixante-neuf, six cent vingt Le Bois-d'Oingt
Rue du Montelier, Vénissieux
Lotissement La Joannas à Saint-Andéol-le-Château
cinq allée du Parasoleil
Rue Saint Gervais au numéro cinquante-trois
sept cent soixante et onze chemin des Fûts, soixante-neuf mille quatre cent quatre-vingts Marcy
vingt-huit rue Chanel, soixante-neuf, six cent quatre-vingt-dix, Bessenay
huit allée Girard, soixante-neuf, six cent quatre-vingt-dix à Bessenay
Rue Songieu, soixante-neuf mille cent Villeurbanne
Route des Gambins, soixante-neuf, deux cent cinquante Poleymieux-au-Mont-d'Or
Rue du Puits Henri, Givors
Chemin du Plat Saint-Romain à Saint-Laurent-de-Vaux
quatre-vingt-dix-neuf mille neuf cent quatre-vingt-dix-neuf chemin Rampon
Allée des Chardonnets au numéro quatre
cent dix-neuf route du Cherest, soixante-neuf mille cent vingt-six Brindas
deux cent quarante allée des Haies, soixante-neuf, quatre cent quatre-vingts, Morancé
soixante-dix-neuf rue Quivogne, soixante-neuf, zéro zéro deux à Lyon
Rue du Père Chevrier, soixante-neuf mille deux cent soixante-dix Fontaines-Saint-Martin
Rue Louis et Eugène Berlot, soixante-neuf, quatre cent soixante Blacé
Impasse de la Grande Vie, Chassieu
Chemin du Grand Puys à Brindas
soixante impasse de l'Horme
Rue Jean Jullien au numéro deux
dix rue du Pont Chollet, soixante-neuf mille quatre cent quatre-vingts Anse
quarante-deux montée du Grappillon, soixante-neuf, trois cents, Caluire-et-Cuire
deux rue Le Royer, soixante-neuf, zéro zéro trois à Lyon
Rue Combet-Descombes, soixante-neuf mille trois Lyon
Impasse Lucien Ladous, soixante-neuf, zéro zéro huit Lyon
Quai Saint-Vincent, Lyon
Avenue du Velin à Feyzin
quarante-neuf avenue Marius Mathon
Chemin du Neyra au numéro trente-quatre
cinquante-quatre allée des Deux Pierre, soixante-neuf mille quatre cent quatre-vingts Pommiers
