deux impasse Croix de Mission, trente-neuf, trois cent vingt, Loisia
deux avenue Rockefeller, trente-neuf, cent à Dole
Rue Fontaine du Frêne, trente-neuf mille deux cent quarante Arinthod
Route de Saint-Lupicin, trente-neuf, cent soixante-dix Cuttura
Place de l'Ancien Collège, Lons-le-Saunier
Rue du Rejaison à Monnet-la-Ville
sept rue du Clos de la Forge
Chemin du Pichet au numéro vingt et un
douze rue d'Arsurette, trente-neuf mille deux cent cinquante Arsure-Arsurette
quarante-deux hameau Sur Le Moulin, trente-neuf, cent cinquante, Grande-Rivière
six rue des Champs d'Asi, trente-neuf, trois cent cinquante à Pagney
Rue En Corps, trente-neuf mille trois cent soixante Vaux-lès-Saint-Claude
Rue des Cournues, trente-neuf, cent Choisey
Chemin des Chintres, Le Deschaux
Rue du Commandant René Foucaud à Lons-le-Saunier
sept route de Mienne
Rue des Aigeottes au numéro sept
quatre-vingts route de Chaussenans, trente-neuf mille huit cents Chamole
quinze place Precipiano, trente-neuf, cent, Dole
quatre rue des Toupes, trente-neuf, zéro zéro zéro à Lons-le-Saunier
Route du Lézinois, trente-neuf mille cent trente Bonlieu
La Marbriere, trente-neuf, cent quatre-vingt-dix Cuisia
Route des Corvées, Supt
Rue des Baronnes à Lons-le-Saunier
deux cent dix-sept rue de la Saive
Rue du Mont Ravet au numéro sept
un rue de Turlu, trente-neuf mille trois cent quatre-vingts Vaudrey
douze A rue Maurice Lamy, trente-neuf, quatre cent dix, Saint-Aubin
douze petit Quai, trente-neuf, quatre cents à Morez
Route de la Bienne, trente-neuf mille quatre cents Morbier
Rue de Jean qui Vient, trente-neuf, cinq cent soixante-dix Perrigny
Rue de la Gissière, Saint-Lothain
Route de Villeneuve Sarrogna à Sarrogna
dix-neuf rue Principale Champagne
Rue de la ZAC au numéro huit
dix-huit rue Sous la Tour, trente-neuf mille deux cent soixante Meussia
deux cent quarante rue des Sapins Pellier, trente-neuf, cent trente, Charcier
onze rue des Chastignets, trente-neuf, cinq cents à Tavaux
Chemin de la Grandefontaine, trente-neuf mille deux cent cinquante Censeau
Quartier en Billin, trente-neuf, deux cent dix Nevy-sur-Seille
Rue d'Anjoux, Tavaux
Chemin de Sous Montoiseau à Lajoux
soixante-dix rue de l'Ancien Chalet
Route Nationale soixante-treize au numéro quatre
neuf rue Marin la Meslée, trente-neuf mille cinq cents Tavaux
deux BIS rue Élie Simonin, trente-neuf, cent trente, Charézier
quatre impasse Rouget de Lisle, trente-neuf, cent quatre-vingt-dix à Digna
Rue Sarrazin, trente-neuf mille cent quarante Commenailles
Rue de la Cuisance, trente-neuf, six cents Les Planches-près-Arbois
Rue de Côte Poire, Sirod
Route du Lac d'Antre à Villards-d'Héria
trois impasse des Daphnés
Rue Clos Jules Grévy au numéro huit
dix rue du Crapaud, trente-neuf mille deux cent quatre-vingt-dix Menotey
quatorze rue du Docteur Fortunat Pactet, trente-neuf, trois cent quatre-vingts, Mont-sous-Vaudrey
deux les Margillands, trente-neuf, trois cent vingt à Montagna-le-Templier
Rue Delezay, trente-neuf mille cent cinquante Saint-Laurent-en-Grandvaux
Rue des Rondins, trente-neuf, huit cents Poligny
Route de la Combe du Noyer, Maynal
Place de l'Academie à Pretin
trois cent trente-cinq rue sur les Auges
Rue Ferdinand Thorax au numéro dix-neuf
sept chemin Departemental vingt-sept A Epercy, zéro un, cinq cent quatre-vingt-dix Lavancia-Epercy
trente et un rue de la Portelle, trente-neuf, deux cent quarante, Arinthod
huit rue de la Vy Borgne, trente-neuf, deux cent quarante à Chisséria
Chemin de Montanoisel, trente-neuf mille deux cent dix Montain
Rue Antide-Janvier, trente-neuf, deux cents Saint-Claude
Rue de Fontenotte, Damparis
Route de Colonne à Bersaillin
deux chemin de Mauffans
Route des Selmenbergs au numéro six cent quatre
vingt-quatre rue Jules Secretant, trente-neuf mille cent trente Charézier
un rue des Annexes, trente-neuf, cent, Dole
deux cent dix lotissement sur la Crête, trente-neuf, trois cents à Sapois
Rue du Bas de Courbeau, trente-neuf mille deux cent dix Voiteur
Rue de Trelire, trente-neuf, deux cent quarante Lavans-sur-Valouse
Impasse Layat, Vosbles
Chemin de Prayat au Vaudioux
onze rue du Spoutnick
Lotissement Le Boulu au numéro six mille cent trente-six
cent soixante et onze chemin des Alliés, trente-neuf mille deux cent vingt Les Rousses
trois place du Colonel Varroz, trente-neuf, deux cent soixante-dix, Orgelet
cinq cent soixante et un rue Montenoise, trente-neuf, cent quarante à Villevieux
Impasse du Revers des Vaux, trente-neuf mille sept cents Orchamps
Rue du Petit Crans, trente-neuf, trois cents Sirod
Rue de Jeanne d'Arc, Pannessières
Rue François Laire à Dole
deux rue de l'Heute
Rue de la Confise au numéro douze
quatre grand's Rues, trente-neuf mille cent quatre-vingt-dix Maynal
quatre cent quatre-vingt-un rue du Poissonnard, trente-neuf, cinq cent soixante-dix, Courlans
quatre route des Vignes de Bry, trente-neuf, cent quatre-vingt-dix à Maynal
Route de Domblans, trente-neuf mille deux cent trente Bréry
Chemin des Frittes, trente-neuf, deux cent dix Frontenay
Rue des Fossés du Nord, Chissey-sur-Loue
Chemin de la Choulière à Commenailles
neuf route de Gouaille
Rue de Dambernard au numéro cinq
cinq route de Pont du Navoy, trente-neuf mille huit cents Besain
huit chemin du Belieu, trente-neuf, cent dix, La Chapelle-sur-Furieuse
trois avenue Charles Sauria, trente-neuf, deux cent trente à Saint-Lothain
Rue Jean Lejeune, trente-neuf mille cent Dole
Rue de la Fontaine des Auges, trente-neuf, trois cent cinquante Gendrey
Passage des Deux Portes, Saint-Amour
Rue Vermot à Mesnay
vingt rue des Familiers
Route du Petit Noir au numéro onze
mille quarante-deux route de Pantaise, trente-neuf mille cinq cent soixante-dix Montmorot
trois la Combe du Lac, trente-neuf, trois cent dix, Lamoura
deux chemin de la Plage Blanche, trente-neuf, trois cent quatre-vingts à Ounans
Impasse de la Ranche, trente-neuf mille trois cent vingt Dessia
Rue des Favières, trente-neuf, deux cent cinquante Bief-du-Fourg
Rue Xavier Joly, Dole
Chemin du Cornot à Peseux
dix-sept rue du Moulin des Chênes
Route de Sirod au numéro vingt-sept
dix cité Foch, trente-neuf mille Lons-le-Saunier
deux route d'Orbagna, trente-neuf, cent quatre-vingt-dix, Beaufort
sept rue Ernest Bouvet, trente-neuf, cent cinquante à Saint-Laurent-en-Grandvaux
Rue d'Ain, trente-neuf mille trois cents Champagnole
Chemin du Pan, trente-neuf, six cents Molamboz
Rue de Laya, Montrevel
Route des Chauvettes à La Chaumusse
six rue du Mont Turot
Chemin de Biarne au numéro cinq
un la Renardière, trente-neuf mille cent cinquante Prénovel
trois cent soixante-dix-neuf rue des Bauches, trente-neuf, deux cent dix, Domblans
trente-deux rue Croix d'Amont, trente-neuf, cinq cents à Tavaux
Rue de Très la Ville, trente-neuf mille trois cent soixante-dix Les Bouchoux
Rue Eliette Schenneberg, trente-neuf, cent Dole
Chemin de Mancy, Lons-le-Saunier
Route du Brioland aux Rousses
huit rue du Clos Piffond
Quartier Fontaine Ronde au numéro cent quarante-trois
six A rue de la Merceret, trente-neuf mille cinq cents Abergement-la-Ronce
cinq impasse des Conteroux, trente-neuf, quatre cents, Longchaumois
huit rue Adèle, trente-neuf, cinq cents à Tavaux
Cité des Prés Sainte-Marie, trente-neuf mille cent dix Salins-les-Bains
Rue de la Brizarde, trente-neuf, cent quarante Ruffey-sur-Seille
Chemin des Nues, Cramans
Rue du Haut-Village à Larrivoire
trente-quatre route de la Porte de France
Route de Tassenières au numéro dix-huit
sept rue Adrien Muller, trente-neuf mille trois cents Champagnole
sept côte de Chaumont, trente-neuf, deux cents, Saint-Claude
deux route de PIcarreau, trente-neuf, huit cents à Fay-en-Montagne
Rue de la Bardeuse, trente-neuf mille trois cents Les Nans
Route du Maquis du Haut Jura, trente-neuf, cent soixante-dix Cuttura
Route de Plainoiseau, Domblans
Place du Pasquier à Choisey
soixante chemin du Defois
Rue du Clos Rond au numéro douze
cent cinquante-deux boulevard Théodore Vernier, trente-neuf mille Lons-le-Saunier
trois rue Le Moulard, trente-neuf, huit cents, Fay-en-Montagne
vingt-sept rue des Frères Larceneux, trente-neuf, zéro zéro zéro à Lons-le-Saunier
Montée en Combe Erlin, trente-neuf mille cinq cent soixante-dix Montmorot
Route des Jourats, trente-neuf, cent cinquante Saint-Laurent-en-Grandvaux
Les Champs Martin, Morbier
Rue Vieille d'Arbois à Mont-sous-Vaudrey
dix rue de Tyr
Chemin Leontine au numéro trois
quinze rue Marcel Vincent, zéro un, cinq cent quatre-vingt-dix Lavancia-Epercy
douze chemin de la Bataille, trente-neuf, deux cents, Avignon-lès-Saint-Claude
deux route des Vornes, trente-neuf, cent vingt aux Hays
Rue de la Grand Ranche, trente-neuf mille deux cent soixante Charchilla
Rue de Mirlory, trente-neuf, trois cent trente Port-Lesney
Rue Faustin Besson, Dole
Rue des Epommiers à Valempoulières
vingt-neuf rue du Pré Grand Louis
Rue de la Messotte au numéro quatre
trois rue Herman Picaud, trente-neuf mille trois cents Champagnole
trois rue du Molard à Goujon, trente-neuf, deux cent soixante-dix, Orgelet
sept route d'Augisey, trente-neuf, cent quatre-vingt-dix à Beaufort
Rue du Saugeais, trente-neuf mille cinq cent soixante-dix Vevy
Rue Christin, trente-neuf, deux cents Saint-Claude
Rue des Berges de l'Étang, Commenailles
Lotissement des Combettes à Augisey
cinq rue Meix des Guyons
Chemin de Savignois au numéro onze
un quartier Sous la Roche, trente-neuf mille cinq cent soixante-dix Saint-Laurent-la-Roche
un place du un er Mai, trente-neuf, cent, Champvans
quarante-cinq impasse du Curtil Parez, trente-neuf, trois cents à Sapois
Rue François Demesmay, trente-neuf mille cent Dole
Rue du Noyer Daru, trente-neuf, deux cent soixante-dix Orgelet
Rue Emmanuel Vauchez, Courlans
Rue de Frontignon à Sirod
mille six cent quarante route de la Chaux Mourant
Rue Léopold Alixant au numéro trois
neuf rue de l'Oberlin, trente-neuf mille deux cent quatre-vingt-dix Menotey
deux rue des Prés Millats, trente-neuf, deux cent soixante-dix, Orgelet
soixante chemin des Vieux Monts, trente-neuf, cinq cent soixante-dix à Pannessières
Rue Mouffetard, trente-neuf mille trois cent trente Mouchard
Rue Belladone, trente-neuf, deux cent vingt Prémanon
Route de Foncine, Les Planches-en-Montagne
Rue du Moularot à Aromas
un impasse des Chenevriers
Impasse les Saillites au numéro six
deux allée de la Gentillere, trente-neuf mille six cents Arbois
sept rue Général Lasnes, trente-neuf, cent, Dole
quatre rue des Coulemaches, trente-neuf, cent quatre-vingt-dix à Cousance
Rue des Arrivoirs, trente-neuf mille deux cents Saint-Claude
Rue du Bois l'Evêque, trente-neuf, sept cents Évans
Avenue Thurel, Lons-le-Saunier
Route de Lains à Montagna-le-Templier
quarante-sept rue de Jousseau
Rue Auguste Lançon au numéro quarante-six
dix-sept route de Darbonnay, trente-neuf mille deux cent trente Saint-Lothain
cent trente-cinq route de Samiset, trente-neuf, trois cent soixante, Larrivoire
cent quarante et un rue des Champs de Neige, trente-neuf, deux cent vingt aux Rousses
Rue de Chanois, trente-neuf mille cent Authume
Chemin de la Cabusse, trente-neuf, quatre cents Morbier
Rue des Pêchettes, Macornay
Rue du Lancier à La Favière
onze place Grévy
Montée de la Bessoule au numéro neuf
huit rue du Mas d'Escrit, trente-neuf mille cent Foucherans
trois rue des Voituriers, trente-neuf, cent trente, Marigny
trente-six rue du Petit Rondeau, trente-neuf, cent quarante à Ruffey-sur-Seille
Place Guillaume de Poupet, trente-neuf mille deux cent dix Baume-les-Messieurs
Rue des Champs-Taillard, trente-neuf, cent cinquante Chaux-des-Crotenay
Rue René Dalloz, Moirans-en-Montagne
Route de Robinet à L'Étoile
sept rue de Bermond
Rue du Moitié au numéro cinq
deux rue de la Claive, trente-neuf mille deux cent cinquante Mignovillard
huit bois Richier, trente-neuf, cinq cent soixante-dix, Montmorot
un rue Antoine Chariot, trente-neuf, cent à Dole
Rue de Fourg, trente-neuf mille sept cents Courtefontaine
Grange Bedey, trente-neuf, cent quarante Larnaud
Rue Montoiseau, Jeurre
Rue des Cent Ecus à Cuisia
cent chemin du Haut Cret
Rue de Curti Champet au numéro deux
trois chemin des Neigeottes, trente-neuf mille cent Baverans
neuf rue de la Pétrouillère, trente-neuf, deux cent quatre-vingt-dix, Thervay
trois chemin du Clusiau, trente-neuf, deux cent trente à Vincent
Le Rutillet, trente-neuf mille quatre cent soixante Foncine-le-Haut
Rue de la Vie Croisée, trente-neuf, zéro zéro zéro Lons-le-Saunier
Rue de la Petite Impasse, Les Rousses
Rue Etienne Dusart à Dole
sept rue des Rollots
Route de Cornu au numéro onze
vingt-cinq combe du Galand, trente-neuf mille deux cent vingt Prémanon
vingt rue du seize Juin mille six cent trente-huit, trente-neuf, huit cents, Chamole
deux route de Dramelay, trente-neuf, deux cent quarante à Chatonnay
Impasse du Verdot, trente-neuf mille cent Villette-lès-Dole
Chemin de Bariel, trente-neuf, cent dix La Chapelle-sur-Furieuse
Chemin du Chanelet, Aromas
Impasse Roch à Bans
vingt-six rue des Ninettes
Route de Lamoura au numéro quatorze
six place des Salines, trente-neuf mille cinq cent soixante-dix Montmorot
cinquante-quatre rue du Raffour, trente-neuf, cent quarante, Ruffey-sur-Seille
six cours des Nations, trente-neuf, cinq cents à Tavaux
Rue de la Bière, trente-neuf mille cent Dole
Rue de Champs Jean, trente-neuf, cinq cent soixante-dix Condamine
Rue de Maizières, Voiteur
Rue Colonel Gruyer à Champagnole
trente-cinq allée de la Résistance
Rue des Chéneviéres au numéro quatre
deux cent vingt et un avenue de Chaucenne, trente-neuf mille huit cents Chaussenans
cinq place de la Platière, trente-neuf, deux cent quatre-vingt-dix, Mutigney
neuf impasse Georges Bouton, trente-neuf, trois cent quatre-vingts à Bans
Rue de Montorient, trente-neuf mille cinq cent soixante-dix Courbouzon
Rue du Pont du Bourg, trente-neuf, deux cent trente Champrougier
Rue des Pontes, Équevillon
Cours d'Arbois à Tavaux
quatre-vingt-trois impasse des Cadets
Rue de la Petite Clef au numéro trois cent quatre-vingt-onze
huit impasse des Pignons, trente-neuf mille deux cent soixante-dix Dompierre-sur-Mont
un chemin Le Pouzet, trente-neuf, cent cinquante, Villard-sur-Bienne
quatre place Claire Pernet, trente-neuf, cent quatre-vingt-dix à Beaufort
Rue du Bois du Cret, trente-neuf mille six cents La Châtelaine
Route de Maynal, trente-neuf, cent quatre-vingt-dix Beaufort
Route de Molay, Rahon
Rue du Fichelin au Latet
quatre rue de la Cafetière
Route de Rainans au numéro un
cinq chemin Sous la Ville, trente-neuf mille trois cent soixante Larrivoire
quatre chemin de la Verney, trente-neuf, cent quarante, Larnaud
huit rue de l'Otat, trente-neuf, cent cinquante à La Chaux-du-Dombief
Impasse Moncey, trente-neuf mille cent trente Saint-Maurice-Crillat
Rue de la Florentine, trente-neuf, deux cent dix Le Vernois
Rue de Naizant, Saint-Didier
Ruelle Saint-Mauris à Dole
vingt-deux rue du Closardot
Route du Risoux au numéro mille cinq cent soixante et onze
vingt-trois chemin de la Paule, trente-neuf mille cinq cent soixante-dix Gevingey
un rue du Biolet, trente-neuf, deux cents, Saint-Claude
huit rue Les Bames, trente-neuf, cent soixante-dix à Ravilloles
Passage des Magnins, trente-neuf mille cinq cent soixante-dix Pannessières
Rue des Rains la Banne, trente-neuf, trois cent quatre-vingts Montbarrey
Treije des Vignerons, Montmirey-la-Ville
Rue Gorot à Asnans-Beauvoisin
dix-huit les Roclins
Rue du Joutelot au numéro quatre
huit lotissement Les Champs de l'Église, trente-neuf mille trois cent dix Septmoncel
quarante-quatre chemin de la Grange Chaillot, trente-neuf, cent, Dole
deux rue de la Die, trente-neuf, quatre cents à Morez
Rue de la Chintre, trente-neuf mille deux cent quatre-vingt-dix Thervay
Rue de Chazeau, trente-neuf, huit cents Tourmont
Chemin de la Grange A La Dame, Foncine-le-Bas
Chemin des Genetres au Deschaux
trois route de Censeau
Rue du Clos Capperony au numéro deux cent trente-quatre
un chemin des Brules, trente-neuf mille sept cents Lavangeot
cinq A route d'Andelot, trente-neuf, trois cents, Supt
un route de Charchillac, trente-neuf, sept cents à Salans
Rue de l'Impériale, trente-neuf mille cinq cent soixante-dix Montmorot
Rue du Docteur Bichat, trente-neuf, deux cent quarante Arinthod
Montée du Quer d'Amu, Choux
Allée du trois Septembre à Morez
trois rue de la Cotette
Rue Mable au numéro cinq
cent soixante-dix rue du Mérite, trente-neuf mille Lons-le-Saunier
neuf avenue Ernest Solvay, trente-neuf, cinq cents, Tavaux
un rue Gérard Millet, trente-neuf, cent soixante-dix à Pratz
Rue du Renvers de Plumont, trente-neuf mille cent Dole
Rue de Visessard, trente-neuf, cinq cent soixante-dix Publy
Rue du Pré Aux Dames, Montmorot
Rue Louis Rémy à Messia-sur-Sorne
cinq rue du Bois de Ruez
Rue du Moulin Boudard au numéro trois
deux allée de Chaffardon, trente-neuf mille deux cents Saint-Claude
cinq rue d'Arc-Sous-Montenot, trente-neuf, cent dix, Lemuy
quatre rue du Pan, trente-neuf, six cents à Mathenay
Rue de Ferrachat, trente-neuf mille quatre cents Longchaumois
Chemin de la Crucelle, trente-neuf, cinq cent soixante-dix Pannessières
Rue de Montmirey-le-Château, Montmirey-la-Ville
Rue de la Fontaine du Bas à Saint-Thiébaud
onze rue Hugues de Vienne
Chemin du Bief d'Arroz au numéro trente-deux
quarante et un rue de la Grillière, trente-neuf mille cinq cent soixante-dix Mirebel
trois lotissement La Vignette Agea, trente-neuf, deux cent quarante, Légna
six route de la Perrine, trente-neuf, trois cent soixante-dix à Choux
Impasse du Moulinot, trente-neuf mille sept cents Amange
Route des Buclets, trente-neuf, quatre cents Morbier
Rue des Cabuchons, Chemin
Impasse André Pec à Audelange
sept chemin Saunier
Rue Bernard Tépinier au numéro vingt-huit
quatre rue du Grand Sugny, trente-neuf mille cinq cent soixante-dix Montmorot
cinquante-huit place Faramand, trente-neuf, six cents, Arbois
cinq rue du Bas des Carrés, trente-neuf, six cents à La Châtelaine
Rue de Nozeroy, trente-neuf mille deux cent cinquante Mignovillard
Rue de Pavigny, trente-neuf, zéro zéro zéro Lons-le-Saunier
Chemin des Vieux Fours Villeneuve, Sarrogna
Chemin sous la Croix à Ney
six rue du Malvernois
Rue Aimable Ardiet au numéro deux
quatre quartier sous le Tilleul, trente-neuf mille cent trente Denezières
seize rue de Pesmes, trente-neuf, deux cent quatre-vingt-dix, Mutigney
un TER place Principale, trente-neuf, deux cent quatre-vingt-dix à Chevigny
Rue Ferdinand Fillod, trente-neuf mille cent soixante Saint-Amour
Rue du Bas du Mont, trente-neuf, six cents Mesnay
Rue du Château Maillot, Grozon
Route de Mont-Sous-Vaudrey à Villers-Robert
trente et un rue des Cosaques
Impasse de Saillard au numéro quatre
trois rue de la Tour Canoz, trente-neuf mille six cents Arbois
cinq chemin des Forgerons, trente-neuf, sept cents, Dampierre
onze rue du Poupet, trente-neuf, cent dix à Saint-Thiébaud
Rue du Grand Jousserot, trente-neuf mille cent vingt Longwy-sur-le-Doubs
Avenue Lacuzon, trente-neuf, deux cent soixante-dix Orgelet
Rue du Tomachon, Saint-Claude
Impasse Courbette à Thoiria
sept rue de la Glantine
Rue Pierre Morel au numéro dix-huit BIS
treize chemin de la Fraite, trente-neuf mille deux cent soixante Coyron
un champ du Frene, trente-neuf, cent dix, Pont-d'Héry
dix-sept rue Arney, trente-neuf, cent à Dole
Route du Cernillet, trente-neuf mille deux cent vingt Les Rousses
Les Charrieres, trente-neuf, cent dix Bracon
Rue Léonie Melliès, Champagnole
Rue du Chataignet à Moissey
seize rue Henri Jeanrenaud
Rue sous le Loyriat au numéro six
dix-neuf place du Bourg de Merlia, trente-neuf mille deux cent soixante-dix Orgelet
cent un impasse des Petits Ponts, trente-neuf, cent quarante, Villevieux
six cent soixante-quinze rue du Crêtet, trente-neuf, deux cent vingt à Bois-d'Amont
Route des Pessettes, trente-neuf mille deux cent vingt Prémanon
Rue de la Valouse, trente-neuf, deux cent soixante-dix Chambéria
Rue de Menotey, Peintre
Rue des Frasses à Morez
seize rue des Vennes
Rue du Puits Pierrot au numéro neuf
neuf route du Ferment, trente-neuf mille deux cent trente Rye
quinze chemin de la Fatrole, trente-neuf, cent dix, Dournon
sept rue du Chêne Loup, trente-neuf, trois cents à Crotenay
Chemin Rural de la Chanette, trente-neuf mille trois cent vingt Monnetay
Quartier Le Crêt Aux Fourmis, trente-neuf, deux cent soixante Les Crozets
Chemin de la Condebine, Abergement-le-Grand
Route de Cramans à Mouchard
trois rue du Joncheret
Rue de la Paule au numéro six
vingt-deux rue Léon Clerc, trente-neuf mille deux cent soixante Villards-d'Héria
trois cent soixante-dix chemin des Foueneurs, trente-neuf, trois cent dix, Lamoura
douze rue en Chauffeau, trente-neuf, deux cent dix au Louverot
Rue Champs Philippe, trente-neuf mille cent quarante Relans
Rue de Charbonny, trente-neuf, deux cent cinquante Onglières
Place du Tartre, Le Chateley
Chemin de la Gena à Bellefontaine
quarante-six chemin du Petit Mancy
Rue de l'Achapt au numéro six
six BIS rue du Val d'Orain, trente-neuf mille cent vingt Villers-Robert
quatre rue Belvue, trente-neuf, cinq cent soixante-dix, Saint-Laurent-la-Roche
un chemin de Malaval, trente-neuf, trois cents à Crotenay
Place du Préfet Buchot, trente-neuf mille cent quatre-vingt-dix Maynal
Rue des Frères Poussot, trente-neuf, cent vingt Chaussin
Chemin de la Chapelette, Quintigny
Rue des Lapereaux à Bonlieu
un rue d'Osse
Chemin des Margilliens au numéro trente-deux
cinquante-cinq rue Abbé Barthelet, trente-neuf mille deux cent vingt Prémanon
quarante-trois rue des Étapes, trente-neuf, deux cents, Saint-Claude
sept rue de Césy, trente-neuf, six cents à Arbois
Rue du Cret des Pesieres, trente-neuf mille cent cinquante Saint-Laurent-en-Grandvaux
Rue de l'Ain, trente-neuf, cent trente Marigny
Place de Saint-Christophe, La Tour-du-Meix
Rue du Clos Darioz à Lent
six A rue Croix d'Avin
Rue le Carrouge au numéro deux
neuf rue Bardenet, trente-neuf mille six cents Mesnay
dix rue des Saunerots, trente-neuf, deux cent trente, Foulenay
cinquante-huit rue du Capitaine Lardet, trente-neuf, cent quarante à Larnaud
Le Faubourg, trente-neuf mille deux cent trente Le Villey
Rue d'Aumur, trente-neuf, cinq cents Abergement-la-Ronce
Chemin de la Racine, Moutoux
Rue de l'Ognon à Mutigney
vingt-cinq rue du Fbg de l'Orme
Rue d'Acey au numéro cinq
huit impasse du Haut de Truchenne, trente-neuf mille cent Dole
dix-sept rue de la Toupe Au Loup, trente-neuf, cent quarante, Arlay
quatre-vingt-trois impasse des Quatre Noyers, trente-neuf, cinq cent soixante-dix à Chille
Chemin de Moulssières, trente-neuf mille cent vingt Peseux
Sur Le Monceau, trente-neuf, deux cents Villard-Saint-Sauveur
Rue de la Tour de Flore, Salins-les-Bains
Chemin du Haut de Gravelle à Geruge
cinquante aux Vernes
Rue de la Malange au numéro quatorze
trois chemin de la Montagne Ronde, trente-neuf mille cent cinquante Les Planches-en-Montagne
huit voie Communale Sur Le Coteau, trente-neuf, quatre cents, Morbier
vingt lotissement Prost Tournier Haut, trente-neuf, quatre cents à Bellefontaine
Rue du Chezelay, trente-neuf mille huit cents Grozon
Rue du Capitaine Lacuzon, trente-neuf, trois cents Crotenay
Rue Abergement la Ronce, Aumur
Allée de la Buchaille à Prémanon
trente-trois faubourg d'Aval
Impasse de Plasne au numéro deux
sept quartier Saint-Martin, trente-neuf mille deux cent soixante-dix Pimorin
un rue du Bourg Dessous, trente-neuf, cent quarante, Arlay
cinq rue de Barge, trente-neuf, deux cent soixante à Moirans-en-Montagne
Avenue Romain Roussel, trente-neuf mille quatre cents Morez
Rue de la Pierre qui Vire, trente-neuf, sept cents Châtenois
Chemin Grandvie, Septmoncel
Route de la Tanne à La Chaumusse
deux rue des Iletons
Rue du Petit Pasquier au numéro trois
un impasse du Champ Au Roi, trente-neuf mille trois cents Le Pasquier
deux rue du Clos du Dard, trente-neuf, deux cent cinquante, Onglières
douze rue de Gaucournot, trente-neuf, cinq cents à Tavaux
Chemin Château Le Pin, trente-neuf mille deux cent vingt Prémanon
Impasse du Vieux Sentier, trente-neuf, quatre cent dix Aumur
Rue des Chevreaux, Tavaux
Rue Chamberland à Chilly-le-Vignoble
quatre-vingt-quatre chemin de la Vie aux Chèvres
Rue de Salins-les-Bains au numéro sept BIS
quatre rue des Maubrais, trente-neuf mille trois cents Le Larderet
trois lotissement l'Aubépine, trente-neuf, deux cent soixante-dix, Dompierre-sur-Mont
un A rue Leon Ameter, trente-neuf, cent à Dole
Route de Lorette, trente-neuf mille trois cent trente Port-Lesney
Place de Malpertuis, trente-neuf, zéro zéro zéro Lons-le-Saunier
Rue des Enchâtres, Domblans
Rue La Rieute à Picarreau
quatre rue d'Epercy
Rue de Billey au numéro dix
trois cent vingt rue des Rochats, trente-neuf mille cinq cent soixante-dix Perrigny
dix-huit rue des Creuses, trente-neuf, trois cents, Monnet-la-Ville
trois cents rue du Courchamps, trente-neuf, cinq cent soixante-dix à Montaigu
Route du Boursier, trente-neuf mille cent quatre-vingt-dix Maynal
Impasse de la Croix des Pierres, trente-neuf, cent Foucherans
Rue Victor Huguenin, Dole
Impasse de la Muriat à Frontenay
vingt rue des Bugnardes
Chemin d'Ecuiria au numéro soixante-dix-sept
cent cinquante-huit place Camille ¨Prost, trente-neuf mille trois cents Champagnole
huit rue des Cheminelles, trente-neuf, cent, Dole
onze rue Etienne Lamy, trente-neuf, trois cents à Champagnole
Rue des Louvarets, trente-neuf mille deux cent dix Le Louverot
Rue du Commandant Vallin, trente-neuf, trois cent soixante Viry
Route des Crozets, Moirans-en-Montagne
Rue Emile Girod à Chapois
quatre chemin de la Clie
Rue de la Rippe au numéro quatre
mille quatre cent quinze route des Granges Picard, trente-neuf mille cent soixante Véria
quatre champ Bretee, trente-neuf, trois cent trente, Port-Lesney
trois rue du Noyer Bouvard, trente-neuf, cinq cent soixante-dix à Moiron
Rue de la Brulanderie, trente-neuf mille sept cents Évans
Rue Casimir de Persan, trente-neuf, cent Dole
