trois en Chartey, trente-neuf, deux cent soixante à Lect
Rue Basse du Château, trente-neuf mille deux cent trente Sellières
Rue de Chasles, trente-neuf, deux cent quarante Arinthod
Rue du Bas de l'Etang, Cosges
Rue Champ du Prince à Fontainebrux
onze chemin de la Latte
A l'Angar au numéro soixante-dix-huit
dix quartier les Jardins Merlin, trente-neuf mille cent trente Denezières
cent dix-sept lotissement du Pré Benoit, trente-neuf, trois cent dix, Lamoura
deux vaulgrenant, trente-neuf, trois cent trente à Pagnoz
Place de la Cornée, trente-neuf mille cent Dole
Rue de la Faviole, trente-neuf, huit cents Biefmorin
Rue du Bourgeot, Chaumergy
Rue Constant Chevillon à Annoire
un rue des Prés Neufs
Rue des Tours Bénites au numéro deux
huit rue des Croix Neuves, trente-neuf mille trois cents Montrond
trois rue du Choulot, trente-neuf, sept cents, Sermange
quatre rue de Chalain, trente-neuf, cent trente à Fontenu
A La Plaine des Echaillons, trente-neuf mille trois cents Pont-du-Navoy
Ruelle de la Planche, trente-neuf, sept cents Lavangeot
Impasse Fontenetta, Crançot
Impasse de la Grenadière à La Vieille-Loye
dix chemin des Roussets d'Arelle
En Beaumont au numéro neuf cent soixante-quatorze
cent quarante impasse des Grangettes, trente-neuf mille cinq cent soixante-dix Perrigny
cent quatre-vingt-un chemin des Cantons, trente-neuf, cent quarante, Larnaud
neuf cent soixante-seize rue de la Fontaine aux Daims, trente-neuf, cinq cent soixante-dix à Macornay
Rue de Voltaire, trente-neuf mille huit cents Poligny
Chemin de la Bénarde, trente-neuf, deux cent trente Passenans
Impasse de la Creuzotte, Gevry
Lotissement sur le Moulin à Chassal
vingt-trois rue du Bayard
Rue Jean Emonin au numéro cinq
deux impasse Saint-Gengoult, trente-neuf mille cent Champvans
dix rue de l'Étang Guyot, trente-neuf, deux cent trente, Foulenay
un rue Champs du Pommier, trente-neuf, cent dix à Aresches
Rue Blanche de Buxy, trente-neuf mille cent Dole
Route des Granges Vitte, trente-neuf, cent soixante Saint-Amour
Chemin de Condamine, Macornay
Rue des Reppes à Rye
trois impasse de l'Heute
Rue Maurice Novarina au numéro deux cent dix-neuf
quarante-neuf chemin de l'Estive, trente-neuf mille cent soixante Senaud
cent trois rue de la Teisserie, trente-neuf, deux cent quarante, Vosbles
cinq route de Chevrotaine, trente-neuf, cent trente à Saffloz
Sous l'Auge, trente-neuf mille cent trente Cogna
Place de Netru, zéro un, cinq cent quatre-vingt-dix Chancia
Rue Goy, Poligny
Rue du Docteur Poiffaut à Chaussin
trois rue des Tirettes
Rue Antoine Monnot au numéro vingt-six
sept chemin des Alamans, trente-neuf mille deux cent soixante-dix Orgelet
six lotissement Belin, trente-neuf, cent dix, Salins-les-Bains
un rue de la Vie à Mont, trente-neuf, deux cent cinquante à Arsure-Arsurette
Route de Bonnefontaine, trente-neuf mille huit cents Picarreau
Rue de Jouhe, trente-neuf, deux cent quatre-vingt-dix Biarne
Route de la Muyre, Domblans
Chemin du Terraillot à Desnes
seize clos Bellevue
Rue du Bout du Gué au numéro trente et un
quarante-neuf rue du Moulin des Prés, trente-neuf mille cinq cent soixante-dix Macornay
deux rue du Layau, trente-neuf, cent quatre-vingt-dix, Digna
quatre cent cinq route du Champ Dessus, trente-neuf, cinq cent soixante-dix à Montmorot
Place du Général Michelin, trente-neuf mille cent quarante Commenailles
Rue Conat, trente-neuf, huit cents Bersaillin
Rue de la Butte aux Archers, Poligny
Rue du Beurre Frais à Champrougier
trois grange de la Barre
Chemin des Fourchaux au numéro deux cent dix-neuf
deux cent quatre rue du Clairval, trente-neuf mille deux cent vingt Les Rousses
six les Alabouvettes, trente-neuf, cent cinquante, Prénovel
un chemin des Vignes de Doye, trente-neuf, cent quatre-vingt-dix à Maynal
Route de Champdivers, trente-neuf mille cent vingt Peseux
Rue des Paloux, trente-neuf, deux cent cinquante Cuvier
Rue Genendrey, Balaiseaux
Route de Champrougier aux Deux-Fays
un route de Planssus
Chemin de Cluzon au numéro sept
deux rue du Clos Grillet, trente-neuf mille deux cent cinquante Nozeroy
trois ruelle du Facteur, trente-neuf, trois cent cinquante, Gendrey
soixante-cinq rue de la un Ere d'F L, trente-neuf, cent soixante-dix à Lavans-lès-Saint-Claude
Rue des Champs de la Seille, trente-neuf mille cent quarante Cosges
Rue Fauboirg de la Petite Biche, trente-neuf, six cents Écleux
Allée de Bonneille, Moirans-en-Montagne
Rue du Fort Belin à Clucy
quatorze rue du Pré Blanchard
Rue du Chalonge au numéro trois
quatre rue Vieille de Salins, trente-neuf mille trois cent quatre-vingts Mont-sous-Vaudrey
deux rue de la Claître, trente-neuf, trois cents, Saint-Germain-en-Montagne
deux rue du Valdahon, trente-neuf, deux cent cinquante à Bief-du-Fourg
Chemin de la Batteuse, trente-neuf mille deux cent quarante Arinthod
Route de Choisey, trente-neuf, cent Villette-lès-Dole
L Abbaye, Baume-les-Messieurs
Rue du Dominet à Sirod
douze rue Xavier Joliclerc
Allée des Noiserettes au numéro onze
quinze impasse des Champs Ramboz, trente-neuf mille deux cent dix Domblans
deux cent soixante-deux quartier Sous La Frairie, trente-neuf, trois cent dix, Lamoura
quinze lotissement les Jonquilles, trente-neuf, deux cent quarante à Aromas
Rue des Prés de Poix, trente-neuf mille deux cent dix Domblans
Rue de l'Îlette, trente-neuf, six cents Arbois
Place du dix-neuf Mars soixante-deux, Bracon
Rue des Châtenage à Longchaumois
six rue du Rotour
Rue Bief du Château au numéro deux
quatre-vingt-trois route de la Faucille, trente-neuf mille deux cent vingt Prémanon
sept rue des Rouhaudes, trente-neuf, cent, Choisey
deux cent cinquante-neuf route de Courbouzon, trente-neuf, cinq cent soixante-dix à Messia-sur-Sorne
Rue Jean Jacob La Charne, trente-neuf mille cent trente Charcier
Rue de la Chenauvière, trente-neuf, cinq cent soixante-dix Macornay
Rue des Séchaux, Saint-Germain-en-Montagne
Quartier les Marchands à Grusse
quarante-cinq rue Germain Paget
Chemin du Bois de Ruffey au numéro deux cent vingt-cinq
soixante-douze chemin du Quart d'Amont, trente-neuf mille cinq cent soixante-dix L'Étoile
cent quarante-six lotissement Sur La Ville, trente-neuf, cinq cent soixante-dix, Bornay
douze rue du Bief Meunier, trente-neuf, cent quatre-vingt-dix à Orbagna
Rue de Saint-Amour Villette, trente-neuf mille cent soixante L'Aubépin
Route du Fioget, trente-neuf, trois cents Châtelneuf
Rue de la Vie Dessous, Bonlieu
Lotissement Clos des Forges à Foucherans
huit rue des Montarbaux
Rue des Matz au numéro sept
un route de Neublans, trente-neuf mille cent vingt Asnans-Beauvoisin
quatre chemin de la Houillère, trente-neuf, cent dix, Aiglepierre
six rue de la Grande Chaux, trente-neuf, cent cinquante aux Chalesmes
Lotissement de la Source, trente-neuf mille deux cent quarante Thoirette
Impasse des Douanes, trente-neuf, deux cent vingt Les Rousses
Route de Séligney, Bretenières
Impasse de la Veze à Rouffange
trois route du Parolais
Impasse des Sommières au numéro dix
cinq chemin de la Rippe, trente-neuf mille deux cent soixante-dix Pimorin
quatre A place des Prés Clercs, trente-neuf, cinq cents, Abergement-la-Ronce
deux quartier Les Meix, trente-neuf, deux cent soixante aux Crozets
Chemin des Grands Vergers, trente-neuf mille cent dix Bracon
Rue de la Croix Jacobée, trente-neuf, huit cents Bonnefontaine
Route de Chézabois, Bersaillin
Rue de Gevry à Molay
quatre le Chapître
Grandes Combettes au numéro onze
cent chemin Bec du Peroseys, trente-neuf mille deux cent vingt Prémanon
six impasse de la Pressagne, trente-neuf, cent, Villette-lès-Dole
quatre-vingt-quatre chemin de Tréchaumont, trente-neuf, trois cent dix à Lamoura
Rue du Montarlier, trente-neuf mille cinq cent soixante-dix Courlans
Rue du Fresnois, trente-neuf, cent soixante-dix Leschères
Sur Le Rocher, Lavigny
Place Henri Lissac à Morez
deux rue du Lézard
Impasse de la Petite Brosse au numéro cinq
trois grand Fontaine, trente-neuf mille deux cent soixante-dix Augisey
vingt-six rue d'Archemey, trente-neuf, huit cents, Poligny
un route de Préverant, trente-neuf, trois cent soixante-dix à Choux
Rue de la Grange Bedey, trente-neuf mille cent quarante Larnaud
Impasse de Posot, trente-neuf, sept cents Malange
Chemin du Parthey, Choisey
Route du Coin Dernier à Morbier
un rue du Four A Pain Montadroit
Chemin des Louvières au numéro un
cent quarante et un rue de la Sarazine, trente-neuf mille deux cent dix Domblans
huit rue de la Grozonne, trente-neuf, huit cents, Neuvilley
un rue du Champ Traverset, trente-neuf, trois cent soixante-dix aux Bouchoux
Route des Grandes Maresches, trente-neuf mille cent trente Étival
Rue de la Combe Jeannin, trente-neuf, deux cent dix La Marre
Faubourg Saint-Pierre, Salins-les-Bains
Rue En Chaubeau à Reithouse
un résidence Les Trembles
Rue de la Belle Nanette au numéro un
cent quatre-vingt-six chemin de Marchand, trente-neuf mille cinq cent soixante-dix Macornay
quatorze rue Docteur Normand, trente-neuf, cent, Dole
cinq cent soixante-dix rue du Bief Marlot, trente-neuf, cent quarante à Commenailles
Voie Communale des Grandvalliers, trente-neuf mille cent trente Cogna
Route de Romange, trente-neuf, sept cents Malange
Rue Labbet, Brainans
Chemin de Trechelle à Lavans-lès-Saint-Claude
soixante-cinq z.A. les Vauvres
Rue des Médecins au numéro douze
dix-neuf place Rouget de Lisle, trente-neuf mille cinq cent soixante-dix Montaigu
neuf cent trente-cinq rue des trois Lacs, trente-neuf, cent trente, Doucier
vingt BIS rue de Bersaillin, trente-neuf, deux cent trente à Sellières
Rue du Martelage, trente-neuf mille trois cents Champagnole
Rue Victor Bérard, trente-neuf, trois cents Champagnole
Chemin du Bief Bruyant, Les Rousses
Route de Châtelneuf à Chaux-des-Crotenay
un rue du Clos Verger
Rue Félix Broutet au numéro quatre
cent six quartier de Vivard, trente-neuf mille deux cent trente Toulouse-le-Château
vingt-huit rue Geai, trente-neuf, trois cent quatre-vingts, Vaudrey
six rue de la Lattière, trente-neuf, huit cents à Besain
Rue du Cheneveuille, trente-neuf mille trois cent cinquante Saligney
Impasse des Brozons, trente-neuf, deux cent quarante Légna
Rue du Reposoir, Domblans
Montée des Charnières aux Rousses
cinq BIS chemin de la Carriére
Rue Marguerite Henry Rosier au numéro six
un rue de la Grange Boisson, trente-neuf mille huit cents Buvilly
quarante-six route de Fontainebrux, trente-neuf, cinq cent soixante-dix, Courlaoux
cinq impasse du Fer Rouge, trente-neuf, cent à Dole
Rue des Efforets, trente-neuf mille trois cent vingt Bourcia
Rue de la Carcille, trente-neuf, cent soixante-dix Ponthoux
Rue Jean Faivre, Menotey
Route d'Augea à Cuisia
trois route d'Entre-Deux-Monts
Rue des Tillettes au numéro vingt-trois
un chemin de l'Ile d'Amour, trente-neuf mille trois cent quatre-vingts Augerans
sept rue du Meix Dagay, trente-neuf, cinq cent soixante-dix, Pannessières
quatre chemin des Normois, trente-neuf, deux cent trente à Bréry
Route de Vévy, trente-neuf mille cinq cent soixante-dix Crançot
Route de la Reppe, trente-neuf, cent vingt Pleure
Rue de la Cude, Équevillon
Sous La Poste à Septmoncel
cinq rue Fontaine du Fossard
Route de Molpré au numéro huit
cinq chemin des Exterpois, trente-neuf mille deux cent dix Blois-sur-Seille
huit route des Forêts Monts, zéro un, quatre cent dix, Lajoux
cinq mare Bertin, trente-neuf, cent quatre-vingt-dix à Maynal
Rue des Raffourgs, trente-neuf mille cent dix Lemuy
Escalier Saint-Anatoile, trente-neuf, cent dix Salins-les-Bains
Rue du Fyète, Crenans
Chemin du Patouillet à Bonnefontaine
trois rue Auguste Couvreur
Rue sous les Rochettes au numéro douze
cent seize route du Vieux Mont, trente-neuf mille deux cent trente Passenans
cent soixante-huit rue Bouillod, trente-neuf, cinq cent soixante-dix, L'Étoile
quarante-trois chemin du Verger Judan, trente-neuf, cinq cent soixante-dix à Chille
Ruelle des Sources, trente-neuf mille deux cent quatre-vingt-dix Archelange
Rue de la Fougereuse, trente-neuf, quatre cents Longchaumois
Impasse du Mont Arboz, Desnes
Chemin des Abattais aux Chalesmes
trente-deux montée du Crêt
Rue Maurice Fumey-Badoz au numéro cent onze
sept place de la Fidélité, trente-neuf mille deux cent trente Sellières
quatre route du Pélerin, trente-neuf, cent soixante-dix, Pratz
onze B rue des Traversins, trente-neuf, trois cent quatre-vingts à Ounans
Route de Saint-Baraing, trente-neuf mille cent vingt Chaussin
Route de Hautecour, trente-neuf, cent trente Clairvaux-les-Lacs
Chemin du Pré Benoit, Lamoura
Sur La Place aux Bouchoux
cent soixante-cinq rue de sous Ville
Rue Lotissement Les Crets au numéro un
treize rue Alexis Cordienne, trente-neuf mille cent Dole
deux route d'Onoz, trente-neuf, deux cent soixante-dix, La Tour-du-Meix
seize rue de Faite, trente-neuf, huit cents à Poligny
Impasse du Charmois, trente-neuf mille cent quarante Commenailles
Rue de la Fonclause, trente-neuf, trois cent quatre-vingts Santans
Rue de Tré La Croix, Lavans-lès-Saint-Claude
Rue des Caseaux à Moissey
vingt-sept rue Macedonio Melloni
Impasse Champ Chevallier au numéro treize
six rue de la Bourgeoise, trente-neuf mille deux cent soixante-dix Chavéria
cent quatre-vingt-neuf rue de la Cocarabache, trente-neuf, cent trente, Charcier
trois rue des Setrettes, trente-neuf, huit cents au Fied
Rue des Essarts du Bois, trente-neuf mille sept cents Courtefontaine
Rue de l'Abbé Guichard, trente-neuf, huit cents Grozon
Impasse de la Pastorelle, Petit-Noir
Chemin de la Barthelemière à Gatey
quarante-cinq quai Valette
Rue de la Palice au numéro trois cent soixante-treize
quatre place de la Chevalerie, trente-neuf mille cent soixante Saint-Amour
quatre rue de la Querelle, trente-neuf, cent quarante, Bletterans
cent cinquante-cinq rue de Balovre, trente-neuf, cent soixante à Nanc-lès-Saint-Amour
Chemin de la Janiat, trente-neuf mille trois cents Montigny-sur-l'Ain
Hameau des Bez, trente-neuf, cent cinquante Grande-Rivière
Route de Fétigny La Villette, Sarrogna
Chemin des Saugettes à Mont-sur-Monnet
six passage de l'Ancienne Cure
Rue des Moutoux au numéro huit
quatre rue Belle Orange, trente-neuf mille deux cent quatre-vingt-dix Moissey
deux rue des Nues, trente-neuf, cent vingt, Villers-les-Bois
seize rue des Prés d'Aval, trente-neuf, trois cent soixante à Chassal
Rue en Sus Boirier, trente-neuf mille cinq cent soixante-dix Frébuans
Rue Augustin Jault, trente-neuf, deux cent soixante-dix Orgelet
Chemin de l'Iserable Montadroit, Légna
Chemin des Ellins à Toulouse-le-Château
un rue du Yavaud
Rue du Puisat au numéro un
dix chemin de la Saule, trente-neuf mille huit cents Montholier
cent quinze chemin du Creux Noir, trente-neuf, deux cent vingt, Prémanon
huit chemin des Rus, trente-neuf, trois cent soixante à Molinges
Rue de Champ Dière, trente-neuf mille cent trente Cogna
Rue du Fer à Chat, trente-neuf, trois cent soixante Viry
Rue d'Etables, Saint-Claude
Chemin de la Loye à Parcey
vingt-cinq rue des Aberjoux
Route de Lemuy au numéro un
cent vingt route de la Fraite, trente-neuf mille cent trente Thoiria
quatre-vingt-cinq rue de la Vallée de la Croix, trente-neuf, deux cent cinquante, Doye
vingt-quatre rue Richenet, trente-neuf, cent vingt à Petit-Noir
Ruelle du Charron, trente-neuf mille trois cent trente Port-Lesney
Rue de la Vigne aux Moines, trente-neuf, trois cent trente Mouchard
Rue du Lotissement du Vieux Mont, Arbois
Rue de Montbourgeau à L'Étoile
cent quarante et un route des Briolettes
Impasse Jules Arsène Ecoiffier au numéro neuf
un impasse de la Louvière, trente-neuf mille cent vingt Annoire
quarante-neuf rue de la Belgique, trente-neuf, deux cent dix, Domblans
cinq quartier de la Buclaine, trente-neuf, deux cent soixante à Lect
Ruelle des Copeaux, trente-neuf mille sept cents Falletans
Route de Pupillin, trente-neuf, huit cents Buvilly
Chemin de Challes, Saint-Amour
Rue du Bois Vernois au Vernois
deux route du Mont Saint-Christophe
Route des Chavannes au numéro deux
cinq rue de Saint-Louis, trente-neuf mille huit cents Buvilly
trente-deux chemin des Longeottes, trente-neuf, cent, Dole
trois rue Pierre Simon Progin, trente-neuf, trois cents à Crotenay
La Villa, trente-neuf mille quatre cents Morbier
Chemin des Mouillettes, trente-neuf, deux cent vingt Prémanon
Impasse de la Croix du Poirier, Domblans
Les Boutieres à Vers-sous-Sellières
quarante-huit rue du Créchot
Rue de la Bouderonne au numéro quatre-vingt-quinze
cent quatre route de Genod, trente-neuf mille deux cent quarante Vosbles
cinq A montée des Châlets, trente-neuf, cent trente, Uxelles
cinq rue de Grezin, trente-neuf, six cents à Arbois
Route de Chevreaux, trente-neuf mille cent quatre-vingt-dix Digna
Chemin de la Doule, trente-neuf, cent cinquante Entre-deux-Monts
Ruelle Saint-Paul, Sermange
Quartier d'En Bas à Montmorot
soixante-six rue du Colonel de Casteljau
Genetes au numéro trente-quatre
seize vers Le Vieux Moulin, trente-neuf mille cent trente Menétrux-en-Joux
un chemin des Lapidaires, trente-neuf, trois cent soixante-dix, La Pesse
six rue du Collège de l'Arc, trente-neuf, cent à Dole
Impasse Combe A Rouby, trente-neuf mille cent trente Saint-Maurice-Crillat
Impasse de la Foule, trente-neuf, deux cent soixante Villards-d'Héria
Chemin du Pre Patey, Pannessières
Impasse Claudet à Syam
huit rue du Clos des Valets
Rue de la Tuilerie du Perron au numéro trois
dix-sept route de Thoiria, trente-neuf mille cent trente Soucia
sept chemin de Lavaud, trente-neuf, deux cent soixante-dix, Chambéria
dix rue Desbief, trente-neuf, cent à Dole
Chemin de Trécombe, zéro un, quatre cent dix Lajoux
Rue de L'Orveau, trente-neuf, cent Dole
Rue des Folards, Mignovillard
Rue de Geraise à Clucy
deux rue de l'Expérience
Rue Alexandre Vialatte au numéro huit
neuf A route du Maréchal Pommier, trente-neuf mille deux cent quarante Chisséria
deux chemin du Jardinet, trente-neuf, six cents, Arbois
quatre square du dix-neuf Mars mille neuf cent soixante-deux, trente-neuf, cinq cent soixante-dix à Nogna
Rue de la Croix de Paris, trente-neuf mille cinq cent soixante-dix Cesancey
Route d'Arsure, trente-neuf, cent cinquante Bief-des-Maisons
Hameau des Farrods, Grande-Rivière
Rue de Fontenal à Cuttura
six rue d'Orchamps
Chemin des Toppes au numéro trois
deux chemin des Dances, trente-neuf mille deux cent cinquante Plénise
huit route de Chaléa, trente-neuf, deux cent quarante, Thoirette
huit rue Bauzonnet, trente-neuf, cent à Dole
Impasse des Daujettes, trente-neuf mille sept cents Évans
Chemin de la Barrette, trente-neuf, cent trente Songeson
Chemin de Besancenot, Arbois
Rue François Bachut à Saint-Aubin
six quartier en Vallot
Impasse du Liegeon au numéro deux
un route du Fied, trente-neuf mille huit cents Fay-en-Montagne
deux BIS rue du Général Bethouart, trente-neuf, cent, Dole
trente-neuf rue du Fond de Vau, trente-neuf, deux cent dix à Frontenay
Chemin de Sous Les Champs, trente-neuf mille deux cent quarante Cornod
Rue des Célibataires, trente-neuf, deux cent quarante Aromas
Rue du Pré au Prince, Choisey
Impasse Longchamp à Coyron
cent quatre-vingt-un rue du Mont Treillien
Rue Le Tartre au numéro onze
huit rue de la Moutette, trente-neuf mille cinq cent soixante-dix Nogna
cinq route de Poids de Fiole, trente-neuf, cinq cent soixante-dix, Nogna
quatre chemin de la Louventaire, trente-neuf, sept cents à Salans
Rue Pierre Brocard, trente-neuf mille trois cents Champagnole
Impasse Pierre Chevassus, trente-neuf, cinq cent soixante-dix Gevingey
Rue des Grevots, Beaufort
Rue du Fort Bracon à Bracon
deux chemin du Veyeux
Au Petit Champ au numéro vingt
quatre impasse de l'Ancienne Fromagerie, trente-neuf mille cinq cent soixante-dix Montmorot
soixante-quatre chemin du Prost, trente-neuf, cinq cent soixante-dix, Condamine
trois quartier Les Louvières, trente-neuf, deux cent soixante aux Crozets
Route d'Archelange, trente-neuf mille deux cent quatre-vingt-dix Gredisans
Rue de Certemery, trente-neuf, trois cent trente Mouchard
Quartier Bel Air, Port-Lesney
Chemin des Replets à Courbouzon
huit route de Viry
Montée des Perrières au numéro cent cinquante-cinq
quarante chemin des Babylones, trente-neuf mille cent Dole
cinq rue Croix Guillaume, trente-neuf, deux cent quarante, Arinthod
dix rue de la Pastorelle, trente-neuf, cent vingt à Petit-Noir
Avenue de Gottmadingen, trente-neuf mille trois cents Champagnole
Rue Louis Robert, trente-neuf, cent Dole
Route de la Valserine, Prémanon
Rue Saint-Michel Le Haut à Marnoz
six passage d'Avignon
Rue La Daguine au numéro seize
quatre cent cinquante chemin de Félie, trente-neuf mille deux cent vingt Prémanon
deux quartier Sur Roches, trente-neuf, cinq cent soixante-dix, Crançot
deux rue des Champs Beaux, trente-neuf, cent quatre-vingt-dix à Cousance
Rue de Bellefeuille, trente-neuf mille six cents Arbois
Rue George Gros, trente-neuf, quatre cent dix Saint-Aubin
Chemin En Champagne, Champagnole
Impasse des Margilliens à Salins-les-Bains
quinze la Grande Piece Monnier
Chemin du Pertuis au numéro six
cent deux hameau La Chapelle, trente-neuf mille trois cent vingt Saint-Julien
neuf rue du Clos Jacques Duhamel, trente-neuf, sept cents, Courtefontaine
sept rue de la Petite École, trente-neuf, cinq cent soixante-dix à Nogna
Rue Farlay, trente-neuf mille huit cents Poligny
Rue de Balerne, trente-neuf, zéro zéro zéro Lons-le-Saunier
Ruelle des Merles, Rahon
Rue de Néprand à Sellières
cinq impasse des Clefs
Rue Sous Burgille au numéro trente
quatre rue Sébastien Hurtard, trente-neuf mille cent Sampans
sept chemin Des Gentianes, trente-neuf, trois cent dix, Lamoura
un place Charles Capelli, trente-neuf, trois cents à Saint-Germain-en-Montagne
Rue des Lilas Pellier, trente-neuf mille cent trente Charcier
Impasse des Grandes Fouilles, trente-neuf, deux cent trente Chaumergy
Chemin de Noces, Perrigny
Rue des Saugets à Ladoye-sur-Seille
mille cinq cent soixante-sept route du Bief de la Chaille
Rue Odette de Champdivers au numéro un
un impasse de Jardins, trente-neuf mille cent soixante Saint-Amour
quatre rue du Guy, trente-neuf, cent dix, La Chapelle-sur-Furieuse
dix rue Charles Delorme, trente-neuf, deux cent quarante à Thoirette
Rue du Recépage, trente-neuf mille cinq cents Tavaux
Rue Bodines, trente-neuf, six cents Arbois
Rue Jeanne Hatto, Saint-Amour
Rue des Chevanelles à Taxenne
deux cents route de Trenal
Rue du Plan du Moulin au numéro deux TER
cinquante et un rue des Gouttaux, trente-neuf mille deux cent dix Le Vernois
trois rue du Pré Gros, trente-neuf, deux cent quarante, Arinthod
un rue Abel Guenot, trente-neuf, cent à Foucherans
Rue de la Fin Dessus, trente-neuf mille trois cents Crotenay
Chemin des Etroitots, trente-neuf, cent Dole
Rue des Buts, Orgelet
Rue des Chauffois à Bornay
quinze rue de Nostang
Lotissement Champs des Vis au numéro un
trois a La Dombarnay, trente-neuf mille deux cents La Rixouse
deux rue du Priaux, trente-neuf, huit cents, Colonne
deux route de la Balme-d'Épy, trente-neuf, trois cent vingt à Villechantria
Chemin de la Paulée, trente-neuf mille cent vingt Petit-Noir
Impasse de la Ganeval, trente-neuf, trois cents Montigny-sur-l'Ain
Route de la Vallière, La Chaux-du-Dombief
Route de Rogna à Viry
cent vingt et un rue de la Bergere
Rue du Clôs Vaillant au numéro un
sept lotissement des Côteaux, trente-neuf mille trois cent quatre-vingts Bans
deux rue du Faubourg des Moulins, trente-neuf, deux cents, Saint-Claude
douze BIS rue du Pont de l'Épée, trente-neuf, trois cents à Champagnole
Chemin des Vionnières, trente-neuf mille trois cent trente Port-Lesney
Rue du Vernon, trente-neuf, deux cent cinquante Bief-du-Fourg
Rue du Docteur Briot, Chaussin
Rue des Scilles à Syam
quatre impasse du Meix Pagney
Rue des Buits au numéro trois
quatorze rue de la Combe d'Ain, trente-neuf mille cent trente Charézier
cent trente et un chemin de l'Étang Jean Guyon, trente-neuf, cinq cent soixante-dix, Courlaoux
deux rue de Savagnin, trente-neuf, six cents à Pupillin
Lotissement En Corcelles, trente-neuf mille cent quarante Arlay
Impasse du Fiolage, trente-neuf, sept cents Dampierre
Rue de la Mirode, Les Arsures
Quartier du Sauvage à Vercia
dix rue Dom Paul Benoit
Chemin de Bougelier au numéro cent vingt-deux
deux rue de la Vie Groyot, trente-neuf mille cent cinquante Chaux-des-Crotenay
trente et un le Prieuré, trente-neuf, cinq cent soixante-dix, Saint-Didier
soixante-quinze chemin du Gros Tilleul, trente-neuf, deux cent dix à Domblans
Chemin d'Ivory, trente-neuf mille cent dix Chaux-Champagny
Impasse du Nan, trente-neuf, cent soixante-dix Lavans-lès-Saint-Claude
Rue des Prés de l'Étang, Ruffey-sur-Seille
Chemin du Vieux Nezous à Choisey
cinq cent quatre-vingt-deux chemin de la Clye
Place Narcisse Patouillard au numéro vingt
cinquante-six route de Quintigny, trente-neuf mille cinq cent soixante-dix L'Étoile
six place Marnix, trente-neuf, deux cent soixante-dix, Orgelet
dix rue du Bas des Joncs, trente-neuf, huit cents à Oussières
Avenue Wladimir Gagneur, trente-neuf mille huit cents Poligny
Place du vingt Avril mille sept cent quarante, trente-neuf, sept cents Vriange
Rue de Brans, Montmirey-le-Château
Route de Mont sur Monnet à Châtelneuf
trois rue du Lot Clos d'Aval
Avenue du Général Delort au numéro un
six rue Ambroise Ferrez, trente-neuf mille cent cinquante Saint-Pierre
cinq rue du Corneux, trente-neuf, cent dix, Salins-les-Bains
trois chemin du Clos Grillet, trente-neuf, deux cent cinquante à Censeau
Route des Tuffes, trente-neuf mille deux cent vingt Prémanon
Chemin des Effarets, trente-neuf, deux cent trente Toulouse-le-Château
Rue Pierre Cazot, Montmorot
Rue du Courriot à Arlay
six impasse sur le Moulin
Rue du Pré Jacquin au numéro douze
quatorze quartier de la Bardette, trente-neuf mille cent quatre-vingt-dix Vercia
douze meix Lelin, trente-neuf, cent, Foucherans
quatre cent soixante-cinq rue Francis Picabia, trente-neuf, cent trente à Étival
Rue Sur Les Mouraines, trente-neuf mille cent trente Hautecour
