trois rue Emmanuel Paranteau, trente-trois, trois cent vingt, Eysines
vingt-deux rue des Palombes Cap Ferret, trente-trois, neuf cent cinquante à Lège-Cap-Ferret
Allée de Saint-Brice, trente-trois mille trois cent quatre-vingts Mios
Rue Henri Mérand, trente-trois, zéro zéro zéro Bordeaux
Lotissement Communal du Centre Bourg, Saint-Antoine-sur-l'Isle
Rue Henry Fruges à Pessac
onze quai Léon Perrier
Boulevard Jean-Jacques Bosc au numéro cent cinquante-huit
quarante et un allée du Brion, trente-trois mille cinq cent vingt Bruges
quatre-vingt-quatorze B rue de Vincennes, trente-trois, zéro zéro zéro, Bordeaux
six chemin de l'Estey, trente-trois, six cent dix à Cestas
Rue de Saint-Estèphe, trente-trois mille deux cent quatre-vingt-dix Blanquefort
Avenue Pierre de Ronsard, trente-trois, cent trente-huit Lanton
Impasse des Pinassotes, Gujan-Mestras
Avenue de Belle-France à Mérignac
cinq TER moureou
Rue Edmond Faulat au numéro sept
deux rue du Vieux Catusseau, trente-trois mille cinq cents Pomerol
cent cinquante et un rue Durcy, trente-trois, cent trente, Bègles
huit rue Perrault d'Armancour, trente-trois, cinq cent vingt à Bruges
Rue Fernand de Magellan, trente-trois mille cent quinze La Teste-de-Buch
Clos de Lémy, trente-trois, trois cent soixante-dix Tresses
Avenue Jean-Jacques Rousseau, Saint-Médard-en-Jalles
Chemin de Vimaney à Saint-Médard-en-Jalles
onze rue des Victimes du trois Aout
Rue de Mégret au numéro cinquante-huit
sept cent quarante-huit allée du Souquet, trente-trois mille trois cent soixante Latresne
sept rue des Retaillons, trente-trois, zéro zéro zéro, Bordeaux
vingt-quatre chemin Touton, trente-trois, cent quarante à Villenave-d'Ornon
Lotissement Le Hameau de la Becassiere, trente-trois mille six cent cinquante Cabanac-et-Villagrains
Chemin de l'Allumetayre, trente-trois, trois cent quarante Lesparre-Médoc
Rue André Lesca, La Teste-de-Buch
Rue Coiffard à Bordeaux
douze résidence de Badet Ouest
Chemin du Bois Lorrain au numéro trente-sept
trois rue de Gardet, trente-trois mille sept cent quarante Arès
sept rue Charles Marionneau, trente-trois, zéro zéro zéro, Bordeaux
quarante-cinq rue du Neurin, trente-trois, deux cent quatre-vingt-dix à Blanquefort
Rue de la Brandette, trente-trois mille trois cent quarante Gaillan-en-Médoc
Chemin Cazeau Biel, trente-trois, deux cent quatre-vingt-dix Le Pian-Médoc
Rue du Pujeau d'Andron, Mios
Rue du Perrier de Larsan à Soulac-sur-Mer
cent soixante-huit lotissement Les Vallons du Ferret
Rue du Vieux Gréement au numéro quarante-huit
quatorze rue Ausone, trente-trois mille cinq cent vingt Bruges
dix-sept rue du Général de Monsabert, trente-trois, six cents, Pessac
quarante-cinq rue de Talence, trente-trois, zéro zéro zéro à Bordeaux
Rue de Tujean, trente-trois mille deux cent quatre-vingt-dix Blanquefort
Allée de Perriau, trente-trois, cent soixante-dix Gradignan
Route de Cordeillan, Pauillac
Rue Charles Lecocq à Eysines
quatre-vingt-seize corniche de La Gironde
Avenue de l'Entre Deux Mers au numéro trois
dix-sept chemin du Chec, trente-trois mille six cent cinquante La Brède
dix-neuf chemin de Ambaud, trente-trois, deux cent quarante, Salignac
huit chemin du Sauvignon, trente-trois, six cent quarante à Portets
Place Pey Berland, trente-trois mille Bordeaux
Route du Contou, trente-trois, cinq cent cinquante Tabanac
Avenue Edouard Manet, Saint-Médard-en-Jalles
Rue Edmond Doré à La Teste-de-Buch
vingt-six rue André Hible
Avenue de l'Herbe au numéro douze
dix-huit rue Louis Maydieu, trente-trois mille Bordeaux
sept rue Lagahuzère, trente-trois, cent quatre-vingt-dix, La Réole
trois impasse de Piréou, trente-trois, cent quinze à La Teste-de-Buch
Chemin des Gabarriers, trente-trois mille deux cent quarante Asques
Rue de l'Île aux Oiseaux, trente-trois, cent quinze La Teste-de-Buch
Route de Mouchon, Lanton
Allée des Palissandres à Pessac
quarante allée Calypso
Parc Res Loisirs l'Amélie au numéro trente-huit
cent trois avenue de Candau, trente-trois mille six cents Pessac
vingt-six rue Basté, trente-trois, deux cent trente, Coutras
soixante et un lotissement Bois du Luget, trente-trois, deux cent quatre-vingt-dix au Pian-Médoc
Place Broca, trente-trois mille deux cent vingt Sainte-Foy-la-Grande
Chemin du Lignau, trente-trois, cent vingt et un Carcans
Route de Gréteau, Haux
Chemin de Beaujet à Ambarès-et-Lagrave
vingt-quatre allée Jean Balde
Route de Mounic au numéro quatorze
quatorze BIS avenue Nord, trente-trois mille neuf cent cinquante Lège-Cap-Ferret
quarante et un rue de Campot, trente-trois, deux cent quatre-vingt-dix, Blanquefort
neuf chemin de Jean d'Arsac, trente-trois, trois cent vingt au Taillan-Médoc
Rue Latraine, trente-trois mille cinq cent quatre-vingts Monségur
Chemin des Jaugues, trente-trois, quatre cent quarante Ambarès-et-Lagrave
Allée du Rouquet, Cestas
Impasse du Commandant Marzac A Cazaux à La Teste-de-Buch
quatre-vingt-six rue Lagrua
Chemin de la Mule au numéro neuf
trente-trois rue de la Tresne, trente-trois mille Bordeaux
trois A route de Rapin, trente-trois, six cent quarante, Portets
vingt rue Étienne Huyard, trente-trois, zéro zéro zéro à Bordeaux
Avenue Chambrelent, trente-trois mille cent quinze La Teste-de-Buch
Lotissement Le Pré du Duc, trente-trois, deux cent trente Coutras
Rue de l'Esquirau, Marcheprime
Rue Henry Guillier à Libourne
onze rue Jean Castandet
Place Schubert au numéro douze
douze avenue du Muscat, trente-trois mille neuf cent cinquante Lège-Cap-Ferret
soixante route du Pujeau, trente-trois, trois cent quatre-vingts, Mios
deux route de la Font du Pin, trente-trois, trois cent quarante à Gaillan-en-Médoc
Voie des Tanneries, trente-trois mille cent quatre-vingt-dix Gironde-sur-Dropt
Avenue de Fontenille, trente-trois, trois cent soixante Carignan-de-Bordeaux
Chemin de Loustalot, Saint-Loubès
Rue de Chartrèze à Gradignan
onze rue des Pontets
Rue du Petit Verdot au numéro onze
six rue de la Salargue, trente-trois mille trois cent soixante Latresne
huit allée René, trente-trois, cent trente-huit, Lanton
vingt-cinq rue de Blahéraut, trente-trois, trois cent vingt à Eysines
Rue Géo Delvaille, trente-trois mille Bordeaux
Avenue de Baraillot, trente-trois, six cents Pessac
Rue Henri Jean Moreau, Libourne
Chemin de Peyre à Cestas
deux route de Hourrit
Chemin du Grand Bouquet au numéro dix
cinquante-huit rue Prunier, trente-trois mille Bordeaux
vingt-quatre chemin Lalaurie, trente-trois, cent quarante, Villenave-d'Ornon
cent soixante-huit rue de Baulos, trente-trois, cent quarante à Cadaujac
Rue Georges Rioux, trente-trois mille Bordeaux
Route de Louchats, trente-trois, sept cent vingt Guillos
Impasse François Coli, Saint-Jean-d'Illac
Rue Déjean Castaing à Gujan-Mestras
deux rue de la Tosca
Rue des Vignes de Bussac au numéro quatorze
quatre-vingts lotissement l'Illot, trente-trois mille deux cent quarante La Lande-de-Fronsac
vingt route de Puymorin, trente-trois, deux cent quarante, Saint-Laurent-d'Arce
vingt-quatre chemin de la Caussade, trente-trois, deux cent soixante-dix à Floirac
Rue Brousse Mellet, trente-trois mille cent cinquante Cenon
Rue Jean Guilhem, trente-trois, sept cent quatre-vingts Soulac-sur-Mer
Route de Pey Martin, Listrac-Médoc
Rue Fonfrède à Bordeaux
soixante et un impasse Alberto Santos-Dumont
Place Auberny au numéro dix-sept
sept impasse Elvina Sivan, trente-trois mille Bordeaux
vingt-sept chemin de Lourqueyre, trente-trois, trois cent soixante, Camblanes-et-Meynac
un square Roger Grandcamp, trente-trois, sept cents à Mérignac
Chemin de la Taste, trente-trois mille cent quatre-vingts Saint-Estèphe
Route de Taudinat, trente-trois, quatre cent cinquante Montussan
Passage Garderat, Arcachon
Avenue Château Pichon à Parempuyre
vingt-deux route des Faures
Rue Walter Poupot au numéro vingt-neuf
dix avenue de Montesquieu, trente-trois mille deux cent quarante Saint-André-de-Cubzac
quinze allée Joseph Garibaldi, trente-trois, sept cents, Mérignac
trente-sept rue Maurice Duport, trente-trois, cent soixante à Saint-Médard-en-Jalles
Quai de Bacalan, trente-trois mille Bordeaux
Impasse André Blanc, trente-trois, trois cent vingt Eysines
Place Saint-Projet, Bordeaux
Rue des Laitières à Cadaujac
sept rue du Clos Lafitte
Rue de la Louvèterie au numéro trente-neuf
soixante-dix-sept rue Marc Bourguedieu, trente-trois mille cent douze Saint-Laurent-Médoc
quarante-neuf rue de Loustalot, trente-trois, cent soixante-dix, Gradignan
vingt-six rue du Buisson de Joyeuse, trente-trois, deux cent trente à Coutras
Avenue Jean Marcel Despagne, trente-trois mille cinq cent dix Andernos-les-Bains
Chemin de Fabre, trente-trois, trois cent soixante-dix Tresses
Avenue des Chardonnerets, Arès
Rue Hector Danet à Eysines
quatre chemin du Barrail de Gaillot
Avenue de Jourdane au numéro quatre-vingt-dix-huit
trois cent cinquante-six avenue d'Arès, trente-trois mille sept cents Mérignac
quatre-vingt-onze chemin de Couhins, trente-trois, cent quarante, Villenave-d'Ornon
quarante et un avenue Favard, trente-trois, cent soixante-dix à Gradignan
Rue de Ferron, trente-trois mille Bordeaux
Allée du Burgat, trente-trois, quatre cent soixante-dix Le Teich
Rue Hubert de L'Isle, Saint-André-de-Cubzac
Allée de Couquet à Saint-Loubès
deux TER rue de Mouras
Lotissement du Clos Chauvin au numéro quatre
quatorze rue de Lagorce, trente-trois mille trois cent vingt Le Taillan-Médoc
sept rue du Pont de la Grave, trente-trois, cent trente, Bègles
douze rue du Couloumey, trente-trois, deux cent dix à Langon
Rue du Général d'Amade, trente-trois mille cent vingt-six Fronsac
Boulevard Godard, trente-trois, zéro zéro zéro Bordeaux
Allée Ventose, La Teste-de-Buch
Impasse Gauvin à Saint-Vivien-de-Médoc
cent six rue du Grand Maurian
Rue Camille Braylens au numéro six cent seize
un A rue du Chevalier de Maurian, trente-trois mille deux cent quatre-vingt-dix Blanquefort
cinq rue Mateau, trente-trois, quatre cent vingt, Branne
cent quatre rue Detrois, trente-trois, zéro zéro zéro à Bordeaux
Chemin de Brassat, trente-trois mille deux cent cinquante Saint-Julien-Beychevelle
Avenue des Provinces, trente-trois, six cents Pessac
Passage Moreau, Bordeaux
Chemin de Bacchus à Bruges
vingt-trois cité de la Croisette deux
Rue Pascal Mothes au numéro dix-neuf
douze rue de Bassens, trente-trois mille quatre cent quarante Ambarès-et-Lagrave
un allée du Basque, trente-trois, sept cent dix, Samonac
vingt-sept route des Tayas, trente-trois, trois cent quarante à Saint-Christoly-Médoc
Place Saint-Seurin, trente-trois mille six cent quatre-vingts Le Porge
Avenue de l'Aquitaine, trente-trois, cinq cent soixante Sainte-Eulalie
Lotissement La Chêneraie, Saint-Quentin-de-Baron
Route du Bazadais à Cabanac-et-Villagrains
quatorze résidence la Prairie
Rue Hermione au numéro cinq
quarante-quatre rue Joseph Pérès, trente-trois mille cent dix Le Bouscat
un allée des Faînes, trente-trois, cent soixante, Saint-Aubin-de-Médoc
trois allée Argous, trente-trois, cent trente à Bègles
Route des Coureaux, trente-trois mille deux cent quarante Saint-Laurent-d'Arce
Au Gat, trente-trois, quatre cent trente Gans
Rue de Bègles, Bordeaux
Rue Latapie à La Brède
quarante-trois rue René Balloux
Hameau de Frimont au numéro cinq
deux lotissement Domaine d'Hostein deux, trente-trois mille quatre cent quarante Ambarès-et-Lagrave
quatre-vingt-six rue Peydavant, trente-trois, quatre cents, Talence
quatre chemin de la Mourisse, trente-trois, six cent dix à Cestas
Route du Graoux, trente-trois mille huit cent trente Belin-Béliet
Rue des Marroniers, trente-trois, deux cent quarante Saint-Gervais
Avenue Alexis Capelle, Bègles
Allée de Ségur à Arsac
quatre rue Charles Puyo
Rue Moni au numéro quarante-trois
vingt-cinq rue d'Agen, trente-trois mille Bordeaux
un route de la Naude, trente-trois, neuf cent trente, Vendays-Montalivet
un impasse Maubourguet, trente-trois, zéro zéro zéro à Bordeaux
Allée Valentin, trente-trois mille quatre cent soixante-dix Gujan-Mestras
Rue de Pomerol, trente-trois, trois cent soixante-dix Artigues-près-Bordeaux
Rue des Verts Côteaux, Floirac
Allée Challier à Pessac
trente-deux BIS avenue du Port Aérien
Lotissement Communal de Barathon au numéro quinze
trente-six TER route de Louens, trente-trois mille quatre cent soixante Macau
trente-six BIS route de Touty, trente-trois, trois cent soixante-dix, Pompignac
six avenue Fanning Lafontaine, trente-trois, six cents à Pessac
Rue du Pilote, trente-trois mille sept cent quarante Arès
Route Laubertrie, trente-trois, deux cent quarante Salignac
Chemin de la Lézardière, Salles
Rue Louis Laverny à Bègles
deux lotissement Le Petit Chemin
Place Georges de Porto-Riche au numéro un
trente rue Grangeneuve, trente-trois mille Bordeaux
treize rue de la Française, trente-trois, quatre cent soixante-dix, Le Teich
soixante-sept avenue de Madran, trente-trois, six cents à Pessac
Rue Francis Ruffet, trente-trois mille cinq cent vingt Bruges
Rue Saint-François Xavier, trente-trois, cent soixante-dix Gradignan
Quai de Brienne, Bordeaux
Impasse du Point d'Eau à Naujac-sur-Mer
quatre-vingt-dix-sept rue du Professeur Arnozan
Impasse Helene Boucher au numéro deux
dix-neuf rue Joseph Lahens, trente-trois mille sept cent quatre-vingts Soulac-sur-Mer
vingt-huit route de Bern, trente-trois, quatre cent soixante, Macau
soixante-cinq chemin de Gombaud, trente-trois, deux cent quarante à Saint-André-de-Cubzac
Rue du Pont du Gail, trente-trois mille cinq cent vingt Bruges
Rue du Crebadin, trente-trois, deux cent quatre-vingt-dix Parempuyre
Rue Thérèse, Carbon-Blanc
Chemin d'Aymon à Paillet
cinquante cours Marc Nouaux
Allée Clémenceau au numéro un
vingt-sept lotissement Cottage Beau Sejour, trente-trois mille trois cent soixante-dix Fargues-Saint-Hilaire
vingt-deux allée du Teychan, trente-trois, quatre cent soixante-dix, Le Teich
dix-huit avenue de Noès, trente-trois, six cents à Pessac
Allée des Mousquetaires, trente-trois mille cent quinze La Teste-de-Buch
Rue des Palus, trente-trois, deux cent quatre-vingt-dix Parempuyre
Chemin de Carreyre, Saint-Caprais-de-Bordeaux
Rochereau à Pondaurat
vingt-trois rue Orbe
Rue de Montalieu au numéro cent dix
cent trente-deux avenue du Haut-Lévêque, trente-trois mille six cents Pessac
dix-huit lotissement Fontbonne, trente-trois, trois cent soixante, Camblanes-et-Meynac
quatre-vingt-un rue Solle, trente-trois, zéro zéro zéro à Bordeaux
Lotissement l'Eglantine, trente-trois mille trois cent soixante-dix Tresses
Chemin de Pujoulet, trente-trois, cent quatorze Le Barp
Route de Coudessan, Gaillan-en-Médoc
Allée du Tursan à Andernos-les-Bains
treize chemin de Rieutord
Avenue Guillaume Apollinaire au numéro huit
quarante avenue de Soulac, trente-trois mille quatre cent quatre-vingts Listrac-Médoc
huit rue Léo Saignat, trente-trois, zéro zéro zéro, Bordeaux
huit cité de la Villa, trente-trois, zéro zéro zéro à Bordeaux
Chemin de Monein, trente-trois mille deux cent quarante Saint-André-de-Cubzac
Rue Georges Méran, trente-trois, cent vingt Arcachon
Impasse de la Hudine, Saint-Médard-en-Jalles
Rue de Cotor à Gradignan
onze impasse du Testey
Route de Piquessegue au numéro soixante-dix-neuf
quarante et un chemin de la Carougneyre, trente-trois mille cinq cent quatre-vingt-dix Grayan-et-l'Hôpital
cinq impasse Pierre Melin, trente-trois, zéro zéro zéro, Bordeaux
dix-sept rue André Gendreux, trente-trois, cent soixante à Saint-Médard-en-Jalles
Chemin de Mage, trente-trois mille quatre cent cinquante Saint-Loubès
Place Amédée Larrieu, trente-trois, zéro zéro zéro Bordeaux
ZA de l'Îllot, La Lande-de-Fronsac
Avenue Jean Capdeboscq à Carbon-Blanc
quatre-vingt-huit rue Bonnefin
Rue Le Reynart au numéro huit
dix chemin de la Teulère, trente-trois mille six cent dix Cestas
trente route des Tronquats, trente-trois, quatre cent quatre-vingts, Sainte-Hélène
deux saint-Martin, trente-trois, cent quatre-vingt-dix à Pondaurat
Rue de Riboutet, trente-trois mille six cent soixante-dix Créon
Allée Pierre Ortal, trente-trois, six cent quatre-vingts Lacanau
Lotissement la Lanette, Podensac
Avenue Chasselas à Lège-Cap-Ferret
deux route de Ducasse
Hameau de Fabre au numéro quarante-neuf
douze rue de Mathéou, trente-trois mille quatre cent soixante Cantenac
trente-six rue Georges Lafont, trente-trois, cent dix, Le Bouscat
douze chemin des Prés Cassat, trente-trois, cinq cents à Pomerol
Route de Maison-Rouge, trente-trois mille huit cent trente Belin-Béliet
Rue du quatorze Juillet, trente-trois, trois cent quarante Prignac-en-Médoc
Allée Saturne, Arcachon
Route Départementale deux cent trente-neuf Nord à Haux
treize avenue du Sable d'Expert
Rue du Couynieu au numéro sept
quatorze rue Bréau, trente-trois mille Bordeaux
vingt-deux garde Feu du Juge Le Pyla, trente-trois, cent quinze, La Teste-de-Buch
trois route de Capitourlan, trente-trois, trois cent cinquante à Castillon-la-Bataille
Allée Pontus de Thiard, trente-trois mille cent quinze La Teste-de-Buch
Allée du Cosmos, trente-trois, cent soixante-dix Gradignan
Rue Trouche, Soulac-sur-Mer
Impasse des Agrières à Cartelègue
trente-six BIS allée Sarraméa
Avenue des Pres de Toctoucau au numéro quatorze
vingt et un rue de Camponac, trente-trois mille six cents Pessac
dix chemain Chênaie de Mangaud, trente-trois, sept cent dix, Samonac
quatorze rue Régis, trente-trois, zéro zéro zéro à Bordeaux
Avenue Auguste Ferret, trente-trois mille cent dix Le Bouscat
Avenue du Résinier, trente-trois, cent trente-huit Lanton
Avenue des Violettes Pyla, La Teste-de-Buch
Impasse Toussaint-Louverture à Bordeaux
dix-huit route d'Argilas
Rue des Ancelyns au numéro huit
sept route de Couquèques, trente-trois mille trois cent quarante Bégadan
un BIS impasse de Martindoit, trente-trois, cinq cent cinquante, Langoiran
trois cents avenue de Cavernes, trente-trois, quatre cent cinquante à Izon
La Garde, trente-trois mille trois cent quatre-vingt-dix Saint-Seurin-de-Cursac
Route de Cameyrac, trente-trois, quatre cent cinquante Saint-Sulpice-et-Cameyrac
Rue André Caverne, Bordeaux
Lotissement Les Rouvres du Vatican à Saint-Selve
quarante-six impasse du Grand Houstaou
Chemin de Charlemagne au numéro un
quarante-quatre rue de Hautebelle, trente-trois mille sept cent quarante Arès
neuf rue Ferbos, trente-trois, zéro zéro zéro, Bordeaux
sept BIS allée de Marsalat, trente-trois, cent trente-huit à Lanton
Rue du Luc, trente-trois mille six cents Pessac
Rue de Brach, trente-trois, zéro zéro zéro Bordeaux
Lotissement La Clef de Cazaux deux, La Teste-de-Buch
Avenue de Certes à Audenge
onze place de la Ferme de Richemont
Allée Ferdinand Buisson au numéro sept
trois rue Robert Charazac, trente-trois mille Bordeaux
huit peluchet, trente-trois, deux cent dix, Castets-en-Dorthe
neuf chemin des Agredives, trente-trois, quatre cent soixante à Arcins
Rue Docteur Pierre Masfrand, trente-trois mille cent cinquante Cenon
Chemin du Port des Places, trente-trois, cent quarante Cadaujac
Rue Marcelin, Bordeaux
Route de Casaque à Lugos
vingt-sept passage Cairon
Rue Séguineau au numéro trente et un
dix-neuf route de Troussas, trente-trois mille trois cent quarante Valeyrac
vingt-trois lotissement La Clef de Cazaux, trente-trois, cent quinze, La Teste-de-Buch
vingt-deux chemin de Camparian, trente-trois, six cent dix à Canéjan
Rue Mouneyra, trente-trois mille Bordeaux
Rue Domion, trente-trois, zéro zéro zéro Bordeaux
Rue Roullet, Bordeaux
Lotissement Domaine de Rose à Arbanats
deux route de Vendays
Allée de la Carménère au numéro neuf
trente-deux avenue du Général de Gaulle Pyla, trente-trois mille cent quinze La Teste-de-Buch
sept rue de Corn, trente-trois, deux cent quatre-vingt-dix, Blanquefort
deux rue Peysseguin, trente-trois, cent quatre-vingt-dix à La Réole
Rue Desbiey, trente-trois mille Bordeaux
Rue Tranchère, trente-trois, zéro zéro zéro Bordeaux
Chemin Departemental de Salignac A Verac, Salignac
Chemin de Capet à Saucats
sept avenue Jean Farges
Cité Plaisance au numéro dix
vingt chemin Lou Blanchet, trente-trois mille cinq cent quatre-vingt-dix Grayan-et-l'Hôpital
quarante-deux rue du Moulinat, trente-trois, cent quatre-vingt-cinq, Le Haillan
quatre allée du Pignadey, trente-trois, six cent dix à Cestas
Boulevard Chevrefin, trente-trois mille cent quarante Villenave-d'Ornon
Chemin de Vimeney, trente-trois, sept cent soixante Targon
Rue André Mureine, Bègles
Route Boutin Simon à Saint-Sulpice-et-Cameyrac
quarante-cinq rue Paul Bataille
Impasse Meynieu au numéro trois
quatre-vingt-six rue Paul Camelle, trente-trois mille Bordeaux
cinq rue du Tiscot, trente-trois, deux cent quatre-vingt-dix, Blanquefort
quatre résidence Pont de Martin, trente-trois, sept cent soixante-dix à Salles
Rue Laure Gatet, trente-trois mille Bordeaux
Route du Meynieu, trente-trois, huit cent trente Belin-Béliet
Rue Terrasson, Bordeaux
Rue Paul Dethomas à Saint-Médard-en-Jalles
vingt avenue des Bons Enfants
Avenue du Taillan-Médoc au numéro cent soixante-seize
trois chemin de Pasquot, trente-trois mille cent trente-trois Galgon
cinq BIS avenue Magrin, trente-trois, cinq cent dix, Andernos-les-Bains
deux chemin du Sablonat, trente-trois, quatre cent quatre-vingts à Castelnau-de-Médoc
Chemin de Manizan, trente-trois mille trois cent quarante Saint-Germain-d'Esteuil
Cours d'Ornano, trente-trois, sept cents Mérignac
Rue William Chaumet, Saint-Médard-en-Jalles
Rue Prévost au Bouscat
cinq le Canton
Rue Commandant Hautreux au numéro cinquante-trois
cent soixante-treize rue Antonic, trente-trois mille trois cent vingt Le Taillan-Médoc
quatre impasse des Goëlands, trente-trois, cent quarante, Villenave-d'Ornon
quarante-cinq avenue de Brivazac, trente-trois, six cents à Pessac
Allée des Sous-Bois, trente-trois mille cent quinze La Teste-de-Buch
Chemin de la Porterie, trente-trois, six cent soixante-dix Sadirac
Rue Georges Texier, Villenave-d'Ornon
Route de Léognan à Gradignan
dix-sept lotissement Marlène
Chemin de Ceinture de Talaris au numéro mille sept cent quatre-vingt-quinze
douze lotissement Les Places de Cavernes, trente-trois mille quatre cent cinquante Saint-Loubès
quarante-cinq rue de Doumerc, trente-trois, zéro zéro zéro, Bordeaux
quatre impasse des Bouches, trente-trois, sept cent dix à Gauriac
Avenue de Baron, trente-trois mille six cent cinquante Saint-Médard-d'Eyrans
Avenue Chavat, trente-trois, sept cent vingt Podensac
Allée Puygalant, Mérignac
Route des Lamberts à Comps
quinze chemin des Communs
Rue Guittard au numéro quinze
six chemin du Pont Traoucat, trente-trois mille six cent soixante-dix Blésignac
trois impasse Huet, trente-trois, cent trente-huit, Lanton
dix-huit allée Nicolas Appert, trente-trois, cent soixante à Saint-Médard-en-Jalles
Boulevard Alfred Daney, trente-trois mille Bordeaux
Avenue Favarque, trente-trois, cent trente Bègles
Avenue de Bisserie, La Teste-de-Buch
Route d'Asques à Saint-Romain-la-Virvée
sept BIS avenue Franck Cazenave
Allée de la Pelouse au numéro quarante-cinq BIS
cent dix-sept avenue des Eyquems, trente-trois mille sept cents Mérignac
quatre chemin de Peyrouley, trente-trois, trois cent soixante, Carignan-de-Bordeaux
quatre-vingt-quatre route de Hourton, trente-trois, cent soixante à Saint-Aubin-de-Médoc
Rue Lapeyre, trente-trois mille sept cent quatre-vingts Soulac-sur-Mer
Rue des Frères Lespinasse, trente-trois, cinq cents Arveyres
Allée des Bécasses Cazaux, La Teste-de-Buch
Allée du Médoc à Saint-Aubin-de-Médoc
vingt-trois rue Denise Bouchon
Rue Giacomo Matteoti au numéro onze
dix-huit BIS chemin de Verdet, trente-trois mille cinq cents Libourne
soixante-quinze B boulevard Pierre un er, trente-trois, cent dix, Le Bouscat
sept rue Belliquet, trente-trois, cinq cents à Libourne
Moundet, trente-trois mille deux cent dix Roaillan
Allée Marc Nouaux, trente-trois, quatre cent soixante-dix Gujan-Mestras
Allée Foquet, Gujan-Mestras
Avenue Jeanne de Devant à Langon
quatorze chemin de Machadey
Rue du Sudre au numéro seize
trois cent soixante-quinze chemin de Bois Milon, trente-trois mille deux cent quarante Saint-André-de-Cubzac
vingt rue Fourcaud, trente-trois, cinq cents, Libourne
onze BIS chemin de Valade, trente-trois, cinq cent quatre-vingt-dix à Grayan-et-l'Hôpital
Route du Boursol, trente-trois mille trois cent cinquante Mouliets-et-Villemartin
Allée de la Fontaine d'Albion, trente-trois, trois cent soixante-dix Sallebœuf
Place du Maucaillou, Bordeaux
Rue Duluc à Bordeaux
quarante-deux route de Grayan
Lotissement Le Bois du Martinet au numéro deux
neuf route de Marmande, trente-trois mille cent quatre-vingt-dix La Réole
quinze rue François Xavier, trente-trois, cinq cent vingt, Bruges
vingt rue Leberthon, trente-trois, zéro zéro zéro à Bordeaux
Allée de Cantinole, trente-trois mille trois cent vingt Eysines
Avenue de Ligondra, trente-trois, quatre cent soixante Arsac
Chemin des Champs du Graoux, Belin-Béliet
Avenue de Saint-Emilion à Saint-Sulpice-de-Faleyrens
deux impasse des Cabannes
Rue de la Côte d'Argent au numéro vingt-quatre
huit rue Georges Bedecarrax, trente-trois mille cinq cent soixante Carbon-Blanc
cent quatre-vingt-dix-huit route de Saint-Émilion, trente-trois, cinq cents, Libourne
trois avenue Cavaley, trente-trois, sept cent quarante à Arès
Rue de la Hourqueyre, trente-trois mille trois cent quarante Saint-Yzans-de-Médoc
Rue de Mapouchet, trente-trois, cent quinze La Teste-de-Buch
Rue des Gabauds, Izon
Chemin du Gary à Saint-Loubès
trente-six boulevard Larégnère
Rue Jaufré Rudel au numéro quatorze
six B rue Claude Taffanel, trente-trois mille Bordeaux
trois place du Falgouet, trente-trois, cinq cent dix, Andernos-les-Bains
soixante-dix-huit rue Dubourdieu, trente-trois, zéro zéro zéro à Bordeaux
Place de Lou Gay, trente-trois mille six cent dix Cestas
