huit cent vingt-cinq route d'Annonay, zéro sept, trois cent quarante Talencieux
cent cinquante-cinq chemin des Grads, zéro sept, cent soixante-dix, Lavilledieu
cinq cent onze route des Célestins, zéro sept, trois cent quarante à Saint-Désirat
Impasse Émile Junique, zéro sept, trois cents Tournon-sur-Rhône
Allée de la Magnanerie, zéro sept, trois cents Tournon-sur-Rhône
Route du Pont de Lignon, Roiffieux
Rue des Perriers à Glun
quatre cent cinquante et un rue des Prés Château
Chemin de Rouveure au numéro cent cinquante
mille quarante route de l'Échelette, zéro sept, cent soixante-dix Lussas
vingt et un place Seignobos, zéro sept, deux cent soixante-dix, Lamastre
cinq cent cinq chemin de Geny, zéro sept, cent trente à Soyons
Route de la Roche Péréandre, zéro sept, cent Annonay
Rue Bertraud, zéro sept, huit cents La Voulte-sur-Rhône
Allée de la Mûre, Peaugres
Chemin des Lèches à Soyons
quatre cent dix route de Beaumarais
Place Mayol au numéro deux
neuf rue de Georgie, zéro sept, trois cent trente Thueyts
six chemin de la Roche Noire, zéro sept, deux cents, Aubenas
cinquante-cinq chemin du Bâteau, zéro sept, sept cents à Saint-Just-d'Ardèche
Chemin de Saint-Martin des Ollières, zéro sept, deux cents Aubenas
Chemin de Montleviere, zéro sept, trois cents Étables
Chemin du Sourbier, Champis
Allée François Mansard à Guilherand-Granges
cinq cent quarante chemin de Côte Rôtie
Rue des Chanterelles au numéro cent quatre-vingt-deux
deux rue Radal, zéro sept, deux cents Aubenas
cent huit route de Samoyas, zéro sept, cent, Boulieu-lès-Annonay
cent chemin des Arceaux, zéro sept, deux cents à Saint-Étienne-de-Fontbellon
Boulevard Docteur François Bourret, zéro sept, zéro zéro zéro Privas
Impasse Suzanne Lenglen, zéro sept, cinq cents Guilherand-Granges
Boulevard Saint-Didier, Aubenas
Rue du Moulin de l'Aure à Toulaud
cent soixante-quinze chemin des Cedres
Allée des Poinsettias au numéro cinq
quatre-vingt-onze rue du Minerai, zéro sept, trois cent quarante Brossainc
trois cent dix chemin de Liffrand, zéro sept, deux cents, Lachapelle-sous-Aubenas
huit passage de l'Étang, zéro sept, trois cents à Tournon-sur-Rhône
Route Boissy d'Anglas, zéro sept, cent Roiffieux
Rue Henri Baudson, zéro sept, cent trente Saint-Péray
Route de la Syrah, Saint-Désirat
Rue Rémy Roure à Saint-Péray
trois cents rue René Palix
Allée de la Chênaie au numéro cent quarante
cinq cents route de Barjac, zéro sept, cent cinquante Salavas
cent quarante avenue Olivier de Serres, zéro sept, cent trente, Soyons
trois cent soixante-dix QUATER chemin du Silhol, zéro sept, cent vingt à Saint-Alban-Auriolles
Chemin de Palisson, zéro sept, six cent dix Sécheras
Route de Rochessauve, zéro sept, deux cent dix Alissas
Route de Tauzuc, Saint-Sauveur-de-Montagut
Rue Bertranne à Bourg-Saint-Andéol
cinq cent quinze rue Claude Constant
Avenue Hélène de Tournon au numéro six TER
trois place des Masseguisses, zéro sept, cent quarante Les Vans
mille six cent quatre-vingt-cinq route de la Chiéze, zéro sept, trois cent soixante, Les Ollières-sur-Eyrieux
dix rue Fombarlet, zéro sept, huit cents à La Voulte-sur-Rhône
Route des Bords d'Ardèche, zéro sept, trois cent quatre-vingts Pont-de-Labeaume
Rue des Colibris, zéro sept, cent trente Cornas
Chemin de la Fontaine de Cheyron, Aubenas
Rue de Champel au Cheylard
trente-quatre avenue de Nîmes
Chemin de Chalencon au numéro trois
trente-deux montée de Celles, zéro sept, huit cents La Voulte-sur-Rhône
quarante et un montée des Aygas, zéro sept, cent, Annonay
trente et un rue Vincent Touchet, zéro sept, quatre cents au Teil
Route de Combes, zéro sept, cent trente Saint-Romain-de-Lerps
Route des Mines, zéro sept, zéro zéro zéro Privas
Route de Bréchignac, Ucel
Rue de Tournon à Annonay
quarante-deux allée des Vignes de Beauregard
Rue Franki Kramer au numéro trente-huit
cent quatorze corniche de Montmiandon, zéro sept, cent Annonay
quinze cHE DU PIGEONNIER, zéro sept, trois cent trente, Mayres
soixante-huit chemin des Trousses, zéro sept, trois cents à Tournon-sur-Rhône
Rue Gourgouillon, zéro sept, trois cents Tournon-sur-Rhône
Rue Apollo onze, zéro sept, cinq cents Guilherand-Granges
Allée Air et Lumière, Guilherand-Granges
Chemin de Tourne à Bourg-Saint-Andéol
dix rue de Bernardy
Chemin Petit Avanon au numéro soixante-quinze
mille deux cent soixante-dix C route d'Andance, zéro sept, trois cent quarante Talencieux
cent quinze impasse des Alliers, zéro sept, cent dix, Vinezac
trente-deux chemin de Vermille, zéro sept, quatre cents à Rochemaure
Route de Seytenas, zéro sept, deux cent quatre-vingt-dix Quintenas
Chemin de l'Hermet, zéro sept, trois cents Tournon-sur-Rhône
Rue Chalamet, Lamastre
Rue de Chalamas à Saint-Marcel-lès-Annonay
cinq cent quarante-quatre route de Malbâti
Chemin de Pierre Blanche à Solignac au numéro quatre cent soixante
cinquante-cinq route des Écoles, zéro sept, deux cents Saint-Étienne-de-Fontbellon
mille vingt avenue Sadi Carnot, zéro sept, cinq cents, Guilherand-Granges
dix-huit rue de l'Arzalier, zéro sept, cent trente à Saint-Péray
Allée du Sauvignon, zéro sept, cent Saint-Marcel-lès-Annonay
Route de Chomérac, zéro sept, deux cent dix Saint-Symphorien-sous-Chomérac
Impasse de Margiriat, Saint-Jean-de-Muzols
Impasse des Fouillouses à Cruas
un place Saint-Teophrede
Place de Barjac au numéro dix-sept
neuf cent quarante chemin de Merlançon, zéro sept, sept cents Saint-Just-d'Ardèche
dix chemin de Chabetout, zéro sept, cent, Annonay
quatre rue Maurice Chaze, zéro sept, deux cents à Labégude
Avenue de Chomérac, zéro sept, zéro zéro zéro Privas
Impasse Figuerie, zéro sept, trois cents Saint-Jean-de-Muzols
Rue Gaston Tabardel, Le Teil
Rue de la Chirouze à Lamastre
six rue du Bariol
Rue de la Voûte au numéro soixante-seize
dix-sept place de la Croix de Pierre, zéro sept, quatre cent trente Vernosc-lès-Annonay
cent cinquante-cinq rue de Peyrard, zéro sept, deux cent quatre-vingt-dix, Satillieu
cent vingt-cinq QUATER chemin Croix de Raspail, zéro sept, deux cents à Lachapelle-sous-Aubenas
Avenue Victor Barrès, zéro sept, zéro zéro zéro Saint-Julien-en-Saint-Alban
Rue Délichères, zéro sept, deux cents Aubenas
Allée de Quintieux, Boulieu-lès-Annonay
Allée Léopold Lantheaume à Saint-Péray
trois cent cinquante chemin des Bastides de Bayssac
Route de Lamastre au numéro cinquante et un C
trente-deux route de Prat, zéro sept, deux cent quarante Vernoux-en-Vivarais
vingt et un rue Rhône Bellevue, zéro sept, cinq cents, Guilherand-Granges
quatorze rue des Châtaignes, zéro sept, deux cents à Aubenas
Chemin de la Terrasse, zéro sept, cent soixante Saint-Jean-Roure
Chemin de la Teyssonne, zéro sept, cent Saint-Marcel-lès-Annonay
Route de Boude, Vinezac
Chemin du Robert à Saint-Alban-Auriolles
deux rue Daniel Allibert
Chemin de la Collange au numéro cent dix
cinquante-quatre chemin de Cesar, zéro sept, cinq cent soixante-dix Désaignes
vingt allée Larigner, zéro sept, sept cents, Saint-Just-d'Ardèche
douze rue du Champ de Mars, zéro sept, sept cents à Bourg-Saint-Andéol
Chemin d'Éole, zéro sept, six cent dix Lemps
Place des Écoles, zéro sept, deux cents Lachapelle-sous-Aubenas
Route de Saint-Julien du Serre, Ucel
Rue des Grangettes à Saint-Désirat
huit rue du Lot Les Mouettes
Chemin de Bois Saint-Peyre au numéro cent soixante-cinq
cent cinquante-cinq impasse des Brugières, zéro sept, deux cents Saint-Étienne-de-Fontbellon
vingt-trois rue Ferdinand Malet, zéro sept, cent trente, Saint-Péray
cent quinze route d'Alès, zéro sept, deux cents à Saint-Étienne-de-Fontbellon
Rue des Deux Tours, zéro sept, sept cents Saint-Just-d'Ardèche
Chemin du Fez, zéro sept, sept cents Saint-Just-d'Ardèche
Rue Antonin Calixte, Vernoux-en-Vivarais
Rue de Saint-Cierge à Lamastre
cent cinquante-cinq impasse Anastasia
Place Couverte au numéro quatorze
vingt-sept rue Vincent d'Indy, zéro sept, deux cent cinquante Le Pouzin
sept cent vingt-cinq route de l'Heaume, zéro sept, deux cent quatre-vingt-dix, Quintenas
quinze impasse du Merle, zéro sept, huit cents à La Voulte-sur-Rhône
Chemin des Thermes, zéro sept, cent trente Soyons
Impasse de Basse Hironde, zéro sept, cent dix Vinezac
Allée Sainte-Fleurie, Saint-Péray
Rue Adolphe Baumle à Saint-Péray
vingt rue André-Marie Ampère
Route de Saint-Sernin au numéro deux cent quarante
cinquante-sept chemin de Fontenouille, zéro sept, quatre cents Le Teil
dix-sept A rue Maurice Chomel, zéro sept, cent, Annonay
sept rue des Braux, zéro sept, trois cents à Mauves
Rue Marius Perbost, zéro sept, cent vingt Saint-Alban-Auriolles
Chemin de la Vierge, zéro sept, cent soixante Le Cheylard
Impasse Paul Gauguin, Guilherand-Granges
Passage du Capi à Soyons
quarante route de Tournon
Route de Bruc et Les Côtes au numéro mille neuf cent soixante-dix
trois cent cinquante-cinq chemin de Coste Chaude, zéro sept, zéro zéro zéro Coux
trois cent quatre-vingt-cinq chemin du Pin de Barjac, zéro sept, quatre cent quarante, Champis
sept cent quarante-quatre chemin des Fontanes, zéro sept, cent à Boulieu-lès-Annonay
Rue des Hôpitaux, zéro sept, cent Boulieu-lès-Annonay
Rue Basse Ville, zéro sept, huit cents Beauchastel
Charmilles Ii, Charmes-sur-Rhône
Ruelle du Chareyrou à Lachapelle-sous-Aubenas
cent quatre-vingt-cinq chemin de Chamtadu
Route d'Uzer au numéro mille cinquante-deux
trente-trois impasse des Chirols, zéro sept, trois cent quarante Saint-Désirat
vingt-sept grande Rue de Macheville, zéro sept, deux cent soixante-dix, Lamastre
douze allée de Beaumartel, zéro sept, cent trente à Saint-Péray
Impasse de Grameize, zéro sept, deux cents Lachapelle-sous-Aubenas
Rue du Doux, zéro sept, trois cents Tournon-sur-Rhône
Boulevard Jean Mathon, Aubenas
Chemin de la Blache à Rochemaure
deux cent quarante-cinq route de Largentière
Chemin de Rouchon au numéro quatre
trente rue des Mouliniers, zéro sept, cent soixante-dix Lavilledieu
vingt rue de l'Arceau, zéro sept, cent cinquante, Salavas
cent soixante-dix-sept chemin des Bardons, zéro sept, trois cent soixante-dix à Eclassan
Route de Jaulan, zéro sept, cent trente Soyons
Rue Vierna, zéro sept, sept cents Bourg-Saint-Andéol
Rue de l'Oche, Mauves
Rue du deux Septembre mille neuf cent quarante-quatre à Limony
quatre mille deux cent quarante-cinq route Départementale n°deux
Chemin de Varagnes au numéro vingt
mille six cent soixante-dix route de Châteaubourg, zéro sept, cent trente Saint-Romain-de-Lerps
trente-huit avenue du Saint-Joseph, zéro sept, trois cents, Mauves
quatre chemin de Poulet, zéro sept, trois cent quarante à Champagne
Route de la Nohérie, zéro sept, trois cent quarante Peaugres
Chemin de Sainte-Croix, zéro sept, deux cents Aubenas
Chemin de la Vernade, Saint-Étienne-de-Fontbellon
Rue Jean Joanny à Saint-Julien-en-Saint-Alban
sept chemin de Cetras
Avenue du Jumelage au numéro quarante
cinquante-quatre chemin de Chatinais, zéro sept, cent Annonay
quinze rue du Tracol, zéro sept, quatre cents, Aubignas
mille deux cent soixante A avenue Louis Frédéric Ducros, zéro sept, cent trente à Saint-Péray
Allée des Perdriolles, zéro sept, cent trente Saint-Péray
Route de Réat, zéro sept, trois cents Étables
Place du Pont, Saint-Sauveur-de-Montagut
Route de Vals à Aubenas
quatre-vingts chemin de la Hâle
PL DU VILLAGE au numéro cent cinq
sept cent cinquante-quatre route de Cheval, zéro sept, trois cent quarante Peaugres
quatorze rue Louis Lacrotte, zéro sept, quatre cents, Le Teil
trente-cinq impasse des Cèdres, zéro sept, trois cents à Cheminas
Chemin du Pêcher, zéro sept, quatre cent dix Colombier-le-Vieux
Route de la Bâtie de Crussol, zéro sept, quatre cent quarante Champis
Allée des Guérets, Saint-Péray
Impasse du Crouzet à Coux
vingt et un rue des Frères Montgolfier
Route du Grand Pré au numéro quarante-deux
trois cent quatre-vingt-quinze chemin de Vert, zéro sept, trois cents Étables
deux cent quatre-vingt-quinze chemin de Jomard, zéro sept, quatre cent dix, Saint-Félicien
sept rue Docteur Élisée Charra, zéro sept, deux cent soixante-dix à Lamastre
Rue des Associations, zéro sept, cent trente Toulaud
Chemin de Grassot, zéro sept, six cent dix Sécheras
Rue Marguerite Duras, La Voulte-sur-Rhône
Route de Saint-Romain-d'Ay à Quintenas
vingt et un BIS route de Pradons
RUE HENRI BARBUSSE au numéro six mille cinq cent quatre-vingt-huit
douze BIS avenue Matteoti, zéro sept, quatre cents Le Teil
trois cent cinquante-deux rue du Docteur Adolphe Bonnard, zéro sept, trois cents, Tournon-sur-Rhône
treize impasse de la Croisette, zéro sept, deux cents à Aubenas
Rue Christophe Colomb, zéro sept, cinq cents Guilherand-Granges
Rue du Savel, zéro sept, cent vingt Ruoms
Chemin du Béolet, Saint-Romain-d'Ay
Place de la Roubine à Viviers
mille cent huit route de Sassolas
Route du Doux au numéro sept cent quatre-vingt-dix
douze allée du Garet, zéro sept, cent trente Saint-Péray
six mille côte Barlet, zéro sept, cent, Annonay
trois cent cinquante-cinq chemin de Flogères, zéro sept, cent dix à Vinezac
Rue Vieux Village, zéro sept, trois cents Saint-Jean-de-Muzols
Impasse du Mas de Villard, zéro sept, trois cent quatre-vingts Pont-de-Labeaume
Avenue Lucien Reynaud, Bourg-Saint-Andéol
Chemin du Meyrand à Coux
quatre cent cinquante route de Terminy
Impasse du Rioudard au numéro cinq
cent chemin de Goueille, zéro sept, deux cent quatre-vingt-dix Quintenas
six A impasse de la Riaille, zéro sept, cent soixante, Le Cheylard
cent quarante route de la Viallerie, zéro sept, trois cent soixante aux Ollières-sur-Eyrieux
Chemin de Pren Té Garde, zéro sept, huit cents La Voulte-sur-Rhône
Rue de la Tourette, zéro sept, deux cent quarante Vernoux-en-Vivarais
Route de Crémolière, Étables
Route de Lyas à Coux
mille cent quarante route de Davézieux
Avenue Ludovic Bacconnier au numéro trente et un BIS
cinq rue du Docteur Barry, zéro sept, cent Annonay
cent vingt-six chemin de Rivoire, zéro sept, trois cents, Tournon-sur-Rhône
quinze allée de la Crozette, zéro sept, cent trente à Saint-Péray
Impasse du Queyras, zéro sept, cent vingt Pradons
Rue de Versailles, zéro sept, sept cents Saint-Just-d'Ardèche
Impasse du Murier, Les Ollières-sur-Eyrieux
Rue Pré d'Ayas à Vernosc-lès-Annonay
cent trente-cinq rue des Termes
Rue Camille de Montgolfier au numéro trois cent soixante-cinq D
soixante-cinq chemin de Clutey, zéro sept, cinq cent soixante-dix Labatie-d'Andaure
cent quinze chemin des Pradaux, zéro sept, cent dix, Vinezac
trois cent vingt et un chemin de Jamelle, zéro sept, deux cent soixante à Joyeuse
Chemin de l'Espèdes, zéro sept, cent vingt Ruoms
Rue Camille Arnaud, zéro sept, trois cents Tournon-sur-Rhône
Place Alsace Lorraine, Annonay
Route de Soyons à Toulaud
six rue de l'Arbalestrier
Montée de Constantine au numéro trois
deux cent trente-trois chemin de Chalieux, zéro sept, trois cents Tournon-sur-Rhône
trois rue de la Verse, zéro sept, quatre cents, Rochemaure
trois cent quatorze chemin de Tourtousse, zéro sept, cent trente à Saint-Péray
Chemin de Martinot, zéro sept, trois cents Tournon-sur-Rhône
Avenue Mal de Lattre de Tassigny, zéro sept, sept cents Bourg-Saint-Andéol
Chemin du Sartre, Ucel
Route de Chinon à Eclassan
cinq cent soixante et onze chemin de Greylas
Rue de Paras au numéro six
mille six cent soixante-cinq chemin de Margier / Combeaux, zéro sept, quatre cent quarante Champis
un lotissement Le Clos du Fraysse, zéro sept, trois cents, Glun
mille sept cent cinquante route de la Vernade, zéro sept, cent dix à Vinezac
Chemin de la Brûlade, zéro sept, cent cinquante Salavas
Chemin de la Naute, zéro sept, cinq cent soixante-dix Labatie-d'Andaure
Avenue du Val d'Ardèche, Thueyts
Rue de la Croix de Mission à Roiffieux
quatre cent trente-cinq chemin des Rioux
Rue Hubert Robert au numéro cinquante
trente et un avenue Isidore Cuminal, zéro sept, trois cent quarante Serrières
quarante-huit impasse Chauvière, zéro sept, quatre cents, Rochemaure
soixante chemin de la Vachère, zéro sept, sept cents à Saint-Just-d'Ardèche
Avenue Vincent d'Indy, zéro sept, deux cent quarante Vernoux-en-Vivarais
Impasse de Vissenty, zéro sept, cent Annonay
Faubourg des Sautelles, Viviers
Route de Sarras à Ardoix
cinq cent trente-quatre chemin de Saint-Vincent
Rue de l'Ancienne Aubèrge au numéro cent douze
deux cent vingt-cinq avenue de l'Espinasse, zéro sept, deux cents Saint-Sernin
cent rue des Chèvres, zéro sept, deux cents, Lanas
six mille neuf cent six rue de Tourtousse, zéro sept, cent trente à Saint-Péray
Rue de Pied la Vigne, zéro sept, cent trente Cornas
Chemin de Montrôme, zéro sept, zéro zéro zéro Privas
Rue Louis Vinson, Saint-Julien-en-Saint-Alban
Rue Camille Gaudemard à Lamastre
quarante-huit chemin de la Convalescence
Route de Luzet au numéro mille quatre-vingt-dix
soixante route de Teynac, zéro sept, trois cent soixante Les Ollières-sur-Eyrieux
quarante-cinq route de l'Ecoutay, zéro sept, trois cent quarante, Saint-Désirat
cent vingt-cinq impasse de Signerose, zéro sept, cent soixante au Cheylard
Avenue du Plantier, zéro sept, deux cent quatre-vingt-dix Saint-Romain-d'Ay
Place Auguste Adelbert, zéro sept, zéro zéro zéro Privas
Chemin de Luzas, Lachapelle-sous-Aubenas
Rue Olivier de Serres à Lamastre
onze impasse des Fatouillers
Route de Saint-Etienne de Serres au numéro deux cent soixante-quinze
sept cent cinq route de Sauveplantade, zéro sept, deux cents Vogüé
soixante-quinze route d'Ozon, zéro sept, deux cent dix, Saint-Symphorien-sous-Chomérac
neuf cours du Palais, zéro sept, zéro zéro zéro à Privas
Chemin de Mayour, zéro sept, quatre cents Rochemaure
Cours du Temple, zéro sept, zéro zéro zéro Privas
Allée de Forsythias, Guilherand-Granges
Rue Labatie à Tournon-sur-Rhône
dix impasse de la Syrah
Route de Névissac au numéro six cent cinq
quarante rue Gaston Duclos, zéro sept, cent Annonay
soixante et onze rue de Tournus, zéro sept, trois cent quarante, Serrières
soixante-seize chemin de Ripotier Haut, zéro sept, deux cents à Aubenas
Rue Henry Stendhal, zéro sept, quatre cent trente Davézieux
Allée Camille Claudel, zéro sept, cinq cents Guilherand-Granges
Chemin de l'Ile de la Croix de La, Rochemaure
Impasse des Mazettes à Saint-Barthélemy-le-Plain
dix n° quatre-vingt-six
Castel Pavillon au numéro sept
douze rue Rampon, zéro sept, huit cents La Voulte-sur-Rhône
sept boulevard de Montjuliau, zéro sept, zéro zéro zéro, Privas
deux cent trente-cinq route de Rousset, zéro sept, cent trente à Toulaud
Place du Jeu de Paume, zéro sept, huit cents La Voulte-sur-Rhône
Chemin de Malarias, zéro sept, quatre cents Rochemaure
Chemin de Mapias, Lavilledieu
Allée des Lys à Guilherand-Granges
vingt-six rue sous le Four
Chemin de Brezenaud au numéro mille deux cent quatre-vingt-cinq
six cent quarante chemin de Veyras, zéro sept, deux cents Lachapelle-sous-Aubenas
cent quarante-cinq chemin de Flot, zéro sept, cent trente, Toulaud
deux cent cinquante BIS route de la Maladière, zéro sept, cent à Roiffieux
Chemin de Trollat, zéro sept, trois cents Étables
Rue Font Chevalier, zéro sept, cent Annonay
Rue de l'Ardèche, Vogüé
Rue du Cadran Solaire au Teil
soixante-quinze impasse du Gour du Drague
Impasse de Bizac au numéro quatre-vingt-quinze
six esplanade Mandela, zéro sept, trois cent cinquante Cruas
six cent trente route du Darne, zéro sept, quatre cent dix, Saint-Félicien
trois BIS impasse du Dispensaire, zéro sept, quatre cents au Teil
Rue Joseph Parnin, zéro sept, trois cents Tournon-sur-Rhône
Avenue Marcel Molle, zéro sept, deux cents Aubenas
Passage du Girardier, Saint-Jean-de-Muzols
Rue Eugène Goy à Désaignes
cent vingt-deux faubourg d'Antraigues
Rue de Crussol au numéro trente et un
quatre-vingts chemin de la Bardoine, zéro sept, deux cent quatre-vingt-dix Quintenas
trente-cinq chemin de la Téoule, zéro sept, deux cents, Saint-Étienne-de-Fontbellon
huit allée du Sauvat, zéro sept, cent trente à Saint-Péray
Rue Jean-Louis Soulavie, zéro sept, cent dix Largentière
Route du Petit Lieu, zéro sept, cent soixante Jaunac
Place Marie d'Ornano, Lavilledieu
Allée de la Rose à Chomérac
neuf A boulevard de Vernon
Chemin des Pêchers au numéro quatre cent vingt
quatre-vingt-trois rue Antoine Chelles, zéro sept, quatre cent trente Davézieux
six mille quatre-vingt-trois chemin de Chaveyron, zéro sept, sept cents, Saint-Marcel-d'Ardèche
trois cent cinquante route de Quintenas, zéro sept, deux cent quatre-vingt-dix à Ardoix
Impasse du Bosc, zéro sept, six cent dix Sécheras
Chemin des Sourdes, zéro sept, deux cent soixante Joyeuse
Route de Dugradus, Ucel
Rue d'Authijol à Saint-Alban-Auriolles
cent vingt-cinq chemin du Plaut
Rue des Guéritoux au numéro cinquante
soixante-seize avenue Daniel Mercier, zéro sept, cent Annonay
soixante-quinze allée de Chantebise, zéro sept, trois cents, Cheminas
quinze chemin de Villedieu, zéro sept, cent à Annonay
Rue de Chapotte, zéro sept, trois cents Tournon-sur-Rhône
Route de Bramefan, zéro sept, cent Roiffieux
Avenue de Saunier, Le Cheylard
Chemin du Rail à Vernosc-lès-Annonay
treize route de Jabrezac
Chemin Mignot au numéro onze
dix-huit boulevard Tariotte, zéro sept, quatre cents Le Teil
trois cent trente chemin de Bastide, zéro sept, deux cents, Vogüé
deux route de Boulieu, zéro sept, cent à Annonay
Impasse Beauséjour, zéro sept, cinq cents Guilherand-Granges
Chemin de Châtelas, zéro sept, quatre cent dix Saint-Félicien
Impasse du Bourdaric, Saint-Alban-Auriolles
Rue des Genets à Saint-Cyr
vingt-huit chemin Imbert
Route de Lazuel au numéro trente-quatre
soixante-cinq chemin de Montjoux, zéro sept, deux cent quatre-vingt-dix Quintenas
six rue de Chabetout, zéro sept, quatre cent dix, Saint-Félicien
un rue Capitaine de Canson, zéro sept, cent à Annonay
MTE DE LA COMBE, zéro sept, trois cent quarante Vinzieux
Chemin de la Fromentale, zéro sept, trois cent quarante Peaugres
Rue Baptiste Marcet, Saint-Péray
Montee de Vallier à Châteauneuf-de-Vernoux
six route de Lavilledieu
Rue de Chantebise au numéro deux cent soixante et onze
trois cent soixante-neuf route de Grange Seux, zéro sept, quatre cent trente Vernosc-lès-Annonay
vingt rue Emile Bouschon, zéro sept, cent, Annonay
vingt et un rue Clémenceau, zéro sept, cent vingt à Ruoms
Route de Privas, zéro sept, trois cent soixante Les Ollières-sur-Eyrieux
Chemin de Sceautres, zéro sept, quatre cents Rochemaure
Rue des Pères, Saint-Alban-Auriolles
Avenue de Zelzate à Aubenas
trois cent dix-neuf rTE VIEILLE DE LAGORCE
Route Rd quatre-vingt-six au numéro neuf cent dix
soixante-douze rue Barthélémy Roux, zéro sept, cinq cents Guilherand-Granges
treize BIS avenue du Vanel, zéro sept, zéro zéro zéro, Privas
cent vingt-neuf rue des Chaumatons, zéro sept, cent à Roiffieux
Rue de la Boissonnat, zéro sept, cinq cents Guilherand-Granges
Route du Lauzas, zéro sept, deux cents Ucel
Chemin de Rieussede, Joyeuse
Rue Raoul Follereau à Lamastre
six cent cinquante-cinq route de Valence
Route de Lagorce au numéro vingt-neuf
quatre avenue Commandant Théron, zéro sept, deux cent cinquante Le Pouzin
trente-cinq impasse du Trescolet, zéro sept, trois cent soixante-dix, Ozon
trois rue Louis Reinaud, zéro sept, quatre cents au Teil
Impasse Chabert, zéro sept, deux cent quarante Vernoux-en-Vivarais
Route de Picardel, zéro sept, trois cent quarante Charnas
Chemin de Meyret, Toulaud
Montee de la Place à Saint-Félicien
quatre allée du Colombier
Rue Ferdinand Hérold au numéro vingt-huit
cent cinq route de Lamothe, zéro sept, trois cent trente Barnas
six rue de Bard, zéro sept, quatre cent dix, Saint-Félicien
six montée Jean Gilly, zéro sept, deux cents à Ucel
Avenue Boissy d'Anglas, zéro sept, deux cent soixante-dix Lamastre
Chemin du Magnet, zéro sept, cent trente Soyons
Rue sur la Ville, Boulieu-lès-Annonay
Rue de la Couleyre à Cornas
seize BIS avenue du Docteur Lagarde
Route de Vaudevant au numéro quatre cent soixante-cinq
trois cent soixante-dix combe Laurent, zéro sept, cent vingt Saint-Alban-Auriolles
deux cent cinquante chemin de l'Hotoire, zéro sept, deux cent quatre-vingt-dix, Quintenas
quinze chemin du Soleil Levant, zéro sept, trois cents à Étables
Rue Fernand Lafont, zéro sept, cent soixante Le Cheylard
Route de Montlevier, zéro sept, cent Saint-Marcel-lès-Annonay
Avenue de Prahines, Privas
Avenue Martin Sauze à Lavilledieu
trente chemin des Lavandes
Rue Dame de Montlaur au numéro deux
deux cent quarante-cinq route de Niègles, zéro sept, trois cent quatre-vingts Pont-de-Labeaume
vingt chemin des Bisets, zéro sept, deux cents, Aubenas
trois rue de la Valentine, zéro sept, trois cents à Tournon-sur-Rhône
Route du Clos des Chênes, zéro sept, deux cents Ucel
Chemin de l'Eygue, zéro sept, quatre cents Rochemaure
Chemin du Musard, Soyons
Rue Marie-Jeanne Gauthier à Saint-Péray
quarante-cinq chemin des Souches
Avenue de Boisvignal au numéro trente
trois cent soixante chemin de la Gerle, zéro sept, quatre cent dix Saint-Félicien
cent cinq chemin de Deyras, zéro sept, quatre cent quarante, Champis
deux cent cinquante-six impasse de Pelignol, zéro sept, quatre cents à Rochemaure
Route de Chaumette, zéro sept, deux cent dix Alissas
Montée de la Garenne, zéro sept, deux cent quatre-vingt-dix Satillieu
Impasse Docteur Boissin, Saint-Alban-Auriolles
Chemin de la Gleizasse à Salavas
neuf avenue Victor Descours
Rue du Tamaris au numéro trois
seize impasse des Entraves, zéro sept, trois cent quarante Brossainc
treize rue du Magnum, zéro sept, cent trente, Saint-Péray
trois cent vingt cHE DE CAUTET, zéro sept, trois cent trente à Mayres
Place des Bœufs, zéro sept, zéro zéro zéro Privas
Chemin de la Bergeronne, zéro sept, cent trente Soyons
