Rue de Chambrun, trente-trois, zéro zéro zéro Bordeaux
Chemin de Milavy, Le Taillan-Médoc
Rue François Peychaud à Saint-Médard-en-Jalles
vingt rue Charles Dopter
Rue d'Artiguemale au numéro dix-huit B
sept chemin du Jin, trente-trois mille sept cent soixante-dix Salles
deux mille cent cinq route de Cazaux, trente-trois, cent quinze, La Teste-de-Buch
trente-six rue Édouard Larroque, trente-trois, zéro zéro zéro à Bordeaux
Avenue des Côtes de Bourg, trente-trois mille sept cent dix Prignac-et-Marcamps
Route de Cloche, trente-trois, trois cent quatre-vingts Mios
Avenue du Professeur Paul Lamarque, Bazas
Rue du Commandant Arnould à Bordeaux
seize quai Jean Fleuret
Rue Alcide Lambert au numéro vingt-deux
dix-neuf B chemin des Gassinières, trente-trois mille trois cent quatre-vingts Mios
onze rue Boistaud, trente-trois, zéro zéro zéro, Bordeaux
vingt-sept rue Jean-Louis Faure, trente-trois, deux cent vingt à Sainte-Foy-la-Grande
Avenue de Branne, trente-trois mille trois cent soixante-dix Tresses
Rue Yvon Mansencal, trente-trois, cent quarante Villenave-d'Ornon
Cours Pey Berland, Margaux
Chemin de la Brulerie à Lignan-de-Bordeaux
douze avenue Georges Mandel
Rue E J Laporte au numéro vingt-huit BIS
trente-sept BIS route de Camblanes, trente-trois mille six cent soixante-dix Créon
onze allée Terre Rouge, trente-trois, trois cent vingt, Le Taillan-Médoc
trois rue La Boubée, trente-trois, zéro zéro zéro à Bordeaux
Chemin des Augers, trente-trois mille sept cent dix Tauriac
Rue Rigal, trente-trois, cent dix Le Bouscat
Allée Jean Jossomme, Saint-Médard-en-Jalles
Chemin du Mignon au Barp
quinze rue Vieillard
Rue Marcel Durrieu au numéro cinq
neuf BIS rue Peres, trente-trois mille six cents Pessac
cinq résidence de Gaillat, trente-trois, deux cent dix, Langon
vingt et un chemin des Ourmes, trente-trois, trois cent quarante à Queyrac
Impasse Camille Rongier, trente-trois mille cinq cent dix Andernos-les-Bains
Impasse de Marbotin, trente-trois, sept cents Mérignac
Chemin de l'Estrille, Saint-Loubès
Lotissement Sotogrande à Gujan-Mestras
sept allée de Magudas
Chemin du Chaudron au numéro vingt-neuf
trente et un rue Auguste Lemeland, trente-trois mille cinq cents Arveyres
huit rue Tourat, trente-trois, zéro zéro zéro, Bordeaux
six passage des Graves, trente-trois, zéro zéro zéro à Bordeaux
Avenue des Sternes, trente-trois mille cent quinze La Teste-de-Buch
Rue Chico Mendès, trente-trois, cent soixante Saint-Médard-en-Jalles
Rue Toussaint Balestic, Saint-Médard-en-Jalles
Rue du Général Kléber à Bègles
huit avenue de Canterane
Lotissement Domaine Les Belles Graves au numéro vingt-sept
cinquante-six chemin de Lamouroux, trente-trois mille deux cent quatre-vingt-dix Le Pian-Médoc
vingt et un allée Camille Corot, trente-trois, quatre cent soixante-dix, Gujan-Mestras
sept impasse de Portato, trente-trois, cent vingt-quatre à Auros
Route de Flatter, trente-trois mille trois cent quatre-vingts Mios
Rue de Béarn, trente-trois, sept cents Mérignac
Avenue de Saint-Médard, Eysines
Route de Lignan à Sadirac
sept allée de Pagneau
Rue des Pins Francs au numéro cent quatre BIS
trente et un rue Sieyès, trente-trois mille cent soixante Saint-Médard-en-Jalles
quatre-vingts rue Eugène Jacquet, trente-trois, zéro zéro zéro, Bordeaux
deux chemin du Cap Roux, trente-trois, sept cents à Mérignac
Allée du Petit Moutchic, trente-trois mille six cent quatre-vingts Lacanau
Avenue Sarah Bernhardt, trente-trois, cinq cent dix Andernos-les-Bains
Rue Michel Audoy, Saint-Estèphe
Avenue de Pujade à Cénac
trente BIS chemin de la Corbière
Rue François Dumora au numéro treize
vingt-six TER rue Édouard Bourlaux, trente-trois mille cent quarante Villenave-d'Ornon
neuf allée de l'Agréou, trente-trois, six cent dix, Cestas
onze allée de la Pointe, trente-trois, neuf cent cinquante à Lège-Cap-Ferret
Allée de la Hourn, trente-trois mille cent vingt et un Carcans
Boulevard du onze Novembre mille neuf cent dix-huit, trente-trois, cinq cent quarante Sauveterre-de-Guyenne
Chemin de Savarias, Salignac
Rue Leylaud à La Réole
trente-trois rue Capdeville
Rue de l'Esquirey au numéro onze
six rue des Berneries, trente-trois mille six cent vingt Cubnezais
cent dix route du Médoc, trente-trois, cent dix, Le Bouscat
huit rue Paul Berninet, trente-trois, cent soixante à Saint-Médard-en-Jalles
Avenue Edmond Foucré, trente-trois mille quatre cent cinquante Saint-Loubès
Allée d'Epinal, trente-trois, sept cents Mérignac
Avenue Saint-Thomas d'Aquin Pyla, La Teste-de-Buch
Rue André Loiseau à Saint-Émilion
quarante rue de Lurbe
Rue du Clos Lousteauneu au numéro dix-sept
quatre rue Francis Pélissier, trente-trois mille cent soixante Saint-Médard-en-Jalles
huit clos des Trinitaires, trente-trois, cent douze, Saint-Laurent-Médoc
un rue de Berlet, trente-trois, sept cents à Mérignac
Rue du Petit Païs, trente-trois mille cent douze Saint-Laurent-Médoc
Avenue des Lutins, trente-trois, cinq cent dix Andernos-les-Bains
Rue des Gants, Bordeaux
Rue Jean Maridor à Mérignac
huit rue de Milon
Chemin des Nauves au numéro dix-neuf
neuf avenue de la Pointe aux Chevaux, trente-trois mille neuf cent cinquante Lège-Cap-Ferret
quatre chemin Ouvre, trente-trois, trois cent soixante, Carignan-de-Bordeaux
six chemin de lou Pacadje, trente-trois, six cent dix à Cestas
Rue Yves Du Manoir, trente-trois mille sept cents Mérignac
Impasse Toulinguet, trente-trois, sept cent quarante Arès
Route de Forestier, Cartelègue
Route de Compostelle à Salles
quinze lotissement l'Ecureuil
Rue de la Réole au numéro trente-deux B
vingt-cinq les Petits Rois Nord, trente-trois mille deux cent trente Coutras
deux chemin de Tutou, trente-trois, sept cent soixante-dix, Salles
deux rue Pampelune, trente-trois, huit cent vingt à Saint-Ciers-sur-Gironde
Allée de la Girolle, trente-trois mille quatre cent soixante-dix Gujan-Mestras
Chemin de Thiot, trente-trois, sept cent soixante-dix Salles
Rue Saint-Rieul Dupouy, Villenave-d'Ornon
Allée Baïne à Lacanau
cinq allée du Bassin
Allée de Sénéjac au numéro cent cinquante et un
vingt-trois chemin de Pelon, trente-trois mille deux cent cinquante Cissac-Médoc
quarante-sept avenue du Site Montesquieu, trente-trois, six cent cinquante, Martillac
vingt-six A rue du Solarium, trente-trois, cent soixante-dix à Gradignan
Chemin de l'Isle, trente-trois mille six cent soixante-dix Sadirac
Impasse d'Icare, trente-trois, sept cents Mérignac
Impasse Reine des Près, Soussans
Rue Sourbès à Lormont
cinq avenue René Krick
Chemin Comte à Coulin au numéro douze
dix-sept rue Rocherol, trente-trois mille cinq cents Libourne
trois chemin de Caillivolle, trente-trois, cent quinze, La Teste-de-Buch
treize rue Edmond Grangeneuve, trente-trois, six cents à Pessac
Rue Louise Paris, trente-trois mille six cent soixante-dix Créon
Rue Désiré Granet, trente-trois, trois cent quatre-vingts Biganos
Rue Ham Foret du Troncais, Bruges
Chemin de Boisvert à Canéjan
vingt-trois BIS avenue du Page
Rue Jeanne Baret au numéro dix
trente route de la Souloire, trente-trois mille sept cent cinquante Saint-Germain-du-Puch
sept chemin Lou Parroupian, trente-trois, six cent dix, Cestas
quinze rue Puységur, trente-trois, zéro zéro zéro à Bordeaux
Route de Guerrin, trente-trois mille deux cent cinquante Saint-Sauveur
Rue de l'Abbé Coutreau, trente-trois, neuf cent trente Vendays-Montalivet
Route du Pin Sec, Gaillan-en-Médoc
Chemin de la Pinette à Saint-Magne-de-Castillon
quatre avenue du Roy
Rue Gustave Gaillard au numéro trente-quatre
vingt et un allée de la Callune, trente-trois mille neuf cent cinquante Lège-Cap-Ferret
quinze cité Piron, trente-trois, trois cent quatre-vingt-dix, Plassac
huit avenue du Docteur Gustave Couaillac, trente-trois, huit cent dix à Ambès
Avenue de Picot, trente-trois mille trois cent vingt Eysines
Allée Jean-François Millet, trente-trois, quatre cent soixante-dix Gujan-Mestras
Rue Pierre Deycard, Salles
Avenue Fernand Pillot à Galgon
quatorze avenue Roger Cohé
Avenue de Mentque au numéro trois
trois A rue de Jean Cabos, trente-trois mille deux cent dix Toulenne
cinq cent vingt-deux A chemin de Peyreffite, trente-trois, cent quatre-vingt-dix, La Réole
cinq route de Maurin, trente-trois, six cent soixante-dix à Créon
Chemin de la Vigne Blanche, trente-trois mille trois cent vingt Le Taillan-Médoc
Avenue de Chantier, trente-trois, cent quatorze Le Barp
Place du Docteur Abaut, Langoiran
Rue de Pélet à Ambarès-et-Lagrave
dix-sept rue Villa Pauline
Rue Kyrié au numéro cent soixante-seize
sept place des Prés Verts, trente-trois mille cent quinze La Teste-de-Buch
vingt-deux impasse des Anguillères, trente-trois, cent vingt-sept, Saint-Jean-d'Illac
deux rue du Général Chanzy, trente-trois, cent quinze à La Teste-de-Buch
Avenue Chasse-Spleen, trente-trois mille trois cent vingt Le Taillan-Médoc
Impasse Georges Guynemer, trente-trois, cent vingt-sept Saint-Jean-d'Illac
Rue Guynemer Cazaux, La Teste-de-Buch
Rue du Port Cassy à Lanton
neuf rue de Bégadanet
Allée de Brignon au numéro neuf
un rue Roger Allo, trente-trois mille Bordeaux
cent soixante-dix-huit avenue de la Somme, trente-trois, sept cents, Mérignac
cinquante-quatre BIS rue André Lafon, trente-trois, trois cent quatre-vingt-dix à Blaye
Rue Savinien Vivier, trente-trois mille cinq cent soixante Sainte-Eulalie
Rue du Médoc, trente-trois, cent quatre-vingts Saint-Estèphe
Rue Ernest Bonnet, Ambès
Rue Paul Courteault à Bordeaux
neuf chemin Berniche
Route de Beychac et Cailleau au numéro vingt-deux
treize Q allée des Pins Verts, trente-trois mille quatre cent soixante-dix Gujan-Mestras
quarante-huit avenue des Échoppes, trente-trois, six cents, Pessac
six route de Marze, trente-trois, cent trente-trois à Galgon
Chemin de Bos, trente-trois mille cent soixante Saint-Médard-en-Jalles
Rocade de la Dune, trente-trois, six cent quatre-vingts Lacanau
Chemin de Verdery, Cestas
Rue Ham Foret de Becede à Bruges
sept rue Léopold Boireau
Rue des Dubrocs au numéro huit
dix-neuf rue de Costes, trente-trois mille quatre cent soixante Cussac-Fort-Médoc
quarante et un rue de Leybardie, trente-trois, zéro zéro zéro, Bordeaux
trente-trois rue Cassignard, trente-trois, zéro zéro zéro à Bordeaux
Rue des Gombauds, trente-trois mille sept cent dix Tauriac
Avenue de la Fraternité, trente-trois, cinq cent dix Andernos-les-Bains
Rue Marie Marthe, Talence
Place du vingt Août mille neuf cent quarante-neuf à Cestas
soixante-douze chemin de Cante-Gric
Allée de Francs au numéro neuf
trois impasse Peyrehaut, trente-trois mille cent quarante Villenave-d'Ornon
vingt-neuf rue des As, trente-trois, six cents, Pessac
cinquante-cinq avenue des Paloumeyres, trente-trois, cent vingt-cinq à Louchats
Rue de Magrigne, trente-trois mille deux cent quarante Saint-Laurent-d'Arce
Chemin de la Hountane, trente-trois, six cent cinquante Saint-Selve
Avenue de la Musicienne, Lège-Cap-Ferret
Boulevard du Colonel Wurtz à Andernos-les-Bains
neuf rue Saint-Fort
Chemin des Pradeaux au numéro huit
quatre route de Cavignac, trente-trois mille cent trente-trois Galgon
quatre allée de la Graveyre, trente-trois, cent soixante, Saint-Aubin-de-Médoc
quatre impasse Gaston, trente-trois, quatre cent soixante à Cussac-Fort-Médoc
Rue Viaud, trente-trois mille cent dix Le Bouscat
Chemin de Bonalgue, trente-trois, sept cent cinquante Saint-Germain-du-Puch
Rue Paul Dumont, Eysines
Impasse du Quatre Septembre à Bègles
six avenue Ernest Becquet
Boulevard de l'Océan Pyla au numéro cent quarante et un
soixante-quatre allée des Bergeries, trente-trois mille cent vingt-cinq Louchats
un allée Gilberte Bacquey, trente-trois, cent soixante, Saint-Aubin-de-Médoc
quinze chemin du Petit Babeau, trente-trois, sept cent soixante à Targon
Rue François Daunes, trente-trois mille Bordeaux
Chemin de la Gréle, trente-trois, six cent quatre-vingts Le Porge
Impasse de Lugat, Saint-Magne
Chemin du Pujeau à Salles
deux rue de Sémillon
Avenue de Beaumale au numéro dix-huit
huit cent quarante-cinq route de Canneau, trente-trois mille deux cent quarante La Lande-de-Fronsac
deux rue Paul Daussy, trente-trois, cent quinze, La Teste-de-Buch
six route de Larcheval, trente-trois, sept cent cinquante à Baron
Chemin de Barbicadge, trente-trois mille six cent dix Canéjan
Avenue Emmanuel Lasserre, trente-trois, six cent quatre-vingt-dix Grignols
Rue du Bleu, Eysines
Impasse des Blandats à Ambarès-et-Lagrave
onze allée Jozereau
Allée Pétrus Rubens au numéro quatre
un chemin de l'Oustalet, trente-trois mille cent quinze La Teste-de-Buch
neuf rue du Malaga, trente-trois, trois cent soixante-dix, Artigues-près-Bordeaux
quatorze rue Marie Espelette, trente-trois, cent soixante-dix à Gradignan
Rue Claude Lorrain, trente-trois mille cent soixante Saint-Médard-en-Jalles
Rue Etienne de la Boetie, trente-trois, deux cent quarante Saint-Laurent-d'Arce
Avenue du Haut Médoc, Cussac-Fort-Médoc
Rue de Maurian à Blanquefort
six lotissement de Hirondelles
Rue David Gradis au numéro trois
cinq chemin de l'Avenue, trente-trois mille deux cent cinquante Pauillac
trois rue Bengaline, trente-trois, six cents, Pessac
vingt place Gaviniès, trente-trois, zéro zéro zéro à Bordeaux
Rue Laville-Fatin, trente-trois mille Bordeaux
Rue du Docteur de Souverbie, trente-trois, zéro zéro zéro Bordeaux
Place de Labric, Macau
Rue Léon Cigarroa à Arcachon
vingt-huit rue Tocqueville
Rue Louis Cabié au numéro douze
trente et un rue Dourout, trente-trois mille quatre cents Talence
douze rue Lucien Delvolve, trente-trois, neuf cent trente, Vendays-Montalivet
quatre-vingt-trois rue de la Course, trente-trois, zéro zéro zéro à Bordeaux
Cité Sauvageon, trente-trois mille Bordeaux
Place Rohan, trente-trois, zéro zéro zéro Bordeaux
Lotissement Sainte-Clotilde, Gujan-Mestras
Rue Cols Verts Cap Ferret à Lège-Cap-Ferret
dix rue François Lebreton
Chemin Terre du Pont au numéro trois
quatre avenue Charles Cante, trente-trois mille six cent cinquante La Brède
dix-neuf impasse Ruat, trente-trois, trois cent vingt, Le Taillan-Médoc
quinze avenue Maxence Van Der Mersch, trente-trois, six cents à Pessac
Allée Belem, trente-trois mille neuf cent cinquante Lège-Cap-Ferret
Rue des Cakiliers, trente-trois, cent trente-huit Lanton
Avenue Arguin Dune de l'Herbe, Lège-Cap-Ferret
Avenue du Maréchal Foch Pyla à La Teste-de-Buch
trois rue d'Autriche
Rue Lajaunie au numéro vingt et un
huit clos du Piquet, trente-trois mille trois cent soixante Camblanes-et-Meynac
treize allée du Meynieu, trente-trois, huit cent trente, Belin-Béliet
deux lotissement Domaine de Canterane, trente-trois, deux cent soixante-dix à Bouliac
Route de Plassan, trente-trois mille trois cent quarante Lesparre-Médoc
Rue Bertrand Robin, trente-trois, cinq cents Libourne
Rue Héron, Bordeaux
Chemin du Bon Coin à Lignan-de-Bordeaux
quatorze rue Pierre Réault
Rue Pierre André Charron au numéro quatorze
seize allée de l'Eau Bourde, trente-trois mille cent soixante-dix Gradignan
trois le Bourg Sud, trente-trois, quatre cent trente, Cudos
treize allée des Cerfs, trente-trois, cent soixante à Saint-Aubin-de-Médoc
Route des Mésanges, trente-trois mille cent quarante et un Villegouge
Lotissement Le Haut des Greens, trente-trois, six cent quatre-vingts Lacanau
Avenue La Fontaine, Carbon-Blanc
Rue de Virebouc à Blanquefort
deux rue de Créon
Allée Ausone au numéro neuf
quatre impasse de l'Amiral Corbet, trente-trois mille neuf cent cinquante Lège-Cap-Ferret
cinq rue D-Francois-Esprit Auber, trente-trois, sept cents, Mérignac
un allée Hippocrate, trente-trois, six cents à Pessac
Allée du Pas de Luc, trente-trois mille six cent dix Canéjan
Rue des Trois Frères Béjard, trente-trois, cinq cents Libourne
Avenue Boucher Franc Cap Ferret, Lège-Cap-Ferret
Rue Bréteil à Eysines
trente-deux rue du Mal Gallieni
Allée du Bicon au numéro deux
trois rue Gaëtan Dumas, trente-trois mille Bordeaux
deux lotissement le Clos du Vigneron, trente-trois, trois cent soixante-dix, Pompignac
trente rue Hériard Dubreuil, trente-trois, zéro zéro zéro à Bordeaux
Chemin de la Piguille, trente-trois mille deux cent quarante Saint-Laurent-d'Arce
Avenue Saint-François Xavier Pyla, trente-trois, cent quinze La Teste-de-Buch
Rue de Martouret, Floirac
Allée Fructidor à La Teste-de-Buch
seize résidence de Lépiney
Résidence du Renet au numéro vingt-sept
trente-sept avenue Louis Didier, trente-trois mille cinq cents Libourne
deux rue de Garin, trente-trois, trois cent quarante, Prignac-en-Médoc
neuf route du Sauternais, trente-trois, six cent cinquante à Cabanac-et-Villagrains
Impasse Matalin, trente-trois mille deux cent quatre-vingt-dix Le Pian-Médoc
Rue de Vassivey, trente-trois, deux cent quatre-vingt-dix Parempuyre
Chemin de Feuillade, Camarsac
Rue Jean-Rolland Pillet à Villenave-d'Ornon
sept A rue Jehenne
Chemin du Mayne d'Esteve au numéro soixante-treize
vingt-quatre rue Roger Touton, trente-trois mille Bordeaux
un allée Newton, trente-trois, deux cent soixante-dix, Floirac
cent quarante-trois rue de Choisit, trente-trois, neuf cent dix à Saint-Ciers-d'Abzac
Rue de Daugère, trente-trois mille cinq cent vingt Bruges
Impasse Vieille Tour, trente-trois, quatre cents Talence
Rue du Berdacà, Blanquefort
Allée de Rouillac à Canéjan
quinze rue Esprit-Des-Lois
Impasse Docteur Pallet au numéro cinq
trente-trois avenue de l'Aiglon, trente-trois mille cent quatre-vingt-cinq Le Haillan
quatre impasse Jeannin, trente-trois, zéro zéro zéro, Bordeaux
dix rue Roger Espagnet, trente-trois, quatre cent quarante à Saint-Louis-de-Montferrand
Rue Brun, trente-trois mille Bordeaux
Avenue Paul Broca, trente-trois, deux cent vingt Pineuilh
Résidence Les Genêts d'Or, Captieux
Rue Henri Laval à Landiras
trois impasse Foquet
Rue Lamothe-Pichon au numéro dix-neuf
trente-quatre rue des Pins Verts, trente-trois mille cent quinze La Teste-de-Buch
trente-deux avenue de l'Eau Vive, trente-trois, cent vingt-sept, Martignas-sur-Jalle
dix allée de la Barbanne, trente-trois, cinq cents aux Billaux
Place Averous, trente-trois mille deux cent cinquante Pauillac
Avenue du Thil, trente-trois, cent soixante Saint-Médard-en-Jalles
Rue Barrailley, Lormont
Place Abel Surchamp à Libourne
quarante-trois rue de Monterey
Rue des Grives Cap Ferret au numéro deux
cent quatre-vingt-quinze chemin de Millet, trente-trois mille deux cent quarante Saint-André-de-Cubzac
huit rue Roxane, trente-trois, cent quatre-vingt-cinq, Le Haillan
un rue Bernard Pascaud, trente-trois, sept cent vingt à Budos
Avenue Pres J F Kennedy, trente-trois mille six cents Pessac
Allée du Champ de Foire, trente-trois, deux cent quarante Saint-André-de-Cubzac
Route de la Merceyre, Ordonnac
Lotissement l'Escaley à Saint-Loubès
quarante-deux rue Charles Monselet
Passage François-Ducom au numéro neuf B
vingt-cinq rue Jeanne de Lestonnac, trente-trois mille cinq cent soixante Carbon-Blanc
soixante-six rue Robert d'Ennery, trente-trois, zéro zéro zéro, Bordeaux
dix avenue de Dupouy, trente-trois, trois cent soixante à Cénac
Rue Philippe François, trente-trois mille cent soixante Saint-Médard-en-Jalles
Rampe Saint-Martin, trente-trois, quatre cent trente Bazas
Rue des Baccharis, Lanton
Allée Chante Claire à Gujan-Mestras
sept route de Graulet
Lotissement Domaine de Lorient au numéro dix-sept
vingt-quatre boulevard Kleber, trente-trois mille cinq cents Libourne
seize allée Emile Lanusse Cazaux, trente-trois, cent quinze, La Teste-de-Buch
six rue Georges Darmente, trente-trois, sept cent quatre-vingts à Soulac-sur-Mer
Place René Gérard, trente-trois mille quatre cent dix Cadillac
Rue Bigourdan, trente-trois, zéro zéro zéro Bordeaux
Rue Armand Dulamon, Bordeaux
Rue du Fils à Bordeaux
quatre avenue des Fauvettes Pyla
Rue de la Bonnette au numéro dix
trente-cinq route de Maron, trente-trois mille trois cent soixante-dix Fargues-Saint-Hilaire
cinq chemin de l'Escaley, trente-trois, six cent dix, Cestas
huit rue Henri de Châtelier, trente-trois, six cents à Pessac
Chemin de Mignoy, trente-trois mille huit cent cinquante Léognan
Allée de la Pillardiere, trente-trois, trois cent vingt Eysines
Rue Gemin, Preignac
Route de Barbannes à Saint-Germain-d'Esteuil
deux place Albert-Despujols
Chemin de Martillac au numéro cinquante-six
huit impasse Kleber, trente-trois mille cinq cents Libourne
deux allée Neil Armstrong, trente-trois, sept cents, Mérignac
cent cinquante impasse de Calonge, trente-trois, deux cent quarante à Saint-André-de-Cubzac
Allée des Cantines, trente-trois mille cent vingt-sept Saint-Jean-d'Illac
Allée du Moulin Neuf, trente-trois, quatre cent soixante-dix Gujan-Mestras
Rue des Arbousiers Cap Ferret, Lège-Cap-Ferret
Lotissement Les Graves à Izon
onze allée de Jeandey
Cité les Pins au numéro cinq
huit allée de la Chapelle Pilat, trente-trois mille cent quinze La Teste-de-Buch
treize rue Jean d'Ussel, trente-trois, deux cent soixante-dix, Floirac
trente-neuf allée de la Lande, trente-trois, six cent dix à Cestas
Rue de Montaudon, trente-trois mille cinq cents Libourne
Chemin de l'Ardillas, trente-trois, neuf cent vingt Saint-Yzan-de-Soudiac
Rue de Lisleferme, Bordeaux
Rue Abel au Bouscat
vingt-cinq chemin de Gardeloup
Route de Cubzac au numéro quatre-vingt-cinq
trois rue du Bayot, trente-trois mille cent quarante Cadaujac
quatre B impasse de la Fauvette, trente-trois, quatre cents, Talence
un chemin de la Peyguileyre, trente-trois, six cent cinquante à Saint-Médard-d'Eyrans
Rue André Calderon, trente-trois mille deux cent dix Langon
Chemin des Coudannes, trente-trois, deux cent quatre-vingt-dix Ludon-Médoc
Avenue des Mondaults, Floirac
Pouchon à Puybarban
sept rue Jacques Lemarchand
Rue Arlot de Saint-Saud au numéro treize
deux cent soixante chemin de Romefort, trente-trois mille deux cent quarante Saint-André-de-Cubzac
quatre-vingt-cinq passage du Pas de Monac, trente-trois, deux cent quarante, Saint-André-de-Cubzac
quatorze rue du Grand Soussans, trente-trois, quatre cent soixante à Soussans
Rue Gabriel Léglise, trente-trois mille Bordeaux
Impasse de Leyran, trente-trois, cent quarante Villenave-d'Ornon
Rue de Raboutet, Castelnau-de-Médoc
Chemin de lou Labat à Cestas
trente-cinq BIS avenue Neil Armstrong
Rue Jean Michelet au numéro un
cinq rue des Perlières, trente-trois mille quatre cent soixante-dix Le Teich
vingt rue Antoine Elies, trente-trois, cinq cent dix, Andernos-les-Bains
dix-huit rue Daniel Digneaux, trente-trois, neuf cent quatre-vingts à Audenge
Rue de Fontanieu, trente-trois mille deux cent quatre-vingt-dix Parempuyre
Lotissement Résidence Morisson deux, trente-trois, six cent cinquante Saucats
Impasse Le Breton, Le Verdon-sur-Mer
Route du Mourguet à Toulenne
cinq allée de Perliguey
Avenue du Malbec au numéro vingt-sept
soixante-sept avenue du Boucher Franc l'Herbe, trente-trois mille neuf cent cinquante Lège-Cap-Ferret
trente-sept rue Deveaux, trente-trois, zéro zéro zéro, Bordeaux
deux B allée des Graves, trente-trois, deux cent quatre-vingt-dix à Parempuyre
Rue Duprat, trente-trois mille cent quatre-vingt-dix La Réole
Chemin du Bruilleau, trente-trois, six cent cinquante Saint-Médard-d'Eyrans
Allée des Renardières, Saint-Aubin-de-Médoc
Rue Saint-Elme à Arcachon
dix-sept avenue Louis Giresse
Chemin de Feytit au numéro douze
cent cinquante et un avenue de la Duragne, trente-trois mille huit cent cinquante Léognan
sept rue Jean Michel, trente-trois, six cent quatre-vingts, Lacanau
un rue Marcel Verdier, trente-trois, cent quatre-vingts à Saint-Estèphe
Rue de Venteille, trente-trois mille cent quatre-vingt-cinq Le Haillan
Route des Queyrons, trente-trois, trois cent quarante Ordonnac
Rue du Clauzet, Gaillan-en-Médoc
Rue du Pin de Veymouth à Léognan
neuf impasse du Berret
Résidence Le Lucandreau au numéro trente et un
vingt-huit chemin de Peyremartin, trente-trois mille cent soixante Saint-Médard-en-Jalles
vingt-neuf place Nungesser et Coli, trente-trois, sept cents, Mérignac
soixante et onze rue Maurian, trente-trois, sept cents à Mérignac
Route de Bilos, trente-trois mille sept cent soixante-dix Salles
Avenue Guy de Pierrefeu, trente-trois, cent vingt Arcachon
Route de Haux, Créon
Rue Maurice François à Saint-Médard-en-Jalles
quatre rue de la Caze
Allée de la Gravette au numéro trois
cinquante-trois rue Haurat, trente-trois mille quatre cent soixante-dix Gujan-Mestras
trente et un rue de Janeau, trente-trois, zéro zéro zéro, Bordeaux
trente-huit chemin des Rouges Gorges, trente-trois, deux cent quatre-vingt-dix au Pian-Médoc
Chemin du Péséou, trente-trois mille quatre cent soixante Cantenac
Chemin Emile Lalande, trente-trois, cent quarante Villenave-d'Ornon
Impasse Georges Rigal, La Teste-de-Buch
Avenue François Mauriac à Louchats
sept rue du Bois Gentil
Rue Émile Gentil au numéro quarante-quatre
huit avenue des Bécasses Pyla, trente-trois mille cent quinze La Teste-de-Buch
dix avenue Johannes Brahms, trente-trois, cinq cent dix, Andernos-les-Bains
vingt-cinq chemin de la Péguilleyre, trente-trois, cent quinze à La Teste-de-Buch
Allée de Comprian, trente-trois mille trois cent quatre-vingts Biganos
Rue François Constant, trente-trois, cinq cents Libourne
Route de Carignan, Latresne
Lotissement Clos de Toignan un à Saint-Loubès
neuf résidence du Vieux Port
Chemin de Blanquette au numéro trente et un
cinquante-deux rue Louis-Denis Mallet, trente-trois mille cent trente Bègles
trente-quatre rue de la Préservation, trente-trois, zéro zéro zéro, Bordeaux
seize chemin de Cazallis, trente-trois, trois cent soixante à Lignan-de-Bordeaux
Avenue de Marens Canon, trente-trois mille neuf cent cinquante Lège-Cap-Ferret
Rue Serge Noailles, trente-trois, cent soixante Saint-Médard-en-Jalles
Avenue de la Palombière, Lège-Cap-Ferret
Allée Franz Liszt à Villenave-d'Ornon
vingt-neuf rue Moulinié
