quatre-vingts impasse du Pontet-Ouest, trente-trois, deux cent quatre-vingt-dix, Le Pian-Médoc
vingt chemin de Curtaut, trente-trois, six cent cinquante à La Brède
Lotissement La Lisiere, trente-trois mille cent douze Saint-Laurent-Médoc
Lotissement Clos des Acacias, trente-trois, sept cent vingt Landiras
Rue La Tour Gueyraud, Sainte-Eulalie
Cite Fief de Bouinot à Braud-et-Saint-Louis
deux chemin de Peybotte
Chemin des Prés de Badet au numéro un BIS
cinq BIS allée des Pinasseyres, trente-trois mille cent quinze La Teste-de-Buch
seize allée François de Rabelais, trente-trois, cent quinze, La Teste-de-Buch
neuf rue Vital Mareille, trente-trois, zéro zéro zéro à Bordeaux
Impasse de l'Arrépit, trente-trois mille six cent dix Cestas
Résidence des Espiets Est, trente-trois, huit cent trente Lugos
Chemin de Gargamelle, Ligueux
Rue Eugène Louis à Cenon
vingt et un avenue de Villemejan
Résidence le Mayne au numéro quatre
cent vingt-trois rue Capeyron, trente-trois mille Bordeaux
vingt-sept rue Maubourguet, trente-trois, zéro zéro zéro, Bordeaux
quatorze rue de Bonnefont, trente-trois, deux cent quarante à Cubzac-les-Ponts
L Ariey, trente-trois mille six cent cinquante Saucats
Impasse Marie-Jeanne, trente-trois, zéro zéro zéro Bordeaux
Quai de la Souys, Bordeaux
Route de Lacoste à Mouliets-et-Villemartin
cinq rue du Professeur Delmas Marsalet
Rue Pont Long au numéro quatorze
six clos Saint-Pierre, trente-trois mille cent trente Bègles
huit rue René Desfontaines, trente-trois, cent soixante, Saint-Médard-en-Jalles
deux BIS les Landes, trente-trois, deux cent trente à Coutras
Rue Soubiras, trente-trois mille Bordeaux
Rue de la Forêt des Boïens, trente-trois, trois cent quatre-vingts Biganos
Chemin du Lyze, Biganos
Résidence Les Tourterelles à Captieux
seize allée du Turc
Rue Aurélie Ducros au numéro dix-huit
quinze route de la Rtd Port du Nouguey, trente-trois mille cinq cents Arveyres
vingt-huit chemin de lou Mares, trente-trois, six cent dix, Cestas
sept impasse Conti, trente-trois, zéro zéro zéro à Bordeaux
Rue Baudry-Lacantinerie, trente-trois mille Bordeaux
Chemin du Grand Babeau, trente-trois, sept cent soixante Targon
Allée de la Gaubertie, Gradignan
Allée des Pignes à Cestas
sept avenue de Mendivil
Chemin Bâtie au numéro deux
trois TER chemin de la Fraichere, trente-trois mille quatre cent soixante Macau
quatre allée de l'Estivette, trente-trois, six cent cinquante, La Brède
sept impasse Birouette, trente-trois, zéro zéro zéro à Bordeaux
Impasse de Bazeilles, trente-trois mille quatre cent soixante-dix Gujan-Mestras
Route d'Angeline, trente-trois, quatre cent cinquante Montussan
Rue Christian Franceries, Bruges
Chemin de Gineste à Canéjan
dix-sept impasse du Croissant
Allée des Nauves au numéro quatre
huit avenue Pasteur Pyla, trente-trois mille cent quinze La Teste-de-Buch
quinze cité de Magenta, trente-trois, zéro zéro zéro, Bordeaux
trente-cinq A rue du Colonel Robert Picqué, trente-trois, trois cent quatre-vingts à Marcheprime
Chemin de la Gamarde, trente-trois mille cent quarante Villenave-d'Ornon
Chemin de la Tourte, trente-trois, six cent dix Cestas
Rue des Cigales Cap Ferret, Lège-Cap-Ferret
Lotissement le Moine Blanc à Izon
un allée Jean Benais
Rue de Bertinat au numéro deux
sept rue du Puits Descujols, trente-trois mille Bordeaux
quatorze allée du Comte, trente-trois, quatre cent soixante, Arsac
neuf rue Falcon, trente-trois, sept cents à Mérignac
Route François Mauriac, trente-trois mille cinq cent cinquante Tabanac
Rue Poudensan, trente-trois, zéro zéro zéro Bordeaux
Allée de l'Anglais, Sallebœuf
Chemin de la Hondeyre à Izon
huit rue Groupe Scolaire A Vallaeys
Chemin des Résiniers au numéro onze
un chemin des Bûcherons, trente-trois mille huit cent cinquante Léognan
trente-sept avenue Félix Cailleau, trente-trois, cinq cent trente, Bassens
quarante-cinq boulevard George cinq, trente-trois, zéro zéro zéro à Bordeaux
Lotissement Le Clos de Leysotte, trente-trois mille quatre cents Talence
Rue Roquefiguey, trente-trois, huit cent quatre-vingt-dix Gensac
Rue Corneillan, Cantenac
Route de Brun à Latresne
dix place Georges Chaigne
Route de Saint-Michel-de-Rieufret au numéro douze
trois impasse de la Maison Haute, trente-trois mille trois cent vingt Eysines
dix-neuf rue Duvergier, trente-trois, zéro zéro zéro, Bordeaux
quatre-vingts lotissement Les Pelouses d'Ascot, trente-trois, deux cent soixante-dix à Bouliac
Rue Géraud Dupuy, trente-trois mille quatre cent trente Bazas
Rue Lanet, trente-trois, cent dix Le Bouscat
Allée Beverley, Eysines
Lotissement l'Enclos de la Gardette à Carbon-Blanc
treize chemin du Lauga
Allée de la Botte au numéro neuf A
trois place du Cabernet, trente-trois mille six cent dix Canéjan
dix lotissement Le Pre du Centre, trente-trois, sept cent quarante, Arès
trois cité Les Rouleaux, trente-trois, huit cent vingt à Saint-Ciers-sur-Gironde
Rue du Domaine Joffre, trente-trois mille quatre cent quatre-vingt-dix Verdelais
Chemin de Marge, trente-trois, cent trente-trois Galgon
Impasse Lalande, Coutras
Allée Lespurgères à Gujan-Mestras
quarante-cinq avenue des Trois Lieues
Rue d'Artigues Barbant au numéro trois
vingt rue Pompière, trente-trois mille cent dix Le Bouscat
quatre rue Capitaine-Montauban, trente-trois, zéro zéro zéro, Bordeaux
un BIS chemin des Pérails, trente-trois, neuf cent dix à Saint-Denis-de-Pile
Chemin du Bourdieu, trente-trois mille sept cent dix Bayon-sur-Gironde
Allée Isabelle, trente-trois, cent trente-huit Lanton
Lotissement du Ferron, Le Porge
Cité Peyronneaud à Bordeaux
treize avenue de Lesparre
Rue Esmangard au numéro treize
deux lotissement Serigeau Ii, trente-trois mille quatre cent vingt Espiet
trois place Deutch de la Meurthe, trente-trois, cent soixante-dix, Gradignan
quarante et un BIS route d'Ignac, trente-trois, neuf cent cinquante à Lège-Cap-Ferret
Impasse Lafargue, trente-trois mille Bordeaux
Rue Gouais-Lanos, trente-trois, zéro zéro zéro Bordeaux
Route du Juran, Gaillan-en-Médoc
Chemin du Breton à Lanton
un BIS allée de Curé
Rue Jean Milhade au numéro neuf
douze chemin du Mahourà, trente-trois mille quatre cent soixante Macau
trois chemin de l'Arroudet, trente-trois, six cent dix, Cestas
dix-sept allée du Pont de Titoune, trente-trois, cent trente-huit à Lanton
Rue Des Anciennes Tuilières, trente-trois mille sept cent vingt Podensac
Rue Capitaine Madon, trente-trois, zéro zéro zéro Bordeaux
Place Kleinostheim, Bassens
Avenue de Pineau à Lège-Cap-Ferret
onze rue Baurein
Avenue de l'Anse au numéro neuf
trente et un chemin de Lavignac, trente-trois mille quatre cent cinquante Saint-Loubès
deux cent six avenue de l'Argonne, trente-trois, sept cents, Mérignac
trente-trois chemin de Pelet, trente-trois, quatre cent quarante à Ambarès-et-Lagrave
Rue Daubos, trente-trois mille deux cent cinquante Pauillac
Place Bardineau, trente-trois, zéro zéro zéro Bordeaux
Avenue Saint-Paulin, Bègles
Jean-Gros à Bieujac
huit place du Maréchal Juin
Rue Jean Forton au numéro trente-huit
six passage de Richet, trente-trois mille quatre cent soixante Soussans
huit rue Léo Ferre, trente-trois, six cents, Pessac
quatorze rue Beck, trente-trois, zéro zéro zéro à Bordeaux
Impasse de Biail, trente-trois mille trois cent quarante Gaillan-en-Médoc
Place Charles Gruet, trente-trois, zéro zéro zéro Bordeaux
Rue Ravaux, Arcachon
Rue Alexis Millardet à Saint-André-de-Cubzac
quarante-neuf cité Dunoyer
Lotissement Le Domaine du Moulin au numéro vingt-quatre
deux cent quatre-vingt-cinq chemin Moulin du Daugagnan, trente-trois mille cinq cent quatre-vingt-dix Grayan-et-l'Hôpital
vingt-trois route Henri Mamour, trente-trois, trois cent quarante, Civrac-en-Médoc
cent quarante-trois rue Fernand Audeguil, trente-trois, zéro zéro zéro à Bordeaux
Rue du Barail, trente-trois mille neuf cent cinquante Lège-Cap-Ferret
Rue Pierre et Ernest Michaux, trente-trois, six cent soixante-dix Créon
Route de Jau, Saint-Vivien-de-Médoc
Rue de Fontviel à Samonac
cinquante et un rue d'Arcachon
Rue Berquin au numéro vingt-cinq
vingt-neuf chemin de Lapey, trente-trois mille trois cent vingt Le Taillan-Médoc
dix rue du Château Raoul, trente-trois, trois cent dix, Lormont
cinq lotissement Bois des Coudannes, trente-trois, sept cent vingt à Podensac
Allée de Lapouyade, trente-trois mille deux cent quarante Saint-André-de-Cubzac
Rue Pomme-d'Or, trente-trois, zéro zéro zéro Bordeaux
Impasse de la Gemme, Lugos
Avenue de Joinville-Le-Pont à Vendays-Montalivet
quinze allée Camille Saint-Saens Pyla
Route de Bidaou Benon au numéro sept TER
cinquante-quatre allée de Planquehaute, trente-trois mille six cent quatre-vingts Lacanau
sept place Sacile, trente-trois, cent quatre-vingt-dix, La Réole
six B allée de Terrefort, trente-trois, cent soixante-dix à Gradignan
Rue Boucle de la Gare, trente-trois mille sept cent dix Comps
Rue de Grassi, trente-trois, zéro zéro zéro Bordeaux
Rue de la Gabarreyre, Blanquefort
Passage du Bourdieu à Mouliets-et-Villemartin
cinq cent onze rue Ham Foret de Marensin
Chemin Napoleon au numéro vingt et un
vingt-deux chemin d'Hestigeac, trente-trois mille sept cents Mérignac
treize allée de Cotoyard, trente-trois, trois cent vingt, Le Taillan-Médoc
dix-huit allée Pichelebre, trente-trois, cent soixante à Saint-Médard-en-Jalles
Route d'Hargon, trente-trois mille trois cent quatre-vingts Mios
Camarsac, trente-trois, cent quarante et un Villegouge
Avenue Sud du Phare, Lège-Cap-Ferret
Route de la Tuillière à Fargues-Saint-Hilaire
trente-trois rue Lafiteau
Rue Alfred Smith au numéro trente-sept
cinq beau Pré, trente-trois mille six cent cinquante Saucats
douze impasse Dupuch, trente-trois, cent trente, Bègles
vingt-trois hameau de l'Eyrette, trente-trois, six cent quatre-vingts à Lacanau
Rue Lassime, trente-trois mille cent quatre-vingt-dix Gironde-sur-Dropt
Allée du Bec, trente-trois, quatre cent soixante-dix Gujan-Mestras
Les Jardins San Michele, Mérignac
Avenue Nelly Deganne à Arcachon
deux BIS rue Réné Pezat
Avenue Raymond Manaud au numéro seize
treize rue de la Clairière de Pagneau, trente-trois mille sept cents Mérignac
trois A impasse Bizeaudun, trente-trois, deux cent quatre-vingt-dix, Ludon-Médoc
six BIS route du Pont de Martin, trente-trois, sept cent soixante-dix à Salles
Allée des Galips, trente-trois mille six cent quatre-vingts Saumos
Allée de Pitouret, trente-trois, trois cent soixante-dix Tresses
Allée du Clos de Cantaranne, Gujan-Mestras
Le Son à Saucats
neuf rue Maurice Moussillac
Avenue Jean Mermoz Pyla au numéro vingt-cinq
sept rue Crampel, trente-trois mille Bordeaux
cinq rue Guy Levy, trente-trois, sept cents, Mérignac
vingt-cinq chemin de Ridet, trente-trois, cinq cents à Libourne
Rue Nodoy, trente-trois mille sept cent vingt Virelade
Rue des Bahutiers, trente-trois, zéro zéro zéro Bordeaux
Avenue Jean Fragonard, Mérignac
Avenue de Saint-Pardon à Izon
dix-huit rue Fourcand
Rue du Rouge au numéro deux
six avenue des Aiguilles Vertes, trente-trois mille cent trente-huit Lanton
vingt route de Laujac, trente-trois, trois cent quarante, Bégadan
quinze allée Jean Armand Daney, trente-trois, cent quinze à La Teste-de-Buch
Allée des Grépins, trente-trois mille six cent dix Cestas
Rue du Pas du Bois, trente-trois, cent vingt-sept Saint-Jean-d'Illac
Lotissement Les Vignes de Bisqueytan, Saint-Quentin-de-Baron
Allée des Pignots à Saint-Aubin-de-Médoc
seize rue Louis-Jacques Guichard
Chemin de Malores au numéro treize
cinq chemin de la Matrasse, trente-trois mille six cent dix Cestas
vingt-quatre rue Le Notre, trente-trois, trois cent vingt, Eysines
six rue Canet, trente-trois, quatre cent trente à Bazas
Rue Ham Foret d'Irati, trente-trois mille cinq cent vingt Bruges
Allée Boréale, trente-trois, sept cents Mérignac
Route de Capdet, Listrac-Médoc
Allée des Bérines à Léognan
cent quarante-neuf allée d'Eck
Chemin de Grollet au numéro vingt-trois
six route de David Sud, trente-trois mille cent quarante et un Villegouge
trois quartier le Lapin, trente-trois, deux cent dix, Preignac
neuf rue Mellis, trente-trois, zéro zéro zéro à Bordeaux
Lotissement des Noisetiers, trente-trois mille quatre cent quatre-vingt-dix Saint-Pierre-d'Aurillac
Avenue des Gourreges, trente-trois, trois cent soixante-dix Yvrac
Route du Reche, Noaillan
Passage Cadier à Saint-Médard-en-Jalles
trente-neuf avenue Demeulin
Lotissement Parc du Déhès au numéro treize
quatre avenue Marly, trente-trois mille quatre cents Talence
vingt-quatre avenue des Chalands, trente-trois, neuf cent cinquante, Lège-Cap-Ferret
onze rue Rabie, trente-trois, deux cent cinquante à Pauillac
Avenue Alexandre Jaubert, trente-trois mille six cents Pessac
Route du Moulin de Garosse, trente-trois, quatre cent cinquante Saint-Sulpice-et-Cameyrac
Chemin de Joli-Bois, Tresses
Rue Surson à Bordeaux
huit cité Lavoisier
Rue Émile Lalanne au numéro quarante-trois
quatorze BIS chemin de Calvin, trente-trois mille sept cent soixante-dix Salles
trente-trois chemin de Cabiraud, trente-trois, sept cent dix, Prignac-et-Marcamps
vingt-quatre avenue Haussmann, trente-trois, trois cent quatre-vingt-dix à Blaye
Domaine du Ruste, trente-trois mille trois cent trente Saint-Émilion
Chemin de Terrey, trente-trois, cinq cent cinquante Lestiac-sur-Garonne
Impasse de la Dune de Peillin, Mios
Résidence les Martins à Saint-Seurin-de-Cursac
quinze avenue du Colonel Saldou
Chemin Gracet au numéro vingt-sept
vingt-six rue Jean-Jacques Rabaud, trente-trois mille Bordeaux
quatorze rue Brachet, trente-trois, zéro zéro zéro, Bordeaux
deux allée Chanteclerc, trente-trois, neuf cent cinquante à Lège-Cap-Ferret
Avenue Denis Papin, trente-trois mille cent soixante Saint-Médard-en-Jalles
Impasse Henry Yvonnet, trente-trois, cent dix Le Bouscat
Lotissement Le Hameau de la Garenne, Créon
Route de la Plage Lanton à Lanton
quatorze rue Marius Olivier
Rue Louis Mondaut au numéro quatre
huit allée Roger Touton, trente-trois mille cent vingt Arcachon
cinq boulevard Lahens, trente-trois, cent vingt-trois, Le Verdon-sur-Mer
vingt-deux route des Cotes de Bourg, trente-trois, sept cent dix à Bayon-sur-Gironde
Chemin Feyteau, trente-trois mille six cent cinquante La Brède
Rue Champs du Bourg, trente-trois, cent vingt-quatre Auros
Avenue de la Mouline, Cénac
Rue des Sarcelles Cap Ferret à Lège-Cap-Ferret
trois rue Michel Eyquem de Montaigne
Chemin dou Grit au numéro dix-sept
six rue Bellonte, trente-trois mille cent soixante Saint-Médard-en-Jalles
six avenue Luminais, trente-trois, cent trente-huit, Lanton
onze avenue Grillon, trente-trois, deux cent dix à Preignac
Rue Arsène Lauba, trente-trois mille cent soixante Saint-Médard-en-Jalles
Allée Rose Mousse, trente-trois, cent vingt Arcachon
Rue Président René Coty, Bordeaux
Rue du Cot au Haillan
quatre place des Cabaillouns
Rue de Sainte-Luce au numéro deux
deux avenue des Chasseurs, trente-trois mille neuf cent cinquante Lège-Cap-Ferret
onze impasse des Fétuques, trente-trois, cent vingt-trois, Le Verdon-sur-Mer
sept rue Amand Dumeau, trente-trois, deux cent dix à Langon
Route des Valentons, trente-trois mille quatre cent cinquante Saint-Loubès
Rue Louis Liard, trente-trois, zéro zéro zéro Bordeaux
Rue de Jonques, Salles
Passage du Taffard à Soulac-sur-Mer
vingt-sept avenue du Bois du Chevreuil
Rue du Pin Vert au numéro quatre
quatre avenue de la Galaxie, trente-trois mille cent vingt Arcachon
dix-sept BIS route du Port de la Bastide, trente-trois, quatre cent soixante, Labarde
quatre-vingt-six rue des Vivants, trente-trois, zéro zéro zéro à Bordeaux
Rue Alfred Dalancourt, trente-trois mille Bordeaux
Rue Gabriel Pierne, trente-trois, cent quarante Villenave-d'Ornon
Lotissement Hameau du Collège, Tresses
Lotissement Clos de Belleroque à Bourg
deux cent trente-cinq chemin de Seignan
Chemin de Picot au numéro dix
vingt-cinq impasse Berthus, trente-trois mille Bordeaux
dix-sept A rue du Brouquet, trente-trois, sept cent vingt, Podensac
huit allée du Bois de Jeanton, trente-trois, six cent quatre-vingts à Lacanau
Rue Desse, trente-trois mille Bordeaux
Rue du Puits des Amours, trente-trois, deux cent vingt Sainte-Foy-la-Grande
Rue Alphonse Dupeux, Bordeaux
Rue Yvonne Reinhart à Pessac
sept chemin de Citon
Chemin du Tronc au numéro quatre
onze rue de l'Estey, trente-trois mille trois cent vingt Eysines
quatre rue François Goubet, trente-trois, cinq cent dix, Andernos-les-Bains
cinquante-cinq chemin de Carré, trente-trois, cinq cents à Libourne
Chemin de Bertrandille, trente-trois mille huit cent cinquante Léognan
Allée du Violon, trente-trois, trois cent soixante-dix Bonnetan
Rue Jean Brouillon, Le Bouscat
Chemin de la Rouye à Camblanes-et-Meynac
quatre avenue Mademoiselle de la Harpe
Route de Camarsac au numéro dix
cinq chemin de Fachat, trente-trois mille sept cent soixante-dix Salles
quatre allée de Carabin, trente-trois, quatre cent soixante, Arsac
dix-huit BIS route du Dropt, trente-trois, cent quatre-vingt-dix à Bagas
Avenue de la Presqu'Île, trente-trois mille neuf cent cinquante Lège-Cap-Ferret
Rue Delord, trente-trois, zéro zéro zéro Bordeaux
Avenue Louis Robert, Lanton
Chemin Guérin à Fargues-Saint-Hilaire
six rue Descombes
Rue Mestre au numéro quatre-vingt-quatorze
dix-sept chemin de Calonne, trente-trois mille trois cent soixante Carignan-de-Bordeaux
quarante-sept rue de Bourdillat, trente-trois, cent soixante-dix, Gradignan
six rue Étienne Duperat, trente-trois, zéro zéro zéro à Bordeaux
Rue du Coum, trente-trois mille cent quinze La Teste-de-Buch
Lotissement La Maisonneraie du Clauzet, trente-trois, cent quarante Cadaujac
Rue des Parqueurs, Audenge
Allée des Pins Francs à Cudos
onze rue du Port Leyron
Rue Jean Roger d'Anglade au numéro onze
quatorze lotissement Le Pontet, trente-trois mille deux cent quatre-vingt-dix Le Pian-Médoc
vingt-deux rue Jean Raymond Guyon, trente-trois, cinq cent soixante, Carbon-Blanc
six rue Lagrave, trente-trois, sept cent vingt à Virelade
Chemin Saint-Médard, trente-trois mille six cent dix Cestas
Chemin de Piqueau, trente-trois, cinq cent quatre-vingt-dix Grayan-et-l'Hôpital
Rue Édouard Dupuy, Saint-Estèphe
Rue Contrescarpe à Bordeaux
six chemin de la Patte
Rue de Montuset au numéro cinquante-trois
six rue de la Rousselle, trente-trois mille Bordeaux
seize rue du cinq cent trois Eme Régiment du Train, trente-trois, cent vingt-sept, Martignas-sur-Jalle
dix rue Jean de la Ville de Mirmont, trente-trois, trois cent dix à Lormont
Rue Métivier, trente-trois mille Bordeaux
Rue du Gazot, trente-trois, deux cent trente Guîtres
Avenue de Toquetoucau, Cestas
Route de Guilhem Arnaud à Faleyras
dix-huit allée des Ardilleys
Lotissement Le Val de Petit Palais au numéro vingt-trois
dix-huit rue Sante Garibaldi, trente-trois mille Bordeaux
quatorze rue du Brugnon, trente-trois, cinq cent soixante, Carbon-Blanc
vingt-deux allée du Domaine des Lugées, trente-trois, sept cent quarante à Arès
Rue du Docteur Faure, trente-trois mille cent soixante Saint-Médard-en-Jalles
Rue de Chavailles, trente-trois, cent quatre-vingt-cinq Le Haillan
Impasse Hustin, Bordeaux
Rue Saint-Genès à Castelnau-de-Médoc
deux impasse Barreyre
Rue de Guirauton au numéro vingt-cinq
quatre allée Daniel Brettes, trente-trois mille trois cent quatre-vingts Marcheprime
douze rue Paguemaou, trente-trois, cent quarante, Villenave-d'Ornon
neuf avenue George six, trente-trois, cent vingt à Arcachon
Rue du Grand Veneur, trente-trois mille trois cent soixante-dix Artigues-près-Bordeaux
Chemin de Carros, trente-trois, six cent cinquante Saint-Selve
Route de Cadillac, Langoiran
Rue Pierre Salin à Bègles
deux chemin de la Bienfaisance
Avenue Saint-Antoine de Padoue au numéro huit
neuf rue Hameau de la Fleur, trente-trois mille sept cents Mérignac
un allée André Chénier, trente-trois, deux cent quatre-vingt-dix, Parempuyre
neuf rue Vital Lauba, trente-trois, cent soixante à Saint-Médard-en-Jalles
Rue de la Migrèque, trente-trois mille cent quinze La Teste-de-Buch
Avenue du Coteau, trente-trois, deux cent soixante-dix Bouliac
Rue du Hameau des Chênes, Mérignac
Cité Dugay à Bordeaux
cinquante-cinq rue de Touleyre
Avenue Louis Garros au numéro vingt-neuf
onze avenue Pierre Ceresole, trente-trois mille six cents Pessac
soixante et onze chemin de l'Esventat, trente-trois, quatre cent cinquante, Saint-Loubès
quatre allée François-Armand de Saige, trente-trois, cent quarante à Cadaujac
Rue du Docteur Bos, trente-trois mille trois cent quarante Lesparre-Médoc
Rue Salazard, trente-trois, cinq cent soixante Carbon-Blanc
Passage des Primevères, Pauillac
Rue Basque à Bordeaux
dix-sept lotissement L'Enclos de l'Église
Rue Maxime Lehmann au numéro vingt et un
trois chemin de Labatut, trente-trois mille cent quarante et un Villegouge
deux bourdales, trente-trois, deux cent dix, Mazères
cinquante BIS quai des Queyries, trente-trois, zéro zéro zéro à Bordeaux
Allée de Vampeule, trente-trois mille Bordeaux
Lotissement du Phénix, trente-trois, cinq cents Libourne
Route de la Chatole, Saint-Sauveur
Rue du Professeur Pierre-Cyprien Oré à Mérignac
sept rue François
Avenue de Montaut au numéro deux
sept lotissement Bérard, trente-trois mille deux cent quarante Cubzac-les-Ponts
vingt et un allée de la Craste, trente-trois, six cent dix, Cestas
dix-huit rue Camille Goillot, trente-trois, sept cents à Mérignac
Chemin de Mechives, trente-trois mille cent quarante Villenave-d'Ornon
Chemin de Fraye, trente-trois, huit cent trente Belin-Béliet
Rue du Puits de Paresse, Béguey
Rue Jean Lapeyre à Villandraut
dix-huit allée du Ruisseau des Fleurs
Rue de Carros au numéro vingt-neuf B
cinq chemin de Foncoulon, trente-trois mille quatre cent cinquante Montussan
dix-sept avenue Raymond Boivin, trente-trois, six cents, Pessac
onze impasse de Cazaux, trente-trois, quatre cent soixante-dix à Gujan-Mestras
Rue Recteur Thamin, trente-trois mille Bordeaux
Avenue des Cerfs, trente-trois, neuf cent cinquante Lège-Cap-Ferret
Rue d'Espessas, Aubie-et-Espessas
Rue de Peybouquey à Talence
huit rue Souvenir Français
Rue Jean Lavigne Cazaux au numéro treize C
quatre place Jean Descacq, trente-trois mille six cent quarante Portets
trente-deux chemin de Pouchau, trente-trois, six cent cinquante, Saucats
sept place du Fronton, trente-trois, quatre cent soixante à Macau
Rue Ysengrain, trente-trois mille huit cent cinquante Léognan
Cours Portal, trente-trois, zéro zéro zéro Bordeaux
Rue du Mimbeau, Lège-Cap-Ferret
Lotissement les Pavillons deux à Izon
vingt-trois promenade du Tour du Phare
Rue Largeteau au numéro vingt-trois
trente-neuf rue du Général Cremer, trente-trois mille cent trente Bègles
onze rue Lhôte, trente-trois, zéro zéro zéro, Bordeaux
trente-huit chemin du Tronqueyrà, trente-trois, six cent dix à Cestas
Route du Mayne, trente-trois mille sept cent soixante-dix Salles
Route des Brouilleaux, trente-trois, six cent cinquante Saint-Médard-d'Eyrans
Chemin des Cantaranes, Cestas
Chemin des Greseaux à Saint-Loubès
trente et un rue du Lt Edouard Turrel
Chemin de Patoche au numéro quarante
dix-neuf rue Ludovic Bourdieu, trente-trois mille cinq cent soixante Carbon-Blanc
deux cent dix route de Castor, trente-trois, sept cent soixante-dix, Salles
vingt-six allée des Pasteurines, trente-trois, zéro zéro zéro à Bordeaux
Rue de Laurenzanne, trente-trois mille cent soixante-dix Gradignan
Rue de Charlin, trente-trois, sept cents Mérignac
Rue Mirambeau, Saint-Vivien-de-Médoc
Allée Madame de Pompadour à Villenave-d'Ornon
un square de Veyrines
Rue des Treuils au numéro dix-sept
un avenue Georges Hébert, trente-trois mille six cent cinquante La Brède
cinq B allée des Duragnes, trente-trois, trois cent vingt, Le Taillan-Médoc
cinq cent soixante route de l'Eclop, trente-trois, trois cent quatre-vingt-dix à Eyrans
Chemin des Amours du Lugat, trente-trois mille quatre cent quatre-vingts Moulis-en-Médoc
Rue de l'Ormaie, trente-trois, trois cent dix Lormont
Boulevard du Firmament, La Teste-de-Buch
Rue Eugène Marcou à Lesparre-Médoc
dix rue René Roy de Clotte
Avenue Fernand Coin au numéro vingt-huit
cinquante rue Vincent Gonzales, trente-trois mille cent trente Bègles
soixante et onze lotissement Le Parc des Cèdres, trente-trois, trois cent soixante-dix, Fargues-Saint-Hilaire
deux lotissement Le Hameau de Dorly, trente-trois, cent quarante à Cadaujac
Rue Nicolas Beaujon, trente-trois mille Bordeaux
Rue Hugla, trente-trois, sept cents Mérignac
Rue des Hérons Cap Ferret, Lège-Cap-Ferret
Place du Docteur Fleming à Mérignac
deux place de Drouillet
Rue du Docteur Destouesse au numéro quatre
quatorze rue Raymond Valet, trente-trois mille deux cent quatre-vingt-dix Blanquefort
quatre cent vingt-neuf rue de Prémarchand, trente-trois, cent quarante, Cadaujac
douze place Bir-Hakeim, trente-trois, zéro zéro zéro à Bordeaux
Rue Ferrère, trente-trois mille Bordeaux
Rue de Sybirol, trente-trois, deux cent soixante-dix Floirac
Rue Saumenude, Bordeaux
Escales à Illats
vingt et un chemin de Pascot
Rue Raoul Douat au numéro deux
quarante-six rue Louis Bordier, trente-trois mille quatre cents Talence
soixante-dix rue André Bac, trente-trois, zéro zéro zéro, Bordeaux
trois lotissement Cottage de la Vigne, trente-trois, neuf cent cinquante à Lège-Cap-Ferret
Chemin du Reduit, trente-trois mille cinq cent vingt Bruges
Allée des Courrejolles, trente-trois, six cent quarante Castres-Gironde
Route de Panissas, Vensac
Impasse du Roux à Saint-Magne-de-Castillon
huit lotissement les Graves de Gayon
Les Six Chênes au numéro douze
dix-huit rue de Mirepin, trente-trois mille sept cents Mérignac
cinq allée Malbec, trente-trois, cinq cent vingt, Bruges
vingt-six chemin du Pas du Rey, trente-trois, six cent soixante-dix à Sadirac
