quatre chemin de Frescatis, quatre-vingt-deux, cent dix à Lauzerte
Chemin de Côte Ferrand, quatre-vingt-deux mille deux cent dix Castelmayran
Chemin des Carlas, quatre-vingt-deux, deux cent trente Monclar-de-Quercy
Côte du Pigeonnier, Monclar-de-Quercy
Chemin de Catalo à Reyniès
deux cent quatre-vingt-treize chemin Jacques Mansieu
Chemin de Fage au numéro soixante
douze rue d'Encoste, quatre-vingt-deux mille six cents Verdun-sur-Garonne
sept allées Jules Ferry, quatre-vingt-deux, cent, Castelsarrasin
dix-neuf route de Terrides, quatre-vingt-deux, cent à Labourgade
Place Léon Bourjade, quatre-vingt-deux mille Montauban
Chemin de la Terrassonne, quatre-vingt-deux, huit cents Nègrepelisse
Chemin de Dourre, Montpezat-de-Quercy
Impasse Cayssac à Mirabel
cinq cent soixante-cinq chemin de Côte Blanche
Impasse Maurice Frank Pannetier au numéro un
mille deux cent quatre-vingt-douze chemin de Barreyrous, quatre-vingt-deux mille quatre cent dix Saint-Étienne-de-Tulmont
cent soixante-cinq chemin des Prouchets, quatre-vingt-deux, huit cents, Nègrepelisse
cent quinze chemin de Villas, quatre-vingt-deux, quatre cent quarante à Cayrac
Camel, quatre-vingt-deux mille deux cents Moissac
Chemin de Barganelle, quatre-vingt-deux, deux cent dix Castelmayran
Lotissement du Camp Del Sartre, Septfonds
Chemin de Crabié à Campsas
cent quatre-vingt-neuf impasse Ratery
Chemin des Plauses au numéro cent soixante-dix
deux cent trois chemin de Gazous, quatre-vingt-deux mille trois cent cinquante Albias
treize pexaute, quatre-vingt-deux, trois cents, Saint-Cirq
dix rue Darré-Loc, quatre-vingt-deux, trois cent soixante-dix à Varennes
Chemin de Lissart, quatre-vingt-deux mille trois cents Caussade
Chemin des Pradals, quatre-vingt-deux, huit cents Nègrepelisse
Impasse de Lunel, Meauzac
Impasse du Sable à Moissac
six rue Parpaillou
Rue Pierre Delours au numéro cent soixante-quatre
quatorze impasse Peyrugues, quatre-vingt-deux mille quatre cent quarante Mirabel
quatre rue Raymond Duclos, quatre-vingt-deux, trois cents, Caussade
cent cinquante et un impasse de Carillon, quatre-vingt-deux, sept cents à Montech
Chemin de Fourtous, quatre-vingt-deux mille trois cent soixante-dix Villebrumier
Lotissement Les Fleurs, quatre-vingt-deux, zéro zéro zéro Montauban
Chemin de Bascau, Monteils
Chemin des Barènes à Bioule
vingt-cinq rue Marc Brunel
Impasse du Nouveau Marché au numéro un TER
deux cent quarante cap de Pech, quatre-vingt-deux mille deux cent trente La Salvetat-Belmontet
deux avenue du Fontanas, quatre-vingt-deux, cent soixante-dix, Grisolles
huit lotissement le Plateau des Gascous, quatre-vingt-deux, zéro zéro zéro à Montauban
Impasse de Calvet, quatre-vingt-deux mille deux cent quatre-vingt-dix La Ville-Dieu-du-Temple
Avenue du Docteur Adrien Constans, quatre-vingt-deux, cent quarante Saint-Antonin-Noble-Val
Chemin de la Tisarne, Campsas
Résidence Le Platane Bleu à Saint-Étienne-de-Tulmont
six rue Valès Labouère
Rue du Carrerou de l'Église au numéro un
mille huit cents route de Labastide du Temple, quatre-vingt-deux mille deux cent quatre-vingt-dix La Ville-Dieu-du-Temple
mille deux cent soixante-dix-sept chemin de Goyné, quatre-vingt-deux, cent, Castelsarrasin
mille cinq cent un sentier de Reboys, quatre-vingt-deux, trois cents à Monteils
Chemin de Lombardio, quatre-vingt-deux mille quatre cent quarante Réalville
Place Dupuy, quatre-vingt-deux, trois cent quarante Dunes
Impasse La Patissière, Montauban
Chemin de Penixe à Montauban
mille trois cents chemin de Pesquier
Rue au Ruisseau au numéro trois
quarante-huit impasse du Rodoul, quatre-vingt-deux mille trois cent soixante-dix Orgueil
quatre mille huit cent cinquante-deux chemin de Saint-Avit à Esmes, quatre-vingt-deux, deux cents, Moissac
cinq la Boulbene, quatre-vingt-deux, cent soixante-dix à Dieupentale
Chemin des Poulidets, quatre-vingt-deux mille Montauban
Chemin des Fauchets, quatre-vingt-deux, zéro zéro zéro Montauban
Route d'Aliguières, Septfonds
Chemin de Poutantan à Auvillar
neuf place du Timplé
Petite Rue Grand Selve au numéro deux
cent soixante-dix chemin de la Peyre Basse, quatre-vingt-deux mille cent trente Montastruc
deux cent quinze route Départementale quatre-vingt-seize, quatre-vingt-deux, quatre cents, Goudourville
deux cent vingt-trois chemin Rural vingt-six du Parrouquet, quatre-vingt-deux, sept cents à Saint-Porquier
Impasse du Biarnais, quatre-vingt-deux mille cent trente L'Honor-de-Cos
Rue Marcelle Davet, quatre-vingt-deux, zéro zéro zéro Montauban
Chemin de Tary, Mirabel
Rue Pouzargues à Saint-Nicolas-de-la-Grave
trois cent dix-sept chemin de l'Espagnette
Lotissement du Luché au numéro trois
cinq impasse Beller, quatre-vingt-deux mille deux cent quatre-vingt-dix La Ville-Dieu-du-Temple
quarante chemin de Dariac, quatre-vingt-deux, quatre cent dix, Saint-Étienne-de-Tulmont
deux lotissement Langlat, quatre-vingt-deux, cent à Labastide-du-Temple
Chemin Monie, quatre-vingt-deux mille Montauban
Route de Terre-Blanche, quatre-vingt-deux, cent Castelsarrasin
Rue Castel Fesandie, Nègrepelisse
Chemin des Miquelles à Albias
douze rue Pierre Rosa
Petit Tressols au numéro sept mille sept cent trente-huit
quatre cent quatorze chemin de Manaux, quatre-vingt-deux mille deux cent dix Castelmayran
sept cité la Caussade, quatre-vingt-deux, trois cent soixante-dix, Corbarieu
dix lotissement La Bourdette deux, quatre-vingt-deux, deux cent vingt à Molières
Impasse de Trixe, quatre-vingt-deux mille sept cent dix Bressols
Chemin de Saint-Avit, quatre-vingt-deux, deux cents Moissac
Chemin de Pautal, Orgueil
Chemin des Perrous à Vaïssac
deux impasse Prestat
Impasse du Rouch au numéro deux cent cinquante
un rue de Treilhou, quatre-vingt-deux mille trois cents Caussade
deux cent quatre-vingts chemin des Tuquettes, quatre-vingt-deux, cent trente, Lafrançaise
sept cent soixante-huit route de Boutoli, quatre-vingt-deux, sept cents à Montech
Chemin de Mouniès, quatre-vingt-deux mille deux cents Moissac
Chemin du Moulin Sainte-Livrade, quatre-vingt-deux, deux cents Moissac
Rue Mangegats, Verdun-sur-Garonne
Chemin de Basset à Corbarieu
un rue Saint-Théodard
Impasse Pinetes au numéro quatre-vingt-quinze
dix impasse Morris, quatre-vingt-deux mille Montauban
cent impasse de Jarvenpaa, quatre-vingt-deux, zéro zéro zéro, Montauban
deux cent cinquante chemin de Payé à Laujol, quatre-vingt-deux, deux cents à Moissac
Marcou, quatre-vingt-deux mille Montauban
Chemin de Mathio Haut, quatre-vingt-deux, trois cents Monteils
Chemin de Gratecap, Moissac
Chemin de Magnol à Cayrac
dix porte de Rodanèze
Lotissement le Clos des Chênes au numéro un
cinquante impasse des Caussades, quatre-vingt-deux mille Montauban
cent soixante et un chemin de la Rouaysse, quatre-vingt-deux, deux cent trente, Verlhac-Tescou
cinq cent vingt-cinq chemin de Jarlande, quatre-vingt-deux, cent trente à Lamothe-Capdeville
Chemin des Esclapats, quatre-vingt-deux mille cent Castelferrus
Rue Albert de Reyniès, quatre-vingt-deux, trois cent soixante-dix Reyniès
Carrelot de la Jordane, Valence
Chemin Bonnet à Boudou
cent cinq chemin de Lamothe Vieille
Avenue de Cadossang au numéro deux
cent un chemin de la Samonys, quatre-vingt-deux mille trois cent soixante-dix Reyniès
trois BIS rue Emile Audibert, quatre-vingt-deux, sept cents, Montech
deux cent quarante chemin de Séguels, quatre-vingt-deux, cent trente à Lafrançaise
Place Arnaud Sorbin, quatre-vingt-deux mille sept cents Montech
Chemin d'Aubarède, quatre-vingt-deux, cinq cents Beaumont-de-Lomagne
Chemin du Barbier, Montauban
Chemin de Cheminât à Corbarieu
quatre-vingt-huit chemin de Las Bordes
Chemin de Cayfasses au numéro deux cent soixante-neuf
trois cent dix-neuf chemin de Fontanie, quatre-vingt-deux mille cent Labastide-du-Temple
trente chemin de Pech de Cos, quatre-vingt-deux, cent trente, Lamothe-Capdeville
deux petite Rue du Château d'Eau, quatre-vingt-deux, deux cent quatre-vingt-dix à La Ville-Dieu-du-Temple
Place Gaston Benac, quatre-vingt-deux mille cent Castelsarrasin
Chemin de Rivairol, quatre-vingt-deux, zéro zéro zéro Montauban
Avenue Pierre Perret, Castelsarrasin
Impasse de Pech Laborie à Montech
un rue Des Murets
Carrelot de la Couturière au numéro un
neuf cent quatre-vingt-cinq chemin de Frezals, quatre-vingt-deux mille Montauban
six cent vingt-cinq route de Francour, quatre-vingt-deux, cent trente, Lafrançaise
quatre-vingt-dix-sept chemin de Pech à Crabier, quatre-vingt-deux, deux cent trente à Verlhac-Tescou
Chemin de Terriès, quatre-vingt-deux mille deux cent quarante Septfonds
Chemin du Roussillon, quatre-vingt-deux, trois cent soixante-dix Saint-Nauphary
Chemin de Tandol, Montbeton
Impasse de Laurensous à Castelmayran
quatre rue du Bois des Charmes
Chemin d'Alazard au numéro cent quatre-vingt-quatorze
deux cent quarante chemin des Bruguettes, quatre-vingt-deux mille cent Garganvillar
cent vingt-six chemin de Rigounel, quatre-vingt-deux, trois cent soixante-dix, Corbarieu
un rue de Martre, quatre-vingt-deux, cent dix à Lauzerte
Chemin de Lavandou, quatre-vingt-deux mille huit cents Bioule
Chemin de Réveillat, quatre-vingt-deux, cent Labastide-du-Temple
Chemin des Terres Forts, Castelsarrasin
Besplosses à La Salvetat-Belmontet
sept lotissement l'Enclos de Peligry
Lotissement Genibrette au numéro dix
quatorze tiquette, quatre-vingt-deux mille trois cent cinquante Albias
deux cent soixante et un chemin de Prat Barrat, quatre-vingt-deux, sept cents, Cordes-Tolosannes
un place des Oules, quatre-vingt-deux, cent quarante à Saint-Antonin-Noble-Val
Rue Boneta Rescosta, quatre-vingt-deux mille cent quarante Saint-Antonin-Noble-Val
Chemin de Saint-Macaire, quatre-vingt-deux, quatre cent dix Saint-Étienne-de-Tulmont
Impasse de Fontanie, Labastide-du-Temple
Rue de la Roumiguière à Molières
deux route de Castel
Chemin des Bourguets au numéro cinq cent quatre-vingt-quinze
deux cent dix chemin d'Espère, quatre-vingt-deux mille deux cent soixante-dix Montpezat-de-Quercy
trois cent trois impasse Saint-Coufan, quatre-vingt-deux, deux cent dix, Castelmayran
sept ruelle de la Bride, quatre-vingt-deux, cent quarante à Saint-Antonin-Noble-Val
Chemin de Cassole, quatre-vingt-deux mille quatre cent quarante Cayrac
Route de Pech Agut, quatre-vingt-deux, deux cent soixante-dix Montpezat-de-Quercy
Côte du Géolier, Moissac
Côte du Tap à Albefeuille-Lagarde
quatre port de Bonneau
Hameau de Petit au numéro quatre cent trente
neuf hameau du Canal, quatre-vingt-deux mille cent soixante-dix Dieupentale
quatre cent quarante-cinq chemin de Toumet, quatre-vingt-deux, trois cent soixante-dix, Corbarieu
quatre chemin Rural vingt-deux de Poujral, quatre-vingt-deux, sept cents à Saint-Porquier
Chemin de Cheneviers, quatre-vingt-deux mille cent Castelsarrasin
Avenue du Stade Gouges Boutal, quatre-vingt-deux, cent trente Lafrançaise
Chemin de l'Artel, Castelsarrasin
Chemin de Gaubil à Montauban
deux cent soixante-seize chemin de la Piboulette
Chemin de Lamole au numéro six cent dix-huit
deux cents chemin du Bac de Cos, quatre-vingt-deux mille trois cent cinquante Albias
cent cinquante-cinq la Côte de Toulouse, quatre-vingt-deux, deux cents, Moissac
mille cinq cent trente route des Rauffets, quatre-vingt-deux, huit cents à Vaïssac
Rue Béral, quatre-vingt-deux mille deux cent quarante Puylaroque
Chemin de La Clotte, quatre-vingt-deux, sept cents Escatalens
Route de Sainte-Rose, Malause
Rue de la Mouscane à Montech
sept rue Volgues
Rue de la Vaysse au numéro quatre-vingt-dix
mille quarante chemin des Foulis, quatre-vingt-deux mille huit cents Nègrepelisse
six cent trente-six route du Moulin de Lunel, quatre-vingt-deux, cent trente, Lafrançaise
six cent quarante et un chemin Escalier, quatre-vingt-deux, deux cents à Boudou
Las Condamines, quatre-vingt-deux mille trois cent trente Varen
Chemin de la Croix d'Astorg, quatre-vingt-deux, zéro zéro zéro Montauban
Place Midi Pyrénées, Lafrançaise
Route des Poussets à Vaïssac
cinquante-neuf rue Gouny
Route de la Cascade Pétrifiante au numéro soixante-dix-neuf
seize rue des Claustres, quatre-vingt-deux mille cent quarante Saint-Antonin-Noble-Val
quatre cent quarante chemin des Tempets-Revel, quatre-vingt-deux, huit cents, Vaïssac
un chemin de Marguestaud, quatre-vingt-deux, six cents à Aucamville
Route de Timbrune, quatre-vingt-deux mille quatre cents Espalais
Route Parallèle à la Route Nationale vingt, quatre-vingt-deux, quatre cent quarante Cayrac
Chemin de Bordevieille, Beaumont-de-Lomagne
Impasse de Bordeneuve à Saint-Étienne-de-Tulmont
deux cent vingt chemin Rural de Sirogne
Place de la Vilette au numéro un
cent cinquante-cinq bourg, quatre-vingt-deux mille quatre cents Gasques
un passage des Tanneries, quatre-vingt-deux, trois cents, Caussade
huit cent vingt route de Champ Grand, quatre-vingt-deux, deux cents à Moissac
Chemin du Platan, quatre-vingt-deux mille deux cent dix Saint-Nicolas-de-la-Grave
Chemin du Batan, quatre-vingt-deux, cent quarante Saint-Antonin-Noble-Val
Route de Sicard, Montech
Côte de Darde à Corbarieu
huit chemin de Figuéry
Impasse de Valladolid au numéro trois cents
onze résidence Galmes, quatre-vingt-deux mille quatre cent dix Saint-Étienne-de-Tulmont
trois cent vingt al Grouille, quatre-vingt-deux, zéro zéro zéro, Montauban
trois cent soixante-dix chemin d'Ambeyrac, quatre-vingt-deux, quatre cent quarante à Réalville
Route de Saux, quatre-vingt-deux mille deux cent soixante-dix Montpezat-de-Quercy
Rue du Goût d'Albret, quatre-vingt-deux, trois cent quarante Saint-Loup
Route Quercy Gascogne, Castelsarrasin
Chemin des Moutetes à Montech
deux cent vingt-trois impasse Côte Rouge
Rue Louis Allanche au numéro sept
deux rue Thomas Goular, quatre-vingt-deux mille deux cent dix Saint-Nicolas-de-la-Grave
mille trois cent quatre-vingt-dix-sept route des Viguiers, quatre-vingt-deux, deux cent trente, Monclar-de-Quercy
cinq côte des Bonnetiers, quatre-vingt-deux, zéro zéro zéro à Montauban
Chemin de Caillau, quatre-vingt-deux mille cent Castelsarrasin
Chemin de l'Enclave, quatre-vingt-deux, deux cent dix Castelmayran
Chemin des Saloberts, Castelsarrasin
Impasse Vigné à Boudou
six cent vingt chemin des Trouilles
Chemin de Fougasset au numéro dix
six impasse Hinel, quatre-vingt-deux mille quatre cent quarante Mirabel
quinze chemin de Lantourne, quatre-vingt-deux, deux cents, Moissac
un carrelot du Maréchal Ferrant, quatre-vingt-deux, trois cent quarante à Dunes
Rue Des Platanes, quatre-vingt-deux mille quatre cent quarante Mirabel
Impasse du Gouast, quatre-vingt-deux, cent trente Lamothe-Capdeville
Impasse Gayri, Verlhac-Tescou
Route départementale huit cent vingt à Campsas
deux cent quatre-vingt-un impasse de Marnhiou
Chemin de Lacontal au numéro six
quatre cents chemin de Capperouge, quatre-vingt-deux mille Montauban
six mille deux cent trente-quatre pelassous, quatre-vingt-deux, sept cents, Montech
quatre place de la Font, quatre-vingt-deux, cinq cents à Beaumont-de-Lomagne
Hameau de Lalande, quatre-vingt-deux mille quatre cents Goudourville
Impasse de Rivalet, quatre-vingt-deux, trois cent soixante-dix Corbarieu
Lotissement les Terrasses de Clavel, Moissac
Chemin de Tolio Bas à Mirabel
quatre-vingt-quinze chemin de Daries
Chemin de Pontet au numéro cent un
quatre cent soixante-quinze chemin de Senoulac, quatre-vingt-deux mille deux cent soixante-dix Montpezat-de-Quercy
cinq rue Négreporc, quatre-vingt-deux, cent quarante, Saint-Antonin-Noble-Val
deux cent trente-six chemin de Fourmix, quatre-vingt-deux, deux cents à Moissac
Chemin du Barthac, quatre-vingt-deux mille deux cents Moissac
Rue du Clos Maury, quatre-vingt-deux, zéro zéro zéro Montauban
Chemin de Dane, Golfech
Chemin des Aussières à Réalville
dix chemin de Paillole
Impasse de Cantarou au numéro cinq
treize rue du Roudou, quatre-vingt-deux mille six cents Verdun-sur-Garonne
sept rue Adrien Hebrard, quatre-vingt-deux, cent soixante-dix, Pompignan
deux cent trente-quatre chemin de Massal, quatre-vingt-deux, trois cents à Caussade
Impasse de Fayard, quatre-vingt-deux mille cent Castelsarrasin
Chemin des Merlanes, quatre-vingt-deux, deux cent quatre-vingt-dix La Ville-Dieu-du-Temple
Chemin de Gamots, Lafrançaise
Route de Bougnette à Boudou
deux cent soixante-quinze chemin des Entrepreneurs
Chemin des Bouyes au numéro quatre cent soixante-dix
huit lotissement Les Chenes Verts, quatre-vingt-deux mille Montauban
deux rue Banaste, quatre-vingt-deux, trois cents, Caussade
deux rue Jonqua, quatre-vingt-deux, trois cent quarante à Auvillar
Rue du Docteur Foissac, quatre-vingt-deux mille deux cents Moissac
Chemin de Lamothe à Cardone, quatre-vingt-deux, deux cent trente Verlhac-Tescou
Rue Jean Dargaties, Grisolles
Impasse Eole à Bessens
quatre rue de l'Éveillé
Route de Lafrançaise à Réalville au numéro sept cent soixante-six
cent cinquante route de Rouméguil, quatre-vingt-deux mille cent trente Lafrançaise
seize rue Roger Rignac, quatre-vingt-deux, deux cent trente, Monclar-de-Quercy
dix-sept chemin de Lender, quatre-vingt-deux, trois cents à Monteils
Chemin de Roujols, quatre-vingt-deux mille trois cent soixante-dix Corbarieu
Boulevard du Capitaine Jean Bergès, quatre-vingt-deux, sept cents Montech
Route d'Éspalais, Golfech
Traverse de Castel-Haut à Caussade
un chemin de la Côte du Milieu
Impasse de Lalbenque au numéro trois
cent soixante-deux chemin du Pas de Madame, quatre-vingt-deux mille deux cent quatre-vingt-dix Lacourt-Saint-Pierre
sept cent quatre-vingt-quinze route de Martis, quatre-vingt-deux, quatre cents, Goudourville
cinq cent trente-cinq chemin de Couleau, quatre-vingt-deux, cent trente à L'Honor-de-Cos
Chemin de Balat, quatre-vingt-deux mille Montauban
Départementale huit cent treize de Castelsarrasin, quatre-vingt-deux, sept cents Saint-Porquier
Avenue de la Gimone, Beaumont-de-Lomagne
Chemin de Lescure à Labastide-Saint-Pierre
quatre square Izoulet
Cité l'Auzelou au numéro huit
un chemin de Ducau, quatre-vingt-deux mille cent Castelsarrasin
mille sept cent vingt-quatre route Départementale quatorze de Beaumont, quatre-vingt-deux, sept cents, Saint-Porquier
deux cent quatre-vingt-quatorze impasse de Bosques de Griffoulet, quatre-vingt-deux, trois cents à Caussade
Quai de Villebourbon, quatre-vingt-deux mille Montauban
Chemin de Combeclairon, quatre-vingt-deux, deux cents Moissac
Chemin Marianne, Boudou
Route du Truffe à Montpezat-de-Quercy
cinquante et un chemin de Landette
Carrelot des Tonneliers au numéro un
soixante-douze impasse Braeburn, quatre-vingt-deux mille sept cent dix Bressols
sept impasse Louis Galinier, quatre-vingt-deux, deux cent trente, Monclar-de-Quercy
quatre mille neuf cent quatre-vingt-cinq hameau des Teularios, quatre-vingt-deux, huit cents à Vaïssac
Impasse des Cauty, quatre-vingt-deux mille sept cent dix Bressols
Caderie, quatre-vingt-deux, deux cent trente Monclar-de-Quercy
Chemin de la Lisse, Montricoux
Place de la Condamine à Saint-Antonin-Noble-Val
six rue du Timplé
Impasse du Docteur Dufaur au numéro cinq
dix rue du Pont des Vierges, quatre-vingt-deux mille cent quarante Saint-Antonin-Noble-Val
dix-huit rue Henri Courtois de Maleville, quatre-vingt-deux, trois cents, Caussade
cent vingt-cinq chemin des Coutisses, quatre-vingt-deux, huit cents à Vaïssac
Cité des Najats, quatre-vingt-deux mille six cents Verdun-sur-Garonne
Impasse Jupiter, quatre-vingt-deux, quatre cents Valence
Lotissement du Rond-Point, Saint-Aignan
Rue Marcabrun à Valence
six cent quatre-vingt-dix chemin de Bellechasse
Chemin de Viguerie au numéro deux cent vingt-cinq
dix-sept rue des Payssots, quatre-vingt-deux mille sept cents Finhan
cent deux impasse de la Guillotte, quatre-vingt-deux, trois cent soixante-dix, Campsas
cent soixante-six traverse de Biscans, quatre-vingt-deux, six cents à Verdun-sur-Garonne
Chemin de Poulbérens, quatre-vingt-deux mille trois cents Caussade
Chemin de Bois Vieux, quatre-vingt-deux, deux cent quatre-vingt-dix Montbeton
Lotissement Falip, Septfonds
Rue Pé de Gleyze à Valence
deux mille cinq cents chemin des Ouns
Chemin de Rau au numéro cent quatre-vingt-six
trois impasse de Caume, quatre-vingt-deux mille cent soixante Caylus
quatre cent trente chemin des Penardières, quatre-vingt-deux, quatre cent dix, Saint-Étienne-de-Tulmont
cinq lotissement Le Clos Champetre, quatre-vingt-deux, trois cents à Caussade
Côte de Coustalou, quatre-vingt-deux mille trois cent soixante-dix Reyniès
Place Pétronille Cantecor, quatre-vingt-deux, deux cent quarante Septfonds
Chemin du Couaillou, Monteils
Impasse de Palombes à Valence
sept chemin de la Sabathère
Côte Saint-Georges au numéro six mille cent vingt-neuf
trois cent trente-sept chemin des Mexots, quatre-vingt-deux mille huit cents Bioule
trois rue Albert Lacroix, quatre-vingt-deux, zéro zéro zéro, Montauban
cent quinze chemin de Durand, quatre-vingt-deux, zéro zéro zéro à Montauban
Chemin de Cot, quatre-vingt-deux mille cent cinquante Montaigu-de-Quercy
Impasse des Carrelots, quatre-vingt-deux, six cents Saint-Sardos
Route de Sabi, Montech
Impasse de Bragayrac à Saint-Aignan
mille cent soixante-sept chemin d'Al Pech
Impasse du Fil de l'Eau au numéro un
quatre passage de la Concorde, quatre-vingt-deux mille deux cents Moissac
soixante et un lotissement le Canteloube, quatre-vingt-deux, zéro zéro zéro, Montauban
cent quatre-vingt-dix-sept chemin de Boriès, quatre-vingt-deux, deux cent trente à Monclar-de-Quercy
Chemin de la Gimone, quatre-vingt-deux mille cent Lafitte
Rue du Puits Redon, quatre-vingt-deux, cinq cents Beaumont-de-Lomagne
Rue Aristide Bergés, Montauban
Sentier des Vignals à Monteils
cent trente-neuf chemin du Carreron Long
Rue du Portail Obscur au numéro six
cent soixante chemin de Frapaou, quatre-vingt-deux mille sept cent dix Bressols
cent quatre-vingt-huit impasse Prè Barré, quatre-vingt-deux, deux cents, Moissac
sept cent trente chemin des Tistets, quatre-vingt-deux, deux cent dix à Angeville
Rue Chaudronniers, quatre-vingt-deux mille cent soixante Caylus
Impasse Père Bas, quatre-vingt-deux, sept cents Montech
Chemin du Foutché, Saint-Sardos
Chemin de Millières à Septfonds
deux cent soixante-dix rue Jules Lombrail
Chemin de Saintou au numéro neuf
quatre côte des Charretiers, quatre-vingt-deux mille cent Castelsarrasin
quatre-vingt-dix-huit traverse du Truc, quatre-vingt-deux, trois cents, Caussade
cent quatre-vingts impasse du Cresson, quatre-vingt-deux, huit cents à Nègrepelisse
Route du six Juin mille neuf cent quarante-quatre, quatre-vingt-deux mille deux cent soixante-dix Montpezat-de-Quercy
Impasse Thibaudel, quatre-vingt-deux, zéro zéro zéro Montauban
Rue du Midi-Quercy, Saint-Étienne-de-Tulmont
Impasse Balavit à Nègrepelisse
un rue Jean Speckel
Chemin de la Nauge au numéro six cent trente
un place des Ainats, quatre-vingt-deux mille deux cent quatre-vingt-dix La Ville-Dieu-du-Temple
quatre-vingt-quatre sentier d'Alibaude, quatre-vingt-deux, trois cents, Monteils
cinq impasse Benoit Fourneyron, quatre-vingt-deux, zéro zéro zéro à Montauban
Impasse des Tountous, quatre-vingt-deux mille deux cent trente Monclar-de-Quercy
Chemin de La Rouge, quatre-vingt-deux, trois cent soixante-dix Labastide-Saint-Pierre
Rue des Sahutiers, Saint-Nicolas-de-la-Grave
Route du Sud à Montauban
cinq cent trente chemin de Puylauron
Chemin de Barade au numéro cent soixante-deux
deux cent vingt-trois chemin de Ville Vieille, quatre-vingt-deux mille cent trente Villemade
trois rue Traversière Bourbon, quatre-vingt-deux, six cents, Mas-Grenier
mille quatre cent trente-deux route des Mouets, quatre-vingt-deux, sept cents à Montech
Chemin des Proats Hauts, quatre-vingt-deux mille deux cent trente Léojac
Carrelot des Templiers, quatre-vingt-deux, trois cent quarante Dunes
Chemin de Débès, Dieupentale
Linasses à Monclar-de-Quercy
trois impasse Yvan Delbreil
Impasse de Laronne au numéro trois cent trente-six
un rue Carrelot de Clavet, quatre-vingt-deux mille trois cent quarante Auvillar
cent quatre-vingt-cinq chemin de Fray, quatre-vingt-deux, trois cent cinquante, Albias
quatre place Matabiau, quatre-vingt-deux, cent vingt à Lavit
Chemin de Malpartit, quatre-vingt-deux mille sept cents Escatalens
Chemin de Pech Del Barry, quatre-vingt-deux, trois cents Caussade
Chemin de la Pétassade, Nègrepelisse
Chemin de Messegues à Garganvillar
cent seize chemin de la Bélique
Chemin de Garabio au numéro quarante-huit
cent cinquante-six chemin de Cabanès, quatre-vingt-deux mille cent trente Lafrançaise
deux place Alfred Marty, quatre-vingt-deux, zéro zéro zéro, Montauban
quatre cent quarante-cinq voie Communale de la Mégère, quatre-vingt-deux, deux cents à Moissac
Chemin de Valades, quatre-vingt-deux mille cent trente L'Honor-de-Cos
Rue Louis Rouziés, quatre-vingt-deux, trois cent soixante-dix Labastide-Saint-Pierre
Impasse Henri de Saint-Julien, Montech
Route de Trabesses à Saint-Aignan
quatre rue Tour des Dareysses
Chemin de Poncets au numéro cent vingt-deux
soixante-dix-sept impasse Tournou, quatre-vingt-deux mille trois cent soixante-dix Saint-Nauphary
cent quatre-vingt-un chemin de Blanjou, quatre-vingt-deux, trois cents, Caussade
deux rue Basse du Terrier, quatre-vingt-deux, sept cents à Montech
Impasse Maurice Bayrou, quatre-vingt-deux mille Montauban
Impasse de Malpartit, quatre-vingt-deux, deux cent quatre-vingt-dix La Ville-Dieu-du-Temple
Rue de l'Hirondellat, Nègrepelisse
Rue Cul Roussol à Moissac
deux cent cinquante-neuf impasse des Baysses
Résidence les Guitounes au numéro quatre
quatre cent dix pré des Barthes, quatre-vingt-deux mille deux cents Moissac
trois rue de Belleperche, quatre-vingt-deux, trois cent quarante, Donzac
quatre mille deux cent trente chemin du Gouyré, quatre-vingt-deux, huit cents à Vaïssac
Impasse des Rouges, quatre-vingt-deux mille trois cents Monteils
Chemin de Paillot, quatre-vingt-deux, cent Les Barthes
Saint Martial, Montauban
Impasse Ismen Fulbert à Montauban
