douze rue des Champs Vaudey, soixante-dix mille deux cents Saint-Germain
huit rue du Rahin, soixante-dix, deux cent cinquante, Ronchamp
trente-deux rue Albert Olivier, soixante-dix, zéro zéro zéro à Noidans-lès-Vesoul
Rue Gilberte Lavaire, soixante-dix mille cent soixante-dix Port-sur-Saône
Rue des Prés Verney, soixante-dix, cinq cents Bousseraucourt
Chemin de Chomy, Ternuay-Melay-et-Saint-Hilaire
Rue des Champs Mourey à Senargent-Mignafans
soixante-dix-huit avenue des Chavannes
Impasse des Breuleux au numéro cinq
trois rue Claude Dubuisson, soixante-dix mille deux cent dix Vauvillers
trente-huit rue Joseph Rouget, soixante-dix, zéro zéro zéro, Échenoz-la-Méline
quatre rue de Cubry, soixante-dix, cent trente à Vy-le-Ferroux
Rue André Morel, soixante-dix mille Noidans-lès-Vesoul
Rue de la Gabiotte, soixante-dix, trois cents Saint-Valbert
Rue du Bataillard, Bouligney
Rue Louis Chauveau à Arc-lès-Gray
six route de Traitiéfontaine
Chemin du Tranot au numéro six
dix chemin de la Baubette, soixante-dix mille cent quatre-vingt-dix Chaux-la-Lotière
quatre chemin du Champs du Haut, soixante-dix, deux cents, Froideterre
six rue Maurice Berthel, soixante-dix, deux cents à Magny-Vernois
Rue Sonjour, soixante-dix mille cent Gray-la-Ville
Chemin de la Rougevie, soixante-dix, deux cent quatre-vingt-dix Champagney
Route de Velet, Apremont
Rue Querney à Fougerolles
quatre rue Robert Salmon
Rue de Vy-lès-Rupt au numéro trois
dix-neuf rue Sous La Brosse, soixante-dix mille Comberjon
douze route de Luxeuil les Bain, soixante-dix, deux cents, Lantenot
sept rue de la Champlitte, soixante-dix, sept cents à Gy
Rue d'Asperg, soixante-dix mille deux cents Lure
Rue de Rossey, soixante-dix, zéro zéro zéro Échenoz-la-Méline
Route de Scey-sur-Saône, Fretigney-et-Velloreille
Rue de Piétié à Esprels
un rue de la Malcouverte
Rue Fabrice Mouillet au numéro cinq
quatre-vingt-quatorze rue des Longéots, soixante-dix mille cent Battrans
quatre rue du Lotissement Miguet, soixante-dix, cent soixante, Purgerot
onze rue de la Courbière, soixante-dix, deux cent quarante à Saulx
Rue de Botey, soixante-dix mille cent soixante Menoux
Voie Chalot, soixante-dix, zéro zéro zéro Quincey
Les Champs Pory, Ternuay-Melay-et-Saint-Hilaire
Lotissement Le Clos des Mésanges à Faucogney-et-la-Mer
seize cours Montaigne
Rue du Lotissement du Blandinbois au numéro sept
neuf rue de Vacheresse, soixante-dix mille quatre cents Mignavillers
huit rue du Bertrand, soixante-dix, cent quatre-vingt-dix, La Malachère
dix route de Malbouhans, soixante-dix, deux cents à La Côte
Rue des Beauregards, soixante-dix mille cent trente Soing-Cubry-Charentenay
Chemin des Vergerots, soixante-dix, cent Ancier
Le Ru Jeannot, Ternuay-Melay-et-Saint-Hilaire
Rue du Theurey à Magny-Danigon
quatorze rue de la Luzine
Rue de Montesseaux au numéro vingt
sept rue de Breuches Bois, soixante-dix mille cent quatre-vingt-dix Buthiers
trois chemin du Lot de Fontaine Auchat, soixante-dix, cent soixante, Menoux
dix-huit rue Charles Canel, soixante-dix, quatre cents à Héricourt
Rue de la Vagière, soixante-dix mille deux cent soixante-dix Belmont
Rue de Baillard, soixante-dix, zéro zéro zéro Frotey-lès-Vesoul
Rue de la Grande Berce, Couthenans
Rue de l'Écho du Bremont à Cubry-lès-Faverney
six rue Desault
Rue du Visenay au numéro cinq
dix-huit rue Jean Parmantier, soixante-dix mille Vesoul
neuf rue de Noidans, soixante-dix, zéro zéro zéro, Vesoul
six rue de la Virnoche, soixante-dix, cent dix à Esprels
Rue du Martenot, soixante-dix mille deux cent quatre-vingt-dix Plancher-Bas
Rue des Prés Lajux, soixante-dix, cent quatre-vingt-dix Voray-sur-l'Ognon
Rue de Bonnal, Esprels
Route de Corneux à Ancier
vingt-huit rue de la Noyé de Bout
Rue de la Pie du Chêne au numéro douze
vingt-quatre rue Cheminée Rouge, soixante-dix mille deux cents Roye
cent vingt le Conot, soixante-dix, deux cent soixante-dix, Fresse
quatre rue des Dhuys, soixante-dix, zéro zéro zéro à Coulevon
Le Grand Poiremont, soixante-dix mille trois cent vingt Aillevillers-et-Lyaumont
Rue du quatre e Chasseurs À Cheval, soixante-dix, cent Gray
Quai Mavia, Gray
Rue Lotissement Faure à Châlonvillars
deux rue Robert Clave
Rue Marcel Stouvenel au numéro onze
cinq allée des Perrayes, soixante-dix mille deux cent soixante-dix Ternuay-Melay-et-Saint-Hilaire
vingt-huit voie de la Montmartine, soixante-dix, zéro zéro zéro, Navenne
un rue de la Semouse, soixante-dix, huit cents à Saint-Loup-sur-Semouse
Rue René Pataille, soixante-dix mille Vesoul
Rue Porte de Cubry, soixante-dix, cent soixante Faverney
Route de Frétigney, Traves
Chemin d'Auremenaux à Dampierre-lès-Conflans
deux rue Charles Lacombe
Rue Charles Balandret au numéro trois
neuf résidence Les Merisiers, soixante-dix mille deux cent soixante-dix Mélisey
un chemin de Lisey, soixante-dix, cent trente, Noidans-le-Ferroux
deux rue de Chevaney, soixante-dix, zéro zéro zéro à Mailley-et-Chazelot
Rue de Potey, soixante-dix mille cent Saint-Broing
Rue Georges Bretegnier, soixante-dix, quatre cents Héricourt
Rue du Champ Caillou, Fougerolles
Rue des Houzards à Roye
trois impasse Chevillot
Rue Charles Demandre au numéro trente et un
quatre rue Emile Gauthier, soixante-dix mille Vesoul
un rue de Montseugny, soixante-dix, cent, Germigney
quarante-neuf avenue du Breuchin, soixante-dix, deux cent quatre-vingts à Raddon-et-Chapendu
Chemin des Champs la Dame, soixante-dix mille deux cents Saint-Germain
Rue du Viau, soixante-dix, huit cents Conflans-sur-Lanterne
Rue de Pré La Miche, Chagey
Rue de la Freteneuse à Quincey
deux impasse des Tussilages
Route d'Aubertans au numéro huit
un passage Dom Berthod, soixante-dix mille trois cent soixante Rupt-sur-Saône
dix-neuf rue de la Vie de Velotte, soixante-dix, deux cents, Amblans-et-Velotte
neuf hameau de l'Étang des Maisons, soixante-dix, sept cents à Igny
Impasse Cardinal Gousset, soixante-dix mille deux cents Lure
Rue de la Voge, soixante-dix, deux cent dix Passavant-la-Rochère
Rue du Duez, Scey-sur-Saône-et-Saint-Albin
Rue Michel Venini à Quincey
huit avenue Charles Boby
Rue du Moulin du Fau au numéro seize
sept rue du Clos Saint-Ferjeux, soixante-dix mille Vesoul
treize rue Rochet, soixante-dix, quatre cents, Héricourt
cinq rue du Craie, soixante-dix, huit cents à Bouligney
Voie de Lure, soixante-dix mille deux cents Roye
Rue de Montureux, soixante-dix, cinq cents Gevigney-et-Mercey
Rue des Champs Pommier, Villersexel
Rue Robert Labat à Vesoul
deux impasse des Haches
Impasse de la Riototte au numéro un
trois BIS chemin de la Côte Poras, soixante-dix mille deux cent quatre-vingt-dix Champagney
un allée de l'Archéologie, soixante-dix, deux cents, Lure
deux rue Pertuis Guillaumet, soixante-dix, zéro zéro zéro à Noidans-lès-Vesoul
Rue du Talerot, soixante-dix mille Vesoul
Rue de Verjoulot, soixante-dix, cent quatre-vingt-dix Neuvelle-lès-Cromary
Ruelle de la Baume, Scey-sur-Saône-et-Saint-Albin
Impasse en Chazeau à Fontaine-lès-Luxeuil
seize rue Claude Renaudot
Rue Pierre Carmien au numéro sept BIS
douze impasse Route de Neuvelle, soixante-dix mille cent quatre-vingt-dix Neuvelle-lès-Cromary
six rue de la Sertobas, soixante-dix, deux cents, Magny-Vernois
sept avenue Jacques Prévost, soixante-dix, cent quarante à Pesmes
Chemin des Granges du Bertey, soixante-dix mille deux cent soixante-dix Saint-Barthélemy
Rue de la Goutte Morel, soixante-dix, quatre cents Champey
Avenue Bureaux de Pusy, Port-sur-Saône
Rue de Sauvigney à Villefrancon
cinquante impasse de Crotot
Rue de Fresse au numéro vingt-trois TER
vingt rue Victor Cautenet, soixante-dix mille Montcey
neuf rue du quarante-sept e Régiment d'Artillerie, soixante-dix, quatre cents, Héricourt
six route de Velleguindry, soixante-dix, zéro zéro zéro à Échenoz-la-Méline
Rue Paul Rémy, soixante-dix mille quatre cent quarante Servance
Rue du Grand Magny, soixante-dix, cent dix Villers-la-Ville
Rue des Cornées, Couthenans
Chemin de Fanière à Rigny
vingt-huit rue du Mont-Randon
Impasse des Calechots au numéro cinq
six la Germenain, soixante-dix mille deux cent vingt Fougerolles
quinze rue de la Ressorte, soixante-dix, zéro zéro zéro, Vesoul
trois place Sainte-Gude, soixante-dix, cent soixante à Faverney
Rue du Rang Fahys, soixante-dix mille deux cent quatre-vingts Raddon-et-Chapendu
Rue de Chanelot, soixante-dix, zéro zéro zéro Colombier
Rue du Commandant Girardot, Vesoul
Rue Ribaud à Lure
quatre impasse Jean Meusy
Hameau du Beuchot au numéro treize
trois chemin des Chennessues, soixante-dix mille deux cent cinquante Ronchamp
deux rue du Bouvot, soixante-dix, deux cent dix, Vauvillers
huit impasse du Côté Couly, soixante-dix, deux cent quatre-vingt-dix à Champagney
Rue de Saulnot, soixante-dix mille quatre cents Granges-le-Bourg
Route de la Haute Vie, soixante-dix, trois cent dix Les Fessey
Chemin de la Côte André, Champagney
Rue Joseph Mantion à Quincey
quatre-vingt-dix la Riotte
Parc du Tibet au numéro cinq
vingt-deux rue de Frahier, soixante-dix mille quatre cents Châlonvillars
un rue Derrière Les Vignes, soixante-dix, cent soixante, Saint-Remy
trois rue de Vezet, soixante-dix, cent trente au Pont-de-Planches
Rue de Pusy Lafayette, soixante-dix mille Pusy-et-Épenoux
Rue de Vouhenans, soixante-dix, deux cents Magny-Vernois
Rue des Copris, Héricourt
Avenue du Vernois à Noidans-lès-Vesoul
six route de la Craye
Rue du Fahys au numéro quatorze
sept rue de Sellerey, soixante-dix mille Charmoille
cinq chemin Cote Au Cerisier, soixante-dix, sept cents, Choye
sept rue des Bosquets Saint-Martin, soixante-dix, zéro zéro zéro à Vesoul
Chemin des Deux Ponts, soixante-dix mille cent quatre-vingt-dix Sorans-lès-Breurey
Lotissement du Festin, soixante-dix, deux cent quarante Varogne
Rue du Beuchois, Vellefaux
Rue de Tavey à Héricourt
un rue de Prairot
Rue Viney au numéro six
dix impasse de Theuriot, soixante-dix mille cent quarante Pesmes
deux rue Champ Leclerc, soixante-dix, huit cents, Ainvelle
quatorze route de Gézier, soixante-dix, sept cents à Montboillon
Rue Xavier De Montepin, soixante-dix mille Frotey-lès-Vesoul
Rue du Morbief, soixante-dix, trois cents Luxeuil-les-Bains
Route de Souhières, Mélisey
Route du Souvenir Français à Ternuay-Melay-et-Saint-Hilaire
six dix rue de Chevanel
Chemin des Chazals au numéro neuf
quatre chemin Saint-Valbert, soixante-dix mille deux cent dix Passavant-la-Rochère
huit rue d'Échavanne, soixante-dix, quatre cents, Chenebier
un allée de l'Humanitude, soixante-dix, zéro zéro zéro à Échenoz-la-Méline
Route de Bougnon, soixante-dix mille cent soixante-dix Port-sur-Saône
Route de Nantouard, soixante-dix, cent Saint-Loup-Nantouard
Rue d'Eguilley, Maizières
Rue du Vay à Champey
dix-huit rue de Jussey
Rue des Vieilles Vies au numéro cinq
cinquante-deux la Grande Croix, soixante-dix mille deux cent soixante-dix Fresse
quatre rue de Laire, soixante-dix, quatre cents, Vyans-le-Val
soixante-treize rue de la Doué, soixante-dix, cent dix à Villersexel
Rue de Collot, soixante-dix mille cent soixante Menoux
Rue du Bout Dessus, soixante-dix, cent dix Fallon
Rue des Jargilliers, Colombe-lès-Vesoul
Avenue Jean Dominique à Gray-la-Ville
douze voie de la May
Voie de Rousseau au numéro huit
quinze impasse de la Fêche, soixante-dix mille quatre cents Brevilliers
huit rue du Petit Montmarin, soixante-dix, zéro zéro zéro, Vesoul
trois rue du Monneret, soixante-dix, quatre cents à Trémoins
Rue de Rioz, soixante-dix mille cent quatre-vingt-dix Fondremand
Impasse de Cita, soixante-dix, zéro zéro zéro Échenoz-la-Méline
Les Renards, Fresse
Les Roquets à Saint-Gand
trois chemin de la Manère
Faubourg de la Sablière au numéro dix-neuf C
onze rue du Rhien, soixante-dix mille deux cent cinquante Ronchamp
trois les Evaux, soixante-dix, trois cent dix, Esmoulières
huit la Communaille, soixante-dix, deux cent vingt à Fougerolles
Rue des Grandes Bergères, soixante-dix mille cinq cents Betaucourt
Rue du Chenalot, soixante-dix, cent quatre-vingt-dix Chaux-la-Lotière
Rue du Pont du Var, Plancher-les-Mines
La Gabiotte à Fougerolles
vingt-huit rue François-Nicolas Mouchet
Rue du Petit Biloirey au numéro trois
sept rue du Cordonnet, soixante-dix mille cent quatre-vingt-dix Chaux-la-Lotière
quinze rue de Cotelotte, soixante-dix, quatre cents, Luze
deux rue Combe Vallon, soixante-dix, cent dix à Longevelle
Impasse des Rompeux, soixante-dix mille quatre cent quarante Haut-du-Them-Château-Lambert
Rue de la Crottière, soixante-dix, sept cents Choye
Chemin des Cudes, Granges-la-Ville
Avenue des Parcs à Arc-lès-Gray
douze rue du Mont Ménard
Lotissement Champs du Brot au numéro treize
quatre rue de la Tour du Bailli, soixante-dix mille trois cents Luxeuil-les-Bains
un rue Monnin, soixante-dix, cent quatre-vingt-dix, Cromary
neuf quai Macé, soixante-dix, huit cents à Saint-Loup-sur-Semouse
Rue de Montcey, soixante-dix mille Comberjon
Rue de la Houbette, soixante-dix, deux cents Clairegoutte
Rue de Bois Derrière, Magnivray
Rue des Champs Aux Lièvres à Bonnevent-Velloreille
six rue Bûche Foin
Voie d'Arpenans au numéro deux A
quatorze rue Siblot, soixante-dix mille deux cents Lure
un rue des Champs Cinet, soixante-dix, cent trente, La Vernotte
sept chemin des Jolis Prés, soixante-dix, huit cents à Bourguignon-lès-Conflans
Parc de la Méline, soixante-dix mille Échenoz-la-Méline
Chemin des Suchets, soixante-dix, cent quatre-vingt-dix Cordonnet
La Tillière, La Proiselière-et-Langle
Impasse de la Pommerie à Magny-Danigon
sept rue de la Sible
Rue des Gypsières au numéro sept BIS
six BIS chemin du Rupt des Gouttes, soixante-dix mille deux cent quatre-vingt-dix Plancher-Bas
trois rue de la Froterie, soixante-dix, cent soixante-dix, Bougnon
neuf rue du Vert Chêne, soixante-dix, deux cents à Lure
Rue de Malbazin, soixante-dix mille deux cent quatre-vingt-dix Plancher-Bas
Rue Noël Ory, soixante-dix, zéro zéro zéro Noidans-lès-Vesoul
Rue des Onchets, Échenoz-la-Méline
Rue du Banney à Saint-Valbert
huit chemin de Gy A Citey
Rue François Cordier au numéro un
six rue de la Chapelle Saint-Quillain, soixante-dix mille sept cents Gy
dix-neuf rue le Noyeu, soixante-dix, quatre cents, Vyans-le-Val
un rue de Thieffrans, soixante-dix, deux cent trente à Cognières
Rue Simon Renard, soixante-dix mille Vesoul
Rue Mecorne, soixante-dix, trois cent soixante Scey-sur-Saône-et-Saint-Albin
Rue du Fantomo, Châlonvillars
Route des Fessey à La Corbière
trois rue de la Hye
Rue des Chaillés au numéro soixante-seize
deux impasse des Gerbaux, soixante-dix mille Chariez
un rue Jospeh Berthiot, soixante-dix, cent soixante, Saint-Remy
trois rue de la Lambe, soixante-dix, deux cent quatre-vingts à Breuchotte
Rue de l'Oiseau Lyre, soixante-dix mille deux cents Lure
Rue Planche de Velaze, soixante-dix, zéro zéro zéro Baignes
Route des Meillery, La Corbière
Impasse du Verger Mouton à Andelarrot
neuf rue du Port du Poirier
Route de Mont-lès-Étrelles au numéro cinq
un rue de l'Étude, soixante-dix mille deux cent dix Melincourt
un avenue Aristide Garret, soixante-dix, zéro zéro zéro, Quincey
huit rue de la Petite Creuse, soixante-dix, cent à Sauvigney-lès-Gray
Place des Bourgeois, soixante-dix mille deux cents Magny-Danigon
Rue de Derrière Les Murs, soixante-dix, deux cent trente Montbozon
Route des Échelets, Mélisey
Pont Neuf à Faucogney-et-la-Mer
quatre rue de Fougerolles
Rue Marquichet au numéro quatre
trente-six rue Victor Genoux, soixante-dix mille trois cents Luxeuil-les-Bains
un rue des Griveles, soixante-dix, zéro zéro zéro, Vaivre-et-Montoille
quatre rue Noirot, soixante-dix, zéro zéro zéro à Vesoul
Les Champs Journet, soixante-dix mille deux cent soixante-dix Ternuay-Melay-et-Saint-Hilaire
Le Mont Gerard, soixante-dix, deux cent soixante-dix La Lanterne-et-les-Armonts
Rue de la Cote Villon, Selles
Rue du Père André à Champagney
quatre place de la Fontaine des Tilleuls
Rue du Lotissement de la Caisse d'Épargne au numéro cinq
six route de Palante, soixante-dix mille deux cents La Côte
un impasse du Chauvisot, soixante-dix, deux cents, Rignovelle
dix rue de la Vigne du Puits, soixante-dix, cent soixante à Saint-Remy
Rue Jean Girardot, soixante-dix mille deux cents Lure
Route de Clairegoutte, soixante-dix, deux cents Magny-Danigon
Rue de la Corvée Bassin, Pusey
Rue du Vacand à Igny
sept rue Montgillard
Lotissement Aux Corvées au numéro deux
quatorze rue des Prelots, soixante-dix mille Velleguindry-et-Levrecey
trois rue de la Tounolle, soixante-dix, cent quatre-vingt-dix, Boulot
neuf chemin des Glanots, soixante-dix, cent quarante à Pesmes
Rue de la Haie de Courcelles, soixante-dix mille cent soixante Mersuay
Allées André Maroselli, soixante-dix, trois cents Luxeuil-les-Bains
Rue des Prélots, Germigney
Rue de Montjustin à Arpenans
cinq le Petit Sigle
Chemin de la Gniotte au numéro deux
trois rue des Granges Guenin, soixante-dix mille deux cent soixante-dix Saint-Barthélemy
quatre chemin des Lapierres, soixante-dix, deux cent soixante-dix, Saint-Barthélemy
deux BIS rue de Saulnaire, soixante-dix, deux cents à Malbouhans
Rue du Noirmouchot, soixante-dix mille deux cent quatre-vingt-dix Plancher-Bas
Les Montants, soixante-dix, deux cent quarante Velleminfroy
Sentier des Capucins, Gray
Rue de Sales à Chantes
six chemin du Malpommier
Rue des Auvergnes au numéro cinq
huit rue de la Fontaine du Haut, soixante-dix mille Quincey
trois rue de la Croix Daillot, soixante-dix, deux cent vingt, Fougerolles
deux rue de Trot de la Croix, soixante-dix, zéro zéro zéro à Noidans-lès-Vesoul
Rue du Perrenot, soixante-dix mille cent trente Neuvelle-lès-la-Charité
Rue Jules Alexis Muenier, soixante-dix, zéro zéro zéro Vesoul
Rue Kekedi Stanislas, Noidans-lès-Vesoul
Rue de Pourrière à Maizières
sept rue Pierre Jeanmougin
Route de la Béguine au numéro deux
quarante-cinq le Bas de la Côte, soixante-dix mille trois cent vingt Aillevillers-et-Lyaumont
cinq chemin des Ronds Champs, soixante-dix, deux cent dix, Passavant-la-Rochère
un rue Bois Jean Rainguet, soixante-dix, deux cent soixante-dix à La Lanterne-et-les-Armonts
Rue du Docteur Doillon, soixante-dix mille Vesoul
Rue des Champs de L'Aumônier, soixante-dix, cent dix Villersexel
Ruelle Justin, Autoreille
Rue du Bois de la Main à Passavant-la-Rochère
deux voie de Belverne
Rue Gollu au numéro dix-sept BIS
dix le Rocheret, soixante-dix mille deux cent soixante-dix Mélisey
un rue Arsène Quiney, soixante-dix, zéro zéro zéro, Quincey
six impasse Privée des Bagès, soixante-dix, quatre cent quarante à Servance
Rue des Auquaires, soixante-dix mille deux cent dix Demangevelle
Chemin des Têtes de Chats, soixante-dix, deux cents Saint-Germain
Rue des Champs Vuillemey, Gouhenans
Rue Marius Bondoui à Fougerolles
vingt-huit rue Françoise Carementrant
Rue des Faux au numéro quatre
quatre rue de la Perrière Franche, soixante-dix mille cent quatre-vingt-dix Chaux-la-Lotière
un le Grand Chanois, soixante-dix, trois cent dix, Esmoulières
onze rue de Baulère, soixante-dix, zéro zéro zéro à Vaivre-et-Montoille
Rue de la Goutte Robert, soixante-dix mille deux cents Clairegoutte
Chemin de la Ruée, soixante-dix, cent Apremont
Rue de la Curtille, Saint-Loup-sur-Semouse
Rue du Frais Puits à Quincey
huit rue Noblot
Rue du Puits Arthur au numéro sept
onze rue de l'Étang Lulin, soixante-dix mille deux cent cinquante Ronchamp
quatre chemin des Champs Cassot, soixante-dix, deux cent quatre-vingts, Amage
douze rue de Couthenans, soixante-dix, quatre cents à Chagey
Rue du Grand Patis, soixante-dix mille deux cents Magny-Vernois
Chemin des Vignes Jean Mourey, soixante-dix, zéro zéro zéro Montigny-lès-Vesoul
Impasse de Coulances, Pesmes
Au Ruot un Er Canton à Ferrières-lès-Scey
un rue de Fresne Saint-Mamès
Rue des Quatre Fils Doumer au numéro trois BIS
dix BIS route des Monts Reveaux, soixante-dix mille deux cents Saint-Germain
huit champs Simonin, soixante-dix, deux cent soixante-dix, La Lanterne-et-les-Armonts
un rue de Les Fessey, soixante-dix, trois cent dix à Sainte-Marie-en-Chanois
Rue Léon Dérahon, soixante-dix mille Noidans-lès-Vesoul
Rue de la Boiche, soixante-dix, deux cents Rignovelle
Rue des Combonottes, Échavanne
Route du Hays à Fontaine-lès-Luxeuil
trois rue du Moulin des Écrevisses
Faubourg des Capucins au numéro seize
cinq rue du Chavany, soixante-dix mille deux cent soixante-dix Ternuay-Melay-et-Saint-Hilaire
cinq rue de Chenevie, soixante-dix, quatre cents, Échenans-sous-Mont-Vaudois
un impasse Les Châtelaines, soixante-dix, huit cents à Ainvelle
Rue du Many, soixante-dix mille Vaivre-et-Montoille
Rue des Gros Cailloux, soixante-dix, trois cent dix Les Fessey
Rue François Slakta, Corbenay
Rue Jeanne Coppey à Bucey-lès-Gy
sept rue de la Tilie
Rue des Échelottes au numéro deux
un rue Couderet, soixante-dix mille Vesoul
cinq rue Charrière du Loup, soixante-dix, deux cent dix, Vauvillers
quinze la Rigolle, soixante-dix, trois cent soixante à Scey-sur-Saône-et-Saint-Albin
Rue de la Poierie, soixante-dix mille deux cent quatre-vingt-dix Plancher-Bas
Rue du Marmourot, soixante-dix, cent dix Athesans-Étroitefontaine
Chemin des Grévillons, Ternuay-Melay-et-Saint-Hilaire
Chemin de la Bille à Grandvelle-et-le-Perrenot
quatorze rue de la Reigne
Route d'Avrigney au numéro quatre
vingt-cinq chemin des Crosses, soixante-dix mille cent cinquante Étuz
sept route du Ménil d'Amont, soixante-dix, quatre cent quarante, Haut-du-Them-Château-Lambert
quatre rue de la Brisée, soixante-dix, quatre cents à Frahier-et-Chatebier
Rue des Ecorces, soixante-dix mille deux cent quatre-vingt-dix Plancher-Bas
Rue de la Flandrière, soixante-dix, zéro zéro zéro Échenoz-la-Méline
Rue du Docteur Rossen, Gray
Rue du Chanoine Frezard à Châlonvillars
deux rue de Buc
Rue Joseph Clavier au numéro deux
quatre rue du Vésinay, soixante-dix mille cent quatre-vingt-dix Neuvelle-lès-Cromary
quatre rue de Vougécourt, soixante-dix, deux cent dix, Passavant-la-Rochère
cinq rue Marie Dauguet, soixante-dix, trois cent vingt à Aillevillers-et-Lyaumont
Rue de Bonnevent, soixante-dix mille cent quatre-vingt-dix Chaux-la-Lotière
Impasse Saint-Desle, soixante-dix, deux cents Magny-Vernois
Route de Lyoffans, Frotey-lès-Lure
Route des Chenevières à Cordonnet
un route des Chaseaux
Chemin du Palut au numéro quatre
vingt-six TER faubourg Roch, soixante-dix mille cent Arc-lès-Gray
trois place de Grapigny, soixante-dix, cent soixante, Saint-Remy
deux rue Mottie, soixante-dix, quatre cents à Belverne
Route de Polaincourt, soixante-dix mille deux cent dix Anchenoncourt-et-Chazel
Impasse Docteur Schweitzer, soixante-dix, zéro zéro zéro Noidans-lès-Vesoul
Route du Lyaumont, Aillevillers-et-Lyaumont
Rue de Bruyère à Chaux-la-Lotière
onze rue du Frapertuis
Rue de la Grapiotte au numéro quatre
trois rue des Fouillies, soixante-dix mille trois cents Magnivray
trois rue de la Côte des Chênes, soixante-dix, quatre cents, Courmont
treize rue de la Venode, soixante-dix, deux cents à Magny-Vernois
Rue Vados, soixante-dix mille Coulevon
Route de Voray, soixante-dix, cent quatre-vingt-dix Boult
Rue Micheline, Vesoul
Rue du Martiney à Villersexel
un rue Louis Ronchi
Impasse des Carons au numéro deux
neuf rue Marie François Boisson, soixante-dix mille Vesoul
deux route du Mont de Vannes, soixante-dix, deux cent cinquante, Ronchamp
cent soixante-seize sur Le Chemin de Noidans, soixante-dix, zéro zéro zéro à Échenoz-la-Méline
Route de Sorans, soixante-dix mille cent quatre-vingt-dix Neuvelle-lès-Cromary
Rue Salamon, soixante-dix, quatre cents Héricourt
Rue des Grandes Faulx, Vesoul
Chemin de Polaincourt à Mailleroncourt-Saint-Pancras
six chemin du Creux Marquis
Place du Général Boichut au numéro six C
trois chemin Fontaine Aux Chats, soixante-dix mille cent soixante Menoux
trois cent soixante-cinq BIS les Larmets, soixante-dix, deux cent soixante-dix, Fresse
dix charrière de Vougécourt, soixante-dix, deux cent dix à Passavant-la-Rochère
Avenue des Rêpes, soixante-dix mille Vesoul
Voie Monniot-Binet, soixante-dix, cent dix Esprels
Rue du Pont sur l'Ognon, Froideterre
Impasse des Parcelles à Brevilliers
cinq route de Bains-les-Bains
Rue Docteur Henri Renard au numéro huit
quatorze BIS avenue de Besançon, soixante-dix mille deux cent trente Montbozon
deux chemin du Proy, soixante-dix, zéro zéro zéro, Navenne
neuf rue de Boulouin, soixante-dix, zéro zéro zéro à Rosey
Impasse Tamaleau, soixante-dix mille cent dix Gouhenans
Rue des Cités Chevret, soixante-dix, quatre cents Héricourt
Rue de la Leut, Aboncourt-Gesincourt
Route de Montbozon à Fontenois-lès-Montbozon
cinq rue du Commandant Cécile
Rue de la un re D.F.L au numéro cinq
six rue des Lucottes, soixante-dix mille Vesoul
quinze route de Saponcourt, soixante-dix, deux cent dix, Polaincourt-et-Clairefontaine
quinze rue Sous La Craie, soixante-dix, zéro zéro zéro à Villers-le-Sec
Rue du Docteur Deubel, soixante-dix mille deux cents Lure
Rue du Trou Gaule, soixante-dix, deux cent dix Polaincourt-et-Clairefontaine
Impasse Chicon, Apremont
Rue des Baties à Fretigney-et-Velloreille
quatre rue Francis Mohring
Impasse Jeanne Wehrle au numéro cinq
vingt rue des Champs des Peignes, soixante-dix mille quatre cents Saulnot
treize rue de Provenchère, soixante-dix, cent soixante, Le Val-Saint-Éloi
trois impasse de Velaze, soixante-dix, zéro zéro zéro à Baignes
Rue de Raze, soixante-dix mille cent trente Vy-le-Ferroux
Rue du Pont Renard, soixante-dix, cinq cents Aboncourt-Gesincourt
Rue de Mourière, Ronchamp
Rue Champs Cachet à Magny-Vernois
huit rue du Docteur Prieur
Impasse du Commandot de Cluny au numéro deux BIS
trois chemin de Buthiers, soixante-dix mille cent quatre-vingt-dix Boult
un chemin de Scey, soixante-dix, trois cent soixante, Ferrières-lès-Scey
six rue de la Crêpe, soixante-dix, quatre cents à Trémoins
