six rue Jean-Louis Lagrange, quarante-quatre mille sept cents Orvault
cinq place Notre-Dame du Chatellier, quarante-quatre, trois cent dix, Saint-Lumine-de-Coutais
quatre-vingt-huit rue de Trignac, quarante-quatre, six cents à Saint-Nazaire
Rue du Moulin de Toulon, quarante-quatre mille cent soixante-dix Nozay
Avenue de Suroit, quarante-quatre, zéro zéro zéro Nantes
Chemin de Siriff, Saint-Nazaire
Rue du Capitaine Robert Martin à Frossay
vingt-neuf rue Général Botha
Impasse du Seigle au numéro trois
trois rue de Subrette, quarante-quatre mille deux cent quatre-vingt-dix Guémené-Penfao
cinq cent quatre-vingt-dix-huit route de Clisson, quarante-quatre, cent vingt, Vertou
dix-neuf boulevard Gustave Roch, quarante-quatre, zéro zéro zéro à Nantes
Rue de l'Étier, quarante-quatre mille six cent vingt La Montagne
Languin - Le Doussais, quarante-quatre, trois cent quatre-vingt-dix Nort-sur-Erdre
Rue Gulliver, La Chapelle-sur-Erdre
Route de la Colinerie à Pornic
trois impasse de la Boisselée
Rue Théodore Patry au numéro quatorze
six rue de la Florie, quarante-quatre mille deux cent soixante Prinquiau
six mille cent soixante-quinze route de la Noë Nozou, quarante-quatre, huit cent soixante, Saint-Aignan-Grandlieu
sept impasse des Baladins, quarante-quatre, sept cent soixante à La Bernerie-en-Retz
Rue de Saint-Molf, quarante-quatre mille quatre cent vingt Mesquer
Avenue du Chêne Gala, quarante-quatre, quatre cents Rezé
Route des Terres Quartières, Bouaye
Chemin du Pré Rival à Herbignac
soixante-neuf route de Prézégat
Avenue Moreau au numéro trente
quatorze boulevard Pierre de Maupertuis, quarante-quatre mille six cents Saint-Nazaire
quarante-six rue du Pontereau, quarante-quatre, zéro zéro zéro, Nantes
cinq rue d'Aurelle de Paladines, quarante-quatre, zéro zéro zéro à Nantes
Avenue des Redellières, quarante-quatre mille quatre cents Rezé
Allée des Consuls, quarante-quatre, trois cent cinquante Guérande
Route du Fan, La Turballe
Cour des Automates à Nantes
seize allée des Petits Brivins
Cour des Paludiers au numéro deux
cinquante-cinq allée Louis Daquin, quarante-quatre mille six cents Saint-Nazaire
dix-huit rue Cheviré, quarante-quatre, zéro zéro zéro, Nantes
seize rue Kervégan, quarante-quatre, zéro zéro zéro à Nantes
Rue de la Croix Joselle, quarante-quatre mille deux cent dix Pornic
Rue Jean de Brunhoff, quarante-quatre, sept cents Orvault
Rue de Paimboeuf, Saint-Père-en-Retz
Rue Lucien Aubert à Nantes
cent soixante-douze rue du Roi Albert un er
Rue Pierre Fleury au numéro soixante et un
soixante-quatre avenue de la Prinais, quarante-quatre mille deux cent cinquante Saint-Brevin-les-Pins
trente-huit rue de Briord, quarante-quatre, sept cent dix, Port-Saint-Père
trente et un rue des Ceps de Vignes, quarante-quatre, huit cent cinquante au Cellier
Rue de l'Abbé Fourage, quarante-quatre mille cent quatre-vingt-dix Gorges
Rue du Savetier, quarante-quatre, sept cents Orvault
Rue Robert Mankel, Vertou
Route de Bréhadour à Guérande
cinq rue de la Gare de Chantenay
Rue de la Tortière au numéro quatorze
deux route de Vertou, quarante-quatre mille Nantes
neuf place d'Herbauges, quarante-quatre, cent dix-huit, La Chevrolière
deux cent quarante-sept rue des Maîtres, quarante-quatre, cent cinquante à Saint-Géréon
Rue des Terres-Neuvas, quarante-quatre mille trois cent quarante Bouguenais
Rue du Faubourg de Béré, quarante-quatre, cent dix Châteaubriant
Impasse de la Tanzanite, Aigrefeuille-sur-Maine
Impasse Pierre Le Bloch à Saint-Brevin-les-Pins
onze avenue Cottineau
La Bricaudière au numéro quarante-six
dix impasse de la Goulonnière, quarante-quatre mille deux cent trente Saint-Sébastien-sur-Loire
onze rue Fernand Pineau-Chaillou, quarante-quatre, zéro zéro zéro, Nantes
vingt et un allée des Vosges, quarante-quatre, deux cent cinquante à Saint-Brevin-les-Pins
Rue Élie Delaunay, quarante-quatre mille Nantes
Rue du Pont de Men, quarante-quatre, quatre cent dix Herbignac
Rue de la Sinière, Couëron
Rue Lanoue Bras de Fer à La Chapelle-sur-Erdre
vingt-cinq square Pierre Mendès France
Route de Béac au numéro vingt-cinq
un impasse des Mazeries, quarante-quatre mille quatre cents Rezé
trente rue du Hameau Fleuri, quarante-quatre, sept cents, Orvault
huit impasse Paul Klee, quarante-quatre, trois cent soixante à Vigneux-de-Bretagne
Rue des Baillauds, quarante-quatre mille sept cents Orvault
Route de la Fontaine Tuaud, quarante-quatre, six cents Saint-Nazaire
Rue de Pilleux, Nantes
Route de Chateaubriant à Guémené-Penfao
treize rue des Sables Menus
Rue de Machecoul au numéro huit
douze avenue des Nouelles, quarante-quatre mille deux cent cinquante Saint-Brevin-les-Pins
trois impasse des Loquets, quarante-quatre, quatre cent soixante-dix, Mauves-sur-Loire
quatre rue des Sorinières, quarante-quatre, cent quarante au Bignon
Rue des Boins, quarante-quatre mille quatre cent dix Assérac
Rue Agena, quarante-quatre, quatre cent soixante-dix Carquefou
Rue de la Mule du Pape, Bouguenais
Rue de la Jouardais au Pellerin
quatorze rue du Pont Tournant
Boulevard du Pays de Retz au numéro quatre
vingt-six avenue Bertie, quarante-quatre mille deux cent cinquante Saint-Brevin-les-Pins
huit B rue Général Buat, quarante-quatre, zéro zéro zéro, Nantes
cinq rue Marange Sylvange, quarante-quatre, zéro zéro zéro à Nantes
Impasse de la Jaunais, quarante-quatre mille cinq cent cinquante Montoir-de-Bretagne
Rue Haute des Bains, quarante-quatre, quatre cent quatre-vingt-dix Le Croisic
La Guibretière, Teillé
Rue Jean Antoine de Baïf à Saint-Nazaire
quatorze rue de l'Hérault
Rue de Tharon au numéro quatre-vingt-seize
deux cent trente et un boulevard du Docteur René Laënnec, quarante-quatre mille six cents Saint-Nazaire
cinquante rue de Cambronne, quarante-quatre, cent dix, Châteaubriant
dix-sept rue du Haut Launay, quarante-quatre, zéro zéro zéro à Nantes
Place Bon Accueil, quarante-quatre mille cinq cent quatre-vingt-dix Derval
La Gadeboiserie, quarante-quatre, huit cent quatre-vingts Sautron
Avenue de la Belle Dame, Nantes
Rue Jean Lefeuvre à Sainte-Luce-sur-Loire
cinq allée de SIssac
Rue Maurice Sambron au numéro seize
cent trente et un route de Rennes (Orvault), quarante-quatre mille sept cents Orvault
dix-huit chemin de la Noitrie, quarante-quatre, sept cent soixante-dix, La Plaine-sur-Mer
huit rue de la Noue Mulette, quarante-quatre, deux cent soixante à Prinquiau
Rue du Bois Hardy, quarante-quatre mille cent vingt Vertou
Impasse Frère Maurice Chotard, quarante-quatre, zéro zéro zéro Nantes
Allée de l'Ancre, Saint-Julien-de-Concelles
Rue des Hauts de l'Ile Chaland à Haute-Goulaine
cent soixante-dix route de Kerdrien
Rue du Clos Merçais au numéro sept mille neuf cents
sept avenue François deux Couperin, quarante-quatre mille deux cent cinquante Saint-Brevin-les-Pins
dix rue de l'Erdre, quarante-quatre, trois cent quatre-vingt-dix, Petit-Mars
onze allée de l'Avel Kresteil, quarante-quatre, six cents à Saint-Nazaire
Impasse de la Galaxie, quarante-quatre mille cent vingt Vertou
Rue du Docteur Boubée, quarante-quatre, huit cents Saint-Herblain
Route de Kerbignon, Guérande
Avenue Alexandre Goupil à Orvault
vingt et un avenue José Maria de Hérédia
Rue Ethel et Julius Rosenberg au numéro vingt et un
trente-neuf rue Docteur Pouzin Malègue, quarante-quatre mille Nantes
dix-sept avenue Pelletier-Doisy, quarante-quatre, zéro zéro zéro, Nantes
dix-sept rue Louis Carré, quarante-quatre, six cents à Saint-Nazaire
Avenue Claude Rousseau, quarante-quatre mille deux cent cinquante Saint-Brevin-les-Pins
Route de Donges, quarante-quatre, cent soixante Crossac
Place du Commandant Jean l'Herminier, Nantes
Impasse du Laricio à Nantes
vingt-huit la Blanchardais
Avenue Félix Vincent au numéro trente-cinq T
vingt-trois rue du Docteur Maurice Boutin, quarante-quatre mille cent quatre-vingt-dix Clisson
mille neuf cent cinquante-six route de Rézac, quarante-quatre, cinq cents, La Baule-Escoublac
soixante-quatorze rue du Port des Grenouilles, quarante-quatre, cent quinze à Haute-Goulaine
Rue Stuart, quarante-quatre mille Nantes
Impasse du Souchais, quarante-quatre, quatre cent soixante-dix Thouaré-sur-Loire
Rue Henry Fournis, Guémené-Penfao
Rue du Port des Charrettes à Nantes
six mille cent vingt rue du Bossis
Rue Pierre Viansson-Ponté au numéro cinq
quinze route de la Chalopinière, quarante-quatre mille deux cent dix Pornic
quatre avenue Julien de la Touche, quarante-quatre, quatre cent soixante-dix, Carquefou
quatorze rue Santeuil, quarante-quatre, zéro zéro zéro à Nantes
Rue de la Gorge Sèche, quarante-quatre mille trois cent soixante Cordemais
Rue de l'Ouche Cartière, quarante-quatre, huit cent soixante Pont-Saint-Martin
Boulevard Jules Verne, La Plaine-sur-Mer
Domaine du Calypso à Pornic
deux rue du Locange
Avenue Jouffroy au numéro trois
trois cent sept méron, quarante-quatre mille cent cinquante Saint-Herblon
un avenue Fausto Coppi, quarante-quatre, zéro zéro zéro, Nantes
cinquante-huit avenue des Maillardières, quarante-quatre, deux cent cinquante à Saint-Brevin-les-Pins
Rue de Mauperthuis, quarante-quatre mille quatre cents Rezé
Rue des Onchères, quarante-quatre, cent vingt Vertou
Avenue Jean Friot, Guémené-Penfao
Rue du Largeau à Saint-Sébastien-sur-Loire
cinq rue du Linot
Boulevard Émile Pourieux au numéro neuf
un le Bois Gouet, quarante-quatre mille trois cent quatre-vingt-dix Saffré
cinq rue du Tenny, quarante-quatre, trois cent cinquante, Guérande
dix-huit l'Herbière, quarante-quatre, cent quatre-vingt-dix à Boussay
Rue des Filets, quarante-quatre mille sept cent soixante-dix La Plaine-sur-Mer
Route de Mesquer, quarante-quatre, quatre cent vingt Piriac-sur-Mer
Rue de la Tête des Landes, Pont-Saint-Martin
Rue de la Houssais à Guenrouet
neuf rue du Portereau
Place des Bleuets au numéro sept
quatorze rue du Champ de Pie, quarante-quatre mille cent vingt Vertou
vingt-neuf chemin de Gravelais, quarante-quatre, cinq cents, La Baule-Escoublac
trente BIS avenue Jean Sohier, quarante-quatre, cinq cents à La Baule-Escoublac
Rue du Bois Hue, quarante-quatre mille Nantes
Rue Vénus, quarante-quatre, huit cent cinquante Ligné
Passage de Trébais, Saint-Joachim
Chemin de Brantonnet à Guérande
onze rue Joseph Lardeux
Place de l'Étendard au numéro trois
soixante-dix-neuf promenade de Bellevue, quarante-quatre mille neuf cent quatre-vingts Sainte-Luce-sur-Loire
cinq rue Paul Ambroise Devin, quarante-quatre, huit cents, Saint-Herblain
huit BIS rue de Mauves, quarante-quatre, quatre cent soixante-dix à Thouaré-sur-Loire
Avenue du Mont Noël, quarante-quatre mille trois cent quatre-vingt-dix Saffré
Avenue de la Frégate, quarante-quatre, zéro zéro zéro Nantes
Avenue Courteline, Saint-Herblain
Chemin de la Robertière à Saint-Herblain
huit rue Général Bedeau
Rue du Bois Praud au numéro deux
quarante-six avenue Jean Burel, quarante-quatre mille quatre cent soixante Saint-Nicolas-de-Redon
un allée Marie-Antoinette, quarante-quatre, deux cent cinquante, Saint-Brevin-les-Pins
huit rue de l'Alexanor, quarante-quatre, huit cent quarante aux Sorinières
Rue des Basclotières, quarante-quatre mille deux cent soixante-dix Machecoul
Avenue du Clos-Mery, quarante-quatre, sept cent cinquante Campbon
Rue de Saint-Étienne de Montluc, Savenay
Rue des Judelles à Saint-Molf
trente-quatre rue des Charreaux
Quai de la Fosse au numéro quatre-vingt-onze
six avenue des Ribès, quarante-quatre mille cinq cents La Baule-Escoublac
treize ruie Étienne Sautejeau, quarante-quatre, trois cent trente, Le Pallet
quarante-cinq rue des Rouleaux, quarante-quatre, cent quinze à Basse-Goulaine
Rue Georges Villebois Mareuil, quarante-quatre mille six cents Saint-Nazaire
Rue Jean Baptiste Vigier, quarante-quatre, quatre cents Rezé
Chemin des Vinettes, Les Moutiers-en-Retz
Quai Léon Sécher à Rezé
trente-sept rue du Lock
Rue Henri Gautier au numéro cent soixante-dix
huit rue de la Barilleterie, quarante-quatre mille quatre cent dix Herbignac
cinq avenue de la Petite Bretagne, quarante-quatre, sept cent trente, Saint-Michel-Chef-Chef
un avenue Léa, quarante-quatre, deux cent cinquante à Saint-Brevin-les-Pins
Rue Paul Bellamy, quarante-quatre mille Nantes
Avenue du Cdt de L'Herminier, quarante-quatre, six cents Saint-Nazaire
Route de la Côte d'Amour, Saint-Nazaire
Rue de Basse Hikerik au Croisic
quatre rue d'Arthon
Route de Carquefou au numéro huit cent cinquante-six
cinq impasse du Clos Valentin, quarante-quatre mille cinq cents La Baule-Escoublac
neuf chemin de la Villa Mine, quarante-quatre, six cents, Saint-Nazaire
six impasse du Rôt, quarante-quatre, cent vingt à Vertou
La Rogerie, quarante-quatre mille quatre cent quarante Teillé
Rue de la Lande Guingand, quarante-quatre, cent vingt Vertou
Rue Alphonse Fouschard, Oudon
Rue du Pouët à Saint-Joachim
cinquante et un route des Carrois de Cuneïx
Allée Pen Duick au numéro cinq
un B rue Francis Le Carval, quarante-quatre mille quatre cents Rezé
soixante-dix-huit rue du Plessis Tison, quarante-quatre, zéro zéro zéro, Nantes
deux impasse du Clos de la Lande, quarante-quatre, six cent quarante à Saint-Jean-de-Boiseau
Place du Bocage, quarante-quatre mille deux cent soixante-dix Machecoul
Rue des Sencives, quarante-quatre, trois cent quarante Bouguenais
Allée des Coquarrières, Saint-Nazaire
Rue Louis Labro à Trignac
deux cent quatre-vingt-cinq route de Chauvé
Rue de la Vallée Géraud au numéro cinq
quinze rue de la Cormorane, quarante-quatre mille sept cent soixante-dix La Plaine-sur-Mer
quatorze rue du Fondeur, quarante-quatre, huit cents, Saint-Herblain
quarante-trois rue de Prézegat, quarante-quatre, cinq cent soixante-dix à Trignac
Avenue de l'Ouche Brésil, quarante-quatre mille cent vingt Vertou
Impasse du Stade Raymond Durand, quarante-quatre, cent vingt Vertou
Rue Charles Lecour, Vertou
Avenue Commandant Henri Charbonnier à Nantes
trois rue de Rocheroux
Rue du Pont aux Prêtres au numéro trois
deux place Simon, quarante-quatre mille deux cent quatre-vingt-dix Guémené-Penfao
soixante-trois rue du Fresche Blanc, quarante-quatre, zéro zéro zéro, Nantes
quatre BIS rue de la Fortunerie, quarante-quatre, cent dix-neuf à Treillières
Rue de la Brianderie, quarante-quatre mille Nantes
Rue des Frères Amieux, quarante-quatre, zéro zéro zéro Nantes
Rue de la Garnache, Paulx
Avenue Émile Outtie à Pornichet
quatorze avenue de Port Val
Rue d'Azay Le Rideau au numéro un
cinq la Challoire, quarante-quatre mille cent cinquante Saint-Herblon
sept impasse de Trignac, quarante-quatre, six cents, Saint-Nazaire
soixante-seize avenue des Naudières, quarante-quatre, huit cents à Saint-Herblain
Rue du Chêne Verdet, quarante-quatre mille trois cent trente Vallet
Rue des Salles de l'Éraudière, quarante-quatre, zéro zéro zéro Nantes
Rue du Pertu, Treillières
Avenue de la Vendée à Vieillevigne
soixante-dix-neuf boulevard de la Prée
Rue du Pâtis Brûlé au numéro seize
deux chemin Claire Fontaine, quarante-quatre mille cinq cent vingt La Meilleraye-de-Bretagne
six B chemin de Mauperthuis, quarante-quatre, trois cent cinquante, Guérande
dix route de Kerhue, quarante-quatre, trois cent cinquante à Saint-Molf
Allée de la Houssaie, quarante-quatre mille six cents Saint-Nazaire
Rue Émile Blandin, quarante-quatre, quatre cents Rezé
La Lhorie, Oudon
Rue de Racapé au Landreau
vingt et un rue Casimir Périer
Rue du Premier Bataillon FFI au numéro sept
dix-sept impasse de la Lézinière, quarante-quatre mille huit cent trente Bouaye
sept avenue Albert de Mun, quarante-quatre, six cents, Saint-Nazaire
treize avenue du Maréchal Franchet d'Esperey, quarante-quatre, cinq cent dix au Pouliguen
Rue de la Haluchère, quarante-quatre mille Nantes
Place Eugène Lafontaine, quarante-quatre, quatre cent soixante Saint-Nicolas-de-Redon
Rue des Hauts de l'Erdre, La Chapelle-sur-Erdre
Rue Yves Marie à Nantes
onze rue de Bonne-Fontaine
Boulevard Guy de Champsavin au numéro quatre
dix-neuf avenue de l'Harmonie, quarante-quatre mille Nantes
seize rue de l'Éraudière, quarante-quatre, zéro zéro zéro, Nantes
quarante-neuf rue Louis Gaudin, quarante-quatre, neuf cent quatre-vingts à Sainte-Luce-sur-Loire
Rue Jean-Baptiste Robert, quarante-quatre mille deux cent trente Saint-Sébastien-sur-Loire
Chemin de Roche Blanche, quarante-quatre, deux cent quarante La Chapelle-sur-Erdre
Allée Benjamin, Saint-Brevin-les-Pins
Rue du Rouge Gorge à Saint-Michel-Chef-Chef
treize T place du Petit Bois
Place de l'Église du Coudray au numéro sept BIS
treize allée de Montsoreau, quarante-quatre mille deux cent trente Saint-Sébastien-sur-Loire
vingt-trois avenue de La Blandinais, quarante-quatre, trois cent soixante, Saint-Étienne-de-Montluc
dix-sept rue de Quercy, quarante-quatre, deux cent trente à Saint-Sébastien-sur-Loire
Rue du Milan Noir, quarante-quatre mille trois cent cinquante Guérande
Rue du Communeau, quarante-quatre, trois cent soixante Saint-Étienne-de-Montluc
Avenue du Pouligou, Pornichet
Rue Jacques Pelletier du Mans à Saint-Géréon
neuf avenue Charles Nicolle
Avenue des Ondines au numéro trente-neuf
un rue du Docteur Drouart, quarante-quatre mille sept cent soixante-dix Préfailles
trente-quatre rue des Courettes, quarante-quatre, sept cent soixante, La Bernerie-en-Retz
vingt-six avenue des Grondins, quarante-quatre, sept cent soixante-dix à La Plaine-sur-Mer
Impasse des Jardins de Belle-Vue, quarante-quatre mille cinq cent vingt et un Oudon
Rue de Chauvé, quarante-quatre, trois cent vingt Arthon-en-Retz
Chemin de Bert, Saint-Nazaire
Route de la Clémençais à Blain
cinquante-deux rue de la Plage du Portmain
Rue du Jardin des Amiraux au numéro quarante
quarante-six rue Georges Bizot, quarante-quatre mille Nantes
vingt-deux chemin des Bauches du Breuil, quarante-quatre, trois cent quarante, Bouguenais
un rue des la Noë Luzette, quarante-quatre, sept cent soixante-dix à Préfailles
Avenue de la Patorie, quarante-quatre mille sept cent soixante La Bernerie-en-Retz
Rue de la Dette, quarante-quatre, deux cent dix Pornic
Allée de la Vague, La Baule-Escoublac
Allée des Pouillots à La Chapelle-sur-Erdre
cent cinq route des Relandières
Rue André Caux au numéro cinquante-six
vingt-sept route des Gremets, quarante-quatre mille trois cent quatre-vingt-dix Puceul
sept rue du Hameau de la Serais, quarante-quatre, deux cent soixante, Savenay
quatre rue de l'Île Doray, quarante-quatre, quatre cent vingt à La Turballe
Rue Ingrès, quarante-quatre mille quatre cent soixante-dix Carquefou
Rue de la Véra Cruz, quarante-quatre, six cents Saint-Nazaire
Avenue de Moulins, Pornichet
Rue du Rémouleur à Saint-Herblain
trente-six rue de Beslé
Rue de la Veinerais au numéro huit
cinq rue du Chêne Lasse, quarante-quatre mille huit cents Saint-Herblain
deux avenue du Vieux Logis, quarante-quatre, sept cent trente, Saint-Michel-Chef-Chef
seize la Galonnière, quarante-quatre, deux cent vingt à Couëron
Impasse Christiane Moreau, quarante-quatre mille huit cents Saint-Herblain
Rue de l'Ormelette, quarante-quatre, sept cent soixante-dix La Plaine-sur-Mer
Route de Kercandon, Guérande
Boulevard de Doulon à Nantes
dix rue de Guéméné
Rue de la Prime au numéro quatre-vingt-six
quatre rue de Fablou, quarante-quatre mille cent dix-huit La Chevrolière
cent quinze route de Thouaré, quarante-quatre, neuf cent quatre-vingts, Sainte-Luce-sur-Loire
deux chemin de la Pelousière, quarante-quatre, huit cents à Saint-Herblain
Rue Maurice Monnier, quarante-quatre mille quatre cents Rezé
Rue du Galibier, quarante-quatre, deux cent vingt Couëron
Rue de la Ville-Halluard, Saint-Nazaire
Rue d'Erquy à Nantes
douze rue du Professeur Claude Lemoine
Avenue des Épagneuls au numéro dix
quatre-vingt-dix-neuf rue Jean-Baptiste Vigier, quarante-quatre mille quatre cents Rezé
huit rue Julius et Ethel Rosenberg, quarante-quatre, huit cents, Saint-Herblain
vingt-trois BIS rue André Louërat, quarante-quatre, deux cent dix à Pornic
Allée du Papillon, quarante-quatre mille trois cent quatre-vingts Pornichet
Place de la Croix du Temple, quarante-quatre, cent quarante Le Bignon
Hameau de l'Auneau, Sainte-Luce-sur-Loire
Passage des Dryades à Carquefou
cent vingt-neuf le Pay
Chemin des Prés Clos au numéro vingt-trois
un impasse de Halais, quarante-quatre mille huit cent trente Bouaye
trente-cinq rue Gabriel Clisson, quarante-quatre, quatre cents, Rezé
cent quatre-vingt-trois BIS boulevard de la Tara, quarante-quatre, sept cent soixante-dix à La Plaine-sur-Mer
Rue Président Aristide Briand, quarante-quatre mille deux cent trente Saint-Sébastien-sur-Loire
Route des Épinais, quarante-quatre, huit cent soixante Saint-Aignan-Grandlieu
Rue de la Fontaine aux Bretons, Pornic
Rue des Guittières à Saint-Philbert-de-Grand-Lieu
quatre avenue de Lusancay
Rue du Péribole au numéro trente
onze avenue du Docteur Sourdille, quarante-quatre mille cinq cent dix Le Pouliguen
quatre square Jean Rostand, quarante-quatre, trois cent quarante, Bouguenais
quarante-six rue de Besné, quarante-quatre, deux cent soixante à Prinquiau
Rue du Char à Bancs, quarante-quatre mille sept cents Orvault
Rue des Berberis, quarante-quatre, neuf cent quatre-vingts Sainte-Luce-sur-Loire
Rue de la Bernerie, Pornic
Rue des Guivettes à Basse-Goulaine
un chemin des Vignes Madame
Rue de l'Abbé Orain au numéro un C
cent cinquante-huit route des Puymains, quarante-quatre mille cinq cent quatre-vingts Bourgneuf-en-Retz
cent neuf la Solitude, quarante-quatre, trois cent quatre-vingt-dix, Nort-sur-Erdre
treize allée d'Antarès, quarante-quatre, deux cent cinquante à Saint-Brevin-les-Pins
Rue Alfred Mahé, quarante-quatre mille cinq cent cinquante Saint-Malo-de-Guersac
Route de Bournigal, quarante-quatre, cent quatre-vingt-dix Clisson
Rue de Prigny, Les Moutiers-en-Retz
Rue de la Vrière à La Chapelle-sur-Erdre
cent cinquante-six l'Isle
Rue du Caroil au numéro un
un rue des Palées, quarante-quatre mille cent quinze Basse-Goulaine
soixante-cinq rue de la Martinais, quarante-quatre, quatre cent dix, La Chapelle-des-Marais
six BIS avenue de la Saulzinière, quarante-quatre, sept cent soixante-dix à La Plaine-sur-Mer
Rue de la Buissonade, quarante-quatre mille deux cent vingt Couëron
Avenue de l'Églantine, quarante-quatre, huit cents Saint-Herblain
Rue du Petit Hautier, Le Croisic
Impasse de la Brière à Ancenis
cinquante-neuf rue Mignonne
L Hotel Tuaud au numéro trente et un
quatorze B rue Georges Grille, quarante-quatre mille quatre cents Rezé
vingt et un rue Jean Courot, quarante-quatre, deux cent dix, Pornic
cinq impasse des Sabotiers, quarante-quatre, huit cent quatre-vingts à Sautron
Rue Julienne David, quarante-quatre mille huit cent cinquante Saint-Mars-du-Désert
Rue Michel Desbois, quarante-quatre, quatre cent quatre-vingts Donges
Allée des Prés Salants, Mesquer
Rue de la Bourie à Vallet
sept avenue de Bressaut
Avenue du Commandant de Nervo au numéro treize
huit rue de la Coussais, quarante-quatre mille cinq cent quatre-vingts Fresnay-en-Retz
dix-huit BIS route de la Ville Jono, quarante-quatre, cent dix-sept, Saint-André-des-Eaux
seize rue Pierre Abélard, quarante-quatre, trois cent trente au Pallet
Rue Mazureau, quarante-quatre mille quatre cents Rezé
Rue de la Bougrière, quarante-quatre, neuf cent quatre-vingts Sainte-Luce-sur-Loire
Route d'Abbaretz, Nozay
La Haudelinière à Nort-sur-Erdre
dix-sept rue de la Plage de la Joselière
Rue de la Fontaine Calin au numéro six
six rue de la Mouchonnerie, quarante-quatre mille trois cent quarante Bouguenais
cinq rue de la Grande Bretagne, quarante-quatre, zéro zéro zéro, Nantes
vingt-deux avenue de la Noëveillard, quarante-quatre, deux cent dix à Pornic
Chemin du Clos du Bignon, quarante-quatre mille deux cent soixante Malville
Impasse du Brossais, quarante-quatre, quatre cent soixante-dix Carquefou
Rue du Vélodrome de Longchamp, Nantes
Chemin de la Guiblinière à Nantes
trois rue d'Havelooze
Rue de la Hée au numéro vingt-cinq
deux rue du Champ Barbier, quarante-quatre mille quatre cent dix La Chapelle-des-Marais
un rue de la Tour Saint- Clair, quarante-quatre, cinq cent quatre-vingt-dix, Derval
quatre-vingt-un avenue de la Hautière, quarante-quatre, deux cent cinquante à Saint-Brevin-les-Pins
Rue de Bais, quarante-quatre mille sept cent vingt Saint-Joachim
Rue Xavier Blanchard, quarante-quatre, six cent quatre-vingts Chéméré
Route de Sainte-Luce, Nantes
Rue Tartifume à Grand-Auverné
sept rue Saint-Lupien
Avenue Jacques Auneau au numéro trente-huit
trente-neuf route du Robelier, quarante-quatre mille huit cent trente Bouaye
cent quatre boulevard de Longchamp, quarante-quatre, zéro zéro zéro, Nantes
cent neuf rue de Pornichet, quarante-quatre, six cents à Saint-Nazaire
Chemin de la Brellerie, quarante-neuf mille cent vingt-trois Le Fresne-sur-Loire
Rue du Parc au Ray, quarante-quatre, cent dix-sept Saint-André-des-Eaux
Rue des Clos Mâts, Brains
Rue du Tage à Carquefou
dix-neuf rue de L'Ile de Gratteseille
Route de Kerroué au numéro deux cent quatre-vingt-un
douze rue Josette Bocq, quarante-quatre mille Nantes
un rue des Dons, quarante-quatre, cent dix-neuf, Treillières
douze rue de Trelayan, quarante-quatre, cent soixante-dix à La Grigonnais
Rue de Malnoë, quarante-quatre mille six cent quarante Cheix-en-Retz
Rue du Frety, quarante-quatre, huit cent soixante Pont-Saint-Martin
Rue Bellitourne, Nantes
Rue Edouard Travies à La Chapelle-sur-Erdre
treize chemin des Landes de Ramby
Avenue Antarès au numéro cinq
quarante-huit avenue Marcel, quarante-quatre mille deux cent cinquante Saint-Brevin-les-Pins
deux avenue de Retz, quarante-quatre, trois cent soixante, Saint-Étienne-de-Montluc
quarante-cinq route des Chesnaies, quarante-quatre, cent dix-neuf à Grandchamp-des-Fontaines
Rue du Commandant Bourdais, quarante-quatre mille quatre cent vingt La Turballe
