Route de Champfagou, Les Vans
Rue du Lotissement La Violette au Teil
cent soixante-dix route de Brune
Impasse de la Table d'Orientation au numéro cinq
cinq cent soixante-seize route de Fontachard, zéro sept, trois cent quarante Félines
cinq B avenue du Jeu de Mail, zéro sept, deux cent vingt, Viviers
vingt-neuf chemin des Grailles, zéro sept, cent à Annonay
Chemin de Chassagnes, zéro sept, zéro zéro zéro Coux
Chemin de Grangeneuve, zéro sept, cent trente Saint-Romain-de-Lerps
Rue du Docteur Marc Bouvat, Guilherand-Granges
Route des Vivets à Ucel
soixante-quinze A impasse du Dolmen
Chemin de Montargues au numéro vingt-cinq E
trois route du Val de l'Olivet, zéro sept, deux cents Ucel
huit rue des Condamines, zéro sept, trois cents, Mauves
cent soixante-dix route du Pont de Rigaud, zéro sept, deux cents à Saint-Étienne-de-Fontbellon
Place du Grillet, zéro sept, trois cents Tournon-sur-Rhône
Chemin des Persédès, zéro sept, cent soixante-dix Lavilledieu
Rue de Vernosc, Davézieux
Route de Secheras à Cheminas
quatre-vingt-treize impasse Maurice Utrillo
Impasse de la Plaine au numéro quatre-vingt-six
cinq cent cinq route de l'Eyrieux, zéro sept, cent quatre-vingt-dix Saint-Sauveur-de-Montagut
deux passage de Merle, zéro sept, cent, Annonay
deux mille soixante-dix chemin du Mazel / Rodet, zéro sept, quatre cent quarante à Champis
Rue de Chastagnon, zéro sept, quatre cents Le Teil
Les Charmilles un, zéro sept, huit cents Charmes-sur-Rhône
Rue Joseph Morelli, Cruas
Avenue Ferdinand Janvier à Annonay
deux mille sept cent cinq route de Darbres
Rue Docteur Louis Pargoire au numéro dix-neuf
mille dix voie des Boutières, zéro sept, cent soixante Le Cheylard
trois cent quarante route de Toulaud, zéro sept, cent trente, Soyons
mille cent quarante-cinq route des Cîmes, zéro sept, quatre cent dix à Colombier-le-Vieux
Rue des Courtines, zéro sept, quatre cent trente Saint-Clair
Chemin de Varogne, zéro sept, trois cents Saint-Jean-de-Muzols
RUE ROSINE BOUCHER, Vallon-Pont-d'Arc
Rue du Périllas à Rochemaure
quinze impasse de la Terrasse
Chemin du Cornilhac au numéro cent quatre-vingt-quatorze
vingt et un quartier du Clos, zéro sept, huit cents La Voulte-sur-Rhône
un rue Georges et Germain Bernard, zéro sept, deux cent cinquante, Le Pouzin
trois cent quatre-vingt-cinq chemin de Cigeaille, zéro sept, cent cinquante à Salavas
Quai de la Sablière, zéro sept, cent soixante Le Cheylard
Rue des Résidences du Soleil, zéro sept, quatre cent trente Davézieux
Chemin de Gouye, Saint-Jean-de-Muzols
Chemin des Archilets à Saint-Symphorien-sous-Chomérac
cent quarante et un digue du Doux
Allée des Perdrix au numéro quatre-vingts
cinq cent quatorze BIS chemin des Plaines à Clarençon, zéro sept, cent trente Saint-Péray
cinq A route de la Chavade, zéro sept, deux cents, Ucel
quinze rue Lucien Boissier, zéro sept, cent à Annonay
Chemin des Peclavel, zéro sept, cent Annonay
Impasse les Ronzates, zéro sept, trois cent quarante Talencieux
Chemin de Rabayas, Aubignas
Route du Grand Murier à Boulieu-lès-Annonay
sept chemin du Suchat
Rue Dauphiné au numéro treize
quinze route des Eschandols, zéro sept, six cents Vals-les-Bains
vingt-cinq chemin de Béraud, zéro sept, trois cent soixante-dix, Eclassan
sept cent trente-cinq boulevard Croix de la Lauze, zéro sept, quatre cents à Rochemaure
Rue du Fayet, zéro sept, trois cent quarante Vinzieux
Route des Sinfonts, zéro sept, deux cent quatre-vingt-dix Quintenas
Route du Replat, Peaugres
Route du Barois à Ardoix
cent trente-six TER route de la Croix des Tours
Rue de Couloubreyt au numéro vingt
dix rue Albert Ladreyt, zéro sept, cent soixante Jaunac
un rue du Bon Pasteur, zéro sept, cent, Annonay
six mille huit cent quarante-sept chemin de Chavaran, zéro sept, cent trente à Saint-Péray
Avenue Pierre Mendes France, zéro sept, deux cent vingt Viviers
Rue Edouard Fessy, zéro sept, trois cent cinquante Cruas
Rue des Brasseries, Ruoms
Rue Désiré Bancel à Lamastre
trois passage des Lilas
Impasse du Midi au numéro cent cinquante
cent trente-trois chemin de Chatelot, zéro sept, deux cent quarante Châteauneuf-de-Vernoux
cent sept chemin de la Madonne, zéro sept, trois cent quarante, Brossainc
quinze rue Vidal, zéro sept, cent à Annonay
Chemin du Chabricou, zéro sept, cent quatre-vingt-dix Saint-Sauveur-de-Montagut
Rue des Consuls, zéro sept, cent Annonay
Chemin du Pic, Saint-Romain-de-Lerps
Route de Bertholand à Ozon
six place Rampon
Rue Badinand au numéro trois
cent trente chemin des Barbiers, zéro sept, cent soixante-dix Lussas
deux avenue Marius Juveneton, zéro sept, trois cents, Tournon-sur-Rhône
dix-sept chemin de Maret, zéro sept, cent à Annonay
Chemin de la Barèze, zéro sept, zéro zéro zéro Privas
Chemin des Côteaux, zéro sept, trois cent quarante Talencieux
Impasse Rasurel, Le Teil
Montée du Rocher à Lamastre
dix rue du Planas
Rue Etienne Eyraud au numéro cent soixante
cent soixante-dix-sept route du Panorama, zéro sept, trois cent quarante Charnas
cent quatre-vingt-cinq rue de Fontanes, zéro sept, cent, Annonay
deux mille quatre cent soixante-quinze route de Saint-Péray, zéro sept, cent trente à Saint-Romain-de-Lerps
Route du Claux d'Arzol, zéro sept, deux cent quatre-vingt-dix Saint-Romain-d'Ay
Chemin de Gourdan, zéro sept, quatre cent trente Davézieux
PL DE L EGLISE, Vallon-Pont-d'Arc
Les Allées de Sion à Aubenas
deux rue Soulavie
Chemin des Chauvets au numéro sept cent cinquante
cinquante et un la Combe du Prieuré, zéro sept, cent Annonay
deux cours de l'Esplanade, zéro sept, zéro zéro zéro, Privas
deux cent cinquante rue de la Lie, zéro sept, quatre cent trente à Vernosc-lès-Annonay
Route Rd quatre-vingt-deux, zéro sept, trois cent quarante Andance
Chemin de Boisvignal, zéro sept, deux cents Aubenas
Chemin de Lubac, Lemps
Impasse Courbis à Tournon-sur-Rhône
soixante-cinq iMP DU JEU DE BOULES
Rue de la Deûme au numéro cinq
un chemin Joseph Lapierre, zéro sept, quatre cents Le Teil
six mille huit cent soixante-sept chemin de Dublière, zéro sept, cent trente, Saint-Péray
treize rue Montgolfier, zéro sept, huit cents à La Voulte-sur-Rhône
Route des Fonds d'Artruc, zéro sept, trois cent quarante Peaugres
Montée de Préneuf, zéro sept, zéro zéro zéro Coux
Route du Mas, Ucel
Allée des Amandines à Tournon-sur-Rhône
deux cent quarante-cinq chemin des Digues
Route de Champagne au numéro neuf
douze lotissement La Lauze, zéro sept, sept cents Bourg-Saint-Andéol
quatre cent vingt-cinq rue de l'Ardéchoise, zéro sept, quatre cent dix, Saint-Félicien
huit rue du Miarou, zéro sept, cent cinquante à Vallon-Pont-d'Arc
Chemin des Bleynoux, zéro sept, deux cents Saint-Étienne-de-Fontbellon
Chemin de Merzelet, zéro sept, cent dix Vinezac
Avenue du Forez, Saint-Marcel-lès-Annonay
Rue de la Meilhe à La Voulte-sur-Rhône
cinquante rue Dame de Ventadour
Impasse Claude Monet au numéro huit
deux cent soixante et onze chemin du Petit Nice, zéro sept, deux cent soixante Joyeuse
quarante-cinq chemin de la Salette, zéro sept, quatre cent dix, Colombier-le-Vieux
quarante et un montée de Tauléac, zéro sept, zéro zéro zéro à Privas
Chemin de Crémouillat, zéro sept, cent soixante-dix Lussas
Chemin de la Coustace, zéro sept, cent vingt Pradons
Chemin de Pantu, Annonay
Rue de la Plantas à Vernosc-lès-Annonay
six cent quatre-vingt-dix route de la Croix du Fraysse
Impasse des Fatouliers au numéro quatre-vingt-cinq
cent vingt-cinq rue du Creux de Boule, zéro sept, sept cents Saint-Just-d'Ardèche
huit route de Saint-Jean Roure, zéro sept, cent soixante, Le Cheylard
quatre-vingts route de Saint-Michel, zéro sept, trois cent soixante aux Ollières-sur-Eyrieux
Rue des Goutelles, zéro sept, six cent dix Vion
Allée des Serres, zéro sept, cent trente Soyons
Impasse Joliette, Lavilledieu
Route des Gras à Joyeuse
cent vingt-cinq rue Seyve Buisset
Route de Charnas au numéro trois cent cinq
treize boulevard de Bésignolles, zéro sept, zéro zéro zéro Privas
cinquante chemin du Duzon, zéro sept, quatre cent quarante, Champis
deux rue de la Gadabielle, zéro sept, deux cents à Vogüé
Rue de la Brassiere, zéro sept, cent vingt Pradons
Chemin de Chizaret, zéro sept, deux cent quatre-vingt-dix Quintenas
Allée des Clématites, Guilherand-Granges
Impasse du Ventoux à Saint-Just-d'Ardèche
onze chemin des Sablieres
Chemin du Pré du Moulin au numéro onze
quatre cent soixante-deux rue Indira Gandhi, zéro sept, zéro zéro zéro Saint-Julien-en-Saint-Alban
sept rue du Pouget, zéro sept, trois cent trente, Thueyts
neuf cent quatre-vingt-cinq route de Juny, zéro sept, quatre cent dix à Saint-Félicien
Chemin de Desagnes, zéro sept, cent trente Saint-Romain-de-Lerps
Route de la Lauzière, zéro sept, deux cents Ucel
Rue Promenade du Rhône, Viviers
Chemin Bois de Roche à Andance
trois cent dix chemin du Chambon
Rue des Jardins de Tartavel au numéro cinquante-quatre
huit cent vingt-cinq route du Bouchet, zéro sept, trois cent trente Thueyts
huit D chemin des Seux, zéro sept, cent, Annonay
seize chemin du Coton, zéro sept, deux cents à Aubenas
Chemin des Mazas, zéro sept, cent soixante Mariac
Chemin de la Ribeyrasse, zéro sept, deux cents Saint-Étienne-de-Fontbellon
Calade du Peintre, Coux
Allée du Serpollet à Saint-Marcel-lès-Annonay
neuf cent trente allée du vingt-deux Août mille neuf cent quarante-quatre
Rue Léon Rouveyrol au numéro douze
trente-sept rue de l'Observance, zéro sept, trois cents Tournon-sur-Rhône
vingt-neuf boulevard Peschaire-Alizon, zéro sept, cent cinquante, Vallon-Pont-d'Arc
cinq cent quarante route des Blaches, zéro sept, cent vingt à Chauzon
Chemin de Peyrot, zéro sept, deux cent quatre-vingt-dix Quintenas
Rue de Rivoly, zéro sept, huit cents La Voulte-sur-Rhône
Route de Chaunes, Vinezac
Impasse Jérémie Dufaud à Davézieux
mille cinq cents chemin de la Morge
Allée Marie Thérése Etienne au numéro sept cent quatre-vingt-treize
quarante-quatre rue Guglielmo Marconi, zéro sept, cinq cents Guilherand-Granges
trois rue des Fournas, zéro sept, quatre cents, Meysse
douze rue Chales, zéro sept, deux cent vingt à Viviers
Route des Gaillards, zéro sept, quatre cent dix Saint-Félicien
Route Rd huit cent vingt, zéro sept, cent Boulieu-lès-Annonay
Rue de Montalivet, Annonay
Rue des Olivettes à Baix
cinq rue Panassac
Chemin des Lermuzes au numéro cent
sept cent cinquante-cinq côte de Chabrol, zéro sept, trois cent quatre-vingts Pont-de-Labeaume
cinq place de l'Esparra, zéro sept, deux cents, Vogüé
deux mille neuf cent cinquante route de Buffière, zéro sept, trois cents à Saint-Barthélemy-le-Plain
Chemin de Porte-Broc, zéro sept, cent Annonay
Chemin de Faure, zéro sept, quatre cent dix Colombier-le-Vieux
Route des Vignobles, Saint-Désirat
Chemin de la Tuillière à Saint-Barthélemy-le-Plain
cent quatre-vingts chemin de Treilhasse
Faubourg Latrau au numéro dix-neuf
seize BIS chemin de la Table du Roy, zéro sept, trois cents Saint-Jean-de-Muzols
trois impasse du Sandre, zéro sept, huit cents, La Voulte-sur-Rhône
quarante-huit rue des Chalands, zéro sept, cinq cents à Guilherand-Granges
Place de Montagne, zéro sept, deux cent quatre-vingt-dix Saint-Jeure-d'Ay
RTE DU PRE CHAUVERT, zéro sept, cent soixante Mariac
Impasse Galilée, Guilherand-Granges
Passage des Pins à Cornas
trente-six rue du Général Voyron
Avenue Louis Antériou au numéro quarante-six
un place de la Bibliothèque, zéro sept, cent Boulieu-lès-Annonay
cent dix chemin des Écluses, zéro sept, quatre cent dix, Colombier-le-Vieux
deux cents chemin de Brottes, zéro sept, quatre cent dix à Colombier-le-Vieux
Rue Maubach, zéro sept, quatre cent trente Vernosc-lès-Annonay
Chemin des Hirondelles, zéro sept, trois cents Étables
Chemin de la Faurie Mercier, Champis
Rue Charles Lindbergh à Guilherand-Granges
cinq place Riquet
Rue du Vannier au numéro cinq
mille quatre cent soixante-cinq chemin des Seveniers, zéro sept, cent soixante-dix Lussas
vingt-sept place Récluzière, zéro sept, cent, Annonay
sept cent soixante route de Carlas, zéro sept, cent dix à Vinezac
Rue de la Picholine, zéro sept, cent quarante Les Vans
Chemin Levêque, zéro sept, quatre cents Le Teil
Rue Davity, Tournon-sur-Rhône
Rue d'Ezige à Charmes-sur-Rhône
dix-neuf avenue des Cévennes
Rue du Chaussier au numéro trois
deux allée des Terrasses d'Allinot, zéro sept, deux cent quatre-vingt-dix Saint-Romain-d'Ay
cent vingt E rue des l'Aigas, zéro sept, trois cent dix, Arcens
vingt et un montée des Escouls, zéro sept, deux cent soixante à Joyeuse
Allée Toulouse Lautrec, zéro sept, cinq cents Guilherand-Granges
Allée du Hêtre, zéro sept, huit cents La Voulte-sur-Rhône
Avenue Ozier, Mauves
Âllée des Chênes à Salavas
quatre-vingts chemin du Petit Bel-Air
Chemin de la Léoune au numéro cent quatre-vingts
quatre cent quatre-vingt-dix chemin Ancienne Voie Royale, zéro sept, cent soixante-dix Lavilledieu
douze rue des Baillis, zéro sept, huit cents, Charmes-sur-Rhône
dix mTE DE L'EGLISE, zéro sept, cent soixante à Mariac
Route des Auverges, zéro sept, cent dix Vinezac
Route du Grand Chaléat, zéro sept, trois cent soixante-dix Eclassan
Quai du Nant, Satillieu
Chemin de la Sajourne à Vernoux-en-Vivarais
quatre cent quatre-vingts chemin de la Jointine
Quai de Merle au numéro onze
soixante-quinze allée du Frigoulet, zéro sept, sept cents Saint-Just-d'Ardèche
six cent quarante-cinq chemin de Champjean, zéro sept, trois cents, Étables
quinze allée des Jardins de Girondy, zéro sept, trois cents à Tournon-sur-Rhône
Montée du Saut, zéro sept, cent soixante-dix Lavilledieu
Chemin Ferrat, zéro sept, cent vingt Chauzon
Chemin de Belin, Eclassan
Chemin de Chambaud à Toulaud
un rue Saint-Thomas
Traverse du Stade au numéro soixante
cent soixante impasse du Masson, zéro sept, trois cent soixante-dix Eclassan
dix-huit rue Hugo Seibert, zéro sept, cent trente, Saint-Péray
deux cent dix E impasse des Viaducs, zéro sept, deux cents à Vogüé
Boulevard Henri Savy, zéro sept, zéro zéro zéro Privas
Rue du Suc de Verre, zéro sept, deux cent quatre-vingt-dix Ardoix
Rue Danielle Casanova, Le Teil
Montée du Grillon à Saint-Marcel-lès-Annonay
vingt-quatre hameau de Girondy
Rue Greffier Chomel au numéro onze
quatorze rue Grangeat, zéro sept, cent Annonay
soixante-cinq rue Barbara, zéro sept, trois cents, Tournon-sur-Rhône
cent soixante-sept rue des Patureaux, zéro sept, quatre cent trente à Davézieux
Chemin de Vaures, zéro sept, trois cents Saint-Barthélemy-le-Plain
Impasse des Serruriers, zéro sept, cent trente Saint-Péray
Chemin des Potières, Saint-Georges-les-Bains
Place Jean Gilles à Saint-Julien-en-Saint-Alban
huit cent trente-cinq C boulevard de Paste
Route de Lagrange au numéro sept cent quatre-vingt-cinq
trois cent trente chemin des Girondes, zéro sept, trois cents Tournon-sur-Rhône
trois cents chemin du Petit Marzillac, zéro sept, trois cents, Étables
trois rue Lamothe, zéro sept, trois cent cinquante à Cruas
Impasse Olivier de Serres, zéro sept, cent trente Toulaud
Rue des Griottes, zéro sept, deux cents Aubenas
Rue Marcel Bruyère, Annonay
Chemin de la Roche-au-Moulin à Boulieu-lès-Annonay
quatre impasse de la Croix de l'Houme
Chemin du Chastagnou au numéro quatre-vingt-quinze
trente-neuf impasse des Mas, zéro sept, cinq cents Guilherand-Granges
six cent dix chemin des Deux Chênes, zéro sept, sept cents, Saint-Just-d'Ardèche
cinquante et un chemin de la Palud, zéro sept, zéro zéro zéro à Privas
Impasse du Val d'Ay, zéro sept, deux cent quatre-vingt-dix Satillieu
Route de Manoulier, zéro sept, cent quatre-vingt-dix Saint-Sauveur-de-Montagut
Rue Auguste Cluzel, Boulieu-lès-Annonay
Rue de la Fourelle à Mauves
quatre impasse du Loriot
Voie Romaine des Helviens au numéro quatre cent dix
quinze chemin du Bourdary, zéro sept, quatre cents Le Teil
cinq chemin de la Trainière, zéro sept, huit cents, La Voulte-sur-Rhône
vingt-sept rue des Blaches, zéro sept, deux cents à Saint-Sernin
CHE DE LA ROCHE, zéro sept, trois cent trente Mayres
Rue Roseron, zéro sept, trois cents Tournon-sur-Rhône
Chemin de Roussier, Saint-Péray
Sentier des Cros à Roiffieux
deux rue Jean-Baptiste Serre
Place de la salle des Fêtes au numéro trois
onze chemin de Fontbonne, zéro sept, deux cents Aubenas
vingt-huit faubourg Saint-Jacques, zéro sept, deux cent vingt, Viviers
trois hameau de Merzelet, zéro sept, cent dix à Vinezac
Impasse du Pestrin, zéro sept, deux cents Ucel
Chemin de l'Esclopier, zéro sept, deux cent dix Alissas
Chemin de Coutay, Toulaud
Place du Puits à Soyons
quarante rUE DES VIOLETTES
PL DE L'EGLISE au numéro quinze
cent quarante-cinq route du Velay, zéro sept, deux cent quatre-vingt-dix Saint-Romain-d'Ay
deux rue de l'Abri, zéro sept, deux cents, Saint-Sernin
mille quarante route de Maurins, zéro sept, trois cents à Étables
Chemin Îlot des Clôts, zéro sept, cent soixante-dix Lavilledieu
Impasse des Falaises, zéro sept, cent vingt Saint-Alban-Auriolles
Chemin de Pailleras, Davézieux
Route du Bruas à Ardoix
cinq place de la Madeleine
Rue Henri Mirabel au numéro dix
deux cent un chemin de la Chaussière, zéro sept, deux cent dix Alissas
vingt et un rue des Chaynets, zéro sept, quatre cents, Meysse
deux B boulevard du Montoulon, zéro sept, zéro zéro zéro à Privas
Place Albin Mazon, zéro sept, zéro zéro zéro Privas
Impasse de la Borne, zéro sept, cent soixante Le Cheylard
Chemin des Imbarts, Thueyts
Route de Beaucaire à Eclassan
quinze cite Edf
Rue de la Fonderie au numéro trente-deux
quarante-six BIS rue Croix de Missions, zéro sept, cent Annonay
deux cent quatre-vingts rue des Cypres, zéro sept, quatre cent trente, Saint-Clair
quarante-deux route des Cols, zéro sept, deux cent quarante à Châteauneuf-de-Vernoux
Chemin du Trepôt, zéro sept, zéro zéro zéro Coux
Allée de Garenne, zéro sept, cent trente Saint-Péray
Route de Cormes, Ardoix
Avenue de Tournon à Lamastre
sept place Paul Mercier
Rue Prosper Duroux au numéro deux
quarante-trois avenue de provence, zéro sept, huit cents Charmes-sur-Rhône
quatre-vingt-dix chemin des Pélèates, zéro sept, trois cent soixante-dix, Ozon
quatre cents route des Champs, zéro sept, deux cents à Saint-Étienne-de-Fontbellon
Rue des Frères Monneron, zéro sept, quatre cent trente Davézieux
Impasse de Goudard, zéro sept, quatre cent dix Saint-Félicien
Chemin de Coustillon, Lachapelle-sous-Aubenas
Chemin de Constantine à Aubenas
trois cents route d'Aric Village
Route de Prunias au numéro sept cent quarante-cinq
seize chemin du Pradal, zéro sept, cent quarante Les Vans
cent quatre-vingt-onze rue Remy Roure, zéro sept, trois cents, Tournon-sur-Rhône
deux cent trente route du Poivre, zéro sept, cent soixante à Jaunac
Route d'Arlix, zéro sept, six cents Vals-les-Bains
Rue Président Chamontin, zéro sept, cent vingt Ruoms
Rue du Gamay, Talencieux
Rue Félicien Vergier à Davézieux
trente-cinq passage de la Rampette
Passage de la Figuerie au numéro quatre
un allée des Abricotiers, zéro sept, cent soixante Le Cheylard
quatorze chemin de la Paille, zéro sept, six cents, Vals-les-Bains
cent quatre-vingt-cinq rue Mathieu Gay, zéro sept, cent à Saint-Marcel-lès-Annonay
Rue Haute de la Fontinelle, zéro sept, cent quarante Les Vans
CHE DES SARRETS, zéro sept, cent soixante Mariac
Impasse Soïo, Soyons
Chemin de Martel à Eclassan
cent quinze impasse du Marthouret
Avenue Clément Faugier au numéro deux BIS
six cent quatre-vingt-dix chemin du Bosc, zéro sept, cent trente Saint-Romain-de-Lerps
cent soixante rue Louis Lauriol, zéro sept, cent soixante-dix, Lavilledieu
deux impasse de Plaisance, zéro sept, cent soixante au Cheylard
Impasse du Pin, zéro sept, sept cents Saint-Just-d'Ardèche
Route de la Croze, zéro sept, cent Roiffieux
Impasse des Cygnes, Cornas
Impasse du Maréchal-Ferrant à Saint-Jean-de-Muzols
onze D rue Hannibal
Allée des Ondines au numéro deux cent quarante-trois
neuf cent six route Vieille du Pont d'Arc, zéro sept, cent cinquante Vallon-Pont-d'Arc
trente chemin de Mirecouly, zéro sept, cent, Annonay
quatre cent vingt chemin des Limes, zéro sept, six cent dix à Sécheras
Chemin de Pré-la-Font, zéro sept, deux cents Saint-Didier-sous-Aubenas
Place Nicolas, zéro sept, cent vingt Pradons
Rue du Docteur Cadet, Tournon-sur-Rhône
Chemin de Ronchevon à Saint-Sauveur-de-Montagut
soixante-deux chemin des Epalas
Place Antoine du Roure au numéro dix
un rue Pierre Léorat, zéro sept, huit cents Charmes-sur-Rhône
soixante-huit rue d'Abraham, zéro sept, quatre cent trente, Vernosc-lès-Annonay
vingt rue de Valernaud, zéro sept, deux cent quatre-vingt-dix à Quintenas
Chemin de Biousse, zéro sept, cent trente Saint-Péray
Impasse du Bardas, zéro sept, deux cent vingt Viviers
Chemin de Maisonneuve, Saint-Barthélemy-le-Plain
CHE DE CHADARENT à Saint-Étienne-de-Fontbellon
cent soixante-trois rue de la quatre Eme République
Rue de Gratignol au numéro quatre-vingt-huit
trente-cinq allée Bien-Être, zéro sept, cent soixante Le Cheylard
quarante-quatre rue des Blés Dorés, zéro sept, cent, Saint-Marcel-lès-Annonay
sept cent soixante-dix route de Balais, zéro sept, trois cent quarante à Talencieux
Montée de Gate Dina, zéro sept, cent Saint-Marcel-lès-Annonay
Route de Ruoms, zéro sept, cent vingt Saint-Alban-Auriolles
Rue du Mas, Davézieux
Impasse des Coings à Saint-Cyr
soixante-dix-sept chemin du Ruisseau de l'Oncle
Passage André Beddelem au numéro sept
douze rue Camille Vielfaure, zéro sept, cent dix Largentière
trente-deux rue Alexandre Bottet, zéro sept, cinq cents, Guilherand-Granges
huit rue René Grimaud, zéro sept, deux cents à Aubenas
Rue Louis Arnaud, zéro sept, trois cents Tournon-sur-Rhône
Rue de Marcale, zéro sept, cent trente Saint-Péray
Allée du Chardonnay, Saint-Marcel-lès-Annonay
Chemin de Sagnelaides à Vernoux-en-Vivarais
soixante route de Pelissac
Route de Jaubert au numéro six
un rue du Meunier, zéro sept, quatre cent dix Saint-Félicien
seize rue Andrée Roux, zéro sept, cent, Annonay
deux avenue de Jagornac, zéro sept, cent soixante au Cheylard
Chemin de Ploye, zéro sept, cent trente Saint-Péray
Chemin d'Argevillières, zéro sept, zéro zéro zéro Privas
Chemin des Ranchins, Pradons
Allée Les Acacias à Tournon-sur-Rhône
douze rue de la Viguerie
Avenue de Tourne au numéro treize
cinq cents rue Joseph Roche, zéro sept, trois cent quarante Serrières
quatre-vingt-cinq route d'Ozas, zéro sept, trois cent quarante, Talencieux
quarante cHE DE BARRY, zéro sept, cent soixante à Mariac
Rue du Campaner, zéro sept, quatre cent dix Saint-Félicien
Avenue Colette Dimberton, zéro sept, cent trente Saint-Péray
Route de Poclary, Toulaud
Rue du Pilat à Davézieux
dix chemin de Lacha
Route du Mouriol au numéro mille trois cent quarante-six
cent cinquante route des Saignes, zéro sept, trois cent soixante-dix Eclassan
cinq rue des Ayres, zéro sept, cent vingt, Saint-Alban-Auriolles
huit cent soixante-quinze route des Grads, zéro sept, deux cent dix à Saint-Symphorien-sous-Chomérac
Rue de Tourne, zéro sept, sept cents Bourg-Saint-Andéol
Rue de Mas des Aires, zéro sept, cent cinquante Vallon-Pont-d'Arc
Chemin de Cula, Étables
Chemin des Droles à Saint-Jean-de-Muzols
quatre cent quarante chemin de Bergeron
Rive de la Dorne au numéro sept cent quatre-vingt-dix
seize avenue Mirabel Chambaud, zéro sept, deux cent quarante Vernoux-en-Vivarais
vingt-quatre rue Étienne Frachon, zéro sept, cent, Annonay
trois cent douze avenue de Grosjeanne, zéro sept, zéro zéro zéro à Privas
Boulevard du Vivarais, zéro sept, zéro zéro zéro Privas
Montée de la Gravenne, zéro sept, trois cent trente Thueyts
Chemin du Massoulet, Montpezat-sous-Bauzon
Chemin du Mas de Guihlaumon à Joyeuse
trois impasse Nancy
Route de Chadenac au numéro trois cent cinq B
dix BIS chemin de la Rivoire, zéro sept, cent Annonay
quarante-cinq chemin de la Gueze, zéro sept, cent soixante, Saint-Jean-Roure
quinze rue des Revols, zéro sept, huit cents à La Voulte-sur-Rhône
Chemin de la Créma, zéro sept, trois cent cinquante Cruas
Route du Serre des Fourches, zéro sept, deux cent dix Saint-Symphorien-sous-Chomérac
Rue Maurice Savin, Guilherand-Granges
Rue des Cholettes à Saint-Jean-de-Muzols
quinze rue des Fruitiers
Rue Fontaine du Chat au numéro neuf
quinze boulevard Plein-Soleil, zéro sept, six cents Vals-les-Bains
vingt-quatre montée du Savel, zéro sept, cent, Annonay
trois cent soixante chemin du Tunnel, zéro sept, quatre cents à Aubignas
Chemin de Cueil Mourachat, zéro sept, trois cent quarante Andance
Chemin d'Anty, zéro sept, cent Roiffieux
Les Cabannes, La Voulte-sur-Rhône
Impasse de la Crèche à Saint-Félicien
douze place de l'Airette
Chemin de Mortier au numéro vingt-quatre
quarante chemin du Gour d'Estelle, zéro sept, cent cinquante Salavas
deux cent vingt C vieille Route Vieille Route, zéro sept, six cent dix, Lemps
vingt-cinq allée du Levant, zéro sept, deux cent quatre-vingt-dix à Quintenas
Chemin de Pougay, zéro sept, zéro zéro zéro Saint-Julien-en-Saint-Alban
Route des Littes, zéro sept, trois cent quarante Charnas
Impasse Gaston Perrassi, Le Teil
Rue Ventadour à La Voulte-sur-Rhône
un place Honoré Flaugergues
Impasse de la Congerie au numéro trente-cinq
trente-six rue de Tartavel, zéro sept, quatre cent trente Davézieux
deux cent quatre-vingt-quinze route de la Cave Coopérative, zéro sept, deux cents, Saint-Étienne-de-Fontbellon
trois rue des Pourettes, zéro sept, cent soixante-dix à Saint-Andéol-de-Berg
Chemin Neuf du Champ du Soulier, zéro sept, cent vingt Pradons
Place de la Faurie, zéro sept, deux cent quatre-vingt-dix Satillieu
Impasse la Ferme du Médecin, Davézieux
Route d'Antraigues à Vals-les-Bains
dix avenue Marc Seguin
Chemin des Champs au numéro deux cent soixante-quatre A
