Le Grand Venot, soixante-dix mille deux cent soixante-dix Fresse
Rue du Mont Joyat, soixante-dix, huit cents Briaucourt
Route du Beuchot, Fontaine-lès-Luxeuil
Rue Bec à Arc-lès-Gray
vingt-trois TER rue de La Neuvelle
Route de Vantoux au numéro huit
six impasse des Herottes, soixante-dix mille deux cents Lomont
six rue Jean de Quers, soixante-dix, trois cent dix, La Longine
trois rue des Vins Clairs, soixante-dix, zéro zéro zéro à Frotey-lès-Vesoul
Rue du Pré Besson, soixante-dix mille deux cent quatre-vingt-dix Plancher-Bas
Rue du Savoyard, soixante-dix, deux cent quatre-vingt-dix Plancher-Bas
Revers des Frayers, La Lanterne-et-les-Armonts
Rue Ferry Petitjean à Saint-Loup-sur-Semouse
vingt-neuf rue du Maroz
La Maréchaude au numéro dix
deux chemin du Bois de la Craye, soixante-dix mille Andelarrot
un impasse Offenbach, soixante-dix, quatre cents, Héricourt
huit chemin de Theuriot, soixante-dix, cent quarante à Pesmes
Rue de l'Armée de l'Est, soixante-dix mille cent dix Villersexel
Rue des Champs Choulots, soixante-dix, cent quatre-vingts Autet
Rue de la Garaude, Noidans-le-Ferroux
Avenue d'Augrogne à Saint-Loup-sur-Semouse
sept rue de la Combeauté
Promenade de la Saône au numéro dix-sept
onze impasse du Pas de Biche, soixante-dix mille deux cent quatre-vingt-dix Champagney
sept rue de la Combe Aux Sapins, soixante-dix, cent quatre-vingt-dix, Voray-sur-l'Ognon
deux chemin de la Combe des Pierres, soixante-dix, cent quatre-vingt-dix à Hyet
Rue du Quai Militaire, soixante-dix mille cent dix Villersexel
Rue de Volère, soixante-dix, cent Saint-Loup-Nantouard
Boulevard du Général Brosset, Lure
Rue de Prételon à Villeparois
quarante-six impasse de Presles
Rue de Coulevon au numéro vingt
huit rue des Fincelles, soixante-dix mille deux cents Lure
quatre BIS rue des Cralots, soixante-dix, sept cents, Oiselay-et-Grachaux
trente-six rue des Moines Haut, soixante-dix, deux cent vingt à Fougerolles
Rue du Marteroy, soixante-dix mille Vesoul
Place de l'Eau, soixante-dix, zéro zéro zéro Raze
Avenue François Devosge, Gray
Hameau Les Graviers à Thieffrans
six chemin des Anges
Rue Jules Bailly au numéro quatre
trois rue de l'École André Maire, soixante-dix mille deux cent cinquante Ronchamp
neuf grande Noues, soixante-dix, deux cent soixante-dix, La Lanterne-et-les-Armonts
dix-huit rue Georges Chevrolet, soixante-dix, trois cent vingt à Aillevillers-et-Lyaumont
Impasse de la Grande Hie, soixante-dix mille huit cents Hautevelle
Rue des Ilottes, soixante-dix, zéro zéro zéro Vesoul
Rue de Pont-sur-l'Ognon, Esprels
Chemin des Champs Montants à Luze
treize rue de la Noue Aubain
Impasse Dravillars au numéro deux
deux place Émile Jacotey, soixante-dix mille quatre cents Saulnot
cent quatre-vingts impasse des Montants, soixante-dix, zéro zéro zéro, Raze
quatre route de la Basse Vaivre, soixante-dix, deux cent dix à Passavant-la-Rochère
Rue de Chagey, soixante-dix mille quatre cents Échenans-sous-Mont-Vaudois
Route de Baulay, soixante-dix, cent soixante Fouchécourt
Rue de la Prods, Champagney
Rue de Noroy à Villers-le-Sec
trois chemin des Boulois
La Rua au numéro cent quatre-vingt-huit
trois rue des Chioz, soixante-dix mille cent quatre-vingt-dix Voray-sur-l'Ognon
vingt-quatre rue Jean Deskur, soixante-dix, deux cents, Lure
cinq chemin sous la Côte, soixante-dix, cent quatre-vingt-dix à Sorans-lès-Breurey
Rue de la Beauchère, soixante-dix mille Montigny-lès-Vesoul
Impasse de Gradion, soixante-dix, zéro zéro zéro Chariez
Rue de la Fontaine Gaville, Pusy-et-Épenoux
Aux Tiers à La Chapelle-Saint-Quillain
trois impasse Derrière le Doz
Chemin des Champs de la Croix au numéro un
six TER route du Montandré, soixante-dix mille quatre cent quarante Servance
deux BIS chemin de la Tenue, soixante-dix, deux cent soixante-dix, Saint-Barthélemy
quatre rue Marcodey, soixante-dix, zéro zéro zéro à Vesoul
Place Carlos Louis Dorget, soixante-dix mille trois cent dix La Longine
Rue des Granges Mercier, soixante-dix, zéro zéro zéro Villers-le-Sec
Chemin Derrière Chez Patret, Mersuay
Ruelle du Pré au Buisson à Champagney
trois rue de la Goutte au Dru
Impasse de la Cruaye au numéro deux
quatre route de Vy-Lés-Lure, soixante-dix mille deux cents Les Aynans
deux rue d'Angirey, soixante-dix, sept cents, Igny
deux cent quinze en Chaillot, soixante-dix, zéro zéro zéro à Raze
Chemin de Grandecourt, soixante-dix mille cent vingt Confracourt
Grande Rue A Charentenay, soixante-dix, cent trente Soing-Cubry-Charentenay
Lotissement Le Clocher, Traves
Chemin des Fairoyottes à Ancier
quatorze chemin des Ayets
Rue du Chaffeaux au numéro un
dix lotissement Les Curtilles Aux Renards, soixante-dix mille Échenoz-la-Méline
cinq rue de l'Adjoint, soixante-dix, deux cent dix, Demangevelle
sept rue Marcel Bardot, soixante-dix, quatre cents à Héricourt
Rue de la Petite Terrière, soixante-dix mille Clans
Rue de la Tuilerie Montchanin, soixante-dix, deux cent dix Passavant-la-Rochère
Impasse des Anciens d'A.F.N., Ronchamp
Rue du Moulin Brisse à Granges-le-Bourg
deux A avenue René Heymes
Rue du Rechassey au numéro quatre
un B rue du Camp de Cheval, soixante-dix mille Frotey-lès-Vesoul
quarante-deux rue des Corvées de l'Hermitage, soixante-dix, cent dix, Villersexel
onze BIS rue de la Goutte Saint-Saut, soixante-dix, quatre cents à Chagey
Rue d'Echenoz, soixante-dix mille Vesoul
Route de Villersexel, soixante-dix, cent dix Pont-sur-l'Ognon
Le Monteaujeux, Fresse
Rue du Docteur Panet à Échenoz-la-Méline
six rue des Champs Vaillants
Impasse de la Corne Mirebey au numéro quatre
douze avenue des Rives du Lac, soixante-dix mille Vaivre-et-Montoille
cinq chemin de Breurey, soixante-dix, cent quatre-vingt-dix, Boult
vingt-huit rue Didon, soixante-dix, zéro zéro zéro à Vesoul
Rue de Betoncourt, soixante-dix mille deux cent dix Fontenois-la-Ville
Rue Chauvier, soixante-dix, deux cents Lure
Rue du Pont du Bois, Mailleroncourt-Saint-Pancras
Rue de la Retorderie à Saint-Loup-sur-Semouse
dix rue de la Dernière Halte
Rue Chapelle d'Essernay au numéro neuf
un chemin du Gros Moulin, soixante-dix mille deux cent dix Ambiévillers
deux rue des Polognes, soixante-dix, quatre cents, Héricourt
un impasse de la Vanne, soixante-dix, huit cents à Saint-Loup-sur-Semouse
Rue du Chauffe Cul, soixante-dix mille deux cent quatre-vingt-dix Plancher-Bas
Rue Armand Paulmard, soixante-dix, trois cent soixante Scey-sur-Saône-et-Saint-Albin
Route de Scye, Port-sur-Saône
Rue de la Côte Thiébaut à Ronchamp
un rue Servin
Rue du Mont Rebrassier au numéro neuf
sept rue de Boult, soixante-dix mille cent quatre-vingt-dix Chaux-la-Lotière
sept rue du Verger au Roi, soixante-dix, quatre cents, Chenebier
trois allée de la Côte Vinée, soixante-dix, zéro zéro zéro à Échenoz-la-Méline
Rue des douze Deniers, soixante-dix mille cent quatre-vingt-dix Lieffrans
Rue de la Gourgeotte, soixante-dix, cent dix Aillevans
Rue des Hauts de la Plauche, Ruhans
Rue Au Bas de Varraux à Andelarrot
trente et un route de Vellefrange
Impasse Planche du Mont au numéro cinq
six avenue Duplessis Deville, soixante-dix mille trois cent dix Faucogney-et-la-Mer
sept A rue Justin et Claude Perchot, soixante-dix, cent soixante, Saint-Remy
onze TER rue Victor Chalmey, soixante-dix, zéro zéro zéro à Noidans-lès-Vesoul
Impasse Quenemine, soixante-dix mille deux cents Amblans-et-Velotte
Rue de Genéchier, soixante-dix, quatre cents Chagey
Impasse Près du Breuil, Châlonvillars
Route de Villafans à Villers-la-Ville
six rue des Pics
Rue Max Chaon au numéro cinq
treize rue Baguet, soixante-dix mille Échenoz-la-Méline
dix BIS lotissement Clos de Saône, soixante-dix, trois cent soixante, Scey-sur-Saône-et-Saint-Albin
trois rue de la Vennée, soixante-dix, huit cents à Briaucourt
Mont Bernard, soixante-dix mille deux cent soixante-dix La Lanterne-et-les-Armonts
Rue du Malembre, soixante-dix, deux cent quatre-vingt-dix Plancher-Bas
Rue Cournot Changey, Gray
Rue de Varigney à Plainemont
six impasse Champs Sur Le Château
Quai René Veil au numéro un
sept rue de Prosey, soixante-dix mille quatre cents Chagey
treize rue de la cinq e D.B., soixante-dix, quatre cents, Héricourt
six A chemin du Cordonnet, soixante-dix, cent quatre-vingt-dix à Boult
Impasse des Beuveries, soixante-dix mille cent soixante Purgerot
Rue du Pontcey, soixante-dix, trois cent vingt Aillevillers-et-Lyaumont
Rue de Menthon, Saint-Loup-Nantouard
Rue de la Vaugine à Vesoul
deux chemin de la Groseille
Impasse des Poils de Chiens au numéro quatre
seize rue de la Corrière, soixante-dix mille Velleguindry-et-Levrecey
deux A rue André Bergerot, soixante-dix, trois cent soixante, Scey-sur-Saône-et-Saint-Albin
trois chemin de la Monte Au Py, soixante-dix, deux cent dix à Saponcourt
Place du Puits du Carcan, soixante-dix mille cent Nantilly
Chemin des Machinveaux, soixante-dix, deux cent dix Betoncourt-Saint-Pancras
Rue du Pré des Vernes, Mersuay
Rue des Bournaux à Purgerot
deux BIS rue du Bressot
Chemin de Boult au numéro treize
un esplanade du Stade, soixante-dix mille deux cent cinquante Ronchamp
trente-neuf route de Plombières, soixante-dix, trois cent vingt, Aillevillers-et-Lyaumont
cent un rue du Trouhot, soixante-dix, cent à Gray-la-Ville
Rue du Champ Clément, soixante-dix mille trois cent soixante Pontcey
Route de Bassigney, soixante-dix, huit cents Bourguignon-lès-Conflans
Impasse des Cryots, Perrouse
Rue des Ronds Champs à Passavant-la-Rochère
deux route de Mollans
Rue En Valgris au numéro quatre
douze rue de la Chaillée, soixante-dix mille deux cent quatre-vingt-dix Plancher-Bas
sept rue de Mignavillers, soixante-dix, cent dix, Senargent-Mignafans
dix route de La Mer, soixante-dix, deux cent soixante-dix à Ternuay-Melay-et-Saint-Hilaire
Rue Champs Durand, soixante-dix mille deux cents Magny-Vernois
Place Moulin des Prés, soixante-dix, zéro zéro zéro Vesoul
Rue Basse du Conot, Champagney
Rue Frohberger à Héricourt
trois impasse de Châtillon
Route de Neuvelle au numéro un
onze rue du Creux de Sable, soixante-dix mille cent quatre-vingt-dix Voray-sur-l'Ognon
un le Trou du Bois, soixante-dix, deux cent soixante-dix, La Lanterne-et-les-Armonts
dix-sept chemin du Gagne Pain, soixante-dix, cent soixante-dix à Port-sur-Saône
Rue de la Vieille Verrière, soixante-dix mille quatre cents Courmont
Avenue Jules Seguin, soixante-dix, huit cents Conflans-sur-Lanterne
Rue Charles Page, Athesans-Étroitefontaine
Rexelaxert à Servance
douze route des Bâties
Rue Pizard Theurey au numéro douze
deux sentier des Bosquets, soixante-dix mille Vellefaux
cinq route de Servigney, soixante-dix, deux cent quarante, Genevrey
dix rue de Villafans, soixante-dix, cent dix à Athesans-Étroitefontaine
Rue du Quartier Piron, soixante-dix mille deux cent quatre-vingt-dix Plancher-les-Mines
Route d'Auxelles, soixante-dix, deux cent quatre-vingt-dix Plancher-Bas
Rue de La Praz, Ternuay-Melay-et-Saint-Hilaire
Bois des Hauts à La Lanterne-et-les-Armonts
quatre A rue Georges Prequin
Route de Pusey au numéro un
deux impasse des Migeons, soixante-dix mille cent quatre-vingt-dix Montarlot-lès-Rioz
cinq rue de la Brechotte, soixante-dix, deux cents, Clairegoutte
dix rue de Charcenne, soixante-dix, sept cents à Choye
Lotissement Haut Chanois, soixante-dix mille trois cent soixante Scey-sur-Saône-et-Saint-Albin
Rue de Courmont, soixante-dix, quatre cents Belverne
Rue Résidence Edmé Rochet, Magny-Vernois
Rue Brocherey à Passavant-la-Rochère
seize route de Villeparois
Les Quarres au numéro vingt-quatre
cent cinquante-six le Petit Venot, soixante-dix mille deux cent soixante-dix Fresse
cinq rue du Blancheney, soixante-dix, sept cents, Angirey
sept la Noye Chazal, soixante-dix, deux cent soixante-dix à Mélisey
Rue du trois Rsm, soixante-dix mille quatre cents Saulnot
Rue de Saint-Igny, soixante-dix, zéro zéro zéro Villers-le-Sec
Rue Auguste Hustache, Noidans-lès-Vesoul
Rue de la Gauguillotte à Magnoncourt
un route de la Chapelle Saint-Quillain
Croslières au numéro dix-neuf
quatre chemin des Plaines Fouillies, soixante-dix mille deux cent soixante-dix Saint-Barthélemy
sept rue des Champs Courtots, soixante-dix, trois cent soixante, La Neuvelle-lès-Scey
cinq rue Nicolas Cordier, soixante-dix, deux cent dix à Vauvillers
Impasse de la Courtille, soixante-dix mille cent soixante Cubry-lès-Faverney
Voie des Halles, soixante-dix, deux cent quarante Saulx
Domaine de la Craye, Frahier-et-Chatebier
Rue de Greucourt aux Bâties
douze rue de la Grande Goutte
Rue du Breuilleromont au numéro deux
trois route de Bellevaux, soixante-dix mille cent quatre-vingt-dix Cirey
huit rue de Malbouhans, soixante-dix, deux cents, La Neuvelle-lès-Lure
sept chemin de Louvière, soixante-dix, deux cents à Saint-Germain
Chemin des Vergers du Cornot, soixante-dix mille cent soixante-dix Port-sur-Saône
Rue du Brajun, soixante-dix, zéro zéro zéro Noidans-lès-Vesoul
Rue du Mont Gédry, Arpenans
Le Magny à Fresse
quatre chemin de la Fusay
Rue de Gueldry au numéro dix-huit
cent deux le Bout, soixante-dix mille deux cent vingt Fougerolles
douze passage Jules Didier, soixante-dix, zéro zéro zéro, Vesoul
un impasse des Tuilerie, soixante-dix, deux cents à Palante
Moulin Sauget, soixante-dix mille sept cents Gy
Les Fouillies de Mansevill, soixante-dix, deux cent soixante-dix Mélisey
Chemin des Crais, Confracourt
Rue de Fontenois à Bouhans-lès-Montbozon
sept rue Bourdault
Rue Général Damidaux au numéro vingt-quatre
six route de Pont-de-Planches, soixante-dix mille cent trente Soing-Cubry-Charentenay
huit chemin de Maze, soixante-dix, cent soixante, Faverney
neuf rue de la Croz, soixante-dix, cent quatre-vingt-dix à Grandvelle-et-le-Perrenot
Rue d'Essernay, soixante-dix mille Villers-le-Sec
Rue de la Maisonnée, soixante-dix, deux cent soixante-dix Montessaux
Rue de Chalonvillars, Chagey
Route de Secenans à Granges-la-Ville
vingt-quatre route de Breurey-lès-Faverney
Es Vouhey au numéro quinze
dix rue Eugène Guingot, soixante-dix mille quatre cent quarante Servance
trois cent soixante-dix-huit le Sapoz, soixante-dix, deux cent soixante-dix, Fresse
neuf route de Magny-Vernois, soixante-dix, deux cents à Amblans-et-Velotte
Impasse Haroun Tazieff, soixante-dix mille Noidans-lès-Vesoul
Hameau de la Lantenelle, soixante-dix, trois cent dix La Proiselière-et-Langle
Rue Champrain, Fontaine-lès-Luxeuil
Chemin Champs Sans Terre à Bussières
quatre rue du Pré de la Haie
Rue du Pont du Page au numéro sept A
un rue André Didier, soixante-dix mille Noidans-lès-Vesoul
six rue des Trois Terres, soixante-dix, quatre cents, Luze
onze allée des Prés de la Grange, soixante-dix, deux cents à Lure
Rue des Berniers, soixante-dix mille deux cents Lure
Rue des Champs Praux, soixante-dix, deux cent soixante-dix Saint-Barthélemy
Rue Gilbert Duhaut, Corbenay
Rue Paul Petitclerc à Vesoul
deux place Schuffenecker
Rue des Foulnières au numéro deux
six route de Chassey, soixante-dix mille deux cent trente Thieffrans
trois allée du Tissage, soixante-dix, deux cent soixante-dix, Ternuay-Melay-et-Saint-Hilaire
un moulin Millet, soixante-dix, deux cent soixante-dix à La Lanterne-et-les-Armonts
Rue des Montelots, soixante-dix mille huit cents Saint-Loup-sur-Semouse
Chemin des Champs du Chêne, soixante-dix, quatre cents Étobon
Route d'Autoreille, Charcenne
Impasse de Maladere à Gouhenans
trois BIS rue de Thiénans
Rue Pierre Emmonot au numéro un
deux le Château d'En Haut, soixante-dix mille huit cents Jasney
douze impasse La Varenne, soixante-dix, quatre cents, Vyans-le-Val
trois rue du Docteur Gaston Vichard, soixante-dix, zéro zéro zéro à Vesoul
Rue de Montbrégil, soixante-dix mille cent dix Esprels
Rue du Guignoley, soixante-dix, sept cents Frasne-le-Château
Rue du Champ Lallemand, Palante
Pré Preigney à Mersuay
un rue des Grandes Paules
Rue des Granges Fouillots au numéro vingt
un rue de la Graviolle, soixante-dix mille cent quatre-vingt-dix Boulot
dix-neuf rue du Tezin, soixante-dix, deux cent dix, Fontenois-la-Ville
huit impasse d'Epenotte, soixante-dix, deux cents à Roye
Rue des Lennery, soixante-dix mille cent quatre-vingts Autet
Rue Marie Richard, soixante-dix, deux cents Lure
Impasse Pré Gilley, Jasney
Rue du Sondenans à Montbozon
un rue de la Corvée d'Arche
Rue de Fontenois la Ville au numéro dix-sept
sept allée des Plantes Saint-Pierre, soixante-dix mille cent quarante Pesmes
dix rue André Morisot, soixante-dix, zéro zéro zéro, Noidans-lès-Vesoul
six chemin de Poligny, soixante-dix, deux cent quarante à Genevrey
Bretelle des Puits, soixante-dix mille cent trente Neuvelle-lès-la-Charité
Rue Charles Pique, soixante-dix, zéro zéro zéro Échenoz-la-Méline
Rue Entre Deux Voyes, Cubry-lès-Faverney
Rue du Praro à La Creuse
sept rue Pré du Clos
Impasse du Bois du Ban au numéro quatre
sept rue du Hameau de Granges, soixante-dix mille quatre cents Granges-le-Bourg
onze rue du Docteur Renaud, soixante-dix, sept cents, Gy
cinquante-cinq rue des Repes, soixante-dix, zéro zéro zéro à Raze
Place de Coligny, soixante-dix mille sept cents Choye
Rue Adrien Guidat, soixante-dix, zéro zéro zéro Noidans-lès-Vesoul
Ruelle du Puits d'Éboulet, Champagney
Rue de Granvelle à Pesmes
quatre BIS rue du Bringuey
Rue Jean de Scey au numéro trois
onze avenue de la Combeauté, soixante-dix mille trois cent vingt Corbenay
quatre chemin des Tricoulons, soixante-dix, deux cent cinquante, Ronchamp
deux BIS rue du Tertre du Palais, soixante-dix, cent à Gray
Route de la Grange du Vau, soixante-dix mille deux cents Amblans-et-Velotte
Chemin du dessus des Granges, soixante-dix, deux cent soixante-dix Saint-Barthélemy
Rue de Vauconcourt, Confracourt
Rue Couelle à Passavant-la-Rochère
un rue de la Molle Côte
Rue Paulien au numéro quarante-cinq
trois route de la Baraque Ferry, soixante-dix mille trois cent dix Les Fessey
trois rue Longereaux, soixante-dix, sept cents, Charcenne
cinq escaliers du Château, soixante-dix, sept cents à Gy
Terre Rouge, soixante-dix mille cent dix Saint-Ferjeux
Rue du Port Louis, soixante-dix, huit cents Bouligney
Rue du Moulin Des Femmes, Châtenois
Rue Vertillot à Belmont
dix place de la Baille
Poinçon au numéro un BIS
cinq impasse de la Chapelle de Saint-Valbert, soixante-dix mille quatre cents Héricourt
deux rue de la Cuvotte, soixante-dix, quatre cents, Frahier-et-Chatebier
vingt-quatre route de Virey, soixante-dix, sept cents à Charcenne
Rue Dussy, soixante-dix mille cent vingt Vy-lès-Rupt
Chemin des Pilliers, soixante-dix, deux cent soixante-dix Saint-Barthélemy
Rue de la Combe Vallery, Rioz
Rue des Grimes à Lomont
quatre grands Prés
Rue du Général Prévost au numéro deux
cinq chemin du Haut Beuveroux, soixante-dix mille deux cent quatre-vingt-dix Champagney
six rue du Puits de la Velle, soixante-dix, cent quatre-vingts, Autet
quatre avenue Christian Bergelin, soixante-dix, zéro zéro zéro à Vesoul
Chemin du Chougnard, soixante-dix mille quatre cents Verlans
Rue Général Détrie, soixante-dix, cent soixante Faverney
Avenue de Gefell, Échenoz-la-Méline
Rue de Lavandières aux Aynans
deux rue Dechairée
Place Calmette au numéro quatre
quatorze rue Nouelet, soixante-dix mille Vallerois-Lorioz
neuf rue Jules Taiclet, soixante-dix, deux cent quatre-vingt-dix, Champagney
onze rue de la Pallaure, soixante-dix, huit cents à Briaucourt
Charrière Mariotte, soixante-dix mille deux cent dix Passavant-la-Rochère
Impasse des Champs Poirots, soixante-dix, deux cents Les Aynans
Impasse du Pré du Moulin, Senargent-Mignafans
Route du Peu d'Acquêt à Ambiévillers
trois rue de Chavonnet
Rue Corne Jacques au numéro quatorze
un rue d'Aigrevaux, soixante-dix mille Flagy
dix rue de la Fontaine de Bû, soixante-dix, zéro zéro zéro, Vellefaux
un rue de Lyoffans, soixante-dix, deux cents à Moffans-et-Vacheresse
Rue des Calouettes, soixante-dix mille deux cent vingt Fougerolles
Rue du Roussey, soixante-dix, huit cents Dampierre-lès-Conflans
Rue de Mailley, Rosey
Rue du Champ de l'Écu à Mailley-et-Chazelot
deux rue sur les Écluses
Rue Chapas Étienne au numéro quatre
trois rue d'Estravaux, soixante-dix mille cent trente Fresne-Saint-Mamès
trois avenue de l'Ancienne Mairie, soixante-dix, zéro zéro zéro, Frotey-lès-Vesoul
onze rue de la Grisotte, soixante-dix, cent soixante à Menoux
Rue des Bareys, soixante-dix mille deux cents Magny-Danigon
Impasse de La Vigne, soixante-dix, deux cents Lomont
Rue du Rognon, Andornay
Chemin des Ensanges à Grandvelle-et-le-Perrenot
deux impasse de l'Étang Reiney
Rue de Bassigney au numéro un BIS
six chemin des Champs de la Baye, soixante-dix mille deux cents Froideterre
quatre impasse du Touvot, soixante-dix, quatre cents, Héricourt
quatre rue de Chailloz, soixante-dix, cent dix à Esprels
Chemin des Saumurs, soixante-dix mille cent soixante Mersuay
Rue du Château Grillot, soixante-dix, zéro zéro zéro Échenoz-la-Méline
Rue du Tifosse, Frotey-lès-Lure
Rue de Noirfond à Rioz
quinze allée des Rotevins
Rue de Quenoche au numéro quatre
huit rue de la Croix de Baulay, soixante-dix mille cinq cents Gevigney-et-Mercey
six rue Monteille, soixante-dix, deux cent quarante, Vellefrie
deux impasse la Banvoie, soixante-dix, trois cent dix à Corravillers
Impasse du Planchet, soixante-dix mille deux cent quarante Genevrey
Route du Charme, soixante-dix, sept cents Étrelles-et-la-Montbleuse
Rue d'Échevanne, Battrans
Chemin de Razel à Fontaine-lès-Luxeuil
quatre impasse du Bourbet
Rue Pierre Thevenin au numéro deux
deux BIS lotissement du Pré de la Haie, soixante-dix mille cent trente Fretigney-et-Velloreille
deux rue des Queugnots, soixante-dix, sept cents, Montboillon
trois chemin de la Vigne Rouge, soixante-dix, trois cent soixante à Rupt-sur-Saône
Rue de Blolequin, soixante-dix mille cent soixante-dix Port-sur-Saône
Rue Lotissement Les Prérots, soixante-dix, quatre cents Couthenans
Rue du Mont Vaudois, Luze
Rue des Fossés de la Douve à Lure
vingt rue sous les Vorpes
Rue de Brigaumont au numéro quatorze
un rue du Pré Sous La Ville, soixante-dix mille cent dix Grammont
quatorze rue de Boulère, soixante-dix, zéro zéro zéro, Andelarre
sept avenue Charles Couyba, soixante-dix, cent à Arc-lès-Gray
Rue Sur les Fossés, soixante-dix mille quatre cents Granges-le-Bourg
Impasse des Crotos, soixante-dix, zéro zéro zéro Vaivre-et-Montoille
Route de Frasne-le-Château, Étrelles-et-la-Montbleuse
Rue des Résidences de la Saône à Port-sur-Saône
deux rue des Prés Champrin
Rue Georges Croisille au numéro huit
quatre impasse des Champs la Derrière, soixante-dix mille deux cents Les Aynans
un impasse de Mortoz, soixante-dix, zéro zéro zéro, Vellefaux
dix champs des Hauts, soixante-dix, deux cent soixante-dix à La Lanterne-et-les-Armonts
Chemin de Pandoillon, soixante-dix mille cent quatre-vingt-dix Grandvelle-et-le-Perrenot
Route de Seveux, soixante-dix, sept cents Vellemoz
Rue du Hâtre Moulin, Gevigney-et-Mercey
Rue des Champs Pierron à Champagney
dix tête des Combes Brûlées
Rue du Puits n°dix au numéro quatre
sept port Saint-Martin, soixante-dix mille cent Arc-lès-Gray
un impasse du Rouchot, soixante-dix, zéro zéro zéro, Pusy-et-Épenoux
trois abbaye Notre-Dame de Bithaine, soixante-dix, deux cents à Adelans-et-le-Val-de-Bithaine
Rue de Schönau, soixante-dix mille cent dix Villersexel
Rue du Binveau, soixante-dix, deux cent dix Montdoré
Rue du Moulin d'Auterive, Anchenoncourt-et-Chazel
Rue Charatre à Arpenans
trois place Pierre Ronsard
Avenue d'Aillevillers au numéro un BIS
sept impasse Bouly, soixante-dix mille huit cents Saint-Loup-sur-Semouse
treize rue de Nonchetille, soixante-dix, zéro zéro zéro, Quincey
quatorze rue Robert Franchequin, soixante-dix, zéro zéro zéro à Vesoul
Terre Neuve, soixante-dix mille deux cent soixante-dix Ternuay-Melay-et-Saint-Hilaire
Lotissement les Fleurs, soixante-dix, deux cent dix Passavant-la-Rochère
Rue Corney de l'Église, Clairegoutte
Lotissement des Fourches à Saint-Barthélemy
trois lotissement du Docteur Maréchal
Rue de la Croix de l'Âge au numéro trois
un rue René Nuffer, soixante-dix mille cent Gray
quatorze rue des Parisies, soixante-dix, deux cent cinquante, Ronchamp
cinq place Centre, soixante-dix, deux cents à Magny-Jobert
Route des Deux Ports, soixante-dix mille trois cent soixante Chassey-lès-Scey
Chemin de Champy, soixante-dix, deux cent quarante Colombotte
Ferme des Orcets, Melincourt
Chemin du Tourillon à Saint-Barthélemy
vingt-deux rue de la Prouse
Rue des Champs Gresons au numéro un
huit pres des Couaz, soixante-dix mille deux cent soixante-dix La Lanterne-et-les-Armonts
trois rue de la Corne Vaudrey, soixante-dix, cent trente, Fretigney-et-Velloreille
deux impasse du Ratelot, soixante-dix, quatre cents à Mignavillers
Rue de la Grand Vie, soixante-dix mille deux cents Vouhenans
Rue des Hyarus, soixante-dix, deux cents Lomont
Rue Bouvaist, Vesoul
Route d'Alaincourt à Vauvillers
un rue du Pont de Luge
Rue de L'Atey au numéro cinq
deux chemin des Charmottes, soixante-dix mille huit cents Dampierre-lès-Conflans
neuf montbey, soixante-dix, trois cent soixante, Scey-sur-Saône-et-Saint-Albin
treize rue de Pont-de-Planches, soixante-dix, cent trente à Vezet
Rue de la Cour l'Abbé, soixante-dix mille huit cents Saint-Loup-sur-Semouse
Route de Pnotcey, soixante-dix, trois cent soixante Chemilly
Rue Victor Dolle, Vesoul
Rue des Ambriers à Champagney
trois rue Révérend Père Bigot
Rue de la Goutte Aux Cerfs au numéro treize
quatorze rue Lucien Charrière, soixante-dix mille Noidans-lès-Vesoul
quatre rue de Chaloule, soixante-dix, sept cents, Bucey-lès-Gy
deux rue du Moulin Blanchard, soixante-dix, sept cents à Choye
Moulin de la Charme, soixante-dix mille cent quatre-vingts Autet
Charbonnot et La Providenc, soixante-dix, zéro zéro zéro Échenoz-la-Méline
Chemin de la Vie Gardet, Sorans-lès-Breurey
Allée de la Combe Bélion à Froideterre
cinq route de Châteney
