vingt-huit rue du Docteur Grandjean, cinquante-quatre mille cent dix Réméréville
dix rue de la Kaukenne, cinquante-quatre, cent cinquante, Briey
treize rue du Carreau de la Mine, cinquante-quatre, sept cent quatre-vingt-dix à Mancieulles
Allée Marcel Wenck, cinquante-quatre mille deux cent dix Saint-Nicolas-de-Port
Rue de la Vallée de l'Esch, cinquante-quatre, trois cent quatre-vingts Rogéville
Lotissement Le Grand Jovier, Batilly
Rue Eugène Ory à Pont-à-Mousson
trente-sept BIS rue de Pont A Mousson
Rue de Pont-Saint-Vincent au numéro quinze
vingt et un rue des Chichenottes, cinquante-quatre mille trois cent soixante Barbonville
cinquante et un rue de Tomblaine, cinquante-quatre, quatre cent vingt, Saulxures-lès-Nancy
cinq rue des Deux Épis, cinquante-quatre, six cent trente à Flavigny-sur-Moselle
Rue Ascou, cinquante-quatre mille sept cent trente Ville-Houdlémont
Rue de la Haute-Brin, cinquante-quatre, deux cent quatre-vingts Brin-sur-Seille
Route de Toul, Blénod-lès-Toul
Rue du Comte de Frawenberg à Bouxières-aux-Dames
six rue du Chauxfour
Rue Jean Feuillette au numéro dix-huit
deux avenue du Commandant Charcot, cinquante-quatre mille trois cent vingt Maxéville
six allée de la Butte Sainte-Geneviève, cinquante-quatre, quatre cent vingt-cinq, Pulnoy
un rue des Marnes Grises, cinquante-quatre, deux cent quatre-vingts à Seichamps
Rue du Lorguillon, cinquante-quatre mille sept cent cinquante Trieux
Rue des Ullions, cinquante-quatre, deux cent soixante Longuyon
Rue du Bois le Prêtre, Fey-en-Haye
Route de Badménil à Baccarat
trente et un rue Hubert Sensiquet
Rue de Jolimont au numéro vingt-huit
trois rue Marcellin Munier, cinquante-quatre mille trois cent quatre-vingts Landremont
quinze route de Sanzey, cinquante-quatre, deux cents, Boucq
trois boulevard Tolstoï, cinquante-quatre, cinq cent dix à Tomblaine
Rue du Chambré, cinquante-quatre mille sept cent soixante Faulx
Rue Val des Faulx, cinquante-quatre, six cent soixante-dix Custines
Rue de Ménil, Lunéville
Rue Lionnois à Nancy
douze rue de l'Abbé Devaux
Rue du vingt et un Juin mille neuf cent quarante au numéro cinq
vingt-six rue du Chanoine Piéron, cinquante-quatre mille six cents Villers-lès-Nancy
un chemin du Rouau, cinquante-quatre, cent soixante, Pierreville
vingt-huit rue du Cloué, cinquante-quatre, cent cinquante à Briey
Rue du Général Custine, cinquante-quatre mille Nancy
Rue Houdevaux, cinquante-quatre, cent treize Bulligny
Rue Alfred Songeur, Maidières
Rue Raugraff à Nancy
quatre cour du Couvent
Rue du Poncé au numéro vingt et un
quarante-huit rue du Vieil Aître, cinquante-quatre mille Nancy
trente-deux rue de Saurupt, cinquante-quatre, zéro zéro zéro, Nancy
vingt-quatre rue Monseigneur Turinaz, cinquante-quatre, zéro zéro zéro à Nancy
Rue du Blanc Mur, cinquante-quatre mille deux cent dix Saint-Nicolas-de-Port
Rue de la Bouillante, cinquante-quatre, trois cent quatre-vingts Dieulouard
Chemin du Poirier d'Anne, Pierre-Percée
Chemin de la Gare de Rosières à Dombasle-sur-Meurthe
treize rue de la Petite Embanie
Rue Henry Brun au numéro six cent quarante-cinq
trente-six rue Hanzelet, cinquante-quatre mille cent dix Haraucourt
onze rue Michâtel, cinquante-quatre, deux cents, Toul
dix-neuf rue de Laneuveville, cinquante-quatre, sept cents à Montauville
Rue du Radimont, cinquante-quatre mille sept cent trente Gorcy
Place de la Quatrième République, cinquante-quatre, deux cent trente Chaligny
Rue des Soeurs Bonnaventure, Villers-en-Haye
Rue du quatorze Septembre à Dombasle-sur-Meurthe
trois rue Eugène Sillien
Rue Baron Buquet au numéro trente et un
un quai de Bitche, cinquante-quatre mille trois cents Lunéville
vingt et un rue d'Haussonville, cinquante-quatre, cent dix, Dombasle-sur-Meurthe
deux rue Chiffetraie, cinquante-quatre, trois cent soixante-dix à Hoéville
Rue de Maixe, cinquante-quatre mille trois cent soixante-dix Deuxville
Route de Villey-Saint-Étienne, cinquante-quatre, deux cents Toul
Placette Ville d'Avray, Heillecourt
Rue de la Taille Michaud à Velaine-en-Haye
un place du Couarail
Impasse du Prince d'Elbeuf au numéro un
sept rue de Fillières, cinquante-quatre mille cent cinquante Avril
huit rue des Frères Voirin, cinquante-quatre, zéro zéro zéro, Nancy
cinq rue Victor Idoux, cinquante-quatre, deux cent dix à Saint-Nicolas-de-Port
Clos Saint-Louis, cinquante-quatre mille six cent soixante-dix Custines
Rue de Glabavaux, cinquante-quatre, trois cent cinquante Mont-Saint-Martin
Rue Fabius Henrion, Pagny-sur-Moselle
Avenue Paul Déroulède à Laxou
sept rue des Narvannes
Boulevard Valonnière au numéro quatorze
soixante et onze impasse de l'Embanie, cinquante-quatre mille deux cent vingt Malzéville
trois cent soixante-deux avenue du Cardinal Tisserand, cinquante-quatre, deux cents, Toul
vingt-trois rue de Foug, cinquante-quatre, deux cents à Choloy-Ménillot
Rue André Nicolas, cinquante-quatre mille trois cents Lunéville
Rue du cent quarante-neuf Rif, cinquante-quatre, neuf cent vingt Morfontaine
Rue des Vallieux, Neuves-Maisons
Rue Clodion à Nancy
trois rue de La Fourasse
Route de Manonville au numéro cent douze
dix rond-Point Simone Lacorre, cinquante-quatre mille cinq cent dix Tomblaine
trois rue Petitier, cinquante-quatre, quatre cents, Longwy
douze BIS rue Pierre de Bar, cinquante-quatre, deux cent quarante à Jœuf
Avenue du Léomont, cinquante-quatre mille cent dix Dombasle-sur-Meurthe
Rue des trois Maisons, cinquante-quatre, deux cent trente Chaligny
Rue Georges Houdelot, Nomeny
Lotissement les Prunelliers à Chavigny
dix rue de Bonnardel
Rue du quinze Septembre mille neuf cent quarante-quatre au numéro quarante-quatre
huit rue Damain la Ville, cinquante-quatre mille deux cent quatre-vingts Velaine-sous-Amance
huit rue de Chenesieux, cinquante-quatre, cent vingt-deux, Vathiménil
trois ruelle Vuidard, cinquante-quatre, deux cent dix à Saint-Nicolas-de-Port
Place Duroc, cinquante-quatre mille sept cents Pont-à-Mousson
Rue Jean-Baptiste Blondeau, cinquante-quatre, trois cent cinquante Mont-Saint-Martin
Rue de la Chenaux, Crantenoy
Rue Castara à Lunéville
quatre rue Hermitage
Rue des Genèvres au numéro vingt-quatre
dix-huit avenue Charles Odinet, cinquante-quatre mille deux cent vingt Malzéville
trente-huit rue Jacques Marquette, cinquante-quatre, sept cent dix, Ludres
mille deux cent vingt-neuf rue Gaston Petit, cinquante-quatre, sept cents à Pont-à-Mousson
Rue du Frère Barry, cinquante-quatre mille cent quatre-vingts Heillecourt
Rue Roger Marx, cinquante-quatre, six cents Villers-lès-Nancy
Rue de Mars-la-Tour, Bruville
Rue de Florainville à Dombasle-sur-Meurthe
trente-deux rue de la Meselle
Allée René Peters au numéro trente-six
un rue de la Févière, cinquante-quatre mille sept cent dix Fléville-devant-Nancy
un allée des Petits Jardins, cinquante-quatre, quatre cent vingt-cinq, Pulnoy
cinquante rue du Viombois, cinquante-quatre, cent vingt à Bertrichamps
Rue Jean Ploussard, cinquante-quatre mille deux cent vingt Malzéville
Les Longues Rayes, cinquante-quatre, quatre cent vingt Saulxures-lès-Nancy
Rue du Bois de Grève, Messein
Rue des Dominicains à Nancy
un rue Majorelle
Rue Léon Molinos au numéro cent quatre-vingt-huit
trente et un rue du Hardillon, cinquante-quatre mille trois cent quatre-vingt-dix Frouard
quatre impasse Navarre, cinquante-quatre, cent vingt-deux, Chenevières
trente et un rue Catherine de Bourbon, cinquante-quatre, cent quarante à Jarville-la-Malgrange
Route d'Anoux, cinquante-quatre mille cent cinquante Lantéfontaine
Rue d'Halanzy, cinquante-quatre, quatre cents Longwy
Route d'Halanzy, Mont-Saint-Martin
Rue Émile Moselly à Chaudeney-sur-Moselle
seize rue de Mondon
Rue de Liverdun au numéro trente-trois
cinquante-quatre boulevard des Aiguillettes, cinquante-quatre mille six cents Villers-lès-Nancy
quatorze clos du Nayeux, cinquante-quatre, quatre cent dix, Laneuveville-devant-Nancy
dix-sept BIS rue de l'Âtre, cinquante-quatre, sept cent cinquante à Trieux
Rue Albert Denis, cinquante-quatre mille deux cents Toul
Cite de la Gare, cinquante-quatre, six cent soixante Moutiers
Quai de l'Ile Saint-André, Lunéville
Rue de l'Abbé Georges Guérin à Écrouves
vingt-quatre rue de Banvoie
Rue de Martinval au numéro treize
trente-huit rue du Lieutenant Excoffier, cinquante-quatre mille cinq cent cinquante Sexey-aux-Forges
trente-sept rue des Frères Daum, cinquante-quatre, huit cents, Jarny
dix-neuf rue Somen, cinquante-quatre, cinq cent soixante à Audun-le-Roman
Rue Victor Lemoine, cinquante-quatre mille Nancy
Rue Gabriel Maurice, cinquante-quatre, quatre cents Longwy
Avenue Marthe, Laneuveville-devant-Nancy
Rue de Maron à Villey-le-Sec
cent dix-sept rue du Général Duchêne Bastien
Rue de Turique au numéro quarante-deux
onze rue de Badonviller, cinquante-quatre mille Nancy
cinquante-trois rue des Quatre Frères Guillon, cinquante-quatre, sept cents, Maidières
trois rue Mon Logis, cinquante-quatre, cent quatre-vingt-dix à Villerupt
Rue René deux, cinquante-quatre mille cent dix Dombasle-sur-Meurthe
Rue du Pont Mouja, cinquante-quatre, zéro zéro zéro Nancy
Boulevard de Champelle, Villers-lès-Nancy
Rue du Fort des Romains à Blénod-lès-Pont-à-Mousson
douze rue du Lieutenant Breton
Avenue de Fraiture au numéro treize
trois rue d'Évienne, cinquante-quatre mille cent soixante-dix Bagneux
quatre rue Albert Cossart, cinquante-quatre, cent quatre-vingts, Houdemont
cinquante-cinq rue du Doyen Jacques Parisot, cinquante-quatre, six cent trente à Flavigny-sur-Moselle
Quai des Petits Bosquets, cinquante-quatre mille trois cents Lunéville
Rue Armand Solvay, cinquante-quatre, cent dix Dombasle-sur-Meurthe
Rue d'Acras, Bayon
Route de Chambley à Xonville
cinq rue des Docteur Grandjean
Rue du Petit Coucou au numéro cinq
douze chemin du Pré Hali, cinquante-quatre mille cent dix Hudiviller
dix route de Han, cinquante-quatre, six cent vingt, Pierrepont
dix-huit rue du Ménin, cinquante-quatre, deux cents à Toul
Rue de Tharandt, cinquante-quatre mille quatre cent quatre-vingt-dix Piennes
Rue Hermite, cinquante-quatre, zéro zéro zéro Nancy
RES MELEZES vingt et un RUE PAUL BERT, Dombasle-sur-Meurthe
Rue de la Boudière à Trondes
onze rue du Capitaine Clochette
Chemin de la Boulangère au numéro seize
quarante-trois rue Camille Cavallier, cinquante-quatre mille sept cents Blénod-lès-Pont-à-Mousson
quatre deux e Ruelle du Grand Verger, cinquante-quatre, zéro zéro zéro, Nancy
treize rue des Clairs Chênes, cinquante-quatre, cinq cent soixante à Audun-le-Roman
Rue de Harbouey, cinquante-quatre mille quatre cent quatre-vingts Cirey-sur-Vezouze
Rue Nantes Bat Dumont d'Urvill, cinquante-quatre, deux cent cinquante Champigneulles
Rue Nicolas Naddéo, Mont-Saint-Martin
Chemin des Meix Prés à Rosières-aux-Salines
vingt-sept rue de Villey-le-Sec
Rue de Noirval au numéro dix-neuf
un rue Adolphe Thierry, cinquante-quatre mille cinq cent trente Pagny-sur-Moselle
deux cent treize rue Georges Frédéric Haendel, cinquante-quatre, trois cent dix, Homécourt
trois cent trente-quatre rue de Trondes, cinquante-quatre, cinq cent soixante-dix à Lay-Saint-Remy
Rue Cités Saint-Victor, cinquante-quatre mille cent quatre-vingt-dix Villerupt
Rue Louis Majorelle, cinquante-quatre, quatre cent vingt Saulxures-lès-Nancy
Rue Sommer, Pierrepont
Impasse Fabert à Mont-Saint-Martin
un rue Bertrand Auerbach
Allée du Bois d'Amont au numéro treize
huit place Louis Dorion, cinquante-quatre mille sept cent vingt Cutry
treize rue de Bayon, cinquante-quatre, trois cent soixante, Einvaux
dix-neuf rue de Landres, cinquante-quatre, cent onze à Mont-Bonvillers
Rue Fontaine Saint-Brice, cinquante-quatre mille deux cents Pagney-derrière-Barine
Rue Lacanne, cinquante-quatre, quatre cent trente Réhon
Impasse de la Haute Malgrange, Heillecourt
Rue de l'Abbé Antoine à Gerbécourt-et-Haplemont
sept chemin des Angues
Rue Étienne Staub au numéro quinze
un rue du Hac, cinquante-quatre mille deux cent soixante Longuyon
vingt-six rue de Willermont, cinquante-quatre, cinq cent quarante, Pexonne
vingt-neuf rue Jean Villar, cinquante-quatre, cinq cent dix à Tomblaine
Rue Alphonse Fould, cinquante-quatre mille trois cent quarante Pompey
Boulevard Lobau, cinquante-quatre, zéro zéro zéro Nancy
Rue Lucien Galtier, Laneuveville-devant-Nancy
Rue des Pachenottes à Lucey
soixante-trois BIS rue Roger Bérin
Rue de la Sivrite au numéro un
six rue Ajam, cinquante-quatre mille cinq cent quatre-vingts Auboué
cinq rue Mangin, cinquante-quatre, quatre cent soixante-dix, Thiaucourt-Regniéville
huit rue des Behis, cinquante-quatre, huit cent quarante à Velaine-en-Haye
Chemin du Haut du Mont, cinquante-quatre mille deux cent dix Ville-en-Vermois
Allée du Semoir, cinquante-quatre, quatre cent vingt-cinq Pulnoy
Rue de Hablainville, Azerailles
Rue de Chenevières à Bénaménil
cinquante et un rue du Mézot
Rue du Rond Poirier au numéro huit
dix-sept impasse Jules Drach, cinquante-quatre mille sept cent dix Ludres
un résidence Les Chaumières, cinquante-quatre, deux cent quatre-vingts, Seichamps
vingt rue Baumont, cinquante-quatre, trois cents à Lunéville
Rue de Général Lhotte, cinquante-quatre mille trois cents Lunéville
Rue Vayringe, cinquante-quatre, zéro zéro zéro Nancy
Cours du Bas Château, Essey-lès-Nancy
Rue du Lotissement Perrot à Mangonville
cinq ruelle des Vélos
Impasse Louis de Bougainville au numéro vingt-neuf
vingt-huit boulevard du vingt-six e Régiment d'Infanterie, cinquante-quatre mille Nancy
huit rue de Manompré, cinquante-quatre, deux cent quatre-vingts, Seichamps
vingt-quatre rue du Brocard, cinquante-quatre, six cents à Villers-lès-Nancy
Rue de Hauts Jardins, cinquante-quatre mille cent dix Crévic
Rue du Général Vilmette, cinquante-quatre, trois cents Lunéville
Avenue de Léomont, Lunéville
Cours Raymond Poincaré à Toul
quarante-deux allée de l'Observatoire
Rue l'Anglisson au numéro onze
quatorze rue Émile Bernheim, cinquante-quatre mille cent treize Blénod-lès-Toul
un sentier Monseigneur, cinquante-quatre, deux cent trente, Neuves-Maisons
vingt-sept rue des Hours, cinquante-quatre, trois cents à Lunéville
Avenue Aimé Césaire, cinquante-quatre mille sept cent cinquante Trieux
Rue de Roubie, cinquante-quatre, cinq cent soixante-dix Foug
Rue Ernest Albert, Laxou
Avenue soixante-neuf Régiment d'Infanterie à Essey-lès-Nancy
vingt-neuf rue Genreau
Le Renclos au numéro six
trois rue Catherine Kuttinger, cinquante-quatre mille cent quatre-vingts Houdemont
dix BIS rue de Ravenne, cinquante-quatre, deux cent quarante, Jœuf
trente-quatre rue du Président John F. Kennedy, cinquante-quatre, sept cents à Pont-à-Mousson
Rue du Val de Fer, cinquante-quatre mille deux cent trente Neuves-Maisons
Rue du Carrelage, cinquante-quatre, cinq cent soixante-dix Foug
Chemin des Tuiliers, Faulx
Rue de Gerbéviller à Blainville-sur-l'Eau
huit avenue de la Providence
Rue Saint-Mansuy au numéro cinq
cent quarante cité de la Place, cinquante-quatre mille quatre cent quarante Herserange
vingt-sept rue René Caquard, cinquante-quatre, six cent vingt, Pierrepont
trente-cinq rue Les Acacias, cinquante-quatre, cent cinquante à Lantéfontaine
Rue Charency, cinquante-quatre mille deux cent soixante Villette
Rue Pierre Breton, cinquante-quatre, cent dix Dombasle-sur-Meurthe
Rue du Général Berniquet, Lunéville
Rue Albert Fabin à Pagney-derrière-Barine
vingt-trois avenue Patton
Rue Héléne au numéro trente et un
quatre rue de Vairine, cinquante-quatre mille sept cent vingt Lexy
sept rue Cités Saint-Charles, cinquante-quatre, cent quatre-vingt-dix, Villerupt
neuf rue du Chaud Four, cinquante-quatre, deux cent quatre-vingts à Velaine-sous-Amance
Rue du Pré Bailly, cinquante-quatre mille deux cent quatre-vingt-dix Bayon
Allée Le Noirval, cinquante-quatre, deux cent cinquante Champigneulles
Lotissement la Broquerie, Tiercelet
Rue du Catinat à Grand-Failly
trente-six rue sous Bermont
Lotissement Haut de Verrone au numéro quatre
trois cent trente-neuf rue du Général Séré de Rivières, cinquante-quatre mille deux cents Écrouves
douze rue Abbé Paul Varney, cinquante-quatre, sept cents, Norroy-lès-Pont-à-Mousson
sept rue de la Vervaux, cinquante-quatre, quatre cent vingt-cinq à Pulnoy
Rue du Petit Rosoir, cinquante-quatre mille deux cents Lagney
Rue du Haut de Bourgomay, cinquante-quatre, cent quarante Jarville-la-Malgrange
Rue Joseph Ferry, Villerupt
Rue de Laxou à Nancy
un allée Pontus de Tyard
Rue Alfred Renaudin au numéro trois
deux rue de Fresnois, cinquante-quatre mille huit cent soixante-dix Montigny-sur-Chiers
douze rue Anthime Bosment, cinquante-quatre, deux cent quarante, Jœuf
neuf BIS rue Fabvier, cinquante-quatre, sept cents à Pont-à-Mousson
Rue Docteur Chapuis, cinquante-quatre mille deux cents Toul
Rue des Nickles, cinquante-quatre, zéro zéro zéro Nancy
Rue du Château des Princes, Gondreville
Rue de la Mortagne à Laxou
six rue Mathieu un er
Rue Charles Oudille au numéro vingt-cinq
deux rue de la Haute Malgrange, cinquante-quatre mille cinq cents Vandœuvre-lès-Nancy
dix rue de l'Orée du Parc, cinquante-quatre, deux cents, Ménil-la-Tour
quatorze rue du Nideck, cinquante-quatre, quatre cent vingt-cinq à Pulnoy
Rue Saint-Thiébaut, cinquante-quatre mille Nancy
Rue du Thiam, cinquante-quatre, neuf cent soixante-dix Landres
Rue du Nayeux, Laneuveville-devant-Nancy
Rue des Frères Baillard à Saxon-Sion
trente-huit rue Aubrion
Rue Grandjacquot au numéro neuf
vingt-quatre rue Saint-Epvre, cinquante-quatre mille sept cents Blénod-lès-Pont-à-Mousson
vingt-neuf rue de Cumène, cinquante-quatre, deux cent trente, Neuves-Maisons
cent quarante-sept rue Gabriel Mouilleron, cinquante-quatre, zéro zéro zéro à Nancy
Rue Widric un er, cinquante-quatre mille six cents Villers-lès-Nancy
Avenue de la Moselle, cinquante-quatre, six cent soixante-dix Millery
Rue du Mal Foch, Hussigny-Godbrange
Place du Jeu de Quilles à Gondreville
seize rue Marc Raty
Rue du Général Mayer au numéro quarante et un
quarante-quatre rue des Evelottes, cinquante-quatre mille deux cent quatre-vingt-dix Bayon
vingt-huit avenue du Grémillon, cinquante-quatre, quatre cent vingt-cinq, Pulnoy
neuf chemin du Cheminot, cinquante-quatre, trois cents à Hériménil
Rue du Colonel Courtot de Cissey, cinquante-quatre mille Nancy
Lotissement Les Gémeaux, cinquante-quatre, cinq cent soixante-dix Foug
Allée James Moisson, Villers-lès-Nancy
Rue Le Breuil à Gorcy
quatorze rue du Fonteno
Rue Sainte-Pauline au numéro trente
quatre BIS rue Lantivy, cinquante-quatre mille deux cents Royaumeix
seize BIS rue du Chanoine Rolin, cinquante-quatre, deux cent quatre-vingts, Champenoux
vingt et un rue du Docteur Stern, cinquante-quatre, cent cinquante à Briey
Rue de Rozelieures, cinquante-quatre mille trois cents Lunéville
Route de Landécourt, cinquante-quatre, trois cent soixante Damelevières
Rue de Graffigny, Lunéville
Rue de Buttel à Essey-lès-Nancy
soixante-quatorze rue Sainte-Consuelo
Rue de Vic au numéro vingt et un
douze rue Jean Deschamps, cinquante-quatre mille cinq cent cinquante Pont-Saint-Vincent
quarante-deux allée des Berdaines, cinquante-quatre, cinq cent vingt, Laxou
dix-neuf rue des Rays, cinquante-quatre, trois cent quatre-vingt-dix à Frouard
Clos de Brétise, cinquante-quatre mille cent quatre-vingt-dix Bréhain-la-Ville
Route de Jaulny, cinquante-quatre, quatre cent soixante-dix Xammes
Rue Froville, Bezange-la-Grande
Rue du Puisot à Neuves-Maisons
vingt et un allée de l'Othain
Rue des Bas Fourneaux au numéro huit
sept route Division Leclerc, cinquante-quatre mille cent vingt-deux Chenevières
cinq avenue du deux e Bataillon de Chasseurs à Pied, cinquante-quatre, trois cents, Lunéville
vingt-quatre chemin des Marcaires, cinquante-quatre, huit cents à Jarny
Rue Eugène Bastien, cinquante-quatre mille deux cent quarante Jœuf
Chemin d'Alba, cinquante-quatre, deux cent dix Saint-Nicolas-de-Port
Rue de Lamelin Pré, Vaudigny
Rue Pierre Sépulchre à Homécourt
vingt-trois rue de Bléhors
Chemin du Fey au numéro cinq
cinq route de Sivry, cinquante-quatre mille six cent dix Belleau
cent quatre-vingts rue de Goprez, cinquante-quatre, deux cent quarante, Jœuf
cinq rue Adhémar de Monteil, cinquante-quatre, cent vingt à Baccarat
Rue du Trébois, cinquante-quatre mille quatre cent quatre-vingt-dix Piennes
Rue de Domèvre, cinquante-quatre, quatre cent cinquante Verdenal
Rue du Noroi, Lagney
Les Allées d'Arc à Art-sur-Meurthe
vingt-neuf rue du Colonel Grandval
Rue Coquibut au numéro vingt-six
vingt-huit rue du Chanoine Boulanger, cinquante-quatre mille deux cent vingt Malzéville
dix BIS rue Pershing, cinquante-quatre, quatre cents, Longwy
vingt-neuf rue du Docteur Sencert, cinquante-quatre, cent vingt-trois à Viterne
Rue Antoine Sabouret, cinquante-quatre mille trois cent dix Homécourt
Impasse Marconnet, cinquante-quatre, cinq cent quatre-vingts Auboué
Avenue Louis Adt, Jeandelaincourt
Rue des Bélémnites à Seichamps
vingt-sept rue Margaine
Rue des Meys Hallats au numéro quinze
trente-neuf chemin du Rupt des Neaux, cinquante-quatre mille cent trente-quatre Voinémont
vingt et un rue Docteur Schneider, cinquante-quatre, cinq cent soixante-dix, Foug
quarante rue Molitor, cinquante-quatre, zéro zéro zéro à Nancy
Place Xavier Roger, cinquante-quatre mille cinq cent quatre-vingts Auboué
Rue Charles Keller, cinquante-quatre, zéro zéro zéro Nancy
Rue Jameray-Duval, Lunéville
Lotissement Clos du Château à Jolivet
cinq cent soixante-douze aux Clautes
Boulevard d'Haussonville au numéro cent seize
trois square Chagall, cinquante-quatre mille six cents Villers-lès-Nancy
six route d'Agincourt, cinquante-quatre, deux cent soixante-dix, Essey-lès-Nancy
seize rue de Méville, cinquante-quatre, huit cent quatre-vingt-dix à Bayonville-sur-Mad
Allée du Président Kennedy, cinquante-quatre mille deux cents Toul
Rue de la Chavée, cinquante-quatre, trois cent quatre-vingts Dieulouard
Rue de l'Abbé Gridel, Nancy
Rue du Colonel Thiébaut à Rosières-aux-Salines
huit rue Bastien-Lepage
Rue Georges Berger au numéro trois
quatre allée de Menonchamp, cinquante-quatre mille huit cents Jarny
un place du Foyer Culturel, cinquante-quatre, cent soixante, Pulligny
cinquante-sept la Haye du Chemin, cinquante-quatre, huit cent quarante à Velaine-en-Haye
Rue des Victimes du Nazisme, cinquante-quatre mille huit cent dix Longlaville
Avenue de la Chartreuse, cinquante-quatre, cinq cent dix Art-sur-Meurthe
Rue du Royat, Ugny
Rue Édouard Fenal à Badonviller
cent seize rue du Maréchal Oudinot
Rue Émile Marchal au numéro vingt-huit
huit rue Antonin Daum, cinquante-quatre mille six cent quatre-vingt-dix Lay-Saint-Christophe
huit rue des Entonnoirs, cinquante-quatre, quatre cent cinquante, Leintrey
trois allée de Clervaux, cinquante-quatre, cinq cents à Vandœuvre-lès-Nancy
Avenue Jean-Baptiste Diedler, cinquante-quatre mille cinq cent quarante Badonviller
Rue Eugène Hugo, cinquante-quatre, zéro zéro zéro Nancy
Rue Mathias Piermantier, Hussigny-Godbrange
Rue René Wind à Lay-Saint-Christophe
cinq rue de Landrivaux
Les Hameaux de Mance au numéro quatre
vingt et un rue Alfred Mézières, cinquante-quatre mille trois cent cinquante Mont-Saint-Martin
trente et un BIS avenue de Gerbéviller, cinquante-quatre, trois cents, Lunéville
cinq rue des Fléoles, cinquante-quatre, deux cent quatre-vingts à Seichamps
Rue du Colonel Brau, cinquante-quatre mille cent dix Dombasle-sur-Meurthe
Rue des Grouantes, cinquante-quatre, sept cent soixante-dix Bouxières-aux-Chênes
Rue de Sous Vignal, Liverdun
Rue Bel Azur à Valleroy
dix-neuf rue du Chaveau
Avenue du Colonel la Horie au numéro dix-huit
trois rue du Docteur Liébault, cinquante-quatre mille Nancy
trois route de Bezaumont, cinquante-quatre, sept cents, Sainte-Geneviève
quarante-six rue du Maréchal Gérard, cinquante-quatre, zéro zéro zéro à Nancy
Lotissement la Croisette, cinquante-quatre mille cent vingt-deux Azerailles
Impasse Jacques Lacan, cinquante-quatre, sept cents Blénod-lès-Pont-à-Mousson
Chemin de Franchemare, Écrouves
Rue de Mad à Arnaville
cinq rue Le Clos du Moulin
Rue de la Huilière au numéro trente-deux
quarante-trois rue Oscar d'Adelsward, cinquante-quatre mille quatre cents Longwy
sept rue du Champ Laura, cinquante-quatre, trois cent dix, Homécourt
cent quatre-vingt-quinze rue du seize e BCP, cinquante-quatre, deux cents à Écrouves
Rue du vingt-six e Bataillon de Chasseurs à Pied, cinquante-quatre mille sept cents Pont-à-Mousson
Rue de Mont-sur-Meurthe, cinquante-quatre, trois cent soixante Blainville-sur-l'Eau
Rue Benoît Picard, Toul
Rue du Père Hilarion à Pont-à-Mousson
deux rue Christian Pfister
Rue du Haut Mérite au numéro soixante-dix-sept
dix-huit rue de la Mauchére, cinquante-quatre mille six cent soixante-dix Malleloy
trente-sept rue des Cristalleries, cinquante-quatre, cent douze, Vannes-le-Châtel
vingt-trois BIS route de Baccarat, cinquante-quatre, deux cent quatre-vingt-dix à Bayon
Route d'Éply, cinquante-quatre mille six cent dix Nomeny
Route de Voirincourt, cinquante-quatre, deux cent quatre-vingts Seichamps
Rue de l'Eau Salée, Crézilles
Avenue de Lachapelle à Baccarat
quarante-cinq rue François-Émile Babeuf
Rue Eugène Vicaire au numéro dix-neuf
vingt-huit rue Eugène de Diétrich, cinquante-quatre mille trois cents Lunéville
cinq rue Paul Thomas, cinquante-quatre, six cent quatre-vingt-dix, Lay-Saint-Christophe
quatorze rue de la Bellevue, cinquante-quatre, trois cent quatre-vingt-cinq à Manonville
Route de Saffais, cinquante-quatre mille trois cent soixante Barbonville
A La Croix de Mission, cinquante-quatre, cinq cent quarante Badonviller
Rue Fontenoy, Art-sur-Meurthe
Cottage du Rianois à Chanteheux
un rue Dominique George
Rue du Capitaine Cochin au numéro trois cent trente et un
sept allée de la Sambre, cinquante-quatre mille huit cent soixante Haucourt-Moulaine
