Rue des Jardins de Golène, quarante-quatre mille cent quinze Haute-Goulaine
Rue de la Vincee, quarante-quatre, huit cent soixante Pont-Saint-Martin
Rue de la Noé de l'Épinette, Vertou
Chemin de la Culette à Saint-Brevin-les-Pins
deux place du Prieuré Saint-Pierre
Allée Pluton au numéro quatre
un chemin de la Noë des Pastis, quarante-quatre mille cent vingt Vertou
dix rue du Recteur Jacques Thobie, quarante-quatre, huit cent cinquante, Le Cellier
quatre rue Frederic Engels, quarante-quatre, six cents à Saint-Nazaire
Rue de la Courtilletais, quarante-quatre mille sept cent quatre-vingts Missillac
Rue Charyau, quarante-quatre, zéro zéro zéro Nantes
Allée du Père Jean Clouet, La Chapelle-sur-Erdre
Rue de l'Étang du Doucet à Orvault
quatre rue Monteauciel
Boulevard Joseph Houssais au numéro dix
onze avenue de la Grive, quarante-quatre mille Nantes
dix rue du Fief Prieur, quarante-quatre, cent dix-huit, La Chevrolière
cinq rue d'Aigrefeuille, quarante-quatre, cent quarante à La Planche
Allée des Pierres Rousses, quarante-quatre mille trois cent vingt Arthon-en-Retz
Route de la Mouchetière, quarante-quatre, trois cent dix Saint-Colomban
Rue de la Flamme Olympique, Pont-Saint-Martin
Route des Aubinais à Saint-Nazaire
vingt-trois rue de l'Oisilière
La Noé Guy au numéro trente
trois rue Mathilde Verne, quarante-quatre mille quatre cent soixante-dix Mauves-sur-Loire
dix rue du Général Bedeau, quarante-quatre, cent vingt, Vertou
cent trente-six rue de la Classerie, quarante-quatre, quatre cents à Rezé
Chemin de la Croix du Pin, quarante-quatre mille cinq cent cinquante Saint-Malo-de-Guersac
Chavagne, quarante-quatre, trois cent quatre-vingt-dix Nort-sur-Erdre
Rue de Legé, Rezé
Rue Bonnetable à Orvault
huit rue de la Cité de Carfort
Rue Léon Jost au numéro soixante-trois
trois route du Taillis des Landes, quarante-quatre mille huit cent soixante Saint-Aignan-Grandlieu
deux rue de la Croix du Jeu, quarante-quatre, cent soixante, Crossac
quarante-neuf boulevard de Linz, quarante-quatre, deux cent dix à Pornic
Le Bas-Rouvray, quarante-quatre mille quatre cent quarante Joué-sur-Erdre
Rue de la Couillauderie, quarante-quatre, trois cent quarante Bouguenais
Passage de Briord, Port-Saint-Père
Avenue Georges Simenon à Nantes
soixante-quatre quai Émile Cormerais
Boulevard Louis Millet au numéro cinq
vingt-quatre rue du Chapeau aux Moines, quarante-quatre mille deux cent soixante La Chapelle-Launay
cent cinquante-sept route de Bernudet, quarante-quatre, quatre cent vingt, Piriac-sur-Mer
cinq avenue du Bois Cheneau, quarante-quatre, quatre cent trente au Loroux-Bottereau
Allée de Loctudy, quarante-quatre mille Nantes
Impasse du Champ Briant, quarante-quatre, huit cent cinquante Le Cellier
Avenue de Frémeur, Nantes
Rue du Bran à Crossac
deux impasse de la Noë Rocard
Chemin de Choisel au numéro onze
cinq rue jules Massenet, quarante-quatre mille six cents Saint-Nazaire
quatre BIS chemin de la Vigne Goda, quarante-quatre, cinq cents, La Baule-Escoublac
sept rue de la Grange à l'Abbé, quarante-quatre, cent quarante à Geneston
Allée de l'Île de la Boissonnerie, quarante-quatre mille six cents Saint-Nazaire
Rue Herman Melville, quarante-quatre, quatre cents Rezé
Avenue Guillon, Nantes
Rue de l'Orcerie à Vertou
vingt rue des Aigues Marines
Rue Constant Pallard au numéro six BIS
quarante-trois route de Redon, quarante-quatre mille deux cent quatre-vingt-dix Guémené-Penfao
trente-quatre rue des Six Aqueducs, quarante-quatre, zéro zéro zéro, Nantes
vingt-cinq rue du Chêne Creux, quarante-quatre, quatre cents à Rezé
La Blanchetière, quarante-quatre mille trois cent quatre-vingt-dix Nort-sur-Erdre
Impasse du Petit Pas, quarante-quatre, cent dix-huit La Chevrolière
Rue René Urien, Ancenis
Chemin du Haut Landreau à Nantes
onze rue de la Haute Nobilière
Rue Théodore Gericault au numéro quatre
cinq cent quarante et un route de Kélarin, quarante-quatre mille quatre cent vingt Piriac-sur-Mer
vingt rue Jean de Landevennec, quarante-quatre, sept cent quarante, Batz-sur-Mer
quarante-quatre rue Saint-Victorien, quarante-quatre, cent dix à Châteaubriant
Promenade Europa, quarante-quatre mille Nantes
Rue de la Benatière, quarante-quatre, deux cent quarante Sucé-sur-Erdre
Avenue de la Porte des Sables, La Plaine-sur-Mer
Impasse du Blutoir à Pornic
vingt-six avenue Guitteny
Rue des Landes Mortron au numéro deux
dix allée Eugénie Grandet, quarante-quatre mille Nantes
cent quatre-vingts chemin de l'Arceau, quarante-quatre, sept cent cinquante, Campbon
douze allée des Panetons, quarante-quatre, deux cent quarante à La Chapelle-sur-Erdre
Petit Chemin de la Gaudinière, quarante-quatre mille Nantes
Rue de l'Harlo, quarante-quatre, quatre cent dix La Chapelle-des-Marais
Rue des Capitaines de Clerville, Nantes
Route de l'Orionnière à Saint-Philbert-de-Grand-Lieu
deux rue du Docteur Van Der Stappen
Rue des Rouches au numéro trois
quatre les Auberdières, quarante-quatre mille quatre cent quarante Joué-sur-Erdre
deux cent cinquante-quatre rue des Gastinelleries, quarante-quatre, cent cinquante, Saint-Géréon
huit avenue Michel Lecointre, quarante-quatre, zéro zéro zéro à Nantes
Rue du Pré Vincent, quarante-quatre mille sept cent soixante Les Moutiers-en-Retz
Les Bois de Bosseterre, quarante-quatre, cent dix-sept Saint-André-des-Eaux
Rue René Giraud, Blain
Rue de la Chaudronnerie au Croisic
trente-cinq route de la Chapelle-Heulin
Avenue Julien Grellier au numéro douze
dix boulevard Mendès France, quarante-quatre mille sept cents Orvault
sept impasse du Moulin de la Touche, quarante-quatre, deux cent quarante, Sucé-sur-Erdre
deux impasse Orson Welles, quarante-quatre, trois cent quarante à Bouguenais
Allée de la Musique, quarante-quatre mille huit cents Saint-Herblain
Chemin du Clou, quarante-quatre, trois cent soixante-dix La Chapelle-Saint-Sauveur
Rue du Chapeau Laudier, Vertou
Avenue des Gentilshommes à Nantes
douze rue du Clos de la Chapellerie
Rue de l'Ouche Quinet au numéro cinquante et un
neuf avenue du Professeur Thiroloix, quarante-quatre mille cinq cents La Baule-Escoublac
cinq avenue de la Salamandre, quarante-quatre, zéro zéro zéro, Nantes
cent vingt-cinq rue de la Vieille Saulze, quarante-quatre, quatre cent dix à La Chapelle-des-Marais
Rue de la Colétrie, quarante-quatre mille Nantes
Chemin Bleu, quarante-quatre, quatre cents Rezé
Rue du Sergent Thierry, Saint-Sébastien-sur-Loire
Avenue Louis Clément à Piriac-sur-Mer
six chemin de Houssa
Avenue de Pavie au numéro huit
neuf passage Félibien, quarante-quatre mille Nantes
un rue d'Herbauges, quarante-quatre, huit cent soixante, Pont-Saint-Martin
un chemin du Tourland, quarante-quatre, quatre cent dix à Assérac
Allée Georges Bénezet, quarante-quatre mille quatre cents Rezé
La Belletière, quarante-quatre, trois cent quatre-vingt-dix Nort-sur-Erdre
Passage de la Plée, Basse-Goulaine
Boulevard Paul Chabas à Nantes
quatre rue du Moulin des Rochettes
Rue Émile Gadeceau au numéro huit
cinquante-six boulevard Professeur René Auvigné, quarante-quatre mille Nantes
douze allée du Québec, quarante-quatre, deux cent quarante, La Chapelle-sur-Erdre
neuf allée Jules Vallès, quarante-quatre, huit cents à Saint-Herblain
Rue de la Redollerie, quarante-quatre mille cent dix-huit La Chevrolière
Rue de la Bléterie, quarante-quatre, zéro zéro zéro Nantes
Rue Georges Éveillard, Nantes
Route Kescoul à Guérande
sept allée du Lay
Rue de Certé au numéro cinquante-sept
dix-neuf rue La Nouë Bras de Fer, quarante-quatre mille Nantes
sept rue de Calliope, quarante-quatre, deux cent trente, Saint-Sébastien-sur-Loire
deux impasse de la Nicolière, quarante-quatre, trois cent vingt à Saint-Père-en-Retz
Rue du Traict, quarante-quatre mille quatre cent quatre-vingt-dix Le Croisic
Rue du Moëllo, quarante-quatre, quatre cent vingt Mesquer
Rue de la Vallée du Havre, Couffé
Le Pont du Plessis à Nort-sur-Erdre
soixante-treize rue du Bêle
Route des Roseaux au numéro deux BIS
quinze square Benoit Frachon, quarante-quatre mille trois cent quarante Bouguenais
onze impasse du Chêne Creux, quarante-quatre, quatre cents, Rezé
vingt-deux avenue de Langeais, quarante-quatre, huit cents à Saint-Herblain
Rue de la Villardière, quarante-quatre mille sept cent soixante La Bernerie-en-Retz
Rue Moquechien, quarante-quatre, zéro zéro zéro Nantes
Rue Chanoine Poupard, Nantes
Boulevard Gaston Doumergue à Nantes
vingt-deux rue de Passay
Avenue de Beauval au numéro vingt-deux
trente-huit rue Auguste Pasgrimaud, quarante-quatre mille cent soixante-dix La Grigonnais
quinze rue des Bel-Air, quarante-quatre, deux cent soixante-dix, La Marne
dix-neuf rue de la Tournière, quarante-quatre, quatre cent soixante-dix à Carquefou
Place Édouard Normand, quarante-quatre mille Nantes
Bazilleul, quarante-quatre, trois cent quatre-vingt-dix Nort-sur-Erdre
Impasse de la Papine, Saint-Philbert-de-Grand-Lieu
Avenue Paul Gaugin à Pontchâteau
vingt-quatre rue Sean Mac Bride
Rue Hervé Rielle au numéro un
cinq rue de la Bareille, quarante-quatre mille cent vingt Vertou
trente avenue du Corps de Garde, quarante-quatre, sept cent trente, Saint-Michel-Chef-Chef
quinze route de la Beauvaiserie, quarante-quatre, huit cent soixante à Saint-Aignan-Grandlieu
Allée du Parc Fontaine, quarante-quatre mille six cents Saint-Nazaire
Rue du Haut Landreau, quarante-quatre, quatre cents Rezé
Rue du Commun de la Motte, Erbray
Rue John Dos Passos à Brains
trente-cinq rue de la Thuilière
Rue de la Briancière au numéro sept
seize impasse de Houat, quarante-quatre mille huit cent cinquante Ligné
trente-neuf rue de la Bosse du Moulin, quarante-quatre, cent soixante, Pontchâteau
quatre allée de Saint-Saëns, quarante-quatre, deux cent trente à Saint-Sébastien-sur-Loire
La Peignerie, quarante-quatre mille quatre cent quarante Riaillé
Rue de la Cassardière, quarante-quatre, cent quinze Basse-Goulaine
Les Trois Chemins, Saffré
Rue Colette Magny à Nantes
un rue des Crollières de Kerozan
Chemin de la Chicaudière au numéro vingt-huit
deux impasse de la Dominique, quarante-quatre mille quatre cent soixante-dix Carquefou
six avenue de la Favrie, quarante-quatre, huit cents, Saint-Herblain
quatre-vingt-quatorze rue Georges Berthomé, quarante-quatre, quatre cents à Rezé
Impasse de l'Ouche Organd, quarante-quatre mille trois cent trente La Chapelle-Heulin
Rue de la Bellangeraie, quarante-quatre, cinq cent vingt-deux Mésanger
Impasse du Pré de Kerignon, Guérande
Rue du Bois d'Anjou à Saint-Sébastien-sur-Loire
cinquante chemin de Porcé
Route d'Errand au numéro trois
onze rue de la Coutrie, quarante-quatre mille cinq cent vingt Issé
trois rue de l'Aveneau, quarante-quatre, deux cent quarante, La Chapelle-sur-Erdre
cinq avenue de la Métrie, quarante-quatre, cent vingt à Vertou
Route de Saint-Lumine de Clisson, quarante-quatre mille cent quatre-vingt-dix Clisson
Allée de Belle-Île, quarante-quatre, deux cent vingt Couëron
Rue du Clos Bourneau, Bouguenais
Route de la Hillière à Thouaré-sur-Loire
neuf place Alexandre Plancher
Route du Cougou au numéro dix-neuf
cinquante-quatre rue Albert Vinçon, quarante-quatre mille cinq cent soixante-dix Trignac
neuf rue Georges Chartrin, quarante-quatre, zéro zéro zéro, Nantes
vingt-cinq rue de la Mouzinais, quarante-quatre, sept cent quatre-vingts à Missillac
Impasse Ferdinand Magellan, quarante-quatre mille quatre cent soixante-dix Thouaré-sur-Loire
Chemin de la Nouette, quarante-quatre, cent dix-neuf Treillières
Rue des Roches Rouges, Les Moutiers-en-Retz
Rue Éloi Guitteny à Saint-Hilaire-de-Chaléons
vingt-quatre allée de la Calypso
Rue de l'Abbé Cotteux au numéro cinq D
quatre avenue Marcel Thil, quarante-quatre mille Nantes
vingt rue Germaine Dulac, quarante-quatre, huit cent trente, Bouaye
soixante et onze chemin du Port Boyer, quarante-quatre, zéro zéro zéro à Nantes
Rue des Sapeurs, quarante-quatre mille trois cent soixante Vigneux-de-Bretagne
Allée de la Vignauderie, quarante-quatre, cent vingt Vertou
Avenue Charles-Henri de Cossé-Brissac, Saint-Mars-la-Jaille
Avenue de Léchet à Guérande
deux rue Véga
Avenue du Clos Jaunet au numéro trois
douze allée d'Altaïr, quarante-quatre mille deux cent cinquante Saint-Brevin-les-Pins
vingt et un rue du Plessis de la Musse, quarante-quatre, zéro zéro zéro, Nantes
un rue de la Bosselle, quarante-quatre, cent quarante à Remouillé
Rue de l'Île de Hoëdic, quarante-quatre mille neuf cent quatre-vingts Sainte-Luce-sur-Loire
Rue de la Cordionnais, quarante-quatre, cinq cent cinquante Montoir-de-Bretagne
Rue Arsène Leloup, Couëron
Allée des Bernardières à Pornic
vingt rue du Tenu
Allée de la Gergauderie au numéro un
quatre rue du Hameau de la Sérais, quarante-quatre mille deux cent soixante Savenay
onze boulevard Boulay Paty, quarante-quatre, zéro zéro zéro, Nantes
dix-huit avenue de la Prime, quarante-quatre, zéro zéro zéro à Nantes
Rue Maurice Daniel, quarante-quatre mille deux cent trente Saint-Sébastien-sur-Loire
Chemin des Vignes du Clos, quarante-quatre, six cents Saint-Nazaire
Rue de la Garlais, Derval
Rue Charles Chollet à Vertou
neuf BIS chemin de la Briandière
Chemin de la Préauté au numéro treize BIS
trente-sept route de la Dalonnerie, quarante-quatre mille sept cent trente Saint-Michel-Chef-Chef
cinq rue Emmanuel Templier, quarante-quatre, huit cent trente, Bouaye
trois place des Taillis, quarante-quatre, neuf cent quatre-vingts à Sainte-Luce-sur-Loire
Rue Pierre de Parscau du Plessis, quarante-quatre mille quatre cent quatre-vingts Donges
Rue Alfred Gernoux, quarante-quatre, cent dix Soudan
Rue Sébastien Vaillant, Nantes
Rue du Val du Don à Marsac-sur-Don
quatre avenue de la Botte
Rue Pierre de Marivaux au numéro cinq
cinq rue Désiré Colombe, quarante-quatre mille Nantes
un rue de La Loire, quarante-quatre, trois cent soixante, Cordemais
deux rue Alfred Rebelliau, quarante-quatre, zéro zéro zéro à Nantes
Rue du Clos de l'Orgerie, quarante-quatre mille huit cent trente Bouaye
Route de Trans, quarante-quatre, quatre cent quarante Riaillé
Impasse des Blins, Saint-Brevin-les-Pins
Impasse Belle Hautière à Saint-Nazaire
cent vingt-trois rue des Rugbymen
Rue Henri Fiollin au numéro dix-huit
douze allée le Trident, quarante-quatre mille cinq cents La Baule-Escoublac
cent douze rue de la Périnette, quarante-quatre, quatre cent quarante, Riaillé
quatorze BIS avenue de la Pouplinière, quarante-quatre, sept cent trente à Saint-Michel-Chef-Chef
Avenue Louis Ferrand, quarante-quatre mille deux cent cinquante Saint-Brevin-les-Pins
Allée des Linaigrettes, quarante-quatre, trois cent cinquante Guérande
Rue du Bois Haligan, Nantes
Rue du Lô à La Turballe
vingt avenue Gilbert Vaillant
Avenue du Pré de la Lande au numéro trente
neuf allée de Madame, quarante-quatre mille six cent trente Plessé
neuf chemin du Petit Quartier, quarante-quatre, trois cent vingt, Frossay
quarante-quatre rue de la Caillaudière, quarante-quatre, six cent quatre-vingt-dix à La Haie-Fouassière
Impasse du Chablais, quarante-quatre mille quatre cent soixante-dix Thouaré-sur-Loire
Résidence des Tilleuls Argentés, quarante-quatre, cinq cent vingt La Meilleraye-de-Bretagne
Rue du Patis Jars, Casson
Rue du Bois de Lagland à Saint-Herblain
treize chemin de l'Ecobut
Square de la Délivrance au numéro deux
vingt-quatre route de la Rogère, quarante-quatre mille deux cent dix Pornic
deux rue Christophe Ravilly, quarante-quatre, six cent dix, Indre
cent onze BIS route de la Grand'Ville, quarante-quatre, deux cent cinquante à Saint-Brevin-les-Pins
Rue Maurice Briand, quarante-quatre mille cent trente Le Gâvre
Rue de la Coralie, quarante-quatre, cinq cent soixante Paimbœuf
Allée du Bois Gautier, Paimbœuf
Rue Pierre Gicquiau à Saint-Herblain
deux impasse des Bruands
Rue de Melpomène au numéro onze
dix-neuf rue du Moulin de l'Herbray, quarante-quatre mille cent vingt Vertou
un avenue des Tropiques, quarante-quatre, zéro zéro zéro, Nantes
trois B avenue de la Close, quarante-quatre, zéro zéro zéro à Nantes
Rue de la Gascognais, quarante-quatre mille cent soixante Pontchâteau
Rue de Saint-Philbert, quarante-quatre, cent dix-huit La Chevrolière
Route du Treil, Machecoul
Rue de l'Ouche Grande à Saint-Sébastien-sur-Loire
douze rue de Chez Gâtin
Impasse des Orchestres au numéro huit BIS
quinze impasse du Val de Sèvre, quarante-quatre mille Nantes
un avenue de la Rochejaquelein, quarante-quatre, deux cent soixante-dix, Machecoul
trente-huit rue de la Haie d'Ancheteau, quarante-quatre, trois cent quarante à Bouguenais
Avenue Jacques Cassard, quarante-quatre mille deux cent cinquante Saint-Brevin-les-Pins
Rue de Kerloumet, quarante-quatre, quatre cent dix Saint-Lyphard
Rue de Kerjano, Saint-Lyphard
Rue du Pourpris à Orvault
onze rue du Bois des Faux
Chemin des Grenouillets au numéro neuf
vingt-sept rue de Madeira, quarante-quatre mille quatre cent soixante-dix Carquefou
quarante-neuf quai Albert Chassagne, quarante-quatre, cinq cent soixante, Paimbœuf
cinquante-cinq route du Mont Piron, quarante-quatre, cinq cent vingt et un à Oudon
Rue Mercure, quarante-quatre mille huit cents Saint-Herblain
Chemin des Violais, quarante-quatre, deux cent soixante La Chapelle-Launay
Avenue de Rambouillet, Saint-Herblain
Rue Notre-Dame la Blanche à Carquefou
vingt-neuf rue Joseph Tahet
Rue Jules Paressant au numéro quatorze
cinq rue du Couvent des Dames, quarante-quatre mille cent quatre-vingt-dix Clisson
un rue de la Divatte, quarante-quatre, quatre cent cinquante, Barbechat
trente-deux avenue des Renardières, quarante-quatre, sept cent trente à Saint-Michel-Chef-Chef
Rue Maisons Laffitte, quarante-quatre mille sept cents Orvault
Rue de la Barbonnerie, quarante-quatre, quatre cents Rezé
Place de l'Église de Méan, Saint-Nazaire
Rue des Mélisses à Batz-sur-Mer
huit rue de la Gringaudière
Impasse de la Hache au numéro deux
cinq rue Évariste Luminais, quarante-quatre mille Nantes
soixante et un avenue Watteau, quarante-quatre, cent vingt, Vertou
vingt-deux route de Brandu, quarante-quatre, quatre cent vingt à Piriac-sur-Mer
Impasse Gagnerie des Guittières, quarante-quatre mille trois cent dix Saint-Philbert-de-Grand-Lieu
Route de la Grande Haie, quarante-quatre, cent dix-neuf Grandchamp-des-Fontaines
Rue Colette Audry, Nantes
Rue Chauvin de La Musse à Saint-Étienne-de-Montluc
vingt-deux A avenue Villès Chevissens
Rue Thomas-Maisonneuve au numéro huit
deux avenue Christian Doppler, quarante-quatre mille Nantes
un allée du Clos Oral, quarante-quatre, trois cent quatre-vingts, Pornichet
sept rue de l'Épeau, quarante-quatre, quatre cent soixante-dix à Carquefou
Rue Abbé Chauvin, quarante-quatre mille six cent vingt La Montagne
Place du Chanoine Thomas, quarante-quatre, cent soixante-dix La Grigonnais
Chemin des Prés Carriaux, Guérande
Rue du Puits Bougreau à Haute-Goulaine
un rue de la Courte Baille
Chemin de la Turbannière au numéro six
trente et un rue de la Lavanderie, quarante-quatre mille cinq cent vingt et un Oudon
vingt impasse de l'Ondain, quarante-quatre, trois cent quarante, Bouguenais
trois rue de Prétoria, quarante-quatre, zéro zéro zéro à Nantes
Rue du Paraguay, quarante-quatre mille Nantes
Rue des Sergenteries, quarante-quatre, cent quarante Montbert
Rue des Chataigneraies, Crossac
Route de la Hubonnière à Sautron
cinq rue des Ricorneaux
Rue du Ropanné au numéro cinq
treize rue du Barillet, quarante-quatre mille sept cent soixante-dix Préfailles
quarante-trois rue de Chateaulin, quarante-quatre, zéro zéro zéro, Nantes
deux rue du Capitaine Dauce, quarante-quatre, six cents à Saint-Nazaire
La Basse Rue, quarante-quatre mille cent quarante Le Bignon
Allée des Spatules Blanches, quarante-quatre, huit cent soixante Pont-Saint-Martin
Chemin du Vranel, Mesquer
Rue des Quatre Peupliers à Clisson
douze B rue du Tertre Buchelier
Rue du Grolier au numéro vingt-cinq
un rue de la Baillourie, quarante-quatre mille quatre cents Rezé
vingt-neuf rue de Malville, quarante-quatre, zéro zéro zéro, Nantes
trois avenue des Aquarelles, quarante-quatre, zéro zéro zéro à Nantes
Avenue de l'Hôtel Dieu, quarante-quatre mille Nantes
Rue du Cheval de Troie, quarante-quatre, trois cent quarante Bouguenais
Allée du Clos Saint-Yves, Les Moutiers-en-Retz
Rue de l'Île Chaland à Basse-Goulaine
huit avenue de la Mésange
Rue Christiane Cabalé au numéro six
six impasse du Schiste, quarante-quatre mille trois cent soixante Vigneux-de-Bretagne
treize avenue Beethoven, quarante-quatre, trois cent trente, Vallet
cent treize B route de Gachet, quarante-quatre, zéro zéro zéro à Nantes
Rue de Saint-Samson, quarante-quatre mille trois cent soixante Cordemais
Rue de la Mainguais, quarante-quatre, quatre cent soixante-dix Carquefou
Chemin du Moulin du Breuil, Brains
Quai Leray à Pornic
six avenue de Charette
Rue Pinsoison au numéro vingt-deux
trois rue Pierre Magnol, quarante-quatre mille Nantes
vingt avenue de l'Étrier, quarante-quatre, zéro zéro zéro, Nantes
huit square des Noisetiers, quarante-quatre, deux cent quarante à La Chapelle-sur-Erdre
Rue Eugène Cornet, quarante-quatre mille six cents Saint-Nazaire
Avenue de la Jeunesse, quarante-quatre, sept cents Orvault
Rue des Folies Chaillou, Nantes
Place de la Hervetière à La Bernerie-en-Retz
un allée de la Filée
Rue Jean Baptiste Legeay au numéro six
huit rue du Carteron, quarante-quatre mille quatre cent soixante-dix Mauves-sur-Loire
deux rue de l'Audionnerie, quarante-neuf, cent vingt-trois, Le Fresne-sur-Loire
sept mille cent quatorze rue du Pré Govelin, quarante-quatre, quatre cent dix à Herbignac
La Régeserie, quarante-quatre mille cinq cent vingt-deux Pouillé-les-Côteaux
Rue du Honduras, quarante-quatre, zéro zéro zéro Nantes
Rue des Champs du Pin, Teillé
Avenue Père Bretaudeau à Nantes
douze avenue Casimir Périer
Route Clos de la Ville Rouello au numéro treize
quatorze BIS rue Honoré de Mirabeau, quarante-quatre mille six cents Saint-Nazaire
trente et un avenue de l'Eperonnière, quarante-quatre, zéro zéro zéro, Nantes
dix rue des Boucaniers, quarante-quatre, quatre cent soixante-dix à Thouaré-sur-Loire
Impasse du Bas Cormier, quarante-quatre mille sept cents Orvault
Chemin du Parc à Bas Bleus, quarante-quatre, trois cent quatre-vingts Pornichet
Rue de la Cadranière, Carquefou
Avenue Claude Kogan à Nantes
cinq rue du Brévent
Avenue Colonac au numéro treize
quarante lotissement de Treiz Gwen, quarante-quatre mille quatre cent dix Assérac
cinq rue des Setters, quarante-quatre, zéro zéro zéro, Nantes
douze allée des Jardins d'Adèle, quarante-quatre, neuf cent quatre-vingts à Sainte-Luce-sur-Loire
Impasse de la Claverière, quarante-quatre mille quatre cent soixante-dix Carquefou
Allée du Boivre, quarante-quatre, deux cent cinquante Saint-Brevin-les-Pins
Rue Jules Spal, Couëron
Square de Wexford à Couëron
quatre rue Stadtoldendorf
Rue de la Haute Forêt au numéro dix-huit
quatre rue Anselme Fleury, quarante-quatre mille deux cent quarante La Chapelle-sur-Erdre
deux cent soixante-neuf route de Saint-Herblon, quarante-quatre, cent cinquante, Anetz
huit B rue Émile Péhant, quarante-quatre, zéro zéro zéro à Nantes
Rue de Plantive, quarante-quatre mille sept cent soixante Les Moutiers-en-Retz
Passage de la Ricohie, quarante-quatre, cent dix-sept Saint-André-des-Eaux
Ruelle des Néfliers, Haute-Goulaine
Chemin des Champs Guerriers à Moisdon-la-Rivière
vingt-neuf BIS avenue Villez-Davaud
Rue Georges Charrier au numéro douze
vingt-quatre route de la Villès-Blais, quarante-quatre mille trois cent quatre-vingts Pornichet
quatre venelle de La Clunais, quarante-quatre, trois cent soixante, Saint-Étienne-de-Montluc
dix-neuf allée du Béa, quarante-quatre, deux cent cinquante à Saint-Brevin-les-Pins
Rue du Moulin Rothard, quarante-quatre mille six cent quarante Saint-Jean-de-Boiseau
Rue Aimé Barthoulot, quarante-quatre, zéro zéro zéro Nantes
Rue de la Haute Mitrie, Nantes
Rue Sainte-Anne du Vigneau à Saint-Mars-de-Coutais
quatre impasse du Landas
Rue du Bois Giraud au numéro douze
six chemin du Rocher du Lion, quarante-quatre mille six cents Saint-Nazaire
vingt-trois rue des Ardillets, quarante-quatre, deux cent vingt, Couëron
quatre avenue Joseph Ravanel, quarante-quatre, zéro zéro zéro à Nantes
Rue de l'Emeu, quarante-quatre mille Nantes
Boulevard des Américains, quarante-quatre, zéro zéro zéro Nantes
Rue Charles Babin, Pornic
Rue des Glottins à Conquereuil
six rue de Kéroman mille sept cent quatre-vingt-six
Résidence de la Clémencière au numéro quinze
un rue du Vénézuela, quarante-quatre mille Nantes
dix rue Giton, quarante-quatre, zéro zéro zéro, Nantes
quatre-vingt-un boulevard Jean-Joseph de Cacqueray, quarante-quatre, cinq cents à La Baule-Escoublac
Rue Jean-Baptiste Canclaux, quarante-quatre mille quatre cents Rezé
Rue du Bois Monnet, quarante-quatre, quatre cent quarante Joué-sur-Erdre
Route de la Dolotière, La Plaine-sur-Mer
Rue de la Préverie à Fégréac
douze route de Bugale
Rue François Évellin au numéro un
quinze rue des Sableaux, quarante-quatre mille deux cent cinquante Saint-Brevin-les-Pins
sept rue Louis Gouy, quarante-quatre, cinq cent quatre-vingts, Bourgneuf-en-Retz
trois B avenue de la Citerne, quarante-quatre, zéro zéro zéro à Nantes
Rue Jean Gorin, quarante-quatre mille cent trente Blain
Rue Stéphenson, quarante-quatre, zéro zéro zéro Nantes
Rue du Petit Blottereau, Nantes
Place Don Bosco à Nantes
vingt-huit les Buffais
Route du Fort de l'Eve au numéro onze
deux cent sept la Landelle, quarante-quatre mille trois cent quatre-vingt-dix Saffré
quarante-neuf bourg-Chevreuil, quarante-quatre, quatre cent quarante, Riaillé
un place Paul-Émile Ladmirault, quarante-quatre, zéro zéro zéro à Nantes
Rue de Saint-Père en Retz, quarante-quatre mille trois cent vingt Chauvé
