neuf allée du Mont Cindre, soixante-neuf mille trois cents Caluire-et-Cuire
deux chemin du Bois de Longe, soixante-neuf, cinq cent soixante-dix, Dardilly
vingt-sept rue Élie Rochette, soixante-neuf, zéro zéro sept à Lyon
Passage Tolozan, soixante-neuf mille un Lyon
Rue de Fontanières, soixante-neuf, cent Villeurbanne
Rue de la Haute-Valois, Millery
Allée Thalie à Saint-Genis-Laval
treize chemin de l'Araire
Cours Tolstoï au numéro vingt-six
sept allée Joséphine Bardon, soixante-neuf mille trois cent dix Pierre-Bénite
mille quatre cent soixante-dix-neuf route de Theizé, soixante-neuf, quatre cents, Pouilly-le-Monial
cent vingt-huit avenue Lacassagne, soixante-neuf, zéro zéro trois à Lyon
Route de Anse, soixante-neuf mille quatre cent quatre-vingts Lucenay
Avenue de Montmartin, soixante-neuf, neuf cent soixante Corbas
Allée B des Santons, Sainte-Foy-lès-Lyon
Square Huguette Bois à Saint-Priest
vingt rue Tronchet
Passage Lamure au numéro onze
trente-six rue des Confins du Château, soixante-neuf mille sept cents Chassagny
douze rue Antoine Ferraud, soixante-neuf, deux cent vingt, Belleville
dix-neuf chemin de la Ferlatière, soixante-neuf, trois cent soixante-dix à Saint-Didier-au-Mont-d'Or
Rue des Deux Amants, soixante-neuf mille neuf Lyon
Rue Paul Huvelin, soixante-neuf, cent dix Sainte-Foy-lès-Lyon
Allée Françoise Buffeton, Dardilly
Rue du Château de la Duchère à Lyon
un place Camille Georges
Rue Loyson de Chastelus au numéro cinq cent trente et un
quatre rue Victor Subit, soixante-neuf mille cent Villeurbanne
soixante-quinze impasse du Suel, soixante-neuf, sept cents, Échalas
vingt-quatre rue Jacques Reynaud, soixante-neuf, huit cents à Saint-Priest
Allée de la Piscine, soixante-neuf mille cinq cent trente Brignais
Rue Cité de l'Abbé Pierre, soixante-neuf, huit cents Saint-Priest
Boulevard Castellane, Sathonay-Camp
Chemin de Revaison à Saint-Priest
un rue Maxime Lalouette
Rue Capitaine Julien au numéro mille un
neuf avenue Jean Moos, soixante-neuf mille cinq cent cinquante Amplepuis
quatre impasse du Docteur Pénard, soixante-neuf, six cent trente, Chaponost
trente-cinq rue Albert Falsan, soixante-neuf, zéro zéro neuf à Lyon
Chemin de Crépieux, soixante-neuf mille trois cents Caluire-et-Cuire
Rue des Frères Caudron, soixante-neuf, trois cent trente Meyzieu
Rue du Clos des Coquilles, Francheville
Rue Ferdinand Perrier à Saint-Priest
quatre mille cent vingt-sept route du Grisard
Rue Marcel Merieux au numéro soixante-douze D
cent soixante-douze montée des Tiers, soixante-neuf mille quatre cents Liergues
trente-six rue Marie Mas, soixante-neuf, sept cents, Givors
dix-sept rue René Chapard, soixante-neuf, six cent trente à Chaponost
Rue Édouard Rochet, soixante-neuf mille huit Lyon
Quai Docteur Gailleton, soixante-neuf, zéro zéro deux Lyon
Allée du Val de Serres, Dardilly
Rue Benoit Badoil à Chaponost
vingt et un rue Antoine Vacher
Route des Monts d'Or au numéro deux cent huit
six cent quatre-vingt-deux H route du Bas Privas, soixante-neuf mille trois cent quatre-vingt-dix Charly
cent quarante et un rue Joannès Sabot, soixante-neuf, quatre cents, Villefranche-sur-Saône
cent vingt-cinq rue d'Anse, soixante-neuf, quatre cents à Villefranche-sur-Saône
Route de la Vauxonne, soixante-neuf mille quatre cent soixante Saint-Étienne-des-Oullières
Rue des Rivetières, soixante-neuf, deux cent vingt Dracé
Rue Hippolyte Côte, Tarare
Rue Fulgencio Gimenez à Vaulx-en-Velin
cent cinquante-trois chemin d'Apinost
Route de Toussieu au numéro quatorze
cinq chemin de Tholomé, soixante-neuf mille neuf cent soixante-dix Chaponnay
cinq avenue de Réaumur, soixante-neuf, cent cinquante, Décines-Charpieu
vingt-quatre quai de Charézieux, soixante-neuf, deux cent soixante-dix à Saint-Romain-au-Mont-d'Or
Chemin du Vallombrey, soixante-neuf mille cent trente Écully
Rue Pierre Brunier, soixante-neuf, trois cents Caluire-et-Cuire
Rue Bonnefond, Givors
Allée du Baraillon à Tassin-la-Demi-Lune
douze allée des Marasquines
Rue des Côteaux du Lyonnais au numéro dix-sept
neuf chemin de Grévilly, soixante-neuf mille quatre cent quatre-vingt-dix Saint-Forgeux
trois cent soixante-neuf rue de la Garennière, soixante-neuf, quatre cent quarante, Mornant
huit cent quatre-vingt-sept route du Drevet, soixante-neuf, sept cents à Givors
Route de Riottier, soixante-neuf mille quatre cents Villefranche-sur-Saône
Rue Joseph Rimaud, soixante-neuf, cent trente Écully
Rue André Werth, Vaulx-en-Velin
Place Ambroise Courtois à Lyon
neuf rue Rachais
Rue des Usclards au numéro quinze
cent trente-quatre rue de Créqui, soixante-neuf mille six Lyon
un place de l'Oiselière, soixante-neuf, deux cent soixante, Charbonnières-les-Bains
quatre rue Communieu, soixante-neuf, zéro zéro neuf à Lyon
Rue de Bourgchanin, soixante-neuf mille deux cent cinquante Montanay
Route de Mornant, soixante-neuf, sept cents Givors
Rue Marino Simonetti, Décines-Charpieu
Avenue du Carreau à Meyzieu
un rue Jacques Peletier
Grande Rue de la Croix-Rousse au numéro cinquante-trois
trente-huit route du Col de la Luère, soixante-neuf mille deux cent quatre-vingt-dix Grézieu-la-Varenne
deux cent quatre-vingt-quatorze route de Genas, soixante-neuf, cinq cents, Bron
quinze rue Pétrequin, soixante-neuf, zéro zéro six à Lyon
Rue Bernadette Lafont, soixante-neuf mille huit cents Saint-Priest
Allée de la Croisée, soixante-neuf, sept cent soixante Limonest
Rue Louis Aulagne, Vénissieux
Impasse de la Timonière à Liergues
soixante-cinq rue Pierre Bonnaud
Rue Sébastien Gryphe au numéro vingt et un
sept cent cinquante-deux chemin de Bruyères, soixante-neuf mille six cent cinquante Quincieux
treize chemin du Michon, soixante-neuf, deux cent quatre-vingt-dix, Grézieu-la-Varenne
trois cent trente-trois rue Doyen Georges Chapas, soixante-neuf, zéro zéro neuf à Lyon
Rue Hippolyte Kahn, soixante-neuf mille cent Villeurbanne
Boulevard Irène Joliot-Curie, soixante-neuf, deux cents Vénissieux
Rue Jean-Pierre Brédy, Villeurbanne
Chemin de Paisy à Limonest
trente-cinq rue Louis Galvani
Lotissement Les Olivières au numéro dix-huit
cent vingt-deux rue Professeur Beauvisage, soixante-neuf mille huit Lyon
sept cent quatre-vingt-seize chemin de Barberet, soixante-neuf, sept cents, Givors
huit chemin du Vert Pre, soixante-neuf, cinq cent trente à Brignais
Chemin de Thulon, soixante-neuf mille quatre cent trente Lantignié
Chemin du Crapet, soixante-neuf, six cent quatre-vingt-dix Bessenay
Rue Étienne Richerand, Lyon
Rue François Mermet à Tassin-la-Demi-Lune
cinquante-six allée Arthur Honegger
Allée Victor Vermorel au numéro un
quatre rue du Garon, soixante-neuf mille cinq cent vingt Grigny
vingt-trois place Joanny Favre, soixante-neuf, cent vingt-quatre, Colombier-Saugnieu
onze route du Mont-Thou, soixante-neuf, deux cent soixante-dix à Saint-Romain-au-Mont-d'Or
Chemin Antoine Pardon, soixante-neuf mille cent soixante Tassin-la-Demi-Lune
Impasse Stéphane Coignet, soixante-neuf, zéro zéro huit Lyon
Rue de la Crappe, Saint-Symphorien-sur-Coise
Chemin de Germany à Mornant
dix allée Joseph Hours
Rue du Poizat au numéro un
cent soixante-quatorze avenue du Général Frère, soixante-neuf mille huit Lyon
quatre-vingt-dix-sept route des Monts du Lyonnais, soixante-neuf, cinq cent dix, Messimy
vingt-six rue Claude Jusseaud, soixante-neuf, cent dix à Sainte-Foy-lès-Lyon
Chemin du Baraillon, soixante-neuf mille cent soixante Tassin-la-Demi-Lune
Rue Léo et Maurice Trouilhet, soixante-neuf, zéro zéro huit Lyon
Allée des Olagniers, Saint-Pierre-de-Chandieu
Rue Marc Boegner à Lyon
trois route de Feyzin
Rue Louis Poly au numéro neuf
neuf cent quatre-vingt-deux chemin du Vallier, soixante-neuf mille six cent soixante-dix Vaugneray
vingt et un allée Jacques Audiberti, soixante-neuf, trois cent trente, Meyzieu
douze rue Hugues Guérin, soixante-neuf, zéro zéro huit à Lyon
Allée du Gaillot, soixante-neuf mille deux cent trente Saint-Genis-Laval
Chemin de Combe-Martin, soixante-neuf, trois cents Caluire-et-Cuire
Rue Vaubecour, Lyon
Rue Jean Duclos à Vénissieux
cent quatre-vingt-six route de Belleville
Rue du Professeur Joseph Nicolas au numéro cinquante-huit
deux chemin de la Résidence du Viard, soixante-neuf mille deux cent quatre-vingt-dix Craponne
sept place de la Ferrandière, soixante-neuf, zéro zéro trois, Lyon
vingt rue Antonin Perrin, soixante-neuf, cent à Villeurbanne
Rue Jean Voillot, soixante-neuf mille cent Villeurbanne
Chemin du Creuzet, soixante-neuf, deux cent cinquante Neuville-sur-Saône
Chemin du Pré Rond, Montagny
Montée des Forts à Caluire-et-Cuire
cent montée du Chevronnet
Rue François Polot au numéro cent trois
six rue Bissardon, soixante-neuf mille trois cents Caluire-et-Cuire
trente-quatre rue André Bollier, soixante-neuf, zéro zéro sept, Lyon
dix-neuf rue Marius Grosso, soixante-neuf, cent vingt à Vaulx-en-Velin
Rue Louis Juttet, soixante-neuf mille quatre cent dix Champagne-au-Mont-d'Or
Chemin de Parenty, soixante-neuf, deux cent cinquante Neuville-sur-Saône
Allée du Corbelet, Limonest
Rue Félissent à Lyon
sept cent douze rue de la Côte Rivère
Avenue Camille Rousset au numéro treize
huit impasse Pitiot, soixante-neuf mille huit Lyon
seize allée Entre Deux Bois, soixante-neuf, trois cent quatre-vingts, Lissieu
quatre montée Saint-Mayol, soixante-neuf, trois cent soixante à Ternay
Allée Linné, soixante-neuf mille cent dix Sainte-Foy-lès-Lyon
Rue Pierre Poizat, soixante-neuf, deux cent quarante Thizy-les-Bourgs
Impasse des Lyonnais, Cailloux-sur-Fontaines
Avenue de la Colombe à Grigny
quatorze BIS rue Claude Bador
Rue du vingt-quatre Avril mille neuf cent quinze au numéro seize
vingt-quatre rue Victor et Hélène Basch, soixante-neuf mille cent cinquante Décines-Charpieu
trois cent vingt-cinq chemin de Grand Val, soixante-neuf, trois cent quatre-vingts, Civrieux-d'Azergues
soixante-dix mail des Basses Barolles, soixante-neuf, deux cent trente à Saint-Genis-Laval
Allée Louis Durey, soixante-neuf mille trois cent dix Pierre-Bénite
Rue Lepêcheur, soixante-neuf, cent vingt Vaulx-en-Velin
Place de la Rhodiaceta, Lyon
Allée Chante-Alouette à Écully
dix-neuf chemin de Rochebozon
Chemin de Bellissen au numéro vingt-neuf
vingt-cinq chemin de la Rize, soixante-neuf mille cent cinquante Décines-Charpieu
cent soixante-quatre rue Pierre Valdo, soixante-neuf, zéro zéro cinq, Lyon
six allée Chanoz, soixante-neuf, cinq cent quatre-vingts à Sathonay-Camp
Rue Émile Decorps, soixante-neuf mille cent Villeurbanne
Route des Prolières, soixante-neuf, deux cent soixante-dix Cailloux-sur-Fontaines
Rue Maurice Ribaud, Chassieu
Rue Persoz à Villeurbanne
douze impasse Chomel
Rue du Lieutenant-Colonel Girard au numéro vingt-quatre
deux rue Jean-François Ligonnet, soixante-neuf mille sept cent vingt Saint-Bonnet-de-Mure
un BIS allée de Terre Longue, soixante-neuf, cent soixante, Tassin-la-Demi-Lune
trois avenue du Foyer Français, soixante-neuf, trois cent trente à Meyzieu
Impasse Colonel Lamy, soixante-neuf mille huit Lyon
Avenue Joannès Masset, soixante-neuf, zéro zéro neuf Lyon
Côte Pin, Saint-Cyr-au-Mont-d'Or
Place Charles Hernu à Villeurbanne
dix-huit rue Alphonse Rodet
Route des Collonges au numéro cent vingt-cinq
quatre allée du Tonnelier, soixante-neuf mille sept cent quatre-vingts Mions
treize B impasse de la Thibaude, soixante-neuf, cent vingt, Vaulx-en-Velin
trois impasse de Port Masson, soixante-neuf, six cent cinquante à Quincieux
Rue Fleury Jay, soixante-neuf mille cinq cent vingt Grigny
Place de Presberg, soixante-neuf, six cent vingt Oingt
Montée de la Chatelaine, Givors
Boulevard du Baron du Marais à Sainte-Foy-lès-Lyon
un chemin des Chanavaries
Chemin de Fond Rose au numéro quatre
sept BIS allée Longchêne, soixante-neuf mille deux cent trente Saint-Genis-Laval
trois cent soixante-quinze route des Brouilly, soixante-neuf, deux cent vingt, Saint-Lager
vingt et un allée des Monts d'Or, soixante-neuf, quatre cent dix à Champagne-au-Mont-d'Or
Chemin du Mathias, soixante-neuf mille sept cent soixante Limonest
Rue de Gondomar, soixante-neuf, trois cent vingt Feyzin
Chemin de la Thomassière, Saint-Didier-au-Mont-d'Or
Montée de la Croix Rousse à Sourcieux-les-Mines
quatre cent dix chemin des Combes et Feyssolières
Rue Victor Broizat au numéro vingt et un
dix rue Mangetemps, soixante-neuf mille sept cent quatre-vingts Mions
vingt rue de la Camille, soixante-neuf, six cents, Oullins
neuf chemin de la Berthaudière, soixante-neuf, cent cinquante à Décines-Charpieu
Avenue du Frêne, soixante-neuf mille neuf Lyon
Route de Favret, soixante-neuf, deux cent soixante-dix Cailloux-sur-Fontaines
Impasse Marcel Mérieux, Marcy-l'Étoile
Chemin du Baudy à Charbonnières-les-Bains
cent vingt-trois TER avenue Pierre Dumond
Rue Président Édouard Herriot au numéro vingt-sept
deux cent dix BIS route de Corbas, soixante-neuf mille trois cent soixante Saint-Symphorien-d'Ozon
cent soixante-treize route des Chères, soixante-neuf, quatre cent quatre-vingts, Morancé
dix rue Duviard, soixante-neuf, zéro zéro quatre à Lyon
Cours d'Herbouville, soixante-neuf mille quatre Lyon
Route des Ocques Rouges, soixante-neuf, trois cent quatre-vingts Saint-Jean-des-Vignes
Rue Baccot, L'Arbresle
Avenue Barthélémy Buyer à Lyon
quatre-vingt-un route de Vermont
Quai Julius et Ethel Rosenberg au numéro deux
cent seize allée des Fromentaux, soixante-neuf mille deux cent cinquante Montanay
neuf chemin du Trou du Chat, soixante-neuf, deux cent cinquante, Albigny-sur-Saône
cinquante-trois route Départementale trois cent quatre-vingt-six, soixante-neuf, cinq cent soixante à Sainte-Colombe
Rue Philibert Roussy, soixante-neuf mille quatre Lyon
Place Maurice Bariod, soixante-neuf, zéro zéro neuf Lyon
Rue Renée, Saint-Fons
Rue François Peissel à Caluire-et-Cuire
neuf rue de Bonnel
Allée du Moulin Barnoud au numéro cinquante-sept
quatre avenue Claude de la Colombière, soixante-neuf mille trois cent soixante Saint-Symphorien-d'Ozon
deux rue Mathieu Varille, soixante-neuf, zéro zéro sept, Lyon
quatre-vingt-dix-neuf mille neuf cent quatre-vingt-dix-neuf place Antoine Picard, soixante-neuf, sept cents à Givors
Allée du Rhône, soixante-neuf mille trois cent vingt Feyzin
Rue Pierre Baratin, soixante-neuf, cent Villeurbanne
Rue Fleury Neuvesel, Givors
Allée du Petit Velin à Vaulx-en-Velin
deux cent trente-deux chemin du Clos des Liesses
Avenue Édouard Payen au numéro sept
quatre-vingt-dix-neuf mille neuf cent quatre-vingt-dix-neuf rue Professeur Maurice Vallas, soixante-neuf mille quatre Lyon
quarante chemin du Bois de Serres, soixante-neuf, cinq cent soixante-dix, Dardilly
sept cents chemin des Mollières, soixante-neuf, deux cent dix à L'Arbresle
Rue Chambovet, soixante-neuf mille trois Lyon
Rue Eugène Fournière, soixante-neuf, cent Villeurbanne
Rue Jean-Baptiste Chopin, Lyon
Boulevard Lénine à Vénissieux
huit ancienne Route d'Heyrieux
Chemin de la Cotonnière au numéro quarante et un
quatorze avenue Roberto Rossellini, soixante-neuf mille cent Villeurbanne
quatre-vingt-un chemin de Crapon, soixante-neuf, trois cent soixante, Ternay
cinquante-quatre chemin de Putet, soixante-neuf, deux cent trente à Saint-Genis-Laval
Avenue Debrousse, soixante-neuf mille cinq Lyon
Route de Pollionnay, soixante-neuf, deux cent quatre-vingts Sainte-Consorce
Côte de la Gerine, Ampuis
Rue Jean-Michel Savigny à Villefranche-sur-Saône
onze rue Frère Benoît
Quai Joseph Gillet au numéro cinquante et un B
vingt-deux BIS rue de Boyer, soixante-neuf mille cent soixante Tassin-la-Demi-Lune
onze avenue Barthelemy Thimonnier, soixante-neuf, trois cents, Caluire-et-Cuire
trois cent soixante rue Henri Bouchard, soixante-neuf, deux cent soixante-dix à Rochetaillée-sur-Saône
Rue des Hauts de Givors, soixante-neuf mille sept cents Givors
Rue Michel Rambaud, soixante-neuf, zéro zéro six Lyon
Chemin Charles Lindbergh, Vaulx-en-Velin
Rue de Fontbonne à La Tour-de-Salvagny
trente-deux rue Champ Dolin
Rue de la Jachère au numéro trente et un
six montée de la Carnière, soixante-neuf mille huit cents Saint-Priest
cinq rue des Étachères, soixante-neuf, sept cent quatre-vingts, Mions
treize chemin de la Tour de Varissan, soixante-neuf, sept cents à Givors
Rue Louis Plantier, soixante-neuf mille cinq cents Bron
Impasse des Griottiers, soixante-neuf, huit cents Saint-Priest
Chemin du Panorama, Caluire-et-Cuire
Rue du Neyrard à Sainte-Foy-lès-Lyon
un rue Joanny Odet
Résidence Les Rives d'Ozon au numéro trente
deux cent vingt-quatre route du Puy d'Or, soixante-neuf mille sept cent soixante Limonest
sept rue de Boutan, soixante-neuf, cinq cent quarante, Irigny
trente-cinq rue des Géants, soixante-neuf, deux cent vingt à Lancié
Lotissement Res Les Magnolias, soixante-neuf mille trois cent soixante Saint-Symphorien-d'Ozon
Rue de la Verpillière, soixante-neuf, trois cent trente Meyzieu
Rue François Chanvillard, Chaponost
Rue Marie-Françoise Bruyas à Décines-Charpieu
quatorze rue Francisque Aynard
Rue Général de Sève au numéro six
trois rue du Général Bonnard, soixante-neuf mille trois cent soixante Saint-Symphorien-d'Ozon
sept allée de l'Enfance, soixante-neuf, cent, Villeurbanne
sept BIS chemin de la Pillote, soixante-neuf, deux cent trente à Saint-Genis-Laval
Rue Peytel, soixante-neuf mille six cent soixante Collonges-au-Mont-d'Or
Rue du Lermier, soixante-neuf, cent vingt-quatre Colombier-Saugnieu
Rue de Villacroz, Orliénas
Rue François de Génas à Genas
vingt-cinq rue du Vallon Torey
Rue de Fourneaux au numéro neuf
quatre-vingt-sept BIS cours Charlemagne, soixante-neuf mille deux Lyon
un allée des Terres du Bruissin, soixante-neuf, trois cent quarante, Francheville
vingt-trois montée Castellane, soixante-neuf, cent quarante à Rillieux-la-Pape
Rue du Buisset, soixante-neuf mille six cents Oullins
Lotissement Le Trimollin, soixante-neuf, sept cents Saint-Andéol-le-Château
Montée Saint-Claude, Cogny
Route des Pasquiers à Lancié
quatre rue Chavanne
Rue Antoine Remond au numéro treize
mille deux cent quatre-vingts route de Alix, soixante-neuf mille trois cent quatre-vingts Charnay
soixante-dix-sept rue de Cyprian, soixante-neuf, cent, Villeurbanne
six allée Marcellin Champagnat, soixante-neuf, deux cent trente à Saint-Genis-Laval
Rue du Magnolet, soixante-neuf mille quatre cents Villefranche-sur-Saône
Quai Perrache, soixante-neuf, zéro zéro deux Lyon
Avenue Paul Santy, Lyon
Rue du Riondan à Meyzieu
huit montée des Recollets
Rue Henri Brosse au numéro quarante-quatre BIS
deux quai Charles Sénard, soixante-neuf mille trois cents Caluire-et-Cuire
douze impasse Brachet, soixante-neuf, zéro zéro huit, Lyon
trois quai Paul Sédallian, soixante-neuf, zéro zéro neuf à Lyon
Rue de Montribloud, soixante-neuf mille neuf Lyon
Rue Simon Jallade, soixante-neuf, zéro zéro cinq Lyon
Quai Jules Courmont, Lyon
Rue Barrême à Lyon
trois allée de Val Fontaine
Impasse Jean-Pierre Fulchiron au numéro trois
sept cent douze allée de Pluvy, soixante-neuf mille cinq cent quatre-vingt-dix Saint-Symphorien-sur-Coise
cent quatre-vingt-quinze rue de la Maçonnière, soixante-neuf, trois cent quatre-vingt-dix, Vernaison
seize chemin du Clos Challand, soixante-neuf, trois cent quatre-vingt-dix à Charly
Rue Saint-Pierre de Vaise, soixante-neuf mille neuf Lyon
Avenue Grandclément, soixante-neuf, cent vingt Vaulx-en-Velin
Rue des Naïves, Feyzin
Rue du Professeur Paul Sisley à Lyon
deux rue Elisée Thomas
Rue Sigismond Brissy au numéro vingt et un
soixante-huit rue Jacques-Louis Hénon, soixante-neuf mille quatre Lyon
quatre-vingt-dix rue Baraban, soixante-neuf, zéro zéro trois, Lyon
six chemin de Saint-Léonard, soixante-neuf, deux cent soixante-dix à Couzon-au-Mont-d'Or
Rue Marius Poncet, soixante-neuf mille deux cent quatre-vingt-dix Saint-Genis-les-Ollières
Chemin du Tronchon, soixante-neuf, cent trente Écully
Rue des Remondières, Genay
Allée Joannès Gonon à Meyzieu
dix-neuf rue Pierre Bressat
Luzieux au numéro mille cent cinquante-huit
deux route de la Croix-Regis, soixante-neuf mille sept cents Échalas
dix-huit rue de la Tourtière, soixante-neuf, trois cent quatre-vingt-dix, Millery
dix rue Stella, soixante-neuf, zéro zéro deux à Lyon
Rue de Champvert, soixante-neuf mille cinq Lyon
Grande Rue de Vaise, soixante-neuf, zéro zéro neuf Lyon
Rue du Docteur Albéric Pont, Lyon
Chemin du Charréard à Vénissieux
quarante-trois T rue Gervais Bussière
Chemin des Charbottes au numéro trente-six
quarante et un avenue Vladimir Komarov, soixante-neuf mille deux cents Vénissieux
soixante-cinq impasse du Clair de Lune, soixante-neuf, deux cent dix, Sourcieux-les-Mines
mille cent vingt-neuf chemin du Pelet, soixante-neuf, trois cent quatre-vingt-dix à Vernaison
Impasse du Crêt de Charnat, soixante-neuf mille quatre cent soixante Blacé
Rue Renée Sabran, soixante-neuf, zéro zéro neuf Lyon
Rue du Corlevet, Craponne
Rue Eugène Pons à Lyon
quatorze rue d'Yvours
Route de Toleron au numéro mille deux cent soixante-quatre
dix rue du Port Maçon, soixante-neuf mille six cent cinquante Quincieux
quinze rue Rémy Cachet, soixante-neuf, cent vingt, Vaulx-en-Velin
mille huit cent quarante route de Frans, soixante-neuf, quatre cents à Villefranche-sur-Saône
Chemin du Châtenay, soixante-neuf mille six cent quatre-vingts Chassieu
Rue de Trêves Pâques, soixante-neuf, six cent soixante Collonges-au-Mont-d'Or
Route de Port Rivière, Saint-Georges-de-Reneins
Rue Marietton à Lyon
quatre BIS route du Tignot
Rue de la Champie au numéro dix-sept
trois cent quarante-six chemin du Coichat, soixante-neuf mille huit cent trente Saint-Georges-de-Reneins
quatre-vingt-un allée du Clos des Roches, soixante-neuf, cinq cent soixante, Saint-Cyr-sur-le-Rhône
quarante-neuf rue Anatoile Celle, soixante-neuf, six cent trente à Chaponost
Rue des Hérideaux, soixante-neuf mille huit Lyon
Impasse Marion, soixante-neuf, deux cent trente Saint-Genis-Laval
Chemin du Bois Comtal, Vernaison
Rue Pierre Voyant à Villeurbanne
dix chemin du Prélong
Boulevard de la Croix-Rousse au numéro quatre-vingt-dix-huit
douze rue André Dufour, soixante-neuf mille deux cent trente Saint-Genis-Laval
cent soixante-huit route de Liergues, soixante-neuf, quatre cents, Pouilly-le-Monial
un rue Orsel, soixante-neuf, six cents à Oullins
Rue Mauvernay, soixante-neuf mille deux cent quatre-vingt-dix Craponne
Rue Gaspard André, soixante-neuf, zéro zéro deux Lyon
Rue du Château des Marres, Jonage
Rue Professeur Rollet à Lyon
dix A rue Antoine Saunier
Chemin de la Haute Freydière au numéro cent quatre-vingt-cinq
trois route de Solaize, soixante-neuf mille trois cent vingt Feyzin
seize avenue Nicolas Pitiot, soixante-neuf, neuf cent soixante, Corbas
onze chemin de Balmont, soixante-neuf, deux cent vingt à Saint-Jean-d'Ardières
Rue Dedieu, soixante-neuf mille cent Villeurbanne
Rue Claudius Peymel, soixante-neuf, cinq cent quarante Irigny
Rue Marcel Bramet, Bron
Rue des Ecumines à Saint-Pierre-la-Palud
treize rue de Montbrillant
Allée Irène Joliot-Curie au numéro douze
neuf cent quatre avenue Jean Colomb, soixante-neuf mille deux cent quatre-vingts Marcy-l'Étoile
cinq quai Antoine Riboud, soixante-neuf, zéro zéro deux, Lyon
cent cinquante-neuf chemin de Mâchon, soixante-neuf, quatre cents à Gleizé
Chemin de la Vosne, soixante-neuf mille deux cent cinquante Neuville-sur-Saône
Lotissement des Iles, soixante-neuf, cent quarante Rillieux-la-Pape
La Pillardiere, Brindas
Rue de la Glunière à Vénissieux
vingt-cinq rue Comte de Mirabeau
Allée du Beauversant au numéro quatre B
huit quartier de la Ville, soixante-neuf mille trois cent soixante Ternay
sept montee des Brosses, soixante-neuf, trois cent soixante, Ternay
dix BIS rue Léon Fabre, soixante-neuf, cent à Villeurbanne
Rue Bonnet Pernet, soixante-neuf mille deux cents Vénissieux
Allée du Camaïeu, soixante-neuf, cinq cent soixante-dix Dardilly
Avenue Raoul Servant, Marcy-l'Étoile
Chemin des Plattes à Fontaines-Saint-Martin
soixante et un chemin des Verzières
Chemin de Wette-Fays au numéro quatre cent soixante-six
treize rue Raphaël Massard, soixante-neuf mille sept cent quarante Genas
soixante-quatorze rue Joseph Moulin, soixante-neuf, deux cent quatre-vingt-dix, Grézieu-la-Varenne
sept cent six montée d'Eveux, soixante-neuf, deux cent dix à Éveux
Rue Alexis Perroncel, soixante-neuf mille cent Villeurbanne
Rue de la Grande Verchère, soixante-neuf, sept cent trente Genay
Rue Pré Gaudry, Lyon
Avenue de la Villerme à Corbas
cent vingt et un B route du Pont Chabrol
Rue Emile Evellier au numéro dix-sept
neuf chemin du Moulin d'Arche, soixante-neuf mille quatre cent cinquante Saint-Cyr-au-Mont-d'Or
cinquante et un BIS route des Aqueducs, soixante-neuf, six cent trente, Chaponost
soixante-huit rue Gérard Oury, soixante-neuf, huit cents à Saint-Priest
Chemin de Porte-Joie, soixante-neuf mille huit cents Saint-Priest
Allée du Gai Vallon, soixante-neuf, cinq cent trente Brignais
Rue de Champoulin, Saint-Genis-les-Ollières
Côte Carmagnac à Irigny
cent vingt-six rue de Ponterle
Rue de la Pagère au numéro cent quarante-trois
quatre cent vingt-six rue Antoine Pagneux, soixante-neuf mille deux cent dix L'Arbresle
cent vingt-cinq chemin du Petit Merquet, soixante-neuf, trois cent soixante, Solaize
vingt-deux rue de Naizy, soixante-neuf, cent vingt-six à Brindas
Rue Tepito, soixante-neuf mille six cents Oullins
Rue Marius Tassy, soixante-neuf, huit cents Saint-Priest
Route du Bruissin, Francheville
Rue Joseph et Marie-Louise Liauthaud à Givors
quinze chemin de Grave
Rue du Grisard au numéro vingt et un
dix-sept chemin du Soyard, soixante-neuf mille cent vingt-six Brindas
vingt-neuf rue des Basses Verchères, soixante-neuf, zéro zéro cinq, Lyon
vingt-trois rue Général de Miribel, soixante-neuf, zéro zéro sept à Lyon
Chemin de Narcel, soixante-neuf mille cent dix Sainte-Foy-lès-Lyon
