deux cent trente chemin de Brunau, quatre-vingt-deux, cent à Castelsarrasin
Place de la Foire, quatre-vingt-deux mille deux cent quarante Septfonds
Boulevard Lagal, quatre-vingt-deux, sept cents Montech
Chemin de Montmirail, Montalzat
Impasse des Caubetous à Castelmayran
quatre-vingt-sept impasse de Bordette
Rue de Lesparre au numéro trois
dix-neuf rue Jean Jacques Lefranc de Pompignan, quatre-vingt-deux mille cent soixante-dix Pompignan
cent quatre-vingt-six chemin de Caminel, quatre-vingt-deux, cent trente, Lafrançaise
quatre-vingt-onze chemin de Cassang, quatre-vingt-deux, deux cents à Moissac
Chemin de Roys, quatre-vingt-deux mille deux cent quarante Septfonds
Chemin de Saint-Nicolas de la Grave, quatre-vingt-deux, deux cents Moissac
Avenue de Pechmeja, Lafrançaise
Chemin de Canazilles Haut à Campsas
cinq allées du Docteur Bent
Chemin de Barthe Folle au numéro deux cent dix-huit
cent vingt avenue Jules Combes, quatre-vingt-deux mille trois cent cinquante Albias
six rue de Rauffet, quatre-vingt-deux, zéro zéro zéro, Montauban
un rue Henri Dulaut, quatre-vingt-deux, zéro zéro zéro à Montauban
Rue du Miech, quatre-vingt-deux mille deux cent trente Monclar-de-Quercy
Chemin de Tolio, quatre-vingt-deux, quatre cent quarante Mirabel
Chemin Jacques Pères, Pommevic
Rue Jean Mernoz à Montauban
douze impasse d'Angleterre
Chemin de la Montre au numéro cent quatre-vingt-douze
un impasse de la Cheminée, quatre-vingt-deux mille cent Castelsarrasin
cent cinquante-six chemin de Pech Boyer, quatre-vingt-deux, zéro zéro zéro, Montauban
deux cent cinquante-neuf route de Carrière, quatre-vingt-deux, quatre cents à Goudourville
Quai Duprat, quatre-vingt-deux mille deux cents Moissac
Chemin de Planques, quatre-vingt-deux, zéro zéro zéro Montauban
Allée de Pordegui, Castelsarrasin
Route du Petit Bézy à Boudou
huit impasse Treilhou
Chemin de Lagrèze au numéro vingt-neuf
soixante-dix impasse Kiwi, quatre-vingt-deux mille deux cents Moissac
quatre-vingt-dix-huit chemin de Vigne Grande, quatre-vingt-deux, trois cent soixante-dix, Orgueil
six cent vingt-quatre chemin de Souilles, quatre-vingt-deux, quatre cent dix à Saint-Étienne-de-Tulmont
Chemin de Fray Join, quatre-vingt-deux mille sept cents Finhan
Chemin de Caxirou, quatre-vingt-deux, deux cent trente Monclar-de-Quercy
Rue Sapiac, Grisolles
Chemin Jean Grand à Grisolles
trois cent soixante chemin de Samatan
Avenue du Balat-Grand au numéro deux
soixante-dix camp de Lagrange, quatre-vingt-deux mille cent Les Barthes
trois cent soixante-seize chemin Peyre de la Sal, quatre-vingt-deux, deux cent quatre-vingt-dix, Montbeton
neuf cent soixante-huit voie Communale six de Perdigane, quatre-vingt-deux, sept cents à Saint-Porquier
Plaça du Foirail, quatre-vingt-deux mille cent soixante Parisot
Chemin du Soulé, quatre-vingt-deux, quatre cents Goudourville
Chemin de Martelles, Monteils
Résidence du Sous Bois à Valence
quatre cent vingt-six chemin de Mirel
Rue Delbessous au numéro cinq
deux rue des Servics, quatre-vingt-deux mille cent soixante-dix Grisolles
six cent vingt chemin du Moulin de Camparnaud, quatre-vingt-deux, cent trente, Lafrançaise
six rue du Maréchal Sancerre, quatre-vingt-deux, cent à Castelsarrasin
Chemin des Esquilhots, quatre-vingt-deux mille cent Garganvillar
Route de Lamire, quatre-vingt-deux, sept cents Escatalens
Impasse Louis Malle, Montauban
Impasse de Lamouyrasse à Saint-Aignan
trente chemin de Payé
Place Charles Caperan au numéro quatre
quatre-vingt-quinze impasse de Naves, quatre-vingt-deux mille huit cents Nègrepelisse
cent soixante-quinze chemin de Pelouze, quatre-vingt-deux, cent trente, L'Honor-de-Cos
six cent trente impasse de Calabre, quatre-vingt-deux, deux cent quatre-vingt-dix à La Ville-Dieu-du-Temple
Chemin de Barrouillet, quatre-vingt-deux mille trois cent soixante-dix Labastide-Saint-Pierre
Rue du Pont de l'Aveyron, quatre-vingt-deux, cent quarante Saint-Antonin-Noble-Val
Voie Communale dix des Arpens Biels, Saint-Porquier
Chemin d'Espinasse à Montauban
quatre cent vingt chemin de Gouallaou
Chemin de Las Bouzygues au numéro trois cent vingt-cinq
six rue Ange Huc, quatre-vingt-deux mille trois cents Caussade
six cent quatre-vingt-cinq route des Briquetiers, quatre-vingt-deux, deux cent soixante-dix, Montpezat-de-Quercy
cent quarante chemin Lapeyre, quatre-vingt-deux, zéro zéro zéro à Montauban
Chemin de Delmas, quatre-vingt-deux mille Montauban
Impasse Taluchet, quatre-vingt-deux, huit cents Nègrepelisse
Impasse Frézières, Montauban
Chemin de Golse à Lacourt-Saint-Pierre
huit cent quinze chemin de Mages
Rue d'Encessoy au numéro vingt-trois
vingt-neuf rue de la Forêt d'Agre, quatre-vingt-deux mille cent Castelsarrasin
cinquante chemin des Tauges, quatre-vingt-deux, huit cents, Vaïssac
deux rue de l'Abbé de Rosset, quatre-vingt-deux, cent soixante-dix à Grisolles
Impasse La Seyne, quatre-vingt-deux mille quatre cent dix Saint-Étienne-de-Tulmont
Impasse du Rastelet, quatre-vingt-deux, quatre cent dix Saint-Étienne-de-Tulmont
Impasse de Lasserre, Montricoux
Chemin de Ricard à Moissac
cent quatre-vingt-sept route du Rec
Rue du Lot Michaud au numéro quarante-neuf
deux cent trente-deux chemin du Circuit, quatre-vingt-deux mille Montauban
neuf chemin de Rous, quatre-vingt-deux, zéro zéro zéro, Montauban
deux rue du Sous Marin Minerve, quatre-vingt-deux, cent soixante à Caylus
Chemin de la Roche de Saint-Martin, quatre-vingt-deux mille six cents Verdun-sur-Garonne
Chemin du Causse Haut, quatre-vingt-deux, trois cents Monteils
Route des Estédiés, Cordes-Tolosannes
Rue Hippolyte Detours à Moissac
un côte du Couvent
Chemin de Vignalas au numéro trois cent soixante-quatorze
sept rue des Ponts Levis, quatre-vingt-deux mille cinq cents Sérignac
trois T rue del Solier, quatre-vingt-deux, deux cents, Moissac
neuf rue Bède, quatre-vingt-deux, trois cents à Caussade
Chemin de Lauriol, quatre-vingt-deux mille quatre cent quarante Mirabel
Aulery, quatre-vingt-deux, cent dix Lauzerte
Chemin de Treillou, Montauban
Passage Lasserre à Saint-Sardos
deux cent quarante et un chemin de Courtes
Chemin des Noses au numéro quatre cent un
dix boulevard des Ecoles, quatre-vingt-deux mille deux cent trente Monclar-de-Quercy
deux route de Cansiguié, quatre-vingt-deux, deux cent vingt, Vazerac
cent quinze route des Gourdis, quatre-vingt-deux, trois cent cinquante à Albias
Chemin de Gijoux, quatre-vingt-deux mille deux cents Moissac
Lotissement Larigodière, quatre-vingt-deux, trois cent quarante Donzac
Rue Christophe Louis de Lamorcière, Montauban
Lotissement Barrade à Lacourt-Saint-Pierre
mille quatre cent vingt route de Fontaurioles
Impasse des Turilles au numéro quatre-vingts
mille sept cent quinze chemin des Ombrails, quatre-vingt-deux mille huit cents Nègrepelisse
treize grand'Rue du Bourg, quatre-vingt-deux, cent soixante-dix, Fabas
trente et un chemin de Boscla, quatre-vingt-deux, quatre cent dix à Saint-Étienne-de-Tulmont
Rue Benoit-Jamet, quatre-vingt-deux mille cent soixante-dix Grisolles
Rue du Treils, quatre-vingt-deux, trois cent quarante Dunes
Voie Communale douze de l'Hermitage, Saint-Porquier
Chemin de Baladous à Verdun-sur-Garonne
cinq rue du Commandant Defraux
Impasse du Selle Français au numéro onze
un impasse de la Gimone, quatre-vingt-deux mille cent Lafitte
deux lotissement des Boulbènes, quatre-vingt-deux, cent soixante-dix, Dieupentale
quatorze rue Henri Jauvert, quatre-vingt-deux, six cents à Verdun-sur-Garonne
Chemin de la Gauré, quatre-vingt-deux mille cent Castelsarrasin
Quai Montmurat, quatre-vingt-deux, zéro zéro zéro Montauban
Porte de Lectoure, Auvillar
Rue Felixe Lagravère à Montauban
huit rue des Sept Caporaux
Route de Caxot au numéro deux cent vingt
neuf cent douze route de Maubert, quatre-vingt-deux mille trois cent cinquante Albias
trois lotissement Hameau du Pech, quatre-vingt-deux, zéro zéro zéro, Montauban
deux chemin de Sabatou, quatre-vingt-deux, deux cent dix à Castelmayran
Avenue Jean Duquesne, quatre-vingt-deux mille quatre cents Pommevic
Promenade de la Mazerère, quatre-vingt-deux, cinq cents Beaumont-de-Lomagne
Rue Jacques Momméja, Caussade
Impasse Charles Malpel à Montauban
quatre impasse des Caussacs
Cité Luvisutto au numéro neuf
trois impasse de la Courrège, quatre-vingt-deux mille sept cents Finhan
huit saint Cirq, quatre-vingt-deux, trois cents, Saint-Cirq
soixante-douze chemin du Pegat, quatre-vingt-deux, trois cent soixante-dix à Orgueil
Chemin Saint-Cernin, quatre-vingt-deux mille trois cents Caussade
Impasse Macalet, quatre-vingt-deux, cent Castelsarrasin
Chemin de Dariat, Montauban
Chemin de l'Eglise de Falguières à Montauban
quatre cent cinquante chemin de Cruyé
Chemin de Belle-Île au numéro cent quatre-vingt-dix
deux chemin Route Neuve, quatre-vingt-deux mille cent dix Lauzerte
trois cent quatre-vingt-quinze chemin de Fios, quatre-vingt-deux, trois cent soixante-dix, Reyniès
un résidence les Dussardes, quatre-vingt-deux, quatre cent dix à Saint-Étienne-de-Tulmont
Lotissement Saint-Gilles, quatre-vingt-deux mille huit cents Nègrepelisse
Chemin des Amazones, quatre-vingt-deux, deux cent trente Monclar-de-Quercy
Chemin de Flammarenc, Albefeuille-Lagarde
Chemin de Garenats à Albias
dix-neuf impasse de Grimal
Chemin de Bourrel Bas au numéro deux
un côte Forte, quatre-vingt-deux mille cent cinquante Montaigu-de-Quercy
deux cent trente et un chemin de la Timballe, quatre-vingt-deux, huit cents, Montricoux
six cent cinquante chemin de Vaissayère, quatre-vingt-deux, cent à Castelsarrasin
Route de Cazes Mondenard, quatre-vingt-deux mille cent trente Lafrançaise
Chemin des Bergayres, quatre-vingt-deux, huit cents Bioule
Impasse de la Sorbonne, Nègrepelisse
Chemin de la Peyronie à Castelsarrasin
six rue de La Pompe
Impasse de la Vaysse au numéro trois
six cent quarante-cinq rD trente-cinq de Nègrepelisse, quatre-vingt-deux mille huit cents Vaïssac
cent soixante-quinze route de Saint-Hubéry, quatre-vingt-deux, cent trente, Montastruc
quinze avenue de Saint-Cirq, quatre-vingt-deux, trois cents à Caussade
Route de Grellery, quatre-vingt-deux mille deux cent quatre-vingt-dix La Ville-Dieu-du-Temple
Impasse Louis Cabanes, quatre-vingt-deux, zéro zéro zéro Montauban
Impasse Paris-Orléans, Montauban
Voie Communale la Vicomté à Saint-Porquier
quatre cent vingt chemin de Penauze
Lotissement Parc de Biro Soulel au numéro huit
trois cent quatre-vingt-quatorze impasse Trigodina, quatre-vingt-deux mille deux cents Boudou
sept cent quatre-vingt-quatre chemin de Rival, quatre-vingt-deux, cent trente, L'Honor-de-Cos
cent cinquante-cinq impasse de Sainte-Rafine, quatre-vingt-deux, cent trente à Lamothe-Capdeville
Impasse René Daumal, quatre-vingt-deux mille Montauban
Chemin de Réal Font, quatre-vingt-deux, deux cents Moissac
Allée Joseph de Lasserre, Saint-Nicolas-de-la-Grave
Chemin du Coudounié à Lauzerte
cinq rue Roumagnac
Rue de la Campadou au numéro neuf
quatre cent quatorze impasse de Las Graves, quatre-vingt-deux mille deux cent quatre-vingt-dix Meauzac
quatre rue Mounitre, quatre-vingt-deux, zéro zéro zéro, Montauban
neuf cent cinquante-huit chemin des Verries, quatre-vingt-deux, cent à Castelsarrasin
Impasse Berlanes, quatre-vingt-deux mille Montauban
Rue Athenais Mialaret, quatre-vingt-deux, zéro zéro zéro Montauban
Route de PuyLaroque, Caussade
Chemin de Cabarrot à Golfech
huit cent quarante-cinq chemin de Messaut
Rue de L'Escolo Vielho au numéro six
cent quinze chemin de Ramondy, quatre-vingt-deux mille cent trente Lamothe-Capdeville
quatre rue du Braguel, quatre-vingt-deux, quatre cents, Golfech
un impasse Nauze Nord, quatre-vingt-deux, huit cents à Montricoux
Rue Bêche, quatre-vingt-deux mille Montauban
Impasse de Cluzel, quatre-vingt-deux, quatre cents Valence
Route du Moutas, Montech
Chemin Rural de Jongayrolles à Moissac
deux cent un chemin de Miremandre
Rue Lucien Andrieu au numéro deux
quatre-vingt-dix-neuf chemin de Fisset, quatre-vingt-deux mille Montauban
sept cent quatre-vingts chemin du Rivalet, quatre-vingt-deux, cent trente, L'Honor-de-Cos
trois rue des Couffets, quatre-vingt-deux, trois cent cinquante à Albias
Impasse de Belluc, quatre-vingt-deux mille deux cent quatre-vingt-dix Barry-d'Islemade
Chemin Teulède, quatre-vingt-deux, deux cents Boudou
Chemin de Gélardy, La Ville-Dieu-du-Temple
Lotissement Gardia à Lavit
douze rue Pierre Panissard
Route de Guilhemade au numéro deux mille deux cent dix-huit
onze impasse Clair Logis, quatre-vingt-deux mille deux cent dix Castelmayran
dix-huit boulevard de Pintois, quatre-vingt-deux, trois cent quarante, Auvillar
neuf place Etienne Biron, quatre-vingt-deux, six cents à Mas-Grenier
Tucol, quatre-vingt-deux mille deux cent vingt Vazerac
Impasse de Bontens, quatre-vingt-deux, cent Les Barthes
Avenue Croix de Jubilé, Lavit
Rue de l'Hopital Majeur à Saint-Antonin-Noble-Val
quarante-neuf route de Vintilhac
Route de Biro Soulel au numéro un
cinq impasse Marie Guy, quatre-vingt-deux mille sept cents Montech
dix lotissement de la Mayounelle, quatre-vingt-deux, deux cent cinquante, Laguépie
cent quinze voie Communale un de Majerolles, quatre-vingt-deux, sept cents à Saint-Porquier
Impasse Tubal, quatre-vingt-deux mille trois cent quarante Donzac
Chemin de la Tonne, quatre-vingt-deux, quatre cents Valence
Chemin de Rouhan, Moissac
Chemin du Sourbié Sud à Montricoux
deux impasse du Claux de Roux
Rue des Alarys au numéro douze
cinq rue Pierre Paul de Riquet, quatre-vingt-deux mille cent Castelsarrasin
cent soixante route de Cadours, quatre-vingt-deux, sept cents, Cordes-Tolosannes
sept cent dix route de Pech Farinou, quatre-vingt-deux, deux cent soixante-dix à Montpezat-de-Quercy
Carrelot de la Forge, quatre-vingt-deux mille trois cent quarante Donzac
Chemin de Mallet, quatre-vingt-deux, zéro zéro zéro Montauban
Chemin de Sèges à la Madeleine, Moissac
Impasse de Rougerie à Montech
cent soixante chemin de Pelat
Rue de Timbrune au numéro deux
huit grande Rue de Saint-Maurice, quatre-vingt-deux mille cent trente Lafrançaise
deux rue Toumet, quatre-vingt-deux, cent vingt, Lavit
deux rue Achille Raspide, quatre-vingt-deux, six cents à Mas-Grenier
Chemin de Goujou, quatre-vingt-deux mille deux cents Moissac
Chemin de Castanède, quatre-vingt-deux, huit cents Nègrepelisse
Chemin de Gaillardis, Labastide-Saint-Pierre
Rue du Fourbiel à Montpezat-de-Quercy
quinze rue Albert Caillau
Rue de la Bataille de Dunkerque mille neuf cent quarante au numéro trois
six quai du Vieux Port, quatre-vingt-deux mille deux cents Moissac
trois rue de L'Oulette, quatre-vingt-deux, zéro zéro zéro, Montauban
deux cent dix chemin de la Fontaine Saint-Julien, quatre-vingt-deux, sept cents à Escatalens
Route de l'Estele, quatre-vingt-deux mille cent Garganvillar
Chemin de Lanourette, quatre-vingt-deux, zéro zéro zéro Montauban
Chemin de Beauvillard, Montbeton
Rue du Bessarel à Saint-Antonin-Noble-Val
trois cent dix-huit voie Communale neuf de Bordeneuve
Résidence du Gouny au numéro un
dix-neuf lotissement l'Usclade, quatre-vingt-deux mille Montauban
mille seize chemin des Saulous, quatre-vingt-deux, huit cents, Bioule
deux cent vingt et un chemin Rural vingt de Bert, quatre-vingt-deux, sept cents à Saint-Porquier
Impasse de la Cellulose, quatre-vingt-deux mille sept cents Montech
Rue Cariben, quatre-vingt-deux, deux cent soixante-dix Montpezat-de-Quercy
Chemin de Lavergnède, Nohic
Impasse des Pujals à Orgueil
cinq cent soixante et un chemin de Camil
Chemin de Laurier au numéro cinq BIS
six rue Victor Malrieu, quatre-vingt-deux mille Montauban
sept lotissement Latour, quatre-vingt-deux, cent, Castelferrus
quatre-vingts chemin des Brunis, quatre-vingt-deux, huit cents à Nègrepelisse
Rue des Grandes Boucheries, quatre-vingt-deux mille cent quarante Saint-Antonin-Noble-Val
Impasse du Lippizan, quatre-vingt-deux, zéro zéro zéro Montauban
Chemin de Coufignal, Montauban
Route de Verlhac Tescou à Montauban
un impasse Pierre Fermat
Chemin de l'Église de Fonneuve au numéro neuf
soixante chemin de la Roques, quatre-vingt-deux mille deux cents Moissac
trois rue Antonin Delzers, quatre-vingt-deux, cent, Castelsarrasin
soixante-trois chemin de Malengane Haut, quatre-vingt-deux, deux cents à Moissac
Ruelle du Pont Napoléon, quatre-vingt-deux mille deux cents Moissac
Impasse des Goujous, quatre-vingt-deux, trois cent quarante Dunes
Résidence La Seyne, Saint-Étienne-de-Tulmont
Place de la Raison à Castelsarrasin
cinq chemin de Luché
Impasse Gaillou au numéro quatre
sept rue Xavier Moulenq, quatre-vingt-deux mille quatre cents Valence
huit cent vingt-trois route des Gauberts, quatre-vingt-deux, deux cent trente, Monclar-de-Quercy
dix-sept place Du Buoc, quatre-vingt-deux, cent quarante à Saint-Antonin-Noble-Val
Chemin de Ticol Haut, quatre-vingt-deux mille deux cent quatre-vingt-dix Barry-d'Islemade
Impasse de Pechevy, quatre-vingt-deux, deux cent trente Monclar-de-Quercy
Chemin de Dussel, Montauban
Chemin de la Génibre à Lamothe-Capdeville
trente-neuf chemin de Magdelaine Nord
Chemin de Jouanelle au numéro quatre-vingt-quatre
sept chemin De La Roque, quatre-vingt-deux mille sept cents Escatalens
six cent quatre-vingt-deux route de Serre Basse, quatre-vingt-deux, deux cents, Boudou
quatre-vingt-treize rue Maurice Sirac, quatre-vingt-deux, deux cent quatre-vingt-dix à Montbeton
Albergnet, quatre-vingt-deux mille trois cent cinquante Albias
Chemin de Renoy, quatre-vingt-deux, deux cent soixante-dix Montpezat-de-Quercy
Impasse des Boulbènes, Dieupentale
Rue Grany Smith à Bressols
sept chemin du Barry Fort
Impasse des Albarèdes au numéro six
mille cent trente route Adrien Mezger, quatre-vingt-deux mille deux cent quatre-vingt-dix Albefeuille-Lagarde
un place Pierre Tajan, quatre-vingt-deux, cent soixante-dix, Fabas
vingt et un avenue de Mondenard, quatre-vingt-deux, cent dix à Cazes-Mondenard
Chemin de Las Vignettes, quatre-vingt-deux mille trois cent quarante Dunes
Route de Stroys, quatre-vingt-deux, sept cents Cordes-Tolosannes
Rue Bénédict Prévost, Montauban
Chemin de Combourieux à Montpezat-de-Quercy
un carrelot Villenouvelle
Route de Las Parets au numéro trois cent un
quatre cent trente-quatre chemin de Pesquié, quatre-vingt-deux mille cent trente Lafrançaise
trois migou, quatre-vingt-deux, cinq cents, Larrazet
deux passage Ulysse David, quatre-vingt-deux, trois cent soixante-dix à Villebrumier
Route de la Margasse, quatre-vingt-deux mille trois cent soixante-dix Campsas
Rue Estivenque, quatre-vingt-deux, trois cents Caussade
Chemin Rural un des Bouillous, Saint-Porquier
Rue Messeyroux à Albias
deux cent quatre-vingt-dix-huit route d'Ardus
Route de Fajolles au numéro trois cent cinquante-trois
cent cinquante-neuf chemin de Gardiol, quatre-vingt-deux mille trois cent cinquante Albias
quarante-huit chemin de Nauzemasse, quatre-vingt-deux, deux cent quatre-vingt-dix, Lacourt-Saint-Pierre
cent soixante et un impasse de Gerbas, quatre-vingt-deux, quatre cents à Goudourville
Chemin de Falgayras, quatre-vingt-deux mille cent trente Lafrançaise
Impasse d'Emblard, quatre-vingt-deux, quatre cents Goudourville
Rue Cyprien Majorel, Montbeton
Impasse du Fourg à Verlhac-Tescou
cent soixante-quinze chemin de Duton
Rue du Coin de Caussade au numéro un
sept cent quatre-vingt-huit route de Montastruc, quatre-vingt-deux mille cent trente Lafrançaise
trois cent trente route des Granies, quatre-vingt-deux, cent, Garganvillar
mille sept cent trente chemin de Pordegui, quatre-vingt-deux, cent à Castelsarrasin
Chemin de Crouzailles, quatre-vingt-deux mille sept cent dix Bressols
Impasse Pierre Desproges, quatre-vingt-deux, zéro zéro zéro Montauban
Chemin de Nouvel, Bressols
Chemin de Canazilles Bas à Campsas
cinq rue du Potevin
Chemin des Rauffets Hauts au numéro sept cent quatre-vingts
quatre rue Paul Edouard Wallon, quatre-vingt-deux mille Montauban
deux place Bouli et Shatta Simon, quatre-vingt-deux, deux cents, Moissac
cent soixante-quatorze chemin de Fauret, quatre-vingt-deux, trois cent soixante-dix à Corbarieu
Chemin de Gabet Gamasses, quatre-vingt-deux mille deux cent trente Monclar-de-Quercy
Impasse Taurines, quatre-vingt-deux, trois cent cinquante Albias
Impasse Saint-André Nord, Saint-Porquier
Chemin du Moulin d'Huguet à Montaigu-de-Quercy
six cent cinquante-deux chemin du Poujet
Chemin de Cavailles au numéro cent trente et un
cinq cents las Caminoles, quatre-vingt-deux mille cent soixante-dix Monbéqui
cent quarante-quatre chemin de Fontanelles, quatre-vingt-deux, cent trente, L'Honor-de-Cos
quatre cent quatre-vingt-quatre chemin de Grezel, quatre-vingt-deux, quatre cent quarante à Réalville
Impasse Marc Sanguier, quatre-vingt-deux mille Montauban
Petite Rue de Turenne, quatre-vingt-deux, huit cents Nègrepelisse
Route de Lauriol, Montech
Impasse de Biscardel à Lamothe-Capdeville
six cent vingt-quatre route de Coupy
Impasse de la Pelatière au numéro deux cent vingt-quatre
cent quatre-vingts chemin de Saint-Genies, quatre-vingt-deux mille deux cent soixante-dix Montalzat
cinq cent vingt et un chemin de Bordette, quatre-vingt-deux, cent, Castelsarrasin
neuf place Des Capucins, quatre-vingt-deux, cent quarante à Saint-Antonin-Noble-Val
Chemin des Caves et Montagne, quatre-vingt-deux mille deux cent trente Léojac
Place Victor Fournier, quatre-vingt-deux, trois cents Caussade
Chemin de Guillaumet, Moissac
Impasse du Péninet à Donzac
deux cent vingt-neuf impasse la Laque
Chemin de Maladen au numéro cent cinquante
deux rue Jean Moussaron, quatre-vingt-deux mille trois cent quarante Dunes
cinquante-trois rue Royal Gala, quatre-vingt-deux, sept cent dix, Bressols
cent quatre-vingt-six route de Bouligaire, quatre-vingt-deux, trois cent cinquante à Albias
Chemin de Passil, quatre-vingt-deux mille huit cents Bioule
Chemin Cap de Py, quatre-vingt-deux, cent trente L'Honor-de-Cos
Allée de la Lère, Septfonds
Zone d'Activité Le Parc à Canals
cent quarante-quatre impasse Palmier
Chemin de la Perruquière au numéro quatre-vingt-seize
deux cent soixante-sept chemin de Marties, quatre-vingt-deux mille trois cent quarante Donzac
vingt-huit chemin de Haute Pisse, quatre-vingt-deux, quatre cent quarante, Réalville
deux rue Pierre Gerla, quatre-vingt-deux, trois cent soixante-dix à Villebrumier
Rue Jean Mandrette, quatre-vingt-deux mille cent Castelsarrasin
Rue du Docteur Lacaze, quatre-vingt-deux, zéro zéro zéro Montauban
Impasse du Hameau de Soudène, Montech
Chemin de Ricassac à Caussade
trente-six chemin de l'Église de Gasseras
Chemin des Terreforts au numéro cent soixante et onze
douze rue du Chanoine Bessac, quatre-vingt-deux mille cent Castelsarrasin
cent soixante chemin de Delbrel, quatre-vingt-deux, deux cents, Moissac
deux cent soixante-cinq chemin de la Gamassette, quatre-vingt-deux, trois cents à Monteils
Lotissement Lonjou un, quatre-vingt-deux mille Montauban
Chemin de Citou, quatre-vingt-deux, deux cent dix Saint-Nicolas-de-la-Grave
Chemin de Poumarel, Mirabel
Route de la Pente d'Eau à Montech
cent trente et un chemin de Bigarrat
Rue de la Probité au numéro neuf
cent neuf chemin du Mounié, quatre-vingt-deux mille cent trente Montastruc
huit cents chemin de Pech Cruzel, quatre-vingt-deux, huit cents, Vaïssac
trois cent quatre-vingt-dix-huit BIS chemin de Marchandel, quatre-vingt-deux, deux cent trente à Verlhac-Tescou
Rue des Cambis, quatre-vingt-deux mille Montauban
Chemin de Ruppé, quatre-vingt-deux, cent dix Lauzerte
Impasse Fossat, Lacourt-Saint-Pierre
Impasse des Dareysses à Verdun-sur-Garonne
six impasse Mondounas
Rue de l'Aérospatiale au numéro cinq
trois cent quatre-vingt-quatre chemin de Naudet, quatre-vingt-deux mille deux cent trente Léojac
deux cents chemin de Courty, quatre-vingt-deux, cent trente, Lamothe-Capdeville
trois rue Géraud Seignouret, quatre-vingt-deux, cent soixante-dix à Grisolles
Rue du Tour de Cimetière, quatre-vingt-deux mille six cents Verdun-sur-Garonne
Rue Cap del Barry, quatre-vingt-deux, cent soixante-dix Dieupentale
Chemin de l'Église Saint-Hilaire, Montauban
Rue de Padouens à Aucamville
sept cent quatre-vingt-dix chemin des Tempets
Route de Pétou au numéro quatre-vingt-treize
soixante-quatorze impasse Lamothe du Fort, quatre-vingt-deux mille trois cent soixante-dix Corbarieu
six lotissement Le Vignoble, quatre-vingt-deux, deux cent dix, Castelmayran
deux allée des Pruneliers, quatre-vingt-deux, quatre cent dix à Saint-Étienne-de-Tulmont
Rue François Raynal, quatre-vingt-deux mille deux cents Moissac
Rue Tholon de Saint-Jalles, quatre-vingt-deux, trois cent soixante-dix Nohic
Route de Lomagne, Boudou
Rue Victor Grezel à Montauban
soixante-dix-huit chemin de Cutobi
Chemin de Bissières au numéro trois cent soixante-sept
huit cent onze chemin de Tauriac, quatre-vingt-deux mille cent trente Lafrançaise
onze rue Saint-Julia, quatre-vingt-deux, sept cents, Escatalens
cinq place Saint-Orens, quatre-vingt-deux, zéro zéro zéro à Montauban
Chemin de Prats Haut, quatre-vingt-deux mille cent trente Lafrançaise
Place Durand de Bredon, quatre-vingt-deux, deux cents Moissac
Chemin des Candeliers, Corbarieu
Impasse des Farguettes à Monclar-de-Quercy
deux cent quarante le Soulié
Chemin de Relance au numéro quarante-sept
quatre-vingt-deux chemin de Nauguilles, quatre-vingt-deux mille cent Castelsarrasin
quarante-cinq chemin de Cabrelat, quatre-vingt-deux, huit cents, Nègrepelisse
un chemin du Regas, quatre-vingt-deux, six cents à Mas-Grenier
Chemin de Brassac, quatre-vingt-deux mille trois cent soixante-dix Corbarieu
Impasse des Monteils, quatre-vingt-deux, huit cents Nègrepelisse
Chemin de Cap Rivière, Labastide-du-Temple
Place des Bourdettes à Lavit
deux mille cinquante-cinq impasse de Paulet
Chemin de Roubertoune au numéro quatre cent cinquante A
deux cent quatre-vingt-quatorze chemin de la Vignée, quatre-vingt-deux mille cent soixante-dix Pompignan
huit impasse du Tembourel, quatre-vingt-deux, sept cents, Montech
