quarante rue de la Fontaine Anneau, soixante-dix mille trois cent vingt Corbenay
dix route de Rioz, soixante-dix, cent quatre-vingt-dix, Aulx-lès-Cromary
sept rue de la Roichotte, soixante-dix, quatre cents à Saulnot
Rue des Cités Tournesac, soixante-dix mille quatre cents Héricourt
Rue de Cresancey, soixante-dix, cent Champtonnay
Route du Creux Chêne, Amage
Rue du Général Poncet à Pesmes
dix BIS route d'Esprels
Rue du Grand Coteau au numéro dix-sept
douze A rue de Bauffremont, soixante-dix mille cent quatre-vingt-dix Vandelans
six rue de les Aynans, soixante-dix, deux cents, Vouhenans
deux rue Pauléon Fournot, soixante-dix, cent soixante à Saint-Remy
Rue de la Grand Combe, soixante-dix mille deux cent trente Bouhans-lès-Montbozon
Rue Marcel Hacquard, soixante-dix, zéro zéro zéro Noidans-lès-Vesoul
Rue du Pré Perney, Genevrey
Rue de Loulans à Montbozon
vingt-neuf impasse de la l'Aviation
Impasse Marie Richard au numéro onze
six rue de la Duremanne, soixante-dix mille deux cent dix Saponcourt
huit rue du Champ Mercey, soixante-dix, zéro zéro zéro, Navenne
six rue d'Auxon, soixante-dix, cent soixante-dix à Bougnon
Rue du Messager, soixante-dix mille deux cents Le Val-de-Gouhenans
Rue Saint-Valère, soixante-dix, cent soixante-dix Port-sur-Saône
Rue Georges et Pierre Henry, Corbenay
Rue du Capitaine Blandin à Vesoul
trois rue Dagnan Bouveret
Rue Henry Guy au numéro neuf
trente-neuf rue de la Gare d'Aillevillers, soixante-dix mille trois cent vingt Corbenay
vingt-sept rue Roberte Luzet, soixante-dix, huit cents, Saint-Loup-sur-Semouse
quinze vieille Route de Boult, soixante-dix, cent quatre-vingt-dix à Voray-sur-l'Ognon
Le Prémourey, soixante-dix mille deux cent vingt Fougerolles
Rue Sous Saroche, soixante-dix, quatre cents Héricourt
Rue de la Corvée Neuve, Pusey
Rue du Mont de Roche à Vellefaux
trois chemin de la Ronde Besse
Le Volvet au numéro soixante-six
sept avenue René Fouquet, soixante-dix mille cent soixante-dix Port-sur-Saône
onze route de Vauvillers, soixante-dix, deux cent dix, Mailleroncourt-Saint-Pancras
douze rue de la Mechelle, soixante-dix, deux cents à Magny-Vernois
Rue de Traves, soixante-dix mille cent trente Noidans-le-Ferroux
Rue des Champs La Devant, soixante-dix, deux cents Clairegoutte
Route de Bourguignon, Bassigney
Blanzey à Fougerolles
trente et un rue de la Gode Biche
Rue André Thiebaut au numéro six
huit rue Juliot-Curie, soixante-dix mille deux cents Lure
dix-neuf rue de Fourouze, soixante-dix, cent trente, Fretigney-et-Velloreille
deux cent soixante-cinq le Grand Fays, soixante-dix, deux cent vingt à Fougerolles
Rue Marcel Garret, soixante-dix mille cent soixante Menoux
Rue Jean Sainty, soixante-dix, quatre cents Héricourt
Rue de Cognières, Bouhans-lès-Montbozon
Rue de Dampvalley à Colombe-lès-Vesoul
dix rue Meillier
Rue Miroudot Saint-Ferjeux au numéro vingt-deux A
neuf rue En Saumon, soixante-dix mille quatre cents Coisevaux
deux BIS grande Rue de Corcelles, soixante-dix, quatre cents, Saulnot
un rue du Paquit, soixante-dix, sept cents à Frasne-le-Château
Place Léon Jacquey, soixante-dix mille huit cents Saint-Loup-sur-Semouse
Sentier de la Jus, soixante-dix, deux cents Saint-Germain
Impasse des Planchottes, Vy-lès-Rupt
Rue d'Orière à Ronchamp
trente et un rue de Plombières-les-Bains
Route de Faucogney au numéro un BIS
six route de Luxeuil, soixante-dix mille huit cents Conflans-sur-Lanterne
huit rue des Danvions, soixante-dix, zéro zéro zéro, Vesoul
trente-trois rue Henri Duhaut, soixante-dix, trois cent vingt à Corbenay
Place du Trau, soixante-dix mille Vesoul
Rue Charles Chevillard, soixante-dix, zéro zéro zéro Quincey
Avenue du Maréchal Turenne, Luxeuil-les-Bains
Impasse Michel Brocard à Magny-Vernois
treize route de Saint-Gand
Rue de Rosey au numéro soixante-cinq BIS
vingt-six rue de Grandvelle, soixante-dix mille Auxon
huit rue du Palichaud, soixante-dix, sept cents, Vaux-le-Moncelot
neuf rue Claude Cariage, soixante-dix, zéro zéro zéro à Vesoul
Hameau Le Ruisseau des Ecrevisses, soixante-dix mille huit cents Bouligney
Route du Ruisseau de la Goutte, soixante-dix, trois cent dix La Proiselière-et-Langle
Rue Mauvaise, Passavant-la-Rochère
Route des Roselières à Villers-Bouton
cinq rue de la Cabe
Route de Melincourt au numéro vingt-quatre
sept rue Jacques Cordonnier, soixante-dix mille deux cents Lure
dix rue de Chardenet, soixante-dix, zéro zéro zéro, Pusey
quinze route Sous le Mont de Vannes, soixante-dix, deux cent soixante-dix à Saint-Barthélemy
Place des Grands Puits, soixante-dix mille deux cent quarante Saulx
Rue du Varet, soixante-dix, deux cents Roye
Impasse En Bicheron, Hautevelle
Rue Maurice Signard à Gray
cinq avenue Jacques Parisot
Rue Ernest Villeret au numéro vingt-deux BIS
un avenue de la Maladière, soixante-dix mille Mailley-et-Chazelot
trois rue Georges Tournu, soixante-dix, quatre cents, Héricourt
dix rue du Bourset, soixante-dix, deux cents à Malbouhans
Le Prédurupt, soixante-dix mille deux cent vingt Fougerolles
Rue des Perrayes, soixante-dix, deux cent soixante-dix Ternuay-Melay-et-Saint-Hilaire
Rue Docteur Doudier, Pesmes
Rue de la Rezelle à Port-sur-Saône
six rue de Breulot
Rue de Négrot au numéro un
treize route du Rang Drogon, soixante-dix mille deux cents Saint-Germain
quatorze route d'Étuz, soixante-dix, cent quatre-vingt-dix, Boulot
trois impasse de la Combotte, soixante-dix, trois cent dix aux Fessey
Rue Romagny, soixante-dix mille deux cents Lure
Rue des Ballastières, soixante-dix, huit cents Saint-Loup-sur-Semouse
Rue d'Aillevillers, Fleurey-lès-Saint-Loup
Route du Maillebourg à Haut-du-Them-Château-Lambert
dix rue de Marast
Rue du Général de Mirbeck au numéro un
vingt-sept avenue du Plein Soleil, soixante-dix mille cent soixante-dix Port-sur-Saône
cinq rue du Creutot, soixante-dix, cent quatre-vingt-dix, Rioz
trois cent quatre les Rondey, soixante-dix, deux cent soixante-dix à Fresse
Rue de Vellemoz, soixante-dix mille sept cents Igny
Rue des Prés de la Baye, soixante-dix, deux cents Clairegoutte
Chemin des Grattery, Ternuay-Melay-et-Saint-Hilaire
Impasse des Maîtres de Forge à Haut-du-Them-Château-Lambert
neuf BIS rue de Montbozon
Rue Baron d'Huart Saint-Mauris au numéro six
vingt-trois BIS avenue Paul et André Lyautey, soixante-dix mille cent soixante-dix Port-sur-Saône
seize TER rue des Cloies, soixante-dix, deux cents, Lure
quatre A rue Aimé Drovin, soixante-dix, deux cents à Roye
Rue de Batailley, soixante-dix mille Pusy-et-Épenoux
Chemin de Cagnevoivre, soixante-dix, deux cent quatre-vingts Amage
Rue du Général Marcot, Vauvillers
Rue du Grand Grésil à Vesoul
huit impasse de la Chèvregoutte
Rue de la Neuvelle-les-Lure au numéro deux BIS
un quai Docteur Petitjean, soixante-dix mille Vesoul
trente-sept avenue Paul Morel, soixante-dix, zéro zéro zéro, Navenne
cent vingt-huit les Granges d'Amalix, soixante-dix, huit cents à Bouligney
Rue Les Grands Bois, soixante-dix mille deux cent soixante-dix Mélisey
Rue de La Belle Huguette, soixante-dix, cent dix Villersexel
Rue de la Herselle, Polaincourt-et-Clairefontaine
Route de Marloz à Cirey
trente-six rue de Remaucourt
Rue Derrière Le Château au numéro deux
quatorze route de Champagney, soixante-dix mille quatre cents Étobon
deux rue Adolphe Mischler, soixante-dix, cent trente, Fretigney-et-Velloreille
soixante et un BIS rue des Époux Blanchot, soixante-dix, cent à Rigny
Route de Luze, soixante-dix mille quatre cents Échenans-sous-Mont-Vaudois
Chemin des Champs Jobards, soixante-dix, cent cinquante Étuz
Rue des Ombergeons, Lantenot
Voye de Rupt à Scey-sur-Saône-et-Saint-Albin
quinze le Damont
Route de Bonnevent au numéro dix
quinze rue de la Lotière, soixante-dix mille cent quatre-vingt-dix Chaux-la-Lotière
cinq rue d'Evette, soixante-dix, quatre cents, Frahier-et-Chatebier
un impasse Jacques Lamboley, soixante-dix, deux cents à Magny-Vernois
Rue Pré Gaby, soixante-dix mille quatre cents Saulnot
Rue des Neuves Granges, soixante-dix, cent quatre-vingt-dix Chambornay-lès-Bellevaux
Rue de la Neuvelle, Chenebier
Rue du Montciel à Coulevon
trente-trois BIS rue Gisèle Decamps-Laheurte
Rue Corne d'Amont au numéro dix-neuf
vingt-quatre rue de Coulances, soixante-dix mille cent quarante Pesmes
trois chemin du Ballon, soixante-dix, deux cent quatre-vingt-dix, Champagney
quarante et un avenue de Saint-Valbert, soixante-dix, quatre cents à Héricourt
Rue Louis Labarbe, soixante-dix mille deux cents Magny-Vernois
Rue Voisard, soixante-dix, zéro zéro zéro Vesoul
Rue Sous l'Étang, La Neuvelle-lès-Lure
Rue de Pusy à Pusey
deux chemin des Fontaines Belon
Rue du Docteur Bertrand au numéro huit
deux cent trente et un BIS champs Les Chevaux, soixante-dix mille deux cent soixante-dix Fresse
deux rue de la Benade, soixante-dix, quatre cents, Châlonvillars
vingt-neuf rue Émile Grandjean, soixante-dix, deux cent quatre-vingts à Breuchotte
Rue du Gros Galu, soixante-dix mille deux cent quarante Saulx
La Mue Renard, soixante-dix, deux cent soixante-dix La Lanterne-et-les-Armonts
Place Pierre Renet, Vesoul
Chemin du Bauchet à Saint-Sulpice
trois cent quatre-vingt-cinq le Montvilley
Rue de Gémonval au numéro dix
quatre hameau de la Rouchotte, soixante-dix mille deux cent trente Thieffrans
dix-neuf rue d'Athesans, soixante-dix, deux cents, La Vergenne
soixante-sept les Chavannes, soixante-dix, deux cent vingt à Fougerolles
Rue du Beuveroux, soixante-dix mille deux cent quatre-vingt-dix Champagney
Rue du Hameau du Voie, soixante-dix, quatre cents Chavanne
Rue du Val des Charmes, Pusy-et-Épenoux
Rue du Creux Savoyard à Lure
treize rue de la Craillère
Rue derrière chez Martin au numéro deux
quinze rue des Beuges, soixante-dix mille quatre cents Verlans
douze rue du Durgeon, soixante-dix, zéro zéro zéro, Vaivre-et-Montoille
trois rue de la Fontaine à Roue, soixante-dix, quatre cents à Saulnot
Rue de la Combe Sectia, soixante-dix mille Quincey
Rue de la Fontaine du Card, soixante-dix, huit cents Ainvelle
Chemin du Bourbier, Vouhenans
Rue Gustave Courtois à Pusey
trois rue Jacques Viron
Rue Henri Baumont au numéro quatre
dix rue Sous La Roche, soixante-dix mille Frotey-lès-Vesoul
quatorze QUATER rue du Bouhay d'Amont, soixante-dix, deux cent quatre-vingts, Breuchotte
deux rue du Mont Chanois, soixante-dix, zéro zéro zéro à Pusey
Rue du Valère, soixante-dix mille cent quatre-vingt-dix Montarlot-lès-Rioz
Rue du Rejarret, soixante-dix, quatre cents Frahier-et-Chatebier
Rue de Saussenet, Échenoz-la-Méline
Rue de l'Esprit à Plancher-Bas
vingt-trois BIS rue des Fontaines Fleuries
Route de Saulcy au numéro treize
trois rue de Jonvelle, soixante-dix mille cinq cents Betaucourt
treize rue Vanoise, soixante-dix, cent quarante, Pesmes
cent dix-sept le Sarcenot, soixante-dix, deux cent vingt à Fougerolles
Rue Jean Bogé, soixante-dix mille cent soixante-dix Port-sur-Saône
Rue du Lotissement des Acacias, soixante-dix, deux cent dix Vauvillers
En Courbeton, La Lanterne-et-les-Armonts
Rue de Barra à Boulot
vingt-cinq rue de la Libération (alias Rue du vingt Novembre mille neuf cent quarante-quatre)
Chemin du Moulin de l'Étang au numéro trois
un rue du Croterot, soixante-dix mille sept cents Frasne-le-Château
vingt BIS avenue du Général Brosset, soixante-dix, deux cent quatre-vingt-dix, Champagney
sept rue de la Bruyere, soixante-dix, cent cinquante à Étuz
Chemin du Moulin des Oiseaux, soixante-dix mille deux cent soixante-dix Saint-Barthélemy
Rue de Barboilloz, soixante-dix, zéro zéro zéro Vesoul
Route de Magny-Danigon, La Côte
Rue Eugène Maillot à Ainvelle
deux rue Robert Dépoulain
Impasse de la Noue Aubain au numéro huit
douze rue Moïse Lévy, soixante-dix mille cent Gray
six rue Cité Grand Pré, soixante-dix, deux cent quatre-vingts, Breuchotte
quarante-six rue Leopold Senghor, soixante-dix, deux cent quatre-vingt-dix à Champagney
Rue de la Charrière du Magny, soixante-dix mille cent soixante-dix Port-sur-Saône
Rue des Piquets, soixante-dix, cent dix Esprels
Rue du Lieutenant Colonel Boigey, Raddon-et-Chapendu
Rue de Bouhans à Nantilly
deux au Paquey
Rue Marcel Peltier au numéro cinquante-sept
huit rue de la Chevrette, soixante-dix mille quatre cents Brevilliers
sept rue Derrière Le Mottet, soixante-dix, zéro zéro zéro, Colombe-lès-Vesoul
vingt-deux les Demoiselles, soixante-dix, cent à Velet
Rue du Haut Bourey, soixante-dix mille trois cents Luxeuil-les-Bains
Impasse Bourelot, soixante-dix, sept cents Gy
Rue de Germigney, Le Tremblois
Rue de la Houillère à Champagney
seize avenue du Mont Vaudois
Impasse du Cournot au numéro cinq
sept rue de Remondans, soixante-dix mille cent dix Beveuge
un rue Louis Paquet, soixante-dix, zéro zéro zéro, Vesoul
douze chemin de la Noire Terre, soixante-dix, deux cent quatre-vingts à Amage
Grande Rue du Bourg, soixante-dix mille trois cent soixante Scey-sur-Saône-et-Saint-Albin
Rue du Dreilly, soixante-dix, trois cent vingt Aillevillers-et-Lyaumont
Rue Nicolas Perrenot, Grandvelle-et-le-Perrenot
Les Jovis à Fresse
trois rue de Grappigney
Route d'Anchenoncourt au numéro quatre
huit rue du Quarre, soixante-dix mille Mailley-et-Chazelot
quatre lotissement de la Croix-Charles, soixante-dix, sept cents, Bucey-lès-Gy
six le Raddon, soixante-dix, deux cent soixante-dix à Belonchamp
Rue Marcel Durry, soixante-dix mille quatre cents Tavey
Rue du Pont de la Balance, soixante-dix, trois cent soixante Scey-sur-Saône-et-Saint-Albin
Rue du Haut de la Faye, Lure
Rue d'Étobon à Belverne
deux chemin des Taconots
Le Petit Fahys au numéro cent cinq
trente rue des Martenots, soixante-dix mille deux cent quatre-vingt-dix Plancher-les-Mines
quatre-vingt-huit route de Ronchamp, soixante-dix, deux cent soixante-dix, Saint-Barthélemy
six BIS chemin d'Autrey, soixante-dix, cent à Arc-lès-Gray
Rue du Col de la Chevestraye, soixante-dix mille deux cent quatre-vingt-dix Plancher-Bas
Rue de Frotey, soixante-dix, zéro zéro zéro Montcey
Rue de Pontarcher, Vesoul
Impasse des Verjoulots à Vaivre-et-Montoille
neuf rue du Clos Barbey
Rue des Coires au numéro trois
cinq rue de la Côte Aux Verts, soixante-dix mille cent quatre-vingt-dix Maizières
deux rue de la Volle, soixante-dix, deux cents, La Côte
dix rue Françoise Beluche, soixante-dix, deux cents à Lure
Route de Greucourt, soixante-dix mille cent trente Saint-Gand
Route du Cordonnet, soixante-dix, sept cents Bonnevent-Velloreille
Rue de la Croix Partey, Saint-Loup-sur-Semouse
Rue de la Fontaine Aux Dames à Coisevaux
un rue Jean-Bernard Derosne
Rue Mastreich au numéro quatorze
huit rue de Chevret, soixante-dix mille quatre cents Couthenans
deux champs du Gravier, soixante-dix, deux cent soixante-dix, La Lanterne-et-les-Armonts
deux avenue des Frères Doillon, soixante-dix, zéro zéro zéro à Noidans-lès-Vesoul
Rue de Vellechevreux, soixante-dix mille cent dix Vellechevreux-et-Courbenans
Route de Lantenot, soixante-dix, deux cents Saint-Germain
Rue Henry Marsot, Lure
Rue des Prés Bergeon à Comberjon
trente et un rue de Cita
Rue Louis Renard au numéro vingt et un
deux rue Guyon Joly, soixante-dix mille huit cents Saint-Loup-sur-Semouse
six BIS chemin du Bourcet, soixante-dix, deux cent soixante-dix, Saint-Barthélemy
neuf chemin du Camus, soixante-dix, deux cent soixante-dix à Belonchamp
Rue de Rousseau, soixante-dix mille cent quatre-vingt-dix Fondremand
Route de Montessaux, soixante-dix, deux cent soixante-dix Saint-Barthélemy
Rue du Pré aux Vernes, Villersexel
Rue de Pont du Bois à Selles
un rue Jean Poirey
Chemin du Fleuriot au numéro vingt et un
huit rue du Grand Biloirey, soixante-dix mille deux cents Frotey-lès-Lure
dix-sept rue Jeoffroy, soixante-dix, deux cent dix, Passavant-la-Rochère
cent soixante-dix-sept rue François Grammont, soixante-dix, cent dix à Villersexel
Lotissement de la Reingue, soixante-dix mille Rosey
GR GDE RUE, soixante-dix, cent soixante-dix Vauchoux
Rue Pierre Paul Prudhon, Gray
Pré Francais à Velleminfroy
deux rue de Cugney
Lotissement des Murgers au numéro neuf
cinq rue d'Échenoz, soixante-dix mille Vellefaux
douze rue de Maussans, soixante-dix, deux cent trente, Besnans
treize rue Louis Jobard, soixante-dix, cent à Gray
Rue de Poussot, soixante-dix mille quatre cents Belverne
Rue Georges Cholley, soixante-dix, trois cent vingt La Vaivre
Rue Champ Catorin, Saint-Valbert
Chemin de la Demie à Quincey
vingt-sept rue de la Curtenay
Rue Nicolas Lalouette au numéro trois
un la Chatte, soixante-dix mille sept cents Sainte-Reine
douze rue Georges Marconnet, soixante-dix, quatre cents, Héricourt
un les Corvelles, soixante-dix, cent quatre-vingts à Autet
Rue Antoine Boisson, soixante-dix mille deux cents Lure
Résidence du Chanois, soixante-dix, trois cent soixante Scey-sur-Saône-et-Saint-Albin
Rue du Granvau, Choye
Rue des Boiges à Rigny
trente-sept rue du Rapois
Rue de Courte Royes au numéro un
vingt-cinq rue de Vellefaux, soixante-dix mille Vallerois-Lorioz
quarante-cinq avenue Christiane Jansen, soixante-dix, huit cents, Saint-Loup-sur-Semouse
trente-quatre C rue du Chêne Sainte-Anne, soixante-dix, deux cents à Magny-Vernois
Rue Simon Gauthiot, soixante-dix mille cent Ancier
Rue Georges Genoux, soixante-dix, zéro zéro zéro Vesoul
Rue Jospeh Bavoux, Saint-Remy
Rue de Frétigney aux Bâties
cinq voie de Jobert
Rue Augustin Cournot au numéro quatre BIS
dix rue de la Fontaine Saint-Desle, soixante-dix mille cent dix Esprels
trente-trois rue Charles Frechin, soixante-dix, deux cents, Lure
trois rue Pierre Pezet, soixante-dix, cent à Arc-lès-Gray
Rue de la Cressotte, soixante-dix mille deux cent quatre-vingt-dix Plancher-les-Mines
Rue de la Proiselière, soixante-dix, trois cent dix Sainte-Marie-en-Chanois
Route des Malbuissons, Velleclaire
Rue Sur Tremue à Colombe-lès-Vesoul
deux cent trente-neuf le Feu du Court
Rue Gérome au numéro trente-cinq
vingt-neuf rue d'Eboulet, soixante-dix mille deux cent cinquante Ronchamp
dix-huit rue du Quinze Deux, soixante-dix, trois cents, Luxeuil-les-Bains
sept rue du Card, soixante-dix, cent quatre-vingt-dix à Rioz
Boulevard de Franche-Comté, soixante-dix mille deux cents Lure
Chemin des Goûttes, soixante-dix, deux cent cinquante Ronchamp
Rue des Coeurdassier, Passavant-la-Rochère
Impasse du Roui au Pont-de-Planches
trente rue Voie de Saint-Georges
Route de Mignafans au numéro trois
quatre rue de Solborde, soixante-dix mille Échenoz-la-Méline
trois esplanade Charles de Gaulle, soixante-dix, deux cents, Lure
dix rue de l'Étançon, soixante-dix, deux cent cinquante à Ronchamp
Rue des Monts Deron, soixante-dix mille deux cent cinquante Ronchamp
Rue Marcel Rozard, soixante-dix, zéro zéro zéro Frotey-lès-Vesoul
Rue de Fanican, Villeparois
Chemin du Bois de Question à Saint-Germain
deux BIS rue de la Voie Aux Combats
Rue des Gleux au numéro huit
cinq B rue de Dournon, soixante-dix mille cent quatre-vingt-dix Rioz
quatre cent seize la Chevestraye, soixante-dix, deux cent soixante-dix, Fresse
huit rue Robert Roy, soixante-dix, cent soixante-dix à Port-sur-Saône
Place du Charton, soixante-dix mille deux cent vingt Fougerolles
Rue des Echuttes, soixante-dix, huit cents Plainemont
Rue du Champs du Bois, Faymont
Granges Grillot à Fontenois-la-Ville
un rue de Général Bouchez
Route d'Igny au numéro dix
deux rue de l'Aspirant Edmont Drouot, soixante-dix mille cent Gray
quatorze hameau d'Augrogne, soixante-dix, huit cents, Saint-Loup-sur-Semouse
douze rue du Grand Chanois, soixante-dix, zéro zéro zéro à Vesoul
Avenue Michel Leroy, soixante-dix mille huit cents Saint-Loup-sur-Semouse
Rue de Neurey, soixante-dix, deux cent quarante Vilory
Rue des Cités Dolfus, Héricourt
Rue Eugène Furxer à Lure
soixante-trois faubourg des Perrières
Rue Jeannot Lamboley au numéro douze
trois chemin des Champs de la Pierre, soixante-dix mille deux cent quatre-vingts Amage
sept route de They, soixante-dix, cent quatre-vingt-dix, Sorans-lès-Breurey
neuf rue du Champ de Fleurey, soixante-dix, huit cents à Bouligney
Rue des Comballes, soixante-dix mille quatre cents Couthenans
Rue du Bas de Laval, soixante-dix, deux cent vingt Fougerolles
Rue Nicolas Bourgogne, Montdoré
Rue de la Reculée à Roye
onze les Champs Fourguenons
Rue Prés de la Chaux au numéro cinq
quinze avenue Durgeon, soixante-dix mille Vesoul
sept rue Ernest Faivre, soixante-dix, cent, Arc-lès-Gray
quatre rue de Lieucourt, soixante-dix, cent au Tremblois
Rue du seize Juillet, soixante-dix mille Montigny-lès-Vesoul
Chemin de la Croix de Valay, soixante-dix, cent quarante Pesmes
Chemin Chicherit, Champagney
Rue du Square de la Gare à Lure
deux rue du Bois du Bruleux
Rue des Marcelles au numéro trois
quatre impasse du Banc, soixante-dix mille deux cents Lantenot
quatre rue du quatorze Septembre mille neuf cent quarante-quatre, soixante-dix, cent dix, Aillevans
deux rue des Champs Corneillers, soixante-dix, quatre cents à Tavey
Rue Hugot, soixante-dix mille trois cent soixante Scey-sur-Saône-et-Saint-Albin
Rue du Beuchot, soixante-dix, huit cents Hautevelle
Chemin de Sainte-Reine, Fresne-Saint-Mamès
Voie du Cru à Quincey
huit rue de l'Étang de la Poche
Rue de Colombe au numéro huit
un BIS rue de la Respe, soixante-dix mille quatre cents Mandrevillars
deux charrière Fortier, soixante-dix, huit cents, Jasney
cinquante-deux rue Jules Jeanneney, soixante-dix, trois cents à Luxeuil-les-Bains
La Pessa, soixante-dix mille deux cent soixante-dix Fresse
Le Neuf Étang, soixante-dix, deux cent soixante-dix La Lanterne-et-les-Armonts
Rue Charrière des Grands Murs, Vesoul
Rue de la Poirouse à Aillevillers-et-Lyaumont
un rue de l'Eglise Sainte-Catherine
Avenue Claude Peureux au numéro cinquante-six
huit impasse Rougelot, soixante-dix mille Vellefaux
sept route de Moffans, soixante-dix, deux cents, Frotey-lès-Lure
neuf les Rotevins, soixante-dix, zéro zéro zéro à Échenoz-la-Méline
Rue des Piffeaux, soixante-dix mille quatre cents Héricourt
Chemin du Thioulots, soixante-dix, cent quatre-vingt-dix Boult
Rue du Bois Battu, Chenebier
Impasse Le Moulin à Corravillers
dix route de Boult
Rue de la Grappière au numéro neuf
seize route des Aynans, soixante-dix mille cent dix Gouhenans
treize résidence des Érables, soixante-dix, deux cent soixante-dix, Mélisey
un rue Alphonse Odeph, soixante-dix, trois cents à Luxeuil-les-Bains
Chemin de Neuvallée, soixante-dix mille deux cent quarante Châtenois
Rue des Champs Meilley, soixante-dix, deux cents Saint-Germain
Place du Petit Magny, Betaucourt
Impasse des Mouillets à Pesmes
vingt-six route de Port-sur-Saône
Rue des Champs Flagy au numéro neuf
deux cent quatre-vingt-dix-sept BIS les Potets, soixante-dix mille deux cent soixante-dix Fresse
quatorze le Peu d'Aquet, soixante-dix, deux cent dix, Pont-du-Bois
deux vieux Chemin de Frédéric Fontaine, soixante-dix, deux cents à Clairegoutte
Rue Mequillet, soixante-dix mille quatre cents Héricourt
Rue Jardinot, soixante-dix, deux cent dix Selles
Rue du Pré au Loup, Champagney
Rue Les Ronçois à Velloreille-lès-Choye
dix-huit rue de Vallerois
Rue du Verdey au numéro trois
quatorze rue du vingt-sept Septembre mille neuf cent quarante-quatre, soixante-dix mille quatre cents Étobon
trois rue Cuclos, soixante-dix, cent soixante-dix, Port-sur-Saône
vingt-deux avenue des Patis, soixante-dix, trois cent soixante à Scey-sur-Saône-et-Saint-Albin
Impasse Saint-Quentin, soixante-dix mille deux cents Lure
Rue du Docteur Pavillard, soixante-dix, quatre cents Héricourt
Rue de Bains, Fleurey-lès-Saint-Loup
Chemin du Vanney à Couthenans
dix-sept rue du Narbier
Rue des Champs Pey au numéro sept
cinq rue Bouveret-Vergnaud, soixante-dix mille Pusey
vingt et un rue de Bourgagotte, soixante-dix, quatre cent quarante, Servance
quatre allée des Roches Mauban, soixante-dix, zéro zéro zéro à Échenoz-la-Méline
Rue du Mont Prévoir, soixante-dix mille Pusy-et-Épenoux
Rue Au Dessus de Champdamoy, soixante-dix, zéro zéro zéro Quincey
Rue de la Ronde Vaivre, Fleurey-lès-Saint-Loup
Rue de Senargent à Mignavillers
deux quai de la Reigne
Impasse des Corneillers au numéro cinq
deux le Vignot, soixante-dix mille Vaivre-et-Montoille
huit rue Édouard Magot, soixante-dix, zéro zéro zéro, Vesoul
quinze rue Paul Vinot, soixante-dix, quatre cents à Héricourt
Rue des Saussottes, soixante-dix mille trois cent soixante Pontcey
Rue du Colonel Paul-René Machin, soixante-dix, deux cents Lure
Rue du Bois du Tilleul, Quincey
Rue des Dandeligeons à Vyans-le-Val
neuf chemin des Viaux
Chemin Revers des Planches au numéro quatorze
neuf rue Sous Le Château, soixante-dix mille Vaivre-et-Montoille
quarante-cinq rue de la Morette, soixante-dix, quatre cents, Luze
un chemin des Prés Chaon, soixante-dix, deux cent soixante-dix à Saint-Barthélemy
Rue Émile Morin, soixante-dix mille Navenne
Rue du Sous Lieutenant Raphenne, soixante-dix, quatre cents Tavey
Rue du Parc de la Paule, Échenoz-la-Méline
Rue Georges Bonvalot à Noidans-lès-Vesoul
quatre place Dieu
La Ramouse au numéro trente-huit
six rue des Carrières de Saint-Valbert, soixante-dix mille quatre cents Héricourt
sept rue de Moffans, soixante-dix, deux cents, La Vergenne
onze rue des Mortes Pierres, soixante-dix, zéro zéro zéro à Vesoul
Rue des Égalités, soixante-dix mille quatre cents Héricourt
Rue En Goutillant, soixante-dix, quatre cents Échenans-sous-Mont-Vaudois
Faubourg de Montbéliard, Héricourt
Rue de Nozeron à Flagy
huit rue du Moulin de Champdamoy
Avenue Carlos Dorget au numéro quatre
vingt-sept avenue du Mortard, soixante-dix mille deux cents Lure
trente et un rue Les Grandes Parts, soixante-dix, deux cent soixante-dix, Belmont
quatre rue Jean-Charles Berne, soixante-dix, deux cents à Palante
Lotissement en Rougeux, soixante-dix mille deux cent dix Anchenoncourt-et-Chazel
Le Bas, soixante-dix, deux cent soixante-dix Fresse
Rue d'Aroz, Raze
Rue Grosjean à Vesoul
onze rue de la Cornée
Rue des Moissonnières au numéro quatre
