Rue des Espradets, Le Monastier-Pin-Moriès
Chemin de Baume Brune à Florac
cinq rue de la Butte aux Oiseaux
Impasse de la Métallurgie au numéro trois
quatre impasse Paillette, quarante-huit mille cent Le Monastier-Pin-Moriès
six mille trois cent soixante place Jules Laget, quarante-huit, trois cent vingt, Ispagnac
six mille cent vingt-sept rue Laurent Monestier, quarante-huit, cinq cents à Banassac
Rue des Prés Claux, quarante-huit mille cent trente Aumont-Aubrac
Passage de la Côte, quarante-huit, zéro zéro zéro Badaroux
Rue de la Petite Roubeyrolle, Mende
Chemin de la Rancareda à Fraissinet-de-Lozère
six mille vingt-deux rue de l'Ayrette
Résidence Castelsec au numéro quatre
huit mille F lou Colsio, quarante-huit mille cent Montrodat
six mille deux cent vingt-cinq chon Del Couderet, quarante-huit, six cents, Grandrieu
dix-huit passage du Temple, quarante-huit, quatre cents à Florac
Rue du Pont de Mars, quarante-huit mille cent cinquante Meyrueis
Rue du Moulin de Baffie, quarante-huit, cent vingt Saint-Alban-sur-Limagnole
Route de Ginestoux, Chirac
Le Vignas à La Canourgue
un volte de Gevennes
Promenade de l'Oultre au numéro six mille trois cent trente et un
trente-six lotissement Les Églantiers, quarante-huit mille Mende
huit mille la Croux de la Gleize, quarante-huit, trois cents, Fontanes
quatre quartier Le Serre, quarante-huit, deux cent vingt à Fraissinet-de-Lozère
Chemin de la Dralha, quarante-huit mille deux cent vingt Fraissinet-de-Lozère
Impasse de la Courtasse, quarante-huit, deux cent dix Sainte-Enimie
Rue Cyprien Pepin, Mende
Route des Gites à Vialas
trois rue Marthe Dupeyron
Rue de la Honde au numéro un
seize valat de Chaze, quarante-huit mille cent Marvejols
un rue Chalier Hugonnet, quarante-huit, zéro zéro zéro, Mende
onze impasse de Vachery, quarante-huit, zéro zéro zéro à Mende
Chemin du Coustel, quarante-huit mille deux cent dix Les Vignes
L'Esplanade, quarante-huit, cent Marvejols
Place des Moines, Langogne
Impasse René-Descartes à Mende
un rue Traversière du Chastel
Impasse de la Fouon au numéro quatre
six mille trois cent dix-neuf chemin du Champ Grand, quarante-huit mille Chastel-Nouvel
trois rue Achille Foulquier, quarante-huit, deux cent dix, Les Vignes
six mille quatre route de Langogne, quarante-huit, six cents à Grandrieu
Place de l'Ayrette, quarante-huit mille trois cent vingt Ispagnac
Voie Communale Quartier du Sabot, quarante-huit, trois cent vingt Ispagnac
Chemin de la Bugada, Fraissinet-de-Lozère
Chemin du Bois de Romieu à Saint-Chély-d'Apcher
six mille cent quatre-vingt-dix chemin du Cagnard
Rue de la Paillade au numéro un
un hameau du Ménial, quarante-huit mille deux cent dix Les Vignes
un chemin Del Champ Ferier, quarante-huit, deux cent vingt, Fraissinet-de-Lozère
quatre impasse de la Fournière, quarante-huit, zéro zéro zéro à Badaroux
Place Jean Séquier, quarante-huit mille cent cinquante Meyrueis
Lotissement des Hautes Vignes, quarante-huit, cent soixante Le Collet-de-Dèze
Impasse du Fourniols, Florac
Quai Moreau à Bagnols-les-Bains
six mille quatre cent vingt-cinq lotissement l'Esperounado
Lotissement Ganigal Bas au numéro six mille trois cent quarante-trois
un traverse Rochevallier, quarante-huit mille cent Marvejols
neuf rue Amédée Monteil, quarante-huit, zéro zéro zéro, Mende
un impasse de la Pinatelle, quarante-huit, cent au Monastier-Pin-Moriès
Place du Caire, quarante-huit mille cent cinquante Meyrueis
Route de Laval Atger, quarante-huit, six cents Grandrieu
Chemin du Galastre, Le Malzieu-Ville
Chemin du Pradou à Langogne
six mille trois cent soixante-treize quartier des Prairies
Lotissement Pantel au numéro deux
six mille trois cent trente-trois rue du Camard, quarante-huit mille trois cent vingt Ispagnac
deux avenue Michel Gillibert, quarante-huit, quatre cents, Florac
trois BIS impasse de Brassac, quarante-huit, cent à Marvejols
Le Castel de la Peyre, quarante-huit mille deux cent dix Les Vignes
La Canourgue, quarante-huit, cinq cents La Canourgue
Impasse de Genêts, Badaroux
Chemin des Billières à Saint-Chély-d'Apcher
six mille trois cent cinquante-cinq rue de Molines
Impasse du Gargamelou au numéro onze
six mille cinq cent deux rue du Colonel Crespin, quarante-huit mille cent Chirac
six mille cinq cent soixante et un traverse des Prisonniers, quarante-huit, cent, Chirac
six mille six cent soixante-cinq chemin de Billières, quarante-huit, cinq cents à La Canourgue
Chemin de l'Ayrette, quarante-huit mille Badaroux
Impasse Duganat, quarante-huit, cent Marvejols
Traverse des Mulets, Mende
Lou Pasturaou à Grandrieu
vingt-cinq voie Communale Anc. Moulin de la Gratuse
Voie Communale La Grange au numéro deux A
six mille six cent trente passerelle Alamel Flattet, quarante-huit mille cent Chirac
un passage du dix-neuf Mars mille neuf cent soixante-deux, quarante-huit, zéro zéro zéro, Barjac
six mille trois cent trente-sept lotissement Osty, quarante-huit, cent quarante au Malzieu-Ville
Chon de Capet, quarante-huit mille six cents Grandrieu
Chemin des Berges du Lot, quarante-huit, zéro zéro zéro Mende
Impasse de Bastide, Marvejols
Passage du Pradou aux Vignes
six mille deux cent sept avenue Pierre Rousset
Labade au numéro huit mille
six impasse Dubois, quarante-huit mille trois cents Langogne
quatre rue Goulagiou, quarante-huit, cent quatre-vingt-dix, Le Bleymard
six mille sept cent quatre-vingt-dix-sept les Bruguières, quarante-huit, cinq cents à La Canourgue